currency	tweet	username	favorites	retweets	date	id	permalink	geo	hashtags	mentions	lex_sent	vader_sent	cnn_sent	cnn_pos_neg
bitcoin 	Join me and dozens of others to learn about Bitcoin Unlimited and scaling at the @ BitcoinHK Meetup tonight. http://meetu.ps/e/Cdtk6/1ZZTk/a pic.twitter.com/QJzV5Gs525	rogerkver	63	33	1480297826	803053404167737344	https://twitter.com/rogerkver/status/803053404167737344			@	0.10	0.148	0.9901150981719703	1.0
bitcoin 	Bitcoiners, stop the damn infighting. Activate SegWit, then HF to 2x that block size, and start focusing on the real battles ahead. # bitcoin	ErikVoorhees	403	187	1480372531	803366740654747648	https://twitter.com/ErikVoorhees/status/803366740654747648		#		0.12	-0.4233	0.9901150981719703	1.0
bitcoin 	The Secret, Dangerous World of Venezuelan Bitcoin Mining //reason.com/archives/2016/11/28/the-secret-dangerous-world-of via @ reason	ErikVoorhees	12	7	1480366966	803343400787410944	https://twitter.com/ErikVoorhees/status/803343400787410944			@	0.08	-0.4767	0.9901150981719703	1.0
bitcoin 	Indian Bitcoin Exchange Unocoin Releases Mobile Wallet for iOS and Android http://bit.ly/2gzmmVG  via @ CoinDesk	ErikVoorhees	28	16	1480364836	803334467528040452	https://twitter.com/ErikVoorhees/status/803334467528040452			@	0.07	0.0	0.9901150981719703	1.0
bitcoin 	"""The blockchain file is getting rather large, ~500MB. Is there a way to trim it?"" # Bitcoin #2012http://ow.ly/aXum306Bpfu"	TuurDemeester	11	13	1480363904	803330556956200960	https://twitter.com/TuurDemeester/status/803330556956200960		# #2012http		0.22	0.0	0.9901150981719703	1.0
bitcoin 	TIL Indian Bitcoin exchange @ zebpay grew to 150k users in one year, added another 50k users in the past month.http://ow.ly/IcUD306BkZN	TuurDemeester	47	28	1480362166	803323266358185985	https://twitter.com/TuurDemeester/status/803323266358185985			@	0.00	0.0	0.9901150981719703	1.0
bitcoin 	I originally saw it as a hedge against a particular Bitcoin panic, now it's just an altcoin with a reasonable amount of liquidity.	TuurDemeester	0	0	1480310209	803105342259240961	https://twitter.com/TuurDemeester/status/803105342259240961				0.00	-0.5106	0.9901150981719703	1.0
bitcoin 	...costing you millions per day in a hugely embarrassing cyber-attack, and offer to make your trouble go away for $70k in bitcoin?	TuurDemeester	11	4	1480301146	803067332322938882	https://twitter.com/TuurDemeester/status/803067332322938882				0.18	-0.6801	0.9901150981719703	1.0
bitcoin 	When I sell an altcoin, it's always for Bitcoin.	TuurDemeester	1	2	1480294401	803039037938286592	https://twitter.com/TuurDemeester/status/803039037938286592				0.11	0.0	0.9901150981719703	1.0
bitcoin 	https://www.docdroid.net/2qjyYlp/transcript-bitcoin-quarterly-update-call-needham-co-november-2016.pdf.html …	TuurDemeester	0	0	1480291009	803024814168383488	https://twitter.com/TuurDemeester/status/803024814168383488				0.00	0.0	0.9998495436060691	-1.0
bitcoin 	Xapo processes 500,000 bitcoin off-chain Bitcoin tx per day: low fees, quick interaction, immediate confirmation.	TuurDemeester	1	0	1480290821	803024024301236224	https://twitter.com/TuurDemeester/status/803024024301236224				0.13	0.1027	0.9998495436060691	-1.0
bitcoin 	"Here's 2011: - Gox or Stamp? - alpaca socks for bitcoin! - ""how do I print this paper wallet""? - Yay Silk Road"	TuurDemeester	0	0	1480290233	803021556150472704	https://twitter.com/TuurDemeester/status/803021556150472704				0.22	0.1317	0.9998495436060691	-1.0
bitcoin 	Huh? Have you ever visited these pages?https://bitcoincore.org/en/releases/	TuurDemeester	0	0	1480289163	803017071223156736	https://twitter.com/TuurDemeester/status/803017071223156736				0.14	0.0	0.9998495436060691	-1.0
bitcoin 	Originally I held LTC as a hedge against Bitcoin, in case of a BTC panic. But I think that thesis is less valid nowadays.	TuurDemeester	0	0	1480288482	803014213048205312	https://twitter.com/TuurDemeester/status/803014213048205312				0.12	-0.2553	0.9998495436060691	-1.0
bitcoin litecoin 	To be fair, # Litecoin hasn't done that badly in USD. But I look at all altcoins in relation to Bitcoin, and that's where LTC is trailing.pic.twitter.com/xuaYa23Hw2	TuurDemeester	13	9	1480288375	803013765817987073	https://twitter.com/TuurDemeester/status/803013765817987073		#		0.11	0.2966	0.9998495436060691	-1.0
bitcoin 	"""It might make sense just to get some in case it catches on."" - Satoshi 1/17/09 # Bitcoin"	haydentiff	77	50	1480349941	803271992422100992	https://twitter.com/haydentiff/status/803271992422100992		#		0.33	0.0	0.9901150981719703	1.0
bitcoin 	118 coins plotted over time -> alt-coin performance getting worse over time # cryptocurrencies # bitcoin # fintech http://woobull.com/data-visualisation-118-coins-plotted-over-time-this-is-why-hodl-alt-coin-indexes-dont-work/ …pic.twitter.com/AqF5NNrLHD	sbmeunier	9	14	1480368633	803350390871851008	https://twitter.com/sbmeunier/status/803350390871851008		# # #		0.00	-0.4767	0.9901150981719703	1.0
bitcoin 	The Secret, Dangerous World of Venezuelan # Bitcoin Mining # fintech # blockchain http://reason.com/archives/2016/11/28/the-secret-dangerous-world-of …pic.twitter.com/tkepYOx6kO	sbmeunier	3	8	1480364710	803333935199645696	https://twitter.com/sbmeunier/status/803333935199645696		# # #		0.14	-0.4767	0.9901150981719703	1.0
bitcoin 	A Japanese Insurer is Developing a Policy to Cover # Bitcoin Exchanges # insurtech # fintech @ coindesk http://www.coindesk.com/major-insurer-policy-bitcoin-exchanges/ …pic.twitter.com/IWC8R1dbLV	sbmeunier	7	9	1480361420	803320138598641665	https://twitter.com/sbmeunier/status/803320138598641665		# # #	@	0.47	0.0	0.9901150981719703	1.0
bitcoin 	If # blockchain = tech, banning tech makes no sense If blockchain = # bitcoin, banning bitcoin makes no sense # fintechhttps://twitter.com/CryptoCoinsNews/status/803241827813957632 …	sbmeunier	2	9	1480348430	803265653293596673	https://twitter.com/sbmeunier/status/803265653293596673		# # #		0.23	-0.5267	0.9901150981719703	1.0
bitcoin 	does anyone else have a fondness for charts? if so, @ oocBlog is the place to get your # bitcoin charting fix.pic.twitter.com/VIFFJcZV8M	Melt_Dem	5	0	1480370972	803360203878100992	https://twitter.com/Melt_Dem/status/803360203878100992		#	@	0.32	0.2712	0.9901150981719703	1.0
bitcoin 	"""explaining blockchains without referencing Bitcoin = trying to describe language without referencing the alphabet""http://www.bankingexchange.com/news-feed/item/6573-which-is-the-weakest-link?Itemid=101 …"	Melt_Dem	23	2	1480370279	803357293702184960	https://twitter.com/Melt_Dem/status/803357293702184960				0.00	0.0	0.9901150981719703	1.0
bitcoin 	Hong Kong Politicians Accept Bitcoin to Fund Court Appeal https://news.bitcoin.com/hong-kong-politicians-accept-bitcoin-fund-court-appeal/ … via @ BTCTN	SimonDixonTwitt	6	5	1480327473	803177754682216448	https://twitter.com/SimonDixonTwitt/status/803177754682216448			@	0.23	0.3818	0.9901150981719703	1.0
bitcoin 	South Korea Steadily Becoming a Cryptocurrency and Fintech Hub - Aims to Regulate # Bitcoin in 2017https://news.bitcoin.com/korea-cryptocurrency-fintech-hub/ …	BitcoinByte	1	0	1480372093	803364905491513344	https://twitter.com/BitcoinByte/status/803364905491513344		#		0.18	0.0	0.9901150981719703	1.0
bitcoin 	Senegal To Introduce eCFA National Digital Currency # Bitcoinhttp://www.livebitcoinnews.com/senegal-introduce-ecfa-national-digital-currency-soon/ …	BitcoinByte	1	7	1480326796	803174914651996160	https://twitter.com/BitcoinByte/status/803174914651996160		#		0.33	0.0	0.9901150981719703	1.0
bitcoin 	# Senegal To Introduce A New # Blockchain -Based National # Digital # Currency—Second Such Currency in World # bitcoin https://www.google.co.uk/amp/www.iafrikan.com/2016/11/24/senegal-to-introduce-a-new-blockchain-based-national-digital-currency-making-it-only-the-second-country-to-have-a-national-digital-currency/amp/?client=safari …	BitcoinByte	2	0	1480326478	803173579110187008	https://twitter.com/BitcoinByte/status/803173579110187008		# # # # #		0.38	0.0	0.9901150981719703	1.0
bitcoin 	Joke heard at # RegHackTO by @ PaulWMullins - Why is the difficulty level in Bitcoin programming so high? - Because there is too much hash. :)	wmougayar	5	3	1480348888	803267572804239361	https://twitter.com/wmougayar/status/803267572804239361		#	@	0.30	0.1357	0.9901150981719703	1.0
bitcoin 	Fair :) Only # bitcoin field tests I see published are a one-tx cat picture, and routing (not tx) tests. Corrections welcome.	jgarzik	2	0	1480358997	803309974730510336	https://twitter.com/jgarzik/status/803309974730510336		#		-0.05	0.5537	0.9901150981719703	1.0
bitcoin 	# digital # anarchy # bitcoinhttp://www.telegraph.co.uk/technology/news/10881213/The-coming-digital-anarchy.html …	jgarzik	23	32	1480297751	803053091457236992	https://twitter.com/jgarzik/status/803053091457236992		# # #		0.83	0.0	0.9901150981719703	1.0
bitcoin 	Unocoin Launches Bitcoin App For iOS, Android http://www.news18.com/news/tech/unocoin-launches-bitcoin-app-for-ios-android-1316832.html … # IndiaBitcoinpic.twitter.com/4TSYRZWFNH	SunnyStartups	6	3	1480363620	803329364503003136	https://twitter.com/SunnyStartups/status/803329364503003136		#		0.20	0.0	0.9901150981719703	1.0
bitcoin 	Unocoin launches bitcoin app on iOS, Android platforms: http://www.business-standard.com/article/technology/unocoin-launches-bitcoin-app-on-ios-android-platforms-116112800264_1.html …pic.twitter.com/oV3tjO1LPu	SunnyStartups	2	2	1480356209	803298281803628544	https://twitter.com/SunnyStartups/status/803298281803628544				0.00	0.0	0.9901150981719703	1.0
bitcoin 	Unocoin Launches Bitcoin Mobile App on iOS and Android: https://www.unocoin.com/post/656 # IndiaBitcoinpic.twitter.com/xcrZUfZdhY	SunnyStartups	4	3	1480355475	803295204069425153	https://twitter.com/SunnyStartups/status/803295204069425153		#		0.00	0.0	0.9901150981719703	1.0
bitcoin 	Demonetization effect: Tech startup Unocoin launches mobile app to buy & sell Bitcoin on the gohttp://www.financialexpress.com/industry/technology/demonestisaion-effect-tech-startup-unicoin-launches-mobile-app-to-buy-sell-bitcoin-on-the-go/458263/ …	SunnyStartups	4	0	1480355311	803294515104649216	https://twitter.com/SunnyStartups/status/803294515104649216				-0.20	0.0	0.9901150981719703	1.0
bitcoin 	Bitcoin Exchange Unocoin Releases Mobile Wallet for iOS and Android - CoinDeskhttp://www.coindesk.com/bitcoin-exchange-unocoin-releases-mobile-wallet-ios-android/ …	SunnyStartups	2	0	1480345566	803253641247236097	https://twitter.com/SunnyStartups/status/803253641247236097				0.08	0.0	0.9901150981719703	1.0
bitcoin 	Announcement about @ Unocoin's iOS & Android mobile launch trending on reddit: https://www.reddit.com/r/Bitcoin/ # IndiaBitcoin	SunnyStartups	1	1	1480344739	803250174227316736	https://twitter.com/SunnyStartups/status/803250174227316736		#	@	0.27	0.0	0.9901150981719703	1.0
bitcoin 	Been waiting a long time for this day... # IndiaBitcoinhttps://twitter.com/Unocoin/status/803228666138390528 …	SunnyStartups	27	8	1480339642	803228793481687040	https://twitter.com/SunnyStartups/status/803228793481687040		#		0.30	0.0	0.9901150981719703	1.0
bitcoin 	Unocoin Launches Bitcoin Mobile App on iOS AND Android: https://www.unocoin.com/post/656	SunnyStartups	4	0	1480339611	803228664452313088	https://twitter.com/SunnyStartups/status/803228664452313088				-0.10	0.0	0.9901150981719703	1.0
bitcoin 	Full support to # EU Wait and See position on # blockchain https://news.bitcoin.com/europe-power-ban-blockchain/ … via @ BTCTN	PaoloTasca	0	0	1480326109	803172030803824640	https://twitter.com/PaoloTasca/status/803172030803824640		# #	@	0.19	0.4019	0.9901150981719703	1.0
bitcoin 	More thoughts on the costs and benefits of running a full node:http://www.coindesk.com/how-to-save-bitcoins-node-network-from-centralization/ …	lopp	0	1	1480373262	803369805189365761	https://twitter.com/lopp/status/803369805189365761				-0.08	0.3818	0.9901150981719703	1.0
bitcoin 	@ olivierjanss Why should users run full nodes? Doing so provides them w/a security model that has fewer assumptions:http://www.coindesk.com/bitcoins-security-model-deep-dive/ …	lopp	4	4	1480373196	803369529401286656	https://twitter.com/lopp/status/803369529401286656			@	0.16	0.17	0.9901150981719703	1.0
bitcoin 	Bitcoin Black Friday was a big deal the past 2 years, though notsomuch this year.	lopp	0	0	1480360854	803317765310386176	https://twitter.com/lopp/status/803317765310386176				-0.20	0.0	0.9901150981719703	1.0
bitcoin 	A breakdown of the transaction fee rates that were paid during the mempool backlog last week. https://www.bitcoinqueue.com/details/all.html …pic.twitter.com/BgKOvr9foo	lopp	19	12	1480359396	803311647796371457	https://twitter.com/lopp/status/803311647796371457				-0.24	0.0	0.9901150981719703	1.0
bitcoin 	All you have to do is browse the various Bitcoin forums to see the problems users face. High learning curve hinders adoption.	lopp	0	0	1480288272	803013331888050176	https://twitter.com/lopp/status/803013331888050176				0.32	-0.2009	0.9998495436060691	-1.0
bitcoin 	Bitcoin Pioneer Charlie Shrem Launches New Blockchain Venture http://www.digital.nyc/news/bitcoin-pioneer-charlie-shrem-launches-new-blockchain-venture … via @ AddThis	CharlieShrem	4	5	1480371937	803364249355567104	https://twitter.com/CharlieShrem/status/803364249355567104			@	-0.08	0.0	0.9901150981719703	1.0
bitcoin 	I # SegWit for # Bitcoin, but this is a sincere look into a miner's concerns about it & future scaling: http://arkinv.st/2gznJnA	cburniske	0	1	1480369202	803352777078571009	https://twitter.com/cburniske/status/803352777078571009		# #		0.27	0.5499	0.9901150981719703	1.0
bitcoin 	"@ nntaleb I'm reading Antifragile now, made me think: ""bitcoin may be the only antifragile currency in the world."" yeh/neh?"	cburniske	4	1	1480355365	803294743337824257	https://twitter.com/cburniske/status/803294743337824257			@	0.05	0.0	0.9901150981719703	1.0
bitcoin 	"+1: # bitcoin mining has already gone CPU, GPU to ASIC, & fallen down the node ladder. Rigs will last longer w/ more time 2 amortize ""setup""https://twitter.com/tuurdemeester/status/802971884081979392 …"	cburniske	9	2	1480294533	803039593041956864	https://twitter.com/cburniske/status/803039593041956864		#		0.33	-0.2292	0.9901150981719703	1.0
bitcoin 	"""...has also received heat [from R3]"" Two journalists told me this weekend they've been threatened by R3. :/ https://goldsilverbitcoin.com/r3-sends-cease-and-desist-to-peter-todd/ …"	peterktodd	45	32	1480325467	803169338220023808	https://twitter.com/peterktodd/status/803169338220023808				0.16	-0.3994	0.9901150981719703	1.0
bitcoin 	is your professional conclusion? or you are repeating something someone told you who is willing to risk existence of 2 # Bitcoin?	ToneVays	0	0	1480354046	803289209268277250	https://twitter.com/ToneVays/status/803289209268277250		#		0.23	-0.1366	0.9901150981719703	1.0
bitcoin ethereum 	Just another example of success in the latest # Ethereums development effort to HF ... # bitcoinpic.twitter.com/ZNdzme6dLB	ToneVays	18	11	1480340525	803232499602165760	https://twitter.com/ToneVays/status/803232499602165760		# #		0.12	0.5719	0.9901150981719703	1.0
