currency	tweet	username	favorites	retweets	date	id	permalink	geo	hashtags	mentions	lex_sent	vader_sent	cnn_sent	cnn_pos_neg
bitcoin 	P2P Bitcoin exchange is an exciting development. I expect centralized exchanges to compete on speed, service, and improved auditability.https://twitter.com/flix1/status/787313634380742659 …	TuurDemeester	28	42	1476567790	787408498980065280	https://twitter.com/TuurDemeester/status/787408498980065280				0.11	0.3235	0.9940107187320635	-1.0
bitcoin 	wait until we have bitcoin denominated bonds! :-)	TuurDemeester	2	0	1476552725	787345312381702144	https://twitter.com/TuurDemeester/status/787345312381702144				0.38	0.1591	0.9940107187320635	-1.0
bitcoin 	· @ TheBlueMatt's Scaling Bitcoin roundup is worth the read: http://ow.ly/5CmS305cEOR # TumbleBit # SegWit # BitcoinFungibility # HardFork	TuurDemeester	6	2	1476495292	787104423583576065	https://twitter.com/TuurDemeester/status/787104423583576065		# # # #	@	0.47	0.2263	0.9940107187320635	-1.0
bitcoin 	"John Ratcliff nails it with this comment on block size & scaling # Bitcoin: ""Let's not kill the goose with the golden eggs.""pic.twitter.com/36plCGEVXc"	TuurDemeester	146	81	1476494839	787102520304738304	https://twitter.com/TuurDemeester/status/787102520304738304		#		0.22	0.1057	0.9940107187320635	-1.0
bitcoin 	98% Bitcoin, 2% short ETH/BTC with stop loss at 0.028 btc.https://twitter.com/krakenfx/status/787009955228286976 …	TuurDemeester	22	4	1476484130	787057605176795136	https://twitter.com/TuurDemeester/status/787057605176795136				-0.09	-0.2712	0.9946270555089773	1.0
bitcoin 	5y survivors in Bitcoin dodged these bullets and more: - Bitcoinica - Butterfly Labs - Neo&Bee - MtGox - The Dao - Forgetting your password	TuurDemeester	99	31	1476483672	787055683191525377	https://twitter.com/TuurDemeester/status/787055683191525377				0.28	0.0	0.9946270555089773	1.0
bitcoin 	How will the bitcoin civil war end?	jimmysong	0	0	1476555549	787357157498892288	https://twitter.com/jimmysong/status/787357157498892288				0.57	-0.5994	0.9940107187320635	-1.0
bitcoin ethereum 	I'm waiting for an Ethereum hard fork that changes the scripting language to no longer be turing-complete # turningintobitcoin	jimmysong	33	15	1476487708	787072611280756736	https://twitter.com/jimmysong/status/787072611280756736		#		-0.05	-0.3818	0.9946270555089773	1.0
bitcoin 	# bitcoin - we've made it!https://twitter.com/biellacoleman/status/786987829020753920 …	Melt_Dem	15	1	1476489849	787081593756065792	https://twitter.com/Melt_Dem/status/787081593756065792		#		0.17	0.0	0.9940107187320635	-1.0
bitcoin 	Kim wants Bitcoin to go mainstream. He has not said anything else.	SimonDixonTwitt	0	0	1476495442	787105052645130240	https://twitter.com/SimonDixonTwitt/status/787105052645130240				0.08	0.0	0.9940107187320635	-1.0
bitcoin 	see this (http://hackingdistributed.com/2015/10/14/bitcoin-ng/ …) as well as byzcoin	el33th4xor	2	2	1476555649	787357576342142977	https://twitter.com/el33th4xor/status/787357576342142977				0.14	0.2732	0.9940107187320635	-1.0
bitcoin 	One sane Bitfinex customer out there had the good sense to complain about the theft and subsequent shenanigans.https://thehackernews.com/2016/10/bitcoin-hacked.html …	el33th4xor	12	4	1476551582	787340520670593024	https://twitter.com/el33th4xor/status/787340520670593024				-0.11	0.0513	0.9940107187320635	-1.0
bitcoin 	"""Why Bitcoin isn't a Ponzi."" http://cryptohustle.com/why-bitcoin-isnt-a-ponzi-scheme … /cc @ JorgeStolfi"	el33th4xor	16	5	1476536759	787278347449405440	https://twitter.com/el33th4xor/status/787278347449405440			@	0.11	0.0	0.9940107187320635	-1.0
bitcoin 	The DAO wasn't a bullet aimed at Bitcoin.	el33th4xor	4	0	1476490211	787083108684173316	https://twitter.com/el33th4xor/status/787083108684173316				-0.12	0.0	0.9940107187320635	-1.0
bitcoin 	I have nothing to report on # Bitcoin it's become a boring currency. Seems to struggle to catch on due to crime.	GerberKawasaki	0	0	1476551094	787338472029876225	https://twitter.com/GerberKawasaki/status/787338472029876225		#		-0.36	-0.5092	0.9940107187320635	-1.0
bitcoin 	By no means did I suggest anyone put money into it. I follow it and have a very small amount. # bitcoin	GerberKawasaki	1	1	1476485158	787061917563125764	https://twitter.com/GerberKawasaki/status/787061917563125764		#		-0.36	-0.0987	0.9946270555089773	1.0
bitcoin 	Because it went up? It's been so stable acting like a real currency for months. # BTC # Bitcoin	GerberKawasaki	7	1	1476483004	787052884064145408	https://twitter.com/GerberKawasaki/status/787052884064145408		# #		-0.11	0.2279	0.9946270555089773	1.0
bitcoin 	i.e., not Bitcoin	dgwbirch	2	0	1476525171	787229741875027969	https://twitter.com/dgwbirch/status/787229741875027969				0.00	0.0	0.9940107187320635	-1.0
bitcoin ethereum 	Watch episodes of Trust Disrupted: # Bitcoin and the # Blockchain (+ # ethereum)https://techcrunch.com/2016/10/15/watch-all-six-episodes-of-our-series-trust-disrupted-bitcoin-and-the-blockchain/ …	AntonioSelas	2	3	1476552124	787342792951496704	https://twitter.com/AntonioSelas/status/787342792951496704		# # #		0.29	0.5106	0.9940107187320635	-1.0
bitcoin 	Not true. A multi-hop HTLC payment channel network can work securely with just CLTV/CSV. SegWit enhances Lightning/HTLCs, for sure. # bitcoinhttps://twitter.com/taoeffect/status/786613252818018304 …	jgarzik	11	10	1476485454	787063159626412032	https://twitter.com/jgarzik/status/787063159626412032		#		0.10	0.2699	0.9946270555089773	1.0
bitcoin 	Agreed, and I mentioned a number of potential solutions to that on the mailing list: https://lists.linuxfoundation.org/pipermail/bitcoin-dev/2016-October/013211.html …	peterktodd	4	0	1476531287	787255397690343426	https://twitter.com/peterktodd/status/787255397690343426				0.12	0.4767	0.9940107187320635	-1.0
