currency	tweet	username	favorites	retweets	date	id	permalink	geo	hashtags	mentions	lex_sent	vader_sent	cnn_sent	cnn_pos_neg
bitcoin ripple 	Basic product management : Don't kill or cripple version 1 in favor of an as-yet-unreleased version 2. # Bitcoinpic.twitter.com/bmyLY7ogE6	rogerkver	251	230	1474305083	777918017330094080	https://twitter.com/rogerkver/status/777918017330094080		#		0.21	0.3767	0.9908789386235489	-1.0
bitcoin 	Why C++ is used on Wall Street is the same reason why it's used for Bitcoin: precision and performance.pic.twitter.com/HkNtNbguFr	TuurDemeester	51	23	1474289722	777853590132121600	https://twitter.com/TuurDemeester/status/777853590132121600				0.32	0.0	0.9908789386235489	-1.0
bitcoin 	Also this thread: https://bitcointalk.org/index.php?topic=144471.0 … And this post by GMaxwell: https://bitcointalk.org/index.php?topic=144471.msg9764161#msg9764161 …	TuurDemeester	0	0	1474249025	777682893808267264	https://twitter.com/TuurDemeester/status/777682893808267264		#msg9764161		0.20	0.0	0.9908789386235489	-1.0
bitcoin 	Thanks for pointing it out. Very kind. @ Richtopia @ DerinCag @ longfinance @zyen_lf @ broadstreetward @ BroadStWardClub @ leashless @ BitcoinByte	mrmainelli	1	0	1474314833	777958912326787072	https://twitter.com/mrmainelli/status/777958912326787072			@ @ @ @zyen_lf @ @ @ @	0.41	0.3371	0.9908789386235489	-1.0
bitcoin 	Certainly not # Blockchain # Fintech experts we see # IANATransition = end of # Bitcoin. @ NoziPaul @ ICANN @ chrismondini http://SocialNetworksManager.com/?p=10132	NetworksManager	6	10	1474245910	777669830296174592	https://twitter.com/NetworksManager/status/777669830296174592		# # # #	@ @ @	0.30	0.17	0.9908789386235489	-1.0
bitcoin 	Please consider donating to my campaign so that I can plaster my district with yard signs. (DM for # Bitcoin address) http://www.tiffanyhayden.co/donations-2/	haydentiff	4	4	1474304399	777915149764157440	https://twitter.com/haydentiff/status/777915149764157440		#		0.27	0.1591	0.9908789386235489	-1.0
bitcoin 	Thanks for making a # Bitcoin donation!!! I really appreciate it! I want to plaster # Detroit with yard signs. # Election2016 @ thomas_quinlan	haydentiff	5	5	1474303138	777909861552095232	https://twitter.com/haydentiff/status/777909861552095232		# # #	@	0.29	0.292	0.9908789386235489	-1.0
bitcoin 	Thank you! @ BitcoinBuddhist	haydentiff	2	0	1474302576	777907502520369152	https://twitter.com/haydentiff/status/777907502520369152			@	0.50	0.2099	0.9908789386235489	-1.0
bitcoin 	Here's a # Bitcoin address for campaign donations: 1GEoTFND7SQCp9KmApS6GiuYJR9KbFRVSc Thanks! @ thomas_quinlanpic.twitter.com/CSe5Wac4Ba	haydentiff	6	8	1474302340	777906514296205312	https://twitter.com/haydentiff/status/777906514296205312		#	@	0.42	0.2463	0.9908789386235489	-1.0
bitcoin 	Thanks! @ BitcoinBuddhist	haydentiff	2	0	1474299520	777894686623145985	https://twitter.com/haydentiff/status/777894686623145985			@	0.33	0.2463	0.9908789386235489	-1.0
bitcoin 	Selective media attention. They're molding public opinion instead of mirroring it. # irresponsable @ hettil @ wdet @ BitcoinBuddhist @ WashTimes	haydentiff	3	3	1474243039	777657788109422592	https://twitter.com/haydentiff/status/777657788109422592		#	@ @ @ @	0.24	0.0	0.9901477831211629	-1.0
bitcoin 	I have no idea why we have to cram voting into one day. @ BitcoinBuddhist @ wdet # Detroit # Election2016pic.twitter.com/LpFUXkiyiS	haydentiff	3	5	1474239566	777643223053246464	https://twitter.com/haydentiff/status/777643223053246464		# #	@ @	0.48	-0.148	0.9901477831211629	-1.0
bitcoin 	Possessing theoretical rights with zero chance to exercise them is no different than not having the right at all. @ BitcoinBuddhist @ wdet	haydentiff	3	3	1474239455	777642753756766208	https://twitter.com/haydentiff/status/777642753756766208			@ @	0.30	-0.0258	0.9901477831211629	-1.0
bitcoin 	They only have time for straight-party voting. It's that or nothing due to time constraints. @ BitcoinBuddhist @ wdet	haydentiff	2	3	1474239438	777642683019911168	https://twitter.com/haydentiff/status/777642683019911168			@ @	-0.05	0.0	0.9901477831211629	-1.0
bitcoin 	Minorities aren't able to fully exercise their right to vote because of time constraints. @ BitcoinBuddhist @ wdet # Detroit	haydentiff	3	5	1474239325	777642210590240768	https://twitter.com/haydentiff/status/777642210590240768		#	@ @	0.15	0.0	0.9901477831211629	-1.0
bitcoin 	Detroit has the least internet connectivity in the nation. Also, we have straight ticket voting. @ BitcoinBuddhist @ wdet	haydentiff	4	5	1474239220	777641770561568769	https://twitter.com/haydentiff/status/777641770561568769			@ @	0.37	0.0754	0.9901477831211629	-1.0
bitcoin 	Media is supposed to serve as the 4th pillar. They need to be called out. 11 seconds??? @ wdet @ BitcoinBuddhisthttp://m.washingtontimes.com/news/2016/sep/6/gary-johnson-receives-little-coverage-from-news-ne/ …	haydentiff	4	4	1474238361	777638166392025088	https://twitter.com/haydentiff/status/777638166392025088			@ @	0.00	0.0	0.9901477831211629	-1.0
bitcoin 	Haha, I did! @ wdet has done a great disservice to # Detroit. It's oppression. @ BitcoinBuddhist # LetGaryDebatepic.twitter.com/W10nXYezYJ	haydentiff	2	5	1474238101	777637075617054721	https://twitter.com/haydentiff/status/777637075617054721		# #	@ @	0.68	0.2835	0.9901477831211629	-1.0
bitcoin 	the jungle hut at the mayan ruins will take visa, mastercard, and silver, but no # bitcoin? we have work to do...pic.twitter.com/OslOlqZYyM	Melt_Dem	18	0	1474303426	777911067427168257	https://twitter.com/Melt_Dem/status/777911067427168257		#		0.05	-0.2894	0.9908789386235489	-1.0
bitcoin 	"Bitcoin Struggles To Catch on At MIT http://buff.ly/2cHOGGT  ""So far, Bitcoin hasn’t made any significant impact"""	dgwbirch	2	0	1474297192	777884920756727808	https://twitter.com/dgwbirch/status/777884920756727808				0.06	-0.1779	0.9908789386235489	-1.0
bitcoin 	Massive Upside For # Bitcoin: Online gambling to approach $1 trillion by 2021 http://www.cnet.com/uk/news/online-gambling-to-approach-1-trillion-by-2021/ … by @ benfoxrubin cc: @ CubitsBTC	jonmatonis	13	22	1474315721	777962639553069056	https://twitter.com/jonmatonis/status/777962639553069056		#	@ @	0.20	0.0	0.9908789386235489	-1.0
bitcoin 	Intelligent Agents with Bitcoin (posted by John Granata) https://21.co/learn/intelligent-agents-with-bitcoin/#intelligent-agents-with-bitcoin …	jonmatonis	7	4	1474275473	777793825582505984	https://twitter.com/jonmatonis/status/777793825582505984		#intelligent		0.11	0.4588	0.9908789386235489	-1.0
bitcoin 	Trade bitcoin at http://unocoin.com , India's leading platform. # IndiaBitcoinpic.twitter.com/JMUKxsjolD	SunnyStartups	8	6	1474300457	777898616727990272	https://twitter.com/SunnyStartups/status/777898616727990272		#		0.44	0.0	0.9908789386235489	-1.0
bitcoin 	I have a list of educational resources here: https://sites.google.com/site/bitcoinsig/resources …	lopp	5	1	1474319688	777979275492360192	https://twitter.com/lopp/status/777979275492360192				0.33	0.0	0.9908789386235489	-1.0
bitcoin 	http://whatcanidoforbitcoin.xyz/  ;-)	lopp	1	0	1474312747	777950162740183040	https://twitter.com/lopp/status/777950162740183040				0.50	0.25	0.9908789386235489	-1.0
bitcoin ethereum 	There's a reason @ VitalikButerin is extremely bullish on # blockchain helping consumer # IoT break through the hype..https://bitcoinmagazine.com/articles/chronicled-introduces-new-ethereum-powered-iot-open-registry-1472167960 …	cburniske	1	0	1474242787	777656730633273344	https://twitter.com/cburniske/status/777656730633273344		# #	@	0.32	0.296	0.9901477831211629	-1.0
bitcoin 	Huh? Bitcoin has one supermajority dominant implementation of the consensus codebase.	peterktodd	0	0	1474274591	777790124780294144	https://twitter.com/peterktodd/status/777790124780294144				0.09	0.0	0.9908789386235489	-1.0
bitcoin 	"Bitcoin's most important ""training wheel"" is that the protocol and implementation are relatively simple."	peterktodd	8	2	1474241795	777652571150376960	https://twitter.com/peterktodd/status/777652571150376960				0.36	0.2716	0.9901477831211629	-1.0
bitcoin 	See also my post on parallels between Bitcoin/blockchain and other experiences I've had w/ safety-critical fields:https://www.reddit.com/r/Bitcoin/comments/52v3w6/opentimestamps_scalable_trustless_distributed/d7o003l?context=2 …	peterktodd	8	7	1474239829	777644323517194240	https://twitter.com/peterktodd/status/777644323517194240				-0.12	0.0	0.9901477831211629	-1.0
bitcoin 	you might like my other content than: http://www.libertylifetrail.com/2016/04/04/the-top-use-cases-for-bitcoin/ …	ToneVays	1	0	1474314750	777958563712999424	https://twitter.com/ToneVays/status/777958563712999424				0.12	0.3612	0.9908789386235489	-1.0
bitcoin 	the current utility of Bitcoin only makes it useful for grey activity. U r just speculating	ToneVays	0	0	1474307073	777926366113198080	https://twitter.com/ToneVays/status/777926366113198080				0.31	0.2384	0.9908789386235489	-1.0
bitcoin 	in that case, you can read the blog post here and think about how Bitcoin fits into the concept :) https://www.armstrongeconomics.com/world-news/taxes/when-increasing-money-supply-produces-deflation/ …	ToneVays	0	0	1474300869	777900346114969600	https://twitter.com/ToneVays/status/777900346114969600				0.29	0.4588	0.9908789386235489	-1.0
bitcoin 	I don't know what the future of bitcoin is, right now it's the best tool around over-regulation	ToneVays	0	0	1474294047	777871733147758592	https://twitter.com/ToneVays/status/777871733147758592				0.47	0.6369	0.9908789386235489	-1.0
bitcoin 	I probably am as my view has been from day one that just holding Bitcoin breaks 10+ US laws.	ToneVays	1	0	1474292794	777866475541520384	https://twitter.com/ToneVays/status/777866475541520384				0.21	0.0	0.9908789386235489	-1.0
bitcoin 	Quite the opposite, Cash elimination puts an insane premium & utility for bitcoin.	ToneVays	0	0	1474284975	777833680341463042	https://twitter.com/ToneVays/status/777833680341463042				0.00	-0.4019	0.9908789386235489	-1.0
bitcoin 	I find it hard to believe that the banks would denominated this activity in # Bitcoin.	ToneVays	1	0	1474245778	777669278015324161	https://twitter.com/ToneVays/status/777669278015324161		#		-0.06	-0.1027	0.9908789386235489	-1.0
