currency	tweet	username	favorites	retweets	date	id	permalink	geo	hashtags	mentions	lex_sent	vader_sent	cnn_sent	cnn_pos_neg
bitcoin 	Bitcoin immediately started trading higher when @ KimDotcom launched # Bitcache on BTTF. He's got a $2,000 target. https://bnktothefuture.com/pitches/megaupload-2-0-bitcache …pic.twitter.com/HxV1y1k21b	maxkeiser	109	73	1475853788	784413760916221953	https://twitter.com/maxkeiser/status/784413760916221953		#	@	0.05	0.0427	0.9943754120666929	-1.0
bitcoin 	A miracle of fintech and Bitcoin. https://bnktothefuture.com/pitches/megaupload-2-0-bitcache …pic.twitter.com/w9NfyecYkh	maxkeiser	12	7	1475850711	784400853239226368	https://twitter.com/maxkeiser/status/784400853239226368				-0.14	0.2929	0.9943754120666929	-1.0
bitcoin 	Technical limitations are not an obstacle in an evolving system. Bitcoin is evolving, fast.	aantonop	1	0	1475863132	784452951662272512	https://twitter.com/aantonop/status/784452951662272512				0.07	0.1378	0.9943754120666929	-1.0
bitcoin 	ShapeShift has surpassed 100 integrations with industry partners. We will keep working to connect the ecosystem. # bitcoin	ErikVoorhees	83	32	1475854175	784415382039777280	https://twitter.com/ErikVoorhees/status/784415382039777280		#		0.56	0.0	0.9943754120666929	-1.0
bitcoin 	This pisses me off. If you're upset about Bitcoin TX fees, help with payment channels or launch utopiacoin - but don't slander core devs.https://twitter.com/bhec39/status/783972252719218688 …	TuurDemeester	49	10	1475818625	784266274113060864	https://twitter.com/TuurDemeester/status/784266274113060864				0.29	-0.0172	0.9943754120666929	-1.0
bitcoin 	"""Bitcoin will never work as a currency because it is too volatile""https://twitter.com/businessinsider/status/784274652877037569 …"	barrysilbert	241	166	1475826470	784299177568108552	https://twitter.com/barrysilbert/status/784299177568108552				0.17	0.0	0.9943754120666929	-1.0
bitcoin 	. @ Blockstream Completes Its First # Lightning Transaction on Bitcoin Testnet # fintech # paymentshttps://bitcoinmagazine.com/articles/blockstream-completes-its-first-lightning-transaction-on-bitcoin-testnet-1475850017 …	sbmeunier	12	11	1475855713	784421833995149312	https://twitter.com/sbmeunier/status/784421833995149312		# # #	@	0.50	0.0	0.9943754120666929	-1.0
bitcoin 	come on @ MITSloan! don't let @ delitzer and i down! win this # bitcoin challenge! @ ccatalini - HELP!http://www.economist.com/whichmba/mba-case-studies/investment-case-study-competition-2016 …	Melt_Dem	4	2	1475858263	784432527645605888	https://twitter.com/Melt_Dem/status/784432527645605888		#	@ @ @	0.35	0.2468	0.9943754120666929	-1.0
bitcoin 	but then there are also lots of market infrastructure issues in # bitcoin too! so much fantastic work ahead of us, can't waithttps://twitter.com/coindesk/status/783781312217972737 …	Melt_Dem	5	1	1475845214	784377796353294336	https://twitter.com/Melt_Dem/status/784377796353294336		#		0.22	0.2983	0.9943754120666929	-1.0
bitcoin 	Monero has not proven itself yet. # Bitcoin works.	SimonDixonTwitt	1	0	1475857150	784427859016192000	https://twitter.com/SimonDixonTwitt/status/784427859016192000		#		0.67	0.0	0.9943754120666929	-1.0
bitcoin 	Banks don't need to adopt Bitcoin and they won't adopt Blockchain either as they don't want transparency not p2p assets.	SimonDixonTwitt	0	0	1475856791	784426355446259712	https://twitter.com/SimonDixonTwitt/status/784426355446259712				-0.05	-0.4168	0.9943754120666929	-1.0
bitcoin 	Bitcoin, not blockchain. At Deloitte with @ petertoddbtc @ adam3us for # scalingbitcoin Milano.pic.twitter.com/87wbqkFv88	starkness	200	84	1475858863	784435044207165440	https://twitter.com/starkness/status/784435044207165440		#	@ @	0.29	0.0	0.9943754120666929	-1.0
bitcoin 	Good read: 6 lessons financial services can learn from Bitcoin, # blockchain’s original use case (Part 1) via @ capco http://buff.ly/2dufOcC	obussmann	7	5	1475865668	784463588505321473	https://twitter.com/obussmann/status/784463588505321473		#	@	0.33	0.6369	0.9943754120666929	-1.0
bitcoin 	Chicago’s Cook County to Test # Blockchain-Based Property Title Transfer https://bitcoinmagazine.com/articles/chicago-s-cook-county-to-test-bitcoin-blockchain-based-public-records-1475768860 …	AntonioSelas	1	2	1475819844	784271388311822340	https://twitter.com/AntonioSelas/status/784271388311822340		#		0.27	0.0	0.9943754120666929	-1.0
bitcoin 	India's Bitcoin Startups and the Fundraising Gold Rushhttp://www.investopedia.com/news/indias-bitcoin-startups-and-fundraising-gold-rush/ …	SunnyStartups	4	3	1475847607	784387834060955650	https://twitter.com/SunnyStartups/status/784387834060955650				-0.12	0.0	0.9943754120666929	-1.0
bitcoin 	Bitcoin Lightning Payments Pass ‘Milestone’ With Blockstream Test | CoinDeskhttp://www.coindesk.com/blockstream-amps-up-lightning-network-with-first-test-transaction/ …	SunnyStartups	5	1	1475840520	784358110135721984	https://twitter.com/SunnyStartups/status/784358110135721984				0.20	0.0	0.9943754120666929	-1.0
bitcoin 	Bitcoin Fintech Unocoin Sets $1.5M VC Indian Investment Record | NextBillionhttp://nextbillion.net/news/bitcoin-fintech-unocoin-sets-1-5m-vc-indian-investment-record/ …	SunnyStartups	2	0	1475830267	784315105806721024	https://twitter.com/SunnyStartups/status/784315105806721024				0.18	0.0	0.9943754120666929	-1.0
bitcoin 	Learn about bitcoins and how they work.  https://www.khanacademy.org/economics-finance-domain/core-finance/money-and-banking#bitcoin …	SunnyStartups	5	2	1475825887	784296732347633665	https://twitter.com/SunnyStartups/status/784296732347633665		#bitcoin		0.00	0.0	0.9943754120666929	-1.0
bitcoin 	Unocoin is proud to be working with @ PurseIO. Amazon's $5b Plan for India’s e-Commerce, Boom for Bitcoin?https://cointelegraph.com/news/amazons-5b-plan-for-indias-e-commerce-boom-for-bitcoin …	SunnyStartups	7	4	1475814600	784249394472202241	https://twitter.com/SunnyStartups/status/784249394472202241			@	0.22	0.1589	0.9943754120666929	-1.0
bitcoin 	MimbleWimble is on everyone's lips at @ ScalingBitcoin, possibly b/c it's fun to say. Will MimbleWimble be this year's @ lightning Network?	lopp	11	5	1475873456	784496254629900288	https://twitter.com/lopp/status/784496254629900288			@ @	0.36	0.2553	0.9943754120666929	-1.0
bitcoin 	One thing clear from early @ ScalingBitcoin discussions: the ecosystem is expanding (via new tech) faster than many of us can keep track.	lopp	49	28	1475870714	784484750555832320	https://twitter.com/lopp/status/784484750555832320			@	0.39	0.3818	0.9943754120666929	-1.0
bitcoin 	that's a regulatory issue, has nothing to do with the protocol of Bitcoin peer to peer value transfer satoshi built	ToneVays	1	0	1475850994	784402039644233728	https://twitter.com/ToneVays/status/784402039644233728				0.10	0.34	0.9943754120666929	-1.0
