currency	tweet	username	favorites	retweets	date	id	permalink	geo	hashtags	mentions	lex_sent	vader_sent	cnn_sent	cnn_pos_neg
bitcoin ethereum 	if this is what it takes to get bitcoin maximalists to like ethereum, so be it	VitalikButerin	166	68	1469569109	758053905456586761	https://twitter.com/VitalikButerin/status/758053905456586761				0.25	0.3612	0.9974787313069526	-1.0
bitcoin 	@ LiveBitcoinNews piece on how I think # Blockchain will disrupt many industries including the # musicindustry: http://www.livebitcoinnews.com/don-tapscott-believes-blockchain-can-disrupt-any-industry/ …	dtapscott	2	3	1469551380	757979544666210308	https://twitter.com/dtapscott/status/757979544666210308		# #	@	0.39	0.0	0.9974787313069526	-1.0
bitcoin ethereum 	Over $90m volume traded in both ETH and ETC past 24 hours. http://www.CoinCap.io # MarketsGoneWild # ethereum # bitcoin # blockchain # finance	ErikVoorhees	8	3	1469569358	758054949146144768	https://twitter.com/ErikVoorhees/status/758054949146144768		# # # # #		0.43	0.0	0.9974787313069526	-1.0
bitcoin ethereum 	CoinCap now has toggle for all fiat currencies... see asset prices in CAD, ZAR, CHF, CNY, EUR etc http://www.CoinCap.io # bitcoin # ethereum	ErikVoorhees	17	9	1469569232	758054422689624064	https://twitter.com/ErikVoorhees/status/758054422689624064		# #		0.17	0.3612	0.9974787313069526	-1.0
bitcoin ethereum 	In a noisy environment, given time, prices will tend to point toward the truth. # bitcoin # ethereum # markets	ErikVoorhees	31	10	1469560857	758019291581079553	https://twitter.com/ErikVoorhees/status/758019291581079553		# # #		0.40	0.0766	0.9974787313069526	-1.0
bitcoin 	...or I care about Bitcoin and every day I see a friction point which I feel isn't being taken seriously.	ErikVoorhees	0	0	1469556218	757999837585432576	https://twitter.com/ErikVoorhees/status/757999837585432576				0.20	0.5744	0.9974787313069526	-1.0
bitcoin 	. @ CVPITVLIST most bitcoin companies are, like us, in favor of somewhat larger blks soon because they see effect on users every day at scale	ErikVoorhees	21	5	1469554183	757991299714650112	https://twitter.com/ErikVoorhees/status/757991299714650112			@	0.04	0.3185	0.9974787313069526	-1.0
bitcoin 	You must not use Bitcoin very much.	ErikVoorhees	0	0	1469553616	757988922987126786	https://twitter.com/ErikVoorhees/status/757988922987126786				0.71	0.0	0.9974787313069526	-1.0
bitcoin 	I don't think Roger has helped unify, no. But some of his underlying concerns are valid. He cares deeply about Bitcoin.	ErikVoorhees	3	0	1469547969	757965235571531777	https://twitter.com/ErikVoorhees/status/757965235571531777				0.05	0.0543	0.9974787313069526	-1.0
bitcoin 	Fearmongering? Pointing out a concern is not fearmongering. Bitcoin is healthy, but not perfect.	ErikVoorhees	1	0	1469547858	757964770813308928	https://twitter.com/ErikVoorhees/status/757964770813308928				0.79	-0.1616	0.9974787313069526	-1.0
bitcoin 	Contentious hard forks are dangerous. Best way to avoid that is for @ bitcoincoreorg to plan HF and build consensus/unity.	ErikVoorhees	5	1	1469547082	757961516842876928	https://twitter.com/ErikVoorhees/status/757961516842876928			@	0.65	-0.116	0.9974787313069526	-1.0
bitcoin 	I've abandoned /r/bitcoin, so I won't bother you further with comments about it.	ErikVoorhees	1	0	1469545835	757956284394172417	https://twitter.com/ErikVoorhees/status/757956284394172417				-0.08	-0.1743	0.9974787313069526	-1.0
bitcoin 	Big News: Bitcoin not money, Miami judge rules in dismissing laundering chargeshttp://www.miamiherald.com/news/local/crime/article91682102.html …	ErikVoorhees	54	49	1469496135	757747830844825600	https://twitter.com/ErikVoorhees/status/757747830844825600				-0.50	-0.2732	0.9974787313069526	-1.0
bitcoin 	Bitcoin Foundation Exec Director Llew Claasen: We Have Entered Value Age http://coint.co/3tkc	brockpierce	0	2	1469564995	758036648546283520	https://twitter.com/brockpierce/status/758036648546283520				0.08	0.34	0.9974787313069526	-1.0
bitcoin 	Vinny Lingham: Bitcoin Needs to Get to $3,000 Level http://coint.co/3pfr	brockpierce	1	2	1469502953	757776424468033536	https://twitter.com/brockpierce/status/757776424468033536				0.00	0.0	0.9974787313069526	-1.0
bitcoin 	Bitcoin Foundation Exec Director Llew Claasen: We Have Entered Value Age http://coint.co/3tkc	brockpierce	0	1	1469502784	757775716746309632	https://twitter.com/brockpierce/status/757775716746309632				0.08	0.34	0.9974787313069526	-1.0
bitcoin 	If the tweetstorm doesn't show properly, here it is on one page: https://www.reddit.com/r/Bitcoin/comments/4uno3g/bitcoin_core_developer_eric_lombrozo_reflects_on/ …	TuurDemeester	2	3	1469569710	758056426401067008	https://twitter.com/TuurDemeester/status/758056426401067008				0.31	0.0	0.9974787313069526	-1.0
bitcoin ethereum 	"# Ethereum POW: ""Blocktime will bypass Bitcoin levels in March '17 & mining will be hardly possible after July '17.""http://ethereum.stackexchange.com/questions/3779/when-will-the-difficulty-bomb-make-mining-impossible …"	TuurDemeester	1	8	1469545395	757954439080775680	https://twitter.com/TuurDemeester/status/757954439080775680		#		0.20	0.0	0.9974787313069526	-1.0
bitcoin 	Chaum certainly believed in fungibility, user rights just result of bankruptcy. Time for ecosysyem defensive # bitcoin patent pool like linux	adam3us	21	11	1469512423	757816144367525891	https://twitter.com/adam3us/status/757816144367525891		#		0.10	0.3609	0.9974787313069526	-1.0
bitcoin 	Digicash went bankrupt in 98, investors sold ecash patent to highest bidder. Stopped innovation for 6years # bitcoin obligation to not repeat	adam3us	25	13	1469512048	757814572262699008	https://twitter.com/adam3us/status/757814572262699008		#		0.05	-0.1898	0.9974787313069526	-1.0
bitcoin 	Why bitcoin's going to take a while for real adoption to take place...https://www.washingtonpost.com/news/innovations/wp/2016/07/21/humans-once-opposed-coffee-and-refrigeration-heres-why-we-often-hate-new-stuff/ …	jimmysong	0	0	1469490713	757725086774427648	https://twitter.com/jimmysong/status/757725086774427648				0.38	0.0	0.9955752540728812	1.0
bitcoin 	Can Crypto-Currency Overturn Governments? # Bitcoin Subscribe--> http://buff.ly/1TFC7sO pic.twitter.com/yTSPuaeArG	DollarVigilante	20	10	1469554959	757994554700201988	https://twitter.com/DollarVigilante/status/757994554700201988		#		0.12	0.0	0.9974787313069526	-1.0
bitcoin 	Subscribe to the Dollar Vigilante # Mining # Bitcoin # Investing http://ow.ly/IOCP3000UBN pic.twitter.com/OrKhPJevRC	DollarVigilante	7	0	1469539839	757931136236617728	https://twitter.com/DollarVigilante/status/757931136236617728		# # #		0.25	0.0	0.9974787313069526	-1.0
bitcoin 	Subscribe and learn! # Investing # Gold # Bitcoin # Mining # Shemitah http://ow.ly/IOCP3000UBN pic.twitter.com/IP9gy9FHdb	DollarVigilante	6	0	1469517391	757836983771074560	https://twitter.com/DollarVigilante/status/757836983771074560		# # # # #		0.29	0.0	0.9974787313069526	-1.0
bitcoin 	# Equality is what # Bitcoin represents. Subscribe--> http://buff.ly/1TFC7sO pic.twitter.com/oS9Kgmz1za	DollarVigilante	11	4	1469506178	757789953925402624	https://twitter.com/DollarVigilante/status/757789953925402624		# #		0.44	0.0	0.9974787313069526	-1.0
bitcoin 	Subscribe to the Dollar Vigilante # Mining # Bitcoin # Investing http://ow.ly/IOCP3000UBN pic.twitter.com/d0XjMpAOjn	DollarVigilante	4	1	1469498321	757756996351393792	https://twitter.com/DollarVigilante/status/757756996351393792		# # #		0.25	0.0	0.9974787313069526	-1.0
bitcoin 	So what is it? A Miami judge rules that # bitcoin isn’t # money # fintech http://qz.com/741159/a-miami-judge-rules-that-bitcoin-isnt-money/ …	sbmeunier	3	6	1469561440	758021738894598145	https://twitter.com/sbmeunier/status/758021738894598145		# # #		-0.06	0.0	0.9974787313069526	-1.0
bitcoin 	So ironic EU Commission Proposes Central Database Record of # Bitcoin Users # fintech # blockchainhttp://ow.ly/hrKe302CfUa	sbmeunier	5	13	1469554513	757992683243724800	https://twitter.com/sbmeunier/status/757992683243724800		# # #		0.31	-0.2006	0.9974787313069526	-1.0
bitcoin ethereum 	there are few things in life that give me greater joy than the @ Poloniex trollbox # bitcoin # blockchain # ethereum	Melt_Dem	15	7	1469541660	757938773523136512	https://twitter.com/Melt_Dem/status/757938773523136512		# # #	@	0.32	0.743	0.9974787313069526	-1.0
bitcoin 	Guy tries to rob another guy trying to catch Magikarp, gets shot. This not about # Bitcoin, # MtGox or corrupt feds. http://apne.ws/2a633C0	el33th4xor	15	10	1469559792	758014825779912704	https://twitter.com/el33th4xor/status/758014825779912704		# #		0.00	-0.2787	0.9974787313069526	-1.0
bitcoin 	On that day, /r/btc had 15+ threads on one topic, /r/bitcoin had 0 due to censorship. That's a lot of things, healthy it is not.	el33th4xor	0	0	1469546773	757960222149373952	https://twitter.com/el33th4xor/status/757960222149373952				0.12	0.2009	0.9974787313069526	-1.0
bitcoin 	6 Tips for Traveling the World on # Bitcoin:http://ow.ly/YMGj302m5F0	laurashin	0	0	1469547629	757963810179276804	https://twitter.com/laurashin/status/757963810179276804		#		0.33	0.0	0.9974787313069526	-1.0
bitcoin 	. @ Chain's @ AdamLudwin On Who Is Best Poised To Benefit From # Blockchain Technology http://ow.ly/akyA302CzOk # bitcoin # fintech	laurashin	2	1	1469545607	757955332027056133	https://twitter.com/laurashin/status/757955332027056133		# # #	@ @	0.95	0.424	0.9974787313069526	-1.0
bitcoin 	selling my # Bitcoin off until I find a legit place to hold them. Sad State that they don't service.	GerberKawasaki	1	0	1469537132	757919781584408577	https://twitter.com/GerberKawasaki/status/757919781584408577		#		0.00	-0.2384	0.9974787313069526	-1.0
bitcoin 	Let's see. The kidnappers want a) Bitcoin, b) Prepaid cards or c) flipping great wodges of cash? http://buff.ly/2aajVpa	dgwbirch	3	1	1469523295	757861748670074880	https://twitter.com/dgwbirch/status/757861748670074880				0.39	0.3451	0.9974787313069526	-1.0
bitcoin 	@ cgledhill if only there was a more liquid version of bitcoin.	sytaylor	1	0	1469518175	757840271073607680	https://twitter.com/sytaylor/status/757840271073607680			@	-0.08	0.0	0.9974787313069526	-1.0
bitcoin 	Gibraltar Stock Exchange to List Bitcoin Investment Producthttp://www.coindesk.com/gibraltar-stock-exchange-bitcoin-investment-product/?utm_source=feedburner&utm_medium=feed&utm_campaign=Feed%3A+CoinDesk+%28CoinDesk+-+The+Voice+of+Digital+Currency%29 …	jonmatonis	11	10	1469537636	757921898449760256	https://twitter.com/jonmatonis/status/757921898449760256				0.00	0.0	0.9974787313069526	-1.0
bitcoin 	In re $ ETC, # bitcoin and forks: - Seems people value immutability - good - HF or SF: Splits can happen if people object to soft forks, also.	jgarzik	6	16	1469543766	757947608908214275	https://twitter.com/jgarzik/status/757947608908214275		#		0.28	0.6486	0.9974787313069526	-1.0
bitcoin 	"Great post on WeChat red packets. http://a16z.com/2016/07/24/money-as-message/ … Interesting concept ""Send to group with Lottery"" Doable with # bitcoin script."	jgarzik	5	12	1469533885	757906165305004033	https://twitter.com/jgarzik/status/757906165305004033		#		0.79	0.5134	0.9974787313069526	-1.0
bitcoin 	India's Digital Payment Ecosystem Can Thrive With Bitcoin:http://www.livebitcoinnews.com/indias-digital-payment-ecosystem-can-thrive-with-bitcoin/ …	SunnyStartups	1	6	1469552220	757983066895843328	https://twitter.com/SunnyStartups/status/757983066895843328				0.25	0.0	0.9974787313069526	-1.0
bitcoin 	# bitcoin is not money, Miami judge rules in dismissing laundering charges https://www.google.com/url?rct=j&sa=t&url=http://fortune.com/2016/07/25/bitcoin-money-laundering-miami-judge/&ct=ga&cd=CAEYACoTNDcxMDI1MzU2MzQ3MjkzMDgzNDIaYWYxYWI5NTlhODE2MDZlYTpjb206ZW46VVM&usg=AFQjCNEMBnJn-Nf4frXOSXtJSw4QFu6ReA …	diiorioanthony	5	7	1469558288	758008516866998272	https://twitter.com/diiorioanthony/status/758008516866998272		#		-0.23	-0.2732	0.9974787313069526	-1.0
bitcoin 	Changes from Bitcoin Core 0.13 have been merged into Statoshi. New memory pool charts now available at https://statoshi.info/dashboard/db/memory-pool …	lopp	14	5	1469487742	757712627380449284	https://twitter.com/lopp/status/757712627380449284				0.33	0.0	0.9955752540728812	1.0
bitcoin 	@ ChandlerGuo you were on a WEF panel with my CEO/founder @ CathieDWood - we would love to continue the # Bitcoin conversation!	cburniske	0	0	1469539784	757930908326461440	https://twitter.com/cburniske/status/757930908326461440		#	@ @	0.48	0.6696	0.9974787313069526	-1.0
bitcoin 	# bitcoin traders hate stabilitypic.twitter.com/FIAAn8FUGu	cburniske	2	0	1469538892	757927165618950146	https://twitter.com/cburniske/status/757927165618950146		#		0.00	-0.5719	0.9974787313069526	-1.0
bitcoin 	Maybe I should try retweeting https://twitter.com/Bitcoin_Markets/status/757956098267738112 … :p	peterktodd	7	2	1469546372	757958537003794432	https://twitter.com/peterktodd/status/757958537003794432				-0.43	0.25	0.9974787313069526	-1.0
bitcoin ethereum 	Which # Ethereum Founder will be taken to court (and/or arrested) first? # Ether $ ETH $ ETC $ BTC # Bitcoin # Blockchain	ToneVays	15	9	1469561062	758020155020546052	https://twitter.com/ToneVays/status/758020155020546052		# # # #		0.42	0.0	0.9974787313069526	-1.0
bitcoin 	a # bitcoin HF would be terrible for # blockchain tech, but since @ Blockstream devs r not in it to scam users it should not happen.	ToneVays	1	1	1469556290	758000138925334528	https://twitter.com/ToneVays/status/758000138925334528		# #	@	-0.15	-0.7964	0.9974787313069526	-1.0
bitcoin 	Depends on WHAT u want to decentralize & WHY. # bitcoin did it to payments	ToneVays	0	0	1469549348	757971021802635266	https://twitter.com/ToneVays/status/757971021802635266		#		0.13	0.0386	0.9974787313069526	-1.0
bitcoin 	"I only travel to events if I'm speaking, will try & submit a proposal and we'll see - ""scaling # bitcoin"" exception"	ToneVays	0	0	1469492844	757734027457626112	https://twitter.com/ToneVays/status/757734027457626112		#		0.32	0.0	0.9974787313069526	-1.0
