currency	tweet	username	favorites	retweets	date	id	permalink	geo	hashtags	mentions	lex_sent	vader_sent	cnn_sent	cnn_pos_neg
bitcoin 	Unless Yellen's asked for her views on Bitcoin, this presser is pointless.	maxkeiser	24	8	1497466252	875063001925259265	https://twitter.com/maxkeiser/status/875063001925259265				0.33	0.0	0.9751416537331616	1.0
bitcoin 	Bitcoin trades higher on Fed comments. (Not reallly, Fed has virtually zero impact on Bitcoin, thank Satoshi).	maxkeiser	103	32	1497466192	875062753005891585	https://twitter.com/maxkeiser/status/875062753005891585				0.29	0.1806	0.9751416537331616	1.0
bitcoin 	Making sense of # bitcoin and # blockchain technology. http://pwc.to/2qY0vRC # emergingtech @ PwC @PwC_US_FinSrvcs HT @ MikeQuindazzipic.twitter.com/UafssmKV7C	JimMarous	17	16	1497467280	875067316836253696	https://twitter.com/JimMarous/status/875067316836253696		# # #	@ @PwC_US_FinSrvcs @	0.39	0.0	0.9751416537331616	1.0
bitcoin 	Top 10 # Technology Trends for 2017 http://bit.ly/2tbltJr # fintech # bitcoin # analytics # blockchain # insurtech # ai # iot @ dez_blanchfieldpic.twitter.com/ObzkmauA78	JimMarous	31	48	1497430246	874911982851428352	https://twitter.com/JimMarous/status/874911982851428352		# # # # # # # #	@	0.42	0.2023	0.9751416537331616	1.0
bitcoin 	Whether SegWit2x, UASF, UAHF, MASF, or whatever else, Im looking forward to Bitcoin moving forward. Everyone lost the blocksize debate.	ErikVoorhees	272	73	1497464130	875054104141152256	https://twitter.com/ErikVoorhees/status/875054104141152256				-0.05	-0.1591	0.9751416537331616	1.0
bitcoin 	Bitmain statement on contingency for BIP148 UASF https://blog.bitmain.com/en/uahf-contingency-plan-uasf-bip148/ … # bitcoin	ErikVoorhees	40	18	1497448537	874988701146906626	https://twitter.com/ErikVoorhees/status/874988701146906626		#		0.20	0.0	0.9751416537331616	1.0
bitcoin 	Between a Bitcoin chain split and ETH / ICO regulatory scrutiny, I'm preparing for a volatile summer. # animalspirits.	TuurDemeester	320	100	1497455020	875015891200737280	https://twitter.com/TuurDemeester/status/875015891200737280		#		0.11	0.0	0.9751416537331616	1.0
bitcoin 	Some discussion: https://twitter.com/LukeDashjr/status/874863403067731969 … and https://www.reddit.com/r/Bitcoin/comments/6h5goj/uahf_a_contingency_plan_against_uasf_bip148/ …	TuurDemeester	28	8	1497423376	874883169073467395	https://twitter.com/TuurDemeester/status/874883169073467395				0.20	0.0	0.9751416537331616	1.0
bitcoin ethereum 	"GMax questions Ethereum's 'guaranteed' PoS transition: ""they substantially defused [difficulty bomb] in a prior hardfork"". HT @ Truthcoinhttps://twitter.com/bitcoin_experts/status/874773155717423105 …"	TuurDemeester	26	6	1497410039	874827227929743361	https://twitter.com/TuurDemeester/status/874827227929743361			@	0.17	0.0	0.9751416537331616	1.0
bitcoin 	Reading through their stuff made me feel like a Bitcoin senior citizen, haha. It looks very promising.	haydentiff	0	0	1497412506	874837574610821120	https://twitter.com/haydentiff/status/874837574610821120				-0.06	0.564	0.9751416537331616	1.0
bitcoin 	bitcoin is by design voluntaryist, not benevolent dictatorship, nor democracy as it's designed to protect assets including for the unpopular	adam3us	154	48	1497451005	874999051380547589	https://twitter.com/adam3us/status/874999051380547589				0.15	0.0777	0.9751416537331616	1.0
bitcoin 	consensus for protocol development is not a new invention - this is maybe a instructive on IETF consensus process https://lists.linuxfoundation.org/pipermail/bitcoin-dev/2015-October/011457.html …	adam3us	1	0	1497450704	874997788542742529	https://twitter.com/adam3us/status/874997788542742529				0.20	0.0	0.9751416537331616	1.0
bitcoin 	software for complex network systems (outside of bitcoin) commonly takes >year & a foot of test docs, eg tier1 routers & they can rollback.	adam3us	6	1	1497450366	874996373447487488	https://twitter.com/adam3us/status/874996373447487488				0.21	0.0	0.9751416537331616	1.0
bitcoin 	Anyone can HF anytime, question is will users opt-in significantly, which depends on legitimacy, requires understanding # Bitcoin user ethos.	adam3us	44	5	1497441512	874959236685496322	https://twitter.com/adam3us/status/874959236685496322		#		0.50	0.0	0.9751416537331616	1.0
bitcoin 	Blockchain Beyond Bitcoin: How Blockchain Will Transform Business In 3-5 Years https://www.inc.com/john-koetsier/how-blockchain-will-transform-business-in-3-to-5-years.html … with @ jowyang via @ johnkoetsier:	WarrenWhitlock	14	12	1497465910	875061570023411712	https://twitter.com/WarrenWhitlock/status/875061570023411712			@ @	0.44	0.0	0.9751416537331616	1.0
bitcoin 	# Bitcoin # CryptoCurrency https://dollarvigilante.com/2tt pic.twitter.com/1EHziIr3Yb	DollarVigilante	1	52	1497429251	874907810303287296	https://twitter.com/DollarVigilante/status/874907810303287296		# #		0.40	0.0	0.9751416537331616	1.0
bitcoin 	GOLDMAN SACHS: # Bitcoin is looking 'heavy' http://www.businessinsider.com/bitcoin-price-goldman-sachs-2017-6 …pic.twitter.com/9rIH18XB57	dinisguarda	3	2	1497443992	874969639180173313	https://twitter.com/dinisguarda/status/874969639180173313		#		0.38	0.0	0.9751416537331616	1.0
bitcoin 	# Blockchain’s Got No ‘Killer App’ Yet, Says Morgan Stanley, Even as Bitcoin Soarshttp://flip.it/pKH_NY	dinisguarda	0	0	1497421050	874873411457232896	https://twitter.com/dinisguarda/status/874873411457232896		#		0.00	-0.296	0.9751416537331616	1.0
bitcoin 	Here are the pros and cons of # bitcoin and # blockchain http://www.businessinsider.com/bitcoin-price-and-blockchain-pros-and-cons-2017-6 …pic.twitter.com/ptHuaXuqwX	dinisguarda	1	1	1497419372	874866374765678595	https://twitter.com/dinisguarda/status/874866374765678595		# #		0.15	0.0	0.9751416537331616	1.0
bitcoin 	Morgan Stanley Says # Bitcoin Needs Regulation to Keep Risinghttps://bloom.bg/2rfrKmC	dinisguarda	1	0	1497417567	874858803916918785	https://twitter.com/dinisguarda/status/874858803916918785		#		0.10	0.0	0.9751416537331616	1.0
bitcoin 	Initial coin offerings present dangers to investors, new challenge for U.S. regulators # fintech # ICO # blockchain http://www.reuters.com/article/bc-finreg-bitcoin-ico-idUSKBN1942HF …	sbmeunier	11	15	1497454976	875015710212333568	https://twitter.com/sbmeunier/status/875015710212333568		# # #		0.21	-0.4404	0.9751416537331616	1.0
bitcoin 	# bitcoin is a sociotechnical system - requires not just technical but also social consensus mechanisms. why efforts to date have failed.https://twitter.com/brucefenton/status/874966190053101569 …	Melt_Dem	29	4	1497457345	875025643972513792	https://twitter.com/Melt_Dem/status/875025643972513792		#		0.14	-0.1702	0.9751416537331616	1.0
bitcoin 	"i love it when strangers who own no # bitcoin or tokens tell me how digital currencies work - ""satoshi, china, Silk Road, ICO, blockchains"""	Melt_Dem	150	29	1497442425	874963063832805378	https://twitter.com/Melt_Dem/status/874963063832805378		#		0.44	0.4588	0.9751416537331616	1.0
bitcoin 	Bitcoin maximalists and their gold-buggery always miss the point: Anyone can replicate a finite supply. But not Bitcoin's network effect.https://twitter.com/bitstein/status/875032337158983681 …	el33th4xor	75	22	1497460871	875040435441463297	https://twitter.com/el33th4xor/status/875040435441463297				-0.15	-0.051	0.9751416537331616	1.0
bitcoin 	Bitcoin isn't the most critical software on Earth. It's not the most valuable. It is in no way exceptional, save for its network effect.https://twitter.com/matshenricson/status/875016345871626241 …	el33th4xor	38	10	1497455314	875017126138048512	https://twitter.com/el33th4xor/status/875017126138048512				0.08	0.0314	0.9751416537331616	1.0
bitcoin 	The Rise of Digital Money Has Exploded Since Bitcoin's Creationhttps://news.bitcoin.com/digital-money-exploded-bitcoin/ …	BitcoinByte	2	2	1497410461	874828999263911936	https://twitter.com/BitcoinByte/status/874828999263911936				-0.30	0.2732	0.9751416537331616	1.0
bitcoin 	Agreed, age shouldn't matter. @ TheBlueMatt wrote some of the bitcoin wallet encryption when he was in high school.	starkness	39	2	1497470395	875080379278950404	https://twitter.com/starkness/status/875080379278950404			@	0.26	0.128	0.9751416537331616	1.0
bitcoin 	"I never heard of Book2Look before, but it's very cool. Check out, for example, ""Before Babylon, Beyond Bitcoin"" http://buff.ly/2t1NRyk pic.twitter.com/bvsAVAAtgE"	dgwbirch	7	6	1497469327	875075901704339457	https://twitter.com/dgwbirch/status/875075901704339457				0.11	0.2626	0.9751416537331616	1.0
bitcoin 	~“Blockchain, which originated in digital currency bitcoin, works as web-based processing and settlement system”http://buff.ly/2rrgTtU	dgwbirch	4	3	1497446822	874981506439106561	https://twitter.com/dgwbirch/status/874981506439106561				0.29	0.0	0.9751416537331616	1.0
bitcoin 	April the current Bitcoin average transaction fee is about $4 or something like thathttp://m.huffpost.com/us/entry/6009108 …	dgwbirch	7	6	1497433291	874924756017053701	https://twitter.com/dgwbirch/status/874924756017053701				0.50	0.3612	0.9751416537331616	1.0
bitcoin 	Banks have opinions on bitcoin prices Which says their clients are looking for opinions - because they're buying. https://twitter.com/triptananda/status/874850547861508096 …	sytaylor	14	5	1497427005	874898389649022979	https://twitter.com/sytaylor/status/874898389649022979				0.21	0.0	0.9751416537331616	1.0
bitcoin 	My guest article for @ BitcoinMagazine https://bitcoinmagazine.com/articles/op-edwhy-connecting-all-blockchains-final-step-mass-adoption/ … # bitcoin # blockchain	julianhosp	5	1	1497458049	875028597370527744	https://twitter.com/julianhosp/status/875028597370527744		# #	@	0.18	0.0	0.9751416537331616	1.0
bitcoin 	By the by, @ EFF accepts # bitcoinhttps://supporters.eff.org/donate	jgarzik	8	1	1497415813	874851446092701697	https://twitter.com/jgarzik/status/874851446092701697		#	@	0.12	0.3182	0.9751416537331616	1.0
bitcoin 	What is # Bitcoin ? asks @ PwC_UK @triptananda at # techxlr8 # Blockchain event. Asking from a Regulator perspective.pic.twitter.com/hRaZKzTHbg	gpn01	0	0	1497451592	875001513864835072	https://twitter.com/gpn01/status/875001513864835072		# # #	@ @triptananda	0.40	0.0	0.9751416537331616	1.0
bitcoin 	5/ # Bitcoin mining currently seen as much more centralized than # ether. Future of # BTC seen as more centralized, # ETH more # decentralized.pic.twitter.com/CvlMNEaynK	alexsunnarborg	0	0	1497468189	875071127403593728	https://twitter.com/alexsunnarborg/status/875071127403593728		# # # # #		0.19	0.0	0.9751416537331616	1.0
bitcoin 	4/ Respondents now view # bitcoin as a 'digital gold' & think # ether can function as a 'digital currency' as wellpic.twitter.com/XAhTXGfBkz	alexsunnarborg	0	1	1497467985	875070270230474752	https://twitter.com/alexsunnarborg/status/875070270230474752		# #		0.18	0.0	0.9751416537331616	1.0
bitcoin ethereum 	3/ Less than 5% of respondents felt negative about # ethereum while # bitcoin was extremely splitpic.twitter.com/6BQ15nDPtD	alexsunnarborg	0	0	1497467815	875069560562601984	https://twitter.com/alexsunnarborg/status/875069560562601984		# #		-0.12	-0.5719	0.9751416537331616	1.0
bitcoin ethereum 	1/ Top highlights from @ coindesk's Q1 2017 State of # Blockchain Spotlight Study on # Ethereum & # Bitcoin Sentiment… http://www.coindesk.com/charts-enthusiasm-ethereum-hit-time-high-q1/ …	alexsunnarborg	11	9	1497467532	875068373922656257	https://twitter.com/alexsunnarborg/status/875068373922656257		# # #	@	0.09	0.2023	0.9751416537331616	1.0
bitcoin 	How to sign a message!? # Bitcoin # Cryptography https://bitcointalk.org/index.php?topic=990345.0 …	onemanatatime	6	3	1497445184	874974637435768832	https://twitter.com/onemanatatime/status/874974637435768832		# #		0.10	0.0	0.9751416537331616	1.0
bitcoin 	Creditbit Gets Listed on Bittrex; Price Through the Roofhttp://www.livebitcoinnews.com/creditbit-gets-listed-bittrex-price-roof/ …	CharlieShrem	12	7	1497467055	875066371192877057	https://twitter.com/CharlieShrem/status/875066371192877057				0.44	0.0	0.9751416537331616	1.0
bitcoin 	When you see some of the most diplomatic people in # Bitcoin like @ slushcz and @ eric_lombrozo become vocal, you know shit just got real.	WhalePanda	216	59	1497441007	874957119098937345	https://twitter.com/WhalePanda/status/874957119098937345		#	@ @	0.27	-0.2732	0.9751416537331616	1.0
bitcoin 	It's a scare tactic, it's full of lies really. Yes Bitcoin's immediate future is a bit uncertain but long term it's fine.	WhalePanda	7	0	1497422353	874878876060667905	https://twitter.com/WhalePanda/status/874878876060667905				0.05	-0.1839	0.9751416537331616	1.0
bitcoin 	"""It's moon or bust."" Love it or hate it, r/Bitcoin continues to have some gem posts: http://arkinv.st/2sbAmMj  h/t @ jmonegro"	cburniske	19	5	1497471565	875085285742317569	https://twitter.com/cburniske/status/875085285742317569			@	0.50	0.064	0.9751416537331616	1.0
bitcoin ethereum 	5/ and FWIW, the intellectual network effect of # Bitcoin *and* # Ethereum developers collaborating together would be extremely powerful.	cburniske	14	8	1497452213	875004118359781378	https://twitter.com/cburniske/status/875004118359781378		# #		0.10	0.7501	0.9751416537331616	1.0
bitcoin 	4/ Importantly cornerstone # Bitcoin developers are largely intact & it's a rockstar team. Not too late 2 create a more welcoming environment	cburniske	12	4	1497452041	875003398277521408	https://twitter.com/cburniske/status/875003398277521408		#		0.26	0.5623	0.9751416537331616	1.0
bitcoin ethereum 	3/ Over time tho, if devs at the margin opt for # Ethereum over # Bitcoin then the global innovation ecosystem will weight toward $ ETH's favor	cburniske	9	3	1497451905	875002826883313664	https://twitter.com/cburniske/status/875002826883313664		# #		0.33	0.6486	0.9751416537331616	1.0
bitcoin 	2/ That said, I think we underestimate how many developers globally continue to work on # Bitcoin, even if not high-profile devs	cburniske	10	4	1497451823	875002485504700416	https://twitter.com/cburniske/status/875002485504700416		#		0.00	-0.296	0.9751416537331616	1.0
bitcoin 	Equity markets @ GoldmanSachs bearish notes = # Bitcoin @ GoldmanSachs bearish notes = 0 effect http://www.coindesk.com/goldman-sachs-bearish-bitcoin-price/ … by @ wolfiezhao	cburniske	14	3	1497446898	874981824732291072	https://twitter.com/cburniske/status/874981824732291072		#	@ @ @	0.30	0.0	0.9751416537331616	1.0
bitcoin 	the # Bitcoin plot thickenshttps://twitter.com/bitmaintech/status/874853904067985408 …	cburniske	14	7	1497444713	874972660228399104	https://twitter.com/cburniske/status/874972660228399104		#		0.00	0.0	0.9751416537331616	1.0
bitcoin 	What's irritating 2 me is we've fought this battle once w/ Bitcoin, and it was a stupid argument	cburniske	9	5	1497406588	874812755420880896	https://twitter.com/cburniske/status/874812755420880896				0.11	-0.9217	0.9751416537331616	1.0
bitcoin 	Ran into a guy. He said come to his Meetup, and promised I'd make tons of money off # Bitcoin. Same thing. How does this make $ ETH a Ponzi?	cburniske	2	1	1497405458	874808013240102912	https://twitter.com/cburniske/status/874808013240102912		#		-0.13	0.0903	0.9751416537331616	1.0
bitcoin 	5/ If you want to argue that future investors are boosting returns for current investors, guess what.. Same for # Bitcoin & most all assets!!	cburniske	39	6	1497404215	874802800173166593	https://twitter.com/cburniske/status/874802800173166593		#		0.16	0.1296	0.9751416537331616	1.0
bitcoin 	Bearish momentum continues to grow. Until # Bitcoin # Economic Nodes speak out against @ BITMAINtech's dumb # MAHF plan, this may last. $ BTCUSDpic.twitter.com/fhCOOlzNxY	ToneVays	39	26	1497476590	875106365705945093	https://twitter.com/ToneVays/status/875106365705945093		# # #	@	0.04	-0.1702	0.9751416537331616	1.0
bitcoin 	Ha, that's funny, you do know that Bitcoin is now one of their investors right?	ToneVays	0	0	1497473217	875092214480764928	https://twitter.com/ToneVays/status/875092214480764928				0.27	0.6486	0.9751416537331616	1.0
bitcoin 	Here is Greg Maxwell's (nullc on # Bitcoin Reddit) views on # SegWit2x & consider that @ Bitmain's # MAHF pan is way dumber than that!!! # UASFpic.twitter.com/q8Ezh1sG4Q	ToneVays	144	81	1497468230	875071299143467008	https://twitter.com/ToneVays/status/875071299143467008		# # # #	@	0.43	-0.2615	0.9751416537331616	1.0
bitcoin 	If # UASF # BIP148 picks up momentum before Aug 1st # Bitcoin can should up way past $3,500	ToneVays	8	3	1497464322	875054907069530112	https://twitter.com/ToneVays/status/875054907069530112		# # #		0.26	0.0	0.9751416537331616	1.0
bitcoin 	Major $ BTCUSD level is breaking now, a close < $2500 opens door back to $2k all caused by @ Bitmain's post. # Bitcoin # UASF # BIP148 # SegWitpic.twitter.com/jryBrfAspa	ToneVays	69	29	1497459993	875036749151514626	https://twitter.com/ToneVays/status/875036749151514626		# # # #	@	0.33	0.0	0.9751416537331616	1.0
bitcoin 	In 1h(11am ET) going LIVE to provide my thoughts on @ BITMAINtech's # MAHF on # Bitcoin $ BTCUSD https://blog.bitmain.com/en/uahf-contingency-plan-uasf-bip148/ … https://www.youtube.com/watch?v=bdgdiBUUAn8 …	ToneVays	68	40	1497449655	874993390991048705	https://twitter.com/ToneVays/status/874993390991048705		# #	@	0.33	0.0	0.9751416537331616	1.0
bitcoin 	1. @ BITMAINtech is threatening a Miner Activated Hard Fork # MAHF. (& a Stealth one at that). # Bitcoin # UASF # SegWithttps://blog.bitmain.com/en/uahf-contingency-plan-uasf-bip148/ …	ToneVays	94	43	1497447571	874984649713479680	https://twitter.com/ToneVays/status/874984649713479680		# # # #	@	0.38	-0.1658	0.9751416537331616	1.0
bitcoin 	Looks like we r about to have a bigger # Bitcoin pullback. @ BITMAINtech threat to crate a # MAHF + Lies/FUD already started $ BTCUSD sellingpic.twitter.com/3KyXJU8hxU	ToneVays	114	59	1497447424	874984031925960704	https://twitter.com/ToneVays/status/874984031925960704		# #	@	0.19	-0.0827	0.9751416537331616	1.0
bitcoin 	Bitcoin high board jump 2578 -5.86% Days high was 2828 Puts hair on your chest	Sunchartist	1	1	1497468693	875073239503994881	https://twitter.com/Sunchartist/status/875073239503994881				0.00	0.0	0.9751416537331616	1.0
bitcoin 	Bitcoin 7.50% range today ok not a sideways movement 2618	Sunchartist	2	0	1497448364	874987976845017091	https://twitter.com/Sunchartist/status/874987976845017091				-0.30	0.296	0.9751416537331616	1.0
bitcoin 	The low volatility in most asset classes is forcing people to 1) sell vol 2) take up watching paint drying as vocation 4) trade Bitcoin	Sunchartist	5	7	1497418963	874864658473263105	https://twitter.com/Sunchartist/status/874864658473263105				0.28	0.1761	0.9751416537331616	1.0
bitcoin 	Any intraday move in Bitcoin <2.5% is the new sideways price action	Sunchartist	2	0	1497418332	874862012181958656	https://twitter.com/Sunchartist/status/874862012181958656				0.67	0.0	0.9751416537331616	1.0
