currency	tweet	username	favorites	retweets	date	id	permalink	geo	hashtags	mentions	lex_sent	vader_sent	cnn_sent	cnn_pos_neg
bitcoin ethereum 	/r/btc, /r/bitcoin and many others (realistically ethereum too) would say otherwise :)	VitalikButerin	5	3	1509890026	927172087512485888	https://twitter.com/VitalikButerin/status/927172087512485888				-0.08	0.4588	0.9781360916832559	1.0
bitcoin 	There is a price point, probably around $100K, when # Bitcoin HODL’ers become spenders; price volatility stabilizes, and a currency is born.	maxkeiser	817	300	1509917327	927286596583526400	https://twitter.com/maxkeiser/status/927286596583526400		#		0.59	0.0	0.9781360916832559	1.0
bitcoin 	Gold was a store of value before it became a currency. Same thing with # Bitcoin, but time line speeded up by hundreds of thousands of yrs.	maxkeiser	292	128	1509915438	927278672784101376	https://twitter.com/maxkeiser/status/927278672784101376		#		-0.22	0.17	0.9781360916832559	1.0
bitcoin 	Hey fuckwit Saudi princes. Any money you have *not* in # Bitcoin you’ll lose. I’ll sell you some for $25,000 each.	maxkeiser	270	67	1509912915	927268089988894720	https://twitter.com/maxkeiser/status/927268089988894720		#		-0.29	-0.134	0.9781360916832559	1.0
bitcoin 	# Bitcoin should be Sharia compliant since it’s not an interest bearing instrument (just like Gold). Muslims should be all over BTC.https://twitter.com/rt_com/status/926989945541083136 …	maxkeiser	116	64	1509911098	927260471299858432	https://twitter.com/maxkeiser/status/927260471299858432		#		0.18	0.0017	0.9781360916832559	1.0
bitcoin 	This guy wrote an excellent book... So there’s that.https://www.amazon.com/Bitcoin-Standard-Decentralized-Alternative-Central/dp/1119473861 …	maxkeiser	9	1	1509903691	927229402567540736	https://twitter.com/maxkeiser/status/927229402567540736				0.89	0.1906	0.9781360916832559	1.0
bitcoin 	$9,000 # Bitcoin? Remember, the Beatles predicted it. Played backwards, clearly begs to be freed from fiat.https://youtu.be/oKBtfnGVuGs	maxkeiser	45	8	1509903042	927226680070066178	https://twitter.com/maxkeiser/status/927226680070066178		#		0.00	0.2594	0.9781360916832559	1.0
bitcoin 	Using # Bitcoin’s name claiming to know Satoshi’s true vision is goofy. Call it something else, dudes.https://twitter.com/saifedean/status/927089958908825600 …	maxkeiser	35	13	1509902063	927222576518172672	https://twitter.com/maxkeiser/status/927222576518172672		#		0.29	0.1953	0.9781360916832559	1.0
bitcoin 	Hahaha! No # Bitcoin fuckwit. Who’s laughing now camel boy!https://twitter.com/zerohedge/status/927204876031025152 …	maxkeiser	169	65	1509897960	927205366663917569	https://twitter.com/maxkeiser/status/927205366663917569		#		-0.10	0.2109	0.9781360916832559	1.0
bitcoin 	$8,000 soon in the rear view mirror. # Bitcoinpic.twitter.com/3Xm91IBWSo	maxkeiser	265	94	1509889769	927171008234246145	https://twitter.com/maxkeiser/status/927171008234246145		#		0.33	0.0	0.9781360916832559	1.0
bitcoin 	Why else would the price relative to Bitcoin matter?	SatoshiLite	6	1	1509911577	927262478102290432	https://twitter.com/SatoshiLite/status/927262478102290432				0.22	0.0258	0.9781360916832559	1.0
bitcoin 	Define mainstream. Bitcoin isn't even mainstream yet. But either way, LN will be mainstream eventually.	SatoshiLite	13	1	1509906651	927241816411316224	https://twitter.com/SatoshiLite/status/927241816411316224				0.00	0.0	0.9781360916832559	1.0
bitcoin 	Yes, it would. Would need time. High fees is not the purpose, just unfortunate because Bitcoin is too popular and useful.	SatoshiLite	1	0	1509861220	927051267146313728	https://twitter.com/SatoshiLite/status/927051267146313728				0.14	0.2679	0.9781360916832559	1.0
bitcoin 	Email from Daniel Vogel at @ bitso clearly describes why Segwit2x utterly fails to upgrade Bitcoin. The point was to not split the community!https://twitter.com/coinswawin/status/926160037055287297 …	SatoshiLite	681	225	1509861160	927051013512609793	https://twitter.com/SatoshiLite/status/927051013512609793			@	-0.04	-0.0337	0.9781360916832559	1.0
bitcoin 	I believe Samson is a Bitcoin maximalist	SatoshiLite	23	0	1509842876	926974325269315584	https://twitter.com/SatoshiLite/status/926974325269315584				0.00	0.0	0.9781360916832559	1.0
bitcoin 	There's a dedicated group of people that spend each day harassing anyone who promotes the original vision for Satoshi’s Bitcoin.pic.twitter.com/Tx6cpBikxI	rogerkver	502	151	1509896380	927198739009224705	https://twitter.com/rogerkver/status/927198739009224705				0.25	0.6369	0.9781360916832559	1.0
bitcoin 	Yeah, Bitcoin works great for $7300 transactions. Just not for, you know, peer to peer electronic cash.	ErikVoorhees	31	2	1509846130	926987973366833152	https://twitter.com/ErikVoorhees/status/926987973366833152				1.00	0.3715	0.9781360916832559	1.0
bitcoin 	No way! @ mklords was at this month’s Michigan Peace & Liberty Coalition meetup! So AWESOME to meet IRL! # LiveFree # Bitcoin # MPLCpic.twitter.com/DthTrH4lTM	haydentiff	49	4	1509913846	927271995280187392	https://twitter.com/haydentiff/status/927271995280187392		# # #	@	0.24	0.2985	0.9781360916832559	1.0
bitcoin ripple 	Ripple's ledger headers are like Bitcoin's block headers, both chain & incorporate txns by hash. Ask your mom to explain what a database is	haydentiff	15	2	1509837043	926949859688579073	https://twitter.com/haydentiff/status/926949859688579073				0.08	-0.0513	0.9391262392362864	-1.0
bitcoin 	It’s also much easier to get a bitcoin address rather than jumping through the exchange hoops to get verified.	stacyherbert	4	1	1509910196	927256685311381505	https://twitter.com/stacyherbert/status/927256685311381505				0.11	0.4215	0.9781360916832559	1.0
bitcoin 	Saudi govt says it can freeze assets of those arrested. Too bad the prince didn’t have at least some of his wealth stored in bitcoin.https://twitter.com/alaidi/status/926972243388915714 …	stacyherbert	165	55	1509843159	926975513054339072	https://twitter.com/stacyherbert/status/926975513054339072				-0.20	-0.1244	0.9781360916832559	1.0
bitcoin 	these polls used to get 75% against. I wonder if some was a bluff, hoping Bitcoiners would blink. by the time of fork 90-95% against?	adam3us	6	0	1509865219	927068040008679424	https://twitter.com/adam3us/status/927068040008679424				-0.04	0.1405	0.9781360916832559	1.0
bitcoin 	asked @ jgarzik about replay a number of times. seems intent to disrupt Bitcoin network and create risk, user confusion & *support tickets*	adam3us	31	6	1509863828	927062207879307264	https://twitter.com/adam3us/status/927062207879307264			@	-0.13	-0.1094	0.9781360916832559	1.0
bitcoin 	see this video https://www.youtube.com/watch?v=mmSuxqaKR2U&t=191s … & slides https://drive.google.com/file/d/0B6BtzFqUPARhSl90VU1BRVdQSzg/view … for an explainer of scaling limits & # Bitcoin's differentiated value	adam3us	19	5	1509852223	927013530817019904	https://twitter.com/adam3us/status/927013530817019904		#		0.22	0.34	0.9781360916832559	1.0
bitcoin 	could someone ask @ bobbyclee if he'll buy B2X at 7:2? not found any buyers and in his AMA he was strident about B2X *is* bitcoin.	adam3us	40	1	1509845268	926984358627393537	https://twitter.com/adam3us/status/926984358627393537			@	0.15	0.0	0.9781360916832559	1.0
bitcoin 	bitcoin, # blockchain skills rise in demand as # cryptocurrency values balloon # cybersecurity # fintech https://goo.gl/fKaYGa pic.twitter.com/ZK3g1rwsk8	sbmeunier	3	1	1509902094	927222706516447233	https://twitter.com/sbmeunier/status/927222706516447233		# # # #		0.29	0.296	0.9781360916832559	1.0
bitcoin 	5 indexes have been created to track # bitcoin & other # cryptocurrencies. # blockchain # fintech # insurtech https://buff.ly/2xMloOd	sbmeunier	4	3	1509887040	927159563903741953	https://twitter.com/sbmeunier/status/927159563903741953		# # # # #		0.40	0.125	0.9781360916832559	1.0
bitcoin 	# bitcoin bubble talk intensifies as a new bank eyes # blockchain # fintech https://bloom.bg/2zgiZ0m pic.twitter.com/JWYulIMSSe	sbmeunier	6	8	1509883593	927145107056463872	https://twitter.com/sbmeunier/status/927145107056463872		# # #		0.33	0.0	0.9781360916832559	1.0
bitcoin 	Indonesia is ripe for # cryptocurrency disruption. Could it be Asia's next # bitcoin hub? # blockchain # fintech http://on.forbes.com/60178heDV pic.twitter.com/ZtiRR5gSWF	sbmeunier	0	2	1509867073	927075815229190144	https://twitter.com/sbmeunier/status/927075815229190144		# # # #		0.20	-0.1204	0.9781360916832559	1.0
bitcoin 	4 ways to secure your bags... # bitcoin, # altcoins, # cryptoasset tokens, whatever. A @ notsofast se… https://steemit.com/bitcoin/@notsofast/4-ways-to-secure-your-bags-bitcoin-altcoins-cryptoasset-tokens-whatever-a-notsofast-security-primer … via @ BoehmMathias	thomaspower	6	2	1509908478	927249480906244096	https://twitter.com/thomaspower/status/927249480906244096		# # #	@ @notsofast @	0.18	0.17	0.9781360916832559	1.0
bitcoin 	These International Bitcoin Communities Are Rejecting SegWit2x https://bitcoinmagazine.com/articles/these-international-bitcoin-communities-are-rejecting-segwit2x … via @ helmi @ rosspower	thomaspower	0	0	1509907416	927245027818070016	https://twitter.com/thomaspower/status/927245027818070016			@ @	0.15	-0.4588	0.9781360916832559	1.0
bitcoin 	"""Businesses finally are offering special prices to customers who pay with bitcoin"" https://np.reddit.com/r/btc/comments/7awpft/the_state_of_bitcoin_in_one_image/ … from @ JorgeStolfi"	el33th4xor	20	8	1509918801	927292780187127808	https://twitter.com/el33th4xor/status/927292780187127808			@	0.12	0.3182	0.9781360916832559	1.0
bitcoin 	Good opsec advice, some of it from yours truly.https://www.wired.com/story/how-to-keep-bitcoin-safe-and-secure/ …	el33th4xor	59	33	1509895116	927193436603736064	https://twitter.com/el33th4xor/status/927193436603736064				0.44	0.3502	0.9781360916832559	1.0
bitcoin 	Peak Bitcoin drama: CEO gets called a troll and gets banned from slack. https://twitter.com/WhalePanda/status/926696840988372992 …	el33th4xor	31	6	1509857492	927035631938801666	https://twitter.com/el33th4xor/status/927035631938801666				0.07	-0.2294	0.9781360916832559	1.0
bitcoin 	Celebrity curb on cryptocurrencies # ICO # blockchain # ETH # Bitcoinhttp://www.thetimes.co.uk/article/138676be-c19a-11e7-bb93-ec140220d4de …	BitcoinByte	2	1	1509875770	927112295553077249	https://twitter.com/BitcoinByte/status/927112295553077249		# # # #		0.33	0.0	0.9781360916832559	1.0
bitcoin 	Hysterical truths and risks of # bitcoin. I enjoyed this read.https://twitter.com/tomgartner/status/926881255056134145 …	GerberKawasaki	2	0	1509902580	927224743555620866	https://twitter.com/GerberKawasaki/status/927224743555620866		#		0.18	0.2212	0.9781360916832559	1.0
bitcoin 	Amazon Coin registers cryptocurrency domain names http://mailchi.mp/oliverbussmann/amazon-coin-registers-cryptocurrency-domain-names-former-swiss-bank-execs-launch-blockchain-investment-firm-cme-launching-bitcoin-futures-in-q4 …	obussmann	3	6	1509865426	927068908053508096	https://twitter.com/obussmann/status/927068908053508096				0.14	0.1779	0.9781360916832559	1.0
bitcoin 	Investments can go down as well as up ... bitcoin price likely to sink 20%+ after the Segwit2x fork so wait till end of month	Chris_Skinner	0	0	1509911065	927260331906338816	https://twitter.com/Chris_Skinner/status/927260331906338816				0.40	0.2732	0.9781360916832559	1.0
bitcoin 	Just found two bitcoins that I brought a few years ago and forgot about ... feeling good	Chris_Skinner	54	1	1509894501	927190856909688834	https://twitter.com/Chris_Skinner/status/927190856909688834				0.35	0.5267	0.9781360916832559	1.0
bitcoin 	99%? What do you mean? 0.01% of Bitcoin addresses hold 40% of the coins.	dgwbirch	4	1	1509853661	927019561173401602	https://twitter.com/dgwbirch/status/927019561173401602				-0.14	0.0	0.9781360916832559	1.0
bitcoin 	Should have used Bitcoin, right @ BitcoinRat?https://twitter.com/sarah_yusufi/status/926918433710755841 …	dgwbirch	5	1	1509843191	926975649381789696	https://twitter.com/dgwbirch/status/926975649381789696			@	0.14	0.0	0.9781360916832559	1.0
bitcoin 	Will the average fee become greater than the maximum Lightning transaction? https://medium.com/@rusty_lightning/bitcoin-lightning-faq-why-the-0-042-bitcoin-limit-2eb48b703f3 …https://twitter.com/erikvoorhees/status/926791347016646658 …	gavinandresen	173	60	1509891070	927176468878299137	https://twitter.com/gavinandresen/status/927176468878299137			@rusty_lightning	0.42	0.1806	0.9781360916832559	1.0
bitcoin 	Store of value precedes medium of exchange which precedes unit of account. # bitcoinhttps://twitter.com/maxkeiser/status/927278672784101376 …	jonmatonis	42	11	1509915603	927279366765203458	https://twitter.com/jonmatonis/status/927279366765203458		#		0.21	0.17	0.9781360916832559	1.0
bitcoin 	Bitcoiners in Lisbon! # bitcoin # websummit2017pic.twitter.com/STb8jKM9MQ	bitentrepreneur	19	2	1509907172	927244003946434560	https://twitter.com/bitentrepreneur/status/927244003946434560		# #		0.29	0.0	0.9781360916832559	1.0
bitcoin 	could be that the NK government is interested in teaching their students about BITCOIN because of the geopolitical implications	bitentrepreneur	0	0	1509882503	927140536028409857	https://twitter.com/bitentrepreneur/status/927140536028409857				0.21	0.4019	0.9781360916832559	1.0
bitcoin 	Bitcoin hits the mainstream, but is it really 'the new gold'?'http://www.telegraph.co.uk/investing/news/bitcoin-hits-mainstream-really-new-gold/ …	robdgill	0	0	1509872287	927097684397305856	https://twitter.com/robdgill/status/927097684397305856				0.36	0.0	0.9781360916832559	1.0
bitcoin 	A lot of people have piled their ancap hopes up around bitcoin but without things like land registries it’s entirely dependent on the State.	leashless	0	0	1509905002	927234903820914688	https://twitter.com/leashless/status/927234903820914688				0.12	-0.1938	0.9781360916832559	1.0
bitcoin 	Silk Road still hugely contaminates Bitcoin's reputation in the mainstream.	leashless	0	0	1509870094	927088487324667904	https://twitter.com/leashless/status/927088487324667904				0.00	0.0	0.9781360916832559	1.0
bitcoin 	"Oh the irony...The guy who said Bitcoin is ""enron in the making"" arrested as part of anti-corruption probe.https://www.bloomberg.com/news/articles/2017-11-05/alwaleed-saudi-purge-s-richest-victim-has-assets-across-globe …"	CremeDeLaCrypto	89	33	1509908483	927249500632104960	https://twitter.com/CremeDeLaCrypto/status/927249500632104960				-0.06	-0.2384	0.9781360916832559	1.0
bitcoin 	Listening to Andrew Poelstra @ ScalingBitcoinpic.twitter.com/hDIRTJ9ctF	CremeDeLaCrypto	23	0	1509908139	927248058936467456	https://twitter.com/CremeDeLaCrypto/status/927248058936467456			@	0.17	0.0	0.9781360916832559	1.0
bitcoin 	Interesting implication from @ Avivz78 talk @ ScalingBitcoin: miners much better off economically with lightning network than without	CremeDeLaCrypto	59	12	1509906899	927242858570006528	https://twitter.com/CremeDeLaCrypto/status/927242858570006528			@ @	0.22	0.6808	0.9781360916832559	1.0
bitcoin 	@ MaxKeiser # Prince # Alwaleed last week said $ BTC was a scam and compared bitcoin to # Enron ... today he was arrested on # corruption charges	RonnieMoas	14	5	1509891737	927179262754467840	https://twitter.com/RonnieMoas/status/927179262754467840		# # # #	@	-0.07	-0.836	0.9781360916832559	1.0
bitcoin 	# Prince # Alwaleed last week said $ BTC # Bitcoin was a scam and compared bitcoin to # Enron ... today he was arrested on # corruption charges	RonnieMoas	42	18	1509891565	927178544383488000	https://twitter.com/RonnieMoas/status/927178544383488000		# # # # #		-0.07	-0.836	0.9781360916832559	1.0
bitcoin 	Check out http://lopp.net/bitcoin.html	lopp	0	0	1509920472	927299790022443008	https://twitter.com/lopp/status/927299790022443008				-0.67	0.0	0.9781360916832559	1.0
bitcoin 	"""By observing the mempool to strategically reduce tx fee estimates, can save up to 80% vs Core fee estimates."" - @ kallewoof @ ScalingBitcoin"	lopp	60	12	1509920409	927299522903945217	https://twitter.com/lopp/status/927299522903945217			@ @	0.12	0.3454	0.9781360916832559	1.0
bitcoin 	Multiple ways this could be accomplished; one example is BIP115 by @ LukeDashjr https://github.com/bitcoin/bips/blob/master/bip-0115.mediawiki#Deployment …https://twitter.com/lopp/status/927292690189783040 …	lopp	18	4	1509918950	927293406119784448	https://twitter.com/lopp/status/927293406119784448		#Deployment	@	0.57	0.4404	0.9781360916832559	1.0
bitcoin 	"""Generic replay protection can be added to Bitcoin by having transactions commit to block hash at a given height."" - @ ajtown @ ScalingBitcoin"	lopp	29	8	1509918780	927292690189783040	https://twitter.com/lopp/status/927292690189783040			@ @	0.08	-0.089	0.9781360916832559	1.0
bitcoin 	"""Forking is cheap (for developers.) No matter how undesirable it is, you can't stop it. Costs are externalized."" - @ ajtowns @ ScalingBitcoin"	lopp	70	15	1509917899	927288996891320320	https://twitter.com/lopp/status/927288996891320320			@ @	0.22	-0.1197	0.9781360916832559	1.0
bitcoin 	Adaptor Signatures look like normal multisig on the blockchain, masking more exotic protocols being used under the hood. # ScalingBitcoin	lopp	33	8	1509908077	927247798562471937	https://twitter.com/lopp/status/927247798562471937		#		0.15	0.1806	0.9781360916832559	1.0
bitcoin 	"""If contract execution is performed by publishing to blockchain, miners can inspect & exclude certain ones."" Andrew Poelstra # ScalingBitcoin"	lopp	90	27	1509907009	927243321608511488	https://twitter.com/lopp/status/927243321608511488		#		0.15	0.0258	0.9781360916832559	1.0
bitcoin 	"""Miner revenue is lower in a world where Lightning has a smaller #of users, but is higher when adoption is high"" - @ Avivz78 @ ScalingBitcoin"	lopp	36	2	1509905870	927238542622732288	https://twitter.com/lopp/status/927238542622732288		#of	@ @	0.62	-0.1531	0.9781360916832559	1.0
bitcoin 	"""If a payment channel is funded in a balanced fashion, doubling of value quadruples expected channel lifetime."" - @ Avivz78 @ ScalingBitcoin"	lopp	18	4	1509904954	927234700770361344	https://twitter.com/lopp/status/927234700770361344			@ @	0.14	0.17	0.9781360916832559	1.0
bitcoin 	"Bcash ""fired"" Bitcoin Core Bgold ""fires"" ASIC miners. B2X ""fires"" sovereign users."	lopp	444	111	1509904540	927232965729386496	https://twitter.com/lopp/status/927232965729386496				0.17	0.0	0.9781360916832559	1.0
bitcoin 	"""Ethernet wasn't the best protocol but it had the right group of people excited about it."" - @ Joi @ ScalingBitcoin"	lopp	100	23	1509902586	927224769065361408	https://twitter.com/lopp/status/927224769065361408			@ @	0.62	0.1151	0.9781360916832559	1.0
bitcoin 	In 11 days we will discover who holds more power in Bitcoin: the silent apathetic majority or the loud convicted minority.	lopp	517	121	1509899740	927212831165972481	https://twitter.com/lopp/status/927212831165972481				0.14	-0.296	0.9781360916832559	1.0
bitcoin 	"""Bitcoin's value comes from the inherent failures, limitations, and inconveniences of fiat money."" - @ bobbyclee @ ScalingBitcoin"	lopp	207	63	1509843309	926976143974006786	https://twitter.com/lopp/status/926976143974006786			@ @	-0.17	-0.0766	0.9781360916832559	1.0
bitcoin 	"""In China, Bitcoin is not about payments and spending. It's about investing and speculative trading."" - @ bobbyclee @ ScalingBitcoin"	lopp	122	33	1509842740	926973757125562368	https://twitter.com/lopp/status/926973757125562368			@ @	0.35	0.0342	0.9781360916832559	1.0
bitcoin 	You can buy small fractions of a bitcoin, but if you didn't know that before reading this then you shouldn't because you aren't ready yet.	lopp	751	192	1509841484	926968489234927616	https://twitter.com/lopp/status/926968489234927616				-0.04	-0.395	0.9781360916832559	1.0
bitcoin 	See below. With that said, Bitcoin as digital gold is distinct from Bitcoin as a technology platform. http://blog.ycombinator.com/the-startup-zeitgeist/ …pic.twitter.com/ur7XAHraFi	balajis	24	20	1509907168	927243987273916416	https://twitter.com/balajis/status/927243987273916416				0.17	0.0	0.9781360916832559	1.0
bitcoin 	Mark & Josh are both smart. The range of opinion in VC on Bitcoin is now between “has merit” & “changes everything”. Big shift from 2015. https://twitter.com/msuster/status/927221352477499392 …	balajis	173	43	1509905032	927235028240576513	https://twitter.com/balajis/status/927235028240576513				0.11	0.1005	0.9781360916832559	1.0
bitcoin 	After the hard fork, price and the markets will be the final arbiter of what chain shall be called # Bitcoin. Everyone follows the money	CryptoHustle	56	18	1509903788	927229810346209281	https://twitter.com/CryptoHustle/status/927229810346209281		#		-0.04	-0.0513	0.9781360916832559	1.0
bitcoin 	When famous people talk ignorant shit about # Bitcoin, we have to suffer through weeks of news coverage about it.	CryptoHustle	136	28	1509902142	927222905901146112	https://twitter.com/CryptoHustle/status/927222905901146112		#		0.30	-0.8481	0.9781360916832559	1.0
bitcoin 	I've noticed a correlation of fraudsters calling # Bitcoin a scam.	CryptoHustle	118	10	1509851655	927011147307409408	https://twitter.com/CryptoHustle/status/927011147307409408		#		0.00	-0.7964	0.9781360916832559	1.0
bitcoin 	https://www.reuters.com/article/saudi-kingdom-holding-bitcoin/update-1-bitcoin-is-enron-in-the-making-saudi-prince-alwaleed-says-idUSL8N1MY411 …	westcoastbill	2	0	1509841371	926968014947229696	https://twitter.com/westcoastbill/status/926968014947229696				0.00	0.0	0.9781360916832559	1.0
bitcoin 	If I recall, the prince recently called Bitcoin a fraud # kettleblackhttps://twitter.com/danprimack/status/926966831289597952 …	westcoastbill	4	0	1509841307	926967746654375936	https://twitter.com/westcoastbill/status/926967746654375936		#		-0.17	-0.5859	0.9781360916832559	1.0
bitcoin 	My trip to Zimbabwe several years ago is what first prompted my interest in bitcoin. 79 billion+ % inflation ain't no jokehttps://twitter.com/NeerajKA/status/925347530153578501 …	AriannaSimpson	34	7	1509848648	926998534599065600	https://twitter.com/AriannaSimpson/status/926998534599065600				0.32	0.2294	0.9781360916832559	1.0
bitcoin 	I don't think @ ScalingBitcoin is a good place to have talks pumping coins, even if they're Bitcoin.https://twitter.com/jinglanW/status/926973921584226304 …	peterktodd	135	11	1509843554	926977171372912641	https://twitter.com/peterktodd/status/926977171372912641			@	0.39	0.2202	0.9781360916832559	1.0
bitcoin 	"""PIGS... they get Slaughtered""-Gordon Ghekko, Wall Street 2 'Might' be 1 more # Bitcoin $ BTCUSD push higher next week. But I'm Calling a TOPpic.twitter.com/Pa5JfIaEyl"	ToneVays	790	482	1509916333	927282429064200192	https://twitter.com/ToneVays/status/927282429064200192		#		0.00	0.0	0.9781360916832559	1.0
bitcoin 	I was just joking, I didn't tweet anything today about the # Bitcoin $ BTCUSD price	ToneVays	48	2	1509916155	927281680158621696	https://twitter.com/ToneVays/status/927281680158621696		#		0.25	0.2263	0.9781360916832559	1.0
bitcoin 	Great talk @ Joi @ ScalingBitcoin on why # ICO's r bad to fund ur startup & he advises against it. # ScalingBitcoinhttps://scalingbitcoin.org/live	ToneVays	51	16	1509905004	927234910460489728	https://twitter.com/ToneVays/status/927234910460489728		# #	@ @	0.48	0.0766	0.9781360916832559	1.0
bitcoin 	Today's Game Plan 1. Hear # ScalingBitcoin talks 2. Keep people posted on Daily/4hr/1h 9's Pull-Back 3. Make # ICO speech for # FintechWorld DC	ToneVays	156	10	1509904279	927231867752820736	https://twitter.com/ToneVays/status/927231867752820736		# # #		0.28	0.0	0.9781360916832559	1.0
bitcoin 	Going LIVE w/ @ Truthcoin on @ WorldCryptoNet to talk # NYA # NO2X joined by @ jimmysong # Bitcoinhttps://www.youtube.com/watch?v=JxPwsxIWP30 …	ToneVays	78	26	1509844994	926983211485245440	https://twitter.com/ToneVays/status/926983211485245440		# # #	@ @ @	0.45	0.0	0.9781360916832559	1.0
