currency	tweet	username	favorites	retweets	date	id	permalink	geo	hashtags	mentions	lex_sent	vader_sent	cnn_sent	cnn_pos_neg
bitcoin 	I don't believe they can steal the coins, but I still do believe chinese gov has practical ability to kill bitcoin through PoW manipulation	VitalikButerin	29	7	1494034459	860669021254893568	https://twitter.com/VitalikButerin/status/860669021254893568				-0.21	-0.8591	0.9498589200280773	1.0
bitcoin 	I'm on the sidelines for alts. I may get back into Bitcoin at some point but no longer discussing my positions publicly.	VinnyLingham	1	1	1494039472	860690045748920320	https://twitter.com/VinnyLingham/status/860690045748920320				0.23	-0.2107	0.9498589200280773	1.0
bitcoin litecoin 	Now it makes sense why Litecoin is getting SegWit before Bitcoin, fixing transaction maleability. B/c gold is more malleable than silver! https://twitter.com/aureliorrosa/status/860629536039477250 …	SatoshiLite	133	30	1494025813	860632754077155328	https://twitter.com/SatoshiLite/status/860632754077155328				0.23	0.0	0.9864554619633984	1.0
bitcoin 	No one knows the answer to that. To claim that Bitcoin would be $5000 without this debate is ridiculous.	SatoshiLite	7	0	1494024528	860627367034671104	https://twitter.com/SatoshiLite/status/860627367034671104				0.11	-0.3286	0.9864554619633984	1.0
bitcoin 	What do you mean instead of bitcoin? Bitcoin is taking off also. Just that it takes a lot more capital to move bitcoin than alts.	SatoshiLite	7	0	1494023988	860625100420272128	https://twitter.com/SatoshiLite/status/860625100420272128				0.16	0.0	0.9864554619633984	1.0
bitcoin 	# Bitcoin forces us to reconsider whether we actually understood what money is in the first place.https://youtu.be/ONvg9SbauMg?t=23m20s …	aantonop	380	207	1494077566	860849825243435010	https://twitter.com/aantonop/status/860849825243435010		#		-0.12	0.0	0.9498589200280773	1.0
bitcoin 	ViaBTC signaling segwit would bump support from 32% to 38% of the hashrate, and drop Bitcoin Unlimited from 40% to 35%.https://twitter.com/ViaBTC/status/860933165002522625 …	TuurDemeester	78	26	1494100342	860945353264300033	https://twitter.com/TuurDemeester/status/860945353264300033				-0.24	0.0766	0.9498589200280773	1.0
bitcoin 	Why I never outright accept academic conclusions on Bitcoin: authors often lag behind, don't read core dev listserv.https://www.reddit.com/r/Bitcoin/comments/58x26m/bitcoin_is_unstable_without_the_block_reward/d98acfj/ …	TuurDemeester	74	24	1494099857	860943317328158722	https://twitter.com/TuurDemeester/status/860943317328158722				0.17	-0.2775	0.9498589200280773	1.0
bitcoin ethereum 	After the block size debate in Bitcoin, brace for the Ethereum gas fee debate.https://twitter.com/lopp/status/860497238321135617 …	TuurDemeester	95	42	1494024655	860627899480764416	https://twitter.com/TuurDemeester/status/860627899480764416				0.36	-0.2202	0.9864554619633984	1.0
bitcoin 	# government - for your ledgers of last resort - http://www.zyen.com/Articles/CIRapril2017%20Pages4-7.pdf … - # blockchain @ leashless @ BitcoinByte @ commonwealthsec @ goodenoughc	mrmainelli	2	3	1494072198	860827306948001793	https://twitter.com/mrmainelli/status/860827306948001793		# #	@ @ @ @	0.45	0.0	0.9498589200280773	1.0
bitcoin 	In 6 months Bitcoin has nearly doubled in price & @ GlobalBoost $ BSTY # blockchain surging as well. # MAGA # TrumpTrainhttps://twitter.com/networksmanager/status/812454235598155776 …	NetworksManager	22	27	1494073028	860830789793193984	https://twitter.com/NetworksManager/status/860830789793193984		# # #	@	0.48	0.1366	0.9498589200280773	1.0
bitcoin 	Bitcoin just soared to a new $1,600 high — but the first investor in Snapchat thinks it could hit $500,000 by 2030http://read.bi/2qGj7St	WarrenWhitlock	15	14	1494060241	860777156154187777	https://twitter.com/WarrenWhitlock/status/860777156154187777				0.23	0.0	0.9498589200280773	1.0
bitcoin 	Protectionist # Trump Policies To Crash Dollar, # Gold and # Bitcoin to Soar https://dollarvigilante.com/blog/2016/12/07/protectionist-trump-policies-crash-dollar-gold-bitcoin-soar.html …pic.twitter.com/bUS63tMcM2	DollarVigilante	9	113	1494065833	860800610530144261	https://twitter.com/DollarVigilante/status/860800610530144261		# # #		0.27	-0.4019	0.9498589200280773	1.0
bitcoin 	"Yes, look up ""bitcoin child pays for parent"" ""bitcoin replace by fee"" and ""viabtc transaction accelerator"" depending on your situation"	el33th4xor	3	0	1494105807	860968274523078657	https://twitter.com/el33th4xor/status/860968274523078657				0.15	0.4019	0.9498589200280773	1.0
bitcoin 	"Are they doing that dumb ""trick"" again? http://hackingdistributed.com/2017/02/27/smallest-first-bad-for-bitcoin/ …"	el33th4xor	1	0	1494088458	860895506934841344	https://twitter.com/el33th4xor/status/860895506934841344				-0.50	-0.2553	0.9498589200280773	1.0
bitcoin ethereum 	Are there any Bitcoin/Ethereum/blockchain gatherings tonight in the Bay Area?	el33th4xor	9	6	1494024829	860628630933721089	https://twitter.com/el33th4xor/status/860628630933721089				-0.10	0.0	0.9864554619633984	1.0
bitcoin 	Very easy to put something fake in there based on a real bitcoin tx.	starkness	1	0	1494029701	860649062890053633	https://twitter.com/starkness/status/860649062890053633				0.43	0.3804	0.9498589200280773	1.0
bitcoin 	Um, just because a bitcoin transaction occurred doesn't mean it was linked to this or sent to those addresses?	starkness	1	0	1494029667	860648922275958784	https://twitter.com/starkness/status/860648922275958784				-0.16	0.0	0.9498589200280773	1.0
bitcoin 	Wow. # bitcoin has quietly rallied to $1580. Amazing run. This is now an epic rally. Thanks @ brockpierce @ kazonomics for teaching.	GerberKawasaki	21	7	1494092939	860914304932954112	https://twitter.com/GerberKawasaki/status/860914304932954112		#	@ @	0.74	0.3224	0.9498589200280773	1.0
bitcoin 	Do you think that the Bitcoin price reflects investors switching from gold? I seriously doubt this.	dgwbirch	1	0	1494104350	860962165917929472	https://twitter.com/dgwbirch/status/860962165917929472				0.50	-0.247	0.9498589200280773	1.0
bitcoin 	Surely the price of gold will plummet as seasoned and informed investors dump it for bitcoin. That is who is buying bitcoin, right?https://twitter.com/wef/status/860688831699353601 …	dgwbirch	15	5	1494094107	860919202831585280	https://twitter.com/dgwbirch/status/860919202831585280				0.57	0.0257	0.9498589200280773	1.0
bitcoin 	"Good thread from @ ARKblockchain on why finance's future is in open, permissionless bitcoin/ cryptoassets, not ""blockchain without bitcoin.""https://twitter.com/arkblockchain/status/860925947079536640 …"	mikejcasey	18	11	1494103475	860958495864172544	https://twitter.com/mikejcasey/status/860958495864172544			@	0.32	0.2202	0.9498589200280773	1.0
bitcoin 	Bitcoin was around in 2001?	jonmatonis	0	0	1494062722	860787563111620609	https://twitter.com/jonmatonis/status/860787563111620609				-0.20	0.0	0.9498589200280773	1.0
bitcoin 	Just return to the original, public discussion. https://bitcointalk.org/index.php?topic=1347.msg15366#msg15366 …	jgarzik	6	1	1494082215	860869321932853250	https://twitter.com/jgarzik/status/860869321932853250		#msg15366		-0.50	0.1591	0.9498589200280773	1.0
bitcoin 	The Second Wave of Bitcoin Price Growth May Just Be Beginning - CoinDeskhttp://www.coindesk.com/second-wave-bitcoin-price-growth-may-just-beginning/ …	SunnyStartups	4	1	1494064860	860796529812135937	https://twitter.com/SunnyStartups/status/860796529812135937				0.46	0.3818	0.9498589200280773	1.0
bitcoin 	Blockchain Revolution Event on May 8th at MaRS, Toronto: https://www.meetup.com/CanadaBitcoin/ pic.twitter.com/UR9CfuBxGh	SunnyStartups	0	0	1494053944	860750747193012224	https://twitter.com/SunnyStartups/status/860750747193012224				0.30	0.0	0.9498589200280773	1.0
bitcoin 	Unocoin Organized Cryptothon, a Bitcoin Blockchain Hackathon http://www.digitalterminal.in/news/unocoin-organized-cryptothon-a-bitcoin-blockchain-hackathon/9224.html …pic.twitter.com/4JrY03sRBm	SunnyStartups	3	0	1494024007	860625181978632192	https://twitter.com/SunnyStartups/status/860625181978632192				0.12	0.0	0.9864554619633984	1.0
bitcoin 	Was excited to see many new faces at a local Bitcoin meetup today, but then they promised to double my bitcoins in 90 days via GladiaCoin...pic.twitter.com/V1Q1zquj5a	lopp	58	5	1494106285	860970280826667008	https://twitter.com/lopp/status/860970280826667008				0.04	0.6059	0.9498589200280773	1.0
bitcoin 	Payment channel-based networks are coming to Bitcoin. Miners only get to decide if developers do it the easy way or the hard way.	lopp	100	28	1494097993	860935502597423106	https://twitter.com/lopp/status/860935502597423106				0.30	0.1806	0.9498589200280773	1.0
bitcoin 	https://hypron.net/bitcoinwisdom/	onemanatatime	1	0	1494041442	860698309979131904	https://twitter.com/onemanatatime/status/860698309979131904				0.00	0	0.9498589200280773	1.0
bitcoin 	# Bitcoinpic.twitter.com/8JX5a7U761	onemanatatime	5	1	1494023579	860623384299712512	https://twitter.com/onemanatatime/status/860623384299712512		#		0.50	0.0	0.9864554619633984	1.0
bitcoin 	Those who would sacrifice # Bitcoin security for a cheap cup of coffee, deserve neither.pic.twitter.com/3fB2G2XzYu	CryptoHustle	185	73	1494097030	860931463751008256	https://twitter.com/CryptoHustle/status/860931463751008256		#		-0.07	0.34	0.9498589200280773	1.0
bitcoin 	# Bitcoin is selling for $1645 USD in Japan... $ BTCpic.twitter.com/wB0SYymQ5q	CryptoHustle	44	17	1494026671	860636356703387648	https://twitter.com/CryptoHustle/status/860636356703387648		#		0.45	0.0	0.9864554619633984	1.0
bitcoin 	4/ So long as # Bitcoin doesn't destroy itself from the inside out (always a possibility), I think the will continue 2 be surprised	cburniske	12	3	1494096766	860930353480990725	https://twitter.com/cburniske/status/860930353480990725		#		0.12	0.5789	0.9498589200280773	1.0
bitcoin 	3/ While much of the financial services is begrudgingly admitting # bitcoin is here 2 stay, many still don't fully grasp the opportunity	cburniske	15	1	1494096698	860930068570361856	https://twitter.com/cburniske/status/860930068570361856		#		0.04	0.4703	0.9498589200280773	1.0
bitcoin 	"2/ @ CathieDWood & myself received blowback at the time for even suggesting the possibility. After all, it was "" # blockchain not # Bitcoin"""	cburniske	8	0	1494096575	860929555237752832	https://twitter.com/cburniske/status/860929555237752832		# #	@	0.08	0.0	0.9498589200280773	1.0
bitcoin 	When # bitcoin = $280, @ ARKInvest wrote a w/ Art Laffer saying 1% share of financial gold market $ BTC = $1700. http://arkinv.st/2qbi53z pic.twitter.com/nSiweBSHBQ	cburniske	37	17	1494095715	860925947079536640	https://twitter.com/cburniske/status/860925947079536640		#	@	0.25	0.148	0.9498589200280773	1.0
bitcoin 	From a laws of the universe perspective, # bitcoin being backed by thermodynamics is much more profound than the rolling of a printing press.	cburniske	63	23	1494086584	860887648134725633	https://twitter.com/cburniske/status/860887648134725633		#		0.21	0.0258	0.9498589200280773	1.0
bitcoin 	Stellar stats in this thread on @ CoinDesk's recent growth w/ @ twobitidiot at the helm. The is devouring info on # bitcoin & # blockchainhttps://twitter.com/twobitidiot/status/860545436486176773 …	cburniske	4	1	1494085717	860884012369416192	https://twitter.com/cburniske/status/860884012369416192		# #	@ @	0.42	0.1909	0.9498589200280773	1.0
bitcoin 	2/ An interesting data point: in my experience, this was the first time that there was broadcast interest in cryptoassets beyond Bitcoin.	cburniske	24	2	1494081407	860865936064204801	https://twitter.com/cburniske/status/860865936064204801				0.09	0.6908	0.9498589200280773	1.0
bitcoin ethereum 	# Bitcoin, # Ethereum, ICOs & market cap of # cryptoassets breaking $40B. We covered it all on @ BloombergCA. Far out! http://bloombergtv.ca/2017-05-05/uncategorized/the-future-of-crypto-currencies/ …pic.twitter.com/G5o7eZViqm	cburniske	128	74	1494081306	860865508723355648	https://twitter.com/cburniske/status/860865508723355648		# # #	@	0.30	0.0	0.9498589200280773	1.0
bitcoin 	Thanks, Ray! Shaking heads means that bitcoin still has a wall of worry to climb b4 irrational exuberance makes the market dangerously hot	cburniske	1	0	1494079175	860856572456685569	https://twitter.com/cburniske/status/860856572456685569				0.04	-0.1738	0.9498589200280773	1.0
bitcoin 	When @ CathieDWood & @ ARKInvest committed to # bitcoin in 2015, some people chided us as they thought $4B was an unjustified market cap... https://twitter.com/thebitcointroy/status/860830673246052352 …	cburniske	7	5	1494078974	860855729711980544	https://twitter.com/cburniske/status/860855729711980544		#	@ @	0.12	0.2732	0.9498589200280773	1.0
bitcoin 	Yeah, in other contexts it'd be totally accurate terminology, it's just that for bitcoin there's a kneejerk reaction.	peterktodd	4	1	1494093400	860916235357368320	https://twitter.com/peterktodd/status/860916235357368320				0.39	0.296	0.9498589200280773	1.0
bitcoin 	Finally made to # Toronto, @ SunnyStartups # bitcoin meetup will be awesome Monday but last night's night's comedy night out was great :)pic.twitter.com/5qI8CZEpeG	ToneVays	37	4	1494086766	860888409568665600	https://twitter.com/ToneVays/status/860888409568665600		# #	@	0.67	0.9091	0.9498589200280773	1.0
bitcoin 	An amazing story on how the internet, bitcoin, and China have cornered the market in fake ids for college kids buying beerhttps://twitter.com/tombschrader/status/860532447871729664 …	BaldingsWorld	13	5	1494023594	860623449802260481	https://twitter.com/BaldingsWorld/status/860623449802260481				0.55	-0.1027	0.9864554619633984	1.0
