currency	tweet	username	favorites	retweets	date	id	permalink	geo	hashtags	mentions	lex_sent	vader_sent	cnn_sent	cnn_pos_neg
bitcoin 	[Infographic] Bitcoin Explained in 30 seconds # bitcoin # Blockchain # Fintech # CryptoCurrency # Banking # Startuppic.twitter.com/io1LfcxrxS	JimMarous	7	11	1491150601	848573242428112898	https://twitter.com/JimMarous/status/848573242428112898		# # # # # #		0.33	0.0	0.9936570907649459	-1.0
bitcoin 	[Infographic] Bitcoin Explained in 30 seconds # bitcoin # Blockchain # Fintech # CryptoCurrency # Banking # Startuppic.twitter.com/HEOdMg8hfZ	JimMarous	45	41	1491094920	848339700553179136	https://twitter.com/JimMarous/status/848339700553179136		# # # # # #		0.33	0.0	0.9936570907649459	-1.0
bitcoin litecoin 	"Help me put a Litecoin ""L"" at the top right of the Bitcoin logo on https://www.reddit.com/place?webview=true … pic.twitter.com/TH27COZPh0"	SatoshiLite	31	10	1491120932	848448801064894465	https://twitter.com/SatoshiLite/status/848448801064894465				-0.18	0.5423	0.9936570907649459	-1.0
bitcoin litecoin 	You are confused between Bitcoin and Litecoin.	SatoshiLite	4	0	1491119167	848441400018350082	https://twitter.com/SatoshiLite/status/848441400018350082				-0.14	-0.3182	0.9936570907649459	-1.0
bitcoin litecoin 	See: https://bitcoincore.org/en/2016/01/26/segwit-benefits/ …https://segwit.org/my-vision-for-segwit-and-lightning-networks-on-litecoin-and-bitcoin-cf95a7ab656b …	SatoshiLite	5	1	1491114890	848423459117907968	https://twitter.com/SatoshiLite/status/848423459117907968				-0.50	0.0	0.9936570907649459	-1.0
bitcoin 	Satoshi Nakamoto and Blockstream each made plans for how to scale Bitcoin. Sadly, those plans are in direct contradiction with each other.pic.twitter.com/9zCueHOEx5	rogerkver	184	93	1491141431	848534782019387392	https://twitter.com/rogerkver/status/848534782019387392				-0.23	-0.2929	0.9936570907649459	-1.0
bitcoin 	The Amazon Kindle edition is not DRM protected, at least for The Internet of Money. Mastering Bitcoin can be converted to epub from source	aantonop	2	0	1491149881	848570221338046465	https://twitter.com/aantonop/status/848570221338046465				0.08	-0.0896	0.9936570907649459	-1.0
bitcoin 	Money and State | Thoughts on SegWit2MB http://moneyandstate.com/thoughts-on-segwit2mb/ … # bitcoin # blockchain # segwit	ErikVoorhees	155	108	1491157837	848603594500841473	https://twitter.com/ErikVoorhees/status/848603594500841473		# # #		-0.14	0.0	0.9936570907649459	-1.0
bitcoin 	Apologies, you're right. I thought this reddit thread was a recent one:https://www.reddit.com/r/Bitcoin/comments/5zsk45/i_am_shaolinfry_author_of_the_recent_user/ …	TuurDemeester	2	0	1491150622	848573330869432320	https://twitter.com/TuurDemeester/status/848573330869432320				-0.25	0.0	0.9936570907649459	-1.0
bitcoin 	Segwit via User Activated Soft Fork moves closer to BIP (bitcoin improvement proposal) status thanks to successful crowdfunding campaign.https://twitter.com/Excellion/status/848487742967132160 …	TuurDemeester	93	53	1491145086	848550110548176896	https://twitter.com/TuurDemeester/status/848550110548176896				0.26	0.4329	0.9936570907649459	-1.0
bitcoin 	Bitcoin	haydentiff	0	0	1491145611	848552314684223488	https://twitter.com/haydentiff/status/848552314684223488				0.00	0.0	0.9936570907649459	-1.0
bitcoin 	Twitter analytics says I was extremely interesting in July, lol. 68.5K profile visits. Was it # Bitcoin's halving?https://twitter.com/haydentiff/status/751895847537823745 …	haydentiff	17	2	1491100741	848364113101279232	https://twitter.com/haydentiff/status/848364113101279232		#		-0.11	0.1749	0.9936570907649459	-1.0
bitcoin 	the HF proposals that relate are here https://bitcoinhardforkresearch.github.io/  old X+Y rehash ignores all research, and creates unwelcome to most delay.	adam3us	1	0	1491132094	848495617294966784	https://twitter.com/adam3us/status/848495617294966784				0.00	-0.6478	0.9936570907649459	-1.0
bitcoin 	You use the word politics a lot. Kindly stop with the politics, perhaps Bitcoin could get back to work. spoonnet https://bitcoinhardforkresearch.github.io/	adam3us	5	0	1491091203	848324109301895169	https://twitter.com/adam3us/status/848324109301895169				0.24	0.0833	0.9936570907649459	-1.0
bitcoin 	hah i do not consent - until @ YoursOrg launches, no # bitcoin for content	Melt_Dem	4	2	1491144474	848547543843778560	https://twitter.com/Melt_Dem/status/848547543843778560		#	@	0.33	-0.434	0.9936570907649459	-1.0
bitcoin 	"""Fee market"" should technically be called a ""blockspace market.""https://hackernoon.com/into-the-hall-of-mirrors-part-i-bitcoins-fee-market-is-an-illusion-b367c1049d20 …"	el33th4xor	39	19	1491099903	848360600069693440	https://twitter.com/el33th4xor/status/848360600069693440				0.22	0.0	0.9936570907649459	-1.0
bitcoin 	# Bitcoin Reaches a Grand Compromise on the Scalability Debate - @ CryptoCoinsNewshttps://www.cryptocoinsnews.com/bitcoin-reaches-a-grand-compromise-on-the-scalability-debate/ …	BitcoinByte	0	0	1491085046	848298284410122244	https://twitter.com/BitcoinByte/status/848298284410122244		#	@	0.23	0.4939	0.9612775153032732	1.0
bitcoin 	When will # bitcoin grow up so people can make $10k trades with confidence?https://twitter.com/bambouclub/status/848486151455481856 …	GerberKawasaki	5	0	1491141126	848533501943074816	https://twitter.com/GerberKawasaki/status/848533501943074816		#		0.43	0.2553	0.9936570907649459	-1.0
bitcoin 	Why Mizuho Believes Bitcoin Still Has a Future in Banking http://bit.ly/2nEtdEc  via @ CoinDesk	Chris_Skinner	2	1	1491128576	848480862178029568	https://twitter.com/Chris_Skinner/status/848480862178029568			@	0.07	0.0	0.9936570907649459	-1.0
bitcoin 	All your Bitcoin are belong to... the 0.01%https://twitter.com/bambouclub/status/848486151455481856 …	dgwbirch	2	1	1491167489	848644075750383616	https://twitter.com/dgwbirch/status/848644075750383616				0.00	0.0	0.9936570907649459	-1.0
bitcoin 	Blockchain Webinar #3: Bitcoin Updates, Segwit, Unlimited, Kryptowährungsspekulationen, Q&A: http://youtu.be/5p66TWIujD8?a  via @ YouTube	julianhosp	1	0	1491127516	848476417625030656	https://twitter.com/julianhosp/status/848476417625030656		#3	@	0.00	0.0	0.9936570907649459	-1.0
bitcoin 	Bitcoin vs Gold: Which is a Better Long-Term Bet?http://www.coindesk.com/bitcoin-gold-better-long-term-bet/ …	SunnyStartups	0	0	1491138420	848522151657385985	https://twitter.com/SunnyStartups/status/848522151657385985				0.00	0.2202	0.9936570907649459	-1.0
bitcoin 	# bitcoinhttps://twitter.com/muneeb/status/848236123767885824 …	SunnyStartups	4	1	1491133487	848501463361957889	https://twitter.com/SunnyStartups/status/848501463361957889		#		0.50	0.0	0.9936570907649459	-1.0
bitcoin 	Unocoin | Bitcoin is not illegal in India: https://www.unocoin.com/post/710 # IndiaBitcoinpic.twitter.com/Vd6OS4OdYt	SunnyStartups	0	1	1491130321	848488181666369536	https://twitter.com/SunnyStartups/status/848488181666369536		#		0.27	0.4449	0.9936570907649459	-1.0
bitcoin 	Indian Bitcoin Community Signs Petition Demanding Legal Status for Cryptocurrencieshttp://www.newsbtc.com/2017/03/31/indian-bitcoin-petition-legal-status/ …	SunnyStartups	3	4	1491127260	848475344227184641	https://twitter.com/SunnyStartups/status/848475344227184641				0.20	-0.1027	0.9936570907649459	-1.0
bitcoin 	Finance Minister Mr Arun Jaitley: Make bitcoins and cryptocurrencies legal https://www.change.org/p/finance-minister-mr-arun-jaitley-make-bitcoins-and-cryptocurrencies-legal …pic.twitter.com/GeQMRNflw5	SunnyStartups	5	0	1491116342	848429548765106176	https://twitter.com/SunnyStartups/status/848429548765106176				0.36	0.128	0.9936570907649459	-1.0
bitcoin 	Despite Reports, India's Bitcoin Policy Hasn’t Changedhttp://www.coindesk.com/despite-reports-india-bitcoin-policy-no-change/ …	SunnyStartups	1	1	1491086404	848303979687804928	https://twitter.com/SunnyStartups/status/848303979687804928				0.00	0.0	0.9612775153032732	1.0
bitcoin ethereum 	. @ matchpool crowdsale hits $3 million in 19 minutes! Cap is $5 mm, 33% bonus ends soon: http://bit.ly/2ntiXuL # ethereum # bitcoin	michaelterpin	2	3	1491139728	848527638926950400	https://twitter.com/michaelterpin/status/848527638926950400		# #	@	0.30	0.1808	0.9936570907649459	-1.0
bitcoin ethereum 	@ matchpool crowdsale hits $3 million in 19 minutes! Cap is $5 mm, 33% bonus ends soon: http://bit.ly/2ntiXuL # ethereum # bitcoin	michaelterpin	0	1	1491139588	848527052739358720	https://twitter.com/michaelterpin/status/848527052739358720		# #	@	0.27	0.2712	0.9936570907649459	-1.0
bitcoin 	Are you a # matchmaker? Watch the world become one big dating and referral pool, starting tomorrow! # bitcoin # cryptohttps://twitter.com/matchpool/status/847684761208242176 …	michaelterpin	4	3	1491093096	848332049522012160	https://twitter.com/michaelterpin/status/848332049522012160		# # #		0.29	0.0	0.9936570907649459	-1.0
bitcoin 	Big Daddy # Bitcoin - Ascending Triangle 10 days on Hourly. Alts about to shit their pants (already did). I'm Long @http://Bitmexbtc.co pic.twitter.com/URGr5p4TBx	onemanatatime	10	8	1491163137	848625822562885632	https://twitter.com/onemanatatime/status/848625822562885632		#	@http	0.09	-0.1858	0.9936570907649459	-1.0
bitcoin 	Maybe Vinny was right about Bitcoin. $850 sitting right smack on the 2 year-long $ BTCUSD trend line. @ VinnyLingham https://www.bitfinex.com/?refcode=aQBHcxVPzj …pic.twitter.com/9ow6NUHYmE	onemanatatime	26	8	1491133442	848501271648624646	https://twitter.com/onemanatatime/status/848501271648624646			@	-0.19	0.0	0.9936570907649459	-1.0
bitcoin 	Maybe it's time to adjust how the @ OKCoin index is being calculated? And the # Bitcoin index can also use some adjusting. @ liujackcpic.twitter.com/vuZz4LXpCV	WhalePanda	9	8	1491133754	848502581282439169	https://twitter.com/WhalePanda/status/848502581282439169		#	@ @	0.12	0.0	0.9936570907649459	-1.0
bitcoin 	Bitcoin is digital gold and store of value, it isn't made to buy your coffee with it.	WhalePanda	2	0	1491128152	848479084267134976	https://twitter.com/WhalePanda/status/848479084267134976				0.18	0.34	0.9936570907649459	-1.0
bitcoin 	# Bitcoin blocks full? Not even close when there is no spam. For the people that don't need to do urgent transactions, do them in the weekendpic.twitter.com/s9Zj0nTN20	WhalePanda	133	74	1491115398	848425592555008000	https://twitter.com/WhalePanda/status/848425592555008000		#		0.11	-0.1986	0.9936570907649459	-1.0
bitcoin 	5/ ..all of this could be worsened if # bitcoin has a significant upward move, as it is the primary trading pair for most # cryptoassets	cburniske	3	1	1491148328	848563708259438592	https://twitter.com/cburniske/status/848563708259438592		# #		0.38	-0.2732	0.9936570907649459	-1.0
bitcoin 	1/ Hypotheses 4 massive # cryptoasset bull market: 1) # bitcoin ETF drew in new blood, new 2) Margin-fueled Both went nuts w/ $ BTC stable	cburniske	13	8	1491147879	848561824337453057	https://twitter.com/cburniske/status/848561824337453057		# #		0.23	-0.0258	0.9936570907649459	-1.0
bitcoin ethereum ripple 	3 # cryptoassets simultaneously > $1 billion market cap. # Bitcoin, # Ethereum, # Ripple & co are a new asset class. http://arkinv.st/2nZ5bE7 pic.twitter.com/HWRkYAQCsy	cburniske	24	28	1491136561	848514353037025280	https://twitter.com/cburniske/status/848514353037025280		# # # #		0.35	0.1204	0.9936570907649459	-1.0
bitcoin 	People who wonder whether # bitcoin will scale or won't scale are missing the point. The coin is open source adjustable & anti-fragile. https://twitter.com/bishtpushpa/status/848049125513973760 …	cburniske	21	5	1491095773	848343278130999296	https://twitter.com/cburniske/status/848343278130999296		#		0.21	0.0745	0.9936570907649459	-1.0
bitcoin 	"Agreed, # Bitcoin is only looking to solve 1 need ""Permission-less Value Transfer"" + Micropayments if Scales."	ToneVays	2	0	1491165222	848634569784004609	https://twitter.com/ToneVays/status/848634569784004609		#		0.18	0.6486	0.9936570907649459	-1.0
bitcoin 	In 1hr at 5pm ET (9pm UTC) LIVE # StockMarket & # Bitcoin econ/trading show $ Gold $ SPX $ OIL $ EURUSD $ BTCUSD + Q&A:https://www.youtube.com/watch?v=SylA1hKDai0 …	ToneVays	20	10	1491163804	848628618624462849	https://twitter.com/ToneVays/status/848628618624462849		# #		0.26	0.0	0.9936570907649459	-1.0
bitcoin 	The first Episode of @ Crypto_Scam podcast talked about the # Bitcoin scamhttps://www.youtube.com/watch?v=1r482VFVsnc&t=2059s …	ToneVays	1	0	1491158654	848607020488036353	https://twitter.com/ToneVays/status/848607020488036353		#	@	0.31	-0.5719	0.9936570907649459	-1.0
bitcoin 	I'm willing to wait about 3 years, No One should use # Bitcoin yet unless they Have To... Just hope $ EUR break up don't happen before # SegWit	ToneVays	4	0	1491158452	848606171355283461	https://twitter.com/ToneVays/status/848606171355283461		# #		0.28	0.1779	0.9936570907649459	-1.0
bitcoin 	"Excellent, # Bitcoin Users need stability. The last a Drug Dealer or Escorts wants is a ""pump & dump"" [ or perhaps only Druggy doesn't :) ]"	ToneVays	3	0	1491157986	848604216126046213	https://twitter.com/ToneVays/status/848604216126046213		#		0.52	-0.0252	0.9936570907649459	-1.0
bitcoin 	It does not matter if scaling is solved, what matters is there is only 1 # Bitcoin. But once # SegWit DOES gets in, it's Checkmate for Alts.	ToneVays	19	5	1491157848	848603640575164416	https://twitter.com/ToneVays/status/848603640575164416		# #		0.39	0.1396	0.9936570907649459	-1.0
bitcoin 	April Fools Day is the one day I do read # Bitcoin news cause all Jokes actually make more sense than Real News that Day :)	ToneVays	7	2	1491149252	848567586782666752	https://twitter.com/ToneVays/status/848567586782666752		#		0.69	0.2023	0.9936570907649459	-1.0
bitcoin 	This Week in # Altcoin/ # Shitcoin HISTORY there have never been any Survivors!!! # BitcoinMaximalist # Bitcoin # SupportSegwit to End Insanitypic.twitter.com/WumLG6mc9q	ToneVays	37	16	1491148409	848564049784733696	https://twitter.com/ToneVays/status/848564049784733696		# # # # #		0.35	0.0	0.9936570907649459	-1.0
bitcoin 	UPDATE: $ BTCUSD Forming an Ascending Triangle suggesting an imminent move to around $1,150. # Bitcoin (like Old Faithful) # SupportSegwitpic.twitter.com/cWKExUX1BW	ToneVays	44	22	1491141205	848533833662312448	https://twitter.com/ToneVays/status/848533833662312448		# #		0.43	0.0	0.9936570907649459	-1.0
bitcoin 	Recent interview w/ TBD Podcast covering # Bitcoin # SupportSegwit & realities of Cannibus & PliceState @ Cointelegraph https://soundcloud.com/cointelegraph/tbp121-liberty-life-trails …	ToneVays	19	7	1491138195	848521207335059456	https://twitter.com/ToneVays/status/848521207335059456		# #	@	0.26	0.0	0.9936570907649459	-1.0
bitcoin 	it's taking me forever to download the # blockchain haha, And the # BitcoinUnlimited crazies want to double the size of each block hahaha	ToneVays	0	0	1491100143	848361607625412610	https://twitter.com/ToneVays/status/848361607625412610		# #		0.08	0.6124	0.9936570907649459	-1.0
bitcoin 	The # Bitcoinmaximalist Month End Market Cap Adjusted $ BTCUSD price is now at $1,608, that's my asking price to those buying # Bitcoin from mepic.twitter.com/Qu9A88fTmJ	ToneVays	24	7	1491094204	848336695292461056	https://twitter.com/ToneVays/status/848336695292461056		# #		0.69	0.0	0.9936570907649459	-1.0
