currency	tweet	username	favorites	retweets	date	id	permalink	geo	hashtags	mentions	lex_sent	vader_sent	cnn_sent	cnn_pos_neg
bitcoin 	Today’s # Bitcoin action: traded from $11.80 to 10.70 now at $10.80.	maxkeiser	126	26	1512338468	937441596202733568	https://twitter.com/maxkeiser/status/937441596202733568		#		0.17	0.0	0.9944159467783056	1.0
bitcoin 	As # Bitcoin sails toward $15,000, two random Bitcoiners meet on the subway. FACT: Insurr(ections) are the ultimate aphrodisiac.pic.twitter.com/uHukE7XDNu	maxkeiser	93	20	1512316595	937349855789412355	https://twitter.com/maxkeiser/status/937349855789412355		#		0.00	0.0	0.9944159467783056	1.0
bitcoin 	$ USD arrives at # Bitcoin International Airport.pic.twitter.com/IvJNnEc5tj	maxkeiser	318	101	1512315176	937343905976156160	https://twitter.com/maxkeiser/status/937343905976156160		#		0.12	0.0	0.9944159467783056	1.0
bitcoin 	Central Banks are capitulating. Path to $100,000 accelerating. Fiat currencies going the way of Cowrey shells. Nation states, as we’ve known them, are dead. # Bitcoin is God. The day of reckoning is upon us.pic.twitter.com/OVhSRg73cB	maxkeiser	574	269	1512311715	937329386839298048	https://twitter.com/maxkeiser/status/937329386839298048		#		0.17	-0.0626	0.9944159467783056	1.0
bitcoin 	HaHaHaHa!!! Kill the Central Bankers with # Bitcoinhttps://twitter.com/xentagz/status/937306384789622785 …	maxkeiser	333	119	1512311421	937328152875069441	https://twitter.com/maxkeiser/status/937328152875069441		#		0.12	-0.3454	0.9944159467783056	1.0
bitcoin 	Great! BitcoinTotalBot.https://twitter.com/bitcointotalbot/status/937312637196685313 …	maxkeiser	47	18	1512308346	937315256631791622	https://twitter.com/maxkeiser/status/937315256631791622				4.50	0.2196	0.9944159467783056	1.0
bitcoin 	$13,000 is in the bag. # Bitcoin $ USD hits new all time low against Bitcoin | Bitcoin crushing US dollar & governments can do nothing to stop it - Max Keiser https://www.rt.com/business/411058-bitcoin-fiat-money-keiser/ …pic.twitter.com/DzlXHolNnZ	maxkeiser	311	133	1512307857	937313207718481921	https://twitter.com/maxkeiser/status/937313207718481921		#		0.18	-0.2021	0.9944159467783056	1.0
bitcoin 	Keiser Report: Will Bitcoin Revive Gold as Global Money? (E1157) https://youtu.be/UrettYxF8IQ  via @ YouTubepic.twitter.com/vIE3dUGBsQ	maxkeiser	44	16	1512273747	937170139124027392	https://twitter.com/maxkeiser/status/937170139124027392			@	-0.29	0.17	0.9944159467783056	1.0
bitcoin 	Yes. Apologies to @ DanielKrawisz for flubbing - he coined ‘hyperbitcoinization’https://twitter.com/pierre_rochard/status/937126588860256256 …	maxkeiser	63	11	1512264827	937132727538782209	https://twitter.com/maxkeiser/status/937132727538782209			@	0.36	0.2009	0.9944159467783056	1.0
bitcoin 	Less than 1% of people holding Bitcoin today run a full node. Why do you think that is the case?	VinnyLingham	5	1	1512334463	937424798841389056	https://twitter.com/VinnyLingham/status/937424798841389056				0.30	0.0	0.9944159467783056	1.0
bitcoin 	When did you buy your first bitcoin and, which coin do you plan on buying more of going forward?	VinnyLingham	76	62	1512328631	937400338033737729	https://twitter.com/VinnyLingham/status/937400338033737729				0.16	0.0	0.9944159467783056	1.0
bitcoin 	They don’t get it. Bitcoin is no longer a currency! It’s a store of value! https://twitter.com/wsj/status/936876098595332101 …	VinnyLingham	593	180	1512259255	937109353340928000	https://twitter.com/VinnyLingham/status/937109353340928000				0.12	0.0102	0.9944159467783056	1.0
bitcoin 	He kept talking about Bitcoin Cash. Not sure what that is!	SatoshiLite	254	9	1512258015	937104152747966464	https://twitter.com/SatoshiLite/status/937104152747966464				0.27	0.1901	0.9633620689586208	1.0
bitcoin 	https://www.cnbc.com/2017/11/29/james-altucher-predicts-bitcoin-will-reach-1-million-by-2020.html …	officialmcafee	959	471	1512329945	937405852113342464	https://twitter.com/officialmcafee/status/937405852113342464				0.00	0.0	0.9944159467783056	1.0
bitcoin 	Appreciation of bitcoin. Most core developers are financially independent and can work on what they want to work on	aantonop	74	9	1512325698	937388038103207936	https://twitter.com/aantonop/status/937388038103207936				0.05	0.2939	0.9944159467783056	1.0
bitcoin 	I wrote an entire chapter about Lightning in the second edition of Mastering Bitcoin. It is based on my review of the research and use of the tech.	aantonop	1	0	1512322208	937373398870773760	https://twitter.com/aantonop/status/937373398870773760				0.18	0.0	0.9944159467783056	1.0
bitcoin 	Confusing a bubble (which bitcoin is in right now) with a ponzi (which it isn't). Bubbles can and do occur with technologies that have substance and useful applications. Doesn't make it a Ponzi.	aantonop	5	0	1512320544	937366419871854592	https://twitter.com/aantonop/status/937366419871854592				0.21	0.0714	0.9944159467783056	1.0
bitcoin 	Simple tool for checking USD value of your bitcoins, and vice versa: http://preev.com	TuurDemeester	160	41	1512340351	937449495721279488	https://twitter.com/TuurDemeester/status/937449495721279488				0.00	0.34	0.9944159467783056	1.0
bitcoin 	Here's a primer on why to run a full node:https://www.reddit.com/r/Bitcoin/comments/498520/why_the_bitcoin_rules_cant_change_reading_time/ …	TuurDemeester	0	2	1512325267	937386228034490369	https://twitter.com/TuurDemeester/status/937386228034490369				0.10	0.0	0.9944159467783056	1.0
bitcoin 	Lost @ bitcoins @ seahttp://fortune.com/2017/11/25/lost-bitcoins/ …	mrmainelli	2	3	1512306548	937307714362990592	https://twitter.com/mrmainelli/status/937307714362990592			@ @	0.20	-0.3182	0.9944159467783056	1.0
bitcoin 	This is the thing.. “Conceptually digital currencies are an interesting thing. It’s not part of our investment universe today – it could be. If there is a CME future on bitcoin, it would be.”	cryptomanran	7	1	1512320358	937365640775634945	https://twitter.com/cryptomanran/status/937365640775634945				0.12	0.134	0.9944159467783056	1.0
bitcoin 	The Bitcoin Dilema: I made a trade into an alt using 5 BTC @$4000 , i.e. $20000. I sold the alt today at 3,1 BTC , $33600. Did I make a profit or a loss?	cryptomanran	267	139	1512304257	937298106894438400	https://twitter.com/cryptomanran/status/937298106894438400			@	0.14	0.0383	0.9944159467783056	1.0
bitcoin 	GlobalBoost® is registered trademark No premine or ICO =Fair distribution Get $ BSTY while cheap # Bitcoin # Blockchainhttps://twitter.com/NetworksManager/status/937152628466778112 … – bei The White House	NetworksManager	9	8	1512309023	937318095168909313	https://twitter.com/NetworksManager/status/937318095168909313		# #		0.38	-0.296	0.9944159467783056	1.0
bitcoin litecoin 	To Get # GlobalBoost® make an account at https://www.CoinBase.com/join/52e3c7c6578014d209000011 … Buy # Bitcoin or # Litecoin then make an account at https://www.Cryptopia.co.nz/Register?referrer=GlobalBoost … And exchange for # BSTY! The run up from a penny to 50 cents is gonna be epic!pic.twitter.com/lTUDrwWlI9	NetworksManager	30	22	1512269572	937152628466778112	https://twitter.com/NetworksManager/status/937152628466778112		# # # #		0.33	0.0	0.9944159467783056	1.0
bitcoin 	Top Venture Capitalist Says 300bil Cryptocurrencies Market to be Worth Trillions of Dollars - Buy # GlobalBoost $ BSTYhttp://bitcoinist.com/top-venture-capitalist-says-cryptocurrencies-worth-trillions-dollars/ … – bei The White House	NetworksManager	11	10	1512266292	937138869530779649	https://twitter.com/NetworksManager/status/937138869530779649		#		0.21	0.4019	0.9944159467783056	1.0
bitcoin 	So interesting. I know a man who worked at Coca-Cola who divorced his wife over her bizarre interest in... # Bitcoin. Pity.https://twitter.com/charliebilello/status/937367490233061376 …	haydentiff	81	22	1512323603	937379250369425408	https://twitter.com/haydentiff/status/937379250369425408		#		0.14	0.0849	0.9944159467783056	1.0
bitcoin 	Just ran out of time to spread some # BitcoinCash love around. I’ll go back.	haydentiff	3	0	1512323021	937376807397060608	https://twitter.com/haydentiff/status/937376807397060608		#		0.73	0.3185	0.9944159467783056	1.0
bitcoin ripple 	That’s what’s cool about @ Ripple. They stay in their own lane. No trying to hijack Bitcoin to turn it into something that suits their own needs. And rather than trying to make money off Bitcoin users, they go after the banks. I like that.	haydentiff	2	0	1512319277	937361106225565696	https://twitter.com/haydentiff/status/937361106225565696			@	-0.13	0.0767	0.9944159467783056	1.0
bitcoin 	What @ pmarca described is what attracted me to Bitcoin in the first place.	haydentiff	17	3	1512257201	937100739041726464	https://twitter.com/haydentiff/status/937100739041726464			@	0.29	0.4215	0.9633620689586208	1.0
bitcoin 	“Why # Bitcoin Matters” by @ pmarca https://dealbook.nytimes.com/2014/01/21/why-bitcoin-matters/ …pic.twitter.com/1zWYCGDLw0	haydentiff	29	4	1512256810	937099099526049792	https://twitter.com/haydentiff/status/937099099526049792		#	@	0.25	0.0	0.9633620689586208	1.0
bitcoin 	'Regulate bitcoin.' LOL. The UK Treasury cannot 'regulate bitcoin.' They can only 'regulate' the financial interactions of hapless residents of UK.https://twitter.com/lemasabachthani/status/937450909545746432 …	stacyherbert	131	74	1512340893	937451768048480258	https://twitter.com/stacyherbert/status/937451768048480258				0.05	0.0568	0.9944159467783056	1.0
bitcoin 	Were you at the Prague 2011 bitcoin conference?	stacyherbert	0	0	1512257919	937103750103289856	https://twitter.com/stacyherbert/status/937103750103289856				-0.12	0.0	0.9633620689586208	1.0
bitcoin 	"If I had more info, I would totally write a ""Bitcoin Diamond: What you need to know"" article."	jimmysong	9	0	1512268750	937149179209625600	https://twitter.com/jimmysong/status/937149179209625600				-0.28	0.3947	0.9944159467783056	1.0
bitcoin 	Hey @ BitcoinDiamond_ , is this your github or is this something else?https://github.com/Bitcoin-Diamond/BitcoinDiamond …	jimmysong	37	10	1512262490	937122924473004032	https://twitter.com/jimmysong/status/937122924473004032			@	0.54	0.0	0.9944159467783056	1.0
bitcoin 	Holy hell, # bitcoin. $ btc pic.twitter.com/75Cx1sOE1s	readDanwrite	3	1	1512317437	937353385803763713	https://twitter.com/readDanwrite/status/937353385803763713		#		0.29	-0.3404	0.9944159467783056	1.0
bitcoin 	The Market will always have room for # cryptocurrencies that are more Centralized than # bitcoin @ ami # tech # blockchain # fintech https://hackernoon.com/the-market-will-always-have-room-for-cryptocurrencies-that-are-more-centralized-than-bitcoin-8a9cd4e6accb?source=rss----3a8144eabfe3---4 …pic.twitter.com/U0ie487DPF	sbmeunier	11	20	1512325546	937387398652186624	https://twitter.com/sbmeunier/status/937387398652186624		# # # # #	@	0.52	0.0	0.9944159467783056	1.0
bitcoin 	ECB Wants Digital Cash for Banks to Keep up With Bitcoin https://news.bitcoin.com/ecb-wants-digital-cash-banks-keep-bitcoin/ … via @ BTCTN	thomaspower	2	3	1512313322	937336127836495872	https://twitter.com/thomaspower/status/937336127836495872			@	0.20	0.0	0.9944159467783056	1.0
bitcoin ethereum 	Bitcoin Vs. Ethereum: What You Need to Know About the Great Cryptocurrency Showdown https://www.inc.com/quora/bitcoin-vs-ethereum-what-you-need-to-know-about-great-cryptocurrency-showdown.html … via @ Varna	thomaspower	2	1	1512307863	937313230824751105	https://twitter.com/thomaspower/status/937313230824751105			@	0.47	0.6249	0.9944159467783056	1.0
bitcoin 	As Bitcoin Tops $11,000, Hedge Fund Leader Ken Griffin Joins the Bubble Brigade https://www.cryptocoinsnews.com/as-bitcoin-tops-11000-hedge-fund-leader-ken-griffin-joins-the-its-a-bubble-club/ … via @ cryptocoinsnews	thomaspower	4	0	1512307807	937312995587141632	https://twitter.com/thomaspower/status/937312995587141632			@	0.06	0.5106	0.9944159467783056	1.0
bitcoin 	Google searches for bitcoin pass Trump for the first time http://www.businessinsider.com/bitcoin-price-google-trump-2017-12 … via @ jbkavungal	thomaspower	2	1	1512307018	937309688458129408	https://twitter.com/thomaspower/status/937309688458129408			@	0.29	0.0	0.9944159467783056	1.0
bitcoin 	Bitcoin Futures Are a Bet That Digital Money Will Take Over the World https://www.bloomberg.com/news/articles/2017-12-01/bitcoin-futures-seen-as-bet-digital-money-will-take-over-world … via @ Maplethorpej	thomaspower	0	0	1512306999	937309609638817792	https://twitter.com/thomaspower/status/937309609638817792			@	0.18	0.0	0.9944159467783056	1.0
bitcoin 	Bitcoin Is a Delusion That Could Conquer the World https://refind.com/l/381934292d  via @ papadimitriou @ halbluchs	thomaspower	0	0	1512306979	937309525685690368	https://twitter.com/thomaspower/status/937309525685690368			@ @	0.33	0.0	0.9944159467783056	1.0
bitcoin 	All You Need to Know About Bitcoin's Rise, From $0.01 to $11,000 https://www.bloomberg.com/news/articles/2017-12-01/understanding-bitcoin-s-rise-0-01-to-11-000-quicktake-q-a … via @ MKaigwa	thomaspower	0	1	1512306962	937309454264963072	https://twitter.com/thomaspower/status/937309454264963072			@	-0.06	0.0	0.9944159467783056	1.0
bitcoin 	"Nobel Laureate Economist Predicts a Bitcoin Crash ""Won't Go to Zero, It Will Just Come Down"" https://www.cryptocoinsnews.com/nobel-laureate-economist-predicts-bitcoin-crash-wont-go-to-zero-it-will-just-come-down/ … via @ cryptocoinsnews"	thomaspower	3	8	1512288277	937231083019444224	https://twitter.com/thomaspower/status/937231083019444224			@	0.20	-0.4019	0.9944159467783056	1.0
bitcoin 	Tabs break Bitcoin because they are lines of credit, and no one extends credit unless they know your identity.	el33th4xor	79	12	1512311583	937328833354784768	https://twitter.com/el33th4xor/status/937328833354784768				0.05	0.5423	0.9944159467783056	1.0
bitcoin ethereum 	Unchained is now on SoundCloud! Thank you to all of you who gave your input. The episodes are not in order -- don't know how to fix that, but I highlighted the five most recent so at least those show up at the top. https://soundcloud.com/unchainedpodcast … # bitcoin # crypto # ethereum	laurashin	161	34	1512265030	937133575303864322	https://twitter.com/laurashin/status/937133575303864322		# # #		0.10	0.1643	0.9944159467783056	1.0
bitcoin 	Bitcoin Is 15 Times More Expensive to Keep Safe Than Gold # bitcoinhttp://www.fool.co.uk/investing/2017/11/22/bitcoin-is-15-times-more-expensive-to-keep-safe-than-gold/ …	BitcoinByte	8	3	1512312670	937333395218161664	https://twitter.com/BitcoinByte/status/937333395218161664		#		0.23	0.4404	0.9944159467783056	1.0
bitcoin 	As # bitcoin passes $10,000, experts consider whether # cryptocurrencies will crash or carry onhttps://www.cnbc.com/2017/11/29/bitcoin-passes-10000-cryptocurrency-crash-considered-by-experts.html …	BitcoinByte	8	8	1512256008	937095735807500289	https://twitter.com/BitcoinByte/status/937095735807500289		# #		0.33	-0.4019	0.9633620689586208	1.0
bitcoin 	Investors are shunning new cryptocurrencies even as they pour money into # bitcoinhttps://www.cnbc.com/2017/11/30/ico-bubble-is-bursting-even-as-bitcoin-price-rises.html …	BitcoinByte	2	4	1512255724	937094543006199808	https://twitter.com/BitcoinByte/status/937094543006199808		#		-0.38	0.0	0.9633620689586208	1.0
bitcoin 	Cryptocurrencies (besides Bitcoin): What do they do? and where is the market head… https://cryptocoin.news/news/altcoin/cryptocurrencies-besides-bitcoin-what-do-they-do-and-where-is-the-market-headed-3892/ … via @TodayCryptoCryptoCoinNewsCCN	SimonCocking	3	9	1512334161	937423533289955328	https://twitter.com/SimonCocking/status/937423533289955328			@TodayCryptoCryptoCoinNewsCCN	0.25	0.0	0.9944159467783056	1.0
bitcoin ripple 	Making rippleshttps://nichehunt.com/ripple-why-the-anti-bitcoin-is-loved-by-banks-and-hated-by-the-internet/ …	Chris_Skinner	24	11	1512303691	937295732251402240	https://twitter.com/Chris_Skinner/status/937295732251402240				0.00	0.0	0.9944159467783056	1.0
bitcoin 	McAfee seems to take bitcoin a bit more seriously than me, as I wouldn’t make this bet any dayhttps://www.rt.com/news/411379-john-mcafee-bitcoin-prediction/ …	Chris_Skinner	5	2	1512299393	937277703891365890	https://twitter.com/Chris_Skinner/status/937277703891365890				0.32	-0.2484	0.9944159467783056	1.0
bitcoin 	The statists crack down on the libertarians and bring in strict laws for cryptohttps://news.bitcoin.com/proposed-u-s-legislation-may-criminalize-those-who-conceal-bitcoin/ …	Chris_Skinner	1	0	1512288317	937231250573709313	https://twitter.com/Chris_Skinner/status/937231250573709313				0.21	0.0258	0.9944159467783056	1.0
bitcoin 	Just had a play with with the @ RevolutApp new feature that allows you to buy Bitcoin in a super easy UI and in less than 3 minutes! This is going to be huge!!pic.twitter.com/u8vHeIWrbx	davidbrear	144	64	1512331116	937410761462304773	https://twitter.com/davidbrear/status/937410761462304773			@	0.26	0.413	0.9944159467783056	1.0
bitcoin 	https://fintechinsidernews.com/posts/ZFvRzCHqTikbP28Sd/bitcoin-is-the-6th-large-currency-in-the-world-by …	davidbrear	4	3	1512288528	937232133852155905	https://twitter.com/davidbrear/status/937232133852155905				0.00	0.0	0.9944159467783056	1.0
bitcoin 	Who has a vast surplus of Bitcoin and who wants to borrow them?	dgwbirch	0	0	1512310187	937322979515666433	https://twitter.com/dgwbirch/status/937322979515666433				0.08	0.0	0.9944159467783056	1.0
bitcoin 	But she says Bitcoin “too volatile, too risky, too energy intensive, and because the underlying technologies are not yet scalable” which sounds pretty much like Jamie doesn’t it?	dgwbirch	2	0	1512291466	937244458701213696	https://twitter.com/dgwbirch/status/937244458701213696				0.00	0.7184	0.9944159467783056	1.0
bitcoin 	Nobody (everybody?) owns the Bitcoin brand.	gavinandresen	127	32	1512259777	937111542411116544	https://twitter.com/gavinandresen/status/937111542411116544				-0.17	0.0	0.9944159467783056	1.0
bitcoin 	Malicious Bitcoin Wallet Generation Software Could Produce Known Private Keys -http://klou.tt/dctrb9zgv0je	billatnapier	1	0	1512316809	937350755475898368	https://twitter.com/billatnapier/status/937350755475898368				0.36	0.0	0.9944159467783056	1.0
bitcoin 	What the bitcoin bubble tells us about the economyhttp://www.thetimes.co.uk/article/85ed646c-d778-11e7-945f-b625fa742a9e …	robdgill	0	1	1512289198	937234944266526720	https://twitter.com/robdgill/status/937234944266526720				0.00	0.0	0.9944159467783056	1.0
bitcoin 	Goldman Sachs CEO Open to Considering Bitcoin Trading Once Currency Becomes Esta...https://cointelegraph.com/news/goldman-sachs-ceo-open-to-considering-bitcoin-trading-once-currency-becomes-established …	robdgill	0	0	1512286443	937223387600039937	https://twitter.com/robdgill/status/937223387600039937				0.17	0.0	0.9944159467783056	1.0
bitcoin 	World's largest futures exchange, # CME to launch # bitcoin futures after green light from US regulator. CME completed self-certification with the Commodity Futures Trading Commission to launch its bitcoin futures contract on Dec. 18. https://www.cnbc.com/2017/12/01/cme-says-its-launching-bitcoin-futures-on-dec-18.html … # blockchain	SusanneChishti	6	4	1512285993	937221503908765696	https://twitter.com/SusanneChishti/status/937221503908765696		# # #		0.08	0.0	0.9944159467783056	1.0
bitcoin 	This Is When You Can Start Trading # Bitcoin Futures - easier for investors to profit from losses as well as gains in # cryptocurrency http://www.nasdaq.com/article/this-is-when-you-can-start-trading-bitcoin-futures-cm885310 … via @ ibdinvestors @ Nasdaq # blockchain @ NasdaqTech # cryptocurrency	SusanneChishti	1	0	1512285442	937219192046149633	https://twitter.com/SusanneChishti/status/937219192046149633		# # # #	@ @ @	0.41	0.7579	0.9944159467783056	1.0
bitcoin 	Ride the early steep trajectory for 2-3 years, then roll the investment into new projects capable of climbing steeply. It’s a VC model. Returns that # Bitcoin offered in 2011-2013 are still available today, but there’s work involve to find the gems. /30	woonomic	80	21	1512275802	937178758070636544	https://twitter.com/woonomic/status/937178758070636544		#		0.14	0.0954	0.9944159467783056	1.0
bitcoin 	So let’s look at the individual performance of the other coins. This is a chart of the top 125 coins. As you can see there are plenty of investment opportunities that can outperform # Bitcoin. /25pic.twitter.com/rdqp7AKp8F	woonomic	51	14	1512275517	937177561280532480	https://twitter.com/woonomic/status/937177561280532480		#		0.06	0.146	0.9944159467783056	1.0
bitcoin 	We are also seeing # Bitcoin dominance reducing over the long term. This is a sign of the markets maturing as a fully digital economy should not be 95% money. All industries will eventually fill this economy when this fully matures. (data by Coinmarketcap) /24pic.twitter.com/yo18X6Lyd6	woonomic	35	10	1512275467	937177351305261056	https://twitter.com/woonomic/status/937177351305261056		#		0.09	0.0506	0.9944159467783056	1.0
bitcoin 	Stealth, Awareness, Mania, and Blow-off are the stages of the investment cycle. With Bitcoin only the Geek money invested in the Stealth Phase. Smart money was displaced to the Awareness Phase. /22pic.twitter.com/IF4WeKIMm1	woonomic	35	17	1512275333	937176791906648064	https://twitter.com/woonomic/status/937176791906648064				-0.28	0.0129	0.9944159467783056	1.0
bitcoin 	Bitcoin is not just money. It’s the invention of an Internet-native digital scarcity. And with that breakthrough, software will eat the financial world. /20	woonomic	347	127	1512275172	937176117127122944	https://twitter.com/woonomic/status/937176117127122944				0.17	0.0	0.9944159467783056	1.0
bitcoin 	Now # Bitcoin is not the only story to be told here. We have strong competing altcoins that are on an even higher trajectory, they may even cross USD M1 before Bitcoin. I’ve removed some of the top 10 coins to make this chart clearer. /17pic.twitter.com/Z7DXOdyqCe	woonomic	57	22	1512274963	937175237673832448	https://twitter.com/woonomic/status/937175237673832448		#		0.09	0.1782	0.9944159467783056	1.0
bitcoin 	The data suggests by 2022, Bitcoin’s volatility will also be nearly as low as fiat FOREX. This means grandma can have a USD savings account earning 1% per year, or she can have a BTC savings account earning 1% per week at similar risk profiles. /16pic.twitter.com/V5GDlZNowv	woonomic	86	35	1512274903	937174986883772417	https://twitter.com/woonomic/status/937174986883772417				0.07	-0.1821	0.9944159467783056	1.0
bitcoin 	Seems small but we are 66% of the way on our journey to usurp USD M1 money. Let me reiterate, Bitcoin is 4 years out from exceeding the world reserve currency. Sounds radical, no? /15pic.twitter.com/zMwStZsQbY	woonomic	93	42	1512274847	937174751411408896	https://twitter.com/woonomic/status/937174751411408896				-0.06	-0.074	0.9944159467783056	1.0
bitcoin 	Here’s another view of # Bitcoin’s growth on a long term chart. Remember, each altitude climb here is a 10x. All crypto together today is only 0.5% of World M2 Money. /14pic.twitter.com/YxC4L7T6dj	woonomic	48	18	1512274794	937174531017531392	https://twitter.com/woonomic/status/937174531017531392		#		0.06	0.0954	0.9944159467783056	1.0
bitcoin 	If this trend continues, we are 9 years away from half the world using Bitcoin. /13	woonomic	69	21	1512274722	937174227500793856	https://twitter.com/woonomic/status/937174227500793856				0.44	0.0	0.9944159467783056	1.0
bitcoin 	With Bitcoin we are seeing user count double every 12 months. This was calculated with my work tracking Google Trends data on the assumption that users search BTCUSD price. More here: http://woobull.com/woos-law-of-bitcoin-user-growth-bitcoins-adoption-curve/ … /12pic.twitter.com/2Izs2LGWAm	woonomic	38	14	1512274681	937174056360607744	https://twitter.com/woonomic/status/937174056360607744				0.09	0.0	0.9944159467783056	1.0
bitcoin 	Note this is a laggy indicator and is best used to distinguish overvaluation (hence bear season) from a consolidation during the dead-cat bounce phase of a price correction. More here: https://www.forbes.com/sites/wwoo/2017/09/29/is-bitcoin-in-a-bubble-check-the-nvt-ratio/ … /9	woonomic	32	6	1512274474	937173186940162049	https://twitter.com/woonomic/status/937173186940162049				0.78	0.3185	0.9944159467783056	1.0
bitcoin 	NVT Ratio is another invention of mine. This works like Bitcoin’s PE Ratio, indicating when BTC price has outstripped fundamental value, also like PE Ratio for young fast growth companies, it is higher in the earlier high growth phase for Bitcoin. /8pic.twitter.com/Nb2cTtIVEk	woonomic	34	12	1512274421	937172963727724544	https://twitter.com/woonomic/status/937172963727724544				0.60	0.297	0.9944159467783056	1.0
bitcoin 	Interestingly, at the Bcash fork, I also noted that BCH started trading the 3 cats pattern, which suggested to me that the old time Bitcoiners were trading this market, not the normal Bitcoiner + Wall St Hybrid we were seeing in the BTC market. /7	woonomic	24	5	1512274366	937172733053624321	https://twitter.com/woonomic/status/937172733053624321				-0.09	0.2009	0.9944159467783056	1.0
bitcoin 	This was at the time of the ETF decision, my theory was that Wall St money failed to enter via an ETF, so instead directly bought in around Mar 2017, that changed the psychological trading profile that Bitcoin was trading. A new animal had entered the market. /6	woonomic	28	4	1512274313	937172511279677441	https://twitter.com/woonomic/status/937172511279677441				-0.21	-0.1702	0.9944159467783056	1.0
bitcoin 	Cash Deposit ROI - 1% per year # Bitcoin ROI - 4.5% per week	woonomic	212	79	1512261385	937118287674134529	https://twitter.com/woonomic/status/937118287674134529		#		-0.14	0.0	0.9944159467783056	1.0
