currency	tweet	username	favorites	retweets	date	id	permalink	geo	hashtags	mentions	lex_sent	vader_sent	cnn_sent	cnn_pos_neg
bitcoin 	What's Next for # Blockchain? http://bit.ly/2rj0svZ @ McKinsey # bitcoin # fintech # banking # techpic.twitter.com/sJTL6pVBHg	JimMarous	10	18	1494878702	864210032824643584	https://twitter.com/JimMarous/status/864210032824643584		# # # # #	@	0.38	0.0	0.9540843568057902	1.0
bitcoin litecoin 	I'm guessing he means that's worse because Litecoin is a bigger threat if Litecoin starts to displace Bitcoin's usage.	SatoshiLite	26	1	1494884052	864232473286238208	https://twitter.com/SatoshiLite/status/864232473286238208				-0.32	-0.7579	0.9540843568057902	1.0
bitcoin litecoin 	On Bitcoin Core slack's # uasf channel, @ LukeDashjr talking about Litecoin potentially a threat to Bitcoin. A surprising turn of events! pic.twitter.com/hP4DKjtQD5	SatoshiLite	273	131	1494883545	864230346778230785	https://twitter.com/SatoshiLite/status/864230346778230785		#	@	0.26	-0.0628	0.9540843568057902	1.0
bitcoin litecoin 	Solution: (This is not a brainwallet. Private key is the Bitcoin equivalent of the Litecoin private key in the hint.)https://twitter.com/SatoshiLite/status/863957238368436224 …	SatoshiLite	5	4	1494827081	863993515805523968	https://twitter.com/SatoshiLite/status/863993515805523968				0.50	0.1061	0.9540843568057902	1.0
bitcoin 	Sorry about that. Bitcoin fees are annoying.	SatoshiLite	2	0	1494817641	863953921659682816	https://twitter.com/SatoshiLite/status/863953921659682816				-0.43	-0.2395	0.9540843568057902	1.0
bitcoin 	Solution: silver to bitcoin’s gold	SatoshiLite	15	4	1494810808	863925263255584768	https://twitter.com/SatoshiLite/status/863925263255584768				-0.20	0.3182	0.9540843568057902	1.0
bitcoin 	Thanks to Blockstream's intentional plan bitcoin fees are higher, double spends are easier, and confirmations take longer than ever before.pic.twitter.com/bTxMBjDQPW	rogerkver	138	52	1494864831	864151850584489984	https://twitter.com/rogerkver/status/864151850584489984				0.00	0.6908	0.9540843568057902	1.0
bitcoin 	Hackers who infected 200,000 machines have only made $50k worth of # bitcoin http://www.cnbc.com/2017/05/15/wannacry-ransomware-hackers-have-only-made-50000-worth-of-bitcoin.html … # blockchain # cybercrime # wannacryattack	BrettKing	11	11	1494865609	864155114197721093	https://twitter.com/BrettKing/status/864155114197721093		# # # #		0.30	-0.3182	0.9540843568057902	1.0
bitcoin 	"""What are people using Bitcoin for?"" https://blog.bitcoinbrains.com/what-are-people-using-bitcoin-for-47dbb30ea5a2 …pic.twitter.com/oioLE0vE7I"	TuurDemeester	49	24	1494881315	864220992071020544	https://twitter.com/TuurDemeester/status/864220992071020544				0.43	0.0	0.9540843568057902	1.0
bitcoin 	$1,000 invested in Bitcoin 6 years ago would be worth over half a million today.https://twitter.com/frankdchaparro/status/864159970497114112 …	TuurDemeester	300	206	1494876152	864199337777086464	https://twitter.com/TuurDemeester/status/864199337777086464				0.13	0.1132	0.9540843568057902	1.0
bitcoin 	Theymos shares his thoughts on @ RSKsmart / # rootstock. https://www.reddit.com/r/Bitcoin/comments/6b7a4t/rsk_is_launching_in_8_days/ …pic.twitter.com/0lBsJRT5Du	TuurDemeester	59	31	1494815323	863944201922203648	https://twitter.com/TuurDemeester/status/863944201922203648		#	@	0.27	0.148	0.9540843568057902	1.0
bitcoin 	Fact: Bitcoin is the malware economy's life-blood. Opinion: Ransomware puts us on a fast track towards a secure and encrypted internet.	TuurDemeester	153	47	1494813201	863935301139312640	https://twitter.com/TuurDemeester/status/863935301139312640				0.24	0.17	0.9540843568057902	1.0
bitcoin 	Shoutout to http://bitrefill.com , a startup helping people top up their phone with bitcoin.https://twitter.com/ziggamon/status/863806644219785216 …	TuurDemeester	65	27	1494812114	863930740605464576	https://twitter.com/TuurDemeester/status/863930740605464576				0.00	0.2294	0.9540843568057902	1.0
bitcoin 	Very exciting roadmap towards an SPV Tumblebit Bitcoin wallet (i.e. with built-in trustless coin mixer for financial privacy):https://twitter.com/nopara73/status/863752281015164928 …	TuurDemeester	42	19	1494811454	863927972591321088	https://twitter.com/TuurDemeester/status/863927972591321088				0.28	0.0153	0.9540843568057902	1.0
bitcoin 	. @ GlobalBoost-Y ( $ BSTY ) $0.003937 (Up 15.98%) 0.00000229 BTC (Up 19.30%) # Bitcoin # Blockchain	NetworksManager	10	6	1494874510	864192448440004608	https://twitter.com/NetworksManager/status/864192448440004608		# #	@	0.39	0.0	0.9540843568057902	1.0
bitcoin 	$ XRP = $.25 # crypto # fintech # bitcoin # blockchainpic.twitter.com/zKFJOYd6Gn	haydentiff	58	17	1494867684	864163817126858752	https://twitter.com/haydentiff/status/864163817126858752		# # # #		0.50	0.0	0.9540843568057902	1.0
bitcoin 	I own crypto to learn, understand, & connect with others. I play poker to gamble. Or Mini-Baccarat if I'm in Vegas... @ BitcoinBelle, Vegas?pic.twitter.com/suDb1ovLXt	haydentiff	7	2	1494812891	863934000750002180	https://twitter.com/haydentiff/status/863934000750002180			@	0.04	0.1133	0.9540843568057902	1.0
bitcoin 	I just published “Why Bitcoin is Different than other Cryptocurrencies”https://medium.com/p/why-bitcoin-is-different-than-other-cryptocurrencies-e16b17d48b94 …	jimmysong	121	51	1494875744	864197624332783616	https://twitter.com/jimmysong/status/864197624332783616				0.20	0.0	0.9540843568057902	1.0
bitcoin 	Can Crypto-Currency Overturn Governments? # Bitcoin Subscribe--> https://dollarvigilante.com/2tt pic.twitter.com/1Wbix8IiRP	DollarVigilante	11	8	1494816611	863949602218758145	https://twitter.com/DollarVigilante/status/863949602218758145		#		0.12	0.0	0.9540843568057902	1.0
bitcoin 	I liked a @ YouTube video http://youtu.be/J_MZ6GcSnQ0?a  German Central Bank Warns Not To Use Bitcoin As It Is Not Backed By A Central Bank	DollarVigilante	5	12	1494810063	863922137198931968	https://twitter.com/DollarVigilante/status/863922137198931968			@	0.29	0.3612	0.9540843568057902	1.0
bitcoin 	# HappyMonday @ DataSci_AE @ BitcoinGhana @ shanak thanks for being top engaged members in my community last week :)	dinisguarda	2	0	1494875800	864197859817783297	https://twitter.com/dinisguarda/status/864197859817783297		#	@ @ @	0.20	0.8555	0.9540843568057902	1.0
bitcoin 	Big -> Norway's Largest Online Bank Integrates # Bitcoin Accounts # fintech # payments # blockchainhttps://news.bitcoin.com/norways-online-bank-bitcoin-accounts/ …	sbmeunier	23	22	1494884628	864234885422223360	https://twitter.com/sbmeunier/status/864234885422223360		# # # #		0.12	0.0	0.9540843568057902	1.0
bitcoin 	At this point, any function can be expressed as a linear combination of existing Bitcoin scaling proposals. The new Fourier Transform.	el33th4xor	20	2	1494865089	864152936368099328	https://twitter.com/el33th4xor/status/864152936368099328				0.33	0.0	0.9540843568057902	1.0
bitcoin 	Until recently, all cryptocurrencies would have taken a huge hit if Bitcoin were to collapse, for whatever reason.	el33th4xor	0	0	1494844825	864067939577716737	https://twitter.com/el33th4xor/status/864067939577716737				-0.11	-0.2263	0.9540843568057902	1.0
bitcoin 	This isn't right: Bitcoin's price could be close to 0 and the attacks would still work and BTC would still be used for ransom payments.	el33th4xor	7	1	1494842713	864059083053072384	https://twitter.com/el33th4xor/status/864059083053072384				-0.16	-0.4404	0.9540843568057902	1.0
bitcoin 	Did I call for the death of Bitcoin? No. Would someone who thinks Bitcoin will die dedicate his career to cryptocurrencies? No.	el33th4xor	1	0	1494842153	864056736243564544	https://twitter.com/el33th4xor/status/864056736243564544				0.00	-0.4477	0.9540843568057902	1.0
bitcoin 	Homeland Security's U.S. Citizenship and Immigration Considers # Bitcoinhttps://news.bitcoin.com/homeland-securitys-u-s-immigration-bitcoin/ …	BitcoinByte	0	0	1494882438	864225699917438976	https://twitter.com/BitcoinByte/status/864225699917438976		#		0.00	0.0	0.9540843568057902	1.0
bitcoin 	Bitcoin’s surge fuels fears of asset bubble @ FT # bitcoin # ICO # blockchain https://webcache.googleusercontent.com/search?q=cache:oUnq9FQbJPMJ:https://www.ft.com/content/ce3ef54e-371b-11e7-bce4-9023f8c0fd2e+&cd=2&hl=en&ct=clnk&gl=uk&client=safari …	BitcoinByte	6	4	1494833362	864019862905114625	https://twitter.com/BitcoinByte/status/864019862905114625		# # #	@	0.44	-0.0772	0.9540843568057902	1.0
bitcoin 	Excellent read: # Bitcoin’s surge fuels fears of asset bubble http://on.ft.com/2qjDqoH  via @ FT	obussmann	0	0	1494869230	864170303391490048	https://twitter.com/obussmann/status/864170303391490048		#	@	1.00	0.5267	0.9540843568057902	1.0
bitcoin 	# Bitcoin BIP 202 lineage: - BIP 102 - Plus @ adam3us 's 2-4-8 - Plus @ f2pool_wangchun suggest per-block increment Min. econ shock per block.https://twitter.com/Zonacats1/status/863896477420187648 …	jgarzik	22	12	1494813783	863937741435916288	https://twitter.com/jgarzik/status/863937741435916288		#	@ @	0.23	-0.2235	0.9540843568057902	1.0
bitcoin 	Not sure what I wrote this week to make the top 20 influencers in # blockchain again, but I'll take it # bitcoinhttps://twitter.com/Richtopia/status/864151471968985088 …	michaelterpin	2	1	1494878669	864209891686273025	https://twitter.com/michaelterpin/status/864209891686273025		# #		0.17	0.2617	0.9540843568057902	1.0
bitcoin 	"""Blockchain, the decentralized technology behind bitcoin, could offer privacy and safety to people who have... http://fb.me/3lGorvzSS"	tonilanec	1	0	1494870677	864176373652492288	https://twitter.com/tonilanec/status/864176373652492288				0.25	0.4215	0.9540843568057902	1.0
bitcoin 	With no currency of their own, Palestinians eye # bitcoin as alternative to Israeli cashhttp://www.haaretz.com/middle-east-news/palestinians/1.788853 …	Anne_Connelly	2	0	1494808314	863914805069053952	https://twitter.com/Anne_Connelly/status/863914805069053952		#		0.07	-0.296	0.9540843568057902	1.0
bitcoin 	. @ pwuille at it again. This would save http://statoshi.info 's CPU; spikes are gettxoutsetinfo calls. https://lists.linuxfoundation.org/pipermail/bitcoin-dev/2017-May/014337.html …pic.twitter.com/5SV3sFhYuV	lopp	31	6	1494880256	864216549422497792	https://twitter.com/lopp/status/864216549422497792			@	0.06	0.1235	0.9540843568057902	1.0
bitcoin 	The best bitcoin volatility chart I've seen, courtesy of @ dangermouse117: http://charts.woobull.com/bitcoin-volatility/ …pic.twitter.com/H42dKIy5sq	lopp	56	24	1494877098	864203302468296705	https://twitter.com/lopp/status/864203302468296705			@	0.83	0.7717	0.9540843568057902	1.0
bitcoin 	@ maxkeiser @ stacyherbert You asked about Bitcoin's monetary velocity; @ dangermouse117 has a great chart here: http://charts.woobull.com/bitcoin-velocity/ …pic.twitter.com/tSwrTtgqub	lopp	5	0	1494876493	864200768433393664	https://twitter.com/lopp/status/864200768433393664			@ @ @	0.61	0.6249	0.9540843568057902	1.0
bitcoin 	Basically, what used to be a fast confirmation bitcoin tx fee 4 months ago is now the minimum to ever get confirmed.https://twitter.com/lopp/status/864108796414767105 …	lopp	20	12	1494856634	864117472705871872	https://twitter.com/lopp/status/864117472705871872				0.18	0.1806	0.9540843568057902	1.0
bitcoin 	Bitcoin is backed by the full faith and credit of physics. Bitcoin is bolstered by the failed faith and credit of nation states.	lopp	90	30	1494799270	863876868558266369	https://twitter.com/lopp/status/863876868558266369				0.26	0.4718	0.9911014678635343	1.0
bitcoin 	Financial pundits who posted how # bitcoin would go to zero should lose all credibility for shit talking the hottest investment of the decade	CryptoHustle	70	14	1494859767	864130611698708480	https://twitter.com/CryptoHustle/status/864130611698708480		#		0.38	-0.743	0.9540843568057902	1.0
bitcoin 	# Bitcoin price yesterday on Bitstamp: $1820, Now: $1745 (- $75). Okcoin quarterly yesterday: $1700, Now: $1490 (-$210). Ok then.pic.twitter.com/guEeaWTkTl	WhalePanda	45	13	1494855023	864110713253625857	https://twitter.com/WhalePanda/status/864110713253625857		#		0.25	0.0987	0.9540843568057902	1.0
bitcoin 	Looks like your work @ BKBrianKelly. News coming out of # China that would cause # bitcoin 2 drop so precipitously @ OKCoin? h/t @ chengevelynpic.twitter.com/zCcHkLbVvp	cburniske	12	11	1494865312	864153868690743296	https://twitter.com/cburniske/status/864153868690743296		# #	@ @ @	0.15	0.0293	0.9540843568057902	1.0
bitcoin ripple 	Please explain what my agenda is? I am very confused now? Because my haters have been arguing for Bitcoin & against ripple all day.	ToneVays	1	0	1494878264	864208195304148993	https://twitter.com/ToneVays/status/864208195304148993				0.42	-0.2658	0.9540843568057902	1.0
bitcoin 	Wow, this is amazing, how come the # Bitcoin dominance index is NOT using Total Supply? Completely different perspective on reality!pic.twitter.com/88PjCuWlpR	ToneVays	28	12	1494876632	864201349210230784	https://twitter.com/ToneVays/status/864201349210230784		#		0.43	0.4278	0.9540843568057902	1.0
bitcoin 	In 45min (4pm ET) # StockMarket & # Bitcoin Live show w/ Q&A $ BTCUSD # WannaCry $ SPX $ GOLD $ OIL $ EURUSD $ EURGBPhttps://www.youtube.com/watch?v=wjCOpAJlcoI …	ToneVays	25	10	1494875651	864197235583668224	https://twitter.com/ToneVays/status/864197235583668224		# # #		0.30	0.0	0.9540843568057902	1.0
bitcoin 	I don't understand what you are arguing? All i'm saying is that if $ XRP goes up another 5 cents to 0.30 it's MCap would be > than # Bitcoin.	ToneVays	2	1	1494874150	864190938100498432	https://twitter.com/ToneVays/status/864190938100498432		#		0.17	-0.2294	0.9540843568057902	1.0
bitcoin 	Satoshi's 1 Million or so BTC has never been in circulation, how come they are still factored into # Bitcoin's MCap?	ToneVays	1	0	1494872931	864185825990504450	https://twitter.com/ToneVays/status/864185825990504450		#		-0.05	0.0	0.9540843568057902	1.0
bitcoin 	Since the Math is too complicated for some, I will just use @ bravenewcoin listing since they understand how to calculate MCap. # Bitcoinpic.twitter.com/59VjSObLDt	ToneVays	35	15	1494872261	864183016750501888	https://twitter.com/ToneVays/status/864183016750501888		#	@	0.42	0.0	0.9540843568057902	1.0
bitcoin 	The # Shitcoin bubble is getting so out of hand that MCap of $ XRP pre-mind scam token + its clone $ XLM pre-mind scam token is > # Bitcoinpic.twitter.com/W9WxhYBJtP	ToneVays	155	82	1494869516	864171501750190082	https://twitter.com/ToneVays/status/864171501750190082		# #		0.40	-0.6041	0.9540843568057902	1.0
bitcoin 	"So $ DASH ""the Digital Trash"" continues to frustrate its bag holders & trolls by not putting them out of their misery # Dashpay # Bitcoinpic.twitter.com/p21AobrJjN"	ToneVays	26	7	1494848708	864084226114715648	https://twitter.com/ToneVays/status/864084226114715648		# #		0.15	-0.7717	0.9540843568057902	1.0
