currency	tweet	username	favorites	retweets	date	id	permalink	geo	hashtags	mentions	lex_sent	vader_sent	cnn_sent	cnn_pos_neg
bitcoin ripple 	People seem to have a problem w/ using Total Supply for MCap, Why? 1. # Ripple is a Centralized Token Created by 3 guys. There is NOTHING preventing them from selling all to exit scam. 2. Satoshi's # Bitcoin r way less likely to ever Trade + Lost Coins, but yet they count in MCap?	ToneVays	412	114	1514673557	947235670816378882	https://twitter.com/ToneVays/status/947235670816378882		# #		0.20	-0.1505	0.9696715661716382	-1.0
bitcoin 	Dude, how new are you? Do you even know what a # Blockchian is good for? http://www.libertylifetrail.com/2016/04/04/the-top-use-cases-for-bitcoin/ …	ToneVays	8	0	1514672639	947231822722805760	https://twitter.com/ToneVays/status/947231822722805760		#		0.41	0.1468	0.9696715661716382	-1.0
bitcoin 	Then how come Satoshi's coins and Bitcoins burned forever count towards # Bitcoin Circulating Supply? MCap should be lower by at least 15% for Bitcoin if that's your logic.	ToneVays	0	0	1514669255	947217627742724099	https://twitter.com/ToneVays/status/947217627742724099		#		0.07	-0.148	0.9696715661716382	-1.0
bitcoin ripple 	That Makes no sense, in that case we should drop the Market Cap of # Bitcoin by 15% at least cause Satoshi's coins have a smaller probability of moving than the current Ripple shit they claim is locked away cause they say so.	ToneVays	14	1	1514669163	947217242550304769	https://twitter.com/ToneVays/status/947217242550304769		#		0.26	-0.7845	0.9696715661716382	-1.0
bitcoin ripple 	I would like to Officially Declare Dec 30th, 2017 as the 2nd Dumbest Day in # Crypto History. # Ripple # XRP $ XRP $ XRPUSD $ XRPBTC MCap Rising ABOVE # Bitcoin $ BTCUSD is only second to the # Auroracoin $ AUR $ AURBTC $ AURUSD = $100 Fiasco of March 4th, 2014pic.twitter.com/BXv1yXILXT	ToneVays	1151	404	1514657873	947169887503437825	https://twitter.com/ToneVays/status/947169887503437825		# # # # #		0.20	-0.3565	0.9696715661716382	-1.0
bitcoin ripple 	# Bitcoin Morning Brief w/ @ jimmysong - Kidnappers make $1M, Miner burns reward, YES # Ripple $ XRP is still a # Scam regardless of $ XRPUSD $ XRPBTC price just watch Me & @ petertoddbtc https://www.youtube.com/watch?v=mQKxSVLLfAk&index=4&list=PLQBwZ2xry6ebYoZktlQeeKDGeJaMP5EJ1 … Today's Video:https://youtu.be/CqA7YrRWgXE	ToneVays	162	49	1514649710	947135649995517953	https://twitter.com/ToneVays/status/947135649995517953		# # #	@ @	0.53	0.5319	0.9696715661716382	-1.0
bitcoin ripple 	I don't even trade # Bitcoin, why would I touch # Ripple nonsense?	ToneVays	8	0	1514589516	946883178513432576	https://twitter.com/ToneVays/status/946883178513432576		# #		-0.08	-0.4019	0.897060296344794	1.0
bitcoin 	No, by my logic the Internet was a Non-Scam... AMZN was http://Pets.com  that happen to get shit right using the Internet... Companies that use the # Bitcoin # Blockchain might survive a handful of them... Altcoins are an AMZN charging for products in $ AMZN stock	ToneVays	6	2	1514589029	946881134671138816	https://twitter.com/ToneVays/status/946881134671138816		# #		0.11	-0.7003	0.897060296344794	1.0
bitcoin 	# Bitcoin continues to be in a NO TRADE Zone, I think this is the 3rd time i'm tweeting out this type of $ BTCUSD Chart. Wait for the Symmetric Triangle show you which direction things will move.pic.twitter.com/9IIvGFjLjz	ToneVays	539	176	1514588590	946879294931980290	https://twitter.com/ToneVays/status/946879294931980290		#		0.26	-0.2233	0.897060296344794	1.0
bitcoin 	$ XRP can go to $100 dollars a token by tomorrow... making it's MCap 10 Trillion Dollars. The fact that the token is totally useless and should not exist should tell you something about to stupidity of speculators... when it goes to 0 over night they will blame # Bitcoin & Core	ToneVays	30	4	1514588497	946878903997665280	https://twitter.com/ToneVays/status/946878903997665280		#		0.29	-0.4061	0.897060296344794	1.0
bitcoin 	Bitcoin <12,000	Sunchartist	9	2	1514640010	947094963346481153	https://twitter.com/Sunchartist/status/947094963346481153				0.00	0.0	0.9696715661716382	-1.0
bitcoin 	Bitcoinpic.twitter.com/mcQZSKDhfg	Sunchartist	2	0	1514600634	946929809539477504	https://twitter.com/Sunchartist/status/946929809539477504				0.00	0.0	0.9696715661716382	-1.0
bitcoin 	Bitcoin continues to hold 12k over and over. If for any reason we break 12k again the next break may see 8k quickly. If for any reason 8k breaks it may be time to start thinking about another 90% decline back to where it was 2 years ago.	Bamabroker	45	10	1514665698	947202709299646464	https://twitter.com/Bamabroker/status/947202709299646464				0.12	0.0	0.9696715661716382	-1.0
bitcoin 	Impressive.. while I am not saying 800.. I know 90% of crypto zombies assume bitcoin hits 8000 at worse if 12k breaks(it is).. to me that says 8000 breaks and we see 3000 or 5000.. to blown up all the chasers of last half yearhttps://twitter.com/russian_market/status/947052697651499008 …	Bamabroker	24	3	1514640464	947096868743458816	https://twitter.com/Bamabroker/status/947096868743458816				-0.04	-0.2384	0.9696715661716382	-1.0
