currency	tweet	username	favorites	retweets	date	id	permalink	geo	hashtags	mentions	lex_sent	vader_sent	cnn_sent	cnn_pos_neg
bitcoin 	Is the Bitcoin correction over?	maxkeiser	15	8	1495831203	868205108898693120	https://twitter.com/maxkeiser/status/868205108898693120				0.80	0.0	0.9590034514464101	1.0
bitcoin 	Let the whole thing collapse and rebuild as Bitcoin-ocracy.https://twitter.com/jamesgrickards/status/868099988756340737 …	maxkeiser	31	14	1495806299	868100655189291011	https://twitter.com/maxkeiser/status/868100655189291011				-0.22	-0.247	0.9590034514464101	1.0
bitcoin 	Gold is the poor man's Bitcoin.	maxkeiser	336	158	1495803684	868089689168859139	https://twitter.com/maxkeiser/status/868089689168859139				-0.50	-0.4767	0.9590034514464101	1.0
bitcoin 	Vinny Lingham Embarks on Identity Management Quest With Civic https://bitcoinmagazine.com/articles/vinny-lingham-embarks-identity-management-quest-civic/ … via @ BitcoinMagazine	VinnyLingham	26	5	1495825589	868181561904046080	https://twitter.com/VinnyLingham/status/868181561904046080			@	0.08	0.0	0.9590034514464101	1.0
bitcoin 	Could the price of Bitcoin hit $1 million? Oh Hell yes!!https://www.fool.com/investing/2017/05/25/could-the-price-of-bitcoin-go-to-1-million.aspx …	officialmcafee	145	68	1495750160	867865190531907584	https://twitter.com/officialmcafee/status/867865190531907584				0.27	-0.18	0.9258213487432811	-1.0
bitcoin 	How # Coinbase crashed due to the recent # bitcoin rush https://techcrunch.com/2017/05/25/coinbase-outage-unprecedented-bitcoin-interest/ … # blockchain # fintech # bitcoinprice # bitcoinbubble # technews	BrettKing	9	20	1495811927	868124260908269568	https://twitter.com/BrettKing/status/868124260908269568		# # # # # # #		0.36	0.0	0.9590034514464101	1.0
bitcoin 	Wired: How One Scrappy Startup Survived the Early Bitcoin Wars https://www.wired.com/2017/05/one-scrappy-startup-survived-early-bitcoin-wars/?mbid=social_twitter_onsiteshare … via @ WIRED	ErikVoorhees	27	10	1495830812	868203471052210176	https://twitter.com/ErikVoorhees/status/868203471052210176			@	0.29	-0.0772	0.9590034514464101	1.0
bitcoin 	Wall St Journal: # bitcoin fell $300 on Thursday afternoon - and still rose on the day https://blogs.wsj.com/moneybeat/2017/05/25/scorching-hot-bitcoin-drops-300-in-an-hour-and-still-rises-on-the-day/ … via @ WSJMoneyBeat # finance	ErikVoorhees	86	54	1495752515	867875071032995842	https://twitter.com/ErikVoorhees/status/867875071032995842		# #	@	0.22	0.0	0.9258213487432811	-1.0
bitcoin 	It's hard to be bullish on something you don't own. # Bitcoin	TuurDemeester	82	18	1495835805	868224414164418560	https://twitter.com/TuurDemeester/status/868224414164418560		#		-0.17	-0.0513	0.9590034514464101	1.0
bitcoin 	"His first words: ""So I wanted to ask your thoughts on The Bitcoin..."""	TuurDemeester	37	3	1495814030	868133081886150660	https://twitter.com/TuurDemeester/status/868133081886150660				0.00	0.0	0.9590034514464101	1.0
bitcoin 	Bitcoin.	TuurDemeester	1	0	1495805981	868099322189144067	https://twitter.com/TuurDemeester/status/868099322189144067				0.00	0.0	0.9590034514464101	1.0
bitcoin 	Current price of one GlobalBoost-Y $ BSTY is: $0.008752 or 0.00000368 BTC Buy & Mine today! # Blockchain # Bitcoinpic.twitter.com/CTiMzlJ9hL	NetworksManager	9	11	1495818817	868153158077476864	https://twitter.com/NetworksManager/status/868153158077476864		# #		0.60	0.0	0.9590034514464101	1.0
bitcoin ripple 	Bitcoin is a currency and payment network. Ripple is a (currency agnostic) global exchange.https://www.quora.com/Is-Ripple-similar-to-Bitcoin/answer/Tiffany-Hayden-3?srid=2K61 …	haydentiff	0	0	1495797699	868064586309787648	https://twitter.com/haydentiff/status/868064586309787648				-0.14	0.0	0.9590034514464101	1.0
bitcoin 	Bitcoin isn't an exchange.	haydentiff	1	0	1495797227	868062605650403328	https://twitter.com/haydentiff/status/868062605650403328				-0.25	0.0	0.9590034514464101	1.0
bitcoin ripple 	You don't get it. Rather than create something artificial, bring whatever you use now into Ripple. Like https://localbitcoins.com/ .	haydentiff	1	0	1495791261	868037580490670081	https://twitter.com/haydentiff/status/868037580490670081				0.06	0.2115	0.9590034514464101	1.0
bitcoin 	Are there any grassroots efforts to get merchants on board? Many retailers are giving up on Bitcoin because nobody is spending it.	haydentiff	2	2	1495763183	867919816119787520	https://twitter.com/haydentiff/status/867919816119787520				0.32	0.17	0.9590034514464101	1.0
bitcoin 	Not for the people who believe Bitcoin should be used to store wealth and not to make everyday transactions. Different priorities.	haydentiff	3	0	1495763091	867919426397630468	https://twitter.com/haydentiff/status/867919426397630468				-0.05	0.247	0.9590034514464101	1.0
bitcoin 	I bought an Applebee's gift card from Gyft yesterday and the transaction fee was $4.88. Bitcoin is becoming unaffordable for me to use.	haydentiff	5	1	1495759517	867904438127792131	https://twitter.com/haydentiff/status/867904438127792131				-0.04	0.2202	0.9590034514464101	1.0
bitcoin 	Only 1,123 days until the next bitcoin halving	barrysilbert	261	76	1495761724	867913693685624834	https://twitter.com/barrysilbert/status/867913693685624834				-0.25	0.0	0.9590034514464101	1.0
bitcoin 	it's not good, but they think retail is killer app. or they want to force a security scale tradeoff for the good of bitcoin (in their mind).	adam3us	0	0	1495811269	868121501207334912	https://twitter.com/adam3us/status/868121501207334912				0.22	-0.0721	0.9590034514464101	1.0
bitcoin 	people ask me how @ blockstream hires top bitcoin people. my answer is density of intensity, and to genuinely have cypherpunk, # bitcoin DNA.	adam3us	96	37	1495811111	868120838943461376	https://twitter.com/adam3us/status/868120838943461376		#	@	0.21	0.1012	0.9590034514464101	1.0
bitcoin 	often it's philosophical: devs want independence to do the right thing and have fealty to bitcoin users first. some businesses dont get that	adam3us	21	8	1495810635	868118841884278788	https://twitter.com/adam3us/status/868118841884278788				0.13	0.0386	0.9590034514464101	1.0
bitcoin 	bitcoin does get extra reliability from fact that multiple miners & fullnodes will reject invalid things if your own computer is unreliable.	adam3us	7	0	1495810379	868117769367285760	https://twitter.com/adam3us/status/868117769367285760				0.45	-0.4019	0.9590034514464101	1.0
bitcoin 	get the impression most of the players consider themselves pro-bitcoin advocates. problem is they don't all agree on tradeoffs to optimise.	adam3us	1	0	1495782504	868000854061850624	https://twitter.com/adam3us/status/868000854061850624				0.38	-0.0012	0.9590034514464101	1.0
bitcoin 	i did read about someone who's father was a jeweler, and he had him engrave his bitcoin private key on the inside of a ring.	adam3us	6	0	1495780343	867991787364786176	https://twitter.com/adam3us/status/867991787364786176				0.04	0.0	0.9590034514464101	1.0
bitcoin 	Bitcoin and AltCoins Take A Well Deserved Breather and A Response to Natural News: http://youtu.be/Hc6_o09vm1c?a  via @ YouTube	DollarVigilante	9	58	1495807379	868105183548522497	https://twitter.com/DollarVigilante/status/868105183548522497			@	0.22	0.5574	0.9590034514464101	1.0
bitcoin 	What Fidelity's Abigail Johnson Has To Say About # Bitcoin And # Blockchain - Investor's Business Dailyhttps://apple.news/A7v3UuqI7NXyVe2eV8kvx9Q …	dinisguarda	0	0	1495823380	868172300625080320	https://twitter.com/dinisguarda/status/868172300625080320		# #		0.24	0.0	0.9590034514464101	1.0
bitcoin 	# Bitcoin is going wild — here's what the # cryptocurrency is all about http://www.businessinsider.com/what-is-bitcoin-the-cryptocurrency-explained-2017-5 …pic.twitter.com/V4w88LFwqi	dinisguarda	0	3	1495782666	868001531211198466	https://twitter.com/dinisguarda/status/868001531211198466		# #		0.53	0.0	0.9590034514464101	1.0
bitcoin ethereum 	Bigger than # bitcoin? Enterprise # Ethereum Alliance grows in size - CNBC # blockchainhttps://apple.news/AMZiqap67Ryq8I-PbcwAKOQ …	dinisguarda	3	13	1495759340	867903696922955776	https://twitter.com/dinisguarda/status/867903696922955776		# # #		0.27	0.0	0.9590034514464101	1.0
bitcoin 	The 2 Biggest Problems Holding Back the # Bitcoin # Blockchain - Inversehttps://apple.news/A9lnG8GDhQraFYjLml-Ph2Q …	dinisguarda	1	4	1495759268	867903393687363584	https://twitter.com/dinisguarda/status/867903393687363584		# #		0.38	-0.4019	0.9590034514464101	1.0
bitcoin 	Can # Bitcoin Cryptographic Technology Help the Environment? - TechDigghttps://apple.news/A3a6YvMYpT6iVUtOzg_KYig …	dinisguarda	0	2	1495759248	867903311344787456	https://twitter.com/dinisguarda/status/867903311344787456		#		0.50	0.2009	0.9590034514464101	1.0
bitcoin 	# Bitcoin plunges more than $300 after earlier hitting all-time highhttp://cnb.cx/2rUkM7A	dinisguarda	0	0	1495753078	867877430069014528	https://twitter.com/dinisguarda/status/867877430069014528		#		0.09	0.0	0.9258213487432811	-1.0
bitcoin 	# Bitcoin Is Bigger Than Ever, And Here's Why That Matters # fintech # blockchain https://www.forbes.com/sites/ryanwhitwam/2017/05/26/bitcoin-is-bigger-than-ever-and-heres-why-that-matters/#5d7e6bd1323b …pic.twitter.com/9jAgg8dAdp	sbmeunier	2	3	1495822285	868167703886012416	https://twitter.com/sbmeunier/status/868167703886012416		# # # #5d7e6bd1323b		0.25	0.0258	0.9590034514464101	1.0
bitcoin 	"this @ barstoolsports short on # bitcoin is amazing. ""we are gonna mine the f* out of some bitcoinzzzz""http://www.barstoolsports.com/boston/barstool-shorts-bitcccoin/ …"	Melt_Dem	3	1	1495803405	868088518832214016	https://twitter.com/Melt_Dem/status/868088518832214016		#	@	0.53	0.2929	0.9590034514464101	1.0
bitcoin ethereum 	"""I was there at the beginning of the internet, & this is more exciting” - @ CathieDWood at # TokenSummit # ICO # bitcoin # Ethereum # crypto"	laurashin	98	46	1495831505	868206378728423426	https://twitter.com/laurashin/status/868206378728423426		# # # # #	@	0.36	0.0	0.9590034514464101	1.0
bitcoin ethereum 	Excellent post on how to handle the # ICO bubble; everyone in the space shd read http://continuations.com/post/161091248805/some-lessons-i-learned-from-the-dotcom-bubble-for … # bitcoin # ethereum # cryptocurrency	laurashin	12	5	1495828420	868193437211930626	https://twitter.com/laurashin/status/868193437211930626		# # # #		0.74	0.5719	0.9590034514464101	1.0
bitcoin ethereum 	Another great article on # TokenSummit by @ IanAllison123 http://www.ibtimes.co.uk/token-summit-2017-blockchain-engineers-say-avoid-ico-hype-1623398?utm_campaign=/token-summit-2017-blockchain-engineers-say-avoid-ico-hype-1623398 … # crypto # blockchain # bitcoin # ethereum # ico	laurashin	10	6	1495827992	868191644012732416	https://twitter.com/laurashin/status/868191644012732416		# # # # # #	@	0.75	0.6249	0.9590034514464101	1.0
bitcoin ethereum 	How to evaluate a # crypto asset or # ICO investment? @ ARKblockchain broke it down at # TokenSummit http://ow.ly/dkrS30c4WUU # bitcoin # ethereum	laurashin	2	1	1495827303	868188753520623617	https://twitter.com/laurashin/status/868188753520623617		# # # # #	@	0.21	-0.0301	0.9590034514464101	1.0
bitcoin ethereum 	Bubble? So What? # TokenSummit Marks # Cryptocurrency's Revitalization http://ow.ly/GsS330c4TIg # bitcoin # ethereum # ico # token	laurashin	21	13	1495824846	868178448954650625	https://twitter.com/laurashin/status/868178448954650625		# # # # # #		0.44	0.0	0.9590034514464101	1.0
bitcoin 	The Times UK: # Bitcoin hits record high in ‘price frenzy’http://www.thetimes.co.uk/article/a5d475ce-418a-11e7-9319-8b08a5454daf …	BitcoinByte	6	3	1495787121	868020216567083008	https://twitter.com/BitcoinByte/status/868020216567083008		#		0.64	0.0	0.9590034514464101	1.0
bitcoin 	Sounds good! Another # Bitcoin summit. Maybe @ brockpierce wants in on this. Love his perspective.	GerberKawasaki	9	4	1495805206	868096071897030658	https://twitter.com/GerberKawasaki/status/868096071897030658		#	@	0.94	0.2824	0.9590034514464101	1.0
bitcoin 	You let me know when Coinbase calls you back. Bitcoin is a fugazi. Enjoy it. Google is the internet. $ goog	GerberKawasaki	0	0	1495805125	868095732288339972	https://twitter.com/GerberKawasaki/status/868095732288339972				0.38	0.0988	0.9590034514464101	1.0
bitcoin 	Here is # KashCycle ep1 on # Bitcoin Everything you need to know about risk & reward. With @ kazonomics and @ rogerkverhttps://youtu.be/mNkZ_sWBxrM	GerberKawasaki	19	18	1495804207	868091881896296448	https://twitter.com/GerberKawasaki/status/868091881896296448		# #	@ @	0.17	0.1909	0.9590034514464101	1.0
bitcoin 	They put @ kevinolearytv on to talk Bitcoin, like putting on grandpa to talk about tinder.	GerberKawasaki	2	0	1495753281	867878282728882176	https://twitter.com/GerberKawasaki/status/867878282728882176			@	0.12	0.3612	0.9258213487432811	-1.0
bitcoin 	I don't short and I'm just as skeptical. Coinbase is down every other day! But i do like the idea of # bitcoin, you did convince me. I listen	GerberKawasaki	2	0	1495753047	867877299282104320	https://twitter.com/GerberKawasaki/status/867877299282104320		#		0.41	0.056	0.9258213487432811	-1.0
bitcoin 	No, just taking the optimists view that if bitcoins will be $500k each then ether should be near same stratospherehttp://uk.businessinsider.com/bitcoin-price-could-be-500000-by-2030-first-snapchat-investor-says-2017-3 …	Chris_Skinner	0	0	1495793329	868046256651874304	https://twitter.com/Chris_Skinner/status/868046256651874304				0.05	0.1027	0.9590034514464101	1.0
bitcoin 	Should I buy some bitcoin now? via Chris Skinner's blog - I'm being asked this a lot as the value ...http://tinyurl.com/yb3g82ad	Chris_Skinner	2	8	1495785981	868015435253501953	https://twitter.com/Chris_Skinner/status/868015435253501953				0.14	0.17	0.9590034514464101	1.0
bitcoin 	Three reasons why this time is different for bitcoin http://cnb.cx/2rpAiuX  More CNBC coverage on the # tokensummit @ token_summit @ NTmoney	wmougayar	2	1	1495829479	868197879256678400	https://twitter.com/wmougayar/status/868197879256678400		#	@ @	0.19	0.0	0.9590034514464101	1.0
bitcoin 	Bitcoin 'nerds' give way to Wall Street suits at digital currency conference http://cnb.cx/2rVH1Kb # tokensummit @ token_summit @ NTmoney	wmougayar	8	2	1495829055	868196103157538816	https://twitter.com/wmougayar/status/868196103157538816		#	@ @	0.32	0.0	0.9590034514464101	1.0
bitcoin 	It's fun to watch demand for @ paulvigna's + my book, The Age of Cryptocurrency, rise in correlation w/ bitcoin price https://www.amazon.com/Age-Cryptocurrency-Blockchain-Challenging-Economic/dp/1250081556/ref=zg_bs_10806607011_16?_encoding=UTF8&psc=1&refRID=NPMX533RNN3CCVZXCB57 …	mikejcasey	8	3	1495813111	868129225932505088	https://twitter.com/mikejcasey/status/868129225932505088			@	0.36	0.4215	0.9590034514464101	1.0
bitcoin 	So many parallels with Bitcoin todayhttps://twitter.com/paulg/status/868125358842925057 …	wences	38	13	1495815564	868139513956020225	https://twitter.com/wences/status/868139513956020225				0.17	0.0	0.9590034514464101	1.0
bitcoin 	This is pessimistic. While most people are burning paper gains from Bitcoin and Ether regulators will wait. When Grandma loses home? CRUSHhttps://twitter.com/SimonOusager/status/868091577939439616 …	leashless	4	0	1495810561	868118529899462656	https://twitter.com/leashless/status/868118529899462656				0.41	-0.1231	0.9590034514464101	1.0
bitcoin 	As bitcoin prices soar, messaging app Kik launches cryptocurrency payment service http://cnb.cx/2rkH855 # blockchain	Anne_Connelly	3	1	1495816731	868144412341219329	https://twitter.com/Anne_Connelly/status/868144412341219329		#		0.07	0.0	0.9590034514464101	1.0
bitcoin 	# bitcoins. $ BTCUSD. $2475 target hit as balloon pops. Way too many buyers bought for wrong reason. # BUBBLE	PeterLBrandt	59	14	1495835374	868222606473908224	https://twitter.com/PeterLBrandt/status/868222606473908224		# #		0.25	-0.0953	0.9590034514464101	1.0
bitcoin 	Maybe what he means is that the /exchanges/ actually own his bitcoins	lopp	8	0	1495835980	868225145328066561	https://twitter.com/lopp/status/868225145328066561				-0.17	0.0	0.9590034514464101	1.0
bitcoin 	If you don't like the price of Bitcoin, just count to 10 and hit F5.	lopp	113	29	1495821812	868165720152190978	https://twitter.com/lopp/status/868165720152190978				0.33	-0.2755	0.9590034514464101	1.0
bitcoin 	Each bull run mints a fresh round of Bitcoin Barons; congrats to HODLers who survived the trough of disillusionment.https://www.youtube.com/watch?v=fZfg1Gtcg08 …	lopp	44	7	1495805045	868095394387030016	https://twitter.com/lopp/status/868095394387030016				-0.05	0.3715	0.9590034514464101	1.0
bitcoin 	Why should I run a full node? # Bitcoin	onemanatatime	4	0	1495817062	868145797132566528	https://twitter.com/onemanatatime/status/868145797132566528		#		0.33	0.0	0.9590034514464101	1.0
bitcoin 	My http://1BrokerBTC.co # Bitcoin portfolio increased by 30% over the past week while I was doing nothing. ¯\_(ツ)_/¯pic.twitter.com/5W6ReSmjpv	onemanatatime	5	1	1495806325	868100766786961408	https://twitter.com/onemanatatime/status/868100766786961408		#		-0.11	0.1366	0.9590034514464101	1.0
bitcoin 	Hello $ CRYPTO! Looking for some PASSIVE income & EASY # Bitcoin? Create an account at http://1BrokerBTC.co , and follow the top traders!pic.twitter.com/dWXYlfluix	onemanatatime	11	1	1495805476	868097204627529734	https://twitter.com/onemanatatime/status/868097204627529734		#		0.18	0.4083	0.9590034514464101	1.0
bitcoin 	RT & help spread the word! Also posted the 0.25 $ BTC ETC MEME Bounty to /r/Bitcoin: https://redd.it/6dfpxv https://twitter.com/n3po/status/867683184565252096 …	onemanatatime	8	2	1495787925	868023590397935617	https://twitter.com/onemanatatime/status/868023590397935617				0.06	0.2287	0.9590034514464101	1.0
bitcoin 	To celebrate @ AppleByteMe's 3-year anniversary, they're giving away $ ABY just for subscribing & posting to Reddit: https://bitcointalk.org/index.php?topic=503131.msg19182070#msg19182070 …pic.twitter.com/DAH9QxAYbb	onemanatatime	4	3	1495768410	867941736353415168	https://twitter.com/onemanatatime/status/867941736353415168		#msg19182070	@	0.37	0.7269	0.9590034514464101	1.0
bitcoin 	$ BTC is my breakfast cereal... # bitcoinpic.twitter.com/gZWncnbfXJ	CryptoHustle	15	0	1495809143	868112583542403072	https://twitter.com/CryptoHustle/status/868112583542403072		#		0.25	0.0	0.9590034514464101	1.0
bitcoin 	If you watch every tick, you'll trade like a dick. Buy low sell high, take profits and don't be greedy. # Bitcoin	CharlieShrem	107	37	1495764184	867924014588735489	https://twitter.com/CharlieShrem/status/867924014588735489		#		0.23	0.0706	0.9590034514464101	1.0
bitcoin 	How OpenTimestamps 'Carbon Dated' (almost) The Entire Internet With One Bitcoin Transaction https://petertodd.org/2017/carbon-dating-the-internet-archive-with-opentimestamps …	peterktodd	116	62	1495793941	868048823498756096	https://twitter.com/peterktodd/status/868048823498756096				0.15	0.0	0.9590034514464101	1.0
bitcoin 	Amazing how a crazy # Bitcoin Maximalist is now trying to be voice of reason in saving people from a Bubble in making https://www.forbes.com/sites/laurashin/2017/05/26/bubble-so-what-token-summit-marks-cryptocurrencys-revitalization/#7b395ead17b5 …pic.twitter.com/W86Zj0F9el	ToneVays	39	18	1495828887	868195394550890496	https://twitter.com/ToneVays/status/868195394550890496		# #7b395ead17b5		0.42	0.34	0.9590034514464101	1.0
bitcoin 	Seems like a reasonable place for a Buy the # Bitcoin dip, but there is plenty of room now to the downside. $ BTCUSDpic.twitter.com/5lwxOYzB4f	ToneVays	130	53	1495827256	868188554551230464	https://twitter.com/ToneVays/status/868188554551230464		#		0.38	-0.095	0.9590034514464101	1.0
bitcoin 	Core & @ Blockstream promising a 2mb HF in Sep is like @ BITMAINtech & # Bitcoin.com promising a 200mb will be at least half full in Sep.	ToneVays	10	1	1495823517	868172873290088448	https://twitter.com/ToneVays/status/868172873290088448		#	@ @	0.25	0.7845	0.9590034514464101	1.0
bitcoin 	I need one more candle, but I think Bitcoin is a Hold + buy at 2k or lower	ToneVays	11	1	1495759664	867905055483203584	https://twitter.com/ToneVays/status/867905055483203584				0.22	-0.4215	0.9590034514464101	1.0
bitcoin 	Any Bitcoin daily move of less than $100 should be filed under rounding error	Sunchartist	6	0	1495765294	867928669850873857	https://twitter.com/Sunchartist/status/867928669850873857				-0.14	-0.4019	0.9590034514464101	1.0
