currency	tweet	username	favorites	retweets	date	id	permalink	geo	hashtags	mentions	lex_sent	vader_sent	cnn_sent	cnn_pos_neg
bitcoin 	Governments can't compete with # Bitcoin for reasons I gave here... https://cointelegraph.com/news/centralized-state-digital-tokens-cant-compete-with-bitcoin-max-keiser …https://twitter.com/business/status/909455174724407297 …	maxkeiser	69	49	1505666315	909456562103648256	https://twitter.com/maxkeiser/status/909456562103648256		#		0.08	0.0	0.9563511525257479	-1.0
bitcoin 	Greed & stupidity killed current bank industry. # Bitcoin's distributed ledger & immutable coin protocol will reinvent money & banking.	maxkeiser	176	85	1505665861	909454656434253825	https://twitter.com/maxkeiser/status/909454656434253825		#		0.15	-0.439	0.9563511525257479	-1.0
bitcoin 	'Hyperbitcoinization' and 'cryptoeconomics' are titles of future Nobel Prize winning economists' papers.	maxkeiser	152	42	1505663053	909442877687726080	https://twitter.com/maxkeiser/status/909442877687726080				0.00	0.7717	0.9563511525257479	-1.0
bitcoin 	If that's what you think, you're sorely mistaken. I am not attacking Bitcoin. I am trying to explain why Core is under attack, not Bitcoin.	VinnyLingham	1	1	1505662549	909440765322985472	https://twitter.com/VinnyLingham/status/909440765322985472				0.12	-0.1603	0.9563511525257479	-1.0
bitcoin 	At one point, Gyft did 5% of ALL Bitcoin transactions per day!	VinnyLingham	1	0	1505658209	909422559141167104	https://twitter.com/VinnyLingham/status/909422559141167104				0.33	0.0	0.9563511525257479	-1.0
bitcoin 	I'm am. And quite frankly, if what I said is absurd, then we really have nothing to worry about. Core will still be in control of Bitcoin.	VinnyLingham	1	0	1505616136	909246092394369024	https://twitter.com/VinnyLingham/status/909246092394369024				0.19	0.1137	0.9563511525257479	-1.0
bitcoin 	If you're calling # BitcoinCash bcash, you are either 1. A jerk intentionally using a derogatory term. 2. Someone brainwashed by those jerks	rogerkver	490	121	1505657815	909420910708375552	https://twitter.com/rogerkver/status/909420910708375552		#		-0.09	-0.1533	0.9563511525257479	-1.0
bitcoin 	Well, that's where we differ then. I think Bitcoin w/ SegWit and a 2MB base block is superior to a Bitcoin w/o either, which was status quo.	ErikVoorhees	2	1	1505611633	909227209319120898	https://twitter.com/ErikVoorhees/status/909227209319120898				0.04	0.2132	0.9563511525257479	-1.0
bitcoin 	Not true. Please stop spreading propaganda.... or at least fact check first. I promoted the 0.15 release because it is good for Bitcoin.	ErikVoorhees	82	8	1505610086	909220718105251840	https://twitter.com/ErikVoorhees/status/909220718105251840				0.39	0.3794	0.9563511525257479	-1.0
bitcoin 	U.S. Bill Would Ease Bitcoin Tax Regulations for Small Transactions https://www.cryptocoinsnews.com/?p=115544  via @ CryptoCoinsNews	ErikVoorhees	208	110	1505609985	909220294895783937	https://twitter.com/ErikVoorhees/status/909220294895783937			@	-0.36	0.3612	0.9563511525257479	-1.0
bitcoin 	"""only about 300,000 holders of at least $5,000 worth of Bitcoin ... that's not a bubble, still very early stage""https://twitter.com/CNBCFastMoney/status/908454383968559107 …"	TuurDemeester	1031	510	1505642358	909356077233221638	https://twitter.com/TuurDemeester/status/909356077233221638				0.20	0.2263	0.9563511525257479	-1.0
bitcoin 	For Bitcoin, it looks like a min of 20 GB (10 GB pre segwit) of download for a pruned node should suffice:https://www.reddit.com/r/Bitcoin/comments/5s6zak/info_7_days_of_bandwidth_usage_on_a_full_node/ddcv4ut/ …	TuurDemeester	22	7	1505630246	909305276821520387	https://twitter.com/TuurDemeester/status/909305276821520387				0.18	0.3612	0.9563511525257479	-1.0
bitcoin 	If I remember right, @ sysmannet quoted bitfury research estimating #of full (occasionally online) Bitcoin nodes at 170,000.	TuurDemeester	6	1	1505614730	909240195870068736	https://twitter.com/TuurDemeester/status/909240195870068736		#of	@	0.00	0.0	0.9563511525257479	-1.0
bitcoin 	Oh gosh, this # Bitcoin meme cracks me up. Poor newbies think we're pychotic, lol. # HODLpic.twitter.com/ls17NL7ztS	haydentiff	265	103	1505603080	909191333352525824	https://twitter.com/haydentiff/status/909191333352525824		# #		-0.24	-0.0257	0.901911905524767	1.0
bitcoin 	Just chatted to him for a few minutes about bitcoin and Nexus conference we are both attending in Aspen this week.	stacyherbert	10	1	1505675833	909496480431357953	https://twitter.com/stacyherbert/status/909496480431357953				0.05	0.0	0.9563511525257479	-1.0
bitcoin 	You can't wipe your bottom with bitcoin or gold. @ maxkeiserhttps://twitter.com/russian_market/status/909350443125440512 …	stacyherbert	16	7	1505657984	909421618765713409	https://twitter.com/stacyherbert/status/909421618765713409			@	-0.18	0.0	0.9563511525257479	-1.0
bitcoin 	This week's Sunday poll: Chinese government reverses the decision to shut down bitcoin exchanges in what time frame?	barrysilbert	42	28	1505661601	909436789848494080	https://twitter.com/barrysilbert/status/909436789848494080				0.22	0.0	0.9563511525257479	-1.0
bitcoin 	"made a new reddit thread https://www.reddit.com/r/Bitcoin/comments/70mwnk/dont_sell_more_bitcoin_than_you_can_afford_to/ … ""don't sell more bitcoin than you can afford to lose. some thoughts on HODLing strategy"""	adam3us	140	38	1505646937	909375282263609346	https://twitter.com/adam3us/status/909375282263609346				0.00	-0.2009	0.9563511525257479	-1.0
bitcoin 	a few thoughts on HODLing and if you must day trade < 10% allocation and trading strategy https://www.reddit.com/r/Bitcoin/comments/70mdfl/most_people_know_the_drill_at_this_point_dont/dn4b3b6/ … (not investment advice)	adam3us	48	11	1505645385	909368772464660480	https://twitter.com/adam3us/status/909368772464660480				0.29	0.0	0.9563511525257479	-1.0
bitcoin 	not. https://bitinfocharts.com/comparison/bitcoin%20cash-size.html … like generally < 25kB. rest is people dumping as Jihan buys, plus few speculators speculating on Bitmain's pump	adam3us	5	0	1505644088	909363331533803520	https://twitter.com/adam3us/status/909363331533803520				0.00	0.0143	0.9563511525257479	-1.0
bitcoin 	well a lot of it will flow outside, localbitcoins and new services, new and changing payment methods.	adam3us	6	0	1505643695	909361684602589184	https://twitter.com/adam3us/status/909361684602589184				0.35	0.2732	0.9563511525257479	-1.0
bitcoin 	Sometimes in Bitcoin the UFOlogists get way too much attention. It's due to influence pyramid immaturity & tech understanding still building	adam3us	25	3	1505639698	909344921366220800	https://twitter.com/adam3us/status/909344921366220800				0.05	0.0	0.9563511525257479	-1.0
bitcoin 	An Interview with Simon Dixon of Bank To The Future about # Bitcoin # Chinahttps://dollarvigilante.com/blog/2017/09/16/breaking-china-to-shutter-all-bitcoin-exchanges-an-interview-with-simon-dixon-of-bank-to-the-future.html …	DollarVigilante	20	100	1505656238	909414292566478848	https://twitter.com/DollarVigilante/status/909414292566478848		# #		-0.07	0.0	0.9563511525257479	-1.0
bitcoin 	# Politics # Bitcoin Subscribe here--> https://dollarvigilante.com/2tt pic.twitter.com/BUmgkyyU8u	DollarVigilante	23	88	1505630432	909306054298800128	https://twitter.com/DollarVigilante/status/909306054298800128		# #		0.29	0.0	0.9563511525257479	-1.0
bitcoin 	Dollar Vigilante’s View on Entrepreneurship, # Bitcoin and # Trump https://dollarvigilante.com/blog/2017/04/21/wealth-research-interviews-jeff-berwick-to-get-the-vigilantes-view-on-entrepreneurship-bitcoin-and-trump.html …pic.twitter.com/USDInUzjmo	DollarVigilante	12	81	1505606559	909205924119814150	https://twitter.com/DollarVigilante/status/909205924119814150		# #		0.27	0.0	0.9563511525257479	-1.0
bitcoin 	No comment After the Boss Calls # Bitcoin a 'Fraud' — JP Morgan Buys the Dip - Bitcoin Newshttps://news.bitcoin.com/after-the-boss-calls-bitcoin-a-fraud-jp-morgan-buys-the-dip/ …	dinisguarda	3	1	1505670949	909475995769540609	https://twitter.com/dinisguarda/status/909475995769540609		#		0.16	0.0857	0.9563511525257479	-1.0
bitcoin 	Finally some # wisdom about # cryptocurrencies World's Central Banks Can't Ignore the # Bitcoin Boom, BIS Sayshttps://www.bloomberg.com/news/articles/2017-09-17/world-s-central-banks-can-t-ignore-the-bitcoin-boom-bis-says …	dinisguarda	6	3	1505670424	909473794556940288	https://twitter.com/dinisguarda/status/909473794556940288		# # #		0.00	0.6715	0.9563511525257479	-1.0
bitcoin 	why spend # bitcoin by @ ChrisPacia (thanks @ drwasho for sharing) - HODLing and spending not mutually exclusive!https://chrispacia.wordpress.com/2017/09/06/why-spend-bitcoin/ …	Melt_Dem	35	11	1505683731	909529606453121025	https://twitter.com/Melt_Dem/status/909529606453121025		#	@ @	0.32	-0.0843	0.9563511525257479	-1.0
bitcoin 	Simon Dixon Bitcoin report from Chinahttps://www.youtube.com/watch?v=lPcuWC5qmbE&feature=share …	SimonDixonTwitt	16	8	1505654069	909405197373337600	https://twitter.com/SimonDixonTwitt/status/909405197373337600				0.17	0.0	0.9563511525257479	-1.0
bitcoin 	Same with all markets but too many people hold no matter what for somebody to accumulate all Bitcoin. It's not as liquid as gold yet though.	SimonDixonTwitt	0	0	1505620558	909264642651832320	https://twitter.com/SimonDixonTwitt/status/909264642651832320				0.15	-0.196	0.9563511525257479	-1.0
bitcoin 	For # Bitcoin to go to zero the internet would have to be shut down but now you have satellites and gold as a hedge against # Bitcoin	SimonDixonTwitt	0	0	1505620282	909263482196865025	https://twitter.com/SimonDixonTwitt/status/909263482196865025		# #		0.25	0.0	0.9563511525257479	-1.0
bitcoin 	Yes. Tulip has no increasing utility. # Bitcoin price is going up as it's utility is increasing every day. Bubble means no underlying value.	SimonDixonTwitt	0	0	1505620134	909262862735990784	https://twitter.com/SimonDixonTwitt/status/909262862735990784		#		0.75	0.0394	0.9563511525257479	-1.0
bitcoin 	I'm pretty sure # Bitcoin will outperform that investment decision too. # Bitcoin is more disruptive to them than Gold.	SimonDixonTwitt	0	0	1505620071	909262598469644288	https://twitter.com/SimonDixonTwitt/status/909262598469644288		# #		0.30	0.145	0.9563511525257479	-1.0
bitcoin 	# Bitcoin has not existed for thousands of years you are correct but that does not make me believe it is not sound money.	SimonDixonTwitt	0	0	1505619938	909262040400666626	https://twitter.com/SimonDixonTwitt/status/909262040400666626		#		-0.08	0.0	0.9563511525257479	-1.0
bitcoin 	I hope they don't but I am pretty sure central banks will hold # Bitcoin	SimonDixonTwitt	0	0	1505619872	909261763979264000	https://twitter.com/SimonDixonTwitt/status/909261763979264000		#		0.27	0.1174	0.9563511525257479	-1.0
bitcoin 	You can hold Bitcoin in your hand in a hardware wallet that you own that cannot be stolen. It's easier to store than gold.	SimonDixonTwitt	0	0	1505619839	909261626645168128	https://twitter.com/SimonDixonTwitt/status/909261626645168128				-0.12	0.5622	0.9563511525257479	-1.0
bitcoin 	A bubble means no utility behind it. Bitcoin has plenty of utility. When you want to spend it you can hold it in stable crypto pegged to USD	SimonDixonTwitt	3	0	1505619244	909259130451329024	https://twitter.com/SimonDixonTwitt/status/909259130451329024				0.11	0.0217	0.9563511525257479	-1.0
bitcoin 	You can try to take # Bitcoin out of China, you won't keep the Chinese people out of # Bitcoin - everybody deserves to own & spend sound moneypic.twitter.com/nl4hBgCiAi	SimonDixonTwitt	135	53	1505618716	909256917033164801	https://twitter.com/SimonDixonTwitt/status/909256917033164801		# #		0.10	0.0	0.9563511525257479	-1.0
bitcoin 	There is nothing similar to # Bitcoin - it's like the internet. You can try and create a new internet but good luck.	SimonDixonTwitt	0	0	1505618462	909255851222765568	https://twitter.com/SimonDixonTwitt/status/909255851222765568		#		0.39	0.6084	0.9563511525257479	-1.0
bitcoin 	"Simon Dixon Bitcoin report from China with @ TechBalt ""The institutions are sucking up the cheap # Bitcoin ""https://www.youtube.com/watch?v=lPcuWC5qmbE&feature=share …"	SimonDixonTwitt	42	17	1505608741	909215076514590727	https://twitter.com/SimonDixonTwitt/status/909215076514590727		#	@	0.11	0.0	0.9563511525257479	-1.0
bitcoin 	After the Boss Calls # Bitcoin a 'Fraud' — JP Morgan Buys the Diphttps://news.bitcoin.com/after-the-boss-calls-bitcoin-a-fraud-jp-morgan-buys-the-dip/ …	BitcoinByte	8	5	1505633441	909318678403063808	https://twitter.com/BitcoinByte/status/909318678403063808		#		0.00	0.368	0.9563511525257479	-1.0
bitcoin 	Bitcoin transactions explained https://www.cryptocoin.news/2017/09/14/bitcoin-transactions-explained/ … via @ CryptoCoin.News	SimonCocking	1	0	1505680308	909515253125468162	https://twitter.com/SimonCocking/status/909515253125468162			@	0.14	0.0	0.9563511525257479	-1.0
bitcoin ethereum 	What is # Ethereum, how it is different to # Bitcoin, and why it is # Blockchain 2.0! https://www.cryptocoin.news/2017/09/16/what-is-ethereum-how-it-is-different-to-bitcoin-and-why-it-is-blockchain-2-0/ … via @ CryptoCoin.News	SimonCocking	3	6	1505632760	909315818579795968	https://twitter.com/SimonCocking/status/909315818579795968		# # #	@	0.41	0.0	0.9563511525257479	-1.0
bitcoin ethereum 	A good article on # Crypto risks investing in # ico # bitcoin # ETHEREUM Buyer beware! # blockchain # cryptocurrencieshttps://www.nytimes.com/2017/09/15/business/cryptocurrency-bubble-doge.html …	GerberKawasaki	3	3	1505665388	909452670871543808	https://twitter.com/GerberKawasaki/status/909452670871543808		# # # # # #		0.29	0.1357	0.9563511525257479	-1.0
bitcoin 	Bitcoin defenders dismiss Dimon as 'naive' in the digital age - http://mailchi.mp/oliverbussmann/bitcoin-defenders-dismiss-dimon-as-naive-in-the-digital-age-klarna-buys-billpay-banks-face-spiraling-costs-from-50-year-old-it …	obussmann	5	1	1505628005	909295874588717057	https://twitter.com/obussmann/status/909295874588717057				0.25	0.0772	0.9563511525257479	-1.0
bitcoin 	# digitaljersey # AI surely that judge is correct - Bitcoin isn’t currency, it’s a form of digital asset?	dgwbirch	1	0	1505643339	909360190822260736	https://twitter.com/dgwbirch/status/909360190822260736		# #		0.05	0.6597	0.9563511525257479	-1.0
bitcoin 	You know it was not Bitcoin that was first. BitGold etc were before, but it was all about the execution that counted	julianhosp	0	0	1505636489	909331462717038592	https://twitter.com/julianhosp/status/909331462717038592				-0.36	0.0	0.9563511525257479	-1.0
bitcoin 	Bitcoins greatest asset is its awesome community. Full of intelligent, kind and hardworking people. :)	bitentrepreneur	12	3	1505649965	909387983391948800	https://twitter.com/bitentrepreneur/status/909387983391948800				0.60	0.7017	0.9563511525257479	-1.0
bitcoin 	"""Biting the Bitcoin"" @ jalak @ unocoin # IndiaBitcoinpic.twitter.com/twNaiXrRBt"	SunnyStartups	6	1	1505669250	909468869634510848	https://twitter.com/SunnyStartups/status/909468869634510848		#	@ @	0.22	0.0	0.9563511525257479	-1.0
bitcoin ripple 	Ripple CEO Brad Garlinghouse explains why the world has barely scratched the surface with cryptocurrencieshttps://www.cnbc.com/amp/2017/09/11/ripple-ceo-brad-garlinghouse-on-bitcoin-and-xrp.html …	robdgill	0	0	1505658452	909423579678363652	https://twitter.com/robdgill/status/909423579678363652				0.13	0.0	0.9563511525257479	-1.0
bitcoin 	Bitcoin defenders dismiss Dimon as ‘naïve’ in the digital agehttps://www.fnlondon.com/articles/bitcoin-defenders-dismiss-dimon-as-naive-in-the-digital-age-20170913 …	robdgill	0	0	1505631822	909311884981088256	https://twitter.com/robdgill/status/909311884981088256				0.00	0.0772	0.9563511525257479	-1.0
bitcoin 	OK, I’ll fund you — if it’s in bitcoinhttp://www.thetimes.co.uk/article/da486872-9afb-11e7-a98f-cc665179329e …	robdgill	0	0	1505631303	909309710037389313	https://twitter.com/robdgill/status/909309710037389313				0.11	0.4466	0.9563511525257479	-1.0
bitcoin 	Check the # Botswana # Blockchain Summit 24-25 Nov: https://botswanablockchainsummit.com/  Contact @ Bitcoinlady if you can contribute as a sponsor, thanks!https://twitter.com/bitcoinlady/status/907975304685158400 …	BlockchainGirl	10	3	1505672839	909483922739929088	https://twitter.com/BlockchainGirl/status/909483922739929088		# #	@	0.19	0.2463	0.9563511525257479	-1.0
bitcoin 	I can buy my groceries with # bitcoin now! # Africa # CapeTown # blockchainhttps://twitter.com/TechCentral/status/909087257038114816 …	Anne_Connelly	5	3	1505642802	909357939953164289	https://twitter.com/Anne_Connelly/status/909357939953164289		# # # #		0.13	0.0	0.9563511525257479	-1.0
bitcoin 	# jamiedimon can kiss my ass ... HIS industry is where the REAL fraud takes place ... # Bitcoin should go to $7,500 by the end of next year	RonnieMoas	41	17	1505661878	909437951989428224	https://twitter.com/RonnieMoas/status/909437951989428224		# #		0.17	-0.6705	0.9563511525257479	-1.0
bitcoin 	To the # bitcoin bears ... I think there is a world market for maybe five computers -- Thomas Watson, chairman of IBM (1943)pic.twitter.com/1VhcMCyiYM	RonnieMoas	15	2	1505660063	909430338715308033	https://twitter.com/RonnieMoas/status/909430338715308033		#		0.17	0.0	0.9563511525257479	-1.0
bitcoin 	"Trying to buy bitcoin hardware with a credit card... how appropriate. ""Transaction denied by the banking network.""pic.twitter.com/K5qF5qDbMf"	lopp	170	25	1505676888	909500905413890053	https://twitter.com/lopp/status/909500905413890053				0.06	-0.0195	0.9563511525257479	-1.0
bitcoin 	Bitcoin was designed to withstand both external and internal attacks. Resisting the whims of seemingly powerful entities shows its strength.	lopp	391	153	1505668571	909466023476252672	https://twitter.com/lopp/status/909466023476252672				0.05	0.139	0.9563511525257479	-1.0
bitcoin 	Bitcoin implementation nodes in perspective, via https://coin.dance/nodes pic.twitter.com/oEdIa9xPdu	lopp	66	26	1505654848	909408462727151617	https://twitter.com/lopp/status/909408462727151617				0.29	0.0	0.9563511525257479	-1.0
bitcoin 	Supply schedule was based off of gold mining. Final number may have been chosen due to max 64 bit number value. https://en.bitcoin.it/wiki/Controlled_supply …	lopp	5	2	1505600620	909181016853680130	https://twitter.com/lopp/status/909181016853680130				-0.32	0.1529	0.901911905524767	1.0
bitcoin 	Challenge accepted.http://www.marketwatch.com/story/bitcoin-needs-to-be-worth-1000000-to-be-a-legitimate-currency-2017-09-15 …	lopp	469	141	1505600074	909178725643759616	https://twitter.com/lopp/status/909178725643759616				0.50	0.17	0.901911905524767	1.0
bitcoin 	USD. Other exchanges have specific USDT markets likte Bittrex and Poloniex:https://bravenewcoin.com/bitcoin?mkt=USDT#Exchanges …	WhalePanda	1	0	1505643026	909358878781034496	https://twitter.com/WhalePanda/status/909358878781034496		#Exchanges		0.09	0.0	0.9563511525257479	-1.0
bitcoin 	https://bravenewcoin.com/bitcoin#Trading-Pairs …	WhalePanda	9	2	1505636487	909331451342188544	https://twitter.com/WhalePanda/status/909331451342188544		#Trading		0.00	0.0	0.9563511525257479	-1.0
bitcoin 	# Bitcoin trading ~15% lower on Chinese exchanges (~16% global volume). Even in China there's quite a spread, Okcoin doing 42% of CNY volumepic.twitter.com/ZHLo9paUaN	WhalePanda	97	74	1505636199	909330244485746689	https://twitter.com/WhalePanda/status/909330244485746689		#		0.04	-0.148	0.9563511525257479	-1.0
bitcoin 	The short term hourly $ BTCUSD pullback should be ending. Now it's time for the Daily TD 9 Buy call to at least hive us a 1-4 # Bitcoin Bullpic.twitter.com/sWJJ3sweyq	ToneVays	193	58	1505684009	909530773497184256	https://twitter.com/ToneVays/status/909530773497184256		#		0.07	0.0	0.9563511525257479	-1.0
bitcoin 	If you think the new # ItMovie is scary, you should buy some # Bitcoin... Shit Gettin' Real!!!pic.twitter.com/EArc52ZJrU	ToneVays	252	79	1505682974	909526432652644352	https://twitter.com/ToneVays/status/909526432652644352		# #		0.28	-0.4059	0.9563511525257479	-1.0
bitcoin 	As he travels through Europe attending Bitcoin meetups & better understands ecosystem to bring better content.	ToneVays	9	0	1505666246	909456272612892673	https://twitter.com/ToneVays/status/909456272612892673				0.06	0.7003	0.9563511525257479	-1.0
bitcoin 	The Troll thinks everything should be free for him. @ MadBitcoins did 3 yrs of free content and now is requesting people voluntarily donate	ToneVays	13	0	1505666184	909456012431822853	https://twitter.com/ToneVays/status/909456012431822853			@	0.21	0.5106	0.9563511525257479	-1.0
