currency	tweet	username	favorites	retweets	date	id	permalink	geo	hashtags	mentions	lex_sent	vader_sent	cnn_sent	cnn_pos_neg
bitcoin 	Hedge funds are herd animals. If one starts pouring cash into Bitcoin, others will follow; $5,000 within sight.pic.twitter.com/cjklIg1w9e	maxkeiser	145	93	1497233275	874085828259196929	https://twitter.com/maxkeiser/status/874085828259196929				0.11	0.0	0.8916629078499414	-1.0
bitcoin 	Bitcoin mentioned on cover of Barron's this weekend. Kiss of death, or major signpost on path to mainstream acceptance and jump in price?pic.twitter.com/TwjH84rdxM	maxkeiser	37	17	1497219676	874028789159923713	https://twitter.com/maxkeiser/status/874028789159923713				-0.04	0.1132	0.9605030028686463	1.0
bitcoin 	My other 2017 prediction comes true from my post in May 2016 : https://vinnylingham.com/bitcoin-2016-there-has-been-an-awakening-164b42d38927 …https://twitter.com/maxkeiser/status/874086369915752448 …	VinnyLingham	69	24	1497242889	874126150167138304	https://twitter.com/VinnyLingham/status/874126150167138304				0.14	0.4215	0.8916629078499414	-1.0
bitcoin 	"@ CaseyNeistat I saw my book ""The Internet of Money"" on your desk in one of your videos. Have you read it yet? Wanna talk bitcoin?"	aantonop	54	13	1497256128	874181680940015616	https://twitter.com/aantonop/status/874181680940015616			@	0.04	0.0	0.8916629078499414	-1.0
bitcoin 	Right on the Money: Bitcoin hits $3,000, or 1000x my entry point six years ago https://falkvinge.net/2017/06/11/right-money-bitcoin-hits-3000-1000x-entry-point-six-years-ago/ … via @ Falkvinge # nailedit # scoreboard	ErikVoorhees	127	58	1497236256	874098329252225024	https://twitter.com/ErikVoorhees/status/874098329252225024		# #	@	0.13	0.0	0.8916629078499414	-1.0
bitcoin ethereum 	"""Its the Ethereum for Bitcoiners"" ""It's the Bitcoin of the Ethereum world"" Or it's both. Or neither."	TuurDemeester	14	1	1497289687	874322434941476864	https://twitter.com/TuurDemeester/status/874322434941476864				0.12	0.0	0.8916629078499414	-1.0
bitcoin 	You may be right on Bitcoin, we'll see. I'm not expecting a long winter as in 2014-15 though.	TuurDemeester	1	1	1497285567	874305157080788992	https://twitter.com/TuurDemeester/status/874305157080788992				0.06	0.0	0.8916629078499414	-1.0
bitcoin 	Don't mistake Bitcoin's immutability and censorship resistance for inertia. This is what guarantees its neutrality as a reserve asset.	TuurDemeester	142	47	1497284136	874299151726637057	https://twitter.com/TuurDemeester/status/874299151726637057				0.37	0.3098	0.8916629078499414	-1.0
bitcoin ethereum 	So Bitcoin is down 8% today. $ LTC & $ XMR follow it down, and even Ethereum Classic does. $ ETH keeps soaring, is in its own momentum.pic.twitter.com/A7YYxJ05Xn	TuurDemeester	67	34	1497280211	874282692082364417	https://twitter.com/TuurDemeester/status/874282692082364417				0.32	0.0	0.8916629078499414	-1.0
bitcoin 	Not necessarily true: Bitcoin's blockchain as is should stay within a reasonable size for many decades at the current growth rate.	TuurDemeester	4	1	1497249197	874152610370138113	https://twitter.com/TuurDemeester/status/874152610370138113				0.29	0.6597	0.8916629078499414	-1.0
bitcoin 	This is BitPay's core model, as well as that of many remittance companies in Bitcoin. It works, volumes and tx sizes are growing.	TuurDemeester	1	0	1497248511	874149731718623233	https://twitter.com/TuurDemeester/status/874149731718623233				0.30	0.3836	0.8916629078499414	-1.0
bitcoin ethereum 	Source: https://forum.ethereum.org/discussion/13208/blockchain-size-160gb … viahttps://www.reddit.com/r/Bitcoin/comments/6gnpya/this_will_happen_to_bitcoin_or_ethereum_total_btc/dirxww1/ …	TuurDemeester	14	1	1497248094	874147982555447296	https://twitter.com/TuurDemeester/status/874147982555447296				0.33	0.0	0.8916629078499414	-1.0
bitcoin 	Bitcoin has +50,000 nodes... http://luke.dashjr.org/programs/bitcoin/files/charts/software.html …	TuurDemeester	23	2	1497238189	874106438569914368	https://twitter.com/TuurDemeester/status/874106438569914368				0.40	0.0	0.8916629078499414	-1.0
bitcoin 	So, Pitbull just plugged bitcoin on CNBC. Yes, Pitbull	barrysilbert	475	166	1497300539	874367951578820609	https://twitter.com/barrysilbert/status/874367951578820609				0.22	0.2009	0.8916629078499414	-1.0
bitcoin 	Do you see the bitcoin price on 1/13/15? I pretty much nailed the bottom	barrysilbert	7	0	1497287685	874314039089922050	https://twitter.com/barrysilbert/status/874314039089922050				0.21	0.247	0.8916629078499414	-1.0
bitcoin 	No, it is not. Invariably what people mean by better governance process, is where they get more influence to change Bitcoin for their views.	adam3us	20	3	1497253835	874172062901915649	https://twitter.com/adam3us/status/874172062901915649				0.29	0.0722	0.8916629078499414	-1.0
bitcoin 	bug fixes, improvements to efficiency/scale, opt-in tech improvements while preserving key properties are acceptable https://bitcointalk.org/index.php?topic=195.msg1611#msg1611 …	adam3us	14	1	1497252567	874166741777121281	https://twitter.com/adam3us/status/874166741777121281		#msg1611		-0.13	0.7096	0.8916629078499414	-1.0
bitcoin 	"Cognitive aid: replace Bitcoin with gold coins/bars. Can you ""govern"" gold atoms? So it is with bitcoinium https://bitcointalk.org/index.php?topic=911339.0 …"	adam3us	16	7	1497251846	874163719743430656	https://twitter.com/adam3us/status/874163719743430656				-0.06	0.0	0.8916629078499414	-1.0
bitcoin 	Governance is a dirty word, it implies anything is changeable if governor's agree. # Bitcoin is not for changing, social contract must stand.	adam3us	88	21	1497251276	874161328826535936	https://twitter.com/adam3us/status/874161328826535936		#		0.57	-0.0513	0.8916629078499414	-1.0
bitcoin 	Kind of, maybe like Bitcoin pizza to bootstrap and for fun, as # bitcoin P2P pizza succeeded where central demo digicash bank t-shirts failed	adam3us	3	1	1497248096	874147989429907456	https://twitter.com/adam3us/status/874147989429907456		#		0.00	0.6486	0.8916629078499414	-1.0
bitcoin 	"What about P2SH, CSV, CLTV soft-forks are you and friends going to ""research"" those too? Way to build a reputation as a vandal in bitcoin."	adam3us	8	1	1497245943	874138962000039936	https://twitter.com/adam3us/status/874138962000039936				0.20	0.2384	0.8916629078499414	-1.0
bitcoin 	If you bought $100 of # bitcoin 7 years ago, you'd be sitting on $75 million now http://bit.ly/2rP7eMu pic.twitter.com/HKXj5JuBHA	WarrenWhitlock	21	24	1497226022	874055404560535552	https://twitter.com/WarrenWhitlock/status/874055404560535552		#		0.11	0.0	0.8916629078499414	-1.0
bitcoin 	Bitcoin $3,000 Party, Live Q&A and Bitcoin Giveaway: http://youtu.be/N-_gWsKlXxo?a  via @ YouTube	DollarVigilante	2	49	1497294594	874343015317475328	https://twitter.com/DollarVigilante/status/874343015317475328			@	0.25	0.4019	0.8916629078499414	-1.0
bitcoin 	Bitcoin $1,500 Party, Live Q&A and Bitcoin Giveaway: http://youtu.be/yZrzQDq3jjE?a  via @ YouTube	DollarVigilante	2	53	1497287736	874314252206649344	https://twitter.com/DollarVigilante/status/874314252206649344			@	0.25	0.4019	0.8916629078499414	-1.0
bitcoin 	Bitcoin Hits $3K and a 100,000% Gain for TDV In Just Six Years - Free Bitcoin Giveaway In This Blog!: http://youtu.be/ZmhIyAg-5BE?a  via	DollarVigilante	8	57	1497234146	874089481963524096	https://twitter.com/DollarVigilante/status/874089481963524096				0.41	0.3951	0.8916629078499414	-1.0
bitcoin ethereum 	Oh, my. Ethereum $ eth market cap is up to $36.4 billion. ( # bitcoin market cap: $45.5 billion)	readDanwrite	1	0	1497275283	874262019922432000	https://twitter.com/readDanwrite/status/874262019922432000		#		0.37	0.0	0.8916629078499414	-1.0
bitcoin 	. @ pitbull IS TALKING ABOUT # BITCOIN ON CNBC.	Melt_Dem	86	24	1497300555	874368021166518272	https://twitter.com/Melt_Dem/status/874368021166518272		#	@	0.60	0.0	0.8916629078499414	-1.0
bitcoin 	My latest interview on Bitcoin News #42 - UASF, State of Bitcoin, ICOS & Regulationhttps://www.youtube.com/watch?v=fXxW5wyeGrk&feature=share …	SimonDixonTwitt	22	7	1497267758	874230460196564992	https://twitter.com/SimonDixonTwitt/status/874230460196564992		#42		0.00	0.0	0.8916629078499414	-1.0
bitcoin 	Understood but it is not censorship resistant and decentralized like # Bitcoin and they solve different problems.	SimonDixonTwitt	1	0	1497253438	874170397041631233	https://twitter.com/SimonDixonTwitt/status/874170397041631233		#		0.18	0.2263	0.8916629078499414	-1.0
bitcoin ethereum 	I wonder how long it'll be before we can implement Bitcoin on top of Ethereum and get a more decentralized system than the real Bitcoin.	el33th4xor	222	73	1497287648	874313884823322626	https://twitter.com/el33th4xor/status/874313884823322626				-0.08	0.2023	0.8916629078499414	-1.0
bitcoin ethereum 	Why Ethereum is Outpacing Bitcoin http://bit.ly/2scTxaJ pic.twitter.com/Yj3OGWEfJM	el33th4xor	43	19	1497287586	874313625586065408	https://twitter.com/el33th4xor/status/874313625586065408				0.33	0.0	0.8916629078499414	-1.0
bitcoin 	In my defense, I've been on sabbatical. And I'm working on an unorthodox overload therapy for my allergies.https://twitter.com/WeRateBitcoiner/status/873514444671770624 …	el33th4xor	60	4	1497225055	874051349394194432	https://twitter.com/el33th4xor/status/874051349394194432				0.17	-0.0777	0.9605030028686463	1.0
bitcoin 	This vision for Bitcoin assumes that (a) Bitcoin is for hodling and not actual use, and (b) Bitcoin community is as big as it will ever be.	el33th4xor	12	1	1497224847	874050476748279808	https://twitter.com/el33th4xor/status/874050476748279808				0.37	0.25	0.9605030028686463	1.0
bitcoin ethereum 	It's where the market cap of Ethereum meets and surpasses that of Bitcoin's	laurashin	1	0	1497276510	874267168178716672	https://twitter.com/laurashin/status/874267168178716672				0.15	0.0	0.8916629078499414	-1.0
bitcoin 	Let’s see. The police found a) prepaid cards b) Bitcoin cold wallets or c) flipping great wodges of cash?https://twitter.com/NinjaEconomics/status/874038540039970817 …	dgwbirch	7	4	1497223070	874043023709155330	https://twitter.com/dgwbirch/status/874043023709155330				0.53	0.2197	0.9605030028686463	1.0
bitcoin litecoin 	How easy is it to hop from # bitcoin to # Litecoin, or $ ETH to $ ETC? -Interoperable- protocols and cross-compat chains make that cheap & easy.	jgarzik	14	9	1497294224	874341466029645825	https://twitter.com/jgarzik/status/874341466029645825		# #		0.46	0.4404	0.8916629078499414	-1.0
bitcoin 	They need to add a hashpower/security chart... # Bitcoin still boatloads more securehttps://twitter.com/elidourado/status/874261282769301504 …	jgarzik	55	23	1497275423	874262608337043456	https://twitter.com/jgarzik/status/874262608337043456		#		-0.08	0.4005	0.8916629078499414	-1.0
bitcoin 	Web traffic growing exponentially and # Alexa ranking keeps hitting all time highs. Global = 21,692 & India = 1,256. @ Unocoin # IndiaBitcoinpic.twitter.com/j1ksF8JAUD	SunnyStartups	8	5	1497282085	874290551113351169	https://twitter.com/SunnyStartups/status/874290551113351169		# #	@	0.12	0.0593	0.8916629078499414	-1.0
bitcoin 	Repeat: my @ skype account has been hacked & the hacker is asking for # bitcoin pretending it's me. @ ATTcares @ ATT this is on you. Please DM	michaelterpin	2	1	1497268862	874235090670432256	https://twitter.com/michaelterpin/status/874235090670432256		#	@ @ @	0.62	0.0	0.8916629078499414	-1.0
bitcoin 	Disappointing that # horizoncyberattack is focussing on # nhs # cyberattack & not on failure to keep systems up to date # Blockchain # Bitcoin	gpn01	2	0	1497299924	874365372383862785	https://twitter.com/gpn01/status/874365372383862785		# # # # #		0.32	-0.1275	0.8916629078499414	-1.0
bitcoin 	If you're looking to store for the longer-ish term, use a hard wallet. @ LedgerHQ Nano S prob the best. @ BitcoinTrezor another option.	DianacBiggs	2	0	1497302313	874375391875665920	https://twitter.com/DianacBiggs/status/874375391875665920			@ @	0.67	0.1781	0.8916629078499414	-1.0
bitcoin 	Bitcoin drives to a new high, but is it headed for a crash?https://www.wsj.com/articles/bitcoin-drives-to-a-new-high-but-is-it-headed-for-a-crash-1496771053 …	robdgill	0	0	1497279143	874278212838334464	https://twitter.com/robdgill/status/874278212838334464				0.38	-0.275	0.8916629078499414	-1.0
bitcoin 	If you think the bitcoin exchange rate should be higher...pic.twitter.com/qEUBoceYDj	lopp	127	48	1497283048	874294589921918976	https://twitter.com/lopp/status/874294589921918976				-0.10	0.0	0.8916629078499414	-1.0
bitcoin 	Just in time for the bounce play... # bitcoinhttp://cnb.cx/2sV5S1p	CryptoHustle	18	2	1497301214	874370784310984705	https://twitter.com/CryptoHustle/status/874370784310984705		#		0.22	0.0	0.8916629078499414	-1.0
bitcoin 	CNBC: Inspiring investors to buy tops and sell bottoms since 2013. # bitcoinhttps://twitter.com/CNBCi/status/874016448586407936 …	CryptoHustle	121	34	1497300851	874369259178217476	https://twitter.com/CryptoHustle/status/874369259178217476		#		0.00	0.3634	0.8916629078499414	-1.0
bitcoin 	Once # bitcoin has its last parabolic blow off and turns bear... $ ETH/USD will be my market of choice to short.	CryptoHustle	28	1	1497277400	874270902040612864	https://twitter.com/CryptoHustle/status/874270902040612864		#		0.45	0.0	0.8916629078499414	-1.0
bitcoin 	Some solid # Bitcoin technical analyses right here.pic.twitter.com/MrGdntTTge	CharlieShrem	68	32	1497293419	874338090638340096	https://twitter.com/CharlieShrem/status/874338090638340096		#		-0.12	0.1531	0.8916629078499414	-1.0
bitcoin ethereum 	As of this minute, bitcoin is faster than Ethereum, because of 1 ICO.	CharlieShrem	75	22	1497280406	874283506859421696	https://twitter.com/CharlieShrem/status/874283506859421696				0.08	0.0	0.8916629078499414	-1.0
bitcoin 	6- I've seen what happens during a massive rise ( # Bitcoin $100-1200). # NothingNewUnderTheSun	CharlieShrem	54	17	1497279589	874280081203572736	https://twitter.com/CharlieShrem/status/874280081203572736		# #		0.20	0.0	0.8916629078499414	-1.0
bitcoin 	That's pure speculation, Bitcoin go up a bit, depends on what the ETH investors do, cash out in fiat or invest it in crypto.	WhalePanda	2	1	1497269951	874239658582044672	https://twitter.com/WhalePanda/status/874239658582044672				-0.04	0.0	0.8916629078499414	-1.0
bitcoin ethereum 	"I published an article ""I was wrong about Ethereum"" $ ETH # Bitcoin $ cryptohttps://medium.com/@WhalePanda/i-was-wrong-about-ethereum-804c9a906d36 …"	WhalePanda	933	500	1497267431	874229086268383232	https://twitter.com/WhalePanda/status/874229086268383232		#	@WhalePanda	-0.27	-0.4767	0.8916629078499414	-1.0
bitcoin 	This is what makes the bubble different than your average # Bitcoin bubble. Bitcoin was held mostly by hodlers/investors, $ ETH by companies.	WhalePanda	59	18	1497261079	874202444045185024	https://twitter.com/WhalePanda/status/874202444045185024		#		0.22	0.0	0.8916629078499414	-1.0
bitcoin 	# bitcoin exchanges are not looking pretty right now. @ bitfinex trading at a heavy discount, BTC-e too, a few others looking odd pic.twitter.com/9rt2YxSvRs	cburniske	15	8	1497290122	874324260856221696	https://twitter.com/cburniske/status/874324260856221696		#	@	0.08	-0.3528	0.8916629078499414	-1.0
bitcoin 	Lots of red 4 # cryptoassets after an enthusiastic weekend. Understand some of the skittishness given the attacks but why's # bitcoin knifing?pic.twitter.com/0ncDxrSPFD	cburniske	19	13	1497289795	874322888219930624	https://twitter.com/cburniske/status/874322888219930624		# #		0.09	0.1279	0.8916629078499414	-1.0
bitcoin 	Daily $ BTCUSD bounced at this level last time. if it doesn't it may create a better buy point near $2,100. # Bitcoin # UASF # BIP148 # SegWitpic.twitter.com/T6ypjE96Y0	ToneVays	64	23	1497289994	874323723242876930	https://twitter.com/ToneVays/status/874323723242876930		# # # #		0.10	0.09	0.8916629078499414	-1.0
bitcoin 	UPDATE of # Bitcoin Dev support for # UASF # BIP148 continues to show increased support. Need same chart for # economic nodes, thank @ LukeDashjrpic.twitter.com/iQo5VwqNNS	ToneVays	80	35	1497285882	874306478198456320	https://twitter.com/ToneVays/status/874306478198456320		# # # #	@	0.23	0.5595	0.8916629078499414	-1.0
bitcoin 	have you considered the possibility that i'm only holding # Bitcoin because it's NOT a scam... prob not.... welcome to Crypto	ToneVays	3	1	1497278387	874275038224150529	https://twitter.com/ToneVays/status/874275038224150529		#		-0.05	0.4588	0.8916629078499414	-1.0
bitcoin 	I honestly do not know, Bitcoin is very hard to predict, i just point out what I see at a given point in time.	ToneVays	2	0	1497275919	874264690628718592	https://twitter.com/ToneVays/status/874264690628718592				0.17	0.3197	0.8916629078499414	-1.0
bitcoin 	Yesterday's # Bitcoin video discussed a Technical sign of caution on Weekly $ BTCUSD charts, might be a rough week https://youtu.be/PdszIrTtkaw?t=13m45s …pic.twitter.com/KUhyKjSEQr	ToneVays	89	19	1497273748	874255584333361152	https://twitter.com/ToneVays/status/874255584333361152		#		0.05	0.0	0.8916629078499414	-1.0
bitcoin 	Correction: Bitcoin Consolidation -$381 from intraday high $2660	Sunchartist	2	0	1497286812	874310379228332032	https://twitter.com/Sunchartist/status/874310379228332032				0.25	0.0	0.8916629078499414	-1.0
bitcoin 	ICMI: Bitcoin -$225 from today’s high	Sunchartist	1	0	1497283900	874298163103801349	https://twitter.com/Sunchartist/status/874298163103801349				0.17	0.0	0.8916629078499414	-1.0
