currency	tweet	username	favorites	retweets	date	id	permalink	geo	hashtags	mentions	lex_sent	vader_sent	cnn_sent	cnn_pos_neg
bitcoin 	$200 # trillion in # stocks # bonds # gold and # cash ... That is where the # bubble is ... $ BTC # bitcoin still undervalued by 80%-90% ... does not matter how far we have risen ... what matters is where we are going ... peace.	RonnieMoas	70	19	1512341573	937454621563539457	https://twitter.com/RonnieMoas/status/937454621563539457		# # # # # # #		0.39	0.5463	0.9944159467783056	1.0
bitcoin 	$200 # trillion in # stocks # bonds # gold and # cash ... That is where the # bubble is ... $ BTC # bitcoin still undervalued by 80%-90% ... does not matter how far we have risen ... what matters is where we are goingpic.twitter.com/PWWbJWkSMp	RonnieMoas	49	19	1512341537	937454470123999233	https://twitter.com/RonnieMoas/status/937454470123999233		# # # # # # #		0.38	0.0067	0.9944159467783056	1.0
bitcoin 	What would be more painful? ... losing a few months salary on # bitcoin? ... or staying on the sidelines ... finding out I was right ... and that you could have shaved 5-10 years off your retirement / there is still 1,000%-1,500% (or more) of upside here $ BTC $ LTC $ ETH # altcoins	RonnieMoas	172	52	1512341372	937453778588102659	https://twitter.com/RonnieMoas/status/937453778588102659		# #		0.11	-0.2915	0.9944159467783056	1.0
bitcoin 	# hacking It is upsetting to see # parasites here who do not pay for my service And do not assist the # charity I work with http://www.foodforthepoor.org/Moas  / If you think you are saving $$$ you are mistaken / I STRONGLY advise you to read this article http://www.forbes.com/sites/laurashin/2016/12/20/hackers-have-stolen-millions-of-dollars-in-bitcoin-using-only-phone-numbers/#3ff548dd38ba … you are welcome	RonnieMoas	15	7	1512313948	937338755110842369	https://twitter.com/RonnieMoas/status/937338755110842369		# # # #3ff548dd38ba		0.19	-0.203	0.9944159467783056	1.0
bitcoin 	Invest your time in education before you invest your money in crypto assets; it's like buying insurance against getting rekt. http://lopp.net/bitcoin.html	lopp	1262	446	1512315883	937346868501151745	https://twitter.com/lopp/status/937346868501151745				-0.14	0.4939	0.9944159467783056	1.0
bitcoin 	"Maybe we should rename the repository ""Bitcoin Schelling Point"""	lopp	4	0	1512257136	937100466751762438	https://twitter.com/lopp/status/937100466751762438				-0.11	0.0	0.9633620689586208	1.0
bitcoin 	If you see the core of Bitcoin on the road, kill it.https://twitter.com/rogerkver/status/936998008637546496 …	lopp	311	37	1512256176	937096442661007360	https://twitter.com/lopp/status/937096442661007360				-0.17	-0.3454	0.9633620689586208	1.0
bitcoin 	make bitcoin cheap again! $11 per mBTC sounds much better than BTC is $11,000	onemanatatime	35	4	1512294827	937258554796384257	https://twitter.com/onemanatatime/status/937258554796384257				0.07	0.2202	0.9944159467783056	1.0
bitcoin 	Top is near when your taxi driver, neighbour, and grandfather all start talking about how amazing Bitcoin is.	onemanatatime	318	67	1512287020	937225809713958912	https://twitter.com/onemanatatime/status/937225809713958912				0.83	0.6808	0.9944159467783056	1.0
bitcoin 	Bitcoin so high i'm turning Super Saiyan too.pic.twitter.com/oRjGAt0tLU	onemanatatime	41	0	1512274952	937175193050521600	https://twitter.com/onemanatatime/status/937175193050521600				0.00	0.5994	0.9944159467783056	1.0
bitcoin 	Bitcoin is the new Bitcoin and will replace Bitcoin	WhalePanda	104	7	1512310337	937323608401170434	https://twitter.com/WhalePanda/status/937323608401170434				0.44	0.0	0.9944159467783056	1.0
bitcoin 	This isn't even a question. If I want to buy an ICO, I need to buy ETH with Bitcoin to buy the tokens. I don't care if later the ICO is up in ETH or USD. I only care about my initial Bitcoin investment. That's the only thing that matters, my precious BTC.https://twitter.com/cryptomanran/status/937298106894438400 …	WhalePanda	380	62	1512309610	937320559360266240	https://twitter.com/WhalePanda/status/937320559360266240				0.06	0.1283	0.9944159467783056	1.0
bitcoin 	"Quite funny how /r/btc's narrative changed from ""BCash will be valued higher than Bitcoin in X months"" to ""it's good that BCash is stable in price so people will use it more""... currently <60 kb/block on average. No one uses it.pic.twitter.com/umrQevkw8c"	WhalePanda	684	189	1512304336	937298437187493888	https://twitter.com/WhalePanda/status/937298437187493888				0.41	0.2923	0.9944159467783056	1.0
bitcoin 	Love these weekend # Bitcoin moves. The Wallstreet boys going to tame Bitcoin with their circuit breakers and 9 to 5 markets?pic.twitter.com/D0mlUh8qI8	WhalePanda	518	142	1512301983	937288567516262401	https://twitter.com/WhalePanda/status/937288567516262401		#		0.68	0.3185	0.9944159467783056	1.0
bitcoin 	Holders of $ GBTC won’t be getting all flavors of forked # bitcoin coins.https://twitter.com/inthepixels/status/937360990169194497 …	cburniske	19	6	1512323276	937377880295821312	https://twitter.com/cburniske/status/937377880295821312		#		0.14	0.0	0.9944159467783056	1.0
bitcoin 	Right you are: should be $1.4B in daily $ BTC trading volume, while $750M in daily transacting via # bitcoin. Good catch!	cburniske	3	1	1512255651	937094238847819776	https://twitter.com/cburniske/status/937094238847819776		#		0.09	0.2463	0.9633620689586208	1.0
bitcoin ethereum 	I'm working on a blog post about scalable asset transfer via single-use-seals. If this gets 100 retweets I'll rewrite it to explain how Bitcoin can take on Ethereum with single-use-seals by making Cryptokitties scale.	peterktodd	515	403	1512328950	937401676042039296	https://twitter.com/peterktodd/status/937401676042039296				0.03	0.1806	0.9944159467783056	1.0
bitcoin 	When Bitcoin chains move up togetherpic.twitter.com/yB8Se7RYiM	VentureCoinist	179	25	1512276433	937181405456433153	https://twitter.com/VentureCoinist/status/937181405456433153				0.17	0.0	0.9944159467783056	1.0
bitcoin 	It's amazing how many # Bitcoin people r allergic to Honesty & Truth. I'm NOT here to be nice or play along w/ others. @ carterthomas might be the nicest & smartest guy in the world, if you like then watch him. But I don't like BULLSHIT & will Call It Like I See It.pic.twitter.com/0fUflHNMF2	ToneVays	311	33	1512339688	937446715719933952	https://twitter.com/ToneVays/status/937446715719933952		#	@	0.33	0.728	0.9944159467783056	1.0
bitcoin 	To me that is one and the same... # Bitcoin is meant to be concealed, that is the point. otherwise it's paypal.	ToneVays	4	1	1512325590	937387583407034368	https://twitter.com/ToneVays/status/937387583407034368		#		0.32	0.0	0.9944159467783056	1.0
bitcoin 	Going Live in 20min to talk Trading # Bitcoin - will the 9 Sell's across all time frames going to fail or predict another great $ BTCUSD top call today? We will find out! -Also the US Senate is planning to move to Criminalize $ BTC is no joke-https://www.youtube.com/watch?v=4CxEJdINWyw …	ToneVays	190	62	1512315809	937346560177901568	https://twitter.com/ToneVays/status/937346560177901568		#		0.53	0.1133	0.9944159467783056	1.0
bitcoin 	*U.K. TREASURY PLANS LEGISLATION TO REGULATE BITCOIN: TELEGRAPH	Sunchartist	9	15	1512340302	937449291160813568	https://twitter.com/Sunchartist/status/937449291160813568				0.12	0.2023	0.9944159467783056	1.0
