currency	tweet	username	favorites	retweets	date	id	permalink	geo	hashtags	mentions	lex_sent	vader_sent	cnn_sent	cnn_pos_neg
bitcoin 	Bitcoin is also not secure with a network delay substantially above ~10 minutes.	VitalikButerin	30	10	1502533762	896317681866907648	https://twitter.com/VitalikButerin/status/896317681866907648				-0.15	-0.5165	0.9615384615384616	1.0
bitcoin 	# Bitcoin protocol is worm-holing its way toward the center of the multi-verse. Bitcoin is a 51% attack on God.	maxkeiser	76	31	1502567939	896461027294027776	https://twitter.com/maxkeiser/status/896461027294027776		#		0.40	-0.125	0.9615384615384616	1.0
bitcoin 	The fundamental case for owning # Bitcoin has never been higher. Even at these high prices, fundamentals-driven demand is still nascent.	maxkeiser	125	59	1502562136	896436688184107012	https://twitter.com/maxkeiser/status/896436688184107012		#		0.43	-0.064	0.9615384615384616	1.0
bitcoin 	Currency invention was not the goal. But to overcome obstacles of sending value p2p, a new currency had to be invented. # Bitcoin # Satoshi	maxkeiser	73	30	1502561988	896436068140150785	https://twitter.com/maxkeiser/status/896436068140150785		# #		-0.16	-0.0172	0.9615384615384616	1.0
bitcoin 	The @ Blockstream Chief Strategy Officer openly supports the censorship on /r/Bitcoin. What does the CEO @ adam3us have to say? Crickets....https://twitter.com/Excellion/status/896272036850393088 …	rogerkver	108	25	1502567820	896460528809263104	https://twitter.com/rogerkver/status/896460528809263104			@ @	0.18	0.1204	0.9615384615384616	1.0
bitcoin 	"If you tone police my twitter, or ask me to ""stick to bitcoin"", I will save you some time and block you, so you don't need to unfollow"	aantonop	398	33	1502555566	896409134035283969	https://twitter.com/aantonop/status/896409134035283969				-0.04	0.0772	0.9615384615384616	1.0
bitcoin 	This is why bitcoin could be the new gold: Tom Leehttp://cnb.cx/2wvrLGi	ErikVoorhees	142	84	1502497928	896167383940739072	https://twitter.com/ErikVoorhees/status/896167383940739072				0.36	0.0	0.9615384615384616	1.0
bitcoin 	So far it doesn't look like July or August will break the June record of Bitcoin Days Destroyed.pic.twitter.com/pdj7IB6VQm	TuurDemeester	14	5	1502554723	896405597003943936	https://twitter.com/TuurDemeester/status/896405597003943936				0.00	-0.2755	0.9615384615384616	1.0
bitcoin 	"Strong indicator that June '17 set a record for most ""old coins"" moved from cold storage in Bitcoin's history (likely prep for HF or sales):pic.twitter.com/5rK6KNXMmU"	TuurDemeester	92	36	1502553296	896399613086793728	https://twitter.com/TuurDemeester/status/896399613086793728				0.32	0.5106	0.9615384615384616	1.0
bitcoin 	Liquidity rather than velocity. For velocity, you could look at Bitcoin days destroyed (BDD) for example. https://oxt.me/charts	TuurDemeester	6	1	1502551786	896393277884297221	https://twitter.com/TuurDemeester/status/896393277884297221				-0.18	-0.247	0.9615384615384616	1.0
bitcoin 	Look for CPAs with articles on Bitcoin pre 2015.	TuurDemeester	4	1	1502511873	896225872910458880	https://twitter.com/TuurDemeester/status/896225872910458880				0.00	0.0	0.9615384615384616	1.0
bitcoin 	Is the nuclear war talk contributing to this Bitcoin rally >$3,000?	TuurDemeester	23	10	1502496418	896161047727415297	https://twitter.com/TuurDemeester/status/896161047727415297				0.55	-0.5994	0.9615384615384616	1.0
bitcoin 	4.53 MHs # mining GlobalBoost # Blockchain! Difficulty 6.33 Price $.022 Remember # ThankAVet # Bitcoin # CryptoCurrencypic.twitter.com/z3uMDq1T0n	NetworksManager	18	15	1502534681	896321535207772162	https://twitter.com/NetworksManager/status/896321535207772162		# # # # #		0.50	-0.17	0.9615384615384616	1.0
bitcoin 	# Bitcoin was $3 when this person posted, upset others had already made money.https://twitter.com/haydentiff/status/896355571154259968 …	haydentiff	26	8	1502543581	896358864496590848	https://twitter.com/haydentiff/status/896358864496590848		#		-0.07	-0.1909	0.9615384615384616	1.0
bitcoin 	I found an old @ JoelKatz post on @ StackExchange, telling it like it is. Why is # Bitcoin fair?pic.twitter.com/C04Y1G5A4U	haydentiff	46	15	1502542796	896355571154259968	https://twitter.com/haydentiff/status/896355571154259968		#	@ @	0.50	0.1806	0.9615384615384616	1.0
bitcoin 	I can't help but think if I were a Bitcoin miner I might try and collude -not to defraud, but to cooperate.	haydentiff	5	1	1502504854	896196433329696768	https://twitter.com/haydentiff/status/896196433329696768				0.05	-0.1603	0.9615384615384616	1.0
bitcoin 	Is it fair to compare it to the cap of 21 MILLION Bitcoin? That's just a community agreement, no?	haydentiff	4	0	1502501528	896182481208082432	https://twitter.com/haydentiff/status/896182481208082432				0.26	0.2841	0.9615384615384616	1.0
bitcoin ripple 	Banks/gov can replicate the @ Ripple protocol or the Bitcoin protocol. Both are open-source.	haydentiff	1	0	1502500432	896177882724274176	https://twitter.com/haydentiff/status/896177882724274176			@	0.00	0.0	0.9615384615384616	1.0
bitcoin 	Looking for a place to spend your bitcoin treasure? Few ideas: https://www.bitpremier.com/  https://purse.io/ https://coincenter.org/donate	barrysilbert	49	16	1502496050	896159506446536706	https://twitter.com/barrysilbert/status/896159506446536706				0.15	0.148	0.9615384615384616	1.0
bitcoin 	my first bitcointalk post was about mining centralisation being an urgent problem needing improving. that was 4.5 years ago. still the case.	adam3us	43	8	1502532670	896313102119170049	https://twitter.com/adam3us/status/896313102119170049				0.00	0.0754	0.9615384615384616	1.0
bitcoin 	Overstock to Keep 50% of All Bitcoin Payments as Investments http://j.mp/2wDRhcv	WarrenWhitlock	6	3	1502574721	896489473353154560	https://twitter.com/WarrenWhitlock/status/896489473353154560				0.18	0.0	0.9615384615384616	1.0
bitcoin 	When Bitcoin has ATH days, I feel	jimmysong	26	11	1502501558	896182605682532352	https://twitter.com/jimmysong/status/896182605682532352				0.14	0.0	0.9615384615384616	1.0
bitcoin 	IRS wants your # Bitcoin information. Subscribe here--> https://dollarvigilante.com/2tt pic.twitter.com/h7TrD6KTOD	DollarVigilante	16	105	1502511087	896222575965200384	https://twitter.com/DollarVigilante/status/896222575965200384		#		0.11	0.0	0.9615384615384616	1.0
bitcoin 	# money is perception # representation of its time # Bitcoin Has No Intrinsic Value But Neither # Fiat https://cointelegraph.com/news/bitcoin-has-no-intrinsic-value-but-neither-does-fiat-opinion … @ Cointelegraph	dinisguarda	1	0	1502568538	896463539753320450	https://twitter.com/dinisguarda/status/896463539753320450		# # # #	@	0.18	0.0516	0.9615384615384616	1.0
bitcoin 	This is quite amazing: 1 # Bitcoin Now Equals Nearly 3 Ounces of # Gold https://cointelegraph.com/news/1-bitcoin-now-equals-nearly-3-ounces-of-gold-bobby-lee … via @ Cointelegraph # blockchain # crypto	dinisguarda	4	1	1502539029	896339771672469506	https://twitter.com/dinisguarda/status/896339771672469506		# # # #	@	0.48	0.624	0.9615384615384616	1.0
bitcoin 	https://www.forbes.com/sites/laurashin/2017/08/08/how-bitcoin-solved-this-serial-entrepreneurs-problems/#7e6ed1dd309c …	laurashin	0	0	1502568451	896463178074251264	https://twitter.com/laurashin/status/896463178074251264		#7e6ed1dd309c		0.00	0.0	0.9615384615384616	1.0
bitcoin 	Here’s Everything You Need to Know About Bitcoin Cash - @ FortuneMagazinehttp://fortune.com/video/2017/08/11/bitcoin-cash-101/ …	BitcoinByte	2	3	1502573672	896485075776225280	https://twitter.com/BitcoinByte/status/896485075776225280			@	-0.17	0.0	0.9615384615384616	1.0
bitcoin 	Bitcoin vaults to new record above $4K, boosted by Japan and multiplying its value fourfold https://www.cnbc.com/2017/08/12/bitcoin-vaults-to-new-record-above-4k-boosted-by-japan-and-multiplying-its-value-fourfold.html …	BitcoinByte	2	4	1502573627	896484886663622657	https://twitter.com/BitcoinByte/status/896484886663622657				0.00	0.5994	0.9615384615384616	1.0
bitcoin 	# Bitcoin Surpasses $4,000, Reaches Another Milestone @ Forbeshttps://www.forbes.com/sites/cbovaird/2017/08/12/bitcoin-surpasses-4000-reaches-another-milestone/#2c7a30bd6a8c …	BitcoinByte	6	7	1502571315	896475187431997440	https://twitter.com/BitcoinByte/status/896475187431997440		# #2c7a30bd6a8c	@	0.22	0.0516	0.9615384615384616	1.0
bitcoin 	#Bitcoin piece 2015: Valuing bitcoin @ CapAndConflict https://www.capitalandconflict.com/investing-in-bitcoin/valuing-bitcoin/ … Update 11 August 2017: bitcoin soarshttps://www.capitalandconflict.com/investing-in-bitcoin/honest-money-why-bitcoin-soars/?utm_content=bufferfcce3&utm_medium=social&utm_source=twitter.com&utm_campaign=buffer …	BitcoinByte	4	4	1502537295	896332498694811649	https://twitter.com/BitcoinByte/status/896332498694811649		#Bitcoin	@	0.21	0.34	0.9615384615384616	1.0
bitcoin litecoin 	One thing that's great about public, decentralized blockchains like bitcoin, litecoin, etc. is their extensibility.	starkness	2	0	1502567042	896457266446159872	https://twitter.com/starkness/status/896457266446159872				0.80	0.3825	0.9615384615384616	1.0
bitcoin 	Not necessarily! Advantage would have just been a malleability fix in from day 1 if a bitcoin-derived chain, or other architecture to help.	starkness	1	0	1502566999	896457087160647681	https://twitter.com/starkness/status/896457087160647681				0.17	0.2859	0.9615384615384616	1.0
bitcoin 	My talk on @ lightning and why Layer 2 will be the HTTP of bitcoin and blockchains is out! https://www.youtube.com/watch?v=3PcR4HWJnkY … @ BlockstackOrg	starkness	1658	656	1502557810	896418547156602880	https://twitter.com/starkness/status/896418547156602880			@ @	0.27	0.0	0.9615384615384616	1.0
bitcoin 	That said, I'd argue it's better that lots of tech, e.g. bitcoin, operates in the gray area. If clarity came too soon, may have stopped it.	starkness	2	1	1502516162	896243860397068288	https://twitter.com/starkness/status/896243860397068288				-0.12	0.1101	0.9615384615384616	1.0
bitcoin 	# Bitcoin $3800 on Coinbase. Thanks # Trump. # war # nkorea # Digital # Gold	GerberKawasaki	4	1	1502543501	896358527769264129	https://twitter.com/GerberKawasaki/status/896358527769264129		# # # # # #		0.44	-0.053	0.9615384615384616	1.0
bitcoin 	Wow! The electricity used for one bitcoin blockchain transaction could power 6.42 US houses for a dayhttp://digiconomist.net/bitcoin-energy-consumption …	Chris_Skinner	39	61	1502535056	896323109665611777	https://twitter.com/Chris_Skinner/status/896323109665611777				0.18	0.312	0.9615384615384616	1.0
bitcoin 	"Nice read. My conclusion was ""Bitcoin will be the death of us""https://twitter.com/rorysutherland/status/896130288257978368 …"	dgwbirch	1	0	1502517561	896249729469886468	https://twitter.com/dgwbirch/status/896249729469886468				0.00	-0.089	0.9615384615384616	1.0
bitcoin 	The interview with cftc commissioner was great for that - futures are useful. But the game theory around securing bitcoin is different	sytaylor	0	0	1502555544	896409041676718081	https://twitter.com/sytaylor/status/896409041676718081				0.59	0.5544	0.9615384615384616	1.0
bitcoin 	It secures the bitcoin network. Now you can argue the utility of that all you want But that's what it does	sytaylor	1	0	1502555401	896408439617933314	https://twitter.com/sytaylor/status/896408439617933314				0.00	0.0225	0.9615384615384616	1.0
bitcoin 	Satoshi described a system for P2P cash. Bitcoin itself has evolved into a digital commodity though. Seen that way it's different	sytaylor	2	0	1502554679	896405411254984709	https://twitter.com/sytaylor/status/896405411254984709				0.14	0.0	0.9615384615384616	1.0
bitcoin 	Pre order now. This is pure gold. Or bitcoin. Or your favourite alt coin Ok so it's a book but it's effing fantastic https://twitter.com/cburniske/status/896382453362851844 …	sytaylor	25	4	1502552476	896396174520987649	https://twitter.com/sytaylor/status/896396174520987649				0.21	0.1967	0.9615384615384616	1.0
bitcoin 	Square founder Jack Dorsey talks bitcoin and says blockchain is the ‘next big unlock’https://www.theverge.com/2017/8/11/16126610/square-twitter-founder-jack-dorsey-blockchain-bitcoin-banks …	sytaylor	40	20	1502545918	896368666119467008	https://twitter.com/sytaylor/status/896368666119467008				0.00	0.0	0.9615384615384616	1.0
bitcoin 	Kinda like what @ CadeMetz was talking about here?https://www.wired.com/2017/03/forget-bitcoin-blockchain-reveal-whats-true-today-tomorrow/ …	mikejcasey	0	0	1502510645	896220719864057857	https://twitter.com/mikejcasey/status/896220719864057857			@	0.00	0.1487	0.9615384615384616	1.0
bitcoin 	That I can't deny. But this is ugly. Reminds me of Feds' stealth policies to goad bankers into denying a/cs to bitcoin, porn, cannabis cos	mikejcasey	0	0	1502504124	896193368123953152	https://twitter.com/mikejcasey/status/896193368123953152				-0.08	-0.218	0.9615384615384616	1.0
bitcoin 	Er... Bitcoin has always been slower. Now it'll be faster. For a while. I'd be worrying about IOTA if I was you.	leashless	0	0	1502493646	896149420495953920	https://twitter.com/leashless/status/896149420495953920				0.00	-0.085	0.9360260869490683	1.0
bitcoin 	Maybe a scaled bitcoin gets the critical momentum... Maybe.	leashless	1	0	1502492423	896144293252915200	https://twitter.com/leashless/status/896144293252915200				-0.44	-0.3182	0.9360260869490683	1.0
bitcoin 	You can't counter these arguments because they are the truth. Hence you have to shift the ground. It's just the usual bitcoin shuffle.	leashless	0	0	1502492396	896144178240827393	https://twitter.com/leashless/status/896144178240827393				0.00	0.1837	0.9360260869490683	1.0
bitcoin 	The future of blockchain: Jack Dorsey talks # bitcoin and says # blockchain is the ‘next big unlock’ https://www.theverge.com/platform/amp/2017/8/11/16126610/square-twitter-founder-jack-dorsey-blockchain-bitcoin-banks …	DeanDemellweek	1	4	1502562237	896437112966402048	https://twitter.com/DeanDemellweek/status/896437112966402048		# #		0.11	0.0	0.9615384615384616	1.0
bitcoin 	https://twitter.com/alexsunnarborg/status/896374261841092609 … https://blog.lawnmower.io/the-bitcoin-wealth-distribution-69a92cc4efcc …	alexsunnarborg	2	0	1502563231	896441281697763329	https://twitter.com/alexsunnarborg/status/896441281697763329				0.00	0.0	0.9615384615384616	1.0
bitcoin 	How many people do you think own bitcoin?	alexsunnarborg	3	1	1502547237	896374198947524610	https://twitter.com/alexsunnarborg/status/896374198947524610				0.38	0.0	0.9615384615384616	1.0
bitcoin ripple 	# bitcoin $ ETH # ripple $ LTC # NEM $ DASH # IOTA $ MIOTA # monero # crypto # blockchain check out the new page at my site http://www.standpointresearch.com/news-center/ pic.twitter.com/vbtd9qzrDV	RonnieMoas	5	3	1502549862	896385207342956544	https://twitter.com/RonnieMoas/status/896385207342956544		# # # # # # #		0.39	0.0	0.9615384615384616	1.0
bitcoin 	Generally it's best to use an exchange in your country. Check out https://howtobuybitcoins.info/	lopp	0	0	1502559003	896423547614236672	https://twitter.com/lopp/status/896423547614236672				0.46	0.3185	0.9615384615384616	1.0
bitcoin 	Pssst hey buddy, wanna buy a gram of bitcoins?	lopp	48	3	1502508375	896211200576540673	https://twitter.com/lopp/status/896211200576540673				-0.22	0.0	0.9615384615384616	1.0
bitcoin 	I suspect that there are probably plenty of users who only participate in discussions about Bitcoin via 1 or 2 comms channels.	lopp	11	0	1502507583	896207876024414208	https://twitter.com/lopp/status/896207876024414208				0.05	-0.296	0.9615384615384616	1.0
bitcoin 	Indeed; I was particularly displeased with the suppression of discussion about the proposal and became a mod of /r/bitcoinxt.	lopp	8	1	1502505330	896198427914231808	https://twitter.com/lopp/status/896198427914231808				-0.11	-0.4927	0.9615384615384616	1.0
bitcoin 	Can we get to $5000 by next week? # Bitcoin	onemanatatime	18	10	1502562769	896439342951825408	https://twitter.com/onemanatatime/status/896439342951825408		#		0.00	0.0	0.9615384615384616	1.0
bitcoin 	Most people enter # Bitcoin for money / to get rich. Though I hope it's not the reason you stay.	onemanatatime	28	5	1502560026	896427839905439745	https://twitter.com/onemanatatime/status/896427839905439745		#		0.10	0.4989	0.9615384615384616	1.0
bitcoin 	Follow & RT to stand a chance to get ONE FULL # BITCOIN if $ BTC goes to US$10,000 in 2017.pic.twitter.com/qJGL86M8KA	onemanatatime	1828	4089	1502556743	896414069506179072	https://twitter.com/onemanatatime/status/896414069506179072		#		0.29	0.25	0.9615384615384616	1.0
bitcoin 	What are the possible hidden motives of big blockers, bitcoin unlimited, bcash, bitmain, ver...? Must read https://medium.com/@HjalmarPeters/the-big-blockers-bead6027deb2 … # Bitcoin	onemanatatime	6	1	1502555848	896410315553775620	https://twitter.com/onemanatatime/status/896410315553775620		#	@HjalmarPeters	0.11	0.0	0.9615384615384616	1.0
bitcoin ethereum 	New to # Bitcoin $ Crypto trading? Must-read about FA, TA, rules & strategy, emotions, psychology, cycles, structure.. http://alunacrypto.blogspot.sg/2017/06/essential-beginners-starter-kit-for-cryptocurrency-trading-bitcoin-altcoins-ethereum.html …	onemanatatime	99	45	1502538898	896339224277901314	https://twitter.com/onemanatatime/status/896339224277901314		#		0.05	0.0	0.9615384615384616	1.0
bitcoin 	not actually buying them with bitcoin.. just at my local online bookstore.	onemanatatime	0	0	1502529102	896298135466553346	https://twitter.com/onemanatatime/status/896298135466553346				0.08	0.0	0.9615384615384616	1.0
bitcoin 	Crazy to think just how much 0.1 or 0.2 # Bitcoin is worth today in terms of $...	onemanatatime	34	0	1502518305	896252848538755072	https://twitter.com/onemanatatime/status/896252848538755072		#		0.33	-0.128	0.9615384615384616	1.0
bitcoin 	# Bitcoin was at sub-$800 at the start of the year. wtf.	onemanatatime	150	23	1502500212	896176962355449857	https://twitter.com/onemanatatime/status/896176962355449857		#		-0.17	-0.2929	0.9615384615384616	1.0
bitcoin 	I think our moms have Bitcoin checker app on their phone now. They seem to know price better than us these days.	onemanatatime	42	4	1502499641	896174567302995968	https://twitter.com/onemanatatime/status/896174567302995968				0.14	0.2202	0.9615384615384616	1.0
bitcoin 	Why # Bitcoin up what news??	onemanatatime	37	1	1502498221	896168610657312769	https://twitter.com/onemanatatime/status/896168610657312769		#		0.33	0.0	0.9615384615384616	1.0
bitcoin 	If you remember this, you are a real Bitcoin OG (2011-2013) https://www.reddit.com/r/Bitcoin/comments/6t9g4k/if_you_remember_this_you_are_a_real_bitcoin_og/?ref=share&ref_source=twitter … via @ reddit	CharlieShrem	22	6	1502556131	896411503187738625	https://twitter.com/CharlieShrem/status/896411503187738625			@	0.27	0.0	0.9615384615384616	1.0
bitcoin 	Shout out to all those people who bought # Bitcoin from # BitInstant from 2011-2013. We did it.pic.twitter.com/LfOP1uyw6l	CharlieShrem	126	19	1502555358	896408262580424705	https://twitter.com/CharlieShrem/status/896408262580424705		# #		0.22	0.0	0.9615384615384616	1.0
bitcoin 	The current # bitcoin price excites and scares me at the same time.	WhalePanda	487	77	1502522422	896270115821543424	https://twitter.com/WhalePanda/status/896270115821543424		#		0.31	0.1779	0.9615384615384616	1.0
bitcoin 	2/ If I mention # bitcoin's price action to people that know little about it, they are *always* intrigued.	cburniske	24	6	1502571028	896473984153395206	https://twitter.com/cburniske/status/896473984153395206		#		0.26	0.0	0.9615384615384616	1.0
bitcoin 	1/ When I explain # Bitcoin's tech to people that know little about it, they are *often* intrigued (or polite enough to feign interest).	cburniske	39	10	1502570967	896473728749535232	https://twitter.com/cburniske/status/896473728749535232		#		-0.08	0.0	0.9615384615384616	1.0
bitcoin 	False. @ blockchain's charts if you'd like to educate yourself: https://blockchain.info/charts . Or @ bitcom21's valuation:http://www.zerohedge.com/news/2016-10-27/needham-raises-bitcoin-price-target-848-heres-why …	cburniske	9	2	1502549777	896384853486317568	https://twitter.com/cburniske/status/896384853486317568			@ @	0.00	0.1204	0.9615384615384616	1.0
bitcoin 	10/ ps: lots of these stats on # bitcoin bubbles came from the book https://www.amazon.com/Bitcoin-Beyond-Innovative-Investors-Blockchain/dp/1260026671 …	cburniske	88	8	1502549205	896382453362851844	https://twitter.com/cburniske/status/896382453362851844		#		0.07	0.0	0.9615384615384616	1.0
bitcoin 	8/ I don't expect as severe a in # bitcoin's price & we haven't reached my definition of a $ BTC bubble, but these are things to be aware of	cburniske	55	11	1502549076	896381911966388233	https://twitter.com/cburniske/status/896381911966388233		#		0.40	0.1139	0.9615384615384616	1.0
bitcoin 	7/ Those were *very* different # bitcoin markets though, with thin liquidity, fragile exchanges, and a fraction of the users & investors.	cburniske	41	6	1502548935	896381322415026177	https://twitter.com/cburniske/status/896381322415026177		#		0.05	0.0	0.9615384615384616	1.0
bitcoin 	6/ After every bubble there's a crash In those 3 periods # bitcoin's drawdown: June 2011 peak to trough: -93% April 2013: -71% Nov 2013: -85%	cburniske	61	29	1502548871	896381054466097153	https://twitter.com/cburniske/status/896381054466097153		#		0.15	-0.4019	0.9615384615384616	1.0
bitcoin 	5/ I define a # bitcoin bubble as a period where price doubles (or more) in a 30-day period. As $ BTC nears $3,800 we are up 70% in 30 days	cburniske	61	17	1502548772	896380636491112453	https://twitter.com/cburniske/status/896380636491112453		#		0.13	0.0	0.9615384615384616	1.0
bitcoin 	4/ The 3 peaks in @ Google Search trends were accompanied by 3 of # bitcoin's 6 price bubbles.pic.twitter.com/HmYYms55dk	cburniske	138	74	1502548758	896380577871536130	https://twitter.com/cburniske/status/896380577871536130		#	@	0.16	0.0	0.9615384615384616	1.0
bitcoin 	3/ The virtuous Satoshi cycle can overheat though, as @ Google Search activity divorces from its tight tango w/ # bitcoin's price.	cburniske	33	8	1502547653	896375943736020993	https://twitter.com/cburniske/status/896375943736020993		#	@	0.41	0.5267	0.9615384615384616	1.0
bitcoin 	2/ An increasing price drives interest in # bitcoin That interest further drives the price of $ BTC. A virtuous Satoshi cycle	cburniske	117	29	1502547534	896375442516652034	https://twitter.com/cburniske/status/896375442516652034		#		0.68	0.6225	0.9615384615384616	1.0
bitcoin 	1/ Mashup of @ Google Search trends for # bitcoin & the price of $ BTC.pic.twitter.com/wXvKA9SzP8	cburniske	712	452	1502547445	896375069273993217	https://twitter.com/cburniske/status/896375069273993217		#	@	0.50	0.0	0.9615384615384616	1.0
bitcoin 	LIVE # Bitcoin & # StockMarket Analysis for $ BTCUSD ATH & is it a Top? $ SPX $ GOLD $ OIL $ EURUSD + Special Guest!!!https://www.youtube.com/watch?v=EoRRUQyhlM4 …	ToneVays	67	19	1502573968	896486315100958720	https://twitter.com/ToneVays/status/896486315100958720		# #		0.48	0.252	0.9615384615384616	1.0
