currency	tweet	username	favorites	retweets	date	id	permalink	geo	hashtags	mentions	lex_sent	vader_sent	cnn_sent	cnn_pos_neg
bitcoin 	An Evening with Vinny Lingham - Bitcoin Scaling and more! Looks like we are going to need a bigger venue - RSVP now!https://www.meetup.com/San-Francisco-Bitcoin-Social/events/238297460/ …	VinnyLingham	43	8	1492734828	855217971790135296	https://twitter.com/VinnyLingham/status/855217971790135296				0.09	0.14	0.9954196138088977	1.0
bitcoin 	Another interesting graph would be to connect altcoins as branches from the main bitcoin chart at the time of the altcoin launch.	SatoshiLite	8	1	1492729299	855194783223996416	https://twitter.com/SatoshiLite/status/855194783223996416				-0.14	0.4019	0.986627043090639	1.0
bitcoin 	Bitcoin has already grown through four orders of magnitude: 1KB to 10KB to 100KB to 1MB blocks. 10MB is the next step.	rogerkver	140	51	1492787434	855438619401625601	https://twitter.com/rogerkver/status/855438619401625601				0.23	-0.1132	0.9954196138088977	1.0
bitcoin 	The 7 Steps of Estate Planning for Bitcoin and Other Digital Assets http://coinjournal.net/7-steps-estate-planning-bitcoin-digital-assets/ … via @ Coinjournal @ KyleTorpey and @ pamelawjd	aantonop	76	41	1492800280	855492496234819585	https://twitter.com/aantonop/status/855492496234819585			@ @ @	0.29	0.1779	0.9954196138088977	1.0
bitcoin 	Bitcoin to Gain Legal Status in India, Reports Local Media https://www.cryptocoinsnews.com/?p=104420  via @ CryptoCoinsNews	ErikVoorhees	78	52	1492731666	855204711594688512	https://twitter.com/ErikVoorhees/status/855204711594688512			@	0.21	0.5994	0.986627043090639	1.0
bitcoin 	Heard today about Bitcoin: nothing as bullish as an asset which keeps recovering in the face of one bad news story after the other.	TuurDemeester	247	101	1492733125	855210828764786688	https://twitter.com/TuurDemeester/status/855210828764786688				-0.17	-0.25	0.9954196138088977	1.0
bitcoin 	Cut film to vent. Microwave 6 minutes. @ BitcoinBellepic.twitter.com/3cGQ63pUoI	haydentiff	5	0	1492805627	855514923597746176	https://twitter.com/haydentiff/status/855514923597746176			@	0.33	-0.0911	0.9954196138088977	1.0
bitcoin 	# whoworeitbetter (I was so tempted to switch the names, haha!) @ BitcoinBellepic.twitter.com/QQBLATKD1F	haydentiff	4	0	1492804976	855512193084862464	https://twitter.com/haydentiff/status/855512193084862464		#	@	0.00	0.0	0.9954196138088977	1.0
bitcoin 	I had another mishap yesterday.... LOL! I'm awful! @ BitcoinBellepic.twitter.com/nGHA3v8ij5	haydentiff	4	1	1492803776	855507160477945857	https://twitter.com/haydentiff/status/855507160477945857			@	-0.70	0.0267	0.9954196138088977	1.0
bitcoin 	Well this is escalating quickly! Indian Prime Minister Narendra Modi has outlawed cash in 75 cities. # Bitcoinhttp://www.independentsentinel.com/eyes-india-goes-cashless-75-cities/ …	haydentiff	11	13	1492788607	855443539781615617	https://twitter.com/haydentiff/status/855443539781615617		#		0.56	0.1127	0.9954196138088977	1.0
bitcoin 	"""Bitcoin is like the crabby old uncle that just won't die."" LOL. I think of that every time Bitcoin rebounds from a dip. # HappyFriday!https://twitter.com/coindesk/status/855390674237214721 …"	haydentiff	27	18	1492788052	855441210202259461	https://twitter.com/haydentiff/status/855441210202259461		#		0.24	0.1565	0.9954196138088977	1.0
bitcoin 	really doesnt. Pools could mine invalid CSV block today, create a fork. Yet they do not. Bitcoin users arent the enemy, they *are* bitcoin	adam3us	1	0	1492796110	855475007333351425	https://twitter.com/adam3us/status/855475007333351425				-0.04	0.0572	0.9954196138088977	1.0
bitcoin 	This plus LTC agreement should give Bitcoin some good data points.https://twitter.com/AaronvanW/status/855418789932011520 …	jimmysong	6	0	1492782818	855419256640593922	https://twitter.com/jimmysong/status/855419256640593922				0.36	0.3634	0.9954196138088977	1.0
bitcoin 	This. Most Bitcoiners know this at a subconscious level. If you find that you hoard Bitcoin, this is why.https://twitter.com/saifedean/status/855389950388449280 …	jimmysong	12	4	1492779603	855405770854236161	https://twitter.com/jimmysong/status/855405770854236161				0.21	0.0	0.9954196138088977	1.0
bitcoin 	Better Buy some # Bitcoin # Investing Learn About Bitcoin--> https://dollarvigilante.com/2tt pic.twitter.com/drK6hREyWy	DollarVigilante	6	11	1492734794	855217829452361729	https://twitter.com/DollarVigilante/status/855217829452361729		# #		0.18	0.4404	0.9954196138088977	1.0
bitcoin 	# FollowFriday top influencers this week @ Namenode5 @PlseHelpPray4Us @ BitcoinRTs, have a great weekend :) http://vitw.it/link/bX5jK	dinisguarda	0	0	1492793027	855462075228979201	https://twitter.com/dinisguarda/status/855462075228979201		#	@ @PlseHelpPray4Us @	0.71	0.836	0.9954196138088977	1.0
bitcoin 	From Here To Where? # Bitcoin And The # Future Of # Cryptocurrency and @ humaniq_co via @ forbeshttp://www.forbes.com/sites/haroldstark/2017/04/21/from-here-to-where-bitcoin-and-the-future-of-cryptocurrency/#75d3b8ce4367 …	dinisguarda	28	20	1492785745	855431535360700416	https://twitter.com/dinisguarda/status/855431535360700416		# # # #75d3b8ce4367	@ @	0.21	0.0	0.9954196138088977	1.0
bitcoin 	# FollowFriday @MxskNObg5budv7Y @ fukugitaise @ Bitcoin24hrs for being top engaged members in my community this week :) http://vitw.it/link/vaNkQ	dinisguarda	0	0	1492734107	855214950247276550	https://twitter.com/dinisguarda/status/855214950247276550		#	@MxskNObg5budv7Y @ @	0.26	0.7579	0.9954196138088977	1.0
bitcoin 	amazing story - here's how @ JeremyRubin and @ delitzer brought # bitcoin to @ MIT (none for grad students tho )http://www.coindesk.com/time-we-gave-500000-bitcoin-college-kids/ …	Melt_Dem	16	4	1492782545	855418110106636288	https://twitter.com/Melt_Dem/status/855418110106636288		#	@ @ @	0.55	0.5859	0.9954196138088977	1.0
bitcoin 	i prefer Bitcoin, but the beauty is that there's enough room for many other cryptocurrencies to exist, even if you don't want / need them	Melt_Dem	1	0	1492747780	855272296226856964	https://twitter.com/Melt_Dem/status/855272296226856964				0.24	0.7066	0.9954196138088977	1.0
bitcoin 	smart money is slowly and quietly starting to dabble in cryptohttp://money.cnn.com/2017/04/20/investing/mike-novogratz-bets-big-on-bitcoin-ether-blockchain/index.html …	Melt_Dem	56	38	1492729916	855197372141449216	https://twitter.com/Melt_Dem/status/855197372141449216				-0.45	0.4019	0.986627043090639	1.0
bitcoin 	Heading over to Beijing to meet the # FinTech and # Bitcoin community out there. Let me know if you are in town.pic.twitter.com/c2GbnBv76x	SimonDixonTwitt	4	1	1492756206	855307638162153472	https://twitter.com/SimonDixonTwitt/status/855307638162153472		# #		-0.04	0.0	0.9954196138088977	1.0
bitcoin 	The story reported several facts that indicate Bitcoin could fall victim to this infighting. We're already seeing signs of it.	laurashin	0	0	1492796384	855476157621219330	https://twitter.com/laurashin/status/855476157621219330				0.05	-0.1366	0.9954196138088977	1.0
bitcoin 	Cardano: A Blockchain with Privacy and Regulation. – Michael Parsons – Mediumhttps://medium.com/@BitcoinByte/a-blockchain-with-privacy-and-regulation-cardano-3606e1288bc2 …	BitcoinByte	0	0	1492800780	855494594355757056	https://twitter.com/BitcoinByte/status/855494594355757056			@BitcoinByte	0.17	0.0	0.9954196138088977	1.0
bitcoin 	"""hard fork: changing the rules; soft fork: tightening the existing rules""https://news.bitcoin.com/asicboost-interview-developer-jeremy-rubin/ …"	BitcoinByte	1	0	1492755509	855304713624891393	https://twitter.com/BitcoinByte/status/855304713624891393				-0.09	-0.1027	0.9954196138088977	1.0
bitcoin 	Du willst englische Bitcoin & Blockchain news ohne Scam und Abzocke? Join TenX TV with Julian Hosp!: http://youtu.be/eSJerPgh1cg?a  via	julianhosp	0	0	1492756196	855307595778637825	https://twitter.com/julianhosp/status/855307595778637825				0.16	-0.0708	0.9954196138088977	1.0
bitcoin 	Willkommen bei Kryptowährungen, Blockchain und Bitcoin ohne Abzocke oder Scams - mit Julian Hosp: http://youtu.be/w-yjDIamh-4?a  via	julianhosp	0	0	1492754879	855302074472345600	https://twitter.com/julianhosp/status/855302074472345600				0.06	-0.5859	0.9954196138088977	1.0
bitcoin 	I love how @ ARKblockchain has been translating # TheSocialOrganism into Bitcoin. :)	mikejcasey	3	1	1492760040	855323718582652928	https://twitter.com/mikejcasey/status/855323718582652928		#	@	1.15	0.5478	0.9954196138088977	1.0
bitcoin 	India & Bitcoin making headlines on r/bitcoin # reddit. https://www.reddit.com/r/Bitcoin/comments/66hdyp/cnbc_india_the_government_is_looking_to_grant/?st=J1QYDPS5&sh=92802e10 …pic.twitter.com/AzikGLQW2Y	SunnyStartups	2	2	1492725778	855180014035271681	https://twitter.com/SunnyStartups/status/855180014035271681		#		0.30	0.0	0.986627043090639	1.0
bitcoin 	Billionaire says he has 10% of his money in Bitcoin and Ether http://cnnmon.ie/2pjpg9E  via @ CNNMoney	wences	18	14	1492780975	855411526299115520	https://twitter.com/wences/status/855411526299115520			@	-0.12	0.0	0.9954196138088977	1.0
bitcoin 	Years ago I wrote about what I consider different asset Tiers and the threats they should protect against:https://medium.com/@lopp/thoughts-on-secure-storage-of-bitcoins-and-other-crypto-assets-210cadabb53d …	lopp	18	5	1492800796	855494663008137216	https://twitter.com/lopp/status/855494663008137216			@lopp	0.11	0.3182	0.9954196138088977	1.0
bitcoin 	You too can become a professional Bitcoiner! DM me if you see an opening that interests you: https://bitgo.workable.com/ https://twitter.com/murchandamus/status/855172426707193856 …	lopp	25	8	1492782629	855418463174762496	https://twitter.com/lopp/status/855418463174762496				0.06	0.125	0.9954196138088977	1.0
bitcoin 	The IMF Just Finished its First 'High Level' Meeting on Blockchain - CoinDesk http://crwd.fr/2oscotu # Bitcoinpic.twitter.com/RkJKxxxfKV	onemanatatime	4	1	1492773972	855382153907011586	https://twitter.com/onemanatatime/status/855382153907011586		#		0.38	0.0	0.9954196138088977	1.0
bitcoin 	[ANN] TrezorCoin - Hardware Security & Privacy - 10,000 Supply Only - No Premine - No ICO - FREE TREZOR! Sign up @trezor.io # TREZOR10khttps://twitter.com/BitcoinTrezor/status/855028285088161792 …	onemanatatime	4	2	1492734024	855214598374309889	https://twitter.com/onemanatatime/status/855214598374309889		#	@trezor	0.28	0.2574	0.9954196138088977	1.0
bitcoin 	Good reads: https://twitter.com/petertoddbtc/status/855144639220862976 … and https://medium.com/@WhalePanda/the-bitcoin-dominance-indicator-fallacy-2b11093869d4 …	WhalePanda	2	0	1492753951	855298181097152512	https://twitter.com/WhalePanda/status/855298181097152512			@WhalePanda	0.60	0.4404	0.9954196138088977	1.0
bitcoin 	Like @ rogerkver (marketing) v. @ adam3us (product). Looks like # SteveJobs could've helped # bitcoin through the scaling debatehttps://twitter.com/valaafshar/status/855363145023541248 …	cburniske	15	8	1492772274	855375033694400513	https://twitter.com/cburniske/status/855375033694400513		# #	@ @	0.30	0.3612	0.9954196138088977	1.0
bitcoin 	Which is precisely why # bitcoin has no Fed https://twitter.com/schuldensuehner/status/855372598229839872 …	cburniske	12	8	1492771776	855372941881638914	https://twitter.com/cburniske/status/855372941881638914		#		0.60	-0.296	0.9954196138088977	1.0
bitcoin 	As animals we are addicted to the adrenaline of , helping to explain some of the # Bitcoin (& crypto) bile that propagates on social media.pic.twitter.com/TQGYakjisX	cburniske	6	3	1492738582	855233717236887553	https://twitter.com/cburniske/status/855233717236887553		#		0.08	0.296	0.9954196138088977	1.0
bitcoin 	# bitcoin climbing a perennial wall of worry.https://twitter.com/tuurdemeester/status/855210828764786688 …	cburniske	20	10	1492734247	855215533746262016	https://twitter.com/cburniske/status/855215533746262016		#		-0.12	-0.2202	0.9954196138088977	1.0
bitcoin 	they can withdraw the # bitcoin, that's why $1242 Mt.Gox high was always legit in book	ToneVays	0	0	1492811031	855537590744879104	https://twitter.com/ToneVays/status/855537590744879104		#		0.06	0.0	0.9954196138088977	1.0
bitcoin 	Just read this article as we gonna talk about it @ WorldCryptoNet podcast. Awesome job Todd getting all those details. # Bitcoin... PS hey Jon	ToneVays	0	0	1492809439	855530915539410946	https://twitter.com/ToneVays/status/855530915539410946		#	@	0.44	0.2083	0.9954196138088977	1.0
bitcoin 	Mt.Gox was always 80,000 # bitcoin in the hole. The worry here is that what if all @ Tether_to $$$ end up being confiscated by some Gov't ???pic.twitter.com/tSYFawKE9l	ToneVays	1	0	1492786265	855433716168044544	https://twitter.com/ToneVays/status/855433716168044544		#	@	0.25	-0.168	0.9954196138088977	1.0
bitcoin 	I will speculate on my Sunday $ BTCUSD Podcast or perhaps it will be a topic on tonight's @ WorldCryptoNet w/ @ MadBitcoins # Bitcoin Group	ToneVays	1	0	1492785218	855429324438163457	https://twitter.com/ToneVays/status/855429324438163457		#	@ @	0.46	0.0	0.9954196138088977	1.0
bitcoin 	Not at all, what I said on January 3rd is as true now 5 months later as it was then. But it's up to you to decide how risky # Bitcoin ispic.twitter.com/lrKsOqoCvo	ToneVays	1	0	1492783876	855423694373613568	https://twitter.com/ToneVays/status/855423694373613568		#		-0.06	0.1096	0.9954196138088977	1.0
bitcoin 	The @ Bitfinex: @ Bitstamp ratio of $ BTCUSD is now 4th largest in 3yrs at 7% & $80 price diff $1330 vs $1250... crazy ... # Bitcoin # Blockchainpic.twitter.com/Te1Qm0JIf1	ToneVays	29	19	1492782166	855416524416446464	https://twitter.com/ToneVays/status/855416524416446464		# #	@ @	0.43	-0.34	0.9954196138088977	1.0
