currency	tweet	username	favorites	retweets	date	id	permalink	geo	hashtags	mentions	lex_sent	vader_sent	cnn_sent	cnn_pos_neg
bitcoin 	Remember when Chinese capital controls shot # Bitcoin from $200 to the moon? Looks like a repeat is fast approaching.https://twitter.com/zerohedge/status/947222744504127488 …	maxkeiser	330	152	1514670946	947224719752876033	https://twitter.com/maxkeiser/status/947224719752876033		#		0.15	0.1204	0.9696715661716382	-1.0
bitcoin 	I concur... # Bitcoin as SOV was virtually never discussed from ‘09 - ‘17. This changed when price broke psychological ‘Gold price’ level this year and media took notice.https://twitter.com/viktorartless/status/947120536185958401 …	maxkeiser	96	37	1514648693	947131385160101889	https://twitter.com/maxkeiser/status/947131385160101889		#		0.14	-0.1405	0.9696715661716382	-1.0
bitcoin 	The original homepage of http://Bitcoin.org  specifically stated that inflation was the method of payment until those coins ran out. The fee market today is premature. Satoshi knew this.	VinnyLingham	7	0	1514664733	947198659170406400	https://twitter.com/VinnyLingham/status/947198659170406400				0.18	0.1061	0.9696715661716382	-1.0
bitcoin 	No. Because the Bitcoin community has agreed to accept UASFs. The governance model is broken, imho, so it doesn’t matter anymore.	VinnyLingham	3	0	1514662903	947190984609107968	https://twitter.com/VinnyLingham/status/947190984609107968				0.33	-0.0444	0.9696715661716382	-1.0
bitcoin 	# popcorntimehttps://twitter.com/cobrabitcoin/status/947170870920990720 …	VinnyLingham	50	9	1514661593	947185491127836672	https://twitter.com/VinnyLingham/status/947185491127836672		#		0.50	0.0	0.9696715661716382	-1.0
bitcoin ripple 	Imagine if we saw Ripple overtake Bitcoin this weekend? # igiveuphttps://twitter.com/melt_dem/status/946912981400670208 …	VinnyLingham	165	42	1514621430	947017033731809281	https://twitter.com/VinnyLingham/status/947017033731809281		#		0.09	0.0	0.9696715661716382	-1.0
bitcoin 	My RT interview about my hackhttps://www.google.com/amp/s/www.rt.com/news/414604-mcafee-hacking-cryptocurrency-bitcoin-threat/amp/ …	officialmcafee	919	213	1514617947	947002424186802176	https://twitter.com/officialmcafee/status/947002424186802176				-0.17	0.0	0.9696715661716382	-1.0
bitcoin 	It. costs 10 Bitcoins. But I'm drunk right now and am probably tripping on acid. Or DMT. Or maybe an overdose of shrooms. Or maybe just having a flashback. In any case, I followed you for free. At least on the physical plane. On the astral plane you probably owe me your children.	officialmcafee	1637	414	1514605617	946950711790702592	https://twitter.com/officialmcafee/status/946950711790702592				0.02	0.019	0.9696715661716382	-1.0
bitcoin 	https://www.marketwatch.com/story/bitcoin-bull-mcafee-urgers-cryptocurrency-investors-to-hold-on-2017-12-26 …	officialmcafee	1474	380	1514596882	946914072016154624	https://twitter.com/officialmcafee/status/946914072016154624				0.00	0.0	0.9696715661716382	-1.0
bitcoin 	After @ RubinReport had me on, they received: 76 Tips via Bitcoin Cash 1 Tip via Bitcoin Core Bitcoin Cash is working well. Bitcoin Core is committing suicide.https://www.youtube.com/watch?v=N6NscwzbMvI …	rogerkver	970	287	1514643954	947111505559982080	https://twitter.com/rogerkver/status/947111505559982080			@	0.14	-0.1212	0.9696715661716382	-1.0
bitcoin 	No I mean that I won't tolerate being told that I should only express opinions about Bitcoin. I'm not a PR bot, I have a wide variety of interests.	aantonop	310	12	1514671855	947228532182339584	https://twitter.com/aantonop/status/947228532182339584				0.03	-0.023	0.9696715661716382	-1.0
bitcoin 	"""stick to bitcoin"" is tone policing and is an instant block"	aantonop	1085	124	1514667631	947210816364974081	https://twitter.com/aantonop/status/947210816364974081				0.36	-0.4404	0.9696715661716382	-1.0
bitcoin 	That's only one of the 8 stories in the book. But yes, it applies to all Bitcoin-born chains, yet also covers Segwit and Lightning.	aantonop	2	0	1514666768	947207197515309056	https://twitter.com/aantonop/status/947207197515309056				0.12	0.2009	0.9696715661716382	-1.0
bitcoin 	Things change so fast in bitcoin. A paper book needs constant updates. The second edition was a 50% rewrite.	aantonop	197	10	1514643754	947110669312282624	https://twitter.com/aantonop/status/947110669312282624				0.00	0.0	0.9696715661716382	-1.0
bitcoin 	It's just what I think the market will decide (give Bitcoin more liquidity and market cap) - it's neither good or bad.	TuurDemeester	5	0	1514670680	947223603875143680	https://twitter.com/TuurDemeester/status/947223603875143680				0.32	0.1139	0.9696715661716382	-1.0
bitcoin 	The image of Bitcoin Hippo showing its true strength and size, versus the altcoins who each struggle with security and lack of network effect.	TuurDemeester	24	3	1514670549	947223054861717504	https://twitter.com/TuurDemeester/status/947223054861717504				-0.04	0.5859	0.9696715661716382	-1.0
bitcoin 	I could be wrong, but this is how I imagine Bitcoin with 2nd layer scaling vs the altcoin complex in the next five years.pic.twitter.com/YAjVPpIt3I	TuurDemeester	1171	280	1514670411	947222474990739456	https://twitter.com/TuurDemeester/status/947222474990739456				-0.21	-0.2617	0.9696715661716382	-1.0
bitcoin ripple 	Bitcoin was created to fund Ripple, so thanks.	haydentiff	6	1	1514667844	947211707679682561	https://twitter.com/haydentiff/status/947211707679682561				-0.12	0.6948	0.9696715661716382	-1.0
bitcoin 	SWIFT is definitely working hard to recreate the wheel. # TooLittleTooLate # SWIFTgpi # xrpthestandardhttps://twitter.com/bitcoinfrank/status/947170959726956545 …	haydentiff	32	3	1514659262	947175714402590720	https://twitter.com/haydentiff/status/947175714402590720		# # #		0.27	0.2952	0.9696715661716382	-1.0
bitcoin ripple 	SWIFT is a one-trick pony. They are a messaging system only. @ Ripple provides instantaneous, global settlement. $ XRP # xrpthestandardhttps://twitter.com/bitcoinfrank/status/947171053058453505 …	haydentiff	55	11	1514659196	947175436852842496	https://twitter.com/haydentiff/status/947175436852842496		#	@	0.10	0.092	0.9696715661716382	-1.0
bitcoin ripple 	$ XRP is a cryptographically-secured digital asset that is native to the XRP Ledger and.... DOES NOT REQUIRE TRUST. XRP has no counterparty risk. # xrpthestandard # Ripplehttps://twitter.com/bitcoinfrank/status/947170816067858433 …	haydentiff	55	16	1514659087	947174980428750849	https://twitter.com/haydentiff/status/947174980428750849		# #		0.39	0.0903	0.9696715661716382	-1.0
bitcoin 	If you leave your # crypto on an exchange (ANY crypto), you no longer have control over it. Golden rule of crypto: “Whoever holds the keys, owns the crypto.” # Bitcoin # BitcoinCash $ XRP # xrpthestandardhttps://twitter.com/sourcex44/status/947170607409504257 …	haydentiff	52	17	1514658778	947173682153250816	https://twitter.com/haydentiff/status/947173682153250816		# # # #		0.22	-0.17	0.9696715661716382	-1.0
bitcoin 	You are incorrect. Bitcoin is not as fungible as XRP. Every # Bitcoin is unique and UTXOs could even become blacklisted at some point. You should consider putting the Bible down and actually reading about the tech you ignorantly want to condemn.	haydentiff	14	4	1514657403	947167914498588672	https://twitter.com/haydentiff/status/947167914498588672		#		0.21	-0.1499	0.9696715661716382	-1.0
bitcoin ripple 	One $ XRP is indistinguishable from another and XRP requires no trust. # xrpthestandard # Ripplehttps://twitter.com/bitcoinfrank/status/947165476437848065 …	haydentiff	39	8	1514657023	947166322923917312	https://twitter.com/haydentiff/status/947166322923917312		# #		0.31	0.1366	0.9696715661716382	-1.0
bitcoin 	Yes! I will be there with @ EdgeSecure! # Bitcoin # TNABChttps://twitter.com/teampresearch/status/947153032613105665 …	haydentiff	19	2	1514656167	947162731198676992	https://twitter.com/haydentiff/status/947162731198676992		# #	@	0.50	0.1525	0.9696715661716382	-1.0
bitcoin 	There are a lot of coins that I don’t care for. Do u know how much time I spend discussing them? None. People who do otherwise are suspicious, IMO. And those who bash others behind anonymous accts-they are COWARDS. You make me not want to be associated w/ # BitcoinCash. @ a3456gfhttps://twitter.com/a3456gf/status/947040414091051010 …	haydentiff	154	18	1514653675	947152280863891457	https://twitter.com/haydentiff/status/947152280863891457		#	@	0.17	0.0108	0.9696715661716382	-1.0
bitcoin 	Who’s going to # Bitcoin Miami?!!! I’ll be there with @ EdgeSecure!https://twitter.com/keynote_ae/status/947111829326753792 …	haydentiff	18	2	1514652827	947148723267756032	https://twitter.com/haydentiff/status/947148723267756032		#	@	0.17	0.0	0.9696715661716382	-1.0
bitcoin 	Damn. 40k followers! That’s so cool (and weird!), haha. Thanks guys! # Bitcoin # BitcoinCash # XRPtheStandard # Libertarian # LiveFree # HappyNewYear2018pic.twitter.com/FqSTKhzy92	haydentiff	302	32	1514594231	946902954958868480	https://twitter.com/haydentiff/status/946902954958868480		# # # # # #		0.30	0.1679	0.9696715661716382	-1.0
bitcoin 	Bitcoin when price is down: it's because my pet feature isn't in there! Bitcoin when price is up: price would go up even more if my pet feature got in there! Or, it's just the markets and your pet feature isn't that important.	jimmysong	368	65	1514654783	947156929373245440	https://twitter.com/jimmysong/status/947156929373245440				0.42	-0.0504	0.9696715661716382	-1.0
bitcoin 	Conventional Wisdom: pay attention to the news because it matters Bitcoin Wisdom: pay attention to real value because that's what matters	jimmysong	491	127	1514607528	946958727629942784	https://twitter.com/jimmysong/status/946958727629942784				-0.10	0.8225	0.9696715661716382	-1.0
bitcoin 	Can Crypto-Currency Overturn Governments? # Bitcoin Subscribe--> https://dollarvigilante.com/2tt pic.twitter.com/vZSw6gXqKM	DollarVigilante	26	8	1514646683	947122953396850688	https://twitter.com/DollarVigilante/status/947122953396850688		#		0.12	0.0	0.9696715661716382	-1.0
bitcoin 	What is # bitcoin, what is # blockchain?http://flip.it/xJGzm5	dinisguarda	3	6	1514663976	947195483960815617	https://twitter.com/dinisguarda/status/947195483960815617		# #		0.75	0.0	0.9696715661716382	-1.0
bitcoin 	BitMEX, a major # cryptocurrency trading platform, has liquidated its customers' # bitcoin Cash for Bitcoin # blockchain # fintech http://for.tn/2Cudayg	sbmeunier	0	2	1514667975	947212258966409216	https://twitter.com/sbmeunier/status/947212258966409216		# # # #		0.29	0.0	0.9696715661716382	-1.0
bitcoin 	Sure, here: http://fc16.ifca.ai/bitcoin/papers/MES16.pdf … Just a single new opcode, enables non-fungible Colored Coins and Vaults.	el33th4xor	31	8	1514595471	946908155572838401	https://twitter.com/el33th4xor/status/946908155572838401				0.43	0.3182	0.9696715661716382	-1.0
bitcoin 	Covenants, invented at @ initc3org, do exactly this. They were designed for Bitcoin and work on Bitcoin Cash.https://twitter.com/JihanWu/status/946783929041747968 …	el33th4xor	67	15	1514594759	946905167638810624	https://twitter.com/el33th4xor/status/946905167638810624			@	0.22	0.0	0.9696715661716382	-1.0
bitcoin 	Was super-excited to see this spot in one of the recent New Yorkers! # bitcoin # cryptopic.twitter.com/HUJUDODwmG	laurashin	41	5	1514590454	946887110925193216	https://twitter.com/laurashin/status/946887110925193216		# #		0.12	0.0	0.897060296344794	1.0
bitcoin ripple 	Actually ripple is valued at more than bitcoin. You are just looking at free float. It’s not the right way to look at these.	novogratz	190	37	1514615282	946991247763181568	https://twitter.com/novogratz/status/946991247763181568				0.25	0.317	0.9696715661716382	-1.0
bitcoin 	The Pineapple Fund, using Bitcoin profits for Crypto Good, https://cryptocoin.news/news/bitcoin/the-pineapple-fund-using-bitcoin-profits-for-crypto-good-5135/ … via @todaycryptoCryptoCoinNewsCCN	SimonCocking	2	1	1514664543	947197864572342272	https://twitter.com/SimonCocking/status/947197864572342272			@todaycryptoCryptoCoinNewsCCN	0.42	0.7003	0.9696715661716382	-1.0
bitcoin 	Got some more good info last night. Fun dinner with friends in tech. Between # ICO and # Tesla it was quite a talk. # bitcoin # climatechange # ElectricCars	GerberKawasaki	1	0	1514647173	947125009352245253	https://twitter.com/GerberKawasaki/status/947125009352245253		# # # # #		0.20	0.3108	0.9696715661716382	-1.0
bitcoin ripple 	Crypto market cap up to $615 bil on http://coinmarketcap.com  pre “crash” levels on rally in # XRP This is getting more interesting. # bitcoin # BTC # BCH # ripple $80 bil mkt cap.	GerberKawasaki	13	2	1514589742	946884126933581825	https://twitter.com/GerberKawasaki/status/946884126933581825		# # # # #		0.35	0.2288	0.897060296344794	1.0
bitcoin 	Sold Out!: Swiss Bitcoin Wallet Bread Secures $20 Million Through Crowdsale @ thecryptovalleyhttps://buff.ly/2DBuVuR	obussmann	2	2	1514645520	947118075308015616	https://twitter.com/obussmann/status/947118075308015616			@	-0.08	0.1591	0.9696715661716382	-1.0
bitcoin 	Goldman Sachs launching trading desk for bitcoin, report says https://buff.ly/2CZTfGl pic.twitter.com/0TTsNUBR78	obussmann	7	8	1514619062	947007103021043712	https://twitter.com/obussmann/status/947007103021043712				0.30	0.0	0.9696715661716382	-1.0
bitcoin 	The Pessimists Guide to 2028, by @ business (includes bitcoin value rising to $1m)https://www.bloomberg.com/graphics/pessimists-guide-to-2018/ …	Chris_Skinner	0	1	1514641993	947103281855254529	https://twitter.com/Chris_Skinner/status/947103281855254529			@	0.07	0.1027	0.9696715661716382	-1.0
bitcoin 	Banker: Bitcoin's Value Is Zero https://futurism.com/real-price-bitcoin-according-morgan-stanley-its-zero/ … Crypto: You Don’t Understand Bitcoin Because You Think Money Is Realhttps://medium.com/@mariabustillos/you-dont-understand-bitcoin-because-you-think-money-is-real-5aef45b8e952 …	Chris_Skinner	53	29	1514636251	947079196681101312	https://twitter.com/Chris_Skinner/status/947079196681101312			@mariabustillos	0.00	0.34	0.9696715661716382	-1.0
bitcoin 	That’s a fair point. The people who invested in Ponzi got 30 cents on the dollar back. I think the writer’s point is that is that the Bitcoin whales will be fine, but the Calcutta taxi drivers putting their life savings into it will lose most of their money.	dgwbirch	0	0	1514672948	947233116829208577	https://twitter.com/dgwbirch/status/947233116829208577				0.27	-0.0557	0.9696715661716382	-1.0
bitcoin 	"""This time, it isn’t just Main Street US that is about to lose its shirt; it is the developing world""http://www.hindustantimes.com/analysis/why-bitcoin-is-the-largest-ponzi-scheme-in-human-history/story-L5z56wbz3hqxl2gIrf125H.html …"	dgwbirch	7	3	1514670142	947221349667360768	https://twitter.com/dgwbirch/status/947221349667360768				0.25	-0.4019	0.9696715661716382	-1.0
bitcoin 	The govt, for example, could not pass a law banning the use of stolen $20s at exchanges or in stores. But it could pass a law making it illegal to use stolen Bitcoins or Bitcoins from mixers.	dgwbirch	2	0	1514668990	947216514725400577	https://twitter.com/dgwbirch/status/947216514725400577				0.05	-0.6361	0.9696715661716382	-1.0
bitcoin 	If you give me any dollar bill, it doesn’t matter, they are all the same. I don’t know who had the bill before you did. Bitcoins are not all the same, each UXTO has a unique history, recorded forever on the blockchain.	dgwbirch	3	0	1514668787	947215664128897024	https://twitter.com/dgwbirch/status/947215664128897024				0.00	0.0086	0.9696715661716382	-1.0
bitcoin 	I don’t mean to be picky, but Bitcoin isn’t fungible http://www.chyp.com/fungibility-and-feasibility/ …	dgwbirch	2	1	1514666409	947205688543121408	https://twitter.com/dgwbirch/status/947205688543121408				0.00	0.0	0.9696715661716382	-1.0
bitcoin 	Bank of England plots its own bitcoin-style digital currencyhttp://flip.it/ZNy9BK	billatnapier	4	3	1514660178	947179556460548096	https://twitter.com/billatnapier/status/947179556460548096				-0.11	0.0	0.9696715661716382	-1.0
bitcoin 	Now, I’m happy to concede that cryptocurrency *might* fail , even that this whole experiment will only prove that well-regulated fiat is better. (I doubt it.) But if your argument for that is “Bitcoin is not real,” you are a fool.	mikejcasey	7	0	1514639084	947091081769967616	https://twitter.com/mikejcasey/status/947091081769967616				0.49	-0.1814	0.9696715661716382	-1.0
bitcoin 	Just discovered the writings of @ mariabustillos. (h/t @ Chris_Skinner.) She gets it. Remarkable how many people don’t.https://medium.com/@mariabustillos/you-dont-understand-bitcoin-because-you-think-money-is-real-5aef45b8e952 …	mikejcasey	21	10	1514638818	947089966634618880	https://twitter.com/mikejcasey/status/947089966634618880			@ @ @mariabustillos	0.33	0.1115	0.9696715661716382	-1.0
bitcoin 	"""In 2013, James Altucher called bitcoin “a fad, or a scam, or a ponzi scheme, or worse.” "" Oh God, how he makes me cringe.http://mashable.com/2017/12/29/bitcoin-ad-guy-bubble-cryptocurrencies/#VC.7dN9lokOy …"	mikejcasey	77	23	1514589528	946883227662381056	https://twitter.com/mikejcasey/status/946883227662381056		#VC		-0.12	-0.089	0.897060296344794	1.0
bitcoin 	From $900 to $20,000: Bitcoin's Historic 2017 Price Run Revisited - CoinDesk https://www.coindesk.com/900-20000-bitcoins-historic-2017-price-run-revisited/ …pic.twitter.com/7O8AaDajI6	SunnyStartups	2	1	1514617142	946999051735764992	https://twitter.com/SunnyStartups/status/946999051735764992				0.54	0.0	0.9696715661716382	-1.0
bitcoin 	A year in charts: From # bitcoin to Trump and chess playing # robots # AI https://www.ft.com/content/7020a6e4-e4e3-11e7-8b99-0191e45377ec?imageId=4ab88530-eb27-11e7-bd17-521324c81e23 … via @ financialtimes	SusanneChishti	11	11	1514669891	947220293990387717	https://twitter.com/SusanneChishti/status/947220293990387717		# # #	@	0.20	0.2023	0.9696715661716382	-1.0
bitcoin 	# 2017HolidayBitcoinGiveaway @ eric_lombrozo - Happy new year!	Anne_Connelly	1	0	1514596390	946912010104553472	https://twitter.com/Anne_Connelly/status/946912010104553472		#	@	0.88	0.6114	0.9696715661716382	-1.0
bitcoin 	Sure. But it's not at the price where Bitcoin is up 1300% in a year (which is the case right now).	CremeDeLaCrypto	13	0	1514655515	947159998550786048	https://twitter.com/CremeDeLaCrypto/status/947159998550786048				0.29	0.1591	0.9696715661716382	-1.0
bitcoin 	"For one, thats bad logic, nothing goes ""only up"". Nor does a price decline imply failure. Second, Those price points cover less than 2% of bitcoin's history. If you bought any other time in 98% of bitcoins history, youre up."	CremeDeLaCrypto	42	2	1514651496	947143142511321088	https://twitter.com/CremeDeLaCrypto/status/947143142511321088				0.03	-0.2632	0.9696715661716382	-1.0
bitcoin 	"Bitcoin ""failed"" because transactions took too long. Then Bitcoin ""failed"" because it couldnt support enough transactions. Now Bitcoin is ""failing"" because transactions are too expensive. Yet it hasnt failed at all."	CremeDeLaCrypto	1151	272	1514650787	947140166694473728	https://twitter.com/CremeDeLaCrypto/status/947140166694473728				0.06	0.0233	0.9696715661716382	-1.0
bitcoin 	# bitcoin $ BTC did not crash ... it is still up 300% in four months ... it corrected ... a healthy correction ... nothing goes up or down in a straight line ... maintaining $28,000 target for 2018 / Donation #700 came in today / thanks to all who assistedhttp://www.foodforthepoor.org/Moas	RonnieMoas	258	77	1514673910	947237152437321728	https://twitter.com/RonnieMoas/status/947237152437321728		# #700		0.24	0.8298	0.9696715661716382	-1.0
bitcoin 	My recent recommendations from (late) November # Cardano $ ADA now up 700% ... # StellarLumens $ XLM up 600% ... http://www.standpointresearch.com  ... top ten ranking 2008-2017 ... I will be a headline speaker and exhibiting at # bitcoinsuperconference Feb 16-18 in Dallas (Texas) $ BTC $ LTC $ ETHpic.twitter.com/KDuVUeSq00	RonnieMoas	104	17	1514589738	946884110865141760	https://twitter.com/RonnieMoas/status/946884110865141760		# # #		0.40	0.1012	0.897060296344794	1.0
bitcoin 	https://en.bitcoin.it/wiki/Controlled_supply …	lopp	5	0	1514644450	947113586387832832	https://twitter.com/lopp/status/947113586387832832				0.00	0.0	0.9696715661716382	-1.0
bitcoin 	In hindsight, perhaps, but the 2 year bear market was rough. Really glad I ended up going full-time Bitcoin a year later.	lopp	2	0	1514642173	947104037861842946	https://twitter.com/lopp/status/947104037861842946				0.05	0.2547	0.9696715661716382	-1.0
bitcoin 	Nice, you should do a PR to add a link to your list in the trading info on http://lopp.net/bitcoin.html	lopp	1	0	1514605226	946949070198902787	https://twitter.com/lopp/status/946949070198902787				0.16	0.4215	0.9696715661716382	-1.0
bitcoin 	"True, but that is not happening at all and is not affecting interchangeability today. Bitcoins are ""essentially interchangeable"", which is the definition of fungible. Is the fungibility of bitcoin at risk from overzealous regulators, potentially. # JoinTheChamber"	PerianneDC	1	0	1514669669	947219361894469633	https://twitter.com/PerianneDC/status/947219361894469633		#		0.19	-0.0117	0.9696715661716382	-1.0
bitcoin 	Bitcoins are essentially interchangeable	PerianneDC	0	0	1514667516	947210332157640714	https://twitter.com/PerianneDC/status/947210332157640714				0.00	0.0	0.9696715661716382	-1.0
bitcoin 	Bitcoin is backed by 11900+ nodes globally. Tulips are flowers that are not durable, portable or divisible. In addition to meeting all of Aristotle's characteristics of money, bitcoin is also fungible, programmable, authenticity verified & storable. We are entering a new era!https://twitter.com/HeruNekhet/status/943133103392002048 …	PerianneDC	157	51	1514664893	947199330041126913	https://twitter.com/PerianneDC/status/947199330041126913				0.19	0.0052	0.9696715661716382	-1.0
bitcoin 	Asking for my friends RV & JW. Can someone explain to me why BCash is dumping harder than # Bitcoin even though it was going to replace Bitcoin? This also means that transactions got cheaper right? Since the coin is worth a lot less (and no one uses it).	WhalePanda	363	79	1514654580	947156076830580736	https://twitter.com/WhalePanda/status/947156076830580736		#		0.10	0.1073	0.9696715661716382	-1.0
bitcoin 	https://www.reddit.com/r/Bitcoin/comments/7n1ie5/someone_destroyed_125_newly_mined_bitcoins/drya5aa/ …	WhalePanda	25	3	1514641336	947100527665524736	https://twitter.com/WhalePanda/status/947100527665524736				0.00	0.0	0.9696715661716382	-1.0
bitcoin 	More info on this # Bitcoin block with destroyed 12.5 BTC. https://www.reddit.com/r/Bitcoin/comments/7n1ie5/someone_destroyed_125_newly_mined_bitcoins/ … Also this means that we will never have 21 million Bitcoin ;)pic.twitter.com/MeK5wnchVq	WhalePanda	138	42	1514641057	947099355223339008	https://twitter.com/WhalePanda/status/947099355223339008		#		0.12	-0.3634	0.9696715661716382	-1.0
bitcoin 	Coinbase reward is the basic reward a miner gets for mining a valid Bitcoin block. Currently that's 12.5 btc. It has nothing to do with the company Coinbase.	WhalePanda	25	0	1514640550	947097230321778688	https://twitter.com/WhalePanda/status/947097230321778688				0.11	0.2235	0.9696715661716382	-1.0
bitcoin 	Some miners believe so much in # Bitcoin that they don't even care about the block rewards and just destroy them. Valid block, with a destroyed coinbase reward. https://btc.com/0000000000000000004b27f9ee7ba33d6f048f684aaeb0eea4befd80f1701126 … Made @ blockchain's block explorer crash.pic.twitter.com/XufvATIQ44	WhalePanda	242	105	1514640247	947095959699324929	https://twitter.com/WhalePanda/status/947095959699324929		#	@	0.00	-0.4975	0.9696715661716382	-1.0
bitcoin ripple 	If you're going to include locked coins from Ripple, you also need to include non-mined coins from Bitcoin.	WhalePanda	34	2	1514638097	947086941551579136	https://twitter.com/WhalePanda/status/947086941551579136				-0.11	0.0	0.9696715661716382	-1.0
bitcoin ripple 	If you count the full supply of Ripple, you should also count 21M coins for Bitcoin. Also Ripple is a centralized scam :P	WhalePanda	80	16	1514634224	947070696403931137	https://twitter.com/WhalePanda/status/947070696403931137				0.13	-0.1211	0.9696715661716382	-1.0
bitcoin 	7/ sometimes the best math is the simplest (or you don’t even need math!) Does this coin have a functioning network? No? Then for the love of god don’t buy it. Doesn’t matter if it’s “only” 10% as much as a bitcoin.	AriannaSimpson	45	4	1514649684	947135539605581826	https://twitter.com/AriannaSimpson/status/947135539605581826				0.57	0.2285	0.9696715661716382	-1.0
bitcoin 	5/ if you can’t explain why a new cryptoasset is fundamentally better than bitcoin, don’t buy it. “It’s cheaper” doesn’t count.	AriannaSimpson	32	4	1514649683	947135535730102272	https://twitter.com/AriannaSimpson/status/947135535730102272				0.00	0.2202	0.9696715661716382	-1.0
bitcoin 	1/ Bitcoin appears, once again, to be falling out of vogue. Let’s recall the same thing happened earlier this year, largely due to ETH’s meteoric rise.	AriannaSimpson	87	19	1514649681	947135526452293636	https://twitter.com/AriannaSimpson/status/947135526452293636				-0.15	-0.0766	0.9696715661716382	-1.0
bitcoin 	Probably means it’s a good time to buy bitcoin...https://twitter.com/montspencer/status/947128243819180032 …	AriannaSimpson	62	3	1514648150	947129108152057856	https://twitter.com/AriannaSimpson/status/947129108152057856				0.22	0.4404	0.9696715661716382	-1.0
