currency	tweet	username	favorites	retweets	date	id	permalink	geo	hashtags	mentions	lex_sent	vader_sent	cnn_sent	cnn_pos_neg
bitcoin 	So fiat would need to travel into and out of Bitcoin at a rate of $6bn per hour, so north of $50 trillion/year of volume traded (vs a fraction of that today) and you’re concerned about what, exactly? (I’m not saying I agree with your logic train, but let’s play along).	VinnyLingham	7	1	1529879502	1011014025499508737	https://twitter.com/VinnyLingham/status/1011014025499508737				-0.06	0.1852	0.9670943	-1.0
bitcoin 	Ironic that you bring this up. If Bitcoin's consensus mechanism is PoW (as defined in the Bitecoim White Paper) and hashrate chose Bitcoin over all other invalid forks including Bitcoin Cash, this means that Bitcoin Cash is NOT Bitcoin. You can't have the cake and eat it too!	SatoshiLite	6	1	1529920681	1011186744681644032	https://twitter.com/SatoshiLite/status/1011186744681644032				0.10	-0.0427	0.9711628	1.0
bitcoin litecoin ethereum 	The problem here is this: With on-chain Bitcoin, Litecoin, Ethereum etc. if you sign and broadcast a transaction to the network (assuming you have internet access), it's going to make it into a block and confirm. It may be slow or cost a bunch in fees, but it'll go through.	ummjackson	7	0	1529955617	1011333274780594177	https://twitter.com/ummjackson/status/1011333274780594177				0.20	-0.2808	0.9722386	1.0
bitcoin ethereum 	You have a more than 1,000 large Bitcoin and Ethereum token holders and developers moving there. Lots of investment and job creation. Watch the CNBC Puertopia documentary. @ cryptomanran	brockpierce	4	0	1529905192	1011121779421728768	https://twitter.com/brockpierce/status/1011121779421728768			@	0.28	0.0683	0.97043544	1.0
bitcoin 	Agreed it's important to identify & address areas of concern, and Bitcoin mining centralization certainly falls in that category.	TuurDemeester	2	0	1529955786	1011333987510439937	https://twitter.com/TuurDemeester/status/1011333987510439937				0.26	0.6486	0.96487015	1.0
bitcoin 	How many lines of code in the Bitcoin client have Chinese mining pools changed so far? I'd say zero.	TuurDemeester	0	0	1529954537	1011328745968455681	https://twitter.com/TuurDemeester/status/1011328745968455681				0.05	0.0	0.97290254	-1.0
bitcoin 	Naked represents transparency. Marco Robinson changing way business is done, a Win/Win for ICO's! For only 5 BTC you fund the building of a new home taking a family off the street & get listed on http://Naked.Market  including his Bitcoin ATM+peer to peer lending # WBSFrankfurtpic.twitter.com/KEFqpS6DxT	NetworksManager	59	30	1529947906	1011300934243307520	https://twitter.com/NetworksManager/status/1011300934243307520		#		0.43	0.0	0.9701937	-1.0
bitcoin 	Satoshi created Bitcoin but David Schwartz, he’s replacing the world’s siloed financial infrastructure.	haydentiff	139	22	1529902766	1011111603792678912	https://twitter.com/haydentiff/status/1011111603792678912				0.15	0.128	0.9794502	-1.0
bitcoin 	Not to mention his contributions to Bitcoin!https://twitter.com/haydentiff/status/886805493490036740?s=21 …	haydentiff	12	4	1529898167	1011092315652358144	https://twitter.com/haydentiff/status/1011092315652358144				-0.14	0.0	0.9714531	1.0
bitcoin 	Interviewing one of the greatest brains in # bitcoin ⁦ @ AmirPolyteknik⁩pic.twitter.com/I4QMvLcZrx	stacyherbert	64	15	1529918845	1011179042643611649	https://twitter.com/stacyherbert/status/1011179042643611649		#	@	0.33	0.6369	0.96985	1.0
bitcoin 	Bitcoin to $5000 By End of Summer, Suggests Chief Traderhttp://bitcoinist.com/bitcoin-to-5000-by-end-of-summer-suggests-chief-trader/ …	thomaspower	0	1	1529956926	1011338766378766337	https://twitter.com/thomaspower/status/1011338766378766337				0.10	0.0	0.9668026	-1.0
bitcoin 	Bitcoin Price Eyes Comeback as 250 Million New Tethers Enter Circulation https://www.ccn.com/bitcoin-price-eyes-comeback-as-250-million-new-tethers-enter-circulation/ … via @ cryptocoinsnews	thomaspower	1	2	1529951703	1011316862234316800	https://twitter.com/thomaspower/status/1011316862234316800			@	0.27	0.0	0.9764347	-1.0
bitcoin 	Coinbase: Over 100 Pages of SEC Complaints Reveal Fraud Allegationshttp://bitcoinist.com/coinbase-sec-complaints-fraud-allegations/ …	thomaspower	1	1	1529951696	1011316832215666690	https://twitter.com/thomaspower/status/1011316832215666690				0.00	-0.7579	0.9732347	-1.0
bitcoin 	Abandoned Intel Manufacturing Complex Bought for $13M to Mine Bitcoin https://news.bitcoin.com/abandoned-intel-manufacturing-complex-bought-for-13m-to-mine-bitcoin/ … via @ BTCTN	thomaspower	2	0	1529944368	1011286095219318785	https://twitter.com/thomaspower/status/1011286095219318785			@	0.14	-0.4588	0.9759058	1.0
bitcoin 	Bitmain’s Mining Pools Now Control Nearly 51 Percent of the Bitcoin Hashrate https://www.ccn.com/bitmains-mining-pools-now-control-nearly-51-percent-of-the-bitcoin-hashrate/ … via @ cryptocoinsnews	thomaspower	4	3	1529944358	1011286053175603200	https://twitter.com/thomaspower/status/1011286053175603200			@	0.06	0.0	0.9766708	-1.0
bitcoin 	China Ranks EOS as the #1 Blockchain, Bitcoin Doesn’t Make Top Ten https://www.ccn.com/china-ranks-eos-as-the-1-blockchain-bitcoin-doesnt-make-top-ten/ … via @ cryptocoinsnews	thomaspower	0	0	1529930316	1011227158260473856	https://twitter.com/thomaspower/status/1011227158260473856		#1	@	0.19	0.2023	0.9750851	-1.0
bitcoin 	South Korea to Invest $230M in Blockchain Technology Developmenthttps://bitcoinist.com/south-korea-230b-invest-blockchain/ …	thomaspower	2	1	1529921046	1011188276152143872	https://twitter.com/thomaspower/status/1011188276152143872				0.33	0.0	0.9703015	-1.0
bitcoin 	$1 billion in lost Mt. Gox Bitcoins will be returned to victims http://fortune.com/2018/06/22/bitcoin-price-mt-gox-trustee/?utm_source=twitter.com#e20d2c4f-9d74-4328-8132-72bebe72c3aa&utm_medium=social&utm_campaign=social-button-sharing … via @ FortuneMagazine	thomaspower	2	0	1529920974	1011187972593606656	https://twitter.com/thomaspower/status/1011187972593606656		#e20d2c4f	@	-0.19	-0.3182	0.9647186	1.0
bitcoin ethereum 	Is Bitcoin, Ethereum and crypto dead? Dump or ride? - @ BankToTheFuture Bloghttp://blog.bnktothefuture.com/bitcoin-ethereum-crypto-dead-dump-ride/ …	SimonDixonTwitt	32	11	1529926855	1011212641933692928	https://twitter.com/SimonDixonTwitt/status/1011212641933692928			@	0.38	-0.3435	0.9579601	1.0
bitcoin ethereum 	Is Bitcoin, Ethereum and crypto dead? Dump or ride? With @ SimonDixonTwitt https://youtu.be/Mu_A9jZVl3k  via @ YouTube	SimonDixonTwitt	58	11	1529925414	1011206597522153472	https://twitter.com/SimonDixonTwitt/status/1011206597522153472			@ @	0.31	-0.3435	0.96403253	1.0
bitcoin 	Excellent writeup on that mysterious hash. Is it Satoshi's ghost, sending us a signal from the future? Or the end result of brilliant minds in a bear market, hoping to see a sign from God to reaffirm their hodl?https://cointelegraph.com/news/what-is-that-mysterious-about-the-bitcoin-block-hash-21e800/amp?__twitter_impression=true …	el33th4xor	91	36	1529961933	1011359769096007680	https://twitter.com/el33th4xor/status/1011359769096007680				0.31	0.2702	0.972121	1.0
bitcoin 	Today I’m speaking on # crypto # bitcoin and your clients at the ETF Global indexing Conference in Dana point. 3:40 PM pst. Come check it out and say hi. Robert Plant to bitcoin finance in 24 hours. Mi vida loca. @ ReformedBroker @ ritholtzpic.twitter.com/K017mEldlp	GerberKawasaki	9	0	1529933315	1011239733844824064	https://twitter.com/GerberKawasaki/status/1011239733844824064		# #	@ @	0.11	0.0	0.97072226	-1.0
bitcoin 	One outcome of a bear market for bitcoin: Chinese miners driven to stealing electricity in a bid to maintain profit margins.http://bit.ly/2MSTfhj	mikejcasey	14	8	1529888973	1011053750117691397	https://twitter.com/mikejcasey/status/1011053750117691397				0.05	-0.2023	0.95947087	-1.0
bitcoin 	"Comisión de Valores de España dice que la ""guerra"" a las cripto no puede hacerla un país solo https://www.diariobitcoin.com/index.php/2018/06/23/comision-de-valores-de-espana-dice-que-la-guerra-a-las-cripto-no-puede-hacerla-un-pais-solo/ … via @ diariobitcoin"	bitentrepreneur	3	0	1529950628	1011312352287916035	https://twitter.com/bitentrepreneur/status/1011312352287916035			@	-0.05	-0.296	0.9726855	1.0
bitcoin 	# Blockchain Expert Eddy Travia Says # ICOs Will Raise $10 Billion+ in 2018 at # CoinAgenda:https://bitcoinexchangeguide.com/blockchain-expert-eddy-travia-says-icos-will-raise-10-billion-in-2018-at-coinagenda/ …	michaelterpin	12	10	1529943486	1011282395104858112	https://twitter.com/michaelterpin/status/1011282395104858112		# # #		0.24	0.0	0.96068037	-1.0
bitcoin 	amped to see what these guys can do :) SpringRolehttps://thebitcoinnews.com/springrole-advisor-toni-lane-ranked-as-top-blockchain-influencer/ …	tonilanec	8	2	1529919499	1011181787245154304	https://twitter.com/tonilanec/status/1011181787245154304				0.20	0.4588	0.9646863	-1.0
bitcoin 	What kind of $ DIG # diapers are you wearing? # Huggies # Luvs # Depends # Pampers ... # rockandroll # shakeandbake # crypto ... # bitcoin # blockchain $ BTC # Dignity	RonnieMoas	26	11	1529926083	1011209400646656000	https://twitter.com/RonnieMoas/status/1011209400646656000		# # # # # # # # # # #		0.44	0.2009	0.9758093	-1.0
bitcoin 	"2/ # Bitcoin and other coins that are on the ""path to full immunity and decentralization"" don't inherently mistrust specific people, rather its the idea of not having to trust any few at all."	CharlieShrem	11	2	1529935420	1011248563735625728	https://twitter.com/CharlieShrem/status/1011248563735625728		#		0.03	-0.4023	0.9763847	1.0
bitcoin ethereum 	2-3 since Satoshi was still around and almost no one even heard about cryptocurrencies back then. But Ethereum has been around longer than Bitcoin was in 2010 and the entire space is magnitudes bigger now.	WhalePanda	4	0	1529928739	1011220543868108800	https://twitter.com/WhalePanda/status/1011220543868108800				0.11	-0.114	0.97169995	-1.0
bitcoin ripple 	On what scale? If Bitcoin is 10, then ETH is like 4, EOS and Ripple are 1.	WhalePanda	9	1	1529927183	1011214014674808834	https://twitter.com/WhalePanda/status/1011214014674808834				0.18	0.1806	0.9630382	1.0
bitcoin 	Check out my interview w/ @ MichellePWGnews on their @ PortfolioGlobal Channel. We were able to cover $ BTCUSD price moves & all the # economics sorounding # Bitcoin # Altcoins & # ICOshttps://youtu.be/C7_9W9Il5kE	ToneVays	54	13	1529959232	1011348439467282435	https://twitter.com/ToneVays/status/1011348439467282435		# # # #	@ @	0.44	0.0	0.97620654	-1.0
bitcoin ethereum 	If you are near New Haven # Connecticut, come out to this amazing @ Meetup where I will be doing LIVE $ BTCUSD charting along with doing all kinds of Q&A on # Bitcoin, # Altcoins & # ICO's... please RSVP here: https://www.meetup.com/Bitcoin-Ethereum-and-Blockchain-Technology/events/251425018/ …pic.twitter.com/sVD4VKBF3t	ToneVays	50	13	1529950750	1011312865108807683	https://twitter.com/ToneVays/status/1011312865108807683		# # # #	@	0.40	0.7783	0.9620213	1.0
bitcoin 	# Bitcoin Brief w/ @ LeahWald @ giacomozucco & @ jimmysong to talk BLS Signatures vs # schnorr, # BCash Stress Testing & latest on # Lightning. Also how soon will $ BTCUSD reach $4,975?https://www.youtube.com/watch?v=nakW9E98y1U …	ToneVays	117	24	1529939375	1011265152690409474	https://twitter.com/ToneVays/status/1011265152690409474		# # # #	@ @ @	0.34	-0.1319	0.9592813	1.0
