currency	tweet	username	favorites	retweets	date	id	permalink	geo	hashtags	mentions	lex_sent	vader_sent	cnn_sent	cnn_pos_neg
bitcoin 	Market cap of # MaxCoin will pass BitcoinCash in...	maxkeiser	49	29	1524070550	986649517318725632	https://twitter.com/maxkeiser/status/986649517318725632		#		0.44	0.0	0.970089	-1.0
bitcoin 	Dear @ reddit, I heard that as of recently you were not a profitable company. I'll pay you $100,000 USD if you simply appoint a moderator to /r/Bitcoin who supports free speech. https://www.youtube.com/watch?v=0Fe6HbNdbrA&feature=youtu.be&t=995 … CC: @ alexisohanian @ wtfspez @ brian_armstronghttps://medium.com/@johnblocke/a-brief-and-incomplete-history-of-censorship-in-r-bitcoin-c85a290fe43 …	rogerkver	1020	275	1524063964	986621892684492800	https://twitter.com/rogerkver/status/986621892684492800			@ @ @ @ @johnblocke	-0.20	0.2366	0.9730578	-1.0
bitcoin 	Bitcoin Q&A: Mixing serviceshttps://youtu.be/rKoMvOH4zoY	aantonop	125	67	1524088386	986724327168053254	https://twitter.com/aantonop/status/986724327168053254				0.00	0.0	0.97904885	1.0
bitcoin 	No, bitcoin is the next bitcoin.	aantonop	2	0	1524026595	986465155939741696	https://twitter.com/aantonop/status/986465155939741696				0.17	-0.296	0.9816156	-1.0
bitcoin 	Interesting the parallel with technological revolutions. The printing press unbundled the quasi monopoly of monastic scribes, just like how the internet and Bitcoin are likely unbundling political quasi monopolies in media and banking.	TuurDemeester	13	1	1524081272	986694487454945282	https://twitter.com/TuurDemeester/status/986694487454945282				0.21	0.3816	0.99490756	-1.0
bitcoin 	"Hyperbitcoinization is defined as ""Bitcoin induced demonetization"", i.e. an economy where Bitcoin has supplanted the national currency as store of value, medium of exchange, and unit of account."	TuurDemeester	82	15	1524080619	986691749509783553	https://twitter.com/TuurDemeester/status/986691749509783553				0.25	0.17	0.98497415	1.0
bitcoin 	When considered for countries with unhinged monetary realities like Venezuela, the supposed absurdity of hyperbitcoinization becomes a lot less obvious.https://twitter.com/crypto/status/986667120321802253 …	TuurDemeester	124	34	1524080356	986690645103464449	https://twitter.com/TuurDemeester/status/986690645103464449				-0.15	0.1806	0.97169995	-1.0
bitcoin 	You can now send an on-chain Bitcoin transaction that'll confirm within 24 hours for 1sat/byte, or about $0.03. src: http://estimatefee.com pic.twitter.com/yrP5dNBEdi	TuurDemeester	253	92	1524055142	986584889137954816	https://twitter.com/TuurDemeester/status/986584889137954816				0.05	0.0	0.9627906	-1.0
bitcoin 	https://twitter.com/Bitcoin/status/983621319957798912 …	TuurDemeester	213	18	1524026638	986465335778906112	https://twitter.com/TuurDemeester/status/986465335778906112				0.00	0.0	0.9683954	-1.0
bitcoin 	# BitcoinCash is leading # crypto higher after # TaxDay # Bitcoin cash gained more than 10% Weds, outpacing most other major cryptocurrencies after the IRS extended the deadline for paying US income tax after a computer glitch Tuesday http://markets.businessinsider.com/news/stocks/bitcoin-cash-price-leading-crypto-higher-after-tax-day-2018-4-1021504387 …pic.twitter.com/KLhOvOP4rk	NetworksManager	8	4	1524074417	986665734314102785	https://twitter.com/NetworksManager/status/986665734314102785		# # # #		0.17	0.3818	0.97011	-1.0
bitcoin litecoin ethereum ripple 	BTC at $8k as $52bn UK firm takes on # blockchain trading # Bitcoin recovered from overnight fall to gain over $200 on day so far, and return to above $8,000. Ethereum is up to $515, # BitcoinCash killin it as # Litecoin & # GlobalBoost hold yesterdays gains.https://www.express.co.uk/finance/city/947718/Bitcoin-price-asset-manager-ripple-cryptocurrency-ethereum-BTC-to-USD-XRP-news …	NetworksManager	8	6	1524063376	986619425821511680	https://twitter.com/NetworksManager/status/986619425821511680		# # # # #		0.04	0.2889	0.95965266	-1.0
bitcoin 	Crypto mining remains a lucrative sector that attracts companies’ investments When # cryptocurrencies boomed in recent years, companies have started to venture into crypto mining to get a larger share of pie. # Bitcoin # Blockchain http://www.ibtimes.com.au/crypto-mining-remains-lucrative-sector-attracts-companies-investments-1567374 …pic.twitter.com/vk9Hi4pXDH	NetworksManager	3	1	1524061997	986613642765488128	https://twitter.com/NetworksManager/status/986613642765488128		# # #		0.05	0.2997	0.9650171	-1.0
bitcoin 	Easily enter the # cryptocurrency space with # GlobalBoost $ BSTY - the only patriot # blockchain! Here's three proven ways to get some today with your PC, # Android phone, or # Bitcoin http://emmegirls.tumblr.com/tagged/bsty pic.twitter.com/3yJk0sUoiM	NetworksManager	11	9	1524055517	986586462211764224	https://twitter.com/NetworksManager/status/986586462211764224		# # # # #		0.20	0.2001	0.95046294	-1.0
bitcoin 	Amazon Sees Bitcoin Use Case in Data Marketplaces - The e-commerce giant describes how merchants and law enforcement could make a # bitcoin transaction stream more valuable by splicing it with other data. # Blockchain -https://www.coindesk.com/amazon-sees-bitcoin-use-case-data-marketplaces/ …	NetworksManager	3	1	1524040275	986522536220520448	https://twitter.com/NetworksManager/status/986522536220520448		# #		0.14	0.312	0.97856826	-1.0
bitcoin 	Crypto Rider lets you ride the thrilling roller coaster of # cryptocurrency prices # Blockchain # Bitcoin https://www.androidpolice.com/2018/04/17/crypto-rider-lets-ride-thrilling-roller-coaster-cryptocurrency-prices/ …pic.twitter.com/pRtbzjiKgO	NetworksManager	4	0	1524022457	986447798274011136	https://twitter.com/NetworksManager/status/986447798274011136		# # #		0.17	0.4767	0.9692255	1.0
bitcoin 	Local network. Go to meetups. Some cities have Bitcoin ATMs. There is also @ LocalBitcoins.	haydentiff	2	0	1524074054	986664213392363520	https://twitter.com/haydentiff/status/986664213392363520			@	0.27	0.0	0.9829216	-1.0
bitcoin 	1 Bitcoin today is still worth 1 Bitcoin tomorrow. It has no counterparty risk, unlike bank IOUs.	haydentiff	2	0	1524020864	986441119763443712	https://twitter.com/haydentiff/status/986441119763443712				0.18	-0.1422	0.96445835	-1.0
bitcoin 	“I hate gold. Gold is a religion.” — Mark Cubanhttps://steemit.com/bitcoin/@dollarvigilante/luckbox-mark-cuban-hates-bitcoin-and-gold-the-two-best-performing-assets-this-millennia …	DollarVigilante	11	4	1524077100	986676991444348928	https://twitter.com/DollarVigilante/status/986676991444348928			@dollarvigilante	0.20	-0.2859	0.9652856	-1.0
bitcoin 	Watch Luke and I report from Zimbabwe to find out the facts.https://dollarvigilante.com/blog/2018/04/14/a-cashless-society-where-bitcoin-trades-at-50-100-premium-video.html …	DollarVigilante	13	5	1524015900	986420297216638976	https://twitter.com/DollarVigilante/status/986420297216638976				0.17	0.0	0.9677875	-1.0
bitcoin 	“I think the fact that within the bitcoin universe an algorithm replaces the functions of [the government]… is actually pretty cool” @ algore 12 # Bitcoin and # Blockchain # Thoughts and # Quotes You Need to Read https://www.intelligenthq.com/finance/12-bitcoin-and-blockchain-thoughts-and-quotes-you-need-to-read/ … via @ intelligenthqpic.twitter.com/lsmGJdDIWA	dinisguarda	12	16	1524075903	986671968282914820	https://twitter.com/dinisguarda/status/986671968282914820		# # # #	@ @	0.24	0.4939	0.9692848	-1.0
bitcoin 	12 # Bitcoin and # Blockchain # Thoughts and # Quotes You Need to Read https://www.intelligenthq.com/finance/12-bitcoin-and-blockchain-thoughts-and-quotes-you-need-to-read/ … via @ intelligenthq	dinisguarda	1	2	1524075067	986668462729781249	https://twitter.com/dinisguarda/status/986668462729781249		# # # #	@	0.21	0.0	0.96539956	-1.0
bitcoin 	The latest The dinis guarda Daily! https://paper.li/dinisguarda?edition_id=49e3ad50-4307-11e8-99ed-0cc47a0d1605 … Thanks to @ MurfAD @ jamiescottsmith # marketing # bitcoin	dinisguarda	1	1	1524055925	986588175513669632	https://twitter.com/dinisguarda/status/986588175513669632		# #	@ @	0.18	0.2202	0.95681655	-1.0
bitcoin 	ChappuisHalder is launching a study on # CryptoInvestors Wondering who are they? How does your profile fit with their? Please contribute to the study by answering a few questions! # crypto # fintech # bitcoin http://surveymonkey.com/r/Q2LK8FM	sbmeunier	0	0	1524070193	986648020237287424	https://twitter.com/sbmeunier/status/986648020237287424		# # # #		0.08	0.1854	0.97647446	1.0
bitcoin 	in today's Leaders Series, meet @ AliShadle who runs Ops at @ ChiaNetworkInc. she talks about getting into # bitcoin by building mining rigs, and why distribution of network capacity via more efficient mining is critical to crypto adoption.https://medium.com/the-future-collective/leaders-series-ali-shadle-at-chia-network-678cc2d24ba1 …	Melt_Dem	20	7	1524048548	986557233038348289	https://twitter.com/Melt_Dem/status/986557233038348289		#	@ @	0.18	0.0669	0.9732857	1.0
bitcoin 	It’s not a Currency, it’s a token. I think they will all be traded against Bitcoin as the Currency.I think having every asset tradable against Bitcoin rather than USD or EUR or JPY is a very worthy goal and removes the world’s dependency on the US government. Tokens enable that.	SimonDixonTwitt	1	0	1524047931	986554647769788422	https://twitter.com/SimonDixonTwitt/status/986554647769788422				0.22	0.23	0.96204203	-1.0
bitcoin 	I had a blast discussing Bitcoin and cryptocurrencies with social scientists and economists on @ ScholarsCircle. Worth checking out if you're into that sort of thing.https://twitter.com/dgolumbia/status/986656062257410049 …	el33th4xor	25	7	1524074398	986665654592987136	https://twitter.com/el33th4xor/status/986665654592987136			@	-0.12	0.0754	0.95549446	-1.0
bitcoin 	Coinbase And Bitfinex Integrate Bitcoin Scaling Upgrade SegWit https://buff.ly/2GKPK8t pic.twitter.com/6J7FfiFmWX	obussmann	2	1	1524025103	986458897262305280	https://twitter.com/obussmann/status/986458897262305280				0.22	0.0	0.9731352	1.0
bitcoin 	“Bitcoin is going to hit $250,000 in 2022 because there are millions of people around the world without a stable currency.” Legal disclaimer: I am repeating these comments for entertainment purposes only and they are not investment advice or solicitation to purchase.pic.twitter.com/bL9o46RNzE	dgwbirch	25	8	1524074103	986664418497904640	https://twitter.com/dgwbirch/status/986664418497904640				0.19	0.1386	0.9741131	1.0
bitcoin 	Catch us today in Dublin! Free # BitcoinCash for all!https://twitter.com/btccom_official/status/986282035487571968 …	bitentrepreneur	3	0	1524033436	986493850087755776	https://twitter.com/bitentrepreneur/status/986493850087755776		#		0.10	0.1854	0.97448266	1.0
bitcoin 	Wrote this on @ RBAdvisors saying crypto=candy crush coins. My 2c: Difference is cryptos like Bitcoin aren't created by a company but by a network with no central point of failure, capable of transferring money without a third party.. don't think you can do that w candy crush https://twitter.com/crypto/status/986630541721161729 …	CamiRusso	10	4	1524069659	986645779740807169	https://twitter.com/CamiRusso/status/986645779740807169			@	0.06	-0.4047	0.96626705	1.0
bitcoin 	Bitcoin whales dump $100 million of digital currency in 24 hourshttps://www.marketwatch.com/story/bitcoin-whales-dump-100-million-of-digital-currency-in-24-hours-2018-04-17 …	robdgill	0	0	1524033271	986493158895816704	https://twitter.com/robdgill/status/986493158895816704				0.00	-0.3818	0.99121463	-1.0
bitcoin 	‘Cryptocurrencies could transform the way we save, invest, and pay our bills’ says IMF boss Christine Lagarde in her blog post. # bitcoinhttps://blogs.imf.org/2018/04/16/an-even-handed-approach-to-crypto-assets/ …	DeanDemellweek	1	1	1524053159	986576572101677056	https://twitter.com/DeanDemellweek/status/986576572101677056		#		0.04	0.2107	0.9533286	1.0
bitcoin 	What do the # psychic fortune teller # technical # analysts have to say about the # bitcoin chart now? I see the letter L five times in this 12-hour $ BTC chart ... once right side up ... twice upside down ... & twice inside out. I call this the 'two eggs over easy' L-L-L-L-L patternpic.twitter.com/E3XYxxpd94	RonnieMoas	49	4	1524069941	986646963847393280	https://twitter.com/RonnieMoas/status/986646963847393280		# # # #		0.28	0.1468	0.96780384	1.0
bitcoin 	# bitcoincash $ BCH up 10% in the last twelve hours # crypto # blockchain # cryptocurrency	RonnieMoas	13	1	1524069491	986645073252225025	https://twitter.com/RonnieMoas/status/986645073252225025		# # # #		0.35	0.0	0.9688389	-1.0
bitcoin 	If you are not diversified in # altcoins you are under-performing during this rally. Many alts up 40%-60% off their lows versus # bitcoin at just 20%. Sign up at http://www.standpointresearch.com  for my top ten names. Daily Notes and dozens of # stock # crypto recommendations annually.pic.twitter.com/if5vZ6qebw	RonnieMoas	32	10	1524058615	986599456077426688	https://twitter.com/RonnieMoas/status/986599456077426688		# # # #		0.23	0.0	0.9895465	1.0
bitcoin 	I nominate myself; I have a strong track record of hands-off moderation of /r/bitcoinxt. My non-moderation is so strong that I even removed myself from power!	lopp	503	11	1524064204	986622897799286785	https://twitter.com/lopp/status/986622897799286785				0.19	0.5923	0.95494395	1.0
bitcoin 	Fun fact, In 1999, Nobel Prize winner Milton Friedman predicted the rise of Bitcoin. In an interview with NTU/F, Friedman suggested a future system that would allow “A method where buying on the Internet you can transfer funds from A to B, without A knowing B or B knowing A.”	CharlieShrem	1478	453	1524034617	986498803044962304	https://twitter.com/CharlieShrem/status/986498803044962304				0.02	0.5562	0.9574227	-1.0
bitcoin 	Offering a bribe to attempt to buy yet another subreddit after he bought and commercialized /r/btc (against reddit TOS). He now uses /r/btc to attempt to defraud new users by trying to get them to buy BCash which he claims is Bitcoin. (Equivalent of trying to sell Pyrite as gold)pic.twitter.com/0mFdgbYxab	WhalePanda	1090	356	1524066548	986632729486905344	https://twitter.com/WhalePanda/status/986632729486905344				0.06	-0.0674	0.9722062	-1.0
bitcoin 	Then why doesnt he give away his all his wealthy and why is he committing fraud by calling bcash bitcoin? He couldnt care any less about the unbanked.	WhalePanda	1	0	1524063584	986620298735824896	https://twitter.com/WhalePanda/status/986620298735824896				0.18	-0.3187	0.9715244	1.0
bitcoin 	Good old # Bitcoin.pic.twitter.com/lje5UrGXVG	WhalePanda	591	125	1524034965	986500262062936064	https://twitter.com/WhalePanda/status/986500262062936064		#		1.25	0.4404	0.9928929	-1.0
bitcoin 	While the # BitLicense may have legitimized # Bitcoin in some professionals’ eyes, that benefit was not worth the cost of # crypto startups fleeing the state.	cburniske	161	29	1524086069	986714608084844546	https://twitter.com/cburniske/status/986714608084844546		# # #		0.11	0.3257	0.9690823	1.0
bitcoin 	LIVE, NOW - Trading # Bitcoin w/ Q&A Hosted by @LeahWald1, there is now a little tiny green seed for the Bulls to cling to, let's talk about with the $ BTCUSD Chartshttps://www.youtube.com/watch?v=RWtnQKEcP8s …	ToneVays	55	10	1524081656	986696097941700609	https://twitter.com/ToneVays/status/986696097941700609		#	@LeahWald1	0.27	0.0	0.97056365	-1.0
bitcoin 	I meant that as arguing over Stupid Pie charts designed to make Bitcoin look bad as it's only purpose with missleading stats.	ToneVays	0	0	1524080481	986691169219362816	https://twitter.com/ToneVays/status/986691169219362816				-0.23	-0.872	0.9666595	-1.0
bitcoin 	A. That statistic is dumb cause 95% of address have dust in them. B. When an address has cold storage for 1000s of customers is it still one address? C. # Bitcoin is the most spread out and decentralized token by factors of 1000+	ToneVays	0	0	1524075885	986671894723047424	https://twitter.com/ToneVays/status/986671894723047424		#		0.27	-0.1021	0.95650333	-1.0
bitcoin 	Sorry guys but was not able to make a $ BTCUSD video this AM, will land in # Toronto in a few hours so hit me up. Will speak at a # Bitcoin conf + my workshop & meetup.	ToneVays	85	4	1524063149	986618475975192576	https://twitter.com/ToneVays/status/986618475975192576		# #		0.26	-0.0193	0.95596	-1.0
bitcoin 	LIVE NOW for a short Trading # Bitcoin before I head of to Toronto & Miami events. Let's see how this daily $ BTCUSD 9 is shaping out. A 1-4 day Correction or something bigger?https://www.youtube.com/watch?v=Zf4C07yoxu0 …	ToneVays	47	9	1524013397	986409800929042432	https://twitter.com/ToneVays/status/986409800929042432		#		0.23	0.0	0.9756505	-1.0
