currency	tweet	username	favorites	retweets	date	id	permalink	geo	hashtags	mentions	lex_sent	vader_sent	cnn_sent	cnn_pos_neg
bitcoin 	GOTBITCOIN?https://twitter.com/nbcnews/status/982234149812502528 …	maxkeiser	6	2	1523034501	982304011725561856	https://twitter.com/maxkeiser/status/982304011725561856				0.00	0.0	0.9725228	-1.0
bitcoin 	World’s getting more economically precarious. Trump’s near record high popularity ratings are fueling his trade war Jimmy. # Bitcoin will see new ATH’s as a result. (Don’t ask me what a ‘Jimmy’ is, I just thought it sounded cool).pic.twitter.com/qvWSx2QBQG	maxkeiser	102	27	1522982449	982085691411763200	https://twitter.com/maxkeiser/status/982085691411763200		#		0.33	-0.0506	0.96702707	1.0
bitcoin 	GotBitcoin?pic.twitter.com/7WH8KuSfVW	maxkeiser	175	55	1522981908	982083422834319360	https://twitter.com/maxkeiser/status/982083422834319360				0.00	0.0	0.9631724	1.0
bitcoin 	Will probably be opt-in. If Bitcoin never gets CT, then it will break from Bitcoin.	SatoshiLite	6	0	1523043406	982341362744836096	https://twitter.com/SatoshiLite/status/982341362744836096				0.27	0.0	0.97631705	-1.0
bitcoin 	Bitcoin Q&A: Using paper walletshttps://youtu.be/cKehFazo8Pw	aantonop	173	100	1523048515	982362789435101185	https://twitter.com/aantonop/status/982362789435101185				0.00	0.0	0.9741339	1.0
bitcoin 	My first book (Mastering Bitcoin by O'Reilly Media) was on github. It's available under creative commons. This is the third one done this way. Wouldn't do it any other way! Let the milestone burndown commence!	aantonop	46	1	1523045415	982349787814137857	https://twitter.com/aantonop/status/982349787814137857				0.26	0.0881	0.98932904	-1.0
bitcoin 	Japan's Monex to buy Coincheck for $34 million, eyes future IPO https://reut.rs/2GF2zlb # bitcoin # blockchain # crypto	ErikVoorhees	229	106	1523024126	982260496383459328	https://twitter.com/ErikVoorhees/status/982260496383459328		# # #		0.11	0.0	0.9729963	1.0
bitcoin 	SEC Quietly Puts Bitcoin ETF Proposals Back on the Table https://www.ccn.com/sec-quietly-puts-bitcoin-etf-proposals-back-on-the-table/ … via @ cryptocoinsnews	ErikVoorhees	549	251	1523016262	982227513224015873	https://twitter.com/ErikVoorhees/status/982227513224015873			@	0.00	0.0	0.9674488	-1.0
bitcoin 	"In other words, the claim that Gregory Maxwell is a ""latecomer"" to Bitcoin is provably false.https://twitter.com/TuurDemeester/status/982276310633295873 …"	TuurDemeester	37	12	1523028366	982278281750708226	https://twitter.com/TuurDemeester/status/982278281750708226				0.25	0.0	0.99205035	-1.0
bitcoin 	Greg Maxwell commented in 2004 in a thread about Hal Finney's RPoW digital cash prototype, which was a Bitcoin predecessor. He reflected back on his involvement in a 2013 thread. http://archives.seul.org/mixminion/dev/Dec-2004/msg00010.html … https://www.reddit.com/r/Bitcoin/comments/2ewcl8/bitcoin_core_dev_gmaxwell_resigns_job_at_mozilla/ck3v5i6/ …pic.twitter.com/MfdIMn0HoQ	TuurDemeester	36	11	1523027896	982276310633295873	https://twitter.com/TuurDemeester/status/982276310633295873				-0.09	0.0	0.9662356	-1.0
bitcoin 	Cool initiative: Bitcoin articles read out loud in podcast form.https://twitter.com/TheCryptoconomy/status/981964245020692481 …	TuurDemeester	58	17	1522974182	982051016689537024	https://twitter.com/TuurDemeester/status/982051016689537024				0.20	0.1591	0.97546285	-1.0
bitcoin 	"Keep an eye on https://www.theinvestorspodcast.com  this weekend - Erik did a fantastic job as Bitcoin skeptic ""steel man"", I responded with my positive outlook.https://twitter.com/ErikSTownsend/status/982015363436204037 …"	TuurDemeester	61	14	1522967098	982021302805508101	https://twitter.com/TuurDemeester/status/982021302805508101				0.25	0.3715	0.95919716	-1.0
bitcoin 	I think the trade for the next 3 months is short Dow Jones long Bitcoin.	cryptomanran	305	51	1522992917	982129595964055552	https://twitter.com/cryptomanran/status/982129595964055552				0.13	0.0	0.9719953	1.0
bitcoin 	There could be some truth to this and I would keep an eye on April 17...https://cointelegraph.com/news/wall-street-bitcoin-bull-tom-lee-predicts-massive-outflow-of-crypto-before-tax-day …	cryptomanran	50	22	1522991094	982121949517115392	https://twitter.com/cryptomanran/status/982121949517115392				0.19	0.3182	0.96832645	-1.0
bitcoin ripple 	I keep saying. There is ZERO chance that that XRP will land up on Coinbase. Even if they offer the exchanges crazy money...they offered $1m this week!https://news.bitcoin.com/centralized-ripple-is-probably-a-security-token/ …	cryptomanran	57	21	1522990948	982121336699891712	https://twitter.com/cryptomanran/status/982121336699891712				0.26	-0.0376	0.9667634	-1.0
bitcoin 	I think it may actually get passed this time...https://hacked.com/sec-initiates-formal-proceedings-on-coveted-bitcoin-etf/ …	cryptomanran	105	36	1522989641	982115854924955648	https://twitter.com/cryptomanran/status/982115854924955648				0.56	0.0	0.9416255	1.0
bitcoin 	They’ve made it easier to acquire IOUs, no doubt. Unfortunately, many people don’t know the difference. That was the one point I tried to make clear in my article: Bitcoin is a set of keys. Whoever holds the keys, controls the crypto.	haydentiff	2	0	1523046908	982356049784180736	https://twitter.com/haydentiff/status/982356049784180736				-0.07	-0.0461	0.97586375	-1.0
bitcoin 	You sound confused. I wrote an introductory Bitcoin post for newcomers that might help you out.https://tiffanyhayden.blog/2018/03/30/what-is-bitcoin/ …	haydentiff	0	0	1523046677	982355084058251264	https://twitter.com/haydentiff/status/982355084058251264				0.06	0.0279	0.97735435	-1.0
bitcoin 	Trying to explain # Bitcoin as simply as possible while still being accurate is...challenging. I had to whittle my way down from 80,000,000,000 words to ~650, haha. Enjoy! (This is for beginners.) https://tiffanyhayden.blog/2018/03/30/what-is-bitcoin/ …	haydentiff	207	64	1523045506	982350170057830400	https://twitter.com/haydentiff/status/982350170057830400		#		0.00	0.2	0.96756774	-1.0
bitcoin 	TODAY 12pm PT @ EdgeSecure’s first ever Facebook live Q&A! Get your questions in ASAP. # Bitcoin # Blockchain # crypto http://facebook.com/EdgeSec pic.twitter.com/R9zeIiVg62	haydentiff	6	2	1523035887	982309823739031553	https://twitter.com/haydentiff/status/982309823739031553		# # #	@	0.32	0.0	0.9458335	-1.0
bitcoin 	“I’m going to write an article about BITCOIN!” Writes op ed about Coinbase. Every XRP article ever. I still see you, @ twobitidiot.	haydentiff	98	10	1523028922	982280610239594496	https://twitter.com/haydentiff/status/982280610239594496			@	0.04	0.0	0.9717979	-1.0
bitcoin 	http://metro.co.uk/2018/04/06/alleged-bitcoin-creator-craig-satoshi-nakamoto-wright-reveals-secrets-rare-interview-7444418/?ito=amp-share-twitter-top …pic.twitter.com/OIV9oUH0kn	stacyherbert	0	0	1523037351	982315966682951680	https://twitter.com/stacyherbert/status/982315966682951680				0.00	0.0	0.97029155	1.0
bitcoin 	Raise your hand if you're old enough to remember McxNOW? https://en.bitcoinwiki.org/wiki/McxNOW pic.twitter.com/K3okrPK7jc	stacyherbert	10	5	1522980191	982076220627025921	https://twitter.com/stacyherbert/status/982076220627025921				-0.09	0.247	0.9711156	-1.0
bitcoin 	In a few minutes: Why Bitcoin is Different Q&A:https://www.youtube.com/watch?v=VIRNWSLf3jc …	jimmysong	75	35	1523042823	982338917088153600	https://twitter.com/jimmysong/status/982338917088153600				-0.11	0.0	0.96109265	-1.0
bitcoin 	Are there any Bitcoin conferences where you have to apply to attend? I would think that would guarantee a certain level of knowledge among attendees and allow better and more productive networking...	jimmysong	136	10	1522969127	982029813572685824	https://twitter.com/jimmysong/status/982029813572685824				-0.03	0.3922	0.9780211	1.0
bitcoin 	Happy Birthday Satoshi Nakamoto https://steemit.com/bitcoin/@dollarvigilante/today-is-the-85th-anniversary-of-gold-confiscation-in-the-ussa-and-satoshi-s-birthday …	DollarVigilante	25	6	1523023200	982256613024260096	https://twitter.com/DollarVigilante/status/982256613024260096			@dollarvigilante	1.00	0.5719	0.9653769	-1.0
bitcoin 	You surely won’t hear this worldview analysis on CNN or any of the mainstream presstitute outlets. https://steemit.com/bitcoin/@dollarvigilante/today-is-the-85th-anniversary-of-gold-confiscation-in-the-ussa-and-satoshi-s-birthday …	DollarVigilante	30	12	1522970934	982037391815991296	https://twitter.com/DollarVigilante/status/982037391815991296			@dollarvigilante	0.00	0.2202	0.97553843	-1.0
bitcoin 	Major blockchain group says Europe should exempt Bitcoin from new data privacy rule https://www.theverge.com/2018/4/5/17199210/blockchain-coin-center-gdpr-europe-bitcoin-data-privacy … via @ verge @ John_Jeckmans	thomaspower	3	0	1523039003	982322895149060097	https://twitter.com/thomaspower/status/982322895149060097			@ @	0.11	0.1027	0.96308607	-1.0
bitcoin 	$ BTC is $ BTC and $ BCH is $ BCH but # BitcoinCash supporters believe $ BCH is closer to the whitepaper than $ BTC so they say $ BCH is $ BTC which is very confusing to newbies even if $ BCH is closer to the whitepaper.	SimonDixonTwitt	1	0	1523012557	982211973252136960	https://twitter.com/SimonDixonTwitt/status/982211973252136960		#		0.43	0.2641	0.96754944	-1.0
bitcoin 	I have been. Did you see any of my recent talks with Roger and BitcoinCash community calling our censorship.	SimonDixonTwitt	3	0	1522997718	982149731190108160	https://twitter.com/SimonDixonTwitt/status/982149731190108160				0.00	0.0	0.9661903	-1.0
bitcoin 	Anybody know who controls the @ Bitcoin Twitter account now? It has become very one sided in the $ BCH $ BTC debate. Sorry if I missed something that everybody else knows. Hard to keep up now.	SimonDixonTwitt	36	2	1522990316	982118687711707136	https://twitter.com/SimonDixonTwitt/status/982118687711707136			@	0.16	-0.116	0.96840894	-1.0
bitcoin 	But it also effects median of Exchange as things are 60% more expensive as goods are priced in fiat. This effects it’s median of Exchange properties too. Store of value in # Bitcoin case has to have a longer term time frame as it has very bad swings that effect short term usage.	SimonDixonTwitt	14	2	1522989890	982116901563219968	https://twitter.com/SimonDixonTwitt/status/982116901563219968		#		0.02	-0.1128	0.9753643	1.0
bitcoin 	Yeah, we took the word out because it was bitcoin winter and hard to get funding for bitcoin companies back then. So it has been great to see the shift to what actually matters.	starkness	26	3	1523032265	982294635136499713	https://twitter.com/starkness/status/982294635136499713				0.32	0.4196	0.9677422	-1.0
bitcoin 	Russian Hotels To Accept Bitcoin During FIFA World Cup 2018 https://cryptocoin.news/news/russian-hotels-to-accept-bitcoin-during-fifa-world-cup-2018-10152/ … via @ TodayCrypto	SimonCocking	18	11	1523001434	982165320440856577	https://twitter.com/SimonCocking/status/982165320440856577			@	0.14	0.3818	0.96494704	1.0
bitcoin 	Buy low. # crypto Soros getting in when the pain gets bad. GK Crypto 1000 index down to 406. Down 59.4% YTD. Now is when it starts to get interesting. https://twitter.com/bitcoinnewspage/status/982270952842014721 …	GerberKawasaki	21	4	1523026744	982271476286959617	https://twitter.com/GerberKawasaki/status/982271476286959617		#		0.16	-0.1083	0.96813345	-1.0
bitcoin 	Why Investing in # Blockchain Infrastructure is Better than Investing in Bitcoin - by @ hiveblockchain https://floq.to/91sPW#.WsNgw3k2Yco.twitter …	VanRijmenam	0	0	1522969821	982032724524437504	https://twitter.com/VanRijmenam/status/982032724524437504		# #	@	0.29	0.4404	0.97248423	-1.0
bitcoin 	BTC falls to $6K as experts claim 'bitcoin is essentially worthless' according to that noted cryptoeconomic journal of record, the Daily Express http://Express.co.uk https://buff.ly/2JmoMGl	dgwbirch	3	2	1523047500	982358533906812929	https://twitter.com/dgwbirch/status/982358533906812929				0.22	-0.4404	0.9589152	-1.0
bitcoin 	And in other news: The Daily Express tells us that Bitcoin is 'essentially worthless' and will continue to PLUNGE according to Capital Economicshttps://buff.ly/2EnJYIz	dgwbirch	1	1	1523031484	982291358382608385	https://twitter.com/dgwbirch/status/982291358382608385				0.13	-0.4404	0.9728281	-1.0
bitcoin 	A 200-Year-Old Idea Offers a New Way to Trace Stolen Bitcoins https://buff.ly/2q79u0l  “they posit that the first coin that leaves a Bitcoin address should be considered the same coin as the first one that went into it”	dgwbirch	6	2	1523014655	982220770712600576	https://twitter.com/dgwbirch/status/982220770712600576				0.22	-0.4939	0.9715488	1.0
bitcoin 	Bitcoin $6613 and still tanking. I think the double-hold crossover support level has recalibrated to an antelope flip. https://www.google.co.uk/search?q=btc+usd&ie=UTF-8&oe=UTF-8&hl=en-gb&client=safari …	dgwbirch	7	6	1523002941	982171641697394688	https://twitter.com/dgwbirch/status/982171641697394688				-0.16	0.134	0.9685398	-1.0
bitcoin 	Tim Draper on bitcoin and India. # IndiaBitcoinpic.twitter.com/h1wdxhWYpk	SunnyStartups	45	25	1522997942	982150672530358272	https://twitter.com/SunnyStartups/status/982150672530358272		#		0.25	0.0	0.97767556	1.0
bitcoin 	Proud to be a part of the @ BoostVC and @ BlumeVentures portfolios. @ TimDraper # IndiaBitcoinhttps://twitter.com/drapernetwork/status/982007021854539777 …	SunnyStartups	15	5	1522980211	982076301673574401	https://twitter.com/SunnyStartups/status/982076301673574401		#	@ @ @	0.24	0.2384	0.9726606	1.0
bitcoin 	$ BTC # bitcoin ... $6,666 ... creepy.	RonnieMoas	74	12	1522994802	982137501937643521	https://twitter.com/RonnieMoas/status/982137501937643521		#		0.38	0.0	0.9733277	-1.0
bitcoin 	"""There are other things that make Bitcoin special than just the blockchain."" - @ starknesshttps://www.youtube.com/watch?v=lSvcIeKFphM&feature=youtu.be …"	lopp	327	120	1523042944	982339426771615744	https://twitter.com/lopp/status/982339426771615744			@	0.40	0.2009	0.97505796	-1.0
bitcoin 	One of my favorites is this animation that shows how Bitcoin script gets executed to check the validity of spending a P2PKH UTXO https://cdn-images-1.medium.com/max/800/1*AlxhxUCtyAhMiI5Ul1dr8w.gif …	lopp	1	0	1523039158	982323544380981248	https://twitter.com/lopp/status/982323544380981248				0.21	0.4215	0.9735468	-1.0
bitcoin 	Should have bought bitcoin.https://twitter.com/darrenrovell/status/981665530548547586 …	westcoastbill	9	1	1522968521	982027273434836992	https://twitter.com/westcoastbill/status/982027273434836992				0.25	0.0	0.9694765	1.0
bitcoin 	"Update in the push for a $ BTC ETF - ""Efforts to list the first Bitcoin exchange-traded funds may not be dead after all.""https://hacked.com/sec-initiates-formal-proceedings-on-coveted-bitcoin-etf/ …"	VentureCoinist	137	52	1522991047	982121754372988928	https://twitter.com/VentureCoinist/status/982121754372988928				0.33	0.2667	0.97459805	1.0
bitcoin ripple 	# Bitcoin Morning Brief w/ @ giacomozucco @LeahWald1 & maybe @ jimmysong to talk more $ XRP # Ripple silliness, # Washington State Mining issues, # India bans $ BTC on ramps & # Monero $ XMR Hard Forks gettin interesting.https://www.youtube.com/watch?v=ASIU-GK_JEo …	ToneVays	86	10	1523025547	982266454585192448	https://twitter.com/ToneVays/status/982266454585192448		# # # # #	@ @LeahWald1 @	0.17	0.0176	0.9743201	1.0
bitcoin 	Hanging out w/ Incredibly talented @ realcoindaddy on the USS Hornet in San Fran talking # Bitcoin and more on the Deck... check it out!https://www.youtube.com/watch?v=sgaJv-UcyXs …	ToneVays	84	7	1522975906	982058245475860480	https://twitter.com/ToneVays/status/982058245475860480		#	@	0.12	0.2987	0.9660687	1.0
bitcoin 	No James Altucher photo here = failurehttps://www.theatlantic.com/photo/2018/04/bitcoin-a-stock-photo-cryptocurrency-primer/557339/ …	valuewalk	2	1	1522965650	982015228593557504	https://twitter.com/valuewalk/status/982015228593557504				0.29	-0.6705	0.9663065	-1.0
