	Shooting Reported Near U.S. Embassy In Turkey Following Russian Ambassador Assassinationhttp://ift.tt/2hNgBbo	DollarVigilante	11	10	1482174364	810924176940953600	https://twitter.com/DollarVigilante/status/810924176940953600			
	Subscribe here--> https://dollarvigilante.com/2tt # Quotes # Mises # Economicspic.twitter.com/6B905Kfgy7	DollarVigilante	14	12	1482172942	810918212200202240	https://twitter.com/DollarVigilante/status/810918212200202240		# # #	
	Could The # Internet Be Set To Be Shut Down On The Eve of October 1st? https://www.dollarvigilante.com/blog/2016/08/29/internet-set-shut-eve-jubilee-october-1st.html …pic.twitter.com/BXlwVpq1V2	DollarVigilante	8	13	1482169939	810905614541090816	https://twitter.com/DollarVigilante/status/810905614541090816		#	
	BREAKING: Russian Ambassador To Turkey Andrey Karlov Shot DEAD In Armed Assaulthttp://ift.tt/2hMXCO1	DollarVigilante	8	9	1482169003	810901690073436160	https://twitter.com/DollarVigilante/status/810901690073436160			
	IMF Head Christine Lagarde Found Guilty In France Of Negligencehttp://ift.tt/2i7qRaH	DollarVigilante	10	4	1482169002	810901687829458945	https://twitter.com/DollarVigilante/status/810901687829458945			
	Huffington Post’s Syrian Refugee Writer Blames Women for Being Sexually Assaultedhttp://ift.tt/2h45SJZ	DollarVigilante	10	10	1482167203	810894140682670080	https://twitter.com/DollarVigilante/status/810894140682670080			
	Smart Meter Data at Crux of Arkansas Murder Case http://snip.ly/1o3r8 # Activism	DollarVigilante	8	9	1482166083	810889444106600449	https://twitter.com/DollarVigilante/status/810889444106600449		#	
	Japan Recognizes First Thyroid Cancer Case As Fukushima Related, Offers Compensation http://snip.ly/obxli # Activism	DollarVigilante	9	2	1482166083	810889441623572483	https://twitter.com/DollarVigilante/status/810889441623572483		#	
	Echoes of Russia: Obama Calls for Silencing “Domestic Propagandists” And Alternative Media http://snip.ly/mabtf # SHTF	DollarVigilante	9	0	1482165969	810888965842731008	https://twitter.com/DollarVigilante/status/810888965842731008		#	
	SOMEBODY Wants Chaos # Economy # Conspiracy # SHTF Subscribe--> https://dollarvigilante.com/2tt pic.twitter.com/wKwFpgYMF4	DollarVigilante	13	7	1482164719	810883720278343680	https://twitter.com/DollarVigilante/status/810883720278343680		# # #	
	Maine Elector Goes Rogue, Votes Bernie Sandershttp://ift.tt/2hRxyyo	DollarVigilante	16	11	1482161855	810871709830180864	https://twitter.com/DollarVigilante/status/810871709830180864			
	Washington Prepares For EMP While # Internet Under Attack Since Transfer to the # UN https://dollarvigilante.com/blog/2016/10/28/washington-prepares-emp-internet-attack-since-transfer-un.html …pic.twitter.com/DBetu8mAVY	DollarVigilante	18	16	1482157036	810851497852497921	https://twitter.com/DollarVigilante/status/810851497852497921		# #	
	# TDV # Quotes Subscribe--> https://dollarvigilante.com/2tt pic.twitter.com/E4hCzSkBSP	DollarVigilante	17	4	1482156557	810849489707827200	https://twitter.com/DollarVigilante/status/810849489707827200		# #	
	State Dept Removed Hillary’s Libya Email That Shows Motive Behind Gaddafi’s Assassinationhttp://ift.tt/2hQOhSE	DollarVigilante	17	18	1482151602	810828703844409344	https://twitter.com/DollarVigilante/status/810828703844409344			
	Join Us--> https://dollarvigilante.com/2tt # Investing # Bankingpic.twitter.com/oUc4xC5EJA	DollarVigilante	22	13	1482148278	810814762665857024	https://twitter.com/DollarVigilante/status/810814762665857024		# #	
	The Future of the Eurozone Could Be Decided on December 4th in # Austria and # Italy. # EU https://dollarvigilante.com/blog/2016/11/29/future-eurozone-decided-december-4th-austria-italy.html …pic.twitter.com/QzaYFcDZ9k	DollarVigilante	13	11	1482146237	810806204473688064	https://twitter.com/DollarVigilante/status/810806204473688064		# # #	
	Join me on @ Steemit # Crypto # Blockchain https://steemit.com/introduceyourself/@dollarvigilante/the-dollar-vigilante-is-now-on-steemit …pic.twitter.com/GoRvYfxLrB	DollarVigilante	18	16	1482140054	810780268684574720	https://twitter.com/DollarVigilante/status/810780268684574720		# #	@ @dollarvigilante
	Paranoia Deepens in US as Cyber-attacks Prepare Post-Election Tumult https://dollarvigilante.com/blog/2016/11/08/paranoia-deepens-us-cyber-attacks-prepare-post-election-tumult.html …pic.twitter.com/g3FYYOHc9T	DollarVigilante	17	9	1482135434	810760891352449024	https://twitter.com/DollarVigilante/status/810760891352449024			
bitcoin 	IRS wants your # Bitcoin information. Subscribe here--> https://dollarvigilante.com/2tt pic.twitter.com/XZSyp7X1eb	DollarVigilante	25	24	1482131836	810745801584545792	https://twitter.com/DollarVigilante/status/810745801584545792		#	
	The Real Reason Why America Has Been Given A Reprieve http://snip.ly/6ybfe # Economy	DollarVigilante	14	10	1482126984	810725448430841856	https://twitter.com/DollarVigilante/status/810725448430841856		#	
	Join us and learn how to protect your assets http://dollarvigilante.com # Economy # Banking # Jubileepic.twitter.com/pZmV7K2S3Z	DollarVigilante	14	5	1482124119	810713432756518917	https://twitter.com/DollarVigilante/status/810713432756518917		# # #	
	Poison Producer Monsanto Approves $66 BILLION Acquisition By Bayerhttp://ift.tt/2h1FdgZ	DollarVigilante	10	10	1482122771	810707779740700674	https://twitter.com/DollarVigilante/status/810707779740700674			
	Government is an Unnecessary Evil. Subscribe here--> https://dollarvigilante.com/2tt # Anarchism # Libertypic.twitter.com/qAi3eFSI9T	DollarVigilante	20	14	1482119418	810693715895451648	https://twitter.com/DollarVigilante/status/810693715895451648		# #	
	Why I Left # Canada and Became A Citizen of the # DominicanRepublic https://www.dollarvigilante.com/blog/2016/08/25/left-canada-became-citizen-dominican-republic.html …pic.twitter.com/ZfAeJXSH15	DollarVigilante	11	11	1482113897	810670559365386240	https://twitter.com/DollarVigilante/status/810670559365386240		# #	
	Seek Your Independence: Anything Else Will Destroy You. # Life # Liberty # Freedom https://dollarvigilante.com/blog/2016/10/16/seek-independence-anything-else-will-destroy.html …pic.twitter.com/mbiMRyN1RH	DollarVigilante	15	4	1482113836	810670302887903233	https://twitter.com/DollarVigilante/status/810670302887903233		# # #	
	Protect Yourself--> https://dollarvigilante.com/2tt # Germany # Markets # Investing # Europepic.twitter.com/k1T51ngqTa	DollarVigilante	16	11	1482111197	810659236380372993	https://twitter.com/DollarVigilante/status/810659236380372993		# # # #	
	The ‘Experts’ Tell Us That Christmas Is The Most Depressing Time Of The Year – Do You Agree?http://ift.tt/2hKiC82	DollarVigilante	9	4	1482110473	810656197934272514	https://twitter.com/DollarVigilante/status/810656197934272514			
	CBS News Caught Lying And Slandering WeAreChange and Free Speech http://snip.ly/0c210 # Activism	DollarVigilante	12	4	1482110311	810655519346196480	https://twitter.com/DollarVigilante/status/810655519346196480		#	
	CBS News Caught Lying And Slandering WeAreChange And Free Speechhttp://ift.tt/2gQ5uKb	DollarVigilante	15	15	1482108666	810648620806635520	https://twitter.com/DollarVigilante/status/810648620806635520			
	Top 10 Times The U.S. Interfered With Foreign Governmentshttp://ift.tt/2hgwjs3	DollarVigilante	12	9	1482108396	810647485941252096	https://twitter.com/DollarVigilante/status/810647485941252096			
	Wells Fargo and Other Banks Now Just Outright Stealing People's # Money https://dollarvigilante.com/blog/2016/09/14/wells-fargo-banks-now-just-outright-stealing-peoples-money.html …pic.twitter.com/zLrZ1C2kdR	DollarVigilante	10	14	1482103035	810625001116286977	https://twitter.com/DollarVigilante/status/810625001116286977		#	
	Subscribe here--> https://dollarvigilante.com/2tt # TPP # Trade # Investingpic.twitter.com/TnuLU9OVMX	DollarVigilante	11	0	1482102980	810624769368453121	https://twitter.com/DollarVigilante/status/810624769368453121		# # #	
	The obvious progression of fantasy sports is fantasy everything. My friends and I have been doing fantasy Survivor for years. @ JZsTweetshow	readDanwrite	3	0	1482187017	810977247209410561	https://twitter.com/readDanwrite/status/810977247209410561			@
	You all saw this coming: fantasy Bachelor. ESPN handling the tech. https://www.yahoo.com/tv/bachelor-fantasy-league-abc-launches-194836981.html … via @ claire_atkins	readDanwrite	2	0	1482186933	810976895982510080	https://twitter.com/readDanwrite/status/810976895982510080			@
	# DFS scooplet: @ PlayDraft has raised new $ and brought on @ jordanfliegel as co-CEO https://yhoo.it/2i8rTDx @ YahooFinancepic.twitter.com/0B9WcAPov7	readDanwrite	16	7	1482184326	810965961717252096	https://twitter.com/readDanwrite/status/810965961717252096		#	@ @ @
	News photo of the year, surely. by @ AP's @ BurhanOzbilicipic.twitter.com/VECCGPXD8V	readDanwrite	65	51	1482172595	810916758492168192	https://twitter.com/readDanwrite/status/810916758492168192			@ @
	compelling # contentpic.twitter.com/juTxbgU33E	readDanwrite	1	0	1482169322	810903027016232960	https://twitter.com/readDanwrite/status/810903027016232960		#	
	admitting? it's a story about cabinet picks who all have ties to a sports organization. go to wikipedia for a detailed bio.	readDanwrite	0	0	1482168970	810901550843437057	https://twitter.com/readDanwrite/status/810901550843437057			
	the post is about that shared common trait, yes. the blurb for each person focuses on that. it isn't a Wikipedia resumé.	readDanwrite	0	0	1482168774	810900728374054912	https://twitter.com/readDanwrite/status/810900728374054912			
	story says West Point grad. did you actually read it?	readDanwrite	0	0	1482168312	810898790223872001	https://twitter.com/readDanwrite/status/810898790223872001			
	time for our @ YahooFinance midday live show. talkin' Trump cabinet; Trump and sports betting; tech IPOs in 2017. https://yhoo.it/2h3Sp51 pic.twitter.com/zFVFD2BYbc	readDanwrite	2	5	1482166629	810891733517168640	https://twitter.com/readDanwrite/status/810891733517168640			@
	the @ FlaPanthers have announced who will run the team if Vincent Viola is confirmed as Trump's Army secy: current $ VIRT CEO Doug Cifu.pic.twitter.com/VWOVhEXLGO	readDanwrite	0	0	1482166449	810890977913241600	https://twitter.com/readDanwrite/status/810890977913241600			@
	Trump wants NHL team owner Vincent Viola as Army secretary-- the latest in his growing sports cabinet https://yhoo.it/2gvTZHO @ YahooFinancepic.twitter.com/NNVqZue9Rk	readDanwrite	5	3	1482158936	810859467642404864	https://twitter.com/readDanwrite/status/810859467642404864			@
	The owner of the @ FlaPanthers. # NHLhttps://twitter.com/cnbcnow/status/810846760042164229 …	readDanwrite	1	0	1482157385	810852962138464257	https://twitter.com/readDanwrite/status/810852962138464257		#	@
	I'm from the Boston area, I like Mark Wahlberg just fine, but have to say: I do not support the marathon movie.	readDanwrite	2	1	1482103574	810627260269084672	https://twitter.com/readDanwrite/status/810627260269084672			
	"New blog post: ""Weigh and deliver"" -- blood money and the evolution of money and law http://unenumerated.blogspot.com/2016/12/weigh-and-deliver-compensation-and.html …pic.twitter.com/buUJL1jSNO"	NickSzabo4	47	28	1482167696	810896210223628290	https://twitter.com/NickSzabo4/status/810896210223628290			
	Thanks!	NickSzabo4	1	0	1482138529	810773872735821824	https://twitter.com/NickSzabo4/status/810773872735821824			
	"Smart Ks are not trad. ""Ricardian"" Ks. But quite wrong to say smart Ks can't capture semantics of many financial Ks.http://archive.is/qnGn5"	NickSzabo4	21	8	1482123261	810709835461357568	https://twitter.com/NickSzabo4/status/810709835461357568			
	@ Steve_Sailer Ways to learn the classics from best to worst: (1) Read them for yourself, (2) Wikipedia, (3) Cliff's Notes, (4) Zuck	NickSzabo4	1	0	1482103093	810625244855730176	https://twitter.com/NickSzabo4/status/810625244855730176			@
	Weigh and deliver: compensation culture and the evolution of law and money (new blog post!) http://unenumerated.blogspot.com/2016/12/weigh-and-deliver-compensation-and.html …pic.twitter.com/BvqYm6I34P	NickSzabo4	114	83	1482102391	810622299288305664	https://twitter.com/NickSzabo4/status/810622299288305664			
	The Growing Need for Specialized Platforms in Corporate Banking http://ow.ly/qGXa307gqfo # fintech # digital # innovationpic.twitter.com/GOYF6vwGKZ	sbmeunier	14	17	1482181512	810954158157287429	https://twitter.com/sbmeunier/status/810954158157287429		# # #	
	Did you know that Atlanta is a hot # fintech place? http://ow.ly/r0MG307gr1U # payments # analytics @ TAGthinkpic.twitter.com/sB0dHfOBYZ	sbmeunier	6	11	1482177653	810937969863491584	https://twitter.com/sbmeunier/status/810937969863491584		# # #	@
	Cool infographic Do you meet the conditions for ASIC # Fintech Licensing exemption? http://ow.ly/ZlPf307gnNV pic.twitter.com/9H2VIMECad	sbmeunier	3	5	1482174313	810923961366249472	https://twitter.com/sbmeunier/status/810923961366249472		#	
bitcoin 	On # Bitcoin, Tulips And IRS # Tax # Compliance # fintech http://www.forbes.com/sites/peterjreilly/2016/12/18/on-bitcoins-tulips-and-irs-tax-compliance/#a03eb5368533 …pic.twitter.com/NbHitHpO6i	sbmeunier	2	0	1482170461	810907806530490369	https://twitter.com/sbmeunier/status/810907806530490369		# # # # #a03eb5368533	
	ICAP to process foreign exchange trades on # blockchain technology http://ow.ly/PUKG307gc5g # fintech # FXpic.twitter.com/qkpQN2rVUM	sbmeunier	3	7	1482166214	810889993099022336	https://twitter.com/sbmeunier/status/810889993099022336		# # #	
	Euroclear Bankchain Completes First Market Pilot for # Blockchain # Gold Settlement # fintech http://news.sys-con.com/node/3974405	sbmeunier	3	4	1482163238	810877508933582849	https://twitter.com/sbmeunier/status/810877508933582849		# # #	
	. @ xbrlus and Consensys forms # blockchain working group # fintech # standardhttps://www.finextra.com/pressarticle/67472/xbrl-us-forms-blockchain-working-group?utm_medium=rss&utm_source=finextrafeed …	sbmeunier	3	3	1482161417	810869873177935872	https://twitter.com/sbmeunier/status/810869873177935872		# # #	@
	ABN Amro tests distributed ledgers in # realestate sector # fintech # blockchain # proptech https://www.finextra.com/newsarticle/29916/abn-amro-tests-distributed-ledgers-in-real-estate-sector?utm_medium=rss&utm_source=finextrafeed …pic.twitter.com/91tBpihq9B	sbmeunier	3	1	1482159632	810862384529178624	https://twitter.com/sbmeunier/status/810862384529178624		# # # #	
	Digital currency sales take off, but with no regulation questions abound # fintech # ICO # cryptocurrency http://in.reuters.com/article/usa-fintech-blockchain-idINKBN148179 …pic.twitter.com/3bf7152SbG	sbmeunier	3	7	1482158407	810857249061142528	https://twitter.com/sbmeunier/status/810857249061142528		# # #	
	Making # Blockchain Real for Enterprises: The Importance of Tokenization # fintech http://ow.ly/uHFj307g7nb pic.twitter.com/yvoYFGtLxu	sbmeunier	8	10	1482156935	810851074370310144	https://twitter.com/sbmeunier/status/810851074370310144		# #	
	Excellent piece by @ CoinSciences Why # Blockchain Won't Be Connecting Banks in 2017 # fintech http://ow.ly/NCoh307g4EP pic.twitter.com/RlKGbJm3ko	sbmeunier	7	6	1482155870	810846607520448512	https://twitter.com/sbmeunier/status/810846607520448512		# #	@
	# Fintech in Capital Markets: Different Engagement Models # VC # startups @ BCG http://ow.ly/TQCk307f5cs pic.twitter.com/LXFLTPOYmX	sbmeunier	22	26	1482152710	810833354266320896	https://twitter.com/sbmeunier/status/810833354266320896		# # #	@
	The Most Influential People in # Blockchain 2016 http://ow.ly/kHfr3078eVw # fintech # insurtech @ coindeskpic.twitter.com/48anFNycjS	sbmeunier	14	12	1482108119	810646323783286784	https://twitter.com/sbmeunier/status/810646323783286784		# # #	@
	What banks can learn from # fintech # startups # API # partnership # innovation # BaaS # openbanking http://www.cio.com/article/3151145/apis/what-banks-can-learn-from-fintech-startups.html …	sbmeunier	9	5	1482107084	810641981680586753	https://twitter.com/sbmeunier/status/810641981680586753		# # # # # # #	
ethereum 	WOOF https://blog.ethereum.org/2016/12/19/security-alert-12192016-ethereum-org-forums-database-compromised/ …	Melt_Dem	4	1	1482185965	810972835049078784	https://twitter.com/Melt_Dem/status/810972835049078784			
bitcoin 	great shout-out to @ PurseIO which helps mechanical turk workers liquidate their gift cards for # bitcoinhttp://www.techrepublic.com/article/inside-amazons-clickworker-platform-how-half-a-million-people-are-training-ai-for-pennies-per-task/?linkId=32466355 …	Melt_Dem	25	10	1482132176	810747227169820672	https://twitter.com/Melt_Dem/status/810747227169820672		#	@
	loving this realness from @ BLR13 - get that pin and pop those balloons of irrational optimism!http://www.coindesk.com/5-things-the-blockchain-industry-needs-to-stop-saying-in-2017/?utm_content=buffer1a8d9&utm_medium=social&utm_source=twitter.com&utm_campaign=buffer …	Melt_Dem	4	1	1482131120	810742799243083776	https://twitter.com/Melt_Dem/status/810742799243083776			@
bitcoin 	clearly these people haven't spent much time in # bitcoin or # blockchain twitter. most of my followers are me.https://twitter.com/ollieconnolly/status/810684058841845760 …	Melt_Dem	2	3	1482130182	810738861794033664	https://twitter.com/Melt_Dem/status/810738861794033664		# #	
	i write / analyze news for our partners and investors, but hope to do a public newsletter soon. thanks for the	Melt_Dem	1	0	1482112400	810664279603113984	https://twitter.com/Melt_Dem/status/810664279603113984			
	are you going to choose love and abundance or feed this false perception of your own importance? chaos and fear are a bad path, my friends	Melt_Dem	7	0	1482111295	810659643806588928	https://twitter.com/Melt_Dem/status/810659643806588928			
bitcoin 	"key takeaway re: transition to digital currency ""i don't think anyone can stop it from happening""http://www.newsweek.com/2016/12/23/virtual-currencies-bitcoin-being-monitored-us-government-532063.html …"	Melt_Dem	16	3	1482109341	810651451982835712	https://twitter.com/Melt_Dem/status/810651451982835712			
	"amazing! i think a lot of # blockchain companies will figure it out, but it's not a one year ""plug and chug"" project"	Melt_Dem	2	0	1482105340	810634670346043392	https://twitter.com/Melt_Dem/status/810634670346043392		#	
	i feel like i can only say this so many times - # blockchain is not a product. it's a platform with strong network effects.	Melt_Dem	25	5	1482103670	810627662536409089	https://twitter.com/Melt_Dem/status/810627662536409089		#	
bitcoin 	headed to denver to work on an exciting new @ DCGco project with @ ideasbynature! let me know if you're around and want to # bitcoin!	Melt_Dem	7	1	1482103605	810627392448462848	https://twitter.com/Melt_Dem/status/810627392448462848		#	@ @
	"highly doubt ""every institution"" will hire # blockchain experts. enthusiasm is waning as irrational exuberance fadeshttp://www.coindesk.com/the-tapscotts-on-blockchain-2016-and-whats-next/ …"	Melt_Dem	2	1	1482103263	810625955593093120	https://twitter.com/Melt_Dem/status/810625955593093120		#	
	I registered for Construct 2017 https://events.bizzabo.com/construct2017/?share=true …	el33th4xor	2	2	1482184478	810966598869745665	https://twitter.com/el33th4xor/status/810966598869745665			
	indeed, BTC denominated instruments can be legal. Looking forward to them!	el33th4xor	2	0	1482180735	810950898365190145	https://twitter.com/el33th4xor/status/810950898365190145			
bitcoin 	A giant library that provides basic data structures like lists that the bitcoin code uses. It's very very big&complex.	el33th4xor	3	0	1482180498	810949905468493824	https://twitter.com/el33th4xor/status/810949905468493824			
	Against one's will, involving people who were unaffected by the theft.	el33th4xor	1	0	1482180422	810949587204734977	https://twitter.com/el33th4xor/status/810949587204734977			
	the fact that it is not backed by anything, and the fact that the contract participants did not actually consent.	el33th4xor	0	0	1482180077	810948139402362888	https://twitter.com/el33th4xor/status/810948139402362888			
bitcoin 	It would be so awesome to get rid of Bitcoin's dependency on the Boost library.	el33th4xor	20	3	1482180019	810947894811435008	https://twitter.com/el33th4xor/status/810947894811435008			
	Probably because it's illegal, but no matter, this hacker gave rise to a new wave of financial trickery.	el33th4xor	4	0	1482179801	810946979438166016	https://twitter.com/el33th4xor/status/810946979438166016			
	"Not only that, but he set off a wave of ""debt tokenization"" at Bitfinex that's ridiculously creative. Why don't normal companies do this? https://twitter.com/22loops/status/810937322363559937 …"	el33th4xor	11	2	1482179750	810946765901987840	https://twitter.com/el33th4xor/status/810946765901987840			
	Recent events make @ ElaineRShi's and @ AriJuels work on assassination markets quite relevant:https://www.hackread.com/darkweb-website-funds-to-assassinate-trump-pence/ …	el33th4xor	4	5	1482177175	810935966575763456	https://twitter.com/el33th4xor/status/810935966575763456			@ @
	"Yes, he says ""Do not forget Aleppo... You will not feel secure as long as they are not secure... I will come out of here dead."""	el33th4xor	0	0	1482176568	810933419907706880	https://twitter.com/el33th4xor/status/810933419907706880			
	I wouldn't count out Switzerland just yet! They are doing everything to remain Switzerland.https://twitter.com/lopp/status/810665611818844164 …	el33th4xor	13	2	1482176149	810931661638696960	https://twitter.com/el33th4xor/status/810931661638696960			
	Awful. Sounds like ISIS or Al-Nusra. Either way, backed by Erdogan and co.	el33th4xor	0	0	1482175966	810930895637069824	https://twitter.com/el33th4xor/status/810930895637069824			
	yes, waiting for the details to emerge. Not good	el33th4xor	0	0	1482173963	810922492697182209	https://twitter.com/el33th4xor/status/810922492697182209			
	They say this now, but they'll all fall into place behind Palantir.http://ind.pn/2h1pyy1	el33th4xor	13	8	1482171190	810910861514670080	https://twitter.com/el33th4xor/status/810910861514670080			
	timing doesn't work for this explanation. gotta know when the evidence doesn't support a narrative. this is it.	el33th4xor	0	0	1482166356	810890588979658752	https://twitter.com/el33th4xor/status/810890588979658752			
	yes, indeed, but sadly, Obama was far from this.	el33th4xor	0	0	1482166283	810890282715717633	https://twitter.com/el33th4xor/status/810890282715717633			
	asserting a falsehood and mixing in ad hominems doesn't make it sound any more convincing, sorry.	el33th4xor	1	0	1482166254	810890162104401921	https://twitter.com/el33th4xor/status/810890162104401921			
	Reminder: 8 years ago, HRC supporters were using the phrase ObamaBro to criticize Obama supporters.https://twitter.com/MattBinder/status/810886790605393920 …	el33th4xor	6	0	1482166123	810889610490429440	https://twitter.com/el33th4xor/status/810889610490429440			
	do you just want a narrative that sounds good to your own ears, or do you want an actionable, proven cause-and-effect?	el33th4xor	1	0	1482164209	810881582877773824	https://twitter.com/el33th4xor/status/810881582877773824			
	you're now making unfalsifiable statements. OK. Kind of like attributinga chart to sunspot activity.	el33th4xor	0	0	1482164118	810881200743129089	https://twitter.com/el33th4xor/status/810881200743129089			
	you're now walking backwards, so that's good. I contested the DAO hack connection. Timing doesn't fit theory.	el33th4xor	0	0	1482163761	810879702038695936	https://twitter.com/el33th4xor/status/810879702038695936			
	You put forth a causative theory, you get to prove causation. We don't need to prove an alternative to disprove it.	el33th4xor	0	0	1482163276	810877670275903488	https://twitter.com/el33th4xor/status/810877670275903488			
	If mgmnt changes their formula, do they retain the rights to the name? ;-)	el33th4xor	0	0	1482162617	810874905143246848	https://twitter.com/el33th4xor/status/810874905143246848			
	the timing doesn't match. that's just you reading your wishes into a chart.	el33th4xor	0	0	1482162512	810874464749649920	https://twitter.com/el33th4xor/status/810874464749649920			
	let me repeat, recent price activity has nothing to do with The DAO.	el33th4xor	0	0	1482160517	810866097662689280	https://twitter.com/el33th4xor/status/810866097662689280			
	so, recent price activity is the result of events from June/July? Sounds desperate.	el33th4xor	1	0	1482156331	810848538355781632	https://twitter.com/el33th4xor/status/810848538355781632			
	so if some genius decides to subsidize ETC and push the price up, I will hardly raise an eyebrow. It's a non-event.	el33th4xor	2	0	1482122647	810707258631999489	https://twitter.com/el33th4xor/status/810707258631999489			
	price of speculative assets like ETC, even BTC, reflect nothing about the underlying technology.	el33th4xor	3	1	1482122574	810706952066125824	https://twitter.com/el33th4xor/status/810706952066125824			
	the price of a lightly-traded asset with low volume can reflect how much someone is willing to subsidize it to make a point.	el33th4xor	2	0	1482122458	810706465472311296	https://twitter.com/el33th4xor/status/810706465472311296			
	you're still not responding or holding up your end of a proper convo.	el33th4xor	0	0	1482118893	810691515253223425	https://twitter.com/el33th4xor/status/810691515253223425			
	you're not conversing with me, you're ranting like a mindless troll.	el33th4xor	1	0	1482117571	810685967808032768	https://twitter.com/el33th4xor/status/810685967808032768			
	And I'm quite serious. It's possible to push ETC price above ETH.	el33th4xor	3	0	1482117063	810683837382586368	https://twitter.com/el33th4xor/status/810683837382586368			
