	いつでしょう…。「もうまもなく」と言うくらいですからねぇ。。。。流石に9月とかはないでしょうけどｗ　あったらあったでそれは記事ネタとしては面白いんですが（笑	mochi_wsj	0	0	1468808365	754863113296486400	https://twitter.com/mochi_wsj/status/754863113296486400			
	大丈夫、Tさんがすべてご破産にしますからｗ	mochi_wsj	0	0	1468808301	754862846584852480	https://twitter.com/mochi_wsj/status/754862846584852480			
	If you don't have the Go yet, let's just blame Yo-Kai. Yo-Kai is prohibiting you from obtaining access to the Go.http://yo-kai.nintendo.com/	mochi_wsj	23	12	1468808278	754862746210934784	https://twitter.com/mochi_wsj/status/754862746210934784			
	ある程度レベルを上げたポケモンGOアカウントを売るという行為が蔓延し始めているという記事。レベル12で100ドルほどの値段にて取引が成立したそうで。https://twitter.com/mochi_wsj/status/754861392369299456 …	mochi_wsj	9	12	1468808040	754861749170429952	https://twitter.com/mochi_wsj/status/754861749170429952			
	As always, it has become good business for some to sell high-powered Pokémon Go accounts via @ saraheneedlemanhttp://on.wsj.com/2a1AlFG	mochi_wsj	9	2	1468807955	754861392369299456	https://twitter.com/mochi_wsj/status/754861392369299456			@
	妖怪のせいにちがいない。	mochi_wsj	0	0	1468807621	754859992956620800	https://twitter.com/mochi_wsj/status/754859992956620800			
	Tencent president uses Supercell deal to go globalhttp://on.wsj.com/2akdd1z	mochi_wsj	2	0	1468807523	754859583269507072	https://twitter.com/mochi_wsj/status/754859583269507072			
	とっとと探して押してきてくださいｗ	mochi_wsj	0	0	1468807373	754858953159303170	https://twitter.com/mochi_wsj/status/754858953159303170			
	あー、あの記事ですね。ま、（人のこといえませんが）公式でないので話半分できいていますｗ	mochi_wsj	0	0	1468807353	754858866882379780	https://twitter.com/mochi_wsj/status/754858866882379780			
	女性専用車両というトラップがあるのでお気をつけ下さい	mochi_wsj	0	0	1468807300	754858646677225472	https://twitter.com/mochi_wsj/status/754858646677225472			
	関西方面だと電車も「こんど」「つぎ」と表記しますよね。私は関東圏出身なのでちんぷんかんぷんでしたｗ	mochi_wsj	0	0	1468805945	754852961990225920	https://twitter.com/mochi_wsj/status/754852961990225920			
	蕎麦屋に出前頼んでいつまでたっても来ないので、電話して確認すると「今でました」。１０分後こなくて、もう一度電話かけると、返事はまた「今出ました」、と。そんな感じのニュアンスですｗ	mochi_wsj	1	0	1468805487	754851042253156354	https://twitter.com/mochi_wsj/status/754851042253156354			
	ブルームバーグのこの記事。「米国版スタートのボタンを押した」と言うことはボタンを押せば他の地域も配信できることはできる状態にあるのかな、と思ったり。サーバー等々の問題はあるのでしょうが（直接聞いたわけでないので、実態は知りませんが）https://www.bloomberg.co.jp/news/articles/2016-07-12/OA6IF06TTDSG01 …	mochi_wsj	11	6	1468805380	754850592548270081	https://twitter.com/mochi_wsj/status/754850592548270081			
	正解だと思います　笑	mochi_wsj	0	0	1468805208	754849869932535808	https://twitter.com/mochi_wsj/status/754849869932535808			
	or not. sort of getting tired of waiting and some people started saying we don't care anymore...	mochi_wsj	3	0	1468805185	754849777087414273	https://twitter.com/mochi_wsj/status/754849777087414273			
	蕎麦屋の出前状態ですね（例えが古い）	mochi_wsj	0	0	1468805165	754849691460775936	https://twitter.com/mochi_wsj/status/754849691460775936			
	記者として個人として、という前提のもと、real soon、と言われて今週スタートしなかったらそれなんなの、怒ります。「もうちょっとだけ」→「まもなく」→「もうまもなく」。次は…「本当にもうちょっと、すっごくもうまもなく」とか？笑	mochi_wsj	1	0	1468804711	754847787380899840	https://twitter.com/mochi_wsj/status/754847787380899840			
	Pokemon Go started in Canada. Hopefully there will be somewhere in Asia or Latin America next.	mochi_wsj	154	74	1468804553	754847126367055872	https://twitter.com/mochi_wsj/status/754847126367055872			
	thanks for sharing The, have a great Monday :) (Want this ? >> http://bit.ly/tweet_thanks_ )	SafarazAli	0	0	1468854866	755058154438701058	https://twitter.com/SafarazAli/status/755058154438701058			
	thanks for sharing Aberdeen, have a great Monday :) (Want this ? >> http://bit.ly/tweet_thanks_ )	SafarazAli	0	0	1468846708	755023935142371328	https://twitter.com/SafarazAli/status/755023935142371328			
	thanks for sharing Ben, have a great Monday :) (Want this ? >> http://bit.ly/tweet_thanks_ )	SafarazAli	0	0	1468839458	754993527205965824	https://twitter.com/SafarazAli/status/754993527205965824			
	thanks for sharing cumbriapcc, have a great Monday :) (Want this? It's FREE! https://bit.ly/thankyou69 )	SafarazAli	0	0	1468832852	754965820946558977	https://twitter.com/SafarazAli/status/754965820946558977			
	data?	FEhrsam	1	0	1468794925	754806740634378241	https://twitter.com/FEhrsam/status/754806740634378241			
	Great, tempered interview by @ derosetech & @ junseth. This is the @ jamie247 company in UK. cc: @ davidbrear @ sytaylorhttps://twitter.com/derosetech/status/754850261361827845 …	jonmatonis	9	5	1468871551	755128133024485376	https://twitter.com/jonmatonis/status/755128133024485376			@ @ @ @ @
	So, after all that wasted energy, he blocked me from seeing his tweets. Funny (and sad). # TooMuchToTake # LogicBrokeDown	jonmatonis	0	0	1468866504	755106965777321984	https://twitter.com/jonmatonis/status/755106965777321984		# #	
	When government money in a region becomes fully digital, any paper cash will become contraband.	jonmatonis	19	16	1468865958	755104676513579008	https://twitter.com/jonmatonis/status/755104676513579008			
	This makes it difficult not to take personally. We should talk IRL; I'm curious what makes you think like you do.	jonmatonis	0	0	1468864720	755099483210342400	https://twitter.com/jonmatonis/status/755099483210342400			
	Seriously, I think it's kinda borderline racist to say that being smart depends on your genes.	jonmatonis	0	0	1468863619	755094864212078592	https://twitter.com/jonmatonis/status/755094864212078592			
	Addressing this on your part implies finding a level of equality or redistribution. What am I missing here, Jamie?	jonmatonis	0	0	1468863308	755093562333683712	https://twitter.com/jonmatonis/status/755093562333683712			
	. @ jamie247 @ AlenaSatoshi Being smart has nothing to do with being lucky. The world needs underachievers as much as it needs overachievers.	jonmatonis	0	0	1468862994	755092244005126144	https://twitter.com/jonmatonis/status/755092244005126144			@ @
	Thanks for the quote, Roger.	jonmatonis	4	0	1468861822	755087327580397568	https://twitter.com/jonmatonis/status/755087327580397568			
	The Other Side of Microcredits http://www.bbc.com/news/world-asia-24128096 … via @ VICE	jonmatonis	1	9	1468859402	755077176391634946	https://twitter.com/jonmatonis/status/755077176391634946			@
	I disagree that wealth inequality is a driver of violence. Just look at Gandhi's peaceful movement for home-rule.	jonmatonis	0	0	1468843329	755009762626981888	https://twitter.com/jonmatonis/status/755009762626981888			
	You have stated that the world needs a fix and that wealth inequality may be a negative factor.	jonmatonis	0	0	1468842992	755008349167419392	https://twitter.com/jonmatonis/status/755008349167419392			
	What are you implying exactly? I've clarly stated my position.	jonmatonis	0	0	1468841964	755004039218114560	https://twitter.com/jonmatonis/status/755004039218114560			
	"Think of ""survival of the fittest"" as ""survival of the smartest"" # NAP"	jonmatonis	0	0	1468841751	755003145428754432	https://twitter.com/jonmatonis/status/755003145428754432		#	
	Adhering to NAP, individuals view govt interference in economy as coercively setting/enforcing preferences.	jonmatonis	0	0	1468841568	755002375362846720	https://twitter.com/jonmatonis/status/755002375362846720			
	It has unfortunately been misappropriated to justify violations of the libertarian non-aggression principle. # NAP	jonmatonis	0	0	1468841282	755001177780072449	https://twitter.com/jonmatonis/status/755001177780072449		#	
	Social Darwinism is based on Herbert Spencer philosophy of extending principles to social and economic level.	jonmatonis	0	0	1468841150	755000623544750080	https://twitter.com/jonmatonis/status/755000623544750080			
	I'm going to stay with this thread (which you started, btw). FYI, I like your other mostly non-sanctimonius tweets.	jonmatonis	0	0	1468840404	754997494812061696	https://twitter.com/jonmatonis/status/754997494812061696			
	I'm a social Darwinist. I don't think that natural (as opposed to govt-caused) wealth inequality is necessarily bad.	jonmatonis	1	0	1468838163	754988097020932096	https://twitter.com/jonmatonis/status/754988097020932096			
	Statistics can be twisted. Yours and mine. 62% of statistical facts are made up!	jonmatonis	0	0	1468838038	754987570585415680	https://twitter.com/jonmatonis/status/754987570585415680			
	40% of randomly lucky 1st-world Americans have less than $400 to their name.	jonmatonis	3	0	1468830467	754955814889070592	https://twitter.com/jonmatonis/status/754955814889070592			
	You are missing the point. It's not about statistics or geography or where you grow up. It's about the individual.	jonmatonis	2	0	1468830364	754955381827178496	https://twitter.com/jonmatonis/status/754955381827178496			
	Tell that to a young child in Nice, who may have thought she was growing up in one of your 'lucky' places.	jonmatonis	0	0	1468829944	754953621041655808	https://twitter.com/jonmatonis/status/754953621041655808			
	Steve Jobs was the son of a Syrian immigrant. Don't be condescending.	jonmatonis	0	0	1468829063	754949927113859072	https://twitter.com/jonmatonis/status/754949927113859072			
bitcoin 	I think 'beyond confiscation' and 'balance unknowability' are equally important to Bitcoiners.	jonmatonis	4	3	1468828760	754948655002492928	https://twitter.com/jonmatonis/status/754948655002492928			
	I just don't accept that fate is pre-determined and I don't subscribe to the victimization mindset.	jonmatonis	3	0	1468828610	754948025043161088	https://twitter.com/jonmatonis/status/754948025043161088			
	I guess 'random' or 'lucky' would have been better word choice than 'deserved'. Either way, it's far from random.	jonmatonis	1	0	1468827716	754944276555898880	https://twitter.com/jonmatonis/status/754944276555898880			
	Joe Sobran: Wanting another's money is need, wanting to keep your own is greed, politician's transfer is compassion.	jonmatonis	0	0	1468826089	754937453824184320	https://twitter.com/jonmatonis/status/754937453824184320			
	'wealth inequality' is a very inciteful term. It implies that said wealth is undeserved.	jonmatonis	1	0	1468825766	754936098271309824	https://twitter.com/jonmatonis/status/754936098271309824			
	Any opinions/comments after reading?	jonmatonis	0	0	1468823809	754927888919629824	https://twitter.com/jonmatonis/status/754927888919629824			
	Sure, smart doorknobs. My point is smartphone IP cores have already grown sensors -> becoming a generic IoT-or-mobile platform.	jgarzik	0	0	1468848608	755031903560933376	https://twitter.com/jgarzik/status/755031903560933376			
	ThePiachu on transactional currencies - aka entry credits or db access tokens - such as from @ factominc https://tpbit.blogspot.ca/2016/07/transactional-currencies-entry-credits.html … # blockchain	jgarzik	1	3	1468845939	755020711387885568	https://twitter.com/jgarzik/status/755020711387885568		#	@
	Look in your pocket for a heavily interconnected supercomputer...	jgarzik	0	0	1468845564	755019137148194816	https://twitter.com/jgarzik/status/755019137148194816			
	Labor opportunity attractiveness for # blockchain experts, ranked: 1. My startup (aka DIY) 2. Your startup 3. A big bank with big salaries.	jgarzik	10	12	1468845484	755018800316223488	https://twitter.com/jgarzik/status/755018800316223488		#	
	"Proving the words of my co-founder @ MatthewRoszak, ""JPMorgan lost two leaders on its # blockchain project"" http://qz.com/729786/jpmorgan-lost-two-leaders-on-its-blockchain-project/?utm_content=buffer02419&utm_medium=social&utm_source=linkedin.com&utm_campaign=buffer …"	jgarzik	6	7	1468845271	755017907176894464	https://twitter.com/jgarzik/status/755017907176894464		#	@
	. @ SoftBank to Buy @ ARMHoldings for More Than $32 Billion http://www.wsj.com/articles/softbank-agrees-to-buy-arm-holdings-for-more-than-32-billion-1468808434 … Heavy strategic focus on # IoT	jgarzik	1	4	1468845159	755017438526369792	https://twitter.com/jgarzik/status/755017438526369792		#	@ @
bitcoin 	“Blockchains are going to do for the financial sector what the internet did for daily life...” https://bitcoinmagazine.com/articles/funderbeam-launches-blockchain-based-trading-and-investment-platform-for-startups-1468691654 …	SunnyStartups	7	3	1468801819	754835657936277504	https://twitter.com/SunnyStartups/status/754835657936277504			
	One of my favorite parts in the book. Great takeaways :)	alextapscott	0	0	1468854281	755055697809768450	https://twitter.com/alextapscott/status/755055697809768450			
	Huh, pretty neat stuff!	alextapscott	2	2	1468854243	755055538359177216	https://twitter.com/alextapscott/status/755055538359177216			
	Will do. Thanks for connecting/ sharing this.	alextapscott	2	0	1468854193	755055328891400192	https://twitter.com/alextapscott/status/755055328891400192			
	Great to hear Keith.. Understanding the beginning is key to the bigger concepts we talk about later.	alextapscott	0	0	1468854160	755055193021177857	https://twitter.com/alextapscott/status/755055193021177857			
	Sweet, great to connect..	alextapscott	2	0	1468854050	755054731869949952	https://twitter.com/alextapscott/status/755054731869949952			
	Thanks for sharing this!	alextapscott	0	0	1468853906	755054125654667264	https://twitter.com/alextapscott/status/755054125654667264			
	Here's how the # blockchain will innovate # American politics! @ dtapscott & I sit down with @ TechCrunch to discuss:http://tcrn.ch/1Wt96Va	alextapscott	16	18	1468833876	754970113275629568	https://twitter.com/alextapscott/status/754970113275629568		# #	@ @
	Most # sunscreen products don't protect against UVA (cause of photo ageing & skin # cancer; UVB causes burns). Go full spectrum w/ zinc oxide.	DianacBiggs	1	1	1468878691	755158081928060928	https://twitter.com/DianacBiggs/status/755158081928060928		# #	
	Also avoid in # suncream: homosalate, octisalate, octocrylene, octinoxate (un-encapsulated). Look for Zinc Oxide for full UVA/UVB protection.	DianacBiggs	1	0	1468878536	755157431299309572	https://twitter.com/DianacBiggs/status/755157431299309572		#	
	# Heatwave PSA: Many # suncream pdts not both UVA/UVB; are endocrine disruptors, carcinogens: avoid benzophenone, avobenzone, oxybenzone...	DianacBiggs	0	0	1468878443	755157040503394304	https://twitter.com/DianacBiggs/status/755157040503394304		# #	
	Some examples of # blockchain infrastructure: @ 21dotco @ Coinprism @coluplatform @ chain etc	DianacBiggs	4	1	1468792931	754798376521203713	https://twitter.com/DianacBiggs/status/754798376521203713		#	@ @ @coluplatform @
	Here's What You Missed About the # blockchain and # PokemonGO at Brainstorm # tech https://www.google.com/url?rct=j&sa=t&url=http://fortune.com/2016/07/17/blockchain-pokemon-brainstorm-tech/&ct=ga&cd=CAEYACoTMTkwOTM3NTcyNzUyMzIxMzY0MDIaNTMzNjA2NWEzNWFjMDEzNDpjb206ZW46VVM&usg=AFQjCNEu5h9Zw9v_fXdtKLMBjUn4jrSS_A …	diiorioanthony	2	0	1468865352	755102134685855744	https://twitter.com/diiorioanthony/status/755102134685855744		# # #	
	Top 10 # startup at # innovation week to receive # funding https://www.google.com/url?rct=j&sa=t&url=http://www.standardmedia.co.ke/article/2000208915/top-10-start-ups-at-innovation-week-to-receive-funding&ct=ga&cd=CAEYAyoTMTkwOTM3NTcyNzUyMzIxNjA2NDIaZmVkM2RhYjY5NjJiMjU4NDpjb206ZW46VVM&usg=AFQjCNGsrfvvFx-cHQDysE0-qckIqeOuZQ …	diiorioanthony	2	2	1468853673	755053146804785152	https://twitter.com/diiorioanthony/status/755053146804785152		# # #	
	Just caught my first Pokemon! Little blighter was in my lounge so glad I got it before someone broke in.	robdgill	1	1	1468865212	755101547235778560	https://twitter.com/robdgill/status/755101547235778560			
	Huge deal which seems to have been aided if anything by Brexit - ARM chip designer to be bought by Japan's Softbank http://www.bbc.co.uk/news/business-36822806 …	robdgill	0	0	1468843355	755009872467484672	https://twitter.com/robdgill/status/755009872467484672			
	"Huge deal; ""Brexit may be turning into a deals bonanza for Asian buyers seeking quality franchises at decent prices"" http://www.bloomberg.com/gadfly/articles/2016-07-18/softbank-s-post-brexit-arm …"	robdgill	1	0	1468841395	755001649308045317	https://twitter.com/robdgill/status/755001649308045317			
	Unchartered territory. Again....Japan flirts with helicopter money http://flip.it/fLInO	robdgill	0	0	1468824111	754929156589322240	https://twitter.com/robdgill/status/754929156589322240			
	Low rates for ever? Or are the experts wrong – again? http://www.telegraph.co.uk/personal-banking/mortgages/low-rates-for-everor-are-the-expertswrong--again/ …	robdgill	0	0	1468823995	754928669940969472	https://twitter.com/robdgill/status/754928669940969472			
	Happy bday @ richardbransonpic.twitter.com/GXIZ5NL5vf	kgauravITC	1	0	1468853214	755051221627666432	https://twitter.com/kgauravITC/status/755051221627666432			@
	Making of the fee free cash transfer at its peek, join us in revolution. @ InnFin @ FTCInnovate @ sbcFinTechhttps://twitter.com/CashaaLtd/status/754992921531875328 …	kgauravITC	2	0	1468839912	754995430409248768	https://twitter.com/kgauravITC/status/754995430409248768			@ @ @
	‘I Feel a Deep Sense of Remorse,’ Donald Trump’s Ghostwriter Sayshttp://www.nytimes.com/2016/07/19/us/politics/trump-book-tony-schwartz.html?smid=fb-share …	Jose_Pagliery	4	2	1468875718	755145611847106560	https://twitter.com/Jose_Pagliery/status/755145611847106560			
	Police militarization at an all-time high. $50m in cops/weapons at # RNC will test US values. http://money.cnn.com/2016/07/17/news/cleveland-republicans-police/index.html?iid=hp-stack-dom …pic.twitter.com/FliVNXJ15f	Jose_Pagliery	3	3	1468867033	755109184295804928	https://twitter.com/Jose_Pagliery/status/755109184295804928		#	
	This is so weird.https://twitter.com/IvanaKottasova/status/755095308493688833 …	Jose_Pagliery	1	1	1468866460	755106779655208960	https://twitter.com/Jose_Pagliery/status/755106779655208960			
	The city of Cleveland has an army ready for the # RNCinCLE. http://money.cnn.com/2016/07/17/news/cleveland-republicans-police/index.html?iid=hp-stack-dom …pic.twitter.com/slo8Bc2LK0	Jose_Pagliery	5	8	1468862505	755090192302739456	https://twitter.com/Jose_Pagliery/status/755090192302739456		#	
	Christ.https://twitter.com/Deena_CNN/status/755071805312921600 …	Jose_Pagliery	0	0	1468858285	755072491899543553	https://twitter.com/Jose_Pagliery/status/755072491899543553			
	Just arrived in beautiful # Vienna to launch @ TheFINTECHBook in # Austria tomorrow @ predictrAI @ econob @ austriainukpic.twitter.com/mZrKWtkRZT	SusanneChishti	20	9	1468851365	755043467659739136	https://twitter.com/SusanneChishti/status/755043467659739136		# #	@ @ @ @
	my god are you feeling alright man? We must drink beer.	leashless	1	0	1468858543	755073574046732290	https://twitter.com/leashless/status/755073574046732290			
	@ sandelfordco hi!	leashless	0	0	1468854481	755056537140355072	https://twitter.com/leashless/status/755056537140355072			@
	:-)!	leashless	0	0	1468836280	754980198785900545	https://twitter.com/leashless/status/754980198785900545			
	I dread to think under what world conditions these remaining two facets of my work would fuse. But you know it's coming, as do I. # Prepare	leashless	5	0	1468836263	754980124043411457	https://twitter.com/leashless/status/754980124043411457		#	
	That leaves me with an Apocalypse Yogi (highly appropriate to a Shiva cult) and a Technology-and-Politics public identity. Workable.	leashless	9	0	1468836223	754979959710638084	https://twitter.com/leashless/status/754979959710638084			
	I've thinned down my number of functionally separate identities to two: merge disaster management and state failure and hexayurt and yogi.	leashless	17	1	1468836169	754979733377540096	https://twitter.com/leashless/status/754979733377540096			
	Making my way through the next turning of this strange and winding path. Things are so much stranger and more complicated than I remember.	leashless	9	0	1468836130	754979569728360448	https://twitter.com/leashless/status/754979569728360448			
	They are killing cops in America. You know. You known where this possibly goes.	leashless	6	0	1468812703	754881306840928256	https://twitter.com/leashless/status/754881306840928256			
	So I have very high hopes for your album, when the time comes.	leashless	1	0	1468807755	754860555748401152	https://twitter.com/leashless/status/754860555748401152			
	It takes a real knack to get something real out of songs which are cultural standards. Takes depth.	leashless	1	0	1468807736	754860476971048962	https://twitter.com/leashless/status/754860476971048962			
	"A peace song which is essentially ""you're a bastard but you're not worth killing"" in the original."	leashless	1	0	1468807709	754860360017010689	https://twitter.com/leashless/status/754860360017010689			
	https://www.youtube.com/watch?v=6JNq7bd0t4g&t=1m7s … is a Burns song done in Burns country *by people who actually get it*	leashless	1	0	1468807681	754860243188867073	https://twitter.com/leashless/status/754860243188867073			
	Looking forwards to it. You really have done something extraodinary there. As a point to compare...	leashless	1	0	1468807542	754859663284379648	https://twitter.com/leashless/status/754859663284379648			
	Tantric sex? Curious about Tantra? Read this one page web comic http://oglaf.com/rudiments/  (contains nudity) everything you need to understand!	leashless	4	0	1468807468	754859349592473601	https://twitter.com/leashless/status/754859349592473601			
	in the same numinous league as Scotcha's version of Ye Jacobites live in Hawick (my home town)	leashless	1	1	1468798114	754820117968592897	https://twitter.com/leashless/status/754820117968592897			
	fucking A. Anything I can do to help? That version of John Barleycorn is amazing.	leashless	1	1	1468797998	754819630313644032	https://twitter.com/leashless/status/754819630313644032			
	. @ CashaaLtd in CT Slovenia - podjetje, ki nudi mednarodna denarna nakazila http://cointelegraph.si/news/Cashaa%20-%20podjetje,%20ki%20nudi%20mednarodna%20denarna%20nakazila … # blockchain	BlockchainGirl	1	1	1468860613	755082255937236992	https://twitter.com/BlockchainGirl/status/755082255937236992		#	@
	See our new video how @ CashaaLtd works! # blockchainhttps://twitter.com/CashaaLtd/status/754992921531875328 …	BlockchainGirl	5	3	1468841993	755004160622354432	https://twitter.com/BlockchainGirl/status/755004160622354432		#	@
	Join @ CashaaLtd - we have more than 8000 traders in 119 countries/1012 cities & $1.2m exchanged! # blockchainhttps://twitter.com/krgauravITC/status/754995430409248768 …	BlockchainGirl	0	0	1468841942	755003945374867456	https://twitter.com/BlockchainGirl/status/755003945374867456		#	@
	Cash remittance @ CashaaLtd Powered by # blockchain, No Fee, No hidden exchange rates https://youtu.be/OBkRwU_qqjk  via @ YouTube	BlockchainGirl	0	0	1468841291	755001212978728960	https://twitter.com/BlockchainGirl/status/755001212978728960		#	@ @
	Schon gelesen? Erfolgsfaktoren in der Finanzdienstleistung http://bit.ly/2a3BGsN # studien	HLeichsenring	1	0	1468860174	755080417728950272	https://twitter.com/HLeichsenring/status/755080417728950272		#	
	Why Bad Employee Feedback Is Better Than None https://www.resourcefulmanager.com/employee-feedback/ … via @ resourcefulmgr # Leadership	HLeichsenring	1	2	1468839533	754993842227666944	https://twitter.com/HLeichsenring/status/754993842227666944		#	@
	Schon gelesen? 60 Sekunden im Web 2.0 unterwegs http://bit.ly/29SfqE1 # trends	HLeichsenring	0	0	1468831340	754959477703602177	https://twitter.com/HLeichsenring/status/754959477703602177		#	
	Man sollte nicht allen Videos auf YouTube vertrauen http://www.thewoolshedcompany.com/virals.html # fake # viral # videos	HLeichsenring	0	0	1468830366	754955393613180928	https://twitter.com/HLeichsenring/status/754955393613180928		# # #	
	Neu: Ein Roboter in der Bankfiliale -http://bit.ly/2a0T1E2 pic.twitter.com/nVkkS6yEH9	HLeichsenring	1	0	1468825410	754934604918816772	https://twitter.com/HLeichsenring/status/754934604918816772			
	Neu: Die aktuellen Top Trends bei Big Data -http://bit.ly/2a0yRdr pic.twitter.com/JMq5tacGvL	HLeichsenring	1	1	1468814254	754887812126760960	https://twitter.com/HLeichsenring/status/754887812126760960			
	Schon gelesen? 11 Merkmale einer erfolgreichen Bank der Zukunft http://bit.ly/29RD1EF	HLeichsenring	0	0	1468802537	754838670641926144	https://twitter.com/HLeichsenring/status/754838670641926144			
	In the future you will own nothing and have access to everything http://boingboing.net/2016/07/14/in-the-future-you-will-own-not.html …	Anne_Connelly	0	0	1468858198	755072126319628288	https://twitter.com/Anne_Connelly/status/755072126319628288			
