	"I don't believe I have ever used the phrase ""you people."" You're thinking of Ross Perot. Also, those two stmts don't conflict."	el33th4xor	0	0	1482116985	810683512814706688	https://twitter.com/el33th4xor/status/810683512814706688			
	there is no reason why ETC price cannot exceed ETH. Think big, little troll!	el33th4xor	3	0	1482112032	810662735402958848	https://twitter.com/el33th4xor/status/810662735402958848			
	thx! validation is covered by fees, provided by the xactions on each parallel chain. /cc @ aegencer	el33th4xor	1	0	1482110053	810654437492555777	https://twitter.com/el33th4xor/status/810654437492555777			@
	To me, this looks like an engagement platform that is not working.https://twitter.com/lopp/status/810542126765375494 …	el33th4xor	7	2	1482109111	810650486063960065	https://twitter.com/el33th4xor/status/810650486063960065			
	Latest news from @ MgcoolOfficial http://irishtechnews.net/ITN3/mgcool-aiming-to-create-a-high-level-camera-comparable-to-gopro-hero-5/ … @ SimonCocking @ Irish_TechNews # China # photography # actioncameraspic.twitter.com/G2k7I6z4Iu	SimonCocking	2	0	1482187169	810977882776412161	https://twitter.com/SimonCocking/status/810977882776412161		# # #	@ @ @
	From Shenzhen to Cape Clear,on an overcast December day https://capeclearbioblitz.wordpress.com/2016/12/13/from-shenzhen-to-cape-clearon-an-overcast-december-day/ … via @ CapeClearBioBtz	SimonCocking	3	2	1482186610	810975537829150720	https://twitter.com/SimonCocking/status/810975537829150720			@
	Startup tips with @ jmauldn http://irishtechnews.net/ITN3/pull-your-head-up-out-of-the-weeds-and-step-back-from-your-bubble-startup-tips-with-justin-mauldin/ … @ SimonCocking @ Irish_TechNews # Entrepreneur # startups # TechPR @ businessinsiderpic.twitter.com/Du5qSATEIO	SimonCocking	11	2	1482184778	810967855164510208	https://twitter.com/SimonCocking/status/810967855164510208		# # #	@ @ @ @
	AI, Banking, Blockchain, Fintech, and wider Innovation trends Fincheck CEO, Ruth Polachek - http://go.shr.lc/2i2BBev  via @ Irish_TechNews	SimonCocking	3	1	1482184094	810964988617748480	https://twitter.com/SimonCocking/status/810964988617748480			@
	Basking sharks up close and personal, pics and videos, Cape Clear https://sarahpaddleswim.wordpress.com/2016/06/28/basking-sharks-up-close-and-personal-pics-and-videos-cape-clear/ … via @aubreyramirez75	SimonCocking	10	6	1482183814	810963810446090240	https://twitter.com/SimonCocking/status/810963810446090240			@aubreyramirez75
	Great interview with @ rutipo http://irishtechnews.net/ITN3/ai-banking-blockchain-fintech-and-wider-innovation-trends-with-shecodes-founder-and-fincheck-ceo-ruth-polachek/ … # banking # fintech # AI @ SimonCocking @ Irish_TechNews @ TelAviv @ shecodes_pic.twitter.com/SDcHOFh6Zr	SimonCocking	8	1	1482166033	810889233284087808	https://twitter.com/SimonCocking/status/810889233284087808		# # #	@ @ @ @ @
	Does privacy still exist? Latest great article by @ OttLegalRebels http://irishtechnews.net/ITN3/does-privacy-still-exist-data-and-privacy-insights-with-marc-gagne/ … @ SimonCocking @ Irish_TechNews # privacy # datapic.twitter.com/H7Qs4yV8Pl	SimonCocking	3	10	1482162176	810873056541417473	https://twitter.com/SimonCocking/status/810873056541417473		# #	@ @ @
	Japan & Slush Tokyo for startups interview with @ asonninen fyi @ SlushAsia http://irishtechnews.net/ITN3/japanese-startup-insights-at-slush-tokyo-antti-sonninen-slush-asia-ceo-explains-more/ … @ SimonCocking @ Irish_TechNews @ SlushHQpic.twitter.com/5N3VXItFeZ	SimonCocking	10	8	1482160332	810865321204707328	https://twitter.com/SimonCocking/status/810865321204707328			@ @ @ @ @
	Interview with senior innovation lead @ Alon_Zed fyi u might like @ AskLloydsBank http://irishtechnews.net/ITN3/if-large-companies-want-to-stay-relevant-they-have-to-innovate-alon-zadka-senior-innovation-lead-lloyds-bank/ … @ SimonCocking @ Irish_TechNewspic.twitter.com/pIzhOLfywf	SimonCocking	7	5	1482155777	810846217089482752	https://twitter.com/SimonCocking/status/810846217089482752			@ @ @ @
	Why large companies need to innovate @ Alon_Zed @ unboundglobal http://irishtechnews.net/ITN3/if-large-companies-want-to-stay-relevant-they-have-to-innovate-alon-zadka-senior-innovation-lead-lloyds-bank/ … @ SimonCocking @ Irish_TechNews # unboundGlobalpic.twitter.com/LkkTjicMmU	SimonCocking	10	4	1482155136	810843527001337858	https://twitter.com/SimonCocking/status/810843527001337858		#	@ @ @ @
	unbound 2016: Driving Innovation Across Large Organisations https://youtu.be/4n1ovgUFMGE  via @ YouTube	SimonCocking	0	0	1482154687	810841646741000192	https://twitter.com/SimonCocking/status/810841646741000192			@
	What is truth in a digital world? Ralph Echemendia, ethical hacker interviewed - http://go.shr.lc/2gLsf5b  via @ Irish_TechNews	SimonCocking	8	9	1482154010	810838803577446400	https://twitter.com/SimonCocking/status/810838803577446400			@
	@ iamsanjayshah1 fyi you might like http://irishtechnews.net/ITN3/category/interviews/ … interested in featuring also? thanks @ SimonCocking @ Irish_TechNews	SimonCocking	0	0	1482139952	810779841842868224	https://twitter.com/SimonCocking/status/810779841842868224			@ @ @
	I tweet literally all the time for the people of # aleppo. read my feed before you judge, and Im Jewish! # onelove	GerberKawasaki	0	0	1482185638	810971463461154816	https://twitter.com/GerberKawasaki/status/810971463461154816		# #	
	Our prayers are with the dead, wounded and families in Germany. We will continue to fight this war against radical Islam & we will win.	GerberKawasaki	7	3	1482184266	810965709933056000	https://twitter.com/GerberKawasaki/status/810965709933056000			
	Looks familiar. # isis We must be careful now that they are almost defeated. This is all they have. Be vigilant, be safe.https://twitter.com/MailOnline/status/810950358235287552 …	GerberKawasaki	2	0	1482184142	810965190069993472	https://twitter.com/GerberKawasaki/status/810965190069993472		#	
	Here is my spot from @ cheddar today. Check it out for some investment ideas for 2017. That is if you care about making money. $ DIS $ FRC $ SMGhttps://twitter.com/cheddar/status/810953410992226304 …	GerberKawasaki	7	3	1482183949	810964379382390785	https://twitter.com/GerberKawasaki/status/810964379382390785			@
	On @ cheddar next tune in # CheddarLIVE # Stock # Bull $ dis $ SMG $ FRC	GerberKawasaki	5	3	1482180405	810949515461038080	https://twitter.com/GerberKawasaki/status/810949515461038080		# # #	@
	Will be on @ cheddar @12:50 TODAY. Discussing the stock market rally. Live on twitter http://ow.ly/Bynb307h4Qo # CheddarLIVE # stockmarket	GerberKawasaki	2	1	1482179259	810944709157855232	https://twitter.com/GerberKawasaki/status/810944709157855232		# #	@ @12
	# Russian ambassador to Turkey assassinated over genocide in # Syria # aleppo	GerberKawasaki	2	3	1482171896	810913824773541888	https://twitter.com/GerberKawasaki/status/810913824773541888		# # #	
	hitting 72* tomorrow. More like Abbott Kinney for me. # Venice # CA.	GerberKawasaki	1	0	1482158986	810859675646234624	https://twitter.com/GerberKawasaki/status/810859675646234624		# #	
	Yes. I tell the drivers that when I get in. Great for moral. That will be a long time coming. # uber	GerberKawasaki	2	0	1482158935	810859462911102976	https://twitter.com/GerberKawasaki/status/810859462911102976		#	
	How come @ marcuslemonis not on the show. We picked up some $ cwh and it's going nuts. Good numbers, management & business	GerberKawasaki	0	0	1482158879	810859226436206593	https://twitter.com/GerberKawasaki/status/810859226436206593			@
	How many great stock pickers from the Philly area with the same birthday and on @ CNBC ? Just us baby!	GerberKawasaki	0	0	1482158729	810858596233682944	https://twitter.com/GerberKawasaki/status/810858596233682944			@
	the payments to leagues are maxed. Players. Maxed. Cord cutting will trickle down. You're correct here as well.	GerberKawasaki	0	0	1482158652	810858273909813248	https://twitter.com/GerberKawasaki/status/810858273909813248			
	love your team. You're doing a great job. Will be on this afternoon. @ cheddar We're ready to do a tech/ENT LA show for you!	GerberKawasaki	2	0	1482158594	810858030954790913	https://twitter.com/GerberKawasaki/status/810858030954790913			@
	that's what I come up with. They lose money on every ride. Can they survive charging the correct amount? # uber	GerberKawasaki	0	0	1482158499	810857635180212224	https://twitter.com/GerberKawasaki/status/810857635180212224		#	
	A man of the people. # Trumphttps://twitter.com/mikeallen/status/810675331396931584 …	GerberKawasaki	1	0	1482158437	810857374680424448	https://twitter.com/GerberKawasaki/status/810857374680424448		#	
	haha. I agree with you. Mostly. We do have the same birthday.	GerberKawasaki	2	0	1482158390	810857176528863236	https://twitter.com/GerberKawasaki/status/810857176528863236			
	all of your ideas merge. All these things happen. We are first advisors using digital solutions. https://gerberkawasaki.com/team/ross-gerber …	GerberKawasaki	1	0	1482158343	810856980881416192	https://twitter.com/GerberKawasaki/status/810856980881416192			
	# stocks start slightly higher on the last full week of the year. Disney jumps $1.5 on the open on great results for # RogueOne $ dis	GerberKawasaki	3	0	1482158077	810855863254552576	https://twitter.com/GerberKawasaki/status/810855863254552576		# #	
	Digging into this book now. Excited for another Michael Lewis book. Always learn so much. Check it out.https://twitter.com/harvard/status/810851054590001156 …	GerberKawasaki	8	1	1482157665	810854135276781569	https://twitter.com/GerberKawasaki/status/810854135276781569			
	what should # Uber's valuation be? Try floating that dog. I bet less than half that number. # IPO # UBER # fail	GerberKawasaki	1	1	1482157602	810853870658154497	https://twitter.com/GerberKawasaki/status/810853870658154497		# # # #	
		GerberKawasaki	0	0	1482157510	810853487298756608	https://twitter.com/GerberKawasaki/status/810853487298756608			
	they don't need you. It's always great!	GerberKawasaki	0	0	1482157486	810853386073477121	https://twitter.com/GerberKawasaki/status/810853386073477121			
	Looking at a wintery 66* here in Santa Monica today. Got to love the polar vortex. Is that real or is it a climate change hoax?https://twitter.com/mattkellerabc7/status/810852164994297857 …	GerberKawasaki	3	1	1482157463	810853287788355588	https://twitter.com/GerberKawasaki/status/810853287788355588			
	Vanity Fair is a great magazine with amazing writing. One of the few I read. I recommend it. Use your airline miles. # Trump doesn't read.https://twitter.com/nytimes/status/810852222447812608 …	GerberKawasaki	5	1	1482157378	810852932497199105	https://twitter.com/GerberKawasaki/status/810852932497199105		#	
	they also sell ads. There could not be a better business than sports and # ESPN. What do people not get. Disney. $ dis # NBA # NFL	GerberKawasaki	1	1	1482157241	810852358095704064	https://twitter.com/GerberKawasaki/status/810852358095704064		# # #	
	they don't have any good metrics's for people's behavior. Phones. Bars. Streaming. Live. DVR. So many ways to get value.	GerberKawasaki	0	0	1482157152	810851982529347584	https://twitter.com/GerberKawasaki/status/810851982529347584			
	With so much diffusion in entertainment. Sports holds it all together. The most valuable properties for ad buyers. Live! Disney $ dis # NFL	GerberKawasaki	1	0	1482157092	810851732922085376	https://twitter.com/GerberKawasaki/status/810851732922085376		#	
	# ESPN makes $7 a sub on cable. Now they are going to be the main beneficiary of skinny bundle. Willl have killer BAM tech app. Disney $ dis	GerberKawasaki	3	2	1482157007	810851376137805824	https://twitter.com/GerberKawasaki/status/810851376137805824		#	
	I love these articles worrying about # ESPN. Then read # NBA game ratings are up huge. # ESPN has every bowl game, # NFL trending. # Disney $ dis	GerberKawasaki	3	1	1482156927	810851040731930624	https://twitter.com/GerberKawasaki/status/810851040731930624		# # # # #	
	Just reading about the Battle for Mosul. Looks like # isis is dug in and we'll supplied from # TURKEY! No # NATOhttp://www.nytimes.com/2016/12/18/world/middleeast/iraq-mosul-islamic-state.html?smprod=nytcore-iphone&smid=nytcore-iphone-share …	GerberKawasaki	1	0	1482156365	810848684376092672	https://twitter.com/GerberKawasaki/status/810848684376092672		# # #	
	@ modestproposal1 you have to look at your EPS estimates. # oil and # financials coming back. Tax reform. We think could be $140.	GerberKawasaki	1	0	1482156150	810847782655299584	https://twitter.com/GerberKawasaki/status/810847782655299584		# #	@
	@ modestproposal1 agree! The Trump bounce in rates made buying a home in America more expensive! Ave $250 per month so far.	GerberKawasaki	1	3	1482156083	810847501511077888	https://twitter.com/GerberKawasaki/status/810847501511077888			@
	Going to be on @ cheddar tomorrow afternoon. Going to be talking # stock ideas and of course Disney & # RogueOne Good year in front of us. $ dis	GerberKawasaki	7	3	1482113327	810668167328505856	https://twitter.com/GerberKawasaki/status/810668167328505856		# #	@
	Huge week for Disney & # RogueOne $155mil Dom. $136 mil for. $291 mil. # china still to come. $19 mil in # Imax gross. Big time! $ dis $ imax	GerberKawasaki	10	1	1482113219	810667715090206720	https://twitter.com/GerberKawasaki/status/810667715090206720		# # #	
	Challenger banks are failing to deliver better banking | Coffee Househttp://buff.ly/2gVz0PF	obussmann	2	2	1482176460	810932966364971008	https://twitter.com/obussmann/status/810932966364971008			
	Like & Share: My Weekly # FinTech Highlights http://cmun.it/RHNP3N pic.twitter.com/BxBnDkh2Dv	obussmann	1	0	1482166793	810892423056527360	https://twitter.com/obussmann/status/810892423056527360		#	
	Internet of Things: Opportunity for Financial Services? http://buff.ly/2gvVAwV # Fintech	obussmann	6	11	1482159120	810860238882607104	https://twitter.com/obussmann/status/810860238882607104		#	
	How artificial intelligence could change the face of business http://buff.ly/2gCmeJN  via @ wef # FinTech	obussmann	6	7	1482150060	810822237788008448	https://twitter.com/obussmann/status/810822237788008448		#	@
	Read & share my 5 Powerful Social Media Tips To Become A Thought Leader! http://cmun.it/SNMFTXM # Fintechpic.twitter.com/xMfn6COalu	obussmann	3	0	1482148364	810815125888319488	https://twitter.com/obussmann/status/810815125888319488		#	
	ICAP looks to process forex trades on # blockchainhttp://buff.ly/2hyNCri	obussmann	5	1	1482132660	810749257300971520	https://twitter.com/obussmann/status/810749257300971520		#	
	2017: The Year Regulators Engage with # Blockchain via @ blckchncnsltnghttp://buff.ly/2hyRVmc	obussmann	6	3	1482128812	810733115866021889	https://twitter.com/obussmann/status/810733115866021889		#	@
	Where the f is that bauble ... http://fb.me/8g4D49M9W	Chris_Skinner	1	0	1482162763	810875519252267008	https://twitter.com/Chris_Skinner/status/810875519252267008			
	Telling porkies on the blockchainhttp://blogs.wsj.com/cio/2016/12/16/wal-mart-readies-blockchain-pilot-for-tracking-u-s-produce-china-pork/?mod=djemCIO_h …	Chris_Skinner	3	0	1482154659	810841529216602112	https://twitter.com/Chris_Skinner/status/810841529216602112			
	Things worth reading: 19th December 2016 - Things we're reading today include ... Crunch time for troubled... http://fb.me/1rdKHNx3J	Chris_Skinner	0	1	1482139813	810779258897436672	https://twitter.com/Chris_Skinner/status/810779258897436672			
	The best FinTech research of 2016 via Chris Skinner's blog - Earlier this year, I summarised some ...http://tinyurl.com/gmfy6lm	Chris_Skinner	19	14	1482138353	810773134496464896	https://twitter.com/Chris_Skinner/status/810773134496464896			
	The best FinTech research of 2016 - Earlier this year, I summarised some of the best research papers that had... http://fb.me/56S5peCNB	Chris_Skinner	13	10	1482137250	810768507474419712	https://twitter.com/Chris_Skinner/status/810768507474419712			
	arrrrrh okay. Happy to oblige. DM @sarah_mikutel your address.	davidbrear	1	1	1482188055	810981601366732800	https://twitter.com/davidbrear/status/810981601366732800			@sarah_mikutel
	pic pic pic!!	davidbrear	1	0	1482180795	810951149704638464	https://twitter.com/davidbrear/status/810951149704638464			
	Check out my interview with @ HotTopicsHT https://twitter.com/hottopicsht/status/810844137259986945 …	davidbrear	7	6	1482157984	810855471779344384	https://twitter.com/davidbrear/status/810855471779344384			@
	How @ i_know_first selects investments using artificial intelligence http://bit.ly/2gQLszj # fintechpic.twitter.com/8QlnL98ZSz	davidbrear	5	11	1482128702	810732653863387136	https://twitter.com/davidbrear/status/810732653863387136		#	@
	6 Mistakes Your Business Makes To Protect Teams Against Cyber-Threats via @ Onion_ID http://bit.ly/2h1K41F # infosec	davidbrear	0	1	1482128640	810732397780172800	https://twitter.com/davidbrear/status/810732397780172800		#	@
	what's in the blocks? A fixed number of gold trades?	dgwbirch	0	0	1482185502	810970894306832384	https://twitter.com/dgwbirch/status/810970894306832384			
	it's not a Blockchain	dgwbirch	1	0	1482185279	810969957542612992	https://twitter.com/dgwbirch/status/810969957542612992			
bitcoin 	if Bitcoin is going to keep going up, why would anyone spend it?	dgwbirch	0	0	1482184438	810966429180850176	https://twitter.com/dgwbirch/status/810966429180850176			
	@ sytaylor @ CarstenStoecker @ cgledhill what will be in the blocks? Please explain.	dgwbirch	1	0	1482183219	810961317347598337	https://twitter.com/dgwbirch/status/810961317347598337			@ @ @
	The start of money.pic.twitter.com/MLS4rpl94O	dgwbirch	7	2	1482177529	810937452974186496	https://twitter.com/dgwbirch/status/810937452974186496			
	Money is a primitive form of memory, as they say. Well, as @kocherlakota009 sayspic.twitter.com/EtUFpODXl9	dgwbirch	1	0	1482175790	810930156407812096	https://twitter.com/dgwbirch/status/810930156407812096			@kocherlakota009
	Payments move value through space. Finance moves value through time.pic.twitter.com/QU8X2eHPok	dgwbirch	9	9	1482175311	810928149013921792	https://twitter.com/dgwbirch/status/810928149013921792			
	Oz	dgwbirch	0	0	1482174938	810926582835671041	https://twitter.com/dgwbirch/status/810926582835671041			
	What's the dog thing on Mastermind? No-one here even knows what to google.	dgwbirch	0	0	1482174721	810925672663306240	https://twitter.com/dgwbirch/status/810925672663306240			
	no it's completely different because in 1914 the American President, Wilson, was more focused on Mexico	dgwbirch	1	0	1482174679	810925496422793216	https://twitter.com/dgwbirch/status/810925496422793216			
	that's why I always log in as you...	dgwbirch	1	0	1482171317	810911395168522240	https://twitter.com/dgwbirch/status/810911395168522240			
	sadly it's factual, but as I blogged last week, it is also stupid, so I'm hopeful it won't happen	dgwbirch	0	0	1482169803	810905046720348160	https://twitter.com/dgwbirch/status/810905046720348160			
	Govt says that your porn habits will be secure, so no need to worry. Phew! Thank goodness.pic.twitter.com/6j4Popg3Hm	dgwbirch	4	0	1482169528	810903893572022274	https://twitter.com/dgwbirch/status/810903893572022274			
	Excuse me Mr. Stark, do you have a few minutes to hear the good news about THE BLOCKCHAIN?pic.twitter.com/a7iKawJKG6	dgwbirch	3	0	1482165766	810888114461818881	https://twitter.com/dgwbirch/status/810888114461818881			
	"New on Tomorrow's Transactions: The Consult Hyperion ""Live Five"" for 2017 http://buff.ly/2h2IGf2  and happy holidays to one and all"	dgwbirch	2	1	1482165421	810886666919571456	https://twitter.com/dgwbirch/status/810886666919571456			
	. @ BrianRoemmele wait, will Russian hackers now be able to hear what's going on in every hotel room in America?	dgwbirch	3	0	1482164765	810883913790976000	https://twitter.com/dgwbirch/status/810883913790976000			@
	if the reputation is real, what do you care whether it’s one person?	dgwbirch	1	1	1482164373	810882272471744513	https://twitter.com/dgwbirch/status/810882272471744513			
	what do you mean by “bogus” reputations?	dgwbirch	0	1	1482163803	810879878191005697	https://twitter.com/dgwbirch/status/810879878191005697			
	so people who have a plane they are not using will let you fly in it for a few days? Cool.	dgwbirch	0	0	1482163735	810879594844798976	https://twitter.com/dgwbirch/status/810879594844798976			
	Most Influential Blockchain People http://buff.ly/2gTHXrB  <- oh man, now I'm not even the top 100. Maybe I should stop calling it pants?	dgwbirch	6	1	1482163660	810879279986868225	https://twitter.com/dgwbirch/status/810879279986868225			
	Why is card issuing down by two-thirds in 2015?https://twitter.com/pesa_africa/status/810874784368181248 …	dgwbirch	1	1	1482162692	810875219363688448	https://twitter.com/dgwbirch/status/810875219363688448			
	and before you ask, no, I don't have anything better to do	dgwbirch	1	0	1482157649	810854067014602753	https://twitter.com/dgwbirch/status/810854067014602753			
	Top 10 Retail Banking Trends and Predictions for 2017 http://buff.ly/2hZV13Y  <- wot no blockchain?pic.twitter.com/HxyX6LS05c	dgwbirch	1	0	1482156717	810850157747175428	https://twitter.com/dgwbirch/status/810850157747175428			
	origin of the phrase is “umble pie” which, if memory serves, is made from offal. So I would look herehttp://www.frenchtoday.com/blog/les-abat-french-offal-organ-variety-meat-dishes …	dgwbirch	0	0	1482156631	810849798907695108	https://twitter.com/dgwbirch/status/810849798907695108			
	so it’s an old photo	dgwbirch	1	0	1482153696	810837487623032832	https://twitter.com/dgwbirch/status/810837487623032832			
	“card fraud totalled $21.84 billion globally in 2015, a 20.6% annual increase”http://buff.ly/2hI0WKl	dgwbirch	4	5	1482151562	810828539087949824	https://twitter.com/dgwbirch/status/810828539087949824			
	The lake near my house. Very peaceful.pic.twitter.com/gJmd2hc5cf	dgwbirch	3	0	1482149052	810818007895252996	https://twitter.com/dgwbirch/status/810818007895252996			
	“this will also prevent the customers from getting their cash looted by unscrupulous elements ” http://buff.ly/2hi6NTl # EndTheCashMenaceNow	dgwbirch	1	0	1482148121	810814104805969920	https://twitter.com/dgwbirch/status/810814104805969920		#	
	Facebook can manage a billion accounts, so the Bank of England can manage a hundred million or so. See @ NGruen1http://buff.ly/2gRQCeq	dgwbirch	6	6	1482147812	810812809642643456	https://twitter.com/dgwbirch/status/810812809642643456			@
	+1 # WessexSaysNohttps://twitter.com/cjenscook/status/810802514065031168 …	dgwbirch	3	0	1482147344	810810844598636544	https://twitter.com/dgwbirch/status/810810844598636544		#	
	Statistic of the day: sheep now outnumber people by three to one in Wales http://buff.ly/2hYRF0T	dgwbirch	3	0	1482146099	810805622874771456	https://twitter.com/dgwbirch/status/810805622874771456			
	"BBC ""You and Yours"" on instant payments fraud ""hundreds of millions of £££"" according to Payment Systems Regulatorhttp://buff.ly/2hSdzTr"	dgwbirch	1	1	1482138476	810773652237152256	https://twitter.com/dgwbirch/status/810773652237152256			
	“keynote speech by @ StevePannifer, who gives a great overview of the issues” http://buff.ly/2hGplh2  UBS Future of Finance # DigitalIdentity	dgwbirch	2	0	1482137341	810768888858365952	https://twitter.com/dgwbirch/status/810768888858365952		#	@
	You mean @ BitPesa ?https://twitter.com/pesa_africa/status/810749965706424320 …	dgwbirch	2	1	1482135633	810761726199205888	https://twitter.com/dgwbirch/status/810761726199205888			@
	you are much too kind Brian, but thanks	dgwbirch	1	0	1482135460	810761000014282752	https://twitter.com/dgwbirch/status/810761000014282752			
	look who's name came first	sytaylor	1	0	1482186553	810975301585010688	https://twitter.com/sytaylor/status/810975301585010688			
	and its Paxos bankchain, in which nodes with wallets send txn outputs of tokens to the active chain	sytaylor	2	0	1482186533	810975215266230275	https://twitter.com/sytaylor/status/810975215266230275			
	you're not a blockchain	sytaylor	1	0	1482186468	810974941948604420	https://twitter.com/sytaylor/status/810974941948604420			
ethereum 	my guess is that it's ethereum based...	sytaylor	0	0	1482185362	810970303413256193	https://twitter.com/sytaylor/status/810970303413256193			
	"that's huge... So much for blockchain being ""all hype"""	sytaylor	2	0	1482184817	810968020357148672	https://twitter.com/sytaylor/status/810968020357148672			
	Hugely significant! Euroclear pencils in 2017 for bullion on # blockchain roll out @ 11FSTeam https://www.finextra.com/newsarticle/29920/euroclear-pencils-in-2017-for-bullion-on-blockchain-roll-out … via @ Finextra	sytaylor	16	9	1482184796	810967929097486336	https://twitter.com/sytaylor/status/810967929097486336		#	@ @
	Inside Hyperledger's High-Stakes Game of Blockchain Marbles http://bit.ly/2hjWcqN  via @ CoinDesk	sytaylor	2	1	1482184636	810967258981945344	https://twitter.com/sytaylor/status/810967258981945344			@
bitcoin 	its hitting its trough like bitcoin did last year. Two different subjects tho. Next gen enterprise / permissionlsss world.	sytaylor	0	0	1482181824	810955466884923396	https://twitter.com/sytaylor/status/810955466884923396			
	good!	sytaylor	1	1	1482179652	810946354872807424	https://twitter.com/sytaylor/status/810946354872807424			
	if argue a type of platform.	sytaylor	0	0	1482141536	810786486899580928	https://twitter.com/sytaylor/status/810786486899580928			
	an epic roast dinner & my flat smelling like Christmas thank you x	sytaylor	1	0	1482102376	810622234540785664	https://twitter.com/sytaylor/status/810622234540785664			
