	hahahhahahaha hello? What do you think the CIA *is*? How many civilians have US troops killed since 9/11? Guantanamo bay? Hello?	leashless	1	0	1482137740	810770564512157696	https://twitter.com/leashless/status/810770564512157696			
	The 21st centuryhttps://twitter.com/RichardBSpencer/status/810635907216896000 …	leashless	5	1	1482106459	810639363688251392	https://twitter.com/leashless/status/810639363688251392			
	# TeamBlockchain!https://twitter.com/thomaspower/status/810864657619685376 …	BlockchainGirl	7	1	1482178227	810940380308996099	https://twitter.com/BlockchainGirl/status/810940380308996099		#	
	Neu: # Bankfiliale bleibt strategischer Kanal für ... -http://bit.ly/2i5QbxR # CustomerManagement # Digitalisierung # Kundenbeziehungpic.twitter.com/y9uHwuS5IK	HLeichsenring	0	0	1482141087	810784604298813440	https://twitter.com/HLeichsenring/status/810784604298813440		# # # #	
	Weihnachten für Banken und FinTechs: http://youtu.be/OLl8U4JB1fg?a  über @ YouTube	HLeichsenring	0	0	1482134910	810758694485065728	https://twitter.com/HLeichsenring/status/810758694485065728			@
	Neu: # Vertrauensverlust im Retail Banking hält an -http://bit.ly/2i53fn8 # Finanzbranche # Finanzdienstleister # Finanzkrisepic.twitter.com/qHktVq6OCb	HLeichsenring	0	0	1482122819	810707979183988736	https://twitter.com/HLeichsenring/status/810707979183988736		# # # #	
	Thanks for the lovely Christmas present @ KVCJarvis @ LuminousPR! # gin # LuminousTipplepic.twitter.com/5OupUcXYI2	emilyspaven	6	5	1482155057	810843194661470208	https://twitter.com/emilyspaven/status/810843194661470208		# #	@ @
bitcoin 	After the Most Notorious Data Breach Ever of Yahoo, are we moving to # blockchain based email systems ?https://news.bitcoin.com/blockchain-based-email-systems/ …	PaoloTasca	1	3	1482184223	810965528894439425	https://twitter.com/PaoloTasca/status/810965528894439425		#	
	This can be the first digital infrastructure for global markets built on # blockchain technology in 2017 https://www.google.co.uk/amp/s/amp.ft.com/content/7b1d986a-c507-11e6-8f29-9445cac8966f?client=safari …	DeanDemellweek	0	0	1482175419	810928601357058048	https://twitter.com/DeanDemellweek/status/810928601357058048		#	
	The Year in Review: The must-read article on how digital currency will change the world by @ brian_armstronghttps://blog.coinbase.com/how-digital-currency-will-change-the-world-310663fe4332?source=linkShare-9438b3ac0899-1482150749 …	DeanDemellweek	1	0	1482151834	810829680542621696	https://twitter.com/DeanDemellweek/status/810829680542621696			@
	Donald J. Trump # ttttt Tim's Twelve Tech Tweets to Trump #7. Bridge half the gap between market wage and minimum... http://fb.me/3swcZEQI8	TimDraper	1	0	1482109225	810650962184454144	https://twitter.com/TimDraper/status/810650962184454144		# #7	
	@ realdonaldtrump # ttttt 7. Bridge half the gap between market wage and minimum wage. Imposing a minimum discourages hiring. Robots win.	TimDraper	2	0	1482108771	810649058830389248	https://twitter.com/TimDraper/status/810649058830389248		#	@
	"Older Post worth reviewing: ""If your risk per trade is more than 1 to 2% of your capital, you are crazy.""http://buff.ly/2h0HQyl"	PeterLBrandt	89	33	1482176820	810934476482215940	https://twitter.com/PeterLBrandt/status/810934476482215940			
	pic.twitter.com/tsIbBkBPa6	PeterLBrandt	27	3	1482158341	810856971998007297	https://twitter.com/PeterLBrandt/status/810856971998007297			
	Thanks Adamhttps://twitter.com/from_10000ft/status/810105965714558976 …	PeterLBrandt	10	1	1482157808	810854734290522112	https://twitter.com/PeterLBrandt/status/810854734290522112			
	"A Premium Alert issued "" January Effect — Revised Update, December 18, 2016"". See http://zpr.io/PGh6b # Factormembers"	PeterLBrandt	3	0	1482153273	810835712165769217	https://twitter.com/PeterLBrandt/status/810835712165769217		#	
	What happens when a cup of boiling water is thrown into the air in MN in -28 degree F temperature? This...pic.twitter.com/o8FyinC2bg	PeterLBrandt	182	126	1482102043	810620840991723520	https://twitter.com/PeterLBrandt/status/810620840991723520			
	I want to use it but IDK if it's wise to run shell scripts written by a guy who gives presentations about underhanded code...	lopp	2	0	1482186483	810975005173579776	https://twitter.com/lopp/status/810975005173579776			
bitcoin 	A downtrend in Bitcoin blocks that didn't utilize their maximum capacity continued throughout 2016. http://p2sh.info/dashboard/db/blocksize-debate …pic.twitter.com/nru8UjpigQ	lopp	14	11	1482180381	810949411807395840	https://twitter.com/lopp/status/810949411807395840			
bitcoin 	It would be really cool if you could build a dynamically updated version of @ pwuille's UTXO value chart: http://bitcoin.sipa.be/utxo_size.png	lopp	0	0	1482176988	810935181368578053	https://twitter.com/lopp/status/810935181368578053			@
	New UTXO stats dashboards by @ khannib just went live at http://p2sh.info/dashboard/db/repartition …pic.twitter.com/Wo4KNkgf2G	lopp	7	4	1482176934	810934954326683648	https://twitter.com/lopp/status/810934954326683648			@
	I think it's pretty tiny, only a few percent.	lopp	0	0	1482176098	810931450950385664	https://twitter.com/lopp/status/810931450950385664			
bitcoin 	Looks like @coluplatform and @ BlockstackOrg created the most OP_RETURN bitcoin transactions in 2016. http://opreturn.org/ pic.twitter.com/VAQhyzMRBv	lopp	25	22	1482175547	810929138966138880	https://twitter.com/lopp/status/810929138966138880			@coluplatform @
bitcoin 	. @ wisemoe OP_RETURN enables developers to anchor into bitcoin's blockchain; it enables a variety of services.http://www.coindesk.com/bitcoin-the-trust-anchor-in-a-sea-of-blockchains/ …	lopp	8	6	1482175373	810928409757028353	https://twitter.com/lopp/status/810928409757028353			@
bitcoin 	Bitcoin OP_RETURN outputs created in: 2014: 13,000 2015: 655,000 2016: 1,040,000 http://p2sh.info/dashboard/db/op_return-statistics …	lopp	18	19	1482174915	810926488035950593	https://twitter.com/lopp/status/810926488035950593			
	Yeah, turns out all the github stats only look at whatever a repo's default master branch activity was.	lopp	1	0	1482174854	810926230446948352	https://twitter.com/lopp/status/810926230446948352			
	. @ BitGo has lofty goals for 2017 - we need more minds! Join me in helping users secure their crypto assets:https://bitgo.workable.com/	lopp	13	6	1482173509	810920588659326976	https://twitter.com/lopp/status/810920588659326976			@
	I struggled for a while trying to find better tools for pulling annual github stats. Gave up.	lopp	1	0	1482168706	810900443215921152	https://twitter.com/lopp/status/810900443215921152			
litecoin 	Upon closer inspection it looks like there is more dev activity than that, but not in litecoin's default github branch.	lopp	0	0	1482167837	810896799821135873	https://twitter.com/lopp/status/810896799821135873			
bitcoin litecoin ethereum 	2016 commits & merges: Bitcoin Core: 2466 Monero: 1609 Ethereum (Go): 1046 Bitcoin Unlimited: 608 Bitcoin Classic: 424 Dash: 35 Litecoin: 13	lopp	73	56	1482166981	810893208368672768	https://twitter.com/lopp/status/810893208368672768			
bitcoin 	"""Bitcoin is going to be the Switzerland [of the currency wars] even when Switzerland is no longer the Switzerland."" - @ aantonop"	lopp	41	16	1482112717	810665611818844164	https://twitter.com/lopp/status/810665611818844164			@
bitcoin 	Zhou is considering buying gold or bitcoin, which he can buy in China and sell for foreign currencies overseas.http://www.straitstimes.com/asia/east-asia/capital-flight-a-big-headache-for-beijing …	lopp	21	17	1482111799	810661759811993601	https://twitter.com/lopp/status/810661759811993601			
	Hmmm then does The DAO count as $160M, $0, or $100M ($ETC market cap)?	lopp	13	0	1482111419	810660166697885696	https://twitter.com/lopp/status/810660166697885696			
bitcoin 	Blockchain industry venture capital funding: 2012: $2.13M 2013: $95.05M 2014: $361.53M 2015: $490.48M 2016: $393.00Mhttp://www.coindesk.com/bitcoin-venture-capital/ …	lopp	22	17	1482108321	810647171276148736	https://twitter.com/lopp/status/810647171276148736			
bitcoin 	Current @ SlackHQ membership: @ AugurProject: 1403 # Bitcoin Core: 2331 # Bitcoin Classic: 1904 @21: 3631 @ openbazaar: 3532 @ storjproject: 5169	lopp	9	5	1482107328	810643007938658304	https://twitter.com/lopp/status/810643007938658304		# #	@ @ @21 @ @
	love it.	CryptoHustle	0	0	1482181329	810953390272499712	https://twitter.com/CryptoHustle/status/810953390272499712			
	Looks like the FOMO is starting to kick in on $ FCT.	CryptoHustle	7	4	1482181263	810953113528135681	https://twitter.com/CryptoHustle/status/810953113528135681			
	Ok, I can respect that.	CryptoHustle	0	0	1482179352	810945097147830272	https://twitter.com/CryptoHustle/status/810945097147830272			
	What's up with Polo listing NXC? They only raised $300K and don't have a working model yet. I can think of other coins more deserving.	CryptoHustle	10	3	1482178487	810941468185595906	https://twitter.com/CryptoHustle/status/810941468185595906			
	That said, that doesn't mean it will dump this year. :-)	CryptoHustle	0	0	1482166070	810889390700511232	https://twitter.com/CryptoHustle/status/810889390700511232			
	Historically the BTC markets dumped 3 years in a row in the months of Dec-Jan	CryptoHustle	0	0	1482166025	810889198228111360	https://twitter.com/CryptoHustle/status/810889198228111360			
	True and the prior year the markets were dead until massive capitulation the first week on Jan	CryptoHustle	2	0	1482165814	810888314333134848	https://twitter.com/CryptoHustle/status/810888314333134848			
	Sunset in Sarasota Bayhttps://www.pscp.tv/w/aycEVzMzNzA5fDFSREdsWURXUmVWSkxYjibkGCPB1sjJGL5dEqdXXwqVA49Kn1JQ9bIx2jnjIQ== …	CharlieShrem	3	5	1482186330	810974365454057472	https://twitter.com/CharlieShrem/status/810974365454057472			
	Boating in Sarasota Bayhttps://www.pscp.tv/w/aybqJDMzNzA5fDFaa0t6cXpkZG5YeHYsSGIQEKpCmmYfna6BBEpXqHtlZf-nyfM1z_ZAvbfRQw== …	CharlieShrem	1	3	1482179620	810946222940766208	https://twitter.com/CharlieShrem/status/810946222940766208			
	Exactly. I'm setting the bar for transparent and secure backed tokens. Using Blockchain tech for what it is. Giving int'l access to US mkt.https://twitter.com/mansa_godson/status/810655405210816512 …	CharlieShrem	7	0	1482114606	810673532988510212	https://twitter.com/CharlieShrem/status/810673532988510212			
bitcoin 	Most IMPORTANT article 2 read if you're publicly involved w/ # bitcoin & # cryptocurrency & haven't secured your phonehttp://blog.kraken.com/post/153209105847/security-advisory-mobile-phones …	cburniske	4	1	1482184376	810966168265748480	https://twitter.com/cburniske/status/810966168265748480		# #	
	"""6 predictions (and opportunities!) for people managers in 2017 "" https://www.linkedin.com/pulse/6-predictions-opportunities-people-managers-2017-rob-cahill … by @ robcahill10 on @ LinkedIn"	AriannaSimpson	3	4	1482182860	810959812242632704	https://twitter.com/AriannaSimpson/status/810959812242632704			@ @
	working on it, will keep you guys posted on the progress of the AMA	ToneVays	1	0	1482182174	810956935050776577	https://twitter.com/ToneVays/status/810956935050776577			
	Laramer won't be involved unless he want to ask questions like anyone else, working on a time later this week	ToneVays	0	0	1482179779	810946889835311104	https://twitter.com/ToneVays/status/810946889835311104			
	The amount of FAKE re-tweets on # Steemit/ # Steem post is unreal, every little thing about this non- # Blockchain scream # Scamhttps://twitter.com/JStuhlman/status/810918319754739712 …	ToneVays	3	1	1482179160	810944293699538945	https://twitter.com/ToneVays/status/810944293699538945		# # # #	
	why so many fake re-tweets?	ToneVays	2	0	1482178280	810940601076219904	https://twitter.com/ToneVays/status/810940601076219904			
	At the moment i'm thinking Thursday, like 7 or 8. I will try and get a co-host	ToneVays	1	0	1482176596	810933535850844160	https://twitter.com/ToneVays/status/810933535850844160			
	don't do anything yet, i'm still not sure if I care to do this	ToneVays	0	0	1482176522	810933228915847168	https://twitter.com/ToneVays/status/810933228915847168			
	I just don't want to be on steemit and i don't want to type out lengthy answers	ToneVays	2	0	1482176018	810931112960753664	https://twitter.com/ToneVays/status/810931112960753664			
	I don't want to be logged in, i can get a neutral party on to keep an eye on questions or I look	ToneVays	0	0	1482175491	810928904601042944	https://twitter.com/ToneVays/status/810928904601042944			
	they can post questions ahead of time either to my Twitter or on the comments to a Steemit post	ToneVays	1	0	1482174928	810926540427067392	https://twitter.com/ToneVays/status/810926540427067392			
	yeah i don't want that actually	ToneVays	0	0	1482174864	810926272398426113	https://twitter.com/ToneVays/status/810926272398426113			
	I don't want to sit & type all day, I would rather fire up a Google Hangout & have people ask in chat	ToneVays	3	0	1482174303	810923922082426881	https://twitter.com/ToneVays/status/810923922082426881			
	I guess but it's also about what they can/can't enforce.	ToneVays	0	0	1482174042	810922825443840000	https://twitter.com/ToneVays/status/810922825443840000			
	A co-worker 3 yrs ago going through # FBAR audit told me to be careful as it's a very wide measure.	ToneVays	0	0	1482173587	810920918247735298	https://twitter.com/ToneVays/status/810920918247735298		#	
	why would i do an AMA for a community that thinks # Steemit is the greatest thing in the world?	ToneVays	1	0	1482173278	810919619531837440	https://twitter.com/ToneVays/status/810919619531837440		#	
	I'm not creating a stemmit accnt nor reddit accnt	ToneVays	0	0	1482173097	810918860304089093	https://twitter.com/ToneVays/status/810918860304089093			
bitcoin 	Like children, unprepared # bitcoin(ers) will learn the hard way about # FBAR/ # FATCA, I tried warning everyone yrs ago https://cointelegraph.com/news/when-banks-become-law-enforcers-op …pic.twitter.com/N1fz2ewk6D	ToneVays	9	14	1482173000	810918454861660160	https://twitter.com/ToneVays/status/810918454861660160		# # #	
	Correct, I still do not know Content nor believe content is on a chain it's in a database	ToneVays	0	0	1482170645	810908578013937664	https://twitter.com/ToneVays/status/810908578013937664			
	I was not ready for debate on technical that Scammers make up as they go & then change after I scam busted original model	ToneVays	1	0	1482163990	810880665969459202	https://twitter.com/ToneVays/status/810880665969459202			
	An impromptu 'debate' over # Steem/ # Steemit, thank @ whalepool, it was not planned so ignore quality/organization https://soundcloud.com/whalepool/tone-vays-debates-ned-scott-and-dan-larimer-about-steemit …	ToneVays	7	6	1482153554	810836891981516800	https://twitter.com/ToneVays/status/810836891981516800		# #	@
bitcoin 	# StockMarket Analysis in about an hour at 9pm ET covering $ SPX $ INDU $ OIL $ GOLD $ BTCUSD $ EURUSD $ USD # Bitcoin, etc https://www.youtube.com/watch?v=88L-4048esY …	ToneVays	4	2	1482108721	810648848272162817	https://twitter.com/ToneVays/status/810648848272162817		# #	
	The true story of Nintendo's most wanted gamehttp://www.espn.com/espn/feature/story/_/id/18121761/the-true-story-nintendo-most-coveted-game …	tylerwinklevoss	3	0	1482105572	810635639569969152	https://twitter.com/tylerwinklevoss/status/810635639569969152			
	Set against the backdrop of a 5,000 year civilization? Sure. Temporaryhttps://twitter.com/YuanTalks/status/810852531685335040 …	BaldingsWorld	4	0	1482157490	810853402221625344	https://twitter.com/BaldingsWorld/status/810853402221625344			
	Samehttps://twitter.com/MichaelSchuman/status/810838263128788992 …	BaldingsWorld	8	3	1482157420	810853108767199234	https://twitter.com/BaldingsWorld/status/810853108767199234			
	MPA positive step. A. Believe it when I see it B. Been talking about deleveraging and managing WMPs for years. Call me skeptical	BaldingsWorld	0	0	1482157379	810852934934204416	https://twitter.com/BaldingsWorld/status/810852934934204416			
	Believe it when I see it. This would put some banks well beneath regulatory capital numbershttps://twitter.com/YuanTalks/status/810806588684562432 …	BaldingsWorld	9	3	1482154207	810839633596710912	https://twitter.com/BaldingsWorld/status/810839633596710912			
	other than letting China do whatever they want, what do you think they are?	BaldingsWorld	0	1	1482132084	810746843068006400	https://twitter.com/BaldingsWorld/status/810746843068006400			
	cheaper RMB will have minimal impact on exports	BaldingsWorld	0	0	1482130566	810740474218737664	https://twitter.com/BaldingsWorld/status/810740474218737664			
	yes, but the US isn't fixing against another currency. :)	BaldingsWorld	0	0	1482128891	810733448587517953	https://twitter.com/BaldingsWorld/status/810733448587517953			
	let me qualify that....unlikely in the near term 1-6 months	BaldingsWorld	1	0	1482127646	810728228180684804	https://twitter.com/BaldingsWorld/status/810728228180684804			
	let's just sit tight. Financially, they're winging it	BaldingsWorld	0	0	1482125391	810718768611622912	https://twitter.com/BaldingsWorld/status/810718768611622912			
	"My ""sum of all fears"" fear is currency decline leading to liquidity crunch leading to banking crisis. Still unlikely but something to watch https://twitter.com/noshortre/status/810647739398664192 …"	BaldingsWorld	5	4	1482124938	810716870307352576	https://twitter.com/BaldingsWorld/status/810716870307352576			
	raising children can be especially challenging in non-pennant/Superbowl contention years!	BaldingsWorld	1	0	1482124061	810713189658857472	https://twitter.com/BaldingsWorld/status/810713189658857472			
	Diamonds are fashionable but also an easy means of a) increasing fiber intake b) smuggling money out c) hard assethttps://www.bloomberg.com/news/articles/2016-12-18/diamonds-not-marriage-are-forever-for-china-s-millennials …	BaldingsWorld	1	4	1482123005	810708760792629248	https://twitter.com/BaldingsWorld/status/810708760792629248			
	"""Daddy, do the Cowboys always win?"" There are so many reasons I love my 5 year old daughter, questions like this are only one reason"	BaldingsWorld	6	0	1482122804	810707917557088257	https://twitter.com/BaldingsWorld/status/810707917557088257			
	Protip: you can never go wrong as a Chinese bank boosting growth estimate. You can get screwed lowering or keeping stable forecasthttps://twitter.com/YuanTalks/status/810684044858052608 …	BaldingsWorld	4	2	1482117212	810684465097928704	https://twitter.com/BaldingsWorld/status/810684465097928704			
	This is BIG: China now claiming jurisdiction beyond the 9 Dash line but keeping blaming Trump to fit your personal narrativehttps://twitter.com/BonnieGlaser/status/810667190345199617 …	BaldingsWorld	19	21	1482115576	810677601509457922	https://twitter.com/BaldingsWorld/status/810677601509457922			
	I keep trying to push the space guns on my daughters but no dice	BaldingsWorld	4	0	1482114802	810674354514182144	https://twitter.com/BaldingsWorld/status/810674354514182144			
	@ bill_easterly hits this point very well about the stereotypes people have about others. We're more than data points https://www.bloomberg.com/view/articles/2016-12-16/stereotypes-are-poisoning-american-politics …	BaldingsWorld	1	0	1482111007	810658438992855040	https://twitter.com/BaldingsWorld/status/810658438992855040			@
	Whether you like him or not, we need to move away from simplified one dimensional headline understanding of people http://www.realclearpolitics.com/articles/2016/12/18/smear_campaign_against_sessions_ignores_the_facts_132588.html …	BaldingsWorld	1	1	1482110911	810658034666131457	https://twitter.com/BaldingsWorld/status/810658034666131457			
	not even close. China militarizing SCS well before	BaldingsWorld	1	0	1482110295	810655450521812993	https://twitter.com/BaldingsWorld/status/810655450521812993			
	I am not Trump fan myself but to blame him for the Cold War with China is just fantasy	BaldingsWorld	1	0	1482109589	810652491746525184	https://twitter.com/BaldingsWorld/status/810652491746525184			
	strategist=sell side. Official=die side when bubble pops	BaldingsWorld	4	1	1482108622	810648433287725058	https://twitter.com/BaldingsWorld/status/810648433287725058			
	There is a new Cold War but it isn't because of Trump. This was happening well before Trump, he only brought the realizationhttps://twitter.com/FT/status/810620494030471169 …	BaldingsWorld	14	9	1482108261	810646919131308032	https://twitter.com/BaldingsWorld/status/810646919131308032			
	It may be ZH but that sums it up perfectlyhttps://twitter.com/zerohedge/status/810643573217656832 …	BaldingsWorld	5	4	1482108113	810646300567990272	https://twitter.com/BaldingsWorld/status/810646300567990272			
	A Christmas Story but incredible line https://en.wikipedia.org/wiki/A_Christmas_Story …	BaldingsWorld	1	0	1482107906	810645431139110912	https://twitter.com/BaldingsWorld/status/810645431139110912			
	Hence they are scorned and called terrible names.https://twitter.com/realdonaldtrump/status/810604216771284992 …	prchovanec	7	1	1482188253	810982431499190272	https://twitter.com/prchovanec/status/810982431499190272			
	So I can go back to sleep now? https://twitter.com/mattbova/status/810980516962910208 …	prchovanec	3	1	1482187952	810981169764384769	https://twitter.com/prchovanec/status/810981169764384769			
	"Thanks @ MTVNews for telling me to stop using the term ""woke"" just after I figured out what it means."	prchovanec	4	0	1482187752	810980330165379072	https://twitter.com/prchovanec/status/810980330165379072			@
	Because every day I wake up asking if this could possibly be real.https://twitter.com/merriamwebster/status/810977776375304192 …	prchovanec	4	1	1482187681	810980030838960128	https://twitter.com/prchovanec/status/810980030838960128			
	Slim majority of Japanese believe US would defend them. Most in Taiwan don't think so.http://www.gallup.com/poll/200012/mixed-reaction-asia-whether-defend.aspx?_source=World&g_medium=newsfeed&g_campaign=tiles …	prchovanec	21	22	1482187559	810979520824152064	https://twitter.com/prchovanec/status/810979520824152064			
	Trump literally could just run this as a campaign ad in 2020. https://twitter.com/mtvnews/status/810960588973035520 …	prchovanec	37	19	1482187145	810977784076058624	https://twitter.com/prchovanec/status/810977784076058624			
	To the spoils belong the victor. Or something like that.https://twitter.com/ananavarro/status/810975078582222848 …	prchovanec	5	2	1482186623	810975592992690176	https://twitter.com/prchovanec/status/810975592992690176			
	If this is the story, Turkey will resume demands for extradition, and off we go.https://twitter.com/reuters/status/810954135621304320 …	prchovanec	3	3	1482185046	810968981377052678	https://twitter.com/prchovanec/status/810968981377052678			
	Sigh. https://twitter.com/scott_kerr/status/810921857100738560 …	prchovanec	11	5	1482184712	810967577245663232	https://twitter.com/prchovanec/status/810967577245663232			
	As I often say: China has changed more, since my first visit there in 1986, than any other country I know.https://twitter.com/adam_tooze/status/810946965034926080 …	prchovanec	13	12	1482184652	810967327122620420	https://twitter.com/prchovanec/status/810967327122620420			
	Well that sounds like justice.https://twitter.com/reuters/status/810881312152092673 …	prchovanec	4	0	1482164272	810881848758980609	https://twitter.com/prchovanec/status/810881848758980609			
	Apparently a popular drink among Russian poor, according to the article.https://twitter.com/financialtimes/status/810880828964306945 …	prchovanec	1	2	1482164158	810881370675363840	https://twitter.com/prchovanec/status/810881370675363840			
	China and Norway reopen ties, start free trade negotiations after 6-year chill over dissident's Nobel Peace Prize http://mobile.nytimes.com/2016/12/19/world/europe/china-norway-nobel-liu-xiaobo.html?_r=0&referer=https://www.google.com/ …	prchovanec	1	0	1482163672	810879331694166016	https://twitter.com/prchovanec/status/810879331694166016			
	The number of people involved in Trump's transition team who have advocated that the US should consider quitting WTO is remarkable.	prchovanec	7	6	1482163487	810878555907301376	https://twitter.com/prchovanec/status/810878555907301376			
	Yes, it's international waters.https://twitter.com/jaketapper/status/810860256016429056 …	prchovanec	2	0	1482162223	810873253044645888	https://twitter.com/prchovanec/status/810873253044645888			
	Note.https://twitter.com/economistmeg/status/810726862817206272 …	prchovanec	1	2	1482155980	810847069615378432	https://twitter.com/prchovanec/status/810847069615378432			
	"Our slogan is ""Keep it under wraps"", and our first major customer is China's financial system."	prchovanec	6	3	1482154836	810842269284794368	https://twitter.com/prchovanec/status/810842269284794368			
	I'm going to start a packaging company called Pandora. Taking orders now.	prchovanec	15	6	1482154175	810839497676099584	https://twitter.com/prchovanec/status/810839497676099584			
	"As I do every day, I asked my twin 3 year-old girls what animal they are today. One said ""bandaid"" the other ""Xmas tree"". Insubordination."	prchovanec	21	1	1482154045	810838953016299520	https://twitter.com/prchovanec/status/810838953016299520			
	thanks. Someone able to recognize and appreciate the distinction.	prchovanec	1	0	1482153111	810835033783156736	https://twitter.com/prchovanec/status/810835033783156736			
	I never predicted China's currency wouldn't be allowed to weaken. But I have argued, strenuously, that it shouldn't.https://twitter.com/business/status/810767897173823488 …	prchovanec	6	1	1482153035	810834714818908160	https://twitter.com/prchovanec/status/810834714818908160			
