	#162 – The best way to deal with stress http://dab.25stories.org/162	julianhosp	0	0	1470747661	762997109389926400	https://twitter.com/julianhosp/status/762997109389926400		#162	
	Do you like Audio Books? Check out this one... It is my favourite :D http://amzn.to/28R79ir # audible # audiobook # books	julianhosp	0	0	1470744158	762982418869542912	https://twitter.com/julianhosp/status/762982418869542912		# # #	
	Durch diesen coolen Trick erinnere ich mich selbst an meine Ziele http://bit.ly/28NRHBG pic.twitter.com/QfDUKLEBqu	julianhosp	0	0	1470726086	762906616937275392	https://twitter.com/julianhosp/status/762906616937275392			
	#162 – Einer der besten Wege wie man mit Stress umgeht http://tab.25geschichten.de/162	julianhosp	0	0	1470715321	762861467062276096	https://twitter.com/julianhosp/status/762861467062276096		#162	
	Would the glass break? http://www.25stories.org/#!Would-the-glass-break-Julians-Daily-Audio-Blog-DAB-Podcast-136/zq64b/577de7fe0cf2e63d265f9790 … # glass # consciouspic.twitter.com/iG1gCQ0jdc	julianhosp	0	0	1470711788	762846649127346177	https://twitter.com/julianhosp/status/762846649127346177		# # #	
	#162 – The best way to deal with stress http://dab.25stories.org/162	julianhosp	0	0	1470693632	762770495485972485	https://twitter.com/julianhosp/status/762770495485972485		#162	
bitcoin 	". @ jonhbit ""hacks"" @ medialab vending machine w/ Raspberry Pi, bitcoin QR. Will sell his excess food while on vacationpic.twitter.com/xpP1npBDTy"	mikejcasey	14	4	1470773328	763104764141985793	https://twitter.com/mikejcasey/status/763104764141985793			@ @
	Brave, le navigateur gonflé qui rémunère les internautes et fait bondir les médias https://www.facebook.com/notes/pierre-tran/brave-le-navigateur-gonfl%C3%A9/10157190132210537/ …pic.twitter.com/4SqZNioqVq	PierreTran	6	6	1470766399	763075701721268224	https://twitter.com/PierreTran/status/763075701721268224			
	New rules in the UK to improve # competition (making it easier for new entrants (in 2018) # fintech # openbanking https://lnkd.in/bJWWmzW	AntonioSelas	0	1	1470774450	763109470201274368	https://twitter.com/AntonioSelas/status/763109470201274368		# # #	
bitcoin 	UK Legislators Cast Critical Eye on # Bitcoin and # Blockchainhttps://lnkd.in/eKsW6Yr	AntonioSelas	0	1	1470755104	763028327540019200	https://twitter.com/AntonioSelas/status/763028327540019200		# #	
	# Fintech not a threat? We'll seehttps://twitter.com/miguelselas/status/762955401281298432 …	AntonioSelas	1	0	1470753383	763021111101718528	https://twitter.com/AntonioSelas/status/763021111101718528		#	
	Another example of the potential uses of # blockchain via @ americanbanker # fintechhttps://lnkd.in/e82evvN	AntonioSelas	1	3	1470727107	762910898545491968	https://twitter.com/AntonioSelas/status/762910898545491968		# #	@
	Will deposit accounts be the next wave of # fintech innovation? https://dailyfintech.com/2016/07/20/will-deposit-accounts-be-the-next-wave-of-fintech-innovation/ … vía @ dailyfintech	AntonioSelas	0	0	1470725091	762902445248970752	https://twitter.com/AntonioSelas/status/762902445248970752		#	@
	"# Fintech @ Stratfor: "" # Blockchain will have a greater impact than the cryptocurrencies derived from it"". I've no doubt!"	AntonioSelas	0	0	1470698298	762790066741706752	https://twitter.com/AntonioSelas/status/762790066741706752		# #	@
	El crowdlending se acelera como alternativa al crédito bancario # fintech http://cincodias.com/cincodias/2016/08/05/mercados/1470417868_752981.html … vía @	AntonioSelas	0	1	1470695011	762776281255645184	https://twitter.com/AntonioSelas/status/762776281255645184		#	@
	いわゆるカジノ法案を秋の国会で通したい、と山本地方創生相が発言。ネックだった公明党も理解を取り付けた、としています。http://on.wsj.com/2bb0Kya  via @ misssaxbys	mochi_wsj	12	8	1470744253	762982814526550017	https://twitter.com/mochi_wsj/status/762982814526550017			@
	A Japanese cabinet member says the government hopes to pass casino bills this fall. Really? http://on.wsj.com/2bb0Kya  via @ misssaxbys	mochi_wsj	2	0	1470744019	762981834971951104	https://twitter.com/mochi_wsj/status/762981834971951104			@
	Due to tough competitions from China and South Korea, Japan Display taps a government fund for support to survivehttp://on.wsj.com/2bb6OKB	mochi_wsj	2	2	1470743531	762979788243898369	https://twitter.com/mochi_wsj/status/762979788243898369			
	Japan Display's new smartphone panel with ultra-thin bezel on four sides. Previously, three was max due to wiring.pic.twitter.com/z8ABJb8MDN	mochi_wsj	18	10	1470736282	762949382542983168	https://twitter.com/mochi_wsj/status/762949382542983168			
	OLEDに対しLCDの優位性に自信をみせるJDI。4辺全てで超狭額縁を実現したLCDを発表、多彩なスマホデザインへの対応はOLEDに引けを取らないと主張。写真はモック。一緒に写っているiPhoneとサイズは同等。本物は写真撮影NG。pic.twitter.com/jNFldzENNM	mochi_wsj	22	46	1470734711	762942794461646848	https://twitter.com/mochi_wsj/status/762942794461646848			
	ジャパンディスプレイ本間CEO。決算会見にて。LCDへの変わらぬ自信を箇所箇所でにじませる。例えばVR。VRは現状OLEDが主流だが、「画質は良い、反応スピードもOLEDと変わらなくなってきた」と。	mochi_wsj	5	4	1470731535	762929473796714496	https://twitter.com/mochi_wsj/status/762929473796714496			
	We've all heard the saying: It's not what you know but who you know...pic.twitter.com/hmFp1PiLz0	SafarazAli	18	14	1470761935	763056980227420164	https://twitter.com/SafarazAli/status/763056980227420164			
	Good list of upcoming App Coins: https://cyber.fund/radar	FEhrsam	100	112	1470719734	762879975586275328	https://twitter.com/FEhrsam/status/762879975586275328			
	A true hero wouldn't so readily jump to be an apologist for the State, ala @ paulkrugman	jonmatonis	2	0	1470764618	763068230973919234	https://twitter.com/jonmatonis/status/763068230973919234			@
bitcoin 	UK Gambling Commission to allow digital currency in online betting http://esportsobserver.com/uk-gambling-committee-allow-virtual-currency-online-betting/ … via @ sweetpotatoes @ CubitsBTC # bitcoin	jonmatonis	10	16	1470752950	763019294980575232	https://twitter.com/jonmatonis/status/763019294980575232		#	@ @
	Seems familiar...https://twitter.com/AsteroidEnergy/status/762774926533201920 …	jgarzik	3	0	1470773718	763106399194722304	https://twitter.com/jgarzik/status/763106399194722304			
	@ BenedictEvans @ CNBCnow Well, don't centralize in one location, even with backup power. Hello cloud...	jgarzik	0	0	1470771195	763095818601717760	https://twitter.com/jgarzik/status/763095818601717760			@ @
bitcoin 	Apple users can now trade bitcoins on Unocoin mobile app - EconoTimeshttp://www.econotimes.com/Apple-users-can-now-trade-bitcoins-on-Unocoin-mobile-app-253015 …	SunnyStartups	4	3	1470755644	763030593554767872	https://twitter.com/SunnyStartups/status/763030593554767872			
bitcoin 	Unocoin Launches Bitcoin Trading App for Apple Usershttp://www.newsbtc.com/2016/08/08/unocoin-launches-bitcoin-trading-app-apple-users/ …	SunnyStartups	1	1	1470749644	763005427147743233	https://twitter.com/SunnyStartups/status/763005427147743233			
	# Trump:stock market ‘a big bubble.’ He must have read summer # TrendsJournal & # TRENDALERT®:Central # banks shooting blanks. # Gold Bull Run	geraldcelente	18	7	1470773202	763104237924605952	https://twitter.com/geraldcelente/status/763104237924605952		# # # # #	
	TOP TREND: MID-YEAR UPDATE: The Last World War The telling truth: No place for peace on world stagehttp://trendsresearch.com/trends-journal/	geraldcelente	5	4	1470772875	763102863857975296	https://twitter.com/geraldcelente/status/763102863857975296			
	Central Command: US Dramatically Escalates Role Supporting # Saudi # Bombing of # Yemen. Bravo # Obama the # Nobel Piece of Crap prize winner	geraldcelente	25	32	1470762540	763059515671609346	https://twitter.com/geraldcelente/status/763059515671609346		# # # # #	
	Heading to WW3. Media and NATO pushing lies on Russian aggression - moving closer to last world war. http://kingworldnews.com/exclusive-gerald-celente-sneak-peek-remarkable-top-trends-2017-can-profit/ …	geraldcelente	21	36	1470754873	763027360102936576	https://twitter.com/geraldcelente/status/763027360102936576			
	Republican security experts attack # Trump. GC: Expert assholes who start # wars/kill millions & lose every # war they started @ realDonaldTrump	geraldcelente	14	21	1470744049	762981958725013505	https://twitter.com/geraldcelente/status/762981958725013505		# # #	@
	Industrial Age is dead. This is the Robotic Age.Find out how virtual reality will lead in education @ KingWorldNews http://kingworldnews.com/exclusive-gerald-celente-sneak-peek-remarkable-top-trends-2017-can-profit/ …	geraldcelente	15	11	1470708029	762830879454560257	https://twitter.com/geraldcelente/status/762830879454560257			@
	Today's Trends in the News: Banks In Trouble. Proof: Obama Wrong Againpic.twitter.com/aY9JbYAd57	geraldcelente	17	14	1470706725	762825411516596224	https://twitter.com/geraldcelente/status/762825411516596224			
	TREND ALERT®: Central banks shooting blanks. Gold’s Bull Run. http://trendsresearch.com/trend-alerts/ pic.twitter.com/FYa2O5hR2a	geraldcelente	7	17	1470704457	762815897748795392	https://twitter.com/geraldcelente/status/762815897748795392			
	Find out which trend in 2017 will shock the world according to Gerald Celente @ KingWorldNews http://kingworldnews.com/exclusive-gerald-celente-sneak-peek-remarkable-top-trends-2017-can-profit/ …	geraldcelente	6	3	1470700832	762800695577808896	https://twitter.com/geraldcelente/status/762800695577808896			@
	Sneak Peek At 2017 Top Trends: Robotization is taking over @ KingWorldNews http://kingworldnews.com/exclusive-gerald-celente-sneak-peek-remarkable-top-trends-2017-can-profit/ …	geraldcelente	4	6	1470693631	762770490662453248	https://twitter.com/geraldcelente/status/762770490662453248			@
	@ OlgaFeldmeier in Moscow this weekhttps://twitter.com/olgafeldmeier/status/762384019115868162 …	wences	0	1	1470720047	762881289498140677	https://twitter.com/wences/status/762881289498140677			@
	It's volcanoes! It's # IoT! I'm going to be watching this with baited breath! Best of luck @ sam_cossman http://money.cnn.com/2016/08/05/technology/volcano-wifi/index.html … # insurtech	charliehalkett	2	0	1470756668	763034886802399233	https://twitter.com/charliehalkett/status/763034886802399233		# #	@
	On-demand drone insurance. $10 an hour. Interesting bus model. Will people remember to activate? # instech # IoThttps://twitter.com/ChristofGellan/status/762946558648123392 …	charliehalkett	2	3	1470743988	762981703862390785	https://twitter.com/charliehalkett/status/762981703862390785		# #	
	The most interesting thing about this is how tech changes behaviour, even in crisis http://fortune.com/2016/08/06/tesla-autopilot-hospital-rescue/ … # insurtech # ConnectedCar # IoT	charliehalkett	1	2	1470734668	762942612730998785	https://twitter.com/charliehalkett/status/762942612730998785		# # #	
	Whatever happened to the dashing 40s film star Red Herring?	charliehalkett	0	0	1470734226	762940761209995264	https://twitter.com/charliehalkett/status/762940761209995264			
	Man having heart attack gets Tesla to drive to A&E.Amazing story!But safer than ambulance? Doubt it. http://fortune.com/2016/08/06/tesla-autopilot-hospital-rescue/ … # IoT # insurtech	charliehalkett	0	0	1470734134	762940371735314432	https://twitter.com/charliehalkett/status/762940371735314432		# #	
	@ futurism.... And it doesn't give insurance companies much time to understand the risks! # insurtech # Iot # insurance	charliehalkett	3	0	1470727899	762914222246354944	https://twitter.com/charliehalkett/status/762914222246354944		# # #	@
	@ futurism the future is coming up fast! But will our infrastructure be anywhere near ready? # autonomous	charliehalkett	0	1	1470727855	762914036631609344	https://twitter.com/charliehalkett/status/762914036631609344		#	@
	Sorry, I can't resist these - if I can't be in Rio, I can at least relive # FakeOlympicHistoryhttps://twitter.com/dogcopG2/status/762351422557990914 …	michaelterpin	6	3	1470774711	763110564520267776	https://twitter.com/michaelterpin/status/763110564520267776		#	
	How do we learn from the future?https://lnkd.in/eC2ebeH	gpn01	0	0	1470726921	762910119793266688	https://twitter.com/gpn01/status/762910119793266688			
bitcoin 	Interested in my thoughts on the Bitfinex hack?? I comment on it here:http://bankinnovation.net/2016/08/another-day-another-bitcoin-after-the-bitfinex-hack/ …	alextapscott	7	1	1470773032	763103525421318144	https://twitter.com/alextapscott/status/763103525421318144			
	The impact of # Blockchain will go beyond financial services. @ dtapscott and I write for @ HarvardBiz:https://hbr.org/2016/05/the-impact-of-the-blockchain-goes-beyond-financial-services# …	alextapscott	43	40	1470766640	763076712720719872	https://twitter.com/alextapscott/status/763076712720719872		# #	@ @
	In case you missed it - 10 things you need to know about # Blockchain!https://twitter.com/dtapscott/status/762640966800986112 …	alextapscott	2	1	1470765993	763073999089741824	https://twitter.com/alextapscott/status/763073999089741824		#	
	I was very honored to speak about # BlockchainRevolution at @ googletalks! In case you missed it check it out here: https://lnkd.in/ezMVbuC	alextapscott	15	9	1470756484	763034116426231809	https://twitter.com/alextapscott/status/763034116426231809		#	@
	Check out this cool info graphic! Thanks for sharing @ evankirstel!https://twitter.com/evankirstel/status/762910052328046592 …	alextapscott	0	3	1470755832	763031380704038912	https://twitter.com/alextapscott/status/763031380704038912			@
	http://www.forbes.com/sites/alextapscott/2016/08/08/the-internet-of-things-needs-a-ledger-of-things/#7c7df22739ee … try this one!	alextapscott	0	0	1470755682	763030753005502468	https://twitter.com/alextapscott/status/763030753005502468		#7c7df22739ee	
bitcoin 	The Internet of Things needs a ledger of things- How # blockchain can animate the physical world # IOT # Bitcoin http://www.forbes.com/sites/alextapscott/2016/08/08/the-internet-of-things-needs-a-ledger-of-things/#537c76e39ee9 …	alextapscott	129	138	1470751133	763011673430962176	https://twitter.com/alextapscott/status/763011673430962176		# # # #537c76e39ee9	
	My latest in @ Forbes: How # Blockchain can help The Internet of Things depend on a Ledger of Things http://www.forbes.com/sites/alextapscott/2016/08/08/the-internet-of-things-needs-a-ledger-of-things/#397b9b3939ee …	alextapscott	17	11	1470693971	762771916604203009	https://twitter.com/alextapscott/status/762771916604203009		# #397b9b3939ee	@
	# InternetOfThings Needs A Ledger of Things https://www.google.com/url?rct=j&sa=t&url=http://www.forbes.com/sites/alextapscott/2016/08/08/the-internet-of-things-needs-a-ledger-of-things/&ct=ga&cd=CAEYACoTNDU3NjI3ODEyNzM3MTMwNjc3MTIZNTgyNWFhYTk5YmRkZDQ0ODpjYTplbjpDQQ&usg=AFQjCNH_4gNLvKNh62zCqqGLh7zBxbUB4g …	diiorioanthony	4	2	1470768203	763083267570622464	https://twitter.com/diiorioanthony/status/763083267570622464		#	
bitcoin 	# Bitcoin Wallets Removed from # Apple # App Store After Users Reported Stolen Fundshttp://news.softpedia.com/news/suspicious-bitcoin-wallets-taken-down-from-the-apple-app-store-507095.shtml#ixzz4Gr1sqXGg …	diiorioanthony	4	1	1470761112	763053526574661632	https://twitter.com/diiorioanthony/status/763053526574661632		# # # #ixzz4Gr1sqXGg	
	UK Visitor Numbers Boosted By Slump In Pound http://news.sky.com/story/uk-visitor-numbers-boosted-by-slump-in-pound-10528319 … # brexit	TonyGallippi	0	0	1470759106	763045111848632320	https://twitter.com/TonyGallippi/status/763045111848632320		#	
	What a great game Rugby 7s is. If only I'd actually watched any on the three occasions I've been to the Hong Kong 7s # RioOlympics2016	robdgill	3	0	1470778136	763124933203492864	https://twitter.com/robdgill/status/763124933203492864		#	
	BOE Can’t Find Enough Sellers as QE Operation Falls Short http://bloom.bg/2bgA8uX	robdgill	0	0	1470760185	763049638651977797	https://twitter.com/robdgill/status/763049638651977797			
	Fascinating interview with one of the most interesting CEOs around, Tidjane Thiam of Credit Suisse with @ flacquahttps://www.bloomberg.com/features/2016-tidjane-thiam-interview/ …	robdgill	2	1	1470728884	762918354814398465	https://twitter.com/robdgill/status/762918354814398465			@
	BOE's McCafferty says more rate cuts on way if economy worsens -Times http://reut.rs/2aHDuvr	robdgill	1	0	1470722421	762891245169410050	https://twitter.com/robdgill/status/762891245169410050			
	Thanks for mention @ BlockchainGirlhttps://twitter.com/BlockchainGirl/status/762954364285747200 …	kgauravITC	2	0	1470745503	762988058165833728	https://twitter.com/kgauravITC/status/762988058165833728			@
bitcoin 	Interview with @ bitcoinhttps://news.bitcoin.com/cashaa-free-p2p-global-unbanked/ …	kgauravITC	3	0	1470744084	762982106645590016	https://twitter.com/kgauravITC/status/762982106645590016			@
	wait and see how this plays out the next time Occupy gets going. We shall reap what we permitted to be sowed.	leashless	0	0	1470775299	763113032541175812	https://twitter.com/leashless/status/763113032541175812			
	I hear the arguments. I do. But the issues are bigger than terms of service, even than harassment. It's precedent setting.	leashless	0	0	1470775239	763112780253818880	https://twitter.com/leashless/status/763112780253818880			
	so when they censor and ban the next Occupy push, you will support it? Have you no principles except authority?	leashless	0	0	1470773554	763105713883377664	https://twitter.com/leashless/status/763105713883377664			
	pic.twitter.com/05GjDKPaBc	leashless	7	0	1470773463	763105331291516929	https://twitter.com/leashless/status/763105331291516929			
	If this was going to be a digital public space, we needed to defend it in a nonpartisan way. We have failed hard	leashless	0	0	1470757697	763039204662280192	https://twitter.com/leashless/status/763039204662280192			
	With public outcry from his enemies to bring him back, speech was protected. All other responses? We are damned.	leashless	0	0	1470757671	763039093609603072	https://twitter.com/leashless/status/763039093609603072			
	This is all road to hell territory. The only protective action possible was to rally around Nero in public.	leashless	0	0	1470757652	763039015008346112	https://twitter.com/leashless/status/763039015008346112			
	Plausibly protected as parody.	leashless	0	0	1470757532	763038510576173056	https://twitter.com/leashless/status/763038510576173056			
	Milo encouraged people to voice their opinion using the tools at their disposal: mass protest online.	leashless	0	0	1470757517	763038447485480962	https://twitter.com/leashless/status/763038447485480962			
	and it's universally the response of the left on hearing of his ban.	leashless	0	0	1470757482	763038303960625152	https://twitter.com/leashless/status/763038303960625152			
	Selective enforcement is the last refuge of the scoundrel. It's the worst kind of bad governance.	leashless	0	0	1470757191	763037083510382592	https://twitter.com/leashless/status/763037083510382592			
	Instead a celebration, ratifying of the idea that banning noxious speech is good governance. Head meet block.	leashless	0	0	1470757126	763036810276696066	https://twitter.com/leashless/status/763036810276696066			
	"""yes, he's an ass, no, you must not ban him, this is our public square"" == reinstate @ Nero, protect us later."	leashless	0	0	1470757085	763036638201126912	https://twitter.com/leashless/status/763036638201126912			@
	To protect *ourselves* from future censorship, we need widespread public outcry *from Nero's enemies* on this.	leashless	0	0	1470757061	763036537248505856	https://twitter.com/leashless/status/763036537248505856			
	Your enemies will define rabble rousing for you, not me.	leashless	1	0	1470756991	763036241730437120	https://twitter.com/leashless/status/763036241730437120			
	. @ miniver @ ninavizz @ ratkins when your enemies boot the entire left off Twitter for rabble rousing, do not be surprised: you set precedent.	leashless	6	1	1470755780	763031164487630848	https://twitter.com/leashless/status/763031164487630848			@ @ @
	But the bottom line is that if you support banning political activists because they've got big mounts? Slipslope	leashless	1	0	1470750947	763010892552437760	https://twitter.com/leashless/status/763010892552437760			
	No, they're responsible for censoring a person with those ideas for actions he took defending his cultural turf.	leashless	0	0	1470750922	763010787086589953	https://twitter.com/leashless/status/763010787086589953			
	yes, because now The Rules are what we defend, rather than fundamental underlying principles like freedom/speech	leashless	0	0	1470750889	763010647697330177	https://twitter.com/leashless/status/763010647697330177			
	and that is really the point: those who cheer censorship today get censored tomorrow We all know where this goes	leashless	3	1	1470731549	762929529983754240	https://twitter.com/leashless/status/762929529983754240			
	organising political action to defend your values becomes cause for a ban? The next Occupy will get silenced too	leashless	0	0	1470731500	762929324395724800	https://twitter.com/leashless/status/762929324395724800			
	we needed @ nero because he disrupted the comfortable blind filter bubble, and with him gone, it is unchallenged.	leashless	1	0	1470731400	762928908169781248	https://twitter.com/leashless/status/762928908169781248			@
	this is the entire point: you've just demonstrated that the discourse - your discourse - is papering over cracks	leashless	0	0	1470731351	762928699738030080	https://twitter.com/leashless/status/762928699738030080			
	being a gay man who fears Muslim immigration will damage your civil rights is not islamophobia. Rational actor.	leashless	0	0	1470731299	762928483077087232	https://twitter.com/leashless/status/762928483077087232			
	read the Koran then get back to me on this.	leashless	0	0	1470731248	762928269205397504	https://twitter.com/leashless/status/762928269205397504			
	This is simply insane. Get over yourself.	leashless	1	0	1470702961	762809624403861504	https://twitter.com/leashless/status/762809624403861504			
	Fighting is never OK? I think we should probably stop talking. Too different https://en.wikipedia.org/wiki/Warsaw_Ghetto …	leashless	0	0	1470702910	762809412142632960	https://twitter.com/leashless/status/762809412142632960			
	How @ CashaaLtd brings revolution in cash transfer using # blockchain:https://twitter.com/BlockchainNet/status/761849631441575936 …	BlockchainGirl	4	3	1470739160	762961454257541120	https://twitter.com/BlockchainGirl/status/762961454257541120		#	@
bitcoin 	. @ CashaaLtd: Cashaa: Free, P2P Global Cash Transfers for the Unbanked https://news.bitcoin.com/cashaa-free-p2p-global-unbanked/ … # blockchain @krgauravITC	BlockchainGirl	9	9	1470737470	762954364285747200	https://twitter.com/BlockchainGirl/status/762954364285747200		#	@ @krgauravITC
	Schon gelesen? Globale Wettbewerbsfähigkeit 2015 – 2016 http://bit.ly/2b3UFVP # trends	HLeichsenring	0	0	1470761484	763055087786815488	https://twitter.com/HLeichsenring/status/763055087786815488		#	
	in der Tat. Danke!	HLeichsenring	1	0	1470735231	762944974333829120	https://twitter.com/HLeichsenring/status/762944974333829120			
	Neu: Apply and comply -http://bit.ly/2aRl3PJ # Compliance # Finanzinstitute # Geldpic.twitter.com/EGXdx6yzKG	HLeichsenring	1	0	1470733295	762936856078118912	https://twitter.com/HLeichsenring/status/762936856078118912		# # #	
	Schon gelesen? ePrivate Banking: Die Nettobank http://bit.ly/2b2T82k # bank20	HLeichsenring	0	0	1470732683	762934286257381376	https://twitter.com/HLeichsenring/status/762934286257381376		#	
	In sieben Schritten zur eigenen Immobile - https://www.der-bank-blog.de/ratgeber/der-weg-zur-eigenen-immobilie/1260/ … # Darlehen # Immobilien # Sparen # Zinsenpic.twitter.com/fkeyzmR9vq	HLeichsenring	2	2	1470731065	762927500905287680	https://twitter.com/HLeichsenring/status/762927500905287680		# # # #	
	Neu: Finanzdienstleister haben Probleme mit der digitalen Transformation -http://bit.ly/2b2rm6d pic.twitter.com/DN50LKR7Fu	HLeichsenring	0	2	1470715067	762860399418970112	https://twitter.com/HLeichsenring/status/762860399418970112			
	Schon gelesen? Brainstorming ist ein wichtiges Thema für Banken http://bit.ly/2b28hkB # banking	HLeichsenring	0	0	1470703882	762813486644813824	https://twitter.com/HLeichsenring/status/762813486644813824		#	
	http://thisisafrica.me/namibian-learner-invents-sim-free-mobile-phone-doesnt-use-airtime/ …	Anne_Connelly	2	1	1470722300	762890736731729920	https://twitter.com/Anne_Connelly/status/762890736731729920			
	Not member of NUJ. Sent link to my LinkedIn profile and link to a byline. Surely that will suffice! Event better be a good!	emilyspaven	0	0	1470763726	763064493404545029	https://twitter.com/emilyspaven/status/763064493404545029			
	Hey, journos, does anyone actually own a press card? I'm being asked to show one as proof of eligibility for a conference press pass. Odd.	emilyspaven	1	0	1470763280	763062620639338497	https://twitter.com/emilyspaven/status/763062620639338497			
	How Deliveroo and UberEATS are changing the £9bn food delivery landscapehttp://bit.ly/2aIERpp	emilyspaven	3	0	1470748482	763000554553536512	https://twitter.com/emilyspaven/status/763000554553536512			
