	"RT @ technocrypto: ""I've tried to give quantum suicide computing a fair shake"""	VitalikButerin	14	5	1468869302	755118702597513216	https://twitter.com/VitalikButerin/status/755118702597513216			@
	List of goods: chocolates, confectionery. https://www.ipo.gov.uk/tmcase/Results/1/UK00003029238 …	VitalikButerin	21	7	1468843385	755009999554932736	https://twitter.com/VitalikButerin/status/755009999554932736			
ethereum 	你的意思是用类似于http://www.ethereum-alarm-clock.com/ 的服务做异步调用？这样可以	VitalikButerin	3	1	1468809722	754868805369753601	https://twitter.com/VitalikButerin/status/754868805369753601			
	Sweet! The next semester might be # blockchain focused. So innovative.	dtapscott	0	1	1468865284	755101848940515328	https://twitter.com/dtapscott/status/755101848940515328		#	
	Love this. Thanks Borje.	dtapscott	2	1	1468865238	755101655545315328	https://twitter.com/dtapscott/status/755101655545315328			
	Oh bummer. Hopefully it turns up so you can continue the read.	dtapscott	0	0	1468865220	755101578453983232	https://twitter.com/dtapscott/status/755101578453983232			
	Is # blockchain the key to securing a true peer-to-peer power grid? @ alextapscott writes for @ TorontoStar:https://www.thestar.com/news/canada/2016/05/06/blockchain-holds-key-to-reinventing-energy-grid.html …	dtapscott	42	53	1468854484	755056551304585216	https://twitter.com/dtapscott/status/755056551304585216		#	@ @
	I'll make sure to add this to my own list. Thanks Matt.	dtapscott	1	0	1468832941	754966194088767488	https://twitter.com/dtapscott/status/754966194088767488			
	You're going to love it. # beachcoin	dtapscott	2	0	1468832910	754966064023347200	https://twitter.com/dtapscott/status/754966064023347200		#	
	Indeed! Keep in touch.	dtapscott	1	1	1468832855	754965831898042368	https://twitter.com/dtapscott/status/754965831898042368			
	Sweet, thanks for sharing this!	dtapscott	1	0	1468832793	754965570148298752	https://twitter.com/dtapscott/status/754965570148298752			
	Sweet, thanks for sharing this.	dtapscott	0	0	1468832608	754964794654990336	https://twitter.com/dtapscott/status/754964794654990336			
	Did you know # blockchain technology could reinvent the # power grid? Here's how: via @ FortuneMagazine @ alextapscotthttp://for.tn/1OlIVwO?xid=for_tw_sh …	dtapscott	27	31	1468832571	754964642246565888	https://twitter.com/dtapscott/status/754964642246565888		# #	@ @
	Thanks. One of my favorite potentials for the # blockchain	dtapscott	0	1	1468832448	754964123989966848	https://twitter.com/dtapscott/status/754964123989966848		#	
	This weekend's guests at the Lodge. Lots of laughs, music and insights!pic.twitter.com/HeO2rN3f9R	dtapscott	14	3	1468797014	754815504162971648	https://twitter.com/dtapscott/status/754815504162971648			
	[KR941] Keiser Report: Preventing Debt Parasites http://po.st/6EoA5A  via @ maxkeiser	maxkeiser	9	14	1468847206	755026025671778304	https://twitter.com/maxkeiser/status/755026025671778304			@
	[KR940] Keiser Report: Gold & World’s Debt Problems http://po.st/qD5F6M  via @ maxkeiser	maxkeiser	7	6	1468847195	755025978477477888	https://twitter.com/maxkeiser/status/755025978477477888			@
	Gold, Trump and Rates: Bank That Foresaw Rally Flags $1,500 http://po.st/VITHf9  via @ maxkeiser	maxkeiser	3	5	1468847183	755025927365681152	https://twitter.com/maxkeiser/status/755025927365681152			@
	Le DARPA lance une initiative qui vise à permettre aux logiciels de se patcher tous seuls en cas de faillehttp://finance.yahoo.com/news/darpa-grand-cyber-challenge-hacking-000000417.html …	babgi	10	15	1468838876	754991086087667713	https://twitter.com/babgi/status/754991086087667713			
	# blockchain et 9 autres techno-megatrends en 2016 selon le @ wefhttps://www.weforum.org/agenda/2016/06/top-10-emerging-technologies-2016?utm_content=buffer2e2f6&utm_medium=social&utm_source=twitter.com&utm_campaign=buffer …	babgi	15	19	1468837747	754986352027000833	https://twitter.com/babgi/status/754986352027000833		#	@
	Will # banking and # fintech merge or collide? https://www.cbinsight.com/will-banking-fintech-merge-collide.html … @ CBinsights @ FinTechMafiapic.twitter.com/jRfxJPem2e	JimMarous	13	12	1468871271	755126960431529984	https://twitter.com/JimMarous/status/755126960431529984		# #	@ @
	Disrupting # Banking: # fintech startups unbundling banks. http://cbi.vc/28JxBKj pic.twitter.com/h0tqsyC4do	JimMarous	24	26	1468871013	755125876010917888	https://twitter.com/JimMarous/status/755125876010917888		# #	
	# Banking Needs to Provide Exceptional Spending & Saving Experiences http://bit.ly/29JRrCA @ DuenaBlomstrom # fintechpic.twitter.com/kFKtRlcrwN	JimMarous	21	19	1468865676	755103492960694272	https://twitter.com/JimMarous/status/755103492960694272		# #	@
	Over 100K Views: 2016 # Banking Trends and Predictions Insights from Best in # Fintech and # Finserv Sponsored by @ Konypic.twitter.com/2x2b1lA20L	JimMarous	17	17	1468840649	754998521292591104	https://twitter.com/JimMarous/status/754998521292591104		# # #	@
	# Fintech and # Banking Must Understand Each Other Before Partnering http://bit.ly/29IjOkV @ FINTONIC @ FinTechMafiapic.twitter.com/qWhFnXubPT	JimMarous	18	25	1468840445	754997667978211328	https://twitter.com/JimMarous/status/754997667978211328		# #	@ @
	# Fintech 40: The people powering financial innovation http://bit.ly/2a9IAzp @ dgwbirch @ matteorizzi @ Chris_Skinnerpic.twitter.com/5UbQ9vwJaj	JimMarous	28	21	1468831621	754960654692392960	https://twitter.com/JimMarous/status/754960654692392960		#	@ @ @
	# Fintech and # Banking Partnerships Require an Understanding http://bit.ly/29IjOkV @ FINTONICpic.twitter.com/GRqEM2Cyms	JimMarous	10	11	1468825279	754934054697439232	https://twitter.com/JimMarous/status/754934054697439232		# #	@
	# Fintech and # Banking Partnerships Require an Understanding http://bit.ly/29IjOkV @ FINTONICpic.twitter.com/2L4If7NR8w	JimMarous	2	9	1468814817	754890175591907328	https://twitter.com/JimMarous/status/754890175591907328		# #	@
	Within a Decade, Retail # Banking Maybe Dead. http://ln.is/lnkd.in/wPYaj # fintech	JimMarous	3	9	1468795286	754808255809982464	https://twitter.com/JimMarous/status/754808255809982464		# #	
	Future of # Banking Hinges on Communication & Personalized Service http://ln.is/insights.samsung.com/SxppR … . # fintech # CX # UX @ personetics @ PersoneticsTR	JimMarous	17	9	1468794428	754804655150989313	https://twitter.com/JimMarous/status/754804655150989313		# # # #	@ @
	# Fintech Is Hot, But The Demise Of Traditional # Banking Has Been Greatly Exaggerated. http://www.forbes.com/sites/chrismyers/2016/04/08/fintech-is-hot-but-the-demise-of-traditional-banking-has-been-greatly-exaggerated/#4aa30d2aa2fd … @ FinTechMafia	JimMarous	20	22	1468794231	754803829108043776	https://twitter.com/JimMarous/status/754803829108043776		# # #4aa30d2aa2fd	@
	Active vs Passive Investing – AVC http://avc.com/2016/07/active-vs-passive-investing/?utm_campaign=subscription&utm_medium=email&utm_source=app …	VinnyLingham	5	1	1468856119	755063406562979840	https://twitter.com/VinnyLingham/status/755063406562979840			
	That's what I said!!https://twitter.com/whaleclubco/status/754805521300021248 …	VinnyLingham	6	0	1468796002	754811258608627712	https://twitter.com/VinnyLingham/status/754811258608627712			
	In 5 years from now, every tech company will be an AI company cc: @ semil	VinnyLingham	15	3	1468793749	754801809139523584	https://twitter.com/VinnyLingham/status/754801809139523584			@
	the only thing I want to disable is an uninformed media	VinnyLingham	206	8	1468793638	754801341856231424	https://twitter.com/VinnyLingham/status/754801341856231424			
bitcoin 	Heading to d10e in San Francisco. Bitcoin techies are dangerous folks. Can't be too safe.pic.twitter.com/Rlt0hr5qtm	officialmcafee	277	75	1468856601	755065428800569344	https://twitter.com/officialmcafee/status/755065428800569344			
bitcoin 	"""We don't need kings to coin our money and Bitcoin will outlive political institutions"" -- @ jonmatonis"	rogerkver	94	57	1468861243	755084899334311937	https://twitter.com/rogerkver/status/755084899334311937			@
	Trump's motorcade involved in accident on first day of RNC http://nydn.us/29TX5GC  - he needs to # makedrivingsafeagain	BrettKing	2	0	1468879166	755160076051107840	https://twitter.com/BrettKing/status/755160076051107840		#	
	I'm going to try	BrettKing	0	0	1468866885	755108564948090880	https://twitter.com/BrettKing/status/755108564948090880			
	Chatting with @ alphapack_co in NYC @ sbcFinTechpic.twitter.com/nJ3faU6rgv	BrettKing	9	1	1468864988	755100605383933952	https://twitter.com/BrettKing/status/755100605383933952			@ @
	Freedom Tower (WTC 1) and the transportation hub at WTC https://www.instagram.com/p/BIAXQoxjknn/	BrettKing	2	0	1468851040	755042103785381888	https://twitter.com/BrettKing/status/755042103785381888			
	@ Clagett I cover this in # AugmentedBook	BrettKing	1	0	1468846744	755024088318476288	https://twitter.com/BrettKing/status/755024088318476288		#	@
	Congrats to @ Chris_Skinner and @ dgwbirch for making the Fintech 40 list from eFinancialNews (paywall) http://m.efinancialnews.com/story/2016-07-18/meet-the-fintech-40-the-people-powering-financial-technology-2016 …	BrettKing	7	8	1468841691	755002893862899712	https://twitter.com/BrettKing/status/755002893862899712			@ @
	they still use steam down there John	BrettKing	1	0	1468803809	754844002067877888	https://twitter.com/BrettKing/status/754844002067877888			
	"""Turkish Police have asked...social media accounts that might be deemed as coup-friendly...great purge is beginning.https://twitter.com/warontherocks/status/755119743368126465 …"	naval	27	28	1468870974	755125713649307649	https://twitter.com/naval/status/755125713649307649			
	"""Turkey may be unrecognizable in a year and, if Erdoğan has his way, an Islamic Republic in a decade.""https://twitter.com/commentary/status/754754056636231680 …"	naval	31	17	1468800257	754829107108511744	https://twitter.com/naval/status/754829107108511744			
	pppffft. Je m'en fous ;-)	aantonop	0	0	1468825394	754934539613380609	https://twitter.com/aantonop/status/754934539613380609			
	Yeah, that was a bit of a strange statement, but the picture was pretty	aantonop	0	0	1468818187	754904309574152192	https://twitter.com/aantonop/status/754904309574152192			
	@ officialmcafee Ahhhh yes the evil crime of conversation!	ErikVoorhees	3	0	1468872291	755131238856273920	https://twitter.com/ErikVoorhees/status/755131238856273920			@
	Why Are Cop Killings so Much Rarer than They Used to Be? | Daniel Bier http://fee.org/articles/why-are-cop-killings-so-much-rarer-than-they-used-to-be/ … via @ feeonline	ErikVoorhees	1	4	1468872227	755130968936030208	https://twitter.com/ErikVoorhees/status/755130968936030208			@
	Father-Son Management Team Michael & Nick Lippman on Rooming With David Bowie 4/michael-nick-lippman-management-interview-photos	brockpierce	1	0	1468872498	755132106750124032	https://twitter.com/brockpierce/status/755132106750124032			
	Strange, some of my emails in Google Inbox don't appear in the inbox on web, but they do on mobile. Anyone solved this riddle? # YouHadOneJob	brian_armstrong	5	0	1468810268	754871096864681984	https://twitter.com/brian_armstrong/status/754871096864681984		#	
	Market volatility at extreme lows againhttps://twitter.com/TheStalwart/status/755118695890952194 …	TuurDemeester	3	2	1468878859	755158788261445632	https://twitter.com/TuurDemeester/status/755158788261445632			
	Gotcha.	TuurDemeester	0	0	1468876178	755147539758845952	https://twitter.com/TuurDemeester/status/755147539758845952			
	AFAIK wildcat banking refers to 19th century private banking rather than to robberies	TuurDemeester	0	0	1468875542	755144873074917377	https://twitter.com/TuurDemeester/status/755144873074917377			
	Indeed, we live in the new era of Wildcat Banking. https://twitter.com/balajis/status/755083392606085120 …	TuurDemeester	4	3	1468872698	755132945422229504	https://twitter.com/TuurDemeester/status/755132945422229504			
	So far the # Ether price is holding up well. If HF works out, I imagine we'll see a short squeeze.	TuurDemeester	9	2	1468872406	755131719687237632	https://twitter.com/TuurDemeester/status/755131719687237632		#	
	I put the link under my previous stat tweet, yesterday's	TuurDemeester	1	0	1468872156	755130670708559872	https://twitter.com/TuurDemeester/status/755130670708559872			
ethereum 	Anyone know if the people running # Ethereum mining pools can vote for or against the Hard Fork with the entire hash rate they represent?	TuurDemeester	2	0	1468872089	755130392374640642	https://twitter.com/TuurDemeester/status/755130392374640642		#	
ethereum 	# Ethereum preliminary hard fork results by pool. EthPool (7% hashrate) votes NO so far. https://www.reddit.com//r/ethereum/comments/4tffta/hard_fork_voting_and_node_adoption_results/?sort=top …pic.twitter.com/WGias8zRqr	TuurDemeester	10	10	1468871354	755127308726497281	https://twitter.com/TuurDemeester/status/755127308726497281		#	
ethereum 	Speculation that # theDAO attacker is renting # ethereum hashrate in mining pools to skew the hard fork vote:https://forum.ethereum.org/discussion/8382/dao-hard-fork-voting-on-ethpool-ethermine/p2 …	TuurDemeester	17	11	1468870814	755125043508772864	https://twitter.com/TuurDemeester/status/755125043508772864		# #	
	are these existing upgraded nodded changing their minds?	TuurDemeester	0	0	1468862041	755088245810196480	https://twitter.com/TuurDemeester/status/755088245810196480			
	Only 2 days to go... definitely an interesting experiment.	TuurDemeester	2	0	1468860583	755082129428582401	https://twitter.com/TuurDemeester/status/755082129428582401			
	Good question... I don't know! Silent votes against the HF, or indifference, or lack of understanding...	TuurDemeester	0	0	1468860498	755081773504233472	https://twitter.com/TuurDemeester/status/755081773504233472			
ethereum 	# Ethereum Hard Fork Day 2 15% upgraded client 11% for HF 4% against HF 85% not upgraded HF activation: Wed, 10:30ampic.twitter.com/TDazI8rXvA	TuurDemeester	31	26	1468860107	755080132935684096	https://twitter.com/TuurDemeester/status/755080132935684096		#	
	I put the link in the thread under the tweet	TuurDemeester	1	0	1468828104	754945904168280064	https://twitter.com/TuurDemeester/status/754945904168280064			
	Thanks for explaining... Didn't mean as an endorsement, find it reprehensible that gvts treat humans like cattle. Does that help?	TuurDemeester	1	0	1468818754	754906686079524864	https://twitter.com/TuurDemeester/status/754906686079524864			
	why?	TuurDemeester	0	0	1468811291	754875386308227072	https://twitter.com/TuurDemeester/status/754875386308227072			
	If you're going to slaughter pigs, might first want to raise the fence. # china # devaluation # capitalcontrols https://twitter.com/pmarca/status/754841807045787649 …	TuurDemeester	7	5	1468805182	754849762835255298	https://twitter.com/TuurDemeester/status/754849762835255298		# # #	
	looks very small still. But interesting!	TuurDemeester	0	0	1468804856	754848395236225024	https://twitter.com/TuurDemeester/status/754848395236225024			
	"""The case for cash is not proven, but it needs to be heard."" - worthwhile thoughts by @ agurevich23. http://alexgurevich.tumblr.com/post/147567467957/journey-of-cash …"	TuurDemeester	2	5	1468804487	754846847462551552	https://twitter.com/TuurDemeester/status/754846847462551552			@
	can you explain 2M and ath?	TuurDemeester	0	0	1468799685	754826707887087616	https://twitter.com/TuurDemeester/status/754826707887087616			
	I think so, yes. In any case 0.015 is crucial technical support imo.	TuurDemeester	1	0	1468796820	754814688899239936	https://twitter.com/TuurDemeester/status/754814688899239936			
	isis carrying out attacks again & again n America using BLM as proxy military. # MAGA # DC # BatonRouge @ SharonM67714628https://twitter.com/NetworksManager/status/755092608116981764 …	NetworksManager	20	24	1468870882	755125328742350848	https://twitter.com/NetworksManager/status/755125328742350848		# # #	@
	In the beginning Mo said Christians & Jews ok then when no convert OFF W/ THERE HEADS @ LindsayMMeredit @ JoeMackmack @ WhiteStanSmiths @ POTUS	NetworksManager	2	1	1468869931	755121340156407808	https://twitter.com/NetworksManager/status/755121340156407808			@ @ @ @
	# NeverForget only took 1 non European # Pontifex & 1 non American Pres>>> # heritage # MAGA @ JanJohnsonFL @ JustusGroupiehttps://twitter.com/NetworksManager/status/719082010560565248 …	NetworksManager	4	3	1468869368	755118977169428480	https://twitter.com/NetworksManager/status/755118977169428480		# # # #	@ @
	We are NOT islamic. We will never be islamic. Islam needs MAJOR reform if want accepted by the West. # MAGA # DC @ WhiteStanSmiths @ POTUS	NetworksManager	21	18	1468869129	755117974718128128	https://twitter.com/NetworksManager/status/755117974718128128		# #	@ @
	. @ Bikers4Trump landing in # Cleveland is the biggest story of the # RNCinCLE WE WILL NEVER FORGET @ FoxNews @ nbc @ CBS @ ABC @ CNN @ BBC @ SkyNews	NetworksManager	51	47	1468868034	755113381598822400	https://twitter.com/NetworksManager/status/755113381598822400		# #	@ @ @ @ @ @ @ @
	Seems having installed muslims across gov now obama chase out local police patriots w islamic proxy groups @ ilovehiltonhead @ BrainlessMuzzos	NetworksManager	15	40	1468867142	755109642141835265	https://twitter.com/NetworksManager/status/755109642141835265			@ @
	U don't think the pirate flag bears remarkable similarities to the IS flag? They are the same people.. # DC	NetworksManager	0	0	1468866007	755104882332491776	https://twitter.com/NetworksManager/status/755104882332491776		#	
	Airplanes for missiles, women & youth as delivery, trucks as human mowers PRODUCTS OF ISLAM. # MAGA # DC @ HarryIsaacJrhttps://twitter.com/NetworksManager/status/754876545056014336 …	NetworksManager	10	16	1468865791	755103973313540096	https://twitter.com/NetworksManager/status/755103973313540096		# #	@
	No they are not	NetworksManager	0	1	1468865369	755102203908677633	https://twitter.com/NetworksManager/status/755102203908677633			
	Thank u my friend. if not me then who?Have narrow roads like this>> # DC must we see w/ our own eyes?	NetworksManager	23	7	1468865305	755101935246708736	https://twitter.com/NetworksManager/status/755101935246708736		#	
	lot's of love coming your way from Washington # DC	NetworksManager	1	0	1468864235	755097450810056704	https://twitter.com/NetworksManager/status/755097450810056704		#	
	Think about pirate flag then think IS flag. Think about hooded witch then think hijab. # MAGA # DC @ TommmyJeffersonhttps://twitter.com/NetworksManager/status/755058114425126912 …	NetworksManager	11	17	1468864152	755097101000904704	https://twitter.com/NetworksManager/status/755097101000904704		# #	@
	# Orlando # NICE # Dallas # BatonRouge # SanBernardino ALL MUSLIMS folks BLM founder a MUSLIM # media # gov LYING. # MAGA # DChttps://twitter.com/NetworksManager/status/755092608116981764 …	NetworksManager	30	38	1468863456	755094180578426881	https://twitter.com/NetworksManager/status/755094180578426881		# # # # # # # # #	
	# WakeUpAmerica The issue is NOT black vs white # racism folks these African murderers are MUSLIMS islam's favorite Army since the # Crusades.	NetworksManager	60	79	1468863081	755092608116981764	https://twitter.com/NetworksManager/status/755092608116981764		# # #	
	# NICE # Orlando # Paris # NYC # Rome # Madrid # Shanghai # Moscow # LA # Boston # Jakarta # Mumbai WAKE UP WORLD>>>>IT'S ISLAM STUPID !!! # MAGA # DC	NetworksManager	73	67	1468854857	755058114425126912	https://twitter.com/NetworksManager/status/755058114425126912		# # # # # # # # # # # # # #	
	This is what islam is breeding everywhere we've let them in. # NICE # DC @ angryslave7 @ ABCXYZLetters @ CNN @ FoxNews @ BBChttps://twitter.com/ABCXYZLetters/status/755050125760880640 …	NetworksManager	8	13	1468854193	755055329386332160	https://twitter.com/NetworksManager/status/755055329386332160		# #	@ @ @ @ @
	Troll someone who cares @ ToniJohnnie @ AngelTilaLovehttps://twitter.com/NetworksManager/status/732232118680616960 …	NetworksManager	1	0	1468853256	755051397935235072	https://twitter.com/NetworksManager/status/755051397935235072			@ @
	nothing polite about this girl	NetworksManager	0	0	1468851225	755042880926912512	https://twitter.com/NetworksManager/status/755042880926912512			
	Whites not raping blacks or muslims. @ AltRightInfo @ lionhart32 @ GoodDktr @ CounterCouncil @ ZalmanGelbman @ kyramarat1 https://twitter.com/AltRightInfo/status/755036351586861056 …	NetworksManager	2	4	1468850344	755039184591749120	https://twitter.com/NetworksManager/status/755039184591749120			@ @ @ @ @ @
	"Without guns we r slaves this why our ancestors fought & died for ""Right To Bear Arms"" notice NOT ""Right To Bear Muskets"" # 2a @ CounterCouncil"	NetworksManager	23	26	1468849527	755035758067609604	https://twitter.com/NetworksManager/status/755035758067609604		#	@
	# BanIslam # IslamIsPeace # NotAllMuslims # BanTheKoran # MuslimBan # DC # NYC # NICE @ reda2448 @ CNN @ FoxNews @ BBC @ CBS @ ABChttps://twitter.com/NetworksManager/status/754876545056014336 …	NetworksManager	30	38	1468845922	755020640516734976	https://twitter.com/NetworksManager/status/755020640516734976		# # # # # # # #	@ @ @ @ @ @
	Switching to Pete's # Coffee next purchase # BLM>> # muslims terrorists. # MAGA # DC @ sirludwig1 @ dionneg11 @ dawnellemurray @ Starbucks @mama_sees	NetworksManager	8	1	1468845785	755020062898216960	https://twitter.com/NetworksManager/status/755020062898216960		# # # # #	@ @ @ @ @mama_sees
	. @ donlemon & @ CNN push blm NOT US! Clarke tried 4 honest discussion Don wouldn't let him. # DC @ aliotta_joseph @ SheriffClarke @ realDonaldTrump	NetworksManager	11	5	1468844798	755015923174674432	https://twitter.com/NetworksManager/status/755015923174674432		#	@ @ @ @ @
	Must alter, delete or abolish their book or we'll have to kill all of them. # BanIslam # NICE # MAGA # DC @ vivaeltrumphttps://twitter.com/NetworksManager/status/754876545056014336 …	NetworksManager	2	5	1468844568	755014957901684736	https://twitter.com/NetworksManager/status/755014957901684736		# # # #	@
	unbelievable	NetworksManager	1	0	1468813213	754883445101301760	https://twitter.com/NetworksManager/status/754883445101301760			
	"LOOK vid # MUSLIMS n # Nice # obama # Hollande @ CNN @ FoxNews @ BBC @ CBS @ ABC NO WANT U 2 SEE 4fear of ""OVER REACTION"" # DCpic.twitter.com/wgFQ9kMUbV – bei The White House"	NetworksManager	1036	2236	1468811567	754876545056014336	https://twitter.com/NetworksManager/status/754876545056014336		# # # # #	@ @ @ @ @
	""" # islam is as dangerous to a man as rabies to an animal."" # Churchill @ Katetech12Kate @ vsh47 @ PatriotByGod # DC # obamahttps://twitter.com/Katetech12Kate/status/754861097459548160 …"	NetworksManager	17	13	1468808409	754863295807488001	https://twitter.com/NetworksManager/status/754863295807488001		# # # #	@ @ @
	it's muslims seems they all sleeper cells	NetworksManager	0	0	1468807643	754860085994749952	https://twitter.com/NetworksManager/status/754860085994749952			
	Him & folks you see cheering for failed coup on TV are the DIRECT decedents of our enemy from # Crusades. # DC @ willdithttps://twitter.com/NetworksManager/status/737822758755782656 …	NetworksManager	5	3	1468800247	754829063123075072	https://twitter.com/NetworksManager/status/754829063123075072		# #	@
	# obama es un traidor de Kenia. Acuse a obama! ¡No confianza! obama trae cerdos islámicos de USA. # BatonRouge @ DanielWortiz @ realDonaldTrump	NetworksManager	5	5	1468799462	754825771521277952	https://twitter.com/NetworksManager/status/754825771521277952		# #	@ @
	looks like it guys	NetworksManager	0	0	1468793697	754801590251491329	https://twitter.com/NetworksManager/status/754801590251491329			
	What happened @ KenRoth maybe take testosterone shots so u can get a stiffy might think hmm>>protect my girls. # islamhttps://twitter.com/kenroth/status/754736804025229312 …	NetworksManager	7	13	1468793350	754800136526696448	https://twitter.com/NetworksManager/status/754800136526696448		#	@
	Thank you! @LibertyThunder	haydentiff	1	2	1468876407	755148500132921344	https://twitter.com/haydentiff/status/755148500132921344			@LibertyThunder
	Why was a broke city trying to build a $285M pipeline -knowing it was insufficient? # FlintWaterCrisis @ HalfSecGhostGun @ mobileslate	haydentiff	1	4	1468873186	755134990673911808	https://twitter.com/haydentiff/status/755134990673911808		#	@ @
	Going forward, estimates are 15yrs and $60M. @ HalfSecGhostGun @ mobileslate # FlintWaterCrisis # ArrestSnyderhttp://www.mlive.com/news/flint/index.ssf/2016/01/15_years_and_60m_needed_to_rep.html …	haydentiff	1	7	1468871394	755127474950905856	https://twitter.com/haydentiff/status/755127474950905856		# #	@ @
	No, a $285M pipeline that was known to be insufficient was always part of the plan. @ HalfSecGhostGun @ mobileslatepic.twitter.com/0NLtT1RwyK	haydentiff	1	2	1468871187	755126606423785472	https://twitter.com/haydentiff/status/755126606423785472			@ @
	The government has neglected water infrastructure nationwide. $3.6 TRILLION in repairs/replacement is needed by 2020. @ philliptobias @ 7am	haydentiff	6	4	1468870690	755124521812824065	https://twitter.com/haydentiff/status/755124521812824065			@ @
	The opposite for courage is not cowardice, it is conformity. Even a dead fish can go with the flow.pic.twitter.com/at42ccBLUN	haydentiff	184	117	1468869784	755120721920229377	https://twitter.com/haydentiff/status/755120721920229377			
	I want to fight for those who have been marginalized and discarded. # FlintWaterCrisis # Detroit @ mobileslatepic.twitter.com/nRvdylapFS	haydentiff	8	8	1468869490	755119491768520705	https://twitter.com/haydentiff/status/755119491768520705		# #	@
