	I'm a facebook shareholder. I think its funny watching twitter management flail around while $ FB eats its lunch. $ twtr	GerberKawasaki	1	0	1470704543	762816259121569794	https://twitter.com/GerberKawasaki/status/762816259121569794			
	Facebook beats Twitter to the race for # Rio2016 live streaming content. They cut a deal for lots of # Olypmics2016 content for $ FB # live.	GerberKawasaki	5	4	1470703344	762811229081522176	https://twitter.com/GerberKawasaki/status/762811229081522176		# # #	
	It took me a while. I finally found a good company that is a play on # Pot. Want to know which one it is? @ tommychong # Legalizeit	GerberKawasaki	40	15	1470701471	762803376010649600	https://twitter.com/GerberKawasaki/status/762803376010649600		# #	@
	Love that too. We own $ LMT and $ NOC That covers a lot of great weapon systems.	GerberKawasaki	0	0	1470699107	762793458562052096	https://twitter.com/GerberKawasaki/status/762793458562052096			
	Agree but we also have priorities like paying medicare and we can not afford big deficits. The rich don't need a tax cut.	GerberKawasaki	0	0	1470699066	762793288604659716	https://twitter.com/GerberKawasaki/status/762793288604659716			
	SAP Thinking Ahead Of # Blockchain Threathttp://bit.ly/2aJC5lQ	obussmann	3	5	1470766809	763077424535990272	https://twitter.com/obussmann/status/763077424535990272		#	
	Excellent preview of the @ Innotribe session at @ Sibos 2016 http://bit.ly/2aGVzGO  via @ petervan	obussmann	3	5	1470763114	763061924720508929	https://twitter.com/obussmann/status/763061924720508929			@ @ @
	Public # Blockchains: The Community vs The Ecosystemhttp://bit.ly/2aJCmW6	obussmann	3	2	1470756780	763035358179319808	https://twitter.com/obussmann/status/763035358179319808		#	
	Australian Media Questions ASX's # Blockchain Drive in Light of Bitfinex Hackhttp://bit.ly/2bazDDF	obussmann	1	2	1470752346	763016762468233216	https://twitter.com/obussmann/status/763016762468233216		#	
	Need your vote for Lykke @ LykkeCity: @ Swisscom_de StartUp Challenge http://bit.ly/2axwfou pic.twitter.com/Cur1hsjugi	obussmann	14	5	1470752344	763016750350950400	https://twitter.com/obussmann/status/763016750350950400			@ @
	Australia's Postal Service Tests # Blockchain Identity - via @ coindesk http://bit.ly/2aIuYJt	obussmann	2	6	1470748680	763001383633186816	https://twitter.com/obussmann/status/763001383633186816		#	@
	Excellent read: UBS Research Report on Whether # FinTech Is a Threat or an Opportunity http://bit.ly/2aDpT1X  via @ LetsTalkPaymnts	obussmann	4	7	1470745020	762986033071984641	https://twitter.com/obussmann/status/762986033071984641		#	@
	Enterprise Software Leader @ SAP Taps # Blockchain to Improve its Productshttp://bit.ly/2ahQZvC	obussmann	5	5	1470742681	762976221936414720	https://twitter.com/obussmann/status/762976221936414720		#	@
	Must attend # FinTech event: @ Innotribe expands at @ Sibos as innovation chat moves centre stage thanks to @ petervan http://bit.ly/2aICMdc	obussmann	6	3	1470738300	762957848158539776	https://twitter.com/obussmann/status/762957848158539776		#	@ @ @
	# Blockchain holds huge potential for wholesale insurance, states Z/Yen and PwC reporthttp://bit.ly/2aucLQe	obussmann	7	7	1470737163	762953080077967360	https://twitter.com/obussmann/status/762953080077967360		#	
	Excellent quote @ lwintermeyer Britain's # fintech sector seeks light at end of Brexit tunnel http://reut.rs/2aBT0Do pic.twitter.com/hTjIY4ViAi	obussmann	15	16	1470729121	762919346729615360	https://twitter.com/obussmann/status/762919346729615360		#	@
	Enjoy my latest post: Want to innovate? Then collaborate! http://bit.ly/2azW2eB # FinTech https://goo.gl/eViMvt	obussmann	7	3	1470722670	762892291291820032	https://twitter.com/obussmann/status/762892291291820032		#	
	My latest blockchain post: Is # Blockchain going mainstream? You bet! http://bit.ly/2aWKAZp # FinTech https://goo.gl/HAja1G	obussmann	5	4	1470707553	762828884265938945	https://twitter.com/obussmann/status/762828884265938945		# #	
	Blockchain Revolution is On: Alibaba to Make Donations Trackablehttp://bit.ly/2ard8Yn	obussmann	5	5	1470694741	762775148760104960	https://twitter.com/obussmann/status/762775148760104960			
	Things most people don't see in The City #3: The Goat by Bishopsgate # TMPDSITCpic.twitter.com/yQ7PJA055b	Chris_Skinner	4	0	1470754787	763026996964257792	https://twitter.com/Chris_Skinner/status/763026996964257792		#3 #	
	Ant Financial core banking service in the cloud http://fb.me/1yjrRwcJi	Chris_Skinner	1	4	1470732449	762933306086141952	https://twitter.com/Chris_Skinner/status/762933306086141952			
	New Blog Post: Ant Financial core banking service in the cloud: I got into an interesting debate with two go... http://bit.ly/2bb7Uob	Chris_Skinner	0	0	1470732444	762933285290856448	https://twitter.com/Chris_Skinner/status/762933285290856448			
	Things worth reading: 9th August 2016 http://fb.me/7IA4hon9O	Chris_Skinner	0	1	1470730652	762925768699629568	https://twitter.com/Chris_Skinner/status/762925768699629568			
	Things worth reading: 9th August 2016 http://fb.me/5GUUtQBUB	Chris_Skinner	0	1	1470730652	762925768384978944	https://twitter.com/Chris_Skinner/status/762925768384978944			
	Ant Financial core banking service in the cloud via Chris Skinner's blog - I got into an ...http://tinyurl.com/jybvrm4	Chris_Skinner	0	2	1470729948	762922816291282944	https://twitter.com/Chris_Skinner/status/762922816291282944			
	Things worth reading: 9th August 2016 via Chris Skinner's blog - Things we're reading today ... http://tinyurl.com/hapzho4	Chris_Skinner	0	1	1470729948	762922816287014912	https://twitter.com/Chris_Skinner/status/762922816287014912			
	Competition and Market Authority's report forcing banks to digitise https://www.gov.uk/government/uploads/system/uploads/attachment_data/file/544567/overview-of-the-banking-retail-market.pdf …	Chris_Skinner	0	2	1470729406	762920544983474176	https://twitter.com/Chris_Skinner/status/762920544983474176			
	New Blog Post: Things worth reading: 9th August 2016: Things we’re reading today include … Married boss of ba... http://bit.ly/2baWXmP	Chris_Skinner	0	0	1470728302	762915910600433664	https://twitter.com/Chris_Skinner/status/762915910600433664			
	Things worth reading: 9th August 2016 via Chris Skinner's blog - Things we're reading today ... http://tinyurl.com/zvl8cwp	Chris_Skinner	0	0	1470728090	762915021370253312	https://twitter.com/Chris_Skinner/status/762915021370253312			
	Trump disagrees with every position held by Trump http://boingboing.net/2016/08/08/trump-disagrees-with-every-pos.html … ... so funny	Chris_Skinner	2	2	1470727601	762912971131654144	https://twitter.com/Chris_Skinner/status/762912971131654144			
	"Britain's High Street banks have been ORDERED to launch a technological ""revolution"" http://www.bbc.co.uk/news/business-37014133 …"	Chris_Skinner	3	2	1470726661	762909027739238400	https://twitter.com/Chris_Skinner/status/762909027739238400			
	finally there is one! :)	davidbrear	3	0	1470777117	763120659526549509	https://twitter.com/davidbrear/status/763120659526549509			
	Settle an argument for me and @ sytaylor - which tube line is the hottest temperature?	davidbrear	3	0	1470774659	763110347150688257	https://twitter.com/davidbrear/status/763110347150688257			@
	many thanks. When does the full list come out?	davidbrear	1	1	1470752968	763019370431905792	https://twitter.com/davidbrear/status/763019370431905792			
	getting a really excellent response Martin so far :)	davidbrear	1	0	1470749880	763006415237705728	https://twitter.com/davidbrear/status/763006415237705728			
	a lot of people will work harder to avoid doing anything :)	davidbrear	1	0	1470744689	762984644140728320	https://twitter.com/davidbrear/status/762984644140728320			
	this is cool.... :)	davidbrear	0	0	1470744653	762984495263977472	https://twitter.com/davidbrear/status/762984495263977472			
	it's a start but not quite the 1-2 we were hoping for.	davidbrear	2	0	1470743382	762979161216585728	https://twitter.com/davidbrear/status/762979161216585728			
	thanks Richard - Feel free to give us a review on iTunes - Happy to have you on also	davidbrear	1	1	1470733625	762938238390693888	https://twitter.com/davidbrear/status/762938238390693888			
	thanks! My ego can take it this week :)	davidbrear	0	0	1470727362	762911971629039617	https://twitter.com/davidbrear/status/762911971629039617			
	lol... see its not funny when you explain it MB :)	davidbrear	0	0	1470727284	762911643894484992	https://twitter.com/davidbrear/status/762911643894484992			
	quite serious and libellous accusations right there Erik. What is this proof?	davidbrear	0	0	1470727018	762910527777628160	https://twitter.com/davidbrear/status/762910527777628160			
	for sure. Plenty to talk about in there. See you guys later.	davidbrear	2	0	1470726870	762909904973795329	https://twitter.com/davidbrear/status/762909904973795329			
	actionable insights = so whats - Man if i have to explain it its not funny :(	davidbrear	0	0	1470726550	762908562360328192	https://twitter.com/davidbrear/status/762908562360328192			
	too big to fail and too big to succeed.	davidbrear	1	0	1470725854	762905645339246592	https://twitter.com/davidbrear/status/762905645339246592			
	fingers crossed!	davidbrear	1	0	1470723576	762896091989827584	https://twitter.com/davidbrear/status/762896091989827584			
	so what? No being offensive that's what we need.	davidbrear	0	0	1470723555	762896002441510912	https://twitter.com/davidbrear/status/762896002441510912			
	that's not true if been stacking cups like a pro :)	davidbrear	1	0	1470722430	762891284751093764	https://twitter.com/davidbrear/status/762891284751093764			
	is why PSD2 needed. Banks who do the minimum don't benefit. Startups & the customers do. It's innovate or lose time! 3/3	davidbrear	1	0	1470722388	762891105893388288	https://twitter.com/davidbrear/status/762891105893388288			
	incumbents then you have to regulated out of the lethargy. Banks have done the min for decades with regulation which 2/3	davidbrear	1	0	1470722302	762890746567528448	https://twitter.com/davidbrear/status/762890746567528448			
	You can take a horse to water and all that. Sometimes when the innovation is good for customers but bad for the big 1/3	davidbrear	1	0	1470722255	762890550005469184	https://twitter.com/davidbrear/status/762890550005469184			
	first rule of Ginger Pig FinTech club is that... Nar there is no rules... 8th?	davidbrear	0	0	1470722154	762890127349809152	https://twitter.com/davidbrear/status/762890127349809152			
	rather than?	davidbrear	0	0	1470721977	762889382479048704	https://twitter.com/davidbrear/status/762889382479048704			
	@ TechCrunch there's a whole product missing on the market its not about just PFM. @ JasonBates has smart idea	davidbrear	1	0	1470721951	762889275507548161	https://twitter.com/davidbrear/status/762889275507548161			@ @
	DMX ;)	davidbrear	0	0	1470720100	762881511536271361	https://twitter.com/davidbrear/status/762881511536271361			
	Very flattered that Credit Suisse chose to feature the @ chyppings shared ledger layers modelpic.twitter.com/QrxNSAeD2b	dgwbirch	9	2	1470776186	763116753014648832	https://twitter.com/dgwbirch/status/763116753014648832			@
	"Credit Suisse equity research on the blockchain “market appears to be overlooking risks for some exchanges (ASX)"" http://buff.ly/2aT8rHy"	dgwbirch	2	0	1470775964	763115819584876544	https://twitter.com/dgwbirch/status/763115819584876544			
	CMA report on open banking cost £5m https://www.ft.com/content/2f48e10e-5e16-11e6-a72a-bd4bf1198c63 …	dgwbirch	0	0	1470775499	763113871632654336	https://twitter.com/dgwbirch/status/763113871632654336			
	THE BLOCKCHAIN can help! Just give each one a serial number and add that to a coloured coin because smart contractshttp://buff.ly/2bd8GBh	dgwbirch	8	0	1470775325	763113140527755265	https://twitter.com/dgwbirch/status/763113140527755265			
	Strong authentication against a revocable token held in tamper-resistant storagehttps://twitter.com/AmerBanker/status/763103337441009664 …	dgwbirch	2	1	1470774677	763110423247851521	https://twitter.com/dgwbirch/status/763110423247851521			
	Come on, not all of the $47 billion has been wasted. Some of it went on consultant http://buff.ly/2aJFlQh	dgwbirch	4	1	1470772686	763102071897849856	https://twitter.com/dgwbirch/status/763102071897849856			
	# Drumpf doesn’t like 3rd-world immigrants, loves their politics. Who knew the American empire would end like this?https://twitter.com/zeynep/status/763094095967449088 …	dgwbirch	3	0	1470771739	763098101708128256	https://twitter.com/dgwbirch/status/763098101708128256		#	
	I don’t want to be the one to break the bad news, but we had bendy buses in London for yonks (and scrapped them)https://twitter.com/counternotions/status/762982122843885569 …	dgwbirch	0	0	1470771491	763097059666882565	https://twitter.com/dgwbirch/status/763097059666882565			
	Ouch @ diane1859 sticking it to the CMA on @ BBCRadio4 for giving the banks an easy ride	dgwbirch	0	0	1470763455	763063353476513792	https://twitter.com/dgwbirch/status/763063353476513792			@ @
	agreed but I think it is better to separate the categories of systemic risk and have third-party credit providers	dgwbirch	1	0	1470761491	763055118988312576	https://twitter.com/dgwbirch/status/763055118988312576			
	provided they don’t offer credit (i.e., overdrafts)	dgwbirch	0	0	1470759517	763046836575801344	https://twitter.com/dgwbirch/status/763046836575801344			
	New on Tomorrow's Transactions: EMV chip clone fraud shock horror. I heard the news, it's the same old blues again http://buff.ly/2aICPWd	dgwbirch	2	0	1470756180	763032840468623361	https://twitter.com/dgwbirch/status/763032840468623361			
	Christ on a bike. Where’s the UNSEE button?https://twitter.com/SLSingh/status/762900291180113920 …	dgwbirch	0	0	1470754571	763026093154701312	https://twitter.com/dgwbirch/status/763026093154701312			
	Bastards! Where are the Windows Maintenance Department when you need them?pic.twitter.com/5H0HEmFFOn	dgwbirch	0	0	1470754533	763025932030468096	https://twitter.com/dgwbirch/status/763025932030468096			
	“Among all [WeChat's] services, it is perhaps its promise of a cashless economy that impresses onlookers the most.”http://buff.ly/2aCTl88	dgwbirch	4	4	1470752645	763018015306809344	https://twitter.com/dgwbirch/status/763018015306809344			
	"(From 2011) An idea for the Independent Commission on Banking ""Financial Services Identifiers"" http://www.chyp.com/an-idea-for-the-independent-commission-on-banking/ …"	dgwbirch	0	1	1470751982	763015233296302080	https://twitter.com/dgwbirch/status/763015233296302080			
	the unit of account wasn’t sugar, the unit of account was (e.g.) Sterling, but the means of exchange was sugar	dgwbirch	1	0	1470751210	763011995394306049	https://twitter.com/dgwbirch/status/763011995394306049			
	I just had another call from “Rachel” at the “Windows Maintenance Department, Microsoft, 100 Victoria Street”. WTF?	dgwbirch	1	0	1470750852	763010494521368576	https://twitter.com/dgwbirch/status/763010494521368576			
	Jeremy Vine, Open Banking and London Riots http://bbc.in/2baV9YH	dgwbirch	1	0	1470749480	763004738694701056	https://twitter.com/dgwbirch/status/763004738694701056			
	no suspicion cardiologists are organising diet and exercise regimes designed to increase demand for cardiologists https://twitter.com/prestonjbyrne/status/762757920375308288 …	dgwbirch	0	0	1470746415	762991881995378688	https://twitter.com/dgwbirch/status/762991881995378688			
	just like the Faster Payment Service. Oh, wait...	dgwbirch	4	0	1470746213	762991034745950208	https://twitter.com/dgwbirch/status/762991034745950208			
	Logical way forward would be to define CMA mandate as AISP subset of PSD2 APIs and use EBA standards (yes I know)https://twitter.com/rl_chris_higham/status/762948142279094273 …	dgwbirch	5	3	1470744261	762982851180634112	https://twitter.com/dgwbirch/status/762982851180634112			
	Yes but luckily @ vanessafeltz had me, so Radio2 listeners are sortedhttps://twitter.com/jamesliamcook/status/762934397943373824 …	dgwbirch	0	0	1470744151	762982387395522560	https://twitter.com/dgwbirch/status/762982387395522560			@
	so sad but so true	dgwbirch	0	0	1470743730	762980620679180288	https://twitter.com/dgwbirch/status/762980620679180288			
	sadly I did but I hope @ vanessafeltz will have me back soon	dgwbirch	0	0	1470743709	762980532611321857	https://twitter.com/dgwbirch/status/762980532611321857			@
	# JeremyVine 0800 288291 and ask to speak to the handsome, charismatic, intelligent and well-informed person talking to Vanessa Felz	dgwbirch	0	0	1470740948	762968955187240960	https://twitter.com/dgwbirch/status/762968955187240960		#	
	Its Nessa not Jezza today https://goo.gl/images/66jFhU	dgwbirch	0	0	1470740668	762967777711943680	https://twitter.com/dgwbirch/status/762967777711943680			
	Hey it's a phone in! You can call up and abuse me live on national radio! Go for it!	dgwbirch	2	0	1470740411	762966702011379712	https://twitter.com/dgwbirch/status/762966702011379712			
	Live in five: Jeremy Vine - BBC Radio 2 http://buff.ly/2aChpZq	dgwbirch	0	0	1470740148	762965597642756096	https://twitter.com/dgwbirch/status/762965597642756096			
	Live in tenpic.twitter.com/Yc3MQxL3Oi	dgwbirch	0	0	1470739828	762964256069410816	https://twitter.com/dgwbirch/status/762964256069410816			
	I've got a Mac, so that was what was abnormal	dgwbirch	0	0	1470737573	762954799079944192	https://twitter.com/dgwbirch/status/762954799079944192			
	I just had a call from the “Windows Technical Department” in “Silicon Valley”. I didn’t realise this scam was still going!	dgwbirch	2	1	1470736902	762951984412524544	https://twitter.com/dgwbirch/status/762951984412524544			
	City have bought Stones. I'm unconvinced.	dgwbirch	0	0	1470736667	762950997492768768	https://twitter.com/dgwbirch/status/762950997492768768			
	Anyone else having problems with CrashPlan Central (it says no backup for six days) ?	dgwbirch	0	0	1470735116	762944493897314304	https://twitter.com/dgwbirch/status/762944493897314304			
	# ChipocalypseNow Yes I heard the news, it’s the same old blues again http://www.chyp.com/yes-i-heard-the-news-its-the-same-old-blues-again/ …	dgwbirch	0	0	1470734641	762942500797644800	https://twitter.com/dgwbirch/status/762942500797644800		#	
	Thank goodness there are detailed open banking standards for the banks to begin coding. Can anyone provide a link?https://twitter.com/StarlingBank/status/762934611865403393 …	dgwbirch	0	1	1470733985	762939747501215744	https://twitter.com/dgwbirch/status/762939747501215744			
	"@ tonyfish so why did they force me to use my ""real name"" (which isn't, by the way)?"	dgwbirch	0	0	1470723527	762895883230904320	https://twitter.com/dgwbirch/status/762895883230904320			@
	we need to decouple the provision of credit from the provision of payments	dgwbirch	1	0	1470723399	762895346297147394	https://twitter.com/dgwbirch/status/762895346297147394			
	Even I'm confused by the CMA chap on @ BBCr4today	dgwbirch	0	1	1470723235	762894660499111936	https://twitter.com/dgwbirch/status/762894660499111936			@
	"""One fifth of the people are against everything all of the time"" -- Robert Kennedy"	gavinandresen	96	29	1470728343	762916082902458368	https://twitter.com/gavinandresen/status/762916082902458368			
	About Blockchain & Crypto Tech: let's not confuse research, experiments, science fiction, speculation and working real products.	wmougayar	26	22	1470751701	763014056047435776	https://twitter.com/wmougayar/status/763014056047435776			
	Good capture, Amber, Thanks!	wmougayar	1	0	1470713594	762854224036102144	https://twitter.com/wmougayar/status/762854224036102144			
	It is original research & thoughts.	wmougayar	0	0	1470699558	762795349522079744	https://twitter.com/wmougayar/status/762795349522079744			
bitcoin 	At the Toronto Bitcoin Meetup # FinTechCanada, about to go on a VC panel with... https://www.swarmapp.com/c/iWL0uzgwmnl pic.twitter.com/2KvZsRJP4n	wmougayar	8	3	1470695805	762779610782334976	https://twitter.com/wmougayar/status/762779610782334976		#	
	spoken like someone who's had to read one.	sytaylor	1	0	1470762205	763058111099858944	https://twitter.com/sytaylor/status/763058111099858944			
	that doesn't really describe how sharing will work or data will be safe. Anyone solved that?	sytaylor	0	0	1470754570	763026089266601984	https://twitter.com/sytaylor/status/763026089266601984			
	Having the largest banks publish and deliver an API standard is like asking Cookie Monster to guard the Cookieshttps://twitter.com/PaymentEye/status/762993343378759680 …	sytaylor	18	12	1470747040	762994505389903872	https://twitter.com/sytaylor/status/762994505389903872			
	Cc @ davidbrearhttps://twitter.com/kantox/status/762983728998182912 …	sytaylor	1	0	1470744579	762984183157383168	https://twitter.com/sytaylor/status/762984183157383168			@
	a 0 - 0 draw.	sytaylor	1	0	1470744089	762982126790795264	https://twitter.com/sytaylor/status/762982126790795264			
	@ AAinslie @ WSJpic.twitter.com/LXy5WdGCCC	sytaylor	1	0	1470744071	762982052564176896	https://twitter.com/sytaylor/status/762982052564176896			@ @
	Spot. Freaking. On. Cc @ dgwbirchhttps://twitter.com/kadhimshubber/status/762981628335587328 …	sytaylor	2	0	1470744040	762981921106305026	https://twitter.com/sytaylor/status/762981921106305026			@
	"When big banks ""welcome"" a report it's usually a sign it's not particularly contentious or difference making. *cough* CMA"	sytaylor	5	3	1470742963	762977406483369984	https://twitter.com/sytaylor/status/762977406483369984			
	How the big high street banks responded to the CMA report # fintech http://www.cityam.com/247156/big-high-street-banks-responded-cma-report … via @ CityAM	sytaylor	0	1	1470742905	762977160986492928	https://twitter.com/sytaylor/status/762977160986492928		#	@
	@ twobitidiot money and cat pictures are two very different business / security models	sytaylor	2	0	1470742178	762974114382483456	https://twitter.com/sytaylor/status/762974114382483456			@
	not saying it's easy. But nosql isn't the solution. It's part of a bigger picture often not discussed imo	sytaylor	0	0	1470741570	762971562186342400	https://twitter.com/sytaylor/status/762971562186342400			
	Sharded or some other data architecture, check out @ IPDBFoundation - it's early but has some great ideas	sytaylor	2	1	1470739935	762964703714930689	https://twitter.com/sytaylor/status/762964703714930689			@
	+ this is why adaptor is crucial, is there room for IPFS / IPDB layer operated by the repositories w/ # blockchain maintaining state	sytaylor	0	0	1470739782	762964063970267136	https://twitter.com/sytaylor/status/762964063970267136		#	
	true, but at least you'd have an automated way to reference agreed state that a workflow (contract) could read and operate	sytaylor	0	0	1470739730	762963845765861376	https://twitter.com/sytaylor/status/762963845765861376			
	"The ""how"" question is one I'm suggesting needs debate, but I think it's two things 1) Fabric of hashes 2) Repository upgrades"	sytaylor	0	0	1470739666	762963577988841472	https://twitter.com/sytaylor/status/762963577988841472			
	should have read *will not* become a golden source of capital markets data... They store hashes	sytaylor	0	0	1470739616	762963368810582016	https://twitter.com/sytaylor/status/762963368810582016			
	"What's the ""adaptor"" between repository and and finance fabric - who defines it, who uses it and how does it work, debate to be had!"	sytaylor	0	0	1470739293	762962014138281984	https://twitter.com/sytaylor/status/762962014138281984			
	but in doing so, you could eliminate the need for banks to hold their own idiosyncratic repository over time.	sytaylor	0	0	1470739225	762961728632156160	https://twitter.com/sytaylor/status/762961728632156160			
	Agreed, there's a part of the conversation missing about upgrading repositories that's critical	sytaylor	1	0	1470739180	762961536705003521	https://twitter.com/sytaylor/status/762961536705003521			
	In other words # Blockchain will sync up existing trade repositories with state at a point in time & reconciliation via cryptography	sytaylor	4	1	1470738990	762960739338444800	https://twitter.com/sytaylor/status/762960739338444800		#	
	I doubt # Blockchain (s) themselves will become golden sources for Capital Markets data - but rather the mesh that creates a meta state	sytaylor	3	1	1470738941	762960534069211140	https://twitter.com/sytaylor/status/762960534069211140		#	
	Competition watchdog enforces smartphone bankin revolution # fintech innovation via regulation? http://www.telegraph.co.uk/news/2016/08/08/competion-watchdogs-to-enforce-smartphone-banking-revolution/ … via @ telegraphnews	sytaylor	4	6	1470727945	762914416899809280	https://twitter.com/sytaylor/status/762914416899809280		#	@
	@ AAinslie @ WSJ not really. People build on ideas all the time. The cypher punks behind the Internet had a very diff vision	sytaylor	1	1	1470727801	762913809556180992	https://twitter.com/sytaylor/status/762913809556180992			@ @
	Durch diesen coolen Trick erinnere ich mich selbst an meine Ziele http://bit.ly/28NRHBG pic.twitter.com/lWveBW1xpb	julianhosp	0	0	1470772932	763103106175557633	https://twitter.com/julianhosp/status/763103106175557633			
	Die 10 Fähigkeiten um im Leben zu dominieren: http://youtu.be/LKdYJJv569M?a  via @ YouTube	julianhosp	0	0	1470769626	763089237944262660	https://twitter.com/julianhosp/status/763089237944262660			@
	#169 – Wer wird älter? Ein 9 Monate oder 2 Jahre altes Kind? http://tab.25geschichten.de/169	julianhosp	0	0	1470768181	763083178038951936	https://twitter.com/julianhosp/status/763083178038951936		#169	
	Julian's Pyramid of 10 skills to dominate in life: http://youtu.be/GcoqdZvvtPY?a  via @ YouTube	julianhosp	0	0	1470751264	763012223451144192	https://twitter.com/julianhosp/status/763012223451144192			@
