	Yay, pokemon turtles with crabs!https://twitter.com/nucoFuture/status/763110575819853824 …	VitalikButerin	12	1	1470777136	763120735279779840	https://twitter.com/VitalikButerin/status/763120735279779840			
	One weak point of current cryptoeconomic thought is the lack of an explicit model of capital lockup costs. @ VladZamfir @ el33th4xor	VitalikButerin	47	13	1470777025	763120273684062209	https://twitter.com/VitalikButerin/status/763120273684062209			@ @
bitcoin 	What's going to happen to the # Bitcoin??? . @ alextapscott comments on the # BitfinexHack here:http://bankinnovation.net/2016/08/another-day-another-bitcoin-after-the-bitfinex-hack/ …	dtapscott	2	6	1470773398	763105058594689024	https://twitter.com/dtapscott/status/763105058594689024		# #	@
	Hillary Clinton brings # Blockchain to Washington! # BlockchainPresident # ImWithHerhttps://lnkd.in/eG5rQ7p	dtapscott	13	15	1470768215	763083320330682368	https://twitter.com/dtapscott/status/763083320330682368		# # #	
	Summer garden parties are the best! # LakeofBays # Summer # Muskokapic.twitter.com/zsdseOo0xc	dtapscott	14	3	1470767561	763080575955640320	https://twitter.com/dtapscott/status/763080575955640320		# # #	
	The # BlockchainRevolution has started! Mark Carney embraces # Fintech and # Blockchain!https://lnkd.in/eS6N8qk	dtapscott	16	18	1470755242	763028905951367168	https://twitter.com/dtapscott/status/763028905951367168		# # #	
	Do YOU have a great idea for a new # blockchain application??? Enter the @ ideas challenge here:https://www.ideapod.com/blockchainrevolution …	dtapscott	6	5	1470753089	763019877091274752	https://twitter.com/dtapscott/status/763019877091274752		#	@
	. @ KimDotcom @ BankToTheFuture START spreading the news... @ start_coin @ StartJOIN	maxkeiser	13	7	1470733404	762937313777385472	https://twitter.com/maxkeiser/status/762937313777385472			@ @ @ @
	. @ voxdotcom Because America Is Already Great?	maxkeiser	13	5	1470698173	762789544446070785	https://twitter.com/maxkeiser/status/762789544446070785			@
	"Très haut débit : ""Houston, we have a problem""pic.twitter.com/c02EEPRo7T"	babgi	62	132	1470755132	763028446729670656	https://twitter.com/babgi/status/763028446729670656			
	Mid-Year Review of 2016 Retail # Banking Trends and Predictions http://bit.ly/1PLBhfX @ KPMG_US # fintechpic.twitter.com/vZBSdWod2l	JimMarous	3	8	1470774933	763111498516357120	https://twitter.com/JimMarous/status/763111498516357120		# #	@
	# Digital # Innovation Transforming the # Banking Industry http://bit.ly/1Sfysze @ DeloitteFinSvcs # fintechpic.twitter.com/wolcMc50pQ	JimMarous	22	17	1470774757	763110757584121856	https://twitter.com/JimMarous/status/763110757584121856		# # # #	@
	# Fintech Poised to Disrupt # Banking Industry http://bit.ly/2aJAbDS @ EYnews @EY_Technologypic.twitter.com/cbmoFth70l	JimMarous	23	33	1470769883	763090314420559872	https://twitter.com/JimMarous/status/763090314420559872		# #	@ @EY_Technologypic
	# Banking vs. # Fintech: A Business Case for Coopetition http://bit.ly/2aFA06m @ McKinsey @ McKQuarterlypic.twitter.com/sG4eV6nEoo	JimMarous	4	8	1470768228	763083372499382272	https://twitter.com/JimMarous/status/763083372499382272		# #	@ @
	"# Google, # Facebook and # Alibaba all Aspire to Become ""Uber of # Banking"" http://bit.ly/2aWMCr0 # fintech @CIBBVApic.twitter.com/H3ppsgaBLb"	JimMarous	9	8	1470768011	763082463270756352	https://twitter.com/JimMarous/status/763082463270756352		# # # # #	@CIBBVApic
	A World Beyond # Passwords http://bit.ly/2ax2oN3 @ DU_Press # fintech # security # UXpic.twitter.com/Vw95mPMTpa	JimMarous	2	1	1470767941	763082169250029568	https://twitter.com/JimMarous/status/763082169250029568		# # # #	@
	"Join me for ""Transforming Branch Account Opening"" Aug 16 1:00 ET http://ow.ly/7W1n3033hhc @ miteksystems # fintechpic.twitter.com/cHb9xVsj0Z"	JimMarous	6	13	1470764138	763066220660744192	https://twitter.com/JimMarous/status/763066220660744192		#	@
	# Blockchain is About More Than # Fintech Interview with @ sammaule http://bit.ly/2axg1LS @ Irish_TechNewspic.twitter.com/WrC5FeV9Jc	JimMarous	29	43	1470745184	762986722846093313	https://twitter.com/JimMarous/status/762986722846093313		# #	@ @
bitcoin 	135-Page # Blockchain Report Use Cases & Technology from @ CreditSuisse http://buff.ly/2aGbGlK # fintech # Bitcoinpic.twitter.com/4IgoAtiylH	JimMarous	13	18	1470738751	762959740724875264	https://twitter.com/JimMarous/status/762959740724875264		# # #	@
	A World Beyond # Passwords http://bit.ly/2ax2oN3 @ DU_Press # fintech # security # UX @ digits @ 1Passwordpic.twitter.com/Oqmhs0tnqV	JimMarous	37	44	1470738424	762958365274218497	https://twitter.com/JimMarous/status/762958365274218497		# # # #	@ @ @
bitcoin 	""" # Bitcoin Could Go Mainstream in 2017"" Interview with @ oscarjofre http://bit.ly/2aIoxcl @ Irish_TechNews # fintechpic.twitter.com/oK6Mz7qJyJ"	JimMarous	9	19	1470737363	762953918754140160	https://twitter.com/JimMarous/status/762953918754140160		# #	@ @
	‘ # Banking in the Cognitive Era: Part 2’ https://soundcloud.com/ibm/sets/banking-in-the-cognitive-era-part-2?utm_source=soundcloud&utm_campaign=share&utm_medium=twitter … @IBMBanking # BigData # IBMwatson # analyticspic.twitter.com/edl8fyfAT8	JimMarous	11	7	1470699605	762795549808402432	https://twitter.com/JimMarous/status/762795549808402432		# # # #	@IBMBanking
	"# Google, # Facebook and # Alibaba all Aspire to Become ""Uber of # Banking"" http://bit.ly/2aWMCr0 # fintech @CIBBVApic.twitter.com/KQTs6yH1lx"	JimMarous	12	9	1470699195	762793828021514245	https://twitter.com/JimMarous/status/762793828021514245		# # # # #	@CIBBVApic
	# Banking Start-up @ simple Turns 7: Still Innovating http://read.bi/2aAWaHw @ i2pi @ StrictlyVC @ shamir_k # fintechpic.twitter.com/Dtt0KGhvGr	JimMarous	29	22	1470698821	762792260115181568	https://twitter.com/JimMarous/status/762792260115181568		# #	@ @ @ @
	The Future of # Banking is Here: # Cognitive Banking http://bit.ly/2aN8jMw @ BankingTechno # fintech @IBMBankingpic.twitter.com/8NzjH8I1Vz	JimMarous	15	13	1470698215	762789718085947393	https://twitter.com/JimMarous/status/762789718085947393		# # #	@ @IBMBankingpic
	you're quoting rhetoric, ignorantly. How about spending some time understanding the business model?	VinnyLingham	0	0	1470752237	763016304034848768	https://twitter.com/VinnyLingham/status/763016304034848768			
	the lack of transparency suggests not	VinnyLingham	0	0	1470708255	762831829976047616	https://twitter.com/VinnyLingham/status/762831829976047616			
	Free identity theft protection is here from Civichttp://www.clark.com/free-identity-theft-protection-is-here-from-civic#.V6ks6GHMqNQ.twitter …	VinnyLingham	8	7	1470704876	762817655635980289	https://twitter.com/VinnyLingham/status/762817655635980289		#	
	Haha. Good one!	SatoshiLite	2	0	1470763688	763064331391029248	https://twitter.com/SatoshiLite/status/763064331391029248			
	MGT Story in Street Register: http://streetregister.com/2016/08/09/mgt-capital-investments-inc-nysemktmgt-is-poised-for-industry-leadership/ …	officialmcafee	38	13	1470731156	762927883404845056	https://twitter.com/officialmcafee/status/762927883404845056			
	My podcast with Vince in the Bay about Sentinel:https://vinceinthebay.com/2016/08/08/defcon-24-john-mcafee/ …	officialmcafee	41	19	1470696873	762784088575119364	https://twitter.com/officialmcafee/status/762784088575119364			
	If you stay home playing video games all day, you won't owe the IRS a dime, but if you work hard, they'll send you to jail if you don't pay.	rogerkver	538	161	1470762139	763057833491378176	https://twitter.com/rogerkver/status/763057833491378176			
	another @ Breakingbanks1 host also!	BrettKing	1	0	1470744792	762985075269103616	https://twitter.com/BrettKing/status/762985075269103616			@
	yup	BrettKing	1	0	1470696150	762781057997500416	https://twitter.com/BrettKing/status/762781057997500416			
	Rare business article that's worth reading. Amazon itself may get disrupted by new logistics grid. https://stratechery.com/2016/walmart-and-the-multichannel-trap/ … via @ stratechery	naval	142	44	1470772790	763102510517096448	https://twitter.com/naval/status/763102510517096448			@
	Facebook Is Wiping Away Evidence Of Police Brutalityhttps://theintercept.com/2016/08/08/facebook-removes-potential-evidence-of-police-brutality-too-readily-activists-say/ …	aantonop	52	61	1470770481	763092826133401600	https://twitter.com/aantonop/status/763092826133401600			
	Not really. I am skeptical about the applicability of blockchains to IoT.	aantonop	1	1	1470770212	763091696020094976	https://twitter.com/aantonop/status/763091696020094976			
	What about it? None of that is the topic of my article.	aantonop	0	0	1470768874	763086083143806980	https://twitter.com/aantonop/status/763086083143806980			
	I'm not trying to sell or criticize Segwit. I'm simply analyzing its impact on economic incentives.	aantonop	4	3	1470766488	763076076046168064	https://twitter.com/aantonop/status/763076076046168064			
	Disagree. If the market doesn't agree with a change in the pricing unit, Segwit will not be adopted. Market can re-price fees	aantonop	1	1	1470761072	763053361646047232	https://twitter.com/aantonop/status/763053361646047232			
	Because the pricing unit (transaction size including signatures) was not a good unit for price discovery, it caused distortion	aantonop	2	1	1470761034	763053200110854144	https://twitter.com/aantonop/status/763053200110854144			
bitcoin 	See if it makes more sense in color: https://github.com/bitcoinbook/bitcoinbook/blob/first_edition/ch08.asciidoc#blockchain-forks …	aantonop	1	1	1470752037	763015464318402560	https://twitter.com/aantonop/status/763015464318402560		#blockchain	
	Yeah, that was an unfortunate expectation and editing error. It will be fixed in 2nd Ed. Digital edition is in color on github now.	aantonop	1	0	1470751798	763014460692803585	https://twitter.com/aantonop/status/763014460692803585			
	ICYMI Segregated Witness and aligning economic incentives with resource costshttps://medium.com/@aantonop/segregated-witness-and-aligning-economic-incentives-with-resource-costs-7d987b135c00#.8n2rlv9my …	aantonop	30	30	1470696490	762782482324258816	https://twitter.com/aantonop/status/762782482324258816		#	@aantonop
	Or maybe you have the correlation backwards...	ErikVoorhees	0	0	1470767162	763078905129414656	https://twitter.com/ErikVoorhees/status/763078905129414656			
	Blockchain assets I'm excited for: @ AugurProject , @ zcashco , Rootstock, & @ LBRYio	ErikVoorhees	40	18	1470759938	763048602545459200	https://twitter.com/ErikVoorhees/status/763048602545459200			@ @ @
	I did see you bought that new Lambo, Meltem... hmmmmmm	ErikVoorhees	0	0	1470759623	763047283273314309	https://twitter.com/ErikVoorhees/status/763047283273314309			
	LBRY now available on ShapeShifthttps://twitter.com/LBRYio/status/763031983102521348 …	ErikVoorhees	12	8	1470758068	763040760388210689	https://twitter.com/ErikVoorhees/status/763040760388210689			
bitcoin 	Dubai Government Seeks Blockchain Projects for Startup Fund http://www.coindesk.com/dubai-blockchain-startups-accelerator/ … via @ CoinDesk # bitcoin	ErikVoorhees	11	12	1470757952	763040272448036864	https://twitter.com/ErikVoorhees/status/763040272448036864		#	@
	you guys as well!	ErikVoorhees	2	0	1470755603	763030421521084416	https://twitter.com/ErikVoorhees/status/763030421521084416			
	yeah thats my point...	ErikVoorhees	1	0	1470723760	762896862454034432	https://twitter.com/ErikVoorhees/status/762896862454034432			
	Not anywhere to the same degree.	ErikVoorhees	1	0	1470723742	762896785744338944	https://twitter.com/ErikVoorhees/status/762896785744338944			
	the problem is not money, but elections.	ErikVoorhees	2	0	1470722631	762892124899553281	https://twitter.com/ErikVoorhees/status/762892124899553281			
	Money is no more dangerous than speech, yet upon one is placed all manner of surveillance, while the other enjoys near universal liberty.	ErikVoorhees	57	28	1470722406	762891183043469313	https://twitter.com/ErikVoorhees/status/762891183043469313			
	"@ ShapeShift_io hmmmm point number 1 on such a document might be, ""1. Do not share opsec regimen with outsiders"""	ErikVoorhees	2	0	1470714239	762856927919341569	https://twitter.com/ErikVoorhees/status/762856927919341569			@
	@ ShapeShift_io I dont disagree with that	ErikVoorhees	1	0	1470713689	762854622763425792	https://twitter.com/ErikVoorhees/status/762854622763425792			@
	Kinda like how there are hundreds of companies that make shoes... ridiculous!	ErikVoorhees	0	0	1470713666	762854526508343296	https://twitter.com/ErikVoorhees/status/762854526508343296			
ethereum 	Ethereum has proven that not only will there be multiple tokens in cryptoland, but perhaps even tokens of tokens. @ ShapeShift_io	ErikVoorhees	39	20	1470712821	762850980547338241	https://twitter.com/ErikVoorhees/status/762850980547338241			@
	Imagine a Floating Glass Sphere Filled with Immutable Information Bits | Jeffrey Tucker http://fee.org/articles/imagine-a-floating-glass-sphere-filled-with-immutable-information-bits/ … via @ feeonline	ErikVoorhees	13	10	1470711332	762844735773958144	https://twitter.com/ErikVoorhees/status/762844735773958144			@
	I will also celebrate, its a great product	ErikVoorhees	4	1	1470708083	762831106538299392	https://twitter.com/ErikVoorhees/status/762831106538299392			
	That will likely be next monday, so I'll make sure to let you know!	ErikVoorhees	1	0	1470698887	762792535815102465	https://twitter.com/ErikVoorhees/status/762792535815102465			
	"If someone told me when I was young I'd grow up to run a company that sells something called ""Shadowcash,"" I'd be so excited :)"	ErikVoorhees	92	29	1470698644	762791517517864960	https://twitter.com/ErikVoorhees/status/762791517517864960			
	That account is a scam account.	ErikVoorhees	1	0	1470695504	762778349181599744	https://twitter.com/ErikVoorhees/status/762778349181599744			
bitcoin 	Our security team completed an awesome AMA on Reddit today https://www.reddit.com/r/Bitcoin/comments/4wx23q/coinbase_security_team_ama_10am_pdt_today_here/ … Our goal is to be the most trusted brand in the space.	brian_armstrong	60	23	1470779530	763130776271527936	https://twitter.com/brian_armstrong/status/763130776271527936			
	New blog post: Why Compliance Is Key To Digital Currency's Successhttps://medium.com/the-coinbase-blog/building-the-bridge-why-compliance-is-key-to-digital-currencys-success-7bfdd88a084c#.x6k2j0u3g …	brian_armstrong	23	18	1470778455	763126269806379008	https://twitter.com/brian_armstrong/status/763126269806379008		#	
	oh, nice!	TuurDemeester	0	0	1470776704	763118924246331392	https://twitter.com/TuurDemeester/status/763118924246331392			
	Part 2 is still in the works... Will also be on Medium	TuurDemeester	1	1	1470772199	763100030555131904	https://twitter.com/TuurDemeester/status/763100030555131904			
	It's a pretty obscure market, so I'm not surprised. Maybe ask the team behind the ETI?	TuurDemeester	1	0	1470772153	763099836237254657	https://twitter.com/TuurDemeester/status/763099836237254657			
	It's a security, you can buy it if you have a brokerage account that has access to the German markets.	TuurDemeester	1	0	1470766211	763074914047799296	https://twitter.com/TuurDemeester/status/763074914047799296			
bitcoin 	Gibraltar Registered Bitcoin ETI now tradable on Deutsche Börse: http://ow.ly/p20L3034XNY  More:https://bitcoineti.com	TuurDemeester	1	4	1470766101	763074452619927552	https://twitter.com/TuurDemeester/status/763074452619927552			
	Can you point me to other interviews where a narcissist talks about his narcissism explicitly, as a personality disorder?	TuurDemeester	0	0	1470765641	763072524837990400	https://twitter.com/TuurDemeester/status/763072524837990400			
	Ultra rare: a narcissist talking about his # narcissism. Have encountered these people in & out of business contexts.http://www.drpsychmom.com/2014/09/08/interview-narcissist-dr-sam-vaknin-deigns-interviewed/# …	TuurDemeester	6	2	1470764253	763066702137401344	https://twitter.com/TuurDemeester/status/763066702137401344		# #	
bitcoin 	"Bitcoin trader abt Bitmex post: ""not defending Bitfinex, but this is bull¨¨¨¨ accounting"" https://www.reddit.com/r/BitcoinMarkets/comments/4wu38s/bitfinex_arthur_hayes_estimates_342_million_6/d6a36lm …https://twitter.com/TuurDemeester/status/762885923642028033 …"	TuurDemeester	5	3	1470730405	762924733025230849	https://twitter.com/TuurDemeester/status/762924733025230849			
	Oh, didn't know they had one.	TuurDemeester	1	0	1470723786	762896972596424704	https://twitter.com/TuurDemeester/status/762896972596424704			
	Indeed - should have checked the handle first!	TuurDemeester	1	0	1470723762	762896868749619200	https://twitter.com/TuurDemeester/status/762896868749619200			
	Désolé, je ne sais pas ce qui c'est passé	TuurDemeester	0	0	1470723725	762896716521582593	https://twitter.com/TuurDemeester/status/762896716521582593			
	". @ Bitmex CEO penned a brutal breakdown of the Bitfinex hack: ""You've Been ButtFinessed"" http://ow.ly/GThm3033B51 pic.twitter.com/tXOX5pFn5n"	TuurDemeester	17	10	1470721152	762885923642028033	https://twitter.com/TuurDemeester/status/762885923642028033			@
	From a monetary perspective, the US economy was healthy in the 19th century under the gold standard.	TuurDemeester	1	0	1470720184	762881863056699392	https://twitter.com/TuurDemeester/status/762881863056699392			
	same for 50%	TuurDemeester	3	0	1470720074	762881403042140160	https://twitter.com/TuurDemeester/status/762881403042140160			
	I think it would be extremely risky to hold 66% of crypto in an asset that's so unproven.	TuurDemeester	4	1	1470719899	762880666031697921	https://twitter.com/TuurDemeester/status/762880666031697921			
	The way to trade this would be to go long ETC/BTC and short ETH/BTC for the same position size.https://twitter.com/kyletorpey/status/762795871192903681 …	TuurDemeester	15	8	1470709695	762837871162068995	https://twitter.com/TuurDemeester/status/762837871162068995			
	Kidding ;-) I think it's a fun and dynamic environment, too!	TuurDemeester	2	1	1470709436	762836780911505410	https://twitter.com/TuurDemeester/status/762836780911505410			
	@ robinhanson That's because there is zero ego in crypto. As a top influencer I would know.	TuurDemeester	2	0	1470709283	762836141280075776	https://twitter.com/TuurDemeester/status/762836141280075776			@
	Haha, let's do this! And then we'll tokenize our shares for the ICO.	TuurDemeester	2	0	1470708933	762834673626025986	https://twitter.com/TuurDemeester/status/762834673626025986			
	@ Reddit_BTC I'll match that!	TuurDemeester	2	0	1470708658	762833519244488704	https://twitter.com/TuurDemeester/status/762833519244488704			@
	even that won't stop the inflation / reorganization of the structure of production.	TuurDemeester	0	0	1470708036	762830910349647872	https://twitter.com/TuurDemeester/status/762830910349647872			
	Germans unarmed they scared of Merkel's militarized police & # obama's 50k troops stationed>GER @ pllacey1 @ udouselesshttps://twitter.com/networksmanager/status/716397380929785858 …	NetworksManager	6	7	1470764412	763067369702891521	https://twitter.com/NetworksManager/status/763067369702891521		#	@ @
	The muslim middle eastern countries don't give benefits & don't have pretty girls as we do # migrants # rape # hijrah @ MarxSUCKS @ AMTrump4PRES	NetworksManager	22	18	1470764187	763066425065873408	https://twitter.com/NetworksManager/status/763066425065873408		# # #	@ @
	"Listen to muslims in Germany chant in English ""With alla's help we will conquer you"" @ aburbeconditaX @ AMTrump4PREShttps://twitter.com/networksmanager/status/716397380929785858 …"	NetworksManager	7	27	1470763216	763062353302687745	https://twitter.com/NetworksManager/status/763062353302687745			@ @
	Please tell your muslims seems the militant branch of islam is unaware they are not supposed to follow sharia. @ BlaugranaQ @ Easterndmondbk	NetworksManager	2	3	1470761590	763055531334340609	https://twitter.com/NetworksManager/status/763055531334340609			@ @
	Nobody cares about your stupid verses @ BlaugranaQ we let you migrate, gave you welfare & medical instead of thanks==https://twitter.com/networksmanager/status/748733401377583105 …	NetworksManager	2	5	1470761116	763053543506849792	https://twitter.com/NetworksManager/status/763053543506849792			@
	Why would u not convert? Why in the world would I read a book that inspires muslims to kill 400 times a month? @ BlaugranaQ @ Easterndmondbk	NetworksManager	3	4	1470760796	763052201665101825	https://twitter.com/NetworksManager/status/763052201665101825			@ @
	100% of isis attacks perpetrated by muslims @ BlaugranaQ we have right & duty to protect ourselves maybe u should convert? @ Easterndmondbk	NetworksManager	3	1	1470760434	763050683985645570	https://twitter.com/NetworksManager/status/763050683985645570			@ @
	The West stands with Israel. @ enajnitram1 @ AMTrump4PREShttps://twitter.com/enajnitram1/status/762983544427835392 …	NetworksManager	17	23	1470744944	762985714313158656	https://twitter.com/NetworksManager/status/762985714313158656			@ @
	"folks not attacking muslims b/c of their ""religion"" it b/c 400 islamic attacks/month demands self defense. @ zahed_nlhttps://twitter.com/zahed_nl/status/762739960491409408 …"	NetworksManager	7	6	1470709020	762835039239282688	https://twitter.com/NetworksManager/status/762835039239282688			@
	Well it high time # Britain held muslims responsible for all the killing & rape of girls @ mobythebadger @ DanEtchells https://twitter.com/mobythebadger/status/762756474036707328 …	NetworksManager	12	8	1470707668	762829365788876802	https://twitter.com/NetworksManager/status/762829365788876802		#	@ @
	100% of the 400 monthly isis attacks are perpetrated by muslims you folks need look n mirror. # BanIslam @ michelwi2011https://twitter.com/michelwi2011/status/762785015084318721 …	NetworksManager	32	36	1470707386	762828183909433344	https://twitter.com/NetworksManager/status/762828183909433344		#	@
	@ Italians4Trump follow me	NetworksManager	1	0	1470707169	762827276316618752	https://twitter.com/NetworksManager/status/762827276316618752			@
	After NICE islamic massacre attack on women & kids>>muslims migrant imam in Ireland calls for REFLECTION.. # BanIslamhttp://shr.gs/ObuPsbm	NetworksManager	64	155	1470706862	762825986702315520	https://twitter.com/NetworksManager/status/762825986702315520		#	
	Is there anything wrong with being different? What a boring place the world would be otherwise. @Tomgreen4200 @ Tslifeisblessed @ 1EMcGon1	haydentiff	3	2	1470709953	762838951061172224	https://twitter.com/haydentiff/status/762838951061172224			@Tomgreen4200 @ @
	People are different. Pretending otherwise prevents authenticity and can even be alienating. @Tomgreen4200 @ Tslifeisblessed @ 1EMcGon1	haydentiff	2	4	1470709796	762838294031806464	https://twitter.com/haydentiff/status/762838294031806464			@Tomgreen4200 @ @
	Pretending not to notice our differences keeps us from discussing & learning from them. @Tomgreen4200 @ Tslifeisblessed @ 1EMcGon1	haydentiff	3	11	1470709039	762835119740555264	https://twitter.com/haydentiff/status/762835119740555264			@Tomgreen4200 @ @
	This conversation started because I had to blog my reply, lol. @ 1EMcGon1 @ Tslifeisblessed @ torinellis	haydentiff	1	0	1470708719	762833776372101121	https://twitter.com/haydentiff/status/762833776372101121			@ @ @
	Oh gosh, this is anther time where I might need to blog to reply. I disagree with most of this. @ 1EMcGon1 @ Tslifeisblessed @ torinellis	haydentiff	1	2	1470708576	762833175978598400	https://twitter.com/haydentiff/status/762833175978598400			@ @ @
	I think because we've made it a sensitive topic, don't discuss it, and try to pretend it's gone. @ Tslifeisblessed @ 1EMcGon1 @ torinellis	haydentiff	2	3	1470708125	762831282158067713	https://twitter.com/haydentiff/status/762831282158067713			@ @ @
	In today's paper? Tslifeisblessed @ 1EMcGon1 @ freep	haydentiff	0	2	1470707433	762828383155810304	https://twitter.com/haydentiff/status/762828383155810304			@ @
	He's been credited for starting Detroit's decline and the racial strife that plagues the city to this day. @ 1EMcGon1 @ Tslifeisblessed	haydentiff	1	2	1470706474	762824360109408256	https://twitter.com/haydentiff/status/762824360109408256			@ @
	Old laws sitting on books don't feel quite the same as deliberately making the decision again, IMO. @ 1EMcGon1 @ Tslifeisblessed @ torinellis	haydentiff	1	2	1470705641	762820866342318085	https://twitter.com/haydentiff/status/762820866342318085			@ @ @
	FWIW, the renovations at @ cobocenter were a huge letdown. No # fintech or # innovation. @ 1EMcGon1 @ Tslifeisblessedhttps://twitter.com/haydentiff/status/736554288353292288 …	haydentiff	2	5	1470705231	762819146363072512	https://twitter.com/haydentiff/status/762819146363072512		# #	@ @ @
	But with Cobo Hall, they recently injected $280M into it and renamed it Cobo Center. It's repulsive. @ 1EMcGon1 @ Tslifeisblessed @ torinellis	haydentiff	2	3	1470705049	762818381561073665	https://twitter.com/haydentiff/status/762818381561073665			@ @ @
	I'm not able to let stuff like that go unnoticed. @ Tslifeisblessed @ torinellis @ Medium	haydentiff	3	2	1470704729	762817041338335232	https://twitter.com/haydentiff/status/762817041338335232			@ @ @
	Sounds like they might not understand the power of social media. Some of us are loud mouths. # Detroit @ Tslifeisblessed @ torinellis @ Medium	haydentiff	3	2	1470704692	762816883942907904	https://twitter.com/haydentiff/status/762816883942907904		#	@ @ @
	I was really upset when I read about it. To deliberately leave the name Cobo knowing what we know. Why? @ Tslifeisblessed @ torinellis @ Medium	haydentiff	2	3	1470704198	762814814544625671	https://twitter.com/haydentiff/status/762814814544625671			@ @ @
