	Appreciate it @ Richtopia! Thanks again for my interview with @ DerinCag... http://bit.ly/2gxvARR https://twitter.com/Richtopia/status/810863555130126336 …	dtapscott	13	9	1482169632	810904327204274176	https://twitter.com/dtapscott/status/810904327204274176			@ @
	Thank you for the mention @ Digitaltonto! # BlockchainRevolution # goodreadshttps://twitter.com/Digitaltonto/status/810830581563015168 …	dtapscott	1	0	1482158077	810855862101221378	https://twitter.com/dtapscott/status/810855862101221378		# #	@
	Thanks. …hm. Just passed 1.3 million views!https://twitter.com/xavislow/status/810640469315166208 …	dtapscott	8	1	1482157283	810852534566928384	https://twitter.com/dtapscott/status/810852534566928384			
	Thanks man!	dtapscott	3	2	1482157249	810852392430354436	https://twitter.com/dtapscott/status/810852392430354436			
	Good (wintery) morning Toronto!pic.twitter.com/i2uUJhlYn4	dtapscott	8	0	1482151733	810829252966891520	https://twitter.com/dtapscott/status/810829252966891520			
	. @ MMFlint You gotta admit this was a delicious moment in US media history. (The moment Hillary's loss was certain).pic.twitter.com/pksNj2hTsr	maxkeiser	146	36	1482167311	810894593294290944	https://twitter.com/maxkeiser/status/810894593294290944			@
	This fits with our comments about 2016 being yr. markets entered Bermuda Triangle phase.https://twitter.com/breakingnews/status/810863496967712768 …	maxkeiser	22	16	1482160026	810864038708211714	https://twitter.com/maxkeiser/status/810864038708211714			
	La place des langues natives dans le monde. Le française deuxième langue acquise après l'anglaispic.twitter.com/e6HvMPYFjo	babgi	164	249	1482185263	810969888315609088	https://twitter.com/babgi/status/810969888315609088			
	« Au lieu de réduire les inégalités, notre système éducatif les renforce »http://www.lemonde.fr/idees/article/2016/12/01/au-lieu-de-reduire-les-inegalites-notre-systeme-educatif-les-renforce_5041322_3232.html …	babgi	12	22	1482172447	810916134862094336	https://twitter.com/babgi/status/810916134862094336			
	Dans six mois les frais d'itinérance data et voix disparaissent... Merci qui ? Un combat (rude) de la Commission EUhttp://www.journaldugeek.com/2016/12/16/cest-officiel-les-frais-ditinerances-disparaitront-bien-en-europe-des-le-15-juin-prochain/ …	babgi	43	38	1482150110	810822448807628800	https://twitter.com/babgi/status/810822448807628800			
	16 extraordinaires inventions et découvertes faites en 2016... via @ wiredhttp://www.wired.co.uk/article/scientific-breakthroughs …	babgi	8	16	1482149854	810821372599500800	https://twitter.com/babgi/status/810821372599500800			@
	Over 100 Banking Leaders Make Bold Predictions for 2017. http://bit.ly/2017BankingTre … # fintech # IoT # AI # data # API # regtech # innovationpic.twitter.com/iS7DvQoZV3	JimMarous	13	18	1482186483	810975007958507520	https://twitter.com/JimMarous/status/810975007958507520		# # # # # # #	
	#1: Improve the # CX in Banking: Will # Banking Industry Continue to Underdeliver? http://bit.ly/2017BankingTrends … … @ Kony # CX # 2017BankTrendspic.twitter.com/33DxBsJxiV	JimMarous	2	6	1482172009	810914300667760640	https://twitter.com/JimMarous/status/810914300667760640		#1 # # # #	@
	Over 100 Banking Leaders Make Bold Predictions for 2017. http://bit.ly/2017BankingTrends … # fintech # IoT # AI # data # API # regtech # innovationpic.twitter.com/dy5GX8ML2g	JimMarous	132	127	1482154345	810840209256497152	https://twitter.com/JimMarous/status/810840209256497152		# # # # # # #	
	# FintechBuzzWordBingo	JimMarous	0	0	1482141792	810787561278939137	https://twitter.com/JimMarous/status/810787561278939137		#	
	104 Interviews + Global Banking Survey 2017 Retail Banking Trends Report http://bit.ly/2017BankingTrends … # CX # # analytics # fintech # APIs # digitalpic.twitter.com/ZyjgRFut1E	JimMarous	32	25	1482141642	810786930271125505	https://twitter.com/JimMarous/status/810786930271125505		# # # # # #	
	Just Released: 2017 Banking Trends and Predictions (104 Interviews) http://bit.ly/2017BankingTrends … # CX # data # fintech # API # payments # AI # IoTpic.twitter.com/ayLxrOdiqn	JimMarous	60	69	1482140692	810782944130371584	https://twitter.com/JimMarous/status/810782944130371584		# # # # # # #	
	Banks need to step up fast when it comes to banking # personalization. http://bit.ly/2hpdd5Z # fintech @ Accenture @ BankingInsightspic.twitter.com/wTCxAeuzSx	JimMarous	16	19	1482120476	810698153888534532	https://twitter.com/JimMarous/status/810698153888534532		# #	@ @
	truth. Everything is else subjective and open to interpretation.	VinnyLingham	2	1	1482160697	810866853857869825	https://twitter.com/VinnyLingham/status/810866853857869825			
bitcoin 	1996 heralded the dawn of the Information Age. 2016 has led us into the Misinformation Age. Math is now the only source of truth. # Bitcoin	VinnyLingham	112	61	1482148767	810816812552048640	https://twitter.com/VinnyLingham/status/810816812552048640		#	
	if you want to start a tech company and you don't have tech skills, yes.	VinnyLingham	2	1	1482139204	810776706449604608	https://twitter.com/VinnyLingham/status/810776706449604608			
	remember, my actual target was a $15bn market cap ($1k was the proxy price at the time before halving). We are close.	VinnyLingham	11	4	1482135313	810760384210698241	https://twitter.com/VinnyLingham/status/810760384210698241			
	thank you!	VinnyLingham	0	0	1482119985	810696092501348352	https://twitter.com/VinnyLingham/status/810696092501348352			
	My daughter, Nyana, and I at Rogue Onepic.twitter.com/mfiRc9X8M4	officialmcafee	177	11	1482123663	810711520581586944	https://twitter.com/officialmcafee/status/810711520581586944			
	Finance in Focus Podcast: Fintech drives the adoption of cognitive https://shar.es/1DHyUS  via @ IBMAnalytics	BrettKing	4	3	1482167276	810894446564937729	https://twitter.com/BrettKing/status/810894446564937729			@
	pretty obvious, but wish I had thought to include this observation in # augmentedbook	BrettKing	1	0	1482157923	810855218586021888	https://twitter.com/BrettKing/status/810855218586021888		#	
	My keynote at @ BDLaccelerate in Beirut, opening for @ stevewoz last month # Augmented # Bank4.0https://www.youtube.com/watch?v=KsnkEx9St24 …	BrettKing	6	3	1482127346	810726968958341120	https://twitter.com/BrettKing/status/810726968958341120		# #	@ @
	thanks!	BrettKing	2	0	1482115504	810677300631105536	https://twitter.com/BrettKing/status/810677300631105536			
	Who said anything about reputation?	naval	2	0	1482142103	810788863614406656	https://twitter.com/naval/status/810788863614406656			
	"“...try to solve [every problem] with an architecture [of people, process, and code]"" - @ traviskhttp://www.forbes.com/sites/miguelhelft/2016/12/14/how-travis-kalanick-is-building-the-ultimate-transportation-machine/amp/ …"	naval	126	35	1482135025	810759174686654464	https://twitter.com/naval/status/810759174686654464			@
	@ ClarkPolner Chess has objective correctness conditions that allow program to iterate past the designer's bias. No equivalent here.	naval	3	0	1482125124	810717650435407874	https://twitter.com/naval/status/810717650435407874			@
	Not that. General intelligence ls of Turing-test magnitude.	naval	1	0	1482120870	810699804569260032	https://twitter.com/naval/status/810699804569260032			
	I rarely block over a single tweet. I read their timeline and look for the pattern.	naval	8	1	1482116552	810681694160199680	https://twitter.com/naval/status/810681694160199680			
	Nope. I block high-conflict people to stay sane. I don't have a responsibility to you nor you to me.	naval	9	0	1482116343	810680818829930496	https://twitter.com/naval/status/810680818829930496			
	"They aren't ""sheeple."" Taking that viewpoint leads to strife, control, and misery."	naval	0	0	1482116205	810680240901013508	https://twitter.com/naval/status/810680240901013508			
	unless you're referring to memory or visual processing, I'd say that's false. The returns to general intelligence are increasing!	naval	0	0	1482115114	810675662113501185	https://twitter.com/naval/status/810675662113501185			
bitcoin 	Both will ultimately prove ineffective at stopping the massive disruption and change that bitcoin will bring.	aantonop	2	0	1482131319	810743631275507712	https://twitter.com/aantonop/status/810743631275507712			
ethereum 	Some legal analysis to see if an Ethereum token is a security (love the point system calculator)https://blog.coinbase.com/2016-12-07-blockchain-token-securities-law-a66ef03c383f#.8r3oah3nm …	brian_armstrong	3	10	1482178378	810941010159120384	https://twitter.com/brian_armstrong/status/810941010159120384		#	
	Coinbase holiday party 2016 @San Francisco, California https://www.instagram.com/p/BONX5z-BZOb/	brian_armstrong	9	3	1482172488	810916308896227331	https://twitter.com/brian_armstrong/status/810916308896227331			@San
	Listening to Shoe Dog, by Phil Knight, on @ audible_com while going for a run always a sucker for startup stories	brian_armstrong	5	0	1482114790	810674304224346112	https://twitter.com/brian_armstrong/status/810674304224346112			@
	Compared to Dash it seems to me that Monero has a lot more credibility.	TuurDemeester	4	1	1482178589	810941899200602112	https://twitter.com/TuurDemeester/status/810941899200602112			
	Many US providers seem to offer higher than 25 Mbps speeds. Looks like data skewed is in favor of homogenous countries.pic.twitter.com/OeZVZMmODj	TuurDemeester	1	1	1482176434	810932858768396288	https://twitter.com/TuurDemeester/status/810932858768396288			
	"Literal conclusion: Drug users are 4 times more likely to stay safe from violence using darknet markets compared to ""buying from a friend"".https://twitter.com/TuurDemeester/status/810930049293512706 …"	TuurDemeester	16	22	1482176121	810931547171786752	https://twitter.com/TuurDemeester/status/810931547171786752			
	Methodology (based on the Global Drug Survey):pic.twitter.com/sfJmJSFFHS	TuurDemeester	3	2	1482175826	810930307348058113	https://twitter.com/TuurDemeester/status/810930307348058113			
	Paper finds that darknet markets reduce drug-related physical violence & threats to personal safety by over 80% (!). http://sci-hub.cc/http://www.sciencedirect.com/science/article/pii/S0955395916301323 …pic.twitter.com/lFpv8730yp	TuurDemeester	101	77	1482175764	810930049293512706	https://twitter.com/TuurDemeester/status/810930049293512706			
	It notes that quite a few vendors use the same name / PGP key across multiple platforms:pic.twitter.com/QLpa4KGgE7	TuurDemeester	3	1	1482174579	810925079454425088	https://twitter.com/TuurDemeester/status/810925079454425088			
	Darknet markets in Canada: paper estimates that the country hosts over 150 active vendors. http://www.fsijournal.org/article/S0379-0738(16)30067-6/abstract?cc=y= …pic.twitter.com/8ysGeaaXM7	TuurDemeester	12	10	1482174515	810924808556920833	https://twitter.com/TuurDemeester/status/810924808556920833			
	Wow! The academic walled garden is crumbling... I'm curious about the implications of this.https://twitter.com/bodobalazs/status/810830675435810816 …	TuurDemeester	22	12	1482173429	810920254226448384	https://twitter.com/TuurDemeester/status/810920254226448384			
	"""In the first 10 months of this year alone, capital flight outflow topped $530 billion""https://twitter.com/lopp/status/810661759811993601 …"	TuurDemeester	9	16	1482161603	810870652336902145	https://twitter.com/TuurDemeester/status/810870652336902145			
	I also emailed himpic.twitter.com/9VfFtC4ks4	TuurDemeester	2	0	1482160394	810865583373709312	https://twitter.com/TuurDemeester/status/810865583373709312			
bitcoin 	I remember this meme being in every bitcoiner's feedpic.twitter.com/04RvJRelQL	TuurDemeester	4	6	1482138410	810773374398005248	https://twitter.com/TuurDemeester/status/810773374398005248			
bitcoin 	More here:https://www.reddit.com/r/Bitcoin/comments/1t5oe9/ill_bet_prof_mark_t_williams_5000_that_bitcoin/ …	TuurDemeester	5	0	1482116202	810680226384637952	https://twitter.com/TuurDemeester/status/810680226384637952			
bitcoin 	3 years ago today I challenged prof. Mark T Williams, who claimed Bitcoin would drop below $10 by summer 2014. He never took me up on it...https://twitter.com/TuurDemeester/status/413225084514361344 …	TuurDemeester	116	26	1482116162	810680059384262657	https://twitter.com/TuurDemeester/status/810680059384262657			
bitcoin 	Surprised about Bitcoin classic...	TuurDemeester	0	0	1482107401	810643313246224385	https://twitter.com/TuurDemeester/status/810643313246224385			
	thanks!	TuurDemeester	0	0	1482103522	810627043725627392	https://twitter.com/TuurDemeester/status/810627043725627392			
bitcoin 	We all need Alt-Warmth this time of year - https://www.mcsweeneys.net/articles/why-i-am-changing-the-name-of-our-puppy-burning-movement-to-alt-warmth … @ mcsweenys # humour (honest!) # doglovers @ leashless @ BitcoinByte	mrmainelli	4	3	1482152094	810830770474545154	https://twitter.com/mrmainelli/status/810830770474545154		# #	@ @ @
	Palestine Music Expo needs your Alt-Christmas help - https://www.gofundme.com/palestinemusicexpo … @Pal_M_X @ lucieelsie @ Palestine_UN @ ochaopt @ PalestineRemix	mrmainelli	2	3	1482150445	810823850535649280	https://twitter.com/mrmainelli/status/810823850535649280			@Pal_M_X @ @ @ @
	How Republics End? = # islam	NetworksManager	21	11	1482180185	810948591187619840	https://twitter.com/NetworksManager/status/810948591187619840		#	
	Hope Trump levels with us about what's going on. There's our engineered cloud cover. # DC https://twitter.com/NetworksManager/status/810915580542849024 …pic.twitter.com/nJeqMcbhYk	NetworksManager	16	11	1482178940	810943371086884868	https://twitter.com/NetworksManager/status/810943371086884868		#	
	We'll have our cloud covering by 5pm. # DCpic.twitter.com/zhpojZB6aM	NetworksManager	31	14	1482172315	810915580542849024	https://twitter.com/NetworksManager/status/810915580542849024		#	
	President Putin might actually restore Christianity back to Istanbul... God bless Vladimir, the Russian people & may their diplomat RIP. # DC	NetworksManager	316	188	1482171803	810913436397957121	https://twitter.com/NetworksManager/status/810913436397957121		#	
	One of Justin Trudeau's muslim migrants charged for killings his two sisters in an apparent islamic honor killing.http://www.metronews.ca/news/ottawa/2016/12/18/brother-arrested-after-double-homicide-leaves-two-women-dead.html …	NetworksManager	104	234	1482120565	810698528083349504	https://twitter.com/NetworksManager/status/810698528083349504			
	The world will not be destroyed by those who do evil, but by those who watch them without doing anything. ― Albert Einstein. # DC # BanIslam	NetworksManager	496	397	1482119378	810693548664295424	https://twitter.com/NetworksManager/status/810693548664295424		# #	
	Radical islamic terrorist drives up on motorcycle & kills five female flight attendants in Afghanistan. # BanIslam # DChttp://aje.io/nxdz	NetworksManager	145	381	1482117913	810687403950305280	https://twitter.com/NetworksManager/status/810687403950305280		# #	
	That's awesome @ 1DEPLORABLE!! I still got some Kuna's laying around I'll check it out :) https://twitter.com/1DEPLORABLE/status/810644519716868096 …	NetworksManager	4	1	1482108806	810649206226616320	https://twitter.com/NetworksManager/status/810649206226616320			@
	0 - media works for the bad guys.	NetworksManager	4	2	1482108564	810648191855132672	https://twitter.com/NetworksManager/status/810648191855132672			
	Anybody that researches Obama's birth certificate longer than 1 hour confirms it's fake. @ fedupwithpc1 @ exboabanker https://mobile.twitter.com/fedupwithpc1/status/810638838506934273 …	NetworksManager	26	25	1482106525	810639637114998784	https://twitter.com/NetworksManager/status/810639637114998784			@ @
	I love Croatia :) @ 1DEPLORABLE https://twitter.com/1DEPLORABLE/status/810637000529367040 …	NetworksManager	4	4	1482106194	810638248875872256	https://twitter.com/NetworksManager/status/810638248875872256			@
	The masses never do @ t5monkey. LOOK at Revolutionary War, Civil War, WW1+WW2 the masses tried to ignore it. # DC # MAGAhttps://twitter.com/t5monkey/status/810634827783344128 …	NetworksManager	7	9	1482105671	810636055854678016	https://twitter.com/NetworksManager/status/810636055854678016		# #	@
	Loretta Lynch says now that Traitor-N-Chief Obama+Hillary Clinton lost - she regrets having that criminal meeting w/ Bill Clinton. # DC # MAGA	NetworksManager	298	225	1482104511	810631189786689536	https://twitter.com/NetworksManager/status/810631189786689536		# #	
	Authorities in croatia busted muslims with large cache of drugs, weapons & explosives. This is war folks-> # Banislam https://translate.googleusercontent.com/translate_c?act=url&depth=1&hl=en&ie=UTF8&nv=1&prev=_t&rurl=translate.google.com&sl=auto&tl=en&u=http://www.uskinfo.ba/m/vijest/foto-sipa-sprijecila-isporuke-droge-i-oruzja-u-zagreb-pogledajte-zaplijenjene-predmete/30377&usg=ALkJrhg8hxcdeOQrS2aHqnkKwRzpuSLEdA …	NetworksManager	141	200	1482104354	810630531792642052	https://twitter.com/NetworksManager/status/810630531792642052		#	
	My son can eat his weight in crab legs...pic.twitter.com/hKKJPfTITB	haydentiff	17	2	1482184591	810967071769198592	https://twitter.com/haydentiff/status/810967071769198592			
ripple 	That's an epic beat-down of his inner self? He wouldn't survive an hour of my inner dialogue, lol. @ RippleCreekNW @ SealWhiskers	haydentiff	2	3	1482178027	810939538235334656	https://twitter.com/haydentiff/status/810939538235334656			@ @
	Let's open the bidding up and see if anyone dares to suggest 50 yrs. @ patersonderek18 @ FlintGate @ maddow @ MMFlinthttps://www.theguardian.com/world/2015/apr/30/chinese-construction-firm-erects-57-storey-skyscraper-in-19-days …	haydentiff	8	4	1482166405	810890792336293888	https://twitter.com/haydentiff/status/810890792336293888			@ @ @ @
	That's so mean! Lol. @ GerberKawasaki @ JonErlichman @ Reuters	haydentiff	2	2	1482159098	810860146054365184	https://twitter.com/haydentiff/status/810860146054365184			@ @ @
	Did you know that Uber plans to replace many of its drivers with autonomous vehicles? @ GerberKawasaki @ JonErlichmanhttps://www.google.com/amp/mobile.reuters.com/article/amp/idUSKCN11K12Y?client=safari …	haydentiff	4	3	1482158704	810858492043153408	https://twitter.com/haydentiff/status/810858492043153408			@ @
	$28 BILLION? @ GerberKawasaki @ JonErlichman https://www.bloomberg.com/news/articles/2016-08-17/an-expert-in-valuation-says-uber-may-have-already-peaked …	haydentiff	0	2	1482158051	810855755779862528	https://twitter.com/haydentiff/status/810855755779862528			@ @
	Valuation (Dec 2016): Uber: $68 billion Ford: $50 billion Valuation (Dec 2011): Ford: $40 billion Uber $330 million h/t @ JonErlichman	haydentiff	6	4	1482157113	810851821250113540	https://twitter.com/haydentiff/status/810851821250113540			@
	# UpsideOf2016pic.twitter.com/qNTx7cqC4g	haydentiff	12	4	1482151652	810828917141598208	https://twitter.com/haydentiff/status/810828917141598208		#	
	Good morning beautiful people! @ babushka99	haydentiff	6	2	1482141258	810785319402487809	https://twitter.com/haydentiff/status/810785319402487809			@
	The # FlintWaterCrisis isn't over. An entire city has been poisoned. @ onetoughnerd @ jasoninthehouse # MISOTS17 # racismhttps://twitter.com/fawfulfan/status/810225822837706753 …	haydentiff	8	9	1482139799	810779201523552256	https://twitter.com/haydentiff/status/810779201523552256		# # #	@ @
	Such low standards. Falsified credentials are gaining access to SWIFT's network, which has NO emergency mechanisms in place. # CyberSecurityhttps://twitter.com/swiftcommunity/status/808739803722383360 …	haydentiff	3	5	1482116254	810680444358455296	https://twitter.com/haydentiff/status/810680444358455296		#	
	Someone trying to get to embassy?	stacyherbert	7	5	1482171368	810911611963772928	https://twitter.com/stacyherbert/status/810911611963772928			
	Interesting infohttps://twitter.com/nate_cohn/status/810872177264328709 …	stacyherbert	4	1	1482162453	810874217747140608	https://twitter.com/stacyherbert/status/810874217747140608			
	Dinner timepic.twitter.com/L0clbsAbAY	stacyherbert	7	2	1482107158	810642294198206464	https://twitter.com/stacyherbert/status/810642294198206464			
	Chasing the mousepic.twitter.com/rP6m9BAoxg	stacyherbert	14	4	1482105246	810634273178914816	https://twitter.com/stacyherbert/status/810634273178914816			
	The Guardian's 'exclusive' leak story has, in fact, been reported before. Um. On Exxon's own website: http://corporate.exxonmobil.com/en/company/about-us/management/rex-w-tillerson …pic.twitter.com/NbPM7HrVMA	stacyherbert	43	30	1482102816	810624083843022849	https://twitter.com/stacyherbert/status/810624083843022849			
	FYI, $ XOM scooped the Guardian on this top secret 'leak' http://corporate.exxonmobil.com/en/company/about-us/management/rex-w-tillerson …https://twitter.com/McFaul/status/810550442526724097 …	stacyherbert	8	4	1482102479	810622668202512384	https://twitter.com/stacyherbert/status/810622668202512384			
	LOL. But Guardian has the EXCLUSIVE on this leak! https://www.theguardian.com/us-news/2016/dec/18/leak-rex-tillerson-director-bahamas-based-us-russian-oil-company?CMP=share_btn_tw …https://twitter.com/zerohedge/status/810618685958291456 …	stacyherbert	17	7	1482102403	810622350869856256	https://twitter.com/stacyherbert/status/810622350869856256			
	Fabulous to connect and thanks for the introduction @ ChrisJ_Pollard - I really look forward to talking more! Warmest wishes :)	sallyeaves	2	1	1482182921	810960067688329216	https://twitter.com/sallyeaves/status/810960067688329216			@
	Look foward to it! See you soon # CES2017 # AR # VR	sallyeaves	2	0	1482180005	810947837919985664	https://twitter.com/sallyeaves/status/810947837919985664		# # #	
	Thank you! @ _Future_Leaders @ CallieStarkey @ YouTube Such a pleasure and see you soon! Fantastic friendships plus legacy! # socinn	sallyeaves	3	2	1482179803	810946988468502529	https://twitter.com/sallyeaves/status/810946988468502529		#	@ @ @
ethereum 	And the march towards ETC <-> ETH parity continues. Ethereum Classic now up to 15% of ETH market cap https://poloniex.com/exchange#eth_etc …https://twitter.com/barrysilbert/status/804780000889159682 …	barrysilbert	66	44	1482185075	810969101992656897	https://twitter.com/barrysilbert/status/810969101992656897		#eth_etc	
ethereum 	More details here: https://blog.ethereum.org/2016/12/19/security-alert-12192016-ethereum-org-forums-database-compromised/ …https://twitter.com/barrysilbert/status/810937664157470721 …	barrysilbert	7	8	1482180581	810950250521362433	https://twitter.com/barrysilbert/status/810950250521362433			
ethereum 	Brutal https://twitter.com/ethereumproject/status/810936498988154880 …	barrysilbert	18	15	1482177580	810937664157470721	https://twitter.com/barrysilbert/status/810937664157470721			
	How to Fix the Internet https://www.theatlantic.com/technology/archive/2016/12/how-to-fix-the-internet/510797/?utm_source=twb … via @ WalterIsaacson @ TheAtlantic	barrysilbert	2	3	1482175819	810930280261419008	https://twitter.com/barrysilbert/status/810930280261419008			@ @
	??	barrysilbert	0	0	1482111734	810661485357703169	https://twitter.com/barrysilbert/status/810661485357703169			
	Glad you made that switch a while back.	jimmysong	0	0	1482159958	810863753902354433	https://twitter.com/jimmysong/status/810863753902354433			
bitcoin 	This needs more exposure and will undoubtedly help the entire ecosystem. A formal specification for bitcoin:https://medium.com/@zeptochain/reimagining-bitcoin-as-a-protocol-buffer-2d0d5d79a3c#.a4imwtm9l …	jimmysong	0	0	1482159541	810862004739211264	https://twitter.com/jimmysong/status/810862004739211264		#	@zeptochain
	“Trickle-Down Poverty”: The Coming Cashless Society Is Making People Desperate http://snip.ly/t7o8h # SHTF	DollarVigilante	12	15	1482186374	810974548392869889	https://twitter.com/DollarVigilante/status/810974548392869889		#	
	The War Against The People: Fear And Loathing In NY And DC http://snip.ly/ec67l # Activism	DollarVigilante	7	2	1482186216	810973887387303937	https://twitter.com/DollarVigilante/status/810973887387303937		#	
	LIVESTREAMING: Franz Ferdinand Moment? World War 3 in Sight? http://snip.ly/93beo # Activism	DollarVigilante	12	13	1482181696	810954929951088640	https://twitter.com/DollarVigilante/status/810954929951088640		#	
	# TDV # Quotes Subscribe--> https://dollarvigilante.com/2tt pic.twitter.com/xIC7cXoQxn	DollarVigilante	8	8	1482181161	810952686606684160	https://twitter.com/DollarVigilante/status/810952686606684160		# #	
	Several People Hurt In Shooting At Islamic Center In Zurich Switzerland Gunman At Large http://ift.tt/2hB9W3j	DollarVigilante	10	11	1482180712	810950802919591938	https://twitter.com/DollarVigilante/status/810950802919591938			
	The Attack on “Fake News” Is An Outright Campaign for # Censorship of the Truth. # FakeNews # News https://dollarvigilante.com/blog/2016/12/09/attack-fake-news-outright-campaign-censorship-truth.html …pic.twitter.com/s9Wo2x4ixe	DollarVigilante	16	15	1482179150	810944249269223425	https://twitter.com/DollarVigilante/status/810944249269223425		# # #	
	Truck Ploughs Into Christmas Market In Germany Injured Dozens One DEAD (LIVE BLOG) http://ift.tt/2h3az5h	DollarVigilante	7	8	1482177414	810936966929911808	https://twitter.com/DollarVigilante/status/810936966929911808			
	Uncensored RAW VIDEO: Russian Ambassador Shot Dead In Turkey http://snip.ly/kf5g4 # SHTF	DollarVigilante	8	5	1482177109	810935691341426688	https://twitter.com/DollarVigilante/status/810935691341426688		#	
	BREAKING NEWS: From Turkey What You Need To Knowhttp://ift.tt/2hjCA6i	DollarVigilante	9	10	1482174671	810925465619800065	https://twitter.com/DollarVigilante/status/810925465619800065			
