	DPS requested a federal audit and they were denied. But look what the last audit revealed. @ mobileslate # Detroithttp://www.mlive.com/news/detroit/index.ssf/2009/09/audit_detroit_public_schools_o.html …	haydentiff	1	4	1468868776	755116495341023232	https://twitter.com/haydentiff/status/755116495341023232		#	@
	Detroit, more than any other city, needs the global truth and immutability of a # blockchain.pic.twitter.com/IoG2FUVAF2	haydentiff	35	31	1468867795	755112380678475776	https://twitter.com/haydentiff/status/755112380678475776		#	
	The platform I am given just for running gives me a louder voice that I have every intention of using. @ nsmartinworld @ mobileslate	haydentiff	3	2	1468867433	755110862973759488	https://twitter.com/haydentiff/status/755110862973759488			@ @
	It was a suggestion. Take it or leave it. <shrug> @ nsmartinworld @ csuwildcat @afrococoapuffs	haydentiff	2	2	1468867161	755109720491524096	https://twitter.com/haydentiff/status/755109720491524096			@ @ @afrococoapuffs
	For one, it's a transparency machine. @ nsmartinworld	haydentiff	1	2	1468867115	755109527196954625	https://twitter.com/haydentiff/status/755109527196954625			@
	Oh, I know that. But placing public spending on a blockchain makes stealing quite a bit harder. @ mobileslate @ nsmartinworld	haydentiff	5	4	1468867043	755109225660084224	https://twitter.com/haydentiff/status/755109225660084224			@ @
	Maybe you should consider learning more about our financial system. @ nsmartinworld @ csuwildcat @afrococoapuffs http://www.internationalman.com//articles/a-powerful-weapon-of-financial-warfare-the-us-treasurys-kiss-of-death#.V4Mg1pL5M-M.twitter …	haydentiff	4	3	1468866961	755108883123888128	https://twitter.com/haydentiff/status/755108883123888128		#	@ @ @afrococoapuffs
	That includes # blockchain technology. DPS is missing $800M. You can't lose $800M on a blockchain. @ nsmartinworld http://usuncut.com/class-war/detroit-teachers-want-you-to-see-these-disturbing-photos/ …	haydentiff	3	6	1468866835	755108355891400704	https://twitter.com/haydentiff/status/755108355891400704		#	@
bitcoin 	A conflict of interest how? I'm poor. I spend Bitcoin. I'm not in a position to invest. @ nsmartinworld @afrococoapuffs	haydentiff	4	0	1468863566	755094644900397056	https://twitter.com/haydentiff/status/755094644900397056			@ @afrococoapuffs
bitcoin 	I hear she's into grassroots initiatives with a passion that's contagious. # Bitcoin @ nsmartinworld @afrococoapuffspic.twitter.com/ZhB5GMGZKy	haydentiff	12	5	1468862846	755091622480740352	https://twitter.com/haydentiff/status/755091622480740352		#	@ @afrococoapuffspic
	I've pulled over twice now. My kids blame both of you that these errands are taking so long. @ timpastoor @ csuwildcat	haydentiff	4	2	1468862261	755089167567257600	https://twitter.com/haydentiff/status/755089167567257600			@ @
bitcoin 	Bitcoin doesn't need to be used by everybody, just be accessible to everyone. That makes it the most valuable invention ever. @ QuadraQ	haydentiff	19	11	1468862136	755088644512354304	https://twitter.com/haydentiff/status/755088644512354304			@
	Not super familiar with Zcash but the more choices the better. @ csuwildcat @ Interledger @ timpastoor	haydentiff	1	2	1468861593	755086367114293249	https://twitter.com/haydentiff/status/755086367114293249			@ @ @
bitcoin ripple 	Yes. I Bitcoin. But what if the gov seizes control of a big mining pool or 2? That's not a concern with Ripple. @ timpastoor @ csuwildcat	haydentiff	2	2	1468861551	755086190416715776	https://twitter.com/haydentiff/status/755086190416715776			@ @
	As to poverty, the best chances of survival come to those who best support each other in the struggle for life. @ timpastoor @ csuwildcat	haydentiff	4	4	1468860578	755082109274890240	https://twitter.com/haydentiff/status/755082109274890240			@ @
bitcoin 	With # Bitcoin you have no choice but to trust whoever purchased the most hashing power. @ Interledger allows escrow. @ csuwildcat @ timpastoor	haydentiff	0	4	1468860413	755081418213031936	https://twitter.com/haydentiff/status/755081418213031936		#	@ @ @
ripple 	With @ Ripple, you choose who to trust. So stop trusting validators you no longer trust to not collude. @ csuwildcat @ timpastoor # fintech	haydentiff	4	2	1468859285	755076687491137536	https://twitter.com/haydentiff/status/755076687491137536		#	@ @ @
	Authority of the world? Gov can interrupt one jurisdiction maybe but... # decentralization. @ csuwildcat @ timpastoor	haydentiff	0	2	1468858320	755072641468358656	https://twitter.com/haydentiff/status/755072641468358656		#	@ @
	Thanks! @ mobileslate	haydentiff	1	2	1468858189	755072091771109376	https://twitter.com/haydentiff/status/755072091771109376			@
	Gah. I can't type now. But don't think about XRP. You can create your own issuances. @ csuwildcat @ timpastoor	haydentiff	1	2	1468856975	755066998766366720	https://twitter.com/haydentiff/status/755066998766366720			@ @
	Yep, I'm on the road but I will later today. In the meantime, think about TimeBanks. @ timpastoor	haydentiff	0	2	1468856317	755064239304368128	https://twitter.com/haydentiff/status/755064239304368128			@
	Thanks! @ Scott7x7	haydentiff	2	2	1468855406	755060418930995200	https://twitter.com/haydentiff/status/755060418930995200			@
	Because of what it makes possible. So many things. A LETSystem will help poverty in developing countries -not banking. @ timpastoor	haydentiff	6	4	1468854556	755056853860646912	https://twitter.com/haydentiff/status/755056853860646912			@
ripple 	Ripple is NOT a consumer facing product. It is the world's 1st distributed exchange. @ TECHNSAVE @ fanfare100 @ MADinMelbourne @ CryptoCoinsNews	haydentiff	7	1	1468853868	755053964698189824	https://twitter.com/haydentiff/status/755053964698189824			@ @ @ @
	My personal knowledge? I certainly hope so. @ nsmartinworld @afrococoapuffs	haydentiff	0	2	1468851617	755044525245169665	https://twitter.com/haydentiff/status/755044525245169665			@ @afrococoapuffs
	The last mile of sovereignty is monetary. @ nsmartinworld h/t @afrococoapuffs	haydentiff	7	11	1468851505	755044054640058368	https://twitter.com/haydentiff/status/755044054640058368			@ @afrococoapuffs
ripple 	$1K from Canada to Germany SETTLED in 8 seconds -with a cross-currency conversion! https://ripple.com/insights/news/watch-real-money-cross-borders-real-time/ … # fintechpic.twitter.com/kbm8BZwNzN	haydentiff	36	24	1468850265	755038856446173184	https://twitter.com/haydentiff/status/755038856446173184		#	
	Nobody is forcing you or even asking you to arm yourself. But you do not get to make that decision for others. @Patztense	haydentiff	9	2	1468848768	755032577556279296	https://twitter.com/haydentiff/status/755032577556279296			@Patztense
	The law abiding citizens unable to purchase guns in Brazil sure hate getting shot. # CapitalOfGunMurders @Patztensepic.twitter.com/Yvw416LfYS	haydentiff	5	3	1468848126	755029880836853760	https://twitter.com/haydentiff/status/755029880836853760		#	@Patztensepic
	John Conyers wants to make it hard for OTHERS to own a gun, but no Gun-Free Zone for him because HE's from # Detroit.https://twitter.com/JamesOKeefeIII/status/752904062962700288 …	haydentiff	10	2	1468847458	755027080551751680	https://twitter.com/haydentiff/status/755027080551751680		#	
bitcoin 	Some people can't enjoy # Bitcoin without the drama, haha. Why Bitcoin's Halving Was a Boring Vindication http://bit.ly/29Klytf # fintech	haydentiff	16	7	1468846356	755022460983058432	https://twitter.com/haydentiff/status/755022460983058432		# #	
bitcoin 	"More middleman = more apathy, IMO. # Bitcoin ""People who made their purchases via credit card value those items less""http://www.pymnts.com/news/mobile-commerce/2016/cash-payment-pain-connection-study/ …"	haydentiff	4	4	1468845874	755020436426153984	https://twitter.com/haydentiff/status/755020436426153984		#	
	I'm very behind! @IsaacJMedina	haydentiff	0	2	1468844987	755016715461922819	https://twitter.com/haydentiff/status/755016715461922819			@IsaacJMedina
	Life. @IsaacJMedina	haydentiff	0	2	1468844791	755015894649167872	https://twitter.com/haydentiff/status/755015894649167872			@IsaacJMedina
	It always seems impossible until it is done. ~Nelson Mandelapic.twitter.com/pJqe3EIJDP	haydentiff	20	16	1468844590	755015049920581632	https://twitter.com/haydentiff/status/755015049920581632			
	Good morning beautiful people! @ babushka99	haydentiff	5	4	1468843541	755010653363011584	https://twitter.com/haydentiff/status/755010653363011584			@
	Fair enough. @ BrooklynBrett	haydentiff	3	2	1468802817	754839843713212416	https://twitter.com/haydentiff/status/754839843713212416			@
	I stated exactly what I would do. Freeze it and pay off, through time, all benefits owed. @ nsmartinworld @ JeffWood4Office @ jacobmramirez	haydentiff	0	2	1468802313	754837728873807872	https://twitter.com/haydentiff/status/754837728873807872			@ @ @
	And you're against returning confiscated funds to victims? Ok. @ JeffWood4Office @ jacobmramirez	haydentiff	1	2	1468800696	754830945396621313	https://twitter.com/haydentiff/status/754830945396621313			@ @
	By definition, it is social insurance. @ JeffWood4Office @ jacobmramirez	haydentiff	1	1	1468800025	754828132008484864	https://twitter.com/haydentiff/status/754828132008484864			@ @
	Is the EU commissioner suggesting # TurkeyCoup was a 'false flag?'http://www.reuters.com/article/us-turkey-security-eu-hahn-idUSKCN0ZY0EA?utm_campaign=trueAnthem%3A+Trending+Content&utm_content=578c86a504d3015cdc1f4910&utm_medium=trueAnthem&utm_source=twitter …	stacyherbert	28	45	1468869960	755121461547962369	https://twitter.com/stacyherbert/status/755121461547962369		#	
	Horrible. No wonder their service is so sh*te.https://twitter.com/Moonbootica/status/755117524669399040 …	stacyherbert	16	20	1468869106	755117878660173824	https://twitter.com/stacyherbert/status/755117878660173824			
	Because they aren't married?https://twitter.com/TheAtlantic/status/755104811780104192 …	stacyherbert	38	9	1468866075	755105165322100736	https://twitter.com/stacyherbert/status/755105165322100736			
	Good morningpic.twitter.com/PFAQF1JyOO	stacyherbert	43	7	1468838446	754989282280996864	https://twitter.com/stacyherbert/status/754989282280996864			
	Sunset Montaukpic.twitter.com/CvSOqhNDC7	stacyherbert	30	5	1468802151	754837048457134081	https://twitter.com/stacyherbert/status/754837048457134081			
	Keiser. Amagansett.pic.twitter.com/e1EIUsHSj1	stacyherbert	19	3	1468797018	754815520499695617	https://twitter.com/stacyherbert/status/754815520499695617			
	A pleasure Del Mauricio - all really good and barmy weather here :) Look forward to talking more!	sallyeaves	1	0	1468877420	755152749273186304	https://twitter.com/sallyeaves/status/755152749273186304			
	Wonderful images thanks everyone ! X @ monibhachu @ elephantgurl24 @ TOdessaKane13 @ MsTerionam @ sardnas51 @ dandb200	sallyeaves	5	3	1468876745	755149917971152897	https://twitter.com/sallyeaves/status/755149917971152897			@ @ @ @ @ @
	A pleasure Piotr - look forward to talking more.	sallyeaves	0	0	1468875778	755145865443016704	https://twitter.com/sallyeaves/status/755145865443016704			
	# Google Reportedly Working on Standalone # VR / # AR Headset http://bit.ly/29PEaIw # tech	sallyeaves	2	0	1468875639	755145279884632064	https://twitter.com/sallyeaves/status/755145279884632064		# # # #	
	Perfect thanks! Have a brilliant evening :)	sallyeaves	0	0	1468866738	755107948297412608	https://twitter.com/sallyeaves/status/755107948297412608			
	Hi Emma, I may be free in the am but travelling a lot ... Wednesday would be perfect if that suits? Thanks Sally	sallyeaves	1	0	1468865824	755104113042550784	https://twitter.com/sallyeaves/status/755104113042550784			
	Great to meet & really like the sound of the # STEAM work you are doing. Fine to be chat although on train so signal may drop!	sallyeaves	0	0	1468865139	755101241567506432	https://twitter.com/sallyeaves/status/755101241567506432		#	
	This combo sounds fantastic Emma! Would love to hear more :) @ Playbox01 @ FlotsamJetsamLS	sallyeaves	0	0	1468864383	755098069373452288	https://twitter.com/sallyeaves/status/755098069373452288			@ @
	Looking good! Let the music play :) @ mbla807 @ elephantgurl24 @ TOdessaKane13 @ MsTerionam @ sardnas51 @ dandb200	sallyeaves	3	2	1468864285	755097657723461632	https://twitter.com/sallyeaves/status/755097657723461632			@ @ @ @ @ @
	Great work! # rotary @ VoleTales @ WHRobertLee @ LAnkcorn @ ASUbhi @ ShafiqueHShah @ CllrMikeLeddy @ derekwebley @ pbalfeuk @ lyn_ankcorn	sallyeaves	3	2	1468861393	755085530275127296	https://twitter.com/sallyeaves/status/755085530275127296		#	@ @ @ @ @ @ @ @ @
	Pleasure Lorraine, its a beauty of a day for sure! Look forward to getting out and about soon :) How is your day?	sallyeaves	0	0	1468857396	755068764408934400	https://twitter.com/sallyeaves/status/755068764408934400			
	Thanks Mia :) All good here and absolutely barmy weather! Maybe should swap to ice cream now hehe. Have a fab day, Sal	sallyeaves	0	0	1468856378	755064494188072960	https://twitter.com/sallyeaves/status/755064494188072960			
	Seconded! I think I maybe ahead of you re coffee intake today :)	sallyeaves	1	0	1468856207	755063776521646080	https://twitter.com/sallyeaves/status/755063776521646080			
	Thank you Chris, much appreciated! Very much looking forward to the event # apprenticeships can change lives @ asianappawards	sallyeaves	1	1	1468855870	755062362806292480	https://twitter.com/sallyeaves/status/755062362806292480		#	@
	Indeed @ filmstvandlife @ standardnews another example regards # rent and impact on # students from Dublin today too http://bit.ly/29Ijwv0	sallyeaves	0	1	1468855342	755060150545907713	https://twitter.com/sallyeaves/status/755060150545907713		# #	@ @
	A pleasure and look forward to sharing ideas! @ MML_UK @ DPALLC	sallyeaves	2	0	1468854138	755055100218015744	https://twitter.com/sallyeaves/status/755055100218015744			@ @
	A pleasure Sam! Plus great to connect @ yourcoachfuel @ DMarkCasey @ OlivierBranford @biggbosshoggin @startupnewss @ rogfh	sallyeaves	3	0	1468853817	755053753208827904	https://twitter.com/sallyeaves/status/755053753208827904			@ @ @ @biggbosshoggin @startupnewss @
	The benefits of # coworking to support # entrepreneurship and # freelancing : finance, space & mutual support http://bit.ly/29SLwiX # startup	sallyeaves	1	1	1468847783	755028443511791617	https://twitter.com/sallyeaves/status/755028443511791617		# # # #	
	Thank you, such lovely messages from everyone X Warmest wishes! @ monibhachu @ elephantgurl24 @ mbla807	sallyeaves	5	2	1468846727	755024016365195264	https://twitter.com/sallyeaves/status/755024016365195264			@ @ @
	# India focusses on its # tech colleges with aim to 'become real power in software' http://bit.ly/29UcrKd @ TheRegister # education # MOOCs	sallyeaves	6	4	1468832856	754965837723930625	https://twitter.com/sallyeaves/status/754965837723930625		# # # #	@
	Interesting piece - what would the # tech landscape look like if girly tropes were championed not ridiculed? http://bit.ly/2a185Bx # art	sallyeaves	2	0	1468832593	754964730893201408	https://twitter.com/sallyeaves/status/754964730893201408		# #	
	Many congratulations! A fantastic appointment! @ GlobalBU @ UKCISA @ Lord_Bilimoria	sallyeaves	3	1	1468832284	754963437403406336	https://twitter.com/sallyeaves/status/754963437403406336			@ @ @
	I couldnt agree more - a wonderful post # Rotary @ rotaryapo @ RotaryJerusalem @ Rotary @ rotary9125	sallyeaves	1	1	1468822711	754923284479770625	https://twitter.com/sallyeaves/status/754923284479770625		#	@ @ @ @
	Digital Currency Group is hiring an Associate, Development in New York City! Apply now! https://angel.co/l/PzqSe	barrysilbert	8	4	1468877460	755152918513344512	https://twitter.com/barrysilbert/status/755152918513344512			
	a-hed?	barrysilbert	0	0	1468845261	755017866055999488	https://twitter.com/barrysilbert/status/755017866055999488			
	‘Ax Attack’: On German Train Many Reported Injured http://ift.tt/29HFXnS	DollarVigilante	7	0	1468879074	755159689499901952	https://twitter.com/DollarVigilante/status/755159689499901952			
	What The Hell Is Happening In Turkey? http://snip.ly/6r59a # Activism	DollarVigilante	8	2	1468875772	755145836561100800	https://twitter.com/DollarVigilante/status/755145836561100800		#	
	Universities, for the most part today... Subscribe--> http://buff.ly/1TFC7sO # TDV # Quotespic.twitter.com/Zc45VhlSpm	DollarVigilante	17	7	1468873158	755134876324593664	https://twitter.com/DollarVigilante/status/755134876324593664		# #	
	# TDV # Quotes Subscribe--> http://buff.ly/1TFC7sO pic.twitter.com/hNyFB9Z5NH	DollarVigilante	8	2	1468871983	755129944842403840	https://twitter.com/DollarVigilante/status/755129944842403840		# #	
	Learn about protecting your assets at The Dollar Vigilante # Dollar # Gold http://ow.ly/IOCP3000UBN pic.twitter.com/GyPH6OW4TZ	DollarVigilante	9	0	1468871083	755126172632092672	https://twitter.com/DollarVigilante/status/755126172632092672		# #	
	The Magic Number 7: # Brexit Collapse Falls Exactly On # Shemitah Date https://www.dollarvigilante.com/blog/2016/06/25/magic-number-7-brexit-collapse-falls-exactly-shemitah-date.html …pic.twitter.com/UtjuyfLXVW	DollarVigilante	9	3	1468869585	755119889581506560	https://twitter.com/DollarVigilante/status/755119889581506560		# #	
	# Killary # CrookedHillary # HillaryClinton https://www.dollarvigilante.com/blog/2016/07/06/fbis-hillary-decision-part-jubilee-plan-towards-greater-chaos.html …pic.twitter.com/vZssZ9KeRr	DollarVigilante	10	1	1468863757	755095444016029697	https://twitter.com/DollarVigilante/status/755095444016029697		# # #	
	The Developer Behind Latest Pokemon Go Augmented Reality Craze http://snip.ly/udqw1 # Activism	DollarVigilante	8	1	1468862262	755089172315201536	https://twitter.com/DollarVigilante/status/755089172315201536		#	
	Turkey’s Failed Coup: “A Gift from God” or From Washington? http://snip.ly/itbyj # Activism	DollarVigilante	8	5	1468862261	755089170683588608	https://twitter.com/DollarVigilante/status/755089170683588608		#	
bitcoin 	Subscribe to the Dollar Vigilante # Mining # Bitcoin # Investing http://ow.ly/IOCP3000UBN pic.twitter.com/mQM4lqo9c8	DollarVigilante	10	1	1468859859	755079096640700416	https://twitter.com/DollarVigilante/status/755079096640700416		# # #	
	Freedom is Rising: Jeff Berwick on FreedomFest TV # Liberty https://www.dollarvigilante.com/blog/2016/05/28/video-freedom-rising-jeff-berwick-freedomfest-tv.html …pic.twitter.com/SgXvU9TN8m	DollarVigilante	10	3	1468858782	755074576741261312	https://twitter.com/DollarVigilante/status/755074576741261312		#	
	# TDV # Quotes Subscribe--> http://buff.ly/1TFC7sO pic.twitter.com/14X3yMDeu7	DollarVigilante	9	7	1468855534	755060954488897537	https://twitter.com/DollarVigilante/status/755060954488897537		# #	
	15 Years of Fighting for 9/11 Truth http://snip.ly/k5bfi # Activism	DollarVigilante	4	3	1468855039	755058877838884864	https://twitter.com/DollarVigilante/status/755058877838884864		#	
	DNC Chair Debbie Wasserman Schultz Stops In Her Tracks When Questioned About Payday Loans http://snip.ly/m5uv6 # Activism	DollarVigilante	7	3	1468855038	755058872273035264	https://twitter.com/DollarVigilante/status/755058872273035264		#	
	“Dark And Distressing Time Has Descended”: Violence Grips Nation In Chaos http://snip.ly/gxzs9 # SHTF	DollarVigilante	6	2	1468855027	755058827083575297	https://twitter.com/DollarVigilante/status/755058827083575297		#	
bitcoin 	Subscribe and learn! # Investing # Gold # Bitcoin # Mining # Shemitah http://ow.ly/IOCP3000UBN pic.twitter.com/UONaBGh3yM	DollarVigilante	4	0	1468848639	755032033605349376	https://twitter.com/DollarVigilante/status/755032033605349376		# # # # #	
	Globalist Brazenly Calls For Elites to 'Rise Up' Against Ignorant Masses https://www.dollarvigilante.com/blog/2016/07/02/globalist-cfr-member-brazenly-calls-elites-rise-ignorant-masses.html …pic.twitter.com/XAvtRUMUsC	DollarVigilante	8	5	1468847854	755028740032307200	https://twitter.com/DollarVigilante/status/755028740032307200			
	Russia To Ban Pokemon GO Because of Links To CIAhttp://ift.tt/2a30bGD	DollarVigilante	8	2	1468845725	755019811625832448	https://twitter.com/DollarVigilante/status/755019811625832448			
	More Questions Then Answers In Nice’ Truck Attack http://ift.tt/29GsGf1	DollarVigilante	3	1	1468843938	755012318170324993	https://twitter.com/DollarVigilante/status/755012318170324993			
	# TDV # Quotes Subscribe--> http://buff.ly/1TFC7sO pic.twitter.com/H49ottLVIJ	DollarVigilante	6	3	1468839091	754991986730475521	https://twitter.com/DollarVigilante/status/754991986730475521		# #	
	Learn about protecting your assets at The Dollar Vigilante # Dollar # Gold http://ow.ly/IOCP3000UBN pic.twitter.com/zdZ9a4gC95	DollarVigilante	4	1	1468837413	754984948621344768	https://twitter.com/DollarVigilante/status/754984948621344768		# #	
	The # Uber Killer # ArcadeCity https://www.dollarvigilante.com/blog/2016/06/11/arcade-city-decentralized-blockchain-based-uber-killer.html …pic.twitter.com/F9iWVToPOa	DollarVigilante	4	1	1468837052	754983435207380992	https://twitter.com/DollarVigilante/status/754983435207380992		# #	
	# TDV # Quotes Subscribe--> http://buff.ly/1TFC7sO pic.twitter.com/aLtGAFAyVs	DollarVigilante	10	2	1468830869	754957502689796097	https://twitter.com/DollarVigilante/status/754957502689796097		# #	
	Anarchast with Sterlin Lujan: Taking the Red Pill and Exiting the Matrix # Anarchism https://www.dollarvigilante.com/blog/2016/05/31/anarchast-sterlin-lujan-taking-red-pill-exiting-matrix.html …pic.twitter.com/J43gcjUJXw	DollarVigilante	13	1	1468826251	754938132068495360	https://twitter.com/DollarVigilante/status/754938132068495360		#	
	Surviving and Prospering During and After the Economic Collapse # Investing http://ow.ly/IOCP3000UBN pic.twitter.com/1GgH3WLRS5	DollarVigilante	8	2	1468826191	754937882289340416	https://twitter.com/DollarVigilante/status/754937882289340416		#	
	# TDV # Quotes http://dollarvigilante.com pic.twitter.com/O1vYEiTTyn	DollarVigilante	4	1	1468822650	754923026915979264	https://twitter.com/DollarVigilante/status/754923026915979264		# #	
	The Central Banking Prisoner's Dilemma: # Fed # Economy https://www.dollarvigilante.com/blog/2016/04/28/central-banking-prisoners-dilemma-fed-freezes-boj-stammers-dollar-drops-2-overnight.html …pic.twitter.com/b4PPU1SEbR	DollarVigilante	6	3	1468815449	754892825490296832	https://twitter.com/DollarVigilante/status/754892825490296832		# #	
	Learn how to make 100% or more gains in your portfolio today! # Investing http://ow.ly/IOCP3000UBN pic.twitter.com/0C0HrocXHc	DollarVigilante	7	0	1468814968	754890809821040640	https://twitter.com/DollarVigilante/status/754890809821040640		#	
	Government is an Unnecessary Evil. Subscribe here--> http://buff.ly/1TFC7sO # Anarchism # Libertypic.twitter.com/s8q0cBJTfp	DollarVigilante	9	6	1468814791	754890064883281920	https://twitter.com/DollarVigilante/status/754890064883281920		# #	
	Baton Rouge, Nice, Dallas, Orlando – A Dark And Distressing Time Has Descended Upon The Civilized World http://snip.ly/v7mib # Economy	DollarVigilante	5	3	1468814567	754889127682768896	https://twitter.com/DollarVigilante/status/754889127682768896		#	
	BREAKING: Cleveland Police Ask Governor to Suspend 2nd Amendment http://ift.tt/2a2sR5k	DollarVigilante	4	2	1468811545	754876451296514048	https://twitter.com/DollarVigilante/status/754876451296514048			
	# TDV # Quotes http://dollarvigilante.com pic.twitter.com/2c3H2TVwBp	DollarVigilante	10	6	1468810238	754870967495757824	https://twitter.com/DollarVigilante/status/754870967495757824		# #	
	The Worst (Fake?) Coup Ever Has Enthroned Erdogan As A Dictator And Has Sealed Turkey’s Fatehttp://ift.tt/29NvbgT	DollarVigilante	8	11	1468808253	754862644520189952	https://twitter.com/DollarVigilante/status/754862644520189952			
bitcoin 	Subscribe to the Dollar Vigilante # Mining # Bitcoin # Investing http://ow.ly/IOCP3000UBN pic.twitter.com/VrLjTND9P4	DollarVigilante	2	0	1468807120	754857890410815489	https://twitter.com/DollarVigilante/status/754857890410815489		# # #	
	Lyin' Yellin is forced to tell the TRUTH! # Economy # Gold # Fed https://www.dollarvigilante.com/blog/2016/03/19/lyin-yellen-is-forced-to-tell-the-truth-at-federal-reserve-meeting-gold-up-economy-down.html …pic.twitter.com/vE8Hps1h1g	DollarVigilante	10	7	1468804659	754847570808152064	https://twitter.com/DollarVigilante/status/754847570808152064		# # #	
	# Trade # Economics # War # Trump # HillaryClinton Subscribe here--> http://buff.ly/1TFC7sO pic.twitter.com/qqEL3FgFE6	DollarVigilante	15	8	1468802019	754836496142729216	https://twitter.com/DollarVigilante/status/754836496142729216		# # # # #	
	28 Declassified Pages Do Nothing To Explain Implausibility of 9/11 Official Story http://snip.ly/cibt2 # Activism	DollarVigilante	9	10	1468798367	754821177919606784	https://twitter.com/DollarVigilante/status/754821177919606784		#	
	Surviving and Prospering During and After the Economic Collapse # Investing http://ow.ly/IOCP3000UBN pic.twitter.com/a7722WQy0y	DollarVigilante	8	2	1468795900	754810832433901568	https://twitter.com/DollarVigilante/status/754810832433901568		#	
	Anarchast Ep.288 @ WatchMyBit Disrupting the Streaming Video Market http://buff.ly/1Y33NsH pic.twitter.com/TkMRmBlbnq	DollarVigilante	9	2	1468793858	754802268365590528	https://twitter.com/DollarVigilante/status/754802268365590528			@
	Time to subscribe to TDV http://buff.ly/1TFC7sO # NWO # Dollar # Economicspic.twitter.com/fBe3rxqMqK	DollarVigilante	10	9	1468793799	754802020754812928	https://twitter.com/DollarVigilante/status/754802020754812928		# # #	
	Is Putin’s Purge Of Top Russian Commanders An Advance Warning Of Large-Scale Military Action In The Near Future? http://snip.ly/jm5i0  #…	DollarVigilante	11	10	1468792923	754798343017078788	https://twitter.com/DollarVigilante/status/754798343017078788		#	
