	# ICOnotIPO # FutureFinancehttps://twitter.com/alextapscott/status/830918596872302595 …	dtapscott	3	1	1486996260	831148675825094657	https://twitter.com/dtapscott/status/831148675825094657		# #	
	great example of how blockchain can help restore # legitimacy in # democraticinstitutionshttps://twitter.com/alextapscott/status/831145307043921920 …	dtapscott	6	1	1486996230	831148546787254274	https://twitter.com/dtapscott/status/831148546787254274		# #	
	Keiser Report: Trump/Abe Golf Diplomacy (E1030)https://www.youtube.com/watch?v=2jqDDOkrDNU&feature=share …	maxkeiser	11	8	1486995129	831143928690782209	https://twitter.com/maxkeiser/status/831143928690782209			
	dans ce cas précis, le problème ce n'est pas tant dans le contenu, que dans le contenant... du moins au XXIème siècle.	babgi	2	1	1487026249	831274455393566721	https://twitter.com/babgi/status/831274455393566721			
	Le Mythe de la Singularité: une voix pour contrer l'inconsistance néo-scientifique des singularistes http://m.20minutes.fr/high-tech/2012083-20170210-aucune-machine-sait-fois-jouer-poker-debarrasser-table?ref=http://linkis.com/www.20minutes.fr/hig/en6g5 … @ Quecalcoatle	babgi	11	17	1486974103	831055741037473792	https://twitter.com/babgi/status/831055741037473792			@
	Une fraude à l'assurance révélée par les data issues d'un pacemaker ; http://www.ladn.eu/inspiration/in-vivo/un-pyromane-trahi-par-son-pacemaker/?utm_source=newsletter_ladn&utm_medium=email&utm_campaign=news_fevrier_2017&utm_content=nl11022017 … # Bigdata	babgi	6	9	1486973873	831054776456589312	https://twitter.com/babgi/status/831054776456589312		#	
	As Valentine's Day Approaches, 45% of # Banking Customers Still Don't Feel the Love http://bit.ly/2ed7Fdn # onboarding # dtigial # marketingpic.twitter.com/f6UTNg6rSr	JimMarous	0	0	1487006436	831191353262497792	https://twitter.com/JimMarous/status/831191353262497792		# # # #	
	Not All High Income Consumers are Created Equal http://bit.ly/2l0sxpc # banking # Millennials # WealthManagement via @ FinancialBrandpic.twitter.com/ZQDmEJQ72P	JimMarous	2	1	1487006157	831190183072653312	https://twitter.com/JimMarous/status/831190183072653312		# # #	@
	Four Alternative Banking Strategies for High-Income Consumers http://bit.ly/2l0sxpc # WealthManagement # fintech # banking @ TheRaddonReportpic.twitter.com/OODmBWJDl7	JimMarous	20	15	1487005836	831188836931743744	https://twitter.com/JimMarous/status/831188836931743744		# # #	@
	Really Good Interview by @ Kantox of @ citi's Tony McLaughlin http://bit.ly/2lIz0Fs # Fintech # Blockchain # data # PSD2 # AI # ML @ davidbrearpic.twitter.com/9WbmpLW91G	JimMarous	28	44	1487005507	831187457035087872	https://twitter.com/JimMarous/status/831187457035087872		# # # # # #	@ @ @
bitcoin 	Great Infographic: Going Cashless Around the World # fintech # payments # bitcoin # blockchain # debitcard # creditcard # CashlessEconomypic.twitter.com/Suw1yiANOV	JimMarous	68	89	1487002921	831176613802962946	https://twitter.com/JimMarous/status/831176613802962946		# # # # # # #	
	22 Firms Using # Blockchain for Identity Management and Authentication. http://bit.ly/2kZLt7A # fintech # authentication # biometricspic.twitter.com/97ssSyBy3w	JimMarous	14	15	1486996174	831148311109365760	https://twitter.com/JimMarous/status/831148311109365760		# # # #	
	I like Infographics but also content sharing	JimMarous	7	0	1486994386	831140814201946113	https://twitter.com/JimMarous/status/831140814201946113			
	Top 10 Retail Banking Trends for 2017 http://bit.ly/2017FI_Trends # fintech # APIs # DataAnalytics # AI # IoT # CX # UX # payments # regtechpic.twitter.com/9fbQxGspII	JimMarous	32	39	1486993105	831135439453028354	https://twitter.com/JimMarous/status/831135439453028354		# # # # # # # # #	
	Community Bankers Falling Behind in Customer Experience http://bit.ly/2kID5Lu # CX # UX # fintech # DigitalBankingReport @ FinancialBrandpic.twitter.com/N7Q1P7CLAC	JimMarous	3	1	1486992676	831133639903678464	https://twitter.com/JimMarous/status/831133639903678464		# # # #	@
	Banking' View of Fintech http://bit.ly/2fuKHgy # fintech @ Capgemini # WorldFintechReport @ WFSULLIVAN3 @ LinkedIn @ Efma_news # bankingpic.twitter.com/wiNm4bYKzz	JimMarous	8	9	1486992220	831131727372357632	https://twitter.com/JimMarous/status/831131727372357632		# # #	@ @ @ @
	Great Infographic: Reimagining the Future of Banking http://bit.ly/2kKlEd2 # fintech # digital # innovation # IoT # AI # IoT @ Deloittepic.twitter.com/aEfch9fSlU	JimMarous	135	153	1486990715	831125417155239936	https://twitter.com/JimMarous/status/831125417155239936		# # # # # #	@
	Tired of people (not @ MikeQuindazzi) overusing tags 4 Klout	JimMarous	6	0	1486990089	831122789306343424	https://twitter.com/JimMarous/status/831122789306343424			@
	New: Mobile Commerce Continues to Grow. http://bit.ly/2lzRqeI # fintech # payments # mobile # digital @ MEFpic.twitter.com/SaI4a7Su9Y	JimMarous	1	3	1486989818	831121653019066370	https://twitter.com/JimMarous/status/831121653019066370		# # # #	@
	Congrats to EUR # Fintech 40 http://bit.ly/2kJcXje @ dgwbirch @ Chris_Skinner @ ccalmeja @ belimad @ ferrarirobtweet @ nekliolios @ matteorizzipic.twitter.com/aUgeVdSdk2	JimMarous	11	8	1486967932	831029856834113536	https://twitter.com/JimMarous/status/831029856834113536		#	@ @ @ @ @ @ @
	Thanks	JimMarous	5	0	1486965048	831017761388240896	https://twitter.com/JimMarous/status/831017761388240896			
	Why not link reports vs just Infographics?	JimMarous	6	1	1486964591	831015844775915520	https://twitter.com/JimMarous/status/831015844775915520			
	Purchase Abandonment Continues to Plague Mobile Payments http://bit.ly/2lzRqeI @ MEF # fintech # payments # trends # retail # mobile # Bankingpic.twitter.com/bhpBvlHrwM	JimMarous	4	1	1486963169	831009881788391425	https://twitter.com/JimMarous/status/831009881788391425		# # # # # #	@
	Mobile Commerce Making Inroads on Desktop http://bit.ly/2lzRqeI @ MEF @ wirecard # fintech # payments # digital # mobile # bankingpic.twitter.com/sVxPM5y4oy	JimMarous	31	39	1486962662	831007752432529408	https://twitter.com/JimMarous/status/831007752432529408		# # # # #	@ @
	The Internet of Things Ecosystem http://read.bi/2khMMlp # IoT # fintech # datapic.twitter.com/d8WqDVJxTM	JimMarous	6	11	1486943998	830929472408997893	https://twitter.com/JimMarous/status/830929472408997893		# # #	
	I can't keep up with reporting it!	VinnyLingham	2	0	1487008001	831197917952229376	https://twitter.com/VinnyLingham/status/831197917952229376			
	I think @ instagram spam and fake accounts are now exceeding @ Twitter but no one is talking about it...	VinnyLingham	21	2	1487007480	831195735894814720	https://twitter.com/VinnyLingham/status/831195735894814720			@ @
	With $6B in deals in 2016, ID management is a hot sector you may have missed http://tcrn.ch/2lGEXle  via @ techcrunch	VinnyLingham	12	5	1487006705	831192483526701057	https://twitter.com/VinnyLingham/status/831192483526701057			@
	yes, but their currency hasn't collapsed yet ;)	VinnyLingham	2	0	1487003795	831180278701756416	https://twitter.com/VinnyLingham/status/831180278701756416			
	And then there was none: Canada sells its gold | http://MINING.com http://www.mining.com/web/and-then-there-was-none-canada-sells-its-gold/ …	VinnyLingham	17	6	1487002207	831173618587430913	https://twitter.com/VinnyLingham/status/831173618587430913			
	I actually love this use case for crypto - I met my wife online! The key Q is will it prevent spam & bots, which other apps refuse to stop.https://twitter.com/coindesk/status/831171129737871360 …	VinnyLingham	12	4	1487002004	831172765101068288	https://twitter.com/VinnyLingham/status/831172765101068288			
	you guys need to contact @cujounited and figure this feud out - your customers shouldn't have to suffer from incompatibilies...	VinnyLingham	0	0	1486951189	830959632625446912	https://twitter.com/VinnyLingham/status/830959632625446912			@cujounited
	been saying that for a while now	VinnyLingham	10	4	1486947273	830943206397210625	https://twitter.com/VinnyLingham/status/830943206397210625			
	@ eerosupport since you recent update my @cujounited is messing up my network. Was that intentional?! Seems like it!	VinnyLingham	0	0	1486947253	830943122708320256	https://twitter.com/VinnyLingham/status/830943122708320256			@ @cujounited
	Can't argue with this logic...https://twitter.com/alistairmilne/status/830859219708555264 …	VinnyLingham	69	30	1486942411	830922813397729282	https://twitter.com/VinnyLingham/status/830922813397729282			
bitcoin 	If PoSe was easy/possible, Bitcoin would be doing it already and rewarding nodes to stay up & do work.	SatoshiLite	6	1	1487025254	831270283692560384	https://twitter.com/SatoshiLite/status/831270283692560384			
	And all PoW does is prove useless work was done. The work (hashing) is hard to do but easy to validate.	SatoshiLite	5	1	1487025098	831269628747722752	https://twitter.com/SatoshiLite/status/831269628747722752			
	I did, but I still agree with the point that if proof of service is possible, then we don't need PoW.	SatoshiLite	1	0	1487022795	831259969555083264	https://twitter.com/SatoshiLite/status/831259969555083264			
	happy competing!	SatoshiLite	1	0	1487022714	831259628411318272	https://twitter.com/SatoshiLite/status/831259628411318272			
	what competition?	SatoshiLite	3	0	1487022093	831257025698861064	https://twitter.com/SatoshiLite/status/831257025698861064			
	who needs real proof when you can have flawed proof plus marketing? Get with the program @ fluffyponyza!	SatoshiLite	9	2	1487009332	831203503640977408	https://twitter.com/SatoshiLite/status/831203503640977408			@
litecoin 	The hardfork has nothing to do with Litecoin or the segwit code.	SatoshiLite	3	1	1486962731	831008044469215232	https://twitter.com/SatoshiLite/status/831008044469215232			
	It's up to the pool owen, pooler. Not my call. But I hear it will be soon. :D	SatoshiLite	0	0	1486952596	830965534673952768	https://twitter.com/SatoshiLite/status/830965534673952768			
litecoin 	https://www.litecoinpool.org/news?id=72	SatoshiLite	1	0	1486944290	830930695224598528	https://twitter.com/SatoshiLite/status/830930695224598528			
bitcoin 	I've been warning everyone. No-one listenshttps://www.google.com/amp/www.forbes.com/sites/laurashin/2016/12/20/hackers-have-stolen-millions-of-dollars-in-bitcoin-using-only-phone-numbers/amp/ …	officialmcafee	145	106	1487000009	831164397594746880	https://twitter.com/officialmcafee/status/831164397594746880			
bitcoin 	BTC (Bitcoin) price on this day in: 2011 $ 1.05 2012 $ 4.62 2013 $ 29 2014 $ 633 2015 $ 392 2016 $ 988	BrettKing	21	21	1487021995	831256616322359300	https://twitter.com/BrettKing/status/831256616322359300			
	@ NTagouri love your work	BrettKing	0	0	1487015867	831230910737633281	https://twitter.com/BrettKing/status/831230910737633281			@
	7 FinTech Companies Helping Millennials Dominate Their Finances This Year via @ forbes http://www.forbes.com/sites/jrose/2017/02/11/7-fintech-companies-helping-millennials-dominate-their-finances-this-year/#6c29ff165f00 … # Fintech # Millennials # Finance	BrettKing	10	18	1487013618	831221477177430016	https://twitter.com/BrettKing/status/831221477177430016		#6c29ff165f00 # # #	@
	On our latest episode of @ Breakingbanks1, we discuss # Fintech + MPESA, Kenya’s mobile money system by @ SafaricomLtdhttps://soundcloud.com/breakingbanks/fintech-and-mpesa-what-mobile-money-means?utm_source=soundcloud&utm_campaign=wtshare&utm_medium=Twitter&utm_content=https%3A//soundcloud.com/breakingbanks/fintech-and-mpesa-what-mobile-money-means …	BrettKing	31	27	1487000469	831166328744579073	https://twitter.com/BrettKing/status/831166328744579073		#	@ @
	Only in a psychological/political sense. Segwit is the most tested feature ever. Thoroughly tested on segnet & testnet already	aantonop	1	1	1486991365	831128144006373376	https://twitter.com/aantonop/status/831128144006373376			
	Still planning. More details this week.	aantonop	0	0	1486991275	831127766967803905	https://twitter.com/aantonop/status/831127766967803905			
bitcoin ethereum 	Coming to # CapeTown # SouthAfrica # bitcoin # ethereumhttps://twitter.com/aantonop/status/831123775009611776 …	aantonop	30	16	1486990406	831124121073315841	https://twitter.com/aantonop/status/831124121073315841		# # # #	
bitcoin ethereum 	Mark your calendars: Cape Town Mar 6 - Bitcoin Meetup Cape Town Mar 15 - Ethereum Meetup Details to follow on: http://antonopoulos.com/events	aantonop	21	12	1486990324	831123775009611776	https://twitter.com/aantonop/status/831123775009611776			
	@ ssawhney87 follow for DM please	aantonop	0	0	1486969347	831035792138964992	https://twitter.com/aantonop/status/831035792138964992			@
	Wow, what a bundle!!https://www.humblebundle.com/freedom	ummjackson	2	0	1487022227	831257586007543808	https://twitter.com/ummjackson/status/831257586007543808			
	Thanks, Kenny.pic.twitter.com/WIPIs5Un8J	ummjackson	9	2	1487002974	831176832976252928	https://twitter.com/ummjackson/status/831176832976252928			
	A little birdy tells me @ _developit might be about to release a http://chime.social  web client into the wild... excited!!pic.twitter.com/ml8LnKnxvH	ummjackson	16	0	1486951889	830962566536966144	https://twitter.com/ummjackson/status/830962566536966144			@
	"Can not a ""flag day"" HF, endorsed/supported by Core, be prepared?"	ErikVoorhees	1	0	1487021400	831254119566413825	https://twitter.com/ErikVoorhees/status/831254119566413825			
	"Debasement... a ""feature"" of fiat that always becomes its demisehttp://imgur.com/ftCHGdl"	ErikVoorhees	19	11	1487015688	831230159734894592	https://twitter.com/ErikVoorhees/status/831230159734894592			
	"There is no ""meantime LN""... that's years away. SegWit won't pass without guarantee of HF."	ErikVoorhees	26	4	1487015600	831229793085562882	https://twitter.com/ErikVoorhees/status/831229793085562882			
	Then that's not really a path, is it? Potential real path: SegWit + Guaranteed HF to bigger block, then LN later.	ErikVoorhees	5	0	1487015022	831227367033012225	https://twitter.com/ErikVoorhees/status/831227367033012225			
	@ eric_lombrozo Beautyon I encourage you to draft a real response to my points made. What's wrong with my reasoning?	ErikVoorhees	1	0	1487014947	831227051021570050	https://twitter.com/ErikVoorhees/status/831227051021570050			@
	"I don't understand what you're talking about... are you saying I have a conflict due to LN hubs? What are ""SC products?"""	ErikVoorhees	0	0	1487013351	831220357084360707	https://twitter.com/ErikVoorhees/status/831220357084360707			
	...what are you talking about?	ErikVoorhees	4	0	1487012939	831218632558514176	https://twitter.com/ErikVoorhees/status/831218632558514176			
	Agreed... let's do both.	ErikVoorhees	1	0	1487012640	831217378109358080	https://twitter.com/ErikVoorhees/status/831217378109358080			
	What's the conflict of interest?	ErikVoorhees	0	0	1487012002	831214701275127808	https://twitter.com/ErikVoorhees/status/831214701275127808			
	"Agreed it doesn't allow at ""large"" scale. But larger-than-current scale is absolutely possible, withheld by arbitrary limit."	ErikVoorhees	2	1	1487010967	831210359918821376	https://twitter.com/ErikVoorhees/status/831210359918821376			
	Agreed 100%. Would help if some capacity room while we worked on those layers, no? SegWit + HF 4MB block, 4 example ;)	ErikVoorhees	5	2	1487010901	831210083698737152	https://twitter.com/ErikVoorhees/status/831210083698737152			
	Soooo AlphaCoin's own development and virtue has no influence on the outcome?	ErikVoorhees	1	0	1487010719	831209317273653248	https://twitter.com/ErikVoorhees/status/831209317273653248			
	First true statement I've seen you make.	ErikVoorhees	0	0	1487010438	831208140020600833	https://twitter.com/ErikVoorhees/status/831208140020600833			
	". @ eric_lombrozo If it's not fast and cheap, then it's only about ""financial sovereignty"" for the wealthy."	ErikVoorhees	36	6	1487010399	831207978430824449	https://twitter.com/ErikVoorhees/status/831207978430824449			@
bitcoin 	@ AaronSchaar @ AlpacaSW Not silent... http://moneyandstate.com/the-parable-of-alpha-a-lesson-in-network-effect-game-theory/ … Keep your head in the sand. You're not helping Bitcoin.	ErikVoorhees	2	0	1487010219	831207220645941253	https://twitter.com/ErikVoorhees/status/831207220645941253			@ @
bitcoin 	More thoughts on Bitcoin transaction costs and game theory: The Parable of Alpha http://moneyandstate.com/the-parable-of-alpha-a-lesson-in-network-effect-game-theory/ … # bitcoin # blockchain # scale	ErikVoorhees	67	39	1487009706	831205072486952960	https://twitter.com/ErikVoorhees/status/831205072486952960		# # #	
	Strawman. Nobody thinks that.	ErikVoorhees	0	0	1487008388	831199543450537988	https://twitter.com/ErikVoorhees/status/831199543450537988			
bitcoin 	You clearly have no idea how much money I lose if Bitcoin falls in price. Rethink.	ErikVoorhees	0	0	1487008311	831199217762840576	https://twitter.com/ErikVoorhees/status/831199217762840576			
	You have zero conception of the transactions that aren't happening, and uses that no longer happen because they've been priced out.	ErikVoorhees	2	0	1487000699	831167293572931586	https://twitter.com/ErikVoorhees/status/831167293572931586			
	Nice chart. Try showing one from 3 year period, which I stated, using $ paid per avg tx, not btc per kb.	ErikVoorhees	0	0	1487000542	831166633674731520	https://twitter.com/ErikVoorhees/status/831166633674731520			
	The argument isn't that the TXs u see are not valuable for their senders. Rather, other potential txs are leaving the platform.	ErikVoorhees	2	0	1487000271	831165496317845504	https://twitter.com/ErikVoorhees/status/831165496317845504			
bitcoin 	More people today are getting more value from Bitcoin, correct. That doesn't refute my point.	ErikVoorhees	0	0	1487000146	831164970926796803	https://twitter.com/ErikVoorhees/status/831164970926796803			
	They go higher due to supply/demand for block space, and the higher they go, the smaller the sphere of use-cases.	ErikVoorhees	0	0	1487000083	831164706878521344	https://twitter.com/ErikVoorhees/status/831164706878521344			
	Sure, but in past 3 years, fees have gone from <$0.01 to >$0.50. This isn't explained by BTC price increase.	ErikVoorhees	1	1	1487000011	831164407283666944	https://twitter.com/ErikVoorhees/status/831164407283666944			
	"False. Cut max block size in half and fees will soar. Doesn't mean anyone is ""finding more value."" Quite the opposite."	ErikVoorhees	3	0	1486999686	831163043321085953	https://twitter.com/ErikVoorhees/status/831163043321085953			
	Umm not correct. Prices can rise for other reasons. Set blksize to 500kb for example, price up, usage down.	ErikVoorhees	0	0	1486999643	831162862169112576	https://twitter.com/ErikVoorhees/status/831162862169112576			
	You mean the higher the aggregate fees. 10k txs at $0.10 fee is more secure than 1k txs at $0.30 .	ErikVoorhees	6	0	1486999526	831162372014428163	https://twitter.com/ErikVoorhees/status/831162372014428163			
bitcoin 	"There is no ""correct"" fee for a Bitcoin transaction. But the higher it gets, the less useful the system becomes."	ErikVoorhees	118	44	1486999082	831160508992589824	https://twitter.com/ErikVoorhees/status/831160508992589824			
	The revolution will not be centralized.https://twitter.com/allenscottoshi/status/831037508708421633 …	ErikVoorhees	75	41	1486997129	831152319546933249	https://twitter.com/ErikVoorhees/status/831152319546933249			
	Good choice: Trump's VP Pence hires libertarian Mark Calabria as chief economisthttp://politi.co/2k7keuu	ErikVoorhees	19	8	1486954040	830971588799582208	https://twitter.com/ErikVoorhees/status/830971588799582208			
	Wow, that's crazy. Thanks for explaining, really appreciate it.	TuurDemeester	1	0	1487026564	831275776309727232	https://twitter.com/TuurDemeester/status/831275776309727232			
	can you elaborate? What's qtrs market?	TuurDemeester	0	0	1487025856	831272806742626304	https://twitter.com/TuurDemeester/status/831272806742626304			
	What's your view on the yuan in view of more QE & bailouts?	TuurDemeester	0	0	1487025800	831272574097248257	https://twitter.com/TuurDemeester/status/831272574097248257			
	is this futures contracts expiration?	TuurDemeester	0	0	1487025635	831271881223315457	https://twitter.com/TuurDemeester/status/831271881223315457			
	You're right, I was mislead, too. More recent source: https://www.theatlantic.com/business/archive/2016/09/ransomware-us/498602/ …pic.twitter.com/zJFpOHGRfy	TuurDemeester	2	0	1487016252	831232525603254272	https://twitter.com/TuurDemeester/status/831232525603254272			
	I have only this spring '16 projection, estimating yoy revenues of $1B by end year:http://money.cnn.com/2016/04/15/technology/ransomware-cyber-security/ …	TuurDemeester	0	0	1487015449	831229156616663040	https://twitter.com/TuurDemeester/status/831229156616663040			
	Good point.	TuurDemeester	1	0	1487012714	831217689012101120	https://twitter.com/TuurDemeester/status/831217689012101120			
	This is nice, but keep in mind it's only a weekly volume of 1,000 BTC / $1M. Drop in the bucket compared to what exchanges move.https://twitter.com/allenscottoshi/status/831037508708421633 …	TuurDemeester	13	5	1487012190	831215488965357569	https://twitter.com/TuurDemeester/status/831215488965357569			
bitcoin 	https://bitcoinmagazine.com/articles/better-bitcoin-privacy-scalability-developers-are-making-tumblebit-reality/ …	TuurDemeester	0	0	1487011179	831211247190175746	https://twitter.com/TuurDemeester/status/831211247190175746			
	14 best practices to prevent ransomware attacks, by @ CarbonBlack_Incpic.twitter.com/gDR04GJk9s	TuurDemeester	22	17	1487006882	831193224601440257	https://twitter.com/TuurDemeester/status/831193224601440257			@
	Source:https://www.carbonblack.com/2016/12/15/carbon-black-threat-report-non-malware-attacks-ransomware-take-center-stage-2016/ …	TuurDemeester	4	2	1487005185	831186106720718849	https://twitter.com/TuurDemeester/status/831186106720718849			
bitcoin 	Bitcoin fueled malware now 5% of total malware incidents. Locky encrypts your data and demands ransom, bitcoinminer secretly mines bitcoin.pic.twitter.com/k890gIhDzn	TuurDemeester	22	16	1487005140	831185920590127104	https://twitter.com/TuurDemeester/status/831185920590127104			
	Source: https://www.carbonblack.com/2016/12/15/carbon-black-threat-report-non-malware-attacks-ransomware-take-center-stage-2016/ …	TuurDemeester	3	1	1487004796	831184475996295169	https://twitter.com/TuurDemeester/status/831184475996295169			
	FTFY: ICO	TuurDemeester	1	0	1487004764	831184340188962816	https://twitter.com/TuurDemeester/status/831184340188962816			
	Total Ransomware Money Paid to Attackers by Businesses 2015: $24 million 2016: $850 millionpic.twitter.com/MLYop7A3H4	TuurDemeester	62	73	1487004547	831183434018017280	https://twitter.com/TuurDemeester/status/831183434018017280			
bitcoin 	Source:https://www.reddit.com/r/Bitcoin/comments/5ts68s/this_day_in_history_of_bitcoin/ …	TuurDemeester	4	3	1487000154	831165004460158976	https://twitter.com/TuurDemeester/status/831165004460158976			
	Indeed.	TuurDemeester	0	0	1486952040	830963203324604416	https://twitter.com/TuurDemeester/status/830963203324604416			
bitcoin 	This is in line with what Bitcoin traders/analysts were expecting all along. Hence the mild reaction price-wise.	TuurDemeester	1	0	1486948304	830947530129104897	https://twitter.com/TuurDemeester/status/830947530129104897			
	Great way to spend # Valentine's Day for guys! http://uk.funzing.com/funz/8512 # date # DatingAdvice	mrmainelli	1	0	1487000971	831168433089835009	https://twitter.com/mrmainelli/status/831168433089835009		# # #	
	Civil forfeiture is baked into police budgets. Of COURSE they're prepared for cash elimination. @ LibertarianJosehttps://www.google.com/amp/amp.timeinc.net/fortune/2016/06/09/civil-forfeiture-erad/%3Fsource%3Ddam?client=safari …	haydentiff	3	1	1487026640	831276097882963969	https://twitter.com/haydentiff/status/831276097882963969			@
	After 2007, pretend clearing houses were setup instead of the real ones needed. And now there is no mechanism to prevent collapse. @ asknbid	haydentiff	0	1	1487025564	831271583478063104	https://twitter.com/haydentiff/status/831271583478063104			@
	If any major party defaults on derivatives, it's game over. The bank with the largest derivative book in the world is failing. @ asknbid	haydentiff	1	0	1487025398	831270889291399168	https://twitter.com/haydentiff/status/831270889291399168			@
	When those derivatives go, the entire world will feel pain. @ asknbid @SimonsMenno	haydentiff	0	0	1487024576	831267440424255493	https://twitter.com/haydentiff/status/831267440424255493			@ @SimonsMenno
	There seems to be a concentrated effort to prevent a rally, but capital keeps flocking to it. No idea what's next. @ asknbid @SimonsMenno	haydentiff	3	0	1487024257	831266101405372416	https://twitter.com/haydentiff/status/831266101405372416			@ @SimonsMenno
	Cleanest dirty shirt. @ RantinArkansan @ asknbid @SimonsMenno	haydentiff	2	1	1487024104	831265458007470084	https://twitter.com/haydentiff/status/831265458007470084			@ @ @SimonsMenno
	A sharp rise in $ USD could be the lynchpin that unravels everything, especially in emerging market. It's hard to say. @ asknbid @SimonsMenno	haydentiff	1	0	1487023927	831264716353847296	https://twitter.com/haydentiff/status/831264716353847296			@ @SimonsMenno
	Things are far worse outside of the US. The dollar is strong. It's a magnet for capital in negative-yield economies. @ asknbid @SimonsMenno	haydentiff	1	1	1487023853	831264408017985541	https://twitter.com/haydentiff/status/831264408017985541			@ @SimonsMenno
	Global monetary collapse, probably. @ asknbid @SimonsMenno	haydentiff	3	0	1487023612	831263395018059776	https://twitter.com/haydentiff/status/831263395018059776			@ @SimonsMenno
