	Ah, looks like a WoT system - have you looked at this, @ ryanxcharles?https://github.com/identifi/identifi …	lopp	0	1	1487012675	831217523781689349	https://twitter.com/lopp/status/831217523781689349			@
	Are you referring to the million dollar forum rewrite or something else?	lopp	0	0	1487011516	831212662914678785	https://twitter.com/lopp/status/831212662914678785			
	Indeed, I highly prefer twitter because I can curate my own content. Trade-off due to difficulty discussing complex topics...	lopp	8	0	1487010028	831206422650159105	https://twitter.com/lopp/status/831206422650159105			
bitcoin 	Every Bitcoin forum is flawed due to being controlled by people w/vested interest in seeing their vision promoted.https://medium.com/@lopp/moderation-methods-vs-censorship-claims-f6baeb3c7392#.4vrazjpps …	lopp	39	16	1487007193	831194528430301184	https://twitter.com/lopp/status/831194528430301184		#	@lopp
	In which I discuss the current state of discussion forums. https://medium.com/@lopp/moderation-methods-vs-censorship-claims-f6baeb3c7392#.o5lstq2sm …	lopp	9	4	1486998453	831157871803035652	https://twitter.com/lopp/status/831157871803035652		#	@lopp
bitcoin 	Bitfinex Referral # Bitcoin Giveaway: 1. RT 2. Sign up https://www.bitfinex.com/?refcode=aQBHcxVPzj … 3. DM me your username Winner gets 0.1 $ BTC chosen on 28-2-17pic.twitter.com/yHzmuXrQMf	onemanatatime	51	92	1486997672	831154597737553921	https://twitter.com/onemanatatime/status/831154597737553921		#	
bitcoin 	$ WTI $ USOIL looking like a big move soon. Trade $ OIL with # Bitcoin while $ BTC & Altcoins are on a flatline on http://evolvemarkets.co .pic.twitter.com/KY4Wij92h5	onemanatatime	6	2	1486964150	831013995351904256	https://twitter.com/onemanatatime/status/831013995351904256		#	
	Trade $ USD $ EUR $ XAU $ OIL directly against $ BTC, or up to 500:1 leverage against traditional FIAT pairs. Only on http://evolvemarkets.co !pic.twitter.com/yOpBNhlkpl	onemanatatime	1	0	1486954925	830975301656027137	https://twitter.com/onemanatatime/status/830975301656027137			
	# Altsarebackpic.twitter.com/d8t9YyWDgp	CryptoHustle	16	0	1487000114	831164837430435841	https://twitter.com/CryptoHustle/status/831164837430435841		#	
	# Altcoin markets are dry as a bone...	CryptoHustle	8	0	1486991815	831130029392326662	https://twitter.com/CryptoHustle/status/831130029392326662		#	
	It'll only confirm if it breaks down. That said, always good to look at both sides. ;-)	CryptoHustle	1	0	1486951216	830959745234268162	https://twitter.com/CryptoHustle/status/830959745234268162			
bitcoin 	# Bearflag $ BTC # bitcoinhttps://www.coinigy.com/s/i/58a10789/	CryptoHustle	8	0	1486948275	830947408469250048	https://twitter.com/CryptoHustle/status/830947408469250048		# #	
bitcoin 	Natural market cycles... liquidity will shift back into altcoins when bitcoin consolidates and gets boring again.	CryptoHustle	1	0	1486947109	830942518208503808	https://twitter.com/CryptoHustle/status/830942518208503808			
	Get ready. Elon Musk says humans must merge with machines or become ... [Video]http://finance.yahoo.com/video/elon-musk-says-humans-must-162600727.html;_ylc=X1MDMTE5Nzc4NDE4NQRfZXgDMQRfeXJpZAMxOWYycWZsY2EzdTBjBGcDZFhWcFpEeHVjejVqWTJZNFpUSmhOeTAyTkRReUxUTmxOMk10T0dJeVlTMHlObVEzWkRObU1EQTRObVE4Wm1sbGJHUStkSE5zWVE9PQRsYW5nA2VuLVVTBG9yaWdfbGFuZwNlbgRvcmlnX3JlZ2lvbgNVUwRwb3MDMQRyZWdpb24DVVMEc3ltYm9sA1RTTEE-?.tsrc=applewf …	westcoastbill	8	2	1487009831	831205592974848001	https://twitter.com/westcoastbill/status/831205592974848001			
	Whew. Let's keep it going!https://twitter.com/cloud9/status/830972706816290816 …	westcoastbill	1	1	1486954396	830973083599069186	https://twitter.com/westcoastbill/status/830973083599069186			
	Go @ Cloud9 !!!https://twitter.com/lolesports/status/830919122082942976 …	westcoastbill	2	0	1486942046	830921284833783808	https://twitter.com/westcoastbill/status/830921284833783808			@
	Markets are efficient. If there is demand, the market will produce the supply.https://twitter.com/btctn/status/831172493515780098 …	CharlieShrem	9	3	1487002041	831172922647666692	https://twitter.com/CharlieShrem/status/831172922647666692			
	just joking my my friend :)	CharlieShrem	0	0	1487001044	831168739638902784	https://twitter.com/CharlieShrem/status/831168739638902784			
	but no one takes you seriously :-/	CharlieShrem	0	0	1487001024	831168653689225216	https://twitter.com/CharlieShrem/status/831168653689225216			
	Atten Designers: Want to do a redesign of http://CharlieShrem.com . Accepting offers! Please email me cs@charlieshrem.com. Thanks for RT :)	CharlieShrem	0	0	1486999429	831161965535981568	https://twitter.com/CharlieShrem/status/831161965535981568			@charlieshrem
	Mainstreet Token sale delayed so we can allow China to participate.http://www.coindesk.com/blockchain-venture-model-test-mainstreet-investment-token/ …	CharlieShrem	3	3	1486997836	831155285377032192	https://twitter.com/CharlieShrem/status/831155285377032192			
	I'm not sure if I'm happy about that lol	CharlieShrem	0	0	1486991158	831127276402073600	https://twitter.com/CharlieShrem/status/831127276402073600			
	I know that and I didn't imply that at all.	WhalePanda	1	0	1487016286	831232667345633280	https://twitter.com/WhalePanda/status/831232667345633280			
bitcoin 	https://bitcoincore.org/en/2016/01/26/segwit-benefits/ … https://bitcoincore.org/en/segwit_adoption/ … https://medium.com/@SegWit.co  and follow @ bergealex4	WhalePanda	0	0	1487011044	831210683509391361	https://twitter.com/WhalePanda/status/831210683509391361			@SegWit @
	If so, they are the last people you should listen to, since they obviously have their own agenda and financial/corporate interest in mind.	WhalePanda	7	1	1487010861	831209914961895426	https://twitter.com/WhalePanda/status/831209914961895426			
bitcoin 	"Do they want control # Bitcoin? Do they profit from altcoins? Do they have a company selling ""corporate blockchain solutions""?"	WhalePanda	6	2	1487010824	831209757914624002	https://twitter.com/WhalePanda/status/831209757914624002		#	
	"For the people who aren't ""convinced"" or try to push their own BU agenda you have to question what their real motives are."	WhalePanda	3	3	1487010756	831209474971013121	https://twitter.com/WhalePanda/status/831209474971013121			
	There's a dedicated Segwit website, lots of articles about the benefits & what it actually does (spoiler: it IS an onchain scaling solution)	WhalePanda	4	1	1487010713	831209292300742657	https://twitter.com/WhalePanda/status/831209292300742657			
bitcoin 	The communication to the community of # Bitcoin Core was far from great before. But they've really improved this the last couple of months.	WhalePanda	4	3	1487010644	831209003212537856	https://twitter.com/WhalePanda/status/831209003212537856		#	
	And another delay and another month. $ SC I like the concept but... meh.https://twitter.com/mineboxHQ/status/831196867417559042 …	WhalePanda	9	4	1487009399	831203784235872256	https://twitter.com/WhalePanda/status/831203784235872256			
	pic.twitter.com/qMyg8AZTRD	WhalePanda	0	0	1486995809	831146780586811392	https://twitter.com/WhalePanda/status/831146780586811392			
	"Charlie Shrem's ICO postponed until 27th due to ""China's impact on crypto liquidity"". I'm sure it has nothing to do with legal issues. $ ETHpic.twitter.com/M3VO9WVbkF"	WhalePanda	22	6	1486987363	831111356409663489	https://twitter.com/WhalePanda/status/831111356409663489			
	I guess so, for China at least.	WhalePanda	1	0	1486978585	831074538716790784	https://twitter.com/WhalePanda/status/831074538716790784			
	afaik yes. cost of investing in compliance probably outweighs profitability.	WhalePanda	2	0	1486978096	831072489727987712	https://twitter.com/WhalePanda/status/831072489727987712			
	Yes they are low volume, but that wasn't my point. My point was that maybe more will follow, rather shut down than invest in compliance.	WhalePanda	9	1	1486977439	831069733030080512	https://twitter.com/WhalePanda/status/831069733030080512			
	Yes I know, but I think it does show an insight on how it's easier to shut down than to be compliant :)	WhalePanda	3	1	1486977389	831069523478458368	https://twitter.com/WhalePanda/status/831069523478458368			
	true but it does show that they rather shut down than investing in being compliant.	WhalePanda	2	1	1486977357	831069387226488832	https://twitter.com/WhalePanda/status/831069387226488832			
	They were both.https://coinmarketcap.com/exchanges/haobtc/ …	WhalePanda	0	0	1486977327	831069263981068290	https://twitter.com/WhalePanda/status/831069263981068290			
bitcoin 	This is quite big Chinese # Bitcoin news.https://twitter.com/cnLedger/status/831066928319848448 …	WhalePanda	18	15	1486977176	831068627847802880	https://twitter.com/WhalePanda/status/831068627847802880		#	
	when exchanges halt withdrawals for a month, it's never positive. It might not be negative but it does create uncertainty	WhalePanda	1	0	1486976105	831064136628973568	https://twitter.com/WhalePanda/status/831064136628973568			
bitcoin 	I won't margin trade # Bitcoin until ETF news comes out. Then it's either fomo long or fomo short. Now it's just gambling against PBOC.	WhalePanda	42	7	1486975556	831061834388082688	https://twitter.com/WhalePanda/status/831061834388082688		#	
	I hate @ ChronobankNews. Twitter ads, Facebook ads, Google Adwords ads. It's absolutely awful. I'm not buying your ICO, deal with it.	WhalePanda	35	0	1486972800	831050274995392512	https://twitter.com/WhalePanda/status/831050274995392512			@
bitcoin 	On @ krakenfx more # ether is bought using fiat currency than using # bitcoin. A lot has changed in a year... thx 4 the graph @ codetractiohttps://twitter.com/codetractio/status/831212277848109057 …	cburniske	15	4	1487011593	831212985314074624	https://twitter.com/cburniske/status/831212985314074624		# #	@ @
bitcoin litecoin 	News about the PBOC freezing # bitcoin & # litecoin withdrawals broke Feb 9, but volume was twice as strong on the 8th. Gov insiders?pic.twitter.com/uLIuVjqLqx	cburniske	65	32	1487009413	831203839789371392	https://twitter.com/cburniske/status/831203839789371392		# #	
	via @ CryptoCompare	cburniske	2	0	1487005890	831189062988025857	https://twitter.com/cburniske/status/831189062988025857			@
	a portion of those people, however, will stay and not leave --> grows user base over time	cburniske	0	0	1486996459	831149510504087552	https://twitter.com/cburniske/status/831149510504087552			
	it's not false, because it's real for the time being. if it gets phased out over time then people that object can stop trading BTC	cburniske	0	0	1486996438	831149420901179393	https://twitter.com/cburniske/status/831149420901179393			
	"what do you mean by ""that"""	cburniske	0	0	1486995780	831146658540945408	https://twitter.com/cburniske/status/831146658540945408			
	"as has been happening over last 8+ years, the space will continue to mature & ""professionalize,"" but user growth is key right now"	cburniske	0	0	1486995720	831146410422784000	https://twitter.com/cburniske/status/831146410422784000			
bitcoin 	zero-fee volume is not the scourge people make it out to be. If it draws in new traders & interest, it's for # bitcoin	cburniske	1	0	1486995665	831146179320770560	https://twitter.com/cburniske/status/831146179320770560		#	
	2/ With Japan's FSA set 2 enact new # cryptocurrency regulation in April the country could be poised 2 w/ consumer & institutional adoption	cburniske	4	3	1486995598	831145896142368768	https://twitter.com/cburniske/status/831145896142368768		#	
bitcoin 	Japan currently claims 60% share of global # bitcoin trading volumes & institutional FX traders are taking note.http://www.coindesk.com/forex-bitcoin-japan-blockchain-startups-months-away/ …	cburniske	8	8	1486995413	831145121802571776	https://twitter.com/cburniske/status/831145121802571776		#	
bitcoin 	High volume, precipitous drop: someone dumped a lot of # bitcoin overnight (or during the day in # China). https://www.cryptocompare.com/coins/btc/overview/USD …pic.twitter.com/o3MxPbkyeL	cburniske	7	2	1486986919	831109494528700416	https://twitter.com/cburniske/status/831109494528700416		# #	
bitcoin 	What say you, PBOC? If # bitcoin can someday usurp the petrodollar, is prob ok 2 let some capital flight slide & fill its coffers w/ $ BTChttps://twitter.com/alistairmilne/status/830859219708555264 …	cburniske	10	4	1486946000	830937868545691648	https://twitter.com/cburniske/status/830937868545691648		#	
	Sunday night inbox count: 10. Calling it a victory and heading to bed...	AriannaSimpson	7	1	1486969409	831036052324380672	https://twitter.com/AriannaSimpson/status/831036052324380672			
	“We came on a boat from Ireland to California” by @ JhanaInchttps://greatmanager.co/we-came-on-a-boat-from-ireland-to-california-453f77a00cb5#.az08toon3 …	AriannaSimpson	1	0	1486967971	831030022009925632	https://twitter.com/AriannaSimpson/status/831030022009925632		#	@
	How is @ mint still SO BAD at categorizing expenses? Honestly, hit rate is like, ~40% at best (even for repeat expenses!)	AriannaSimpson	9	1	1486967806	831029330583179264	https://twitter.com/AriannaSimpson/status/831029330583179264			@
	no idea, haven't been to that one!	AriannaSimpson	1	0	1486962585	831007431765417984	https://twitter.com/AriannaSimpson/status/831007431765417984			
	Aspen is pic.twitter.com/5VIDzWsMQy	AriannaSimpson	9	0	1486959706	830995356875882496	https://twitter.com/AriannaSimpson/status/830995356875882496			
	this only works if you don't mind being interrupted every 2 secs. Defensive mode sucks	AriannaSimpson	0	0	1486958771	830991432215322624	https://twitter.com/AriannaSimpson/status/830991432215322624			
	will DM	AriannaSimpson	0	0	1486943719	830928301631950848	https://twitter.com/AriannaSimpson/status/830928301631950848			
	...I suspect many don't realize it's not just bidir payment channels.	peterktodd	6	0	1487014775	831226330578575361	https://twitter.com/peterktodd/status/831226330578575361			
	Yeah, I spent all morning going through Lightning in detail...	peterktodd	2	0	1487014751	831226230842281984	https://twitter.com/peterktodd/status/831226230842281984			
	For starters, by asking they get to catch you lying, which can easily be worse than the truth.	peterktodd	0	1	1487013808	831222274787332097	https://twitter.com/peterktodd/status/831222274787332097			
	It's hard enough to just tell the truth accurately when border security is being aggressive, something I know from experience.	peterktodd	3	1	1487013535	831221130685976576	https://twitter.com/peterktodd/status/831221130685976576			
	You have surprisingly few rights while crossing borders in most countries, particularly if not a citizen.	peterktodd	3	0	1487013222	831219817562648576	https://twitter.com/peterktodd/status/831219817562648576			
	Seriously, don't do this lightly. Lying to agents is very difficult. For starters, they likely have your real social media account anyway. https://twitter.com/el33th4xor/status/831205083685740545 …	peterktodd	22	5	1487012980	831218803593900032	https://twitter.com/peterktodd/status/831218803593900032			
	I mean, Lightning paper or @ rusty_twit's Deployable Lightning paper.	peterktodd	1	0	1486973144	831051718351810564	https://twitter.com/peterktodd/status/831051718351810564			@
	@ tdryja @ jcp @ starkness CC	peterktodd	1	0	1486972953	831050917805973504	https://twitter.com/peterktodd/status/831050917805973504			@ @ @
	No! Thanks!	peterktodd	0	0	1486972879	831050606756392960	https://twitter.com/peterktodd/status/831050606756392960			
bitcoin 	Q: Who should I cite for the revocation hash bidirectional channel¹ idea? Lightning paper? Or someone earlier? 1)https://github.com/bitcoin/bips/blob/master/bip-0112.mediawiki#lightning-network …	peterktodd	5	4	1486972812	831050323775066113	https://twitter.com/peterktodd/status/831050323775066113		#lightning	
	Here's my attempt as showing an invalid refund tx due to malleability via a rounded rectangle tx!pic.twitter.com/0dK3bv4NmU	peterktodd	0	0	1486965052	831017778337419266	https://twitter.com/peterktodd/status/831017778337419266			
	Heh, come to think of it, that way of drawing it would also kinda give the impression segwit's been activated. :)	peterktodd	1	0	1486964954	831017367631183872	https://twitter.com/peterktodd/status/831017367631183872			
	Yup! Though I'll confess to be very bad at remembering to bring mine on trips - 99% of the time you don't need it. :)	peterktodd	1	0	1486964710	831016345361850369	https://twitter.com/peterktodd/status/831016345361850369			
	"Good to hear! Maybe try drawing up a handwritten-style ""Alice"" and ""Bob"" with a checkmark?"	peterktodd	0	0	1486964278	831014530088058880	https://twitter.com/peterktodd/status/831014530088058880			
	...to setup camp at about 2am. No big deal as we had compasses, maps, and GPS, but easy to see how you'd get lost without.	peterktodd	0	0	1486964165	831014056811171841	https://twitter.com/peterktodd/status/831014056811171841			
	I've actually been in that situation: went camping in Febuary, and we had to cross a frozen lake in a whiteout storm...	peterktodd	0	0	1486964118	831013858609336321	https://twitter.com/peterktodd/status/831013858609336321			
	The people way off in the distance in that photo are probably not being very smart... Likely had no compasses.	peterktodd	0	0	1486964073	831013669974716416	https://twitter.com/peterktodd/status/831013669974716416			
	Parents used to live *way* up north; every year people would die on the frozen lakes by getting lost in whiteout weather.	peterktodd	0	0	1486964033	831013503402123265	https://twitter.com/peterktodd/status/831013503402123265			
	If a storm comes in visibility can very quickly drop to zero, making navigation impossible.	peterktodd	0	0	1486963974	831013255422283777	https://twitter.com/peterktodd/status/831013255422283777			
	In all seriousness, that photo was staged _very_ close to shore; walking out onto a frozen lake without a compass is dumb.	peterktodd	0	0	1486963913	831012999376814080	https://twitter.com/peterktodd/status/831012999376814080			
	But Dia is still seems to be better than Inkscape - I don't see how to get nice snapping and so on of diagram elements in Inkscape. :(	peterktodd	0	0	1486963831	831012657486512132	https://twitter.com/peterktodd/status/831012657486512132			
	FWIW these diagrams were all done w/ Dia (http://dia-installer.de/ ) Kinda clunky UI, and SVG export isn't great.	peterktodd	2	0	1486963778	831012433686827012	https://twitter.com/peterktodd/status/831012433686827012			
bitcoin 	E.g.https://github.com/bitcoin/bips/blob/master/bip-0112.mediawiki#lightning-network …	peterktodd	1	0	1486963622	831011778402385920	https://twitter.com/peterktodd/status/831011778402385920		#lightning	
	Trickier example from a bidirectional payment channel, corresponding to txouts w/ scriptPubKey's w/ a if {} else {} endif choice.pic.twitter.com/3Z3F6Tqz7N	peterktodd	5	2	1486963496	831011250280726528	https://twitter.com/peterktodd/status/831011250280726528			
	Trying to show txs as the *outputs* they produce; the split between Alice and Bob graphically showing more funds to Bob w/ each payment.	peterktodd	0	1	1486963127	831009702175707136	https://twitter.com/peterktodd/status/831009702175707136			
	. @ jspilman payment channel diagrams from an article I'm working on. Ideas on how to represent signatures/half-signed txs? Stamps? Initials?pic.twitter.com/tfzrRFwl1A	peterktodd	14	8	1486962993	831009143599271936	https://twitter.com/peterktodd/status/831009143599271936			@
	Yeah, but I only play a core contributor on TV^H^H^H^H^H Twitter.	peterktodd	1	0	1486958924	830992077186068480	https://twitter.com/peterktodd/status/830992077186068480			
	Toronto Here's a shot of me on my 100% Canadian morning commute:https://twitter.com/petertoddbtc/status/676373152109232128 …	peterktodd	1	0	1486957229	830984965127041026	https://twitter.com/peterktodd/status/830984965127041026			
	Signed this. https://www.pressprogress.ca/petition_demanding_trudeau_honour_electoral_reform_promise_rockets_past_100000_signatures … Trudeau's been a disappointment.	peterktodd	8	4	1486951092	830959224607870978	https://twitter.com/peterktodd/status/830959224607870978			
	Youre still not answering my question: Why do you think there was private communication?	peterktodd	1	0	1486949253	830951513090555904	https://twitter.com/peterktodd/status/830951513090555904			
	"No miners were asked to ""voluntarily sacrifice"" their blocks. Now why do you think that?"	peterktodd	1	1	1486944811	830932881073639426	https://twitter.com/peterktodd/status/830932881073639426			
	Grateful to be featured in @ TimsWeiss and @ bantigito 's book on Digital Kenya!https://twitter.com/TimsWeiss/status/831037297109901312 …	e_rossiello	14	6	1486984052	831097471782752256	https://twitter.com/e_rossiello/status/831097471782752256			@ @
	Replied. More likely people inside exchanges if properly adjusted for time zones. 9th in USA is 8th in Asia.	ToneVays	1	0	1487023806	831264211909083140	https://twitter.com/ToneVays/status/831264211909083140			
	If this is properly adjusted for Time Zones... would say people at the Exchanges might have traded on the info	ToneVays	5	0	1487023710	831263808127647745	https://twitter.com/ToneVays/status/831263808127647745			
bitcoin 	that is not a question I would expect from someone with the following description. Please Read: http://www.libertylifetrail.com/2016/04/04/the-top-use-cases-for-bitcoin/ …pic.twitter.com/ZCheG1RrcI	ToneVays	0	0	1486993889	831138730954080257	https://twitter.com/ToneVays/status/831138730954080257			
	I answered this question a few hours ago during my Q&A in the Market Video, check my YouTube	ToneVays	1	0	1486955539	830977878204510209	https://twitter.com/ToneVays/status/830977878204510209			
bitcoin 	"A great intro to # Bitcoin Documentary. Please share & use Discount code ""tone"" on @ Vimeo # Blockchain # MagicMoneyhttps://vimeo.com/ondemand/magicmoneyfilm …"	ToneVays	30	27	1486940586	830915160860672001	https://twitter.com/ToneVays/status/830915160860672001		# # #	@
	you forget: This is all part if the rebalancing plan!!	BaldingsWorld	5	0	1487025200	831270058563244033	https://twitter.com/BaldingsWorld/status/831270058563244033			
	Lohan is out due to her diplomatic work	BaldingsWorld	2	0	1487025155	831269867139371008	https://twitter.com/BaldingsWorld/status/831269867139371008			
	Breaking: Moby claims Trump isn't vegan https://twitter.com/NME/status/831246047695499265 …	BaldingsWorld	2	1	1487022978	831260737418846208	https://twitter.com/BaldingsWorld/status/831260737418846208			
	Perspective: That's more than 50% of nominal GDP.https://twitter.com/YuanTalks/status/831154144207478784 …	BaldingsWorld	28	26	1487019556	831246382388219906	https://twitter.com/BaldingsWorld/status/831246382388219906			
	but if nobody believes you, surely you just increase them?	BaldingsWorld	0	0	1487015951	831231264048885761	https://twitter.com/BaldingsWorld/status/831231264048885761			
	Facthttps://twitter.com/B_Neha/status/831049534235111424 …	BaldingsWorld	3	1	1486972720	831049939690008576	https://twitter.com/BaldingsWorld/status/831049939690008576			
	Told you this would happenhttps://twitter.com/C_Barraud/status/831040927242264576 …	BaldingsWorld	4	2	1486972610	831049479964930048	https://twitter.com/BaldingsWorld/status/831049479964930048			
	@ io8_8ov dropping hints their tough guy?	BaldingsWorld	0	0	1486972497	831049006604120064	https://twitter.com/BaldingsWorld/status/831049006604120064			@
	Seriously who believes this $%&*#?https://twitter.com/ftchina/status/831046302721069056 …	BaldingsWorld	10	2	1486972329	831048297875795968	https://twitter.com/BaldingsWorld/status/831048297875795968		#	
	Consumer rebalancing with Chinese characteristicshttps://twitter.com/YuanTalks/status/831045619774955520 …	BaldingsWorld	5	1	1486972219	831047837920088064	https://twitter.com/BaldingsWorld/status/831047837920088064			
	Lots of interesting detail herehttps://twitter.com/laurimyllyvirta/status/831005047844544512 …	BaldingsWorld	8	1	1486963411	831010895249616896	https://twitter.com/BaldingsWorld/status/831010895249616896			
	Consumer and services rebalancing with Chinese characteristicshttps://twitter.com/SoberLook/status/831006033225080836 …	BaldingsWorld	5	1	1486962720	831007995693641728	https://twitter.com/BaldingsWorld/status/831007995693641728			
	This sounds familiar....https://twitter.com/ReutersChina/status/830991863570001920 …	BaldingsWorld	2	1	1486962622	831007585033609217	https://twitter.com/BaldingsWorld/status/831007585033609217			
	I've never met anyone with ties to the Koch's and most econ profs self professed liberals	BaldingsWorld	1	0	1486955788	830978922699382784	https://twitter.com/BaldingsWorld/status/830978922699382784			
	Great noodle monetary policy linguistic similies aside, this is a great piece on the challenges of the PBOChttps://twitter.com/justinaknope/status/830970245024067585 …	BaldingsWorld	3	3	1486955527	830977826434146304	https://twitter.com/BaldingsWorld/status/830977826434146304			
	Maybe the greatest Fin Twit Valentines Day tweet everhttps://twitter.com/HaidiLun/status/830975884353875969 …	BaldingsWorld	5	1	1486955300	830976876935933952	https://twitter.com/BaldingsWorld/status/830976876935933952			
	Surely it's not just me that see the resemblancepic.twitter.com/W6qRvgLtGu	BaldingsWorld	5	0	1486942083	830921440132210688	https://twitter.com/BaldingsWorld/status/830921440132210688			
	several Trump policies, which are likely to be at least partly enacted, will push the dollar up.	prchovanec	1	0	1487019850	831247617157898240	https://twitter.com/prchovanec/status/831247617157898240			
	@ thebrmoore it is, as always, at today's equilibrium. But I believe we will see more upside pressure than downside.	prchovanec	0	0	1487019732	831247121651228673	https://twitter.com/prchovanec/status/831247121651228673			@
