	Top coding languages for 2017 by @ SWPlacementsIre for @ Irish_TechNews http://irishtechnews.ie/top-coding-languages-for-2017/ … @ SimonCocking # coding # developerspic.twitter.com/ssIQlvGphv	SimonCocking	5	3	1487000199	831165194441207814	https://twitter.com/SimonCocking/status/831165194441207814		# #	@ @ @
	What's next in the world of marketing @ jeremarketer speaking at @ DubTechSummit http://irishtechnews.ie/whats-next-in-the-world-of-marketing-communications-insights-with-jeremy-goldman/ … @ SimonCocking @ Irish_TechNews # DTSpic.twitter.com/F3jHP6ijQR	SimonCocking	2	1	1486999000	831160165856579584	https://twitter.com/SimonCocking/status/831160165856579584		#	@ @ @ @
	How to create and grow your brand by @ Iam360WISE for @ Irish_TechNews http://irishtechnews.ie/how-to-create-and-grow-your-personal-brand/ … @ SimonCocking # socialmediamarketing # Marketingpic.twitter.com/ph0CX3rCUV	SimonCocking	61	534	1486994065	831139466463027200	https://twitter.com/SimonCocking/status/831139466463027200		# #	@ @ @
	How to pick the best Social Media platform for your business? - http://go.shr.lc/2j6vXUT  via @ Irish_TechNews	SimonCocking	66	789	1486993458	831136923385225217	https://twitter.com/SimonCocking/status/831136923385225217			@
	Featured today @ GlandoreNetwork Business Showcase http://irishtechnews.ie/business-showcase-glandore/ … & workspace for @ DubTechSummit # DTS @ SimonCocking @ Irish_TechNewspic.twitter.com/9d1ZeFvUuz	SimonCocking	13	10	1486992949	831134786286657537	https://twitter.com/SimonCocking/status/831134786286657537		#	@ @ @ @
	Collaborate, create, connect. Why coworking is the future - http://go.shr.lc/2jA9yCX  via @ Irish_TechNews	SimonCocking	8	6	1486991508	831128740440715264	https://twitter.com/SimonCocking/status/831128740440715264			@
	well done, best of luck & you're featured here http://irishtechnews.ie/vc-firm-draper-esprit-hires-irish-entrepreneur-nicola-mcclafferty/ … @ speirinpic.twitter.com/16yOgByutO	SimonCocking	3	1	1486990949	831126398609797120	https://twitter.com/SimonCocking/status/831126398609797120			@
	Iot trends & # LPWAN with Will Ferguson @ VT_IoT http://irishtechnews.ie/iot-trends-lpwan-is-something-to-get-very-excited-about-will-ferguson-vtnetworks/ … learn more at # DTS @ DubTechSummit @ SimonCocking @ Irish_TechNewspic.twitter.com/0VmTh7Gzhp	SimonCocking	7	5	1486990710	831125393511956481	https://twitter.com/SimonCocking/status/831125393511956481		# #	@ @ @ @
	Social media marketing wisdom with @ sandikrakowski http://irishtechnews.ie/be-authentic-serve-others-well-and-having-a-blast-doing-it-social-media-marketing-wisdom-with-sandi-krakowski/ … @ SimonCocking @ Irish_TechNews # socialmediamarketing # socialmediapic.twitter.com/MeGaLTSAOf	SimonCocking	10	2	1486988403	831115719093923841	https://twitter.com/SimonCocking/status/831115719093923841		# #	@ @ @
	Innovation projects at the ESB, Paul Mulvaney Executive Director of Innovation explains more - http://go.shr.lc/2kZrKoN  via @ Irish_TechNews	SimonCocking	1	1	1486987131	831110383423352832	https://twitter.com/SimonCocking/status/831110383423352832			@
	ESB innovation, latest podcast by @ AidanMcCullen for @ Irish_TechNews http://irishtechnews.ie/innovation-projects-at-the-esb-paul-mulvaney-executive-director-of-innovation-explains-more/ … @ SimonCocking @ ESBNetworkspic.twitter.com/buPVCb07aN	SimonCocking	3	1	1486986897	831109401603870720	https://twitter.com/SimonCocking/status/831109401603870720			@ @ @ @
	Paul Rohan explains PSD2 and the Future of Banking - http://go.shr.lc/2lgT2GU  via @ Irish_TechNews	SimonCocking	2	2	1486986437	831107475030044677	https://twitter.com/SimonCocking/status/831107475030044677			@
	@ FacingChina fyi you might like http://irishtechnews.ie/the-chinese-have-transitioned-directly-to-a-mobile-only-era-insights-into-china-with-winston-ma/ … interested in featuring too? @ SimonCocking @ Irish_TechNews	SimonCocking	0	0	1486985691	831104342958698496	https://twitter.com/SimonCocking/status/831104342958698496			@ @ @
	@ fydiz_ 25 startups to watch at Dublin Tech Summit fyi you're featured http://irishtechnews.ie/25-startups-to-watch-at-dublin-tech-summit/ … @ SimonCocking @ Irish_TechNews	SimonCocking	0	1	1486985643	831104141254606848	https://twitter.com/SimonCocking/status/831104141254606848			@ @ @
	@ buymediaie 25 startups to watch at Dublin Tech Summit fyi you're featured http://irishtechnews.ie/25-startups-to-watch-at-dublin-tech-summit/ … @ SimonCocking @ Irish_TechNews	SimonCocking	0	0	1486985624	831104063861317632	https://twitter.com/SimonCocking/status/831104063861317632			@ @ @
	@ CognitionWorld 25 startups to watch at Dublin Tech Summit fyi you're featured http://irishtechnews.ie/25-startups-to-watch-at-dublin-tech-summit/ … @ SimonCocking @ Irish_TechNews	SimonCocking	0	0	1486985570	831103837318631424	https://twitter.com/SimonCocking/status/831103837318631424			@ @ @
	@ ShiftAviation 25 startups to watch at Dublin Tech Summit fyi you're featured http://irishtechnews.ie/25-startups-to-watch-at-dublin-tech-summit/ … @ SimonCocking @ Irish_TechNews	SimonCocking	0	0	1486985546	831103735346630656	https://twitter.com/SimonCocking/status/831103735346630656			@ @ @
	@ GraknLabs 25 startups to watch at Dublin Tech Summit fyi you're featured http://irishtechnews.ie/25-startups-to-watch-at-dublin-tech-summit/ … @ SimonCocking @ Irish_TechNews	SimonCocking	4	2	1486985476	831103440860356608	https://twitter.com/SimonCocking/status/831103440860356608			@ @ @
	@ arraysapp 25 startups to watch at Dublin Tech Summit fyi you're featured http://irishtechnews.ie/25-startups-to-watch-at-dublin-tech-summit/ … @ SimonCocking @ Irish_TechNews	SimonCocking	1	0	1486985456	831103357142069249	https://twitter.com/SimonCocking/status/831103357142069249			@ @ @
	@ livemon_ 25 startups to watch at Dublin Tech Summit fyi you're featured http://irishtechnews.ie/25-startups-to-watch-at-dublin-tech-summit/ … @ SimonCocking @ Irish_TechNews	SimonCocking	3	1	1486985416	831103189449637888	https://twitter.com/SimonCocking/status/831103189449637888			@ @ @
	@ VoteBash 25 startups to watch at Dublin Tech Summit fyi you're featured http://irishtechnews.ie/25-startups-to-watch-at-dublin-tech-summit/ … @ SimonCocking @ Irish_TechNews	SimonCocking	11	6	1486985401	831103128162406403	https://twitter.com/SimonCocking/status/831103128162406403			@ @ @
	@ AzimapSoft 25 startups to watch at Dublin Tech Summit fyi you're featured http://irishtechnews.ie/25-startups-to-watch-at-dublin-tech-summit/ … @ SimonCocking @ Irish_TechNews	SimonCocking	1	0	1486985367	831102983526051840	https://twitter.com/SimonCocking/status/831102983526051840			@ @ @
	@ WonderMobileApp 25 startups to watch at Dublin Tech Summit fyi you're featured http://irishtechnews.ie/25-startups-to-watch-at-dublin-tech-summit/ … @ SimonCocking @ Irish_TechNews	SimonCocking	1	1	1486985352	831102920775045120	https://twitter.com/SimonCocking/status/831102920775045120			@ @ @
	@ StagelinkTweet 25 startups to watch at Dublin Tech Summit fyi you're featured http://irishtechnews.ie/25-startups-to-watch-at-dublin-tech-summit/ … @ SimonCocking @ Irish_TechNews	SimonCocking	1	1	1486985319	831102785160617986	https://twitter.com/SimonCocking/status/831102785160617986			@ @ @
	@ mywomags 25 startups to watch at Dublin Tech Summit fyi you're featured http://irishtechnews.ie/25-startups-to-watch-at-dublin-tech-summit/ … @ SimonCocking @ Irish_TechNews	SimonCocking	0	0	1486985301	831102707146563585	https://twitter.com/SimonCocking/status/831102707146563585			@ @ @
	@ getdesignwizard 25 startups to watch at Dublin Tech Summit fyi you're featured http://irishtechnews.ie/25-startups-to-watch-at-dublin-tech-summit/ … @ SimonCocking @ Irish_TechNews	SimonCocking	1	0	1486985277	831102608869830656	https://twitter.com/SimonCocking/status/831102608869830656			@ @ @
	@ VT_IoT 25 startups to watch at Dublin Tech Summit fyi you're featured http://irishtechnews.ie/25-startups-to-watch-at-dublin-tech-summit/ … @ SimonCocking @ Irish_TechNews	SimonCocking	1	0	1486985167	831102147752230912	https://twitter.com/SimonCocking/status/831102147752230912			@ @ @
	@ nuacomie 25 startups to watch at Dublin Tech Summit fyi you're featured http://irishtechnews.ie/25-startups-to-watch-at-dublin-tech-summit/ … @ SimonCocking @ Irish_TechNews	SimonCocking	0	0	1486985134	831102007016615936	https://twitter.com/SimonCocking/status/831102007016615936			@ @ @
	@ shopCartful 25 startups to watch at Dublin Tech Summit fyi you're featured http://irishtechnews.ie/25-startups-to-watch-at-dublin-tech-summit/ … @ SimonCocking @ Irish_TechNews	SimonCocking	0	0	1486985068	831101732767854592	https://twitter.com/SimonCocking/status/831101732767854592			@ @ @
	@aptOn_tweets 25 startups to watch at # dts fyi you're featured http://irishtechnews.ie/25-startups-to-watch-at-dublin-tech-summit/ … @ SimonCocking @ Irish_TechNews	SimonCocking	1	0	1486985036	831101597719605249	https://twitter.com/SimonCocking/status/831101597719605249		#	@aptOn_tweets @ @
	@ ImpressMe 25 startups to watch at # dts fyi you're featured http://irishtechnews.ie/25-startups-to-watch-at-dublin-tech-summit/ … @ SimonCocking @ Irish_TechNews	SimonCocking	1	0	1486985017	831101517939765248	https://twitter.com/SimonCocking/status/831101517939765248		#	@ @ @
	Latest great piece by @ speirin for @ Irish_TechNews http://irishtechnews.ie/vc-firm-draper-esprit-hires-irish-entrepreneur-nicola-mcclafferty/ … @ NikkiMcClaff @ BrianCVC @ SimonCockingpic.twitter.com/pSVMRZOvaZ	SimonCocking	6	4	1486983900	831096831337697281	https://twitter.com/SimonCocking/status/831096831337697281			@ @ @ @ @
	Using tech to do the right thing @ mikebutcher explains more about @ Techfugees http://irishtechnews.ie/using-tech-to-do-the-right-thing-techcrunchs-mike-butcher-explains-techfugees-initiative/ … @ SimonCocking @ Irish_TechNewspic.twitter.com/W1bCKr1mSB	SimonCocking	9	5	1486976396	831065358199095296	https://twitter.com/SimonCocking/status/831065358199095296			@ @ @ @
	Meanwhile Icahn sold his 50 million Apple shares at $95. Leaving $1.86 bil on the table for Buffett! Icahn has negative returns. $ aapl	GerberKawasaki	4	1	1487022534	831258876339118082	https://twitter.com/GerberKawasaki/status/831258876339118082			
	correct. I'd this point Id be happy if they bought the french phone company. If they earned 5% on cash it's $12 bil! $ aapl	GerberKawasaki	0	0	1487022337	831258047594979329	https://twitter.com/GerberKawasaki/status/831258047594979329			
	Ok landlords, you actually have to spend money to protect the residents that keep paying you obscene rent. Good job # santamonica !https://twitter.com/santamonicacity/status/831257196956626946 …	GerberKawasaki	3	1	1487022244	831257656975187968	https://twitter.com/GerberKawasaki/status/831257656975187968		#	
	Truth is Apple's future has never been more in doubt. Where do they go? Only thing going for it is the 16 PE. Financial engineering $ aapl	GerberKawasaki	4	2	1487022160	831257307765837824	https://twitter.com/GerberKawasaki/status/831257307765837824			
	Who would think, bad Airpods, no one owns an Apple watch or uses apple pay, Iphones are basically all the same, Ipad sales down 20% $ aaplhttps://twitter.com/ReutersBiz/status/831255831354232832 …	GerberKawasaki	3	1	1487022003	831256649914478592	https://twitter.com/GerberKawasaki/status/831256649914478592			
	The last breath of a dying brand. Nice to know you Playboy, hard to attract viewers when you were last cool in 1980.https://twitter.com/CNN/status/831254830366732289 …	GerberKawasaki	1	1	1487021819	831255875863973888	https://twitter.com/GerberKawasaki/status/831255875863973888			
	I think that's accurate. I think most tech startups will never be profitable. # Snap	GerberKawasaki	0	0	1487021727	831255489555992580	https://twitter.com/GerberKawasaki/status/831255489555992580		#	
	Already let your financial goals for the year fall by the wayside? @NickLicourisarticle has tips to stay on track! http://ow.ly/aq06308XRaC pic.twitter.com/QSGab5Rnto	GerberKawasaki	2	1	1487016036	831231619197452290	https://twitter.com/GerberKawasaki/status/831231619197452290			@NickLicourisarticle
	Never stared at Canada with such jealousy. (joke) # trudeau	GerberKawasaki	7	0	1487013456	831220797389754368	https://twitter.com/GerberKawasaki/status/831220797389754368		#	
	They were profitable when they went public. $ FB	GerberKawasaki	1	0	1487011158	831211161362194432	https://twitter.com/GerberKawasaki/status/831211161362194432			
	The country is in the most uncertain time in decades and volatility is at a low. We think this is a big disconnect.	GerberKawasaki	1	0	1487011140	831211083624968192	https://twitter.com/GerberKawasaki/status/831211083624968192			
	Its weird right now. We're not euphoric at all and we have been taking some profits on the way but you have to be long right now.	GerberKawasaki	1	0	1487011090	831210874438287363	https://twitter.com/GerberKawasaki/status/831210874438287363			
	Boy, this stock market fun just doesn't stop. Financials going nuts now. $ FRC $ KRE $ KBE	GerberKawasaki	5	1	1487010382	831207905726656512	https://twitter.com/GerberKawasaki/status/831207905726656512			
	Black swan event. # LARain More rain coming this weekend they say. 72 and sunny today...https://twitter.com/easystreetbiz/status/831175713948438529 …	GerberKawasaki	1	0	1487002993	831176914454786049	https://twitter.com/GerberKawasaki/status/831176914454786049		#	
	Don't buy twitter stock! # sacca the lottery winner. $ twtrhttps://twitter.com/cnbc/status/830096591134527490 …	GerberKawasaki	5	1	1487002957	831176761895374848	https://twitter.com/GerberKawasaki/status/831176761895374848		#	
	What he noticed was there is already a border wall. No one is hopping it. And no need to build more wall in the middle of nowhere! # theWallhttps://twitter.com/dhsgov/status/831175758928298017 …	GerberKawasaki	1	0	1487002903	831176535054823426	https://twitter.com/GerberKawasaki/status/831176535054823426		#	
	Tesla continues to move higher. Up $9 now. Defense stocks all moving higher. IMAX making a move up as well. $ noc $ tsla $ imax $ gd # stocks	GerberKawasaki	5	1	1487002772	831175986347597825	https://twitter.com/GerberKawasaki/status/831175986347597825		#	
	agree. The second half.	GerberKawasaki	1	0	1486996904	831151376520458240	https://twitter.com/GerberKawasaki/status/831151376520458240			
	that's because most fail. So this is a high risk stock on its best days. Where would Facebook be if they didn't buy instagram?	GerberKawasaki	0	0	1486996854	831151165639307265	https://twitter.com/GerberKawasaki/status/831151165639307265			
	# stocks start higher across the world. Tesla & Apple start higher. Rally in Tesla might just be gettting going. Apple upgraded. $ tsla $ aapl	GerberKawasaki	6	2	1486996723	831150616655261697	https://twitter.com/GerberKawasaki/status/831150616655261697		#	
	Strong weekend box office. 'Lego Batman Movie' Tops 'Fifty Shades Darker' With $55.6 Million Box Office Weekendhttps://apple.news/AHTVXvYdTSdmmZqxwlqNttw …	GerberKawasaki	3	1	1486995962	831147422701096960	https://twitter.com/GerberKawasaki/status/831147422701096960			
	Hollywood secret. Don't spend a lot of money. Then you make money. # johnwick2https://www.bloomberg.com/news/articles/2017-02-13/keanu-reeves-shows-hollywood-how-to-make-money …	GerberKawasaki	2	2	1486995862	831147003069427712	https://twitter.com/GerberKawasaki/status/831147003069427712		#	
	All while artist starve. # streaming is broken. https://twitter.com/carlquintanilla/status/831145142681735168 …	GerberKawasaki	3	1	1486995652	831146125272903682	https://twitter.com/GerberKawasaki/status/831146125272903682		#	
	There are so many tech companies that have NO business model. That is a path to make money. Like # Betterment # Spotify. They pay you to use.	GerberKawasaki	1	3	1486995496	831145468491030529	https://twitter.com/GerberKawasaki/status/831145468491030529		# #	
	So many tech start ups pay you to use them. Like Uber instacart. Etc. they are all on sharepost raising money to give to users to use.	GerberKawasaki	0	2	1486995401	831145069495193600	https://twitter.com/GerberKawasaki/status/831145069495193600			
	# snap is not suitable for public investors. It's loses $1.30 for every dollar it takes in. Think about this. They pay for you to use it.	GerberKawasaki	20	11	1486995347	831144845657845761	https://twitter.com/GerberKawasaki/status/831144845657845761		#	
	The public gets the highest valuation sell out from the VC owners to buy non voting worthless stock. Enough already with scamming the public	GerberKawasaki	9	3	1486995276	831144548327776257	https://twitter.com/GerberKawasaki/status/831144548327776257			
	How is it unfair when # VCs have been dumping crap # IPOs on the public like Twitter! So many bad ones! # Snap should not be a public company.https://twitter.com/srussolillo/status/831143473264918530 …	GerberKawasaki	3	2	1486995216	831144295813902336	https://twitter.com/GerberKawasaki/status/831144295813902336		# # #	
	Sorry. I just can't take # Adele ! I liked the second half of the # GRAMMYs but # Beyonce got robbed. # lemonade was way more creative.	GerberKawasaki	5	1	1486995061	831143645004734464	https://twitter.com/GerberKawasaki/status/831143645004734464		# # # #	
	The terrorists that come from rich countries, # Trump # Dubai. No better place to discuss your next attack on America.http://bloom.bg/2lGEnDY	GerberKawasaki	0	0	1486994968	831143255861391360	https://twitter.com/GerberKawasaki/status/831143255861391360		# #	
	Thank god for Gary Clark as I was starting to wonder what was going on at the # GRAMMYs # music	GerberKawasaki	6	0	1486955860	830979222327873536	https://twitter.com/GerberKawasaki/status/830979222327873536		# #	
	Chase Customers Can Soon Use Mint, TurboTax Without Sharing Their Bank Passwordshttp://buff.ly/2jzJ5Wd	obussmann	2	0	1487014861	831226690051440640	https://twitter.com/obussmann/status/831226690051440640			
bitcoin 	Bitcoin Startup Xapo Gets Nod of Approval from Swiss Finance Regulator - CoinDesk http://buff.ly/2kakPL3 # CryptoValley	obussmann	4	3	1486997521	831153960912306176	https://twitter.com/obussmann/status/831153960912306176		#	
bitcoin 	Credit China FinTech Inks $30 Million Deal with Bitcoin Firm BitFury - CryptoCoinsNewshttp://buff.ly/2jDLT2b	obussmann	2	6	1486988460	831115958248996866	https://twitter.com/obussmann/status/831115958248996866			
	Video from Davos: The Global # Fintech Revolution - Crowdfund Insiderhttp://buff.ly/2jTZcMV	obussmann	1	2	1486971061	831042979712344064	https://twitter.com/obussmann/status/831042979712344064		#	
	@ sytaylorhttps://twitter.com/clickbaitrobot/status/831145792266190850 …	Chris_Skinner	1	1	1486997936	831155705424015360	https://twitter.com/Chris_Skinner/status/831155705424015360			@
	# FinTech is dead, long live # FinTech @ FinTechInsidershttps://twitter.com/FinTechInsiders/status/831108576752054272 …	Chris_Skinner	5	3	1486990161	831123093942833153	https://twitter.com/Chris_Skinner/status/831123093942833153		# #	@
	Things worth reading: 13th February 2017 - Things we're reading today include ... RBS plays down claim it will... http://fb.me/8t4L8cuEm	Chris_Skinner	2	1	1486977473	831069874466148352	https://twitter.com/Chris_Skinner/status/831069874466148352			
	2026	Chris_Skinner	0	0	1486976531	831065923998081024	https://twitter.com/Chris_Skinner/status/831065923998081024			
	The Birth of Computing and Development of the Web via Chris Skinner's blog - The last chapter of ...http://tinyurl.com/gls2ldz	Chris_Skinner	1	1	1486975021	831059589550440450	https://twitter.com/Chris_Skinner/status/831059589550440450			
	The Birth of Computing and Development of the Web - The last chapter of ValueWeb talks about what comes after the... http://fb.me/7u5xUyIWg	Chris_Skinner	1	2	1486974107	831055757541978112	https://twitter.com/Chris_Skinner/status/831055757541978112			
	@ breakingbanks hey. :)	davidbrear	0	0	1487011015	831210562679951360	https://twitter.com/davidbrear/status/831210562679951360			@
	Goodness me that was a busy day... feel like the pace in 2017 has picked up which is awesome.	davidbrear	0	0	1487010733	831209379357741057	https://twitter.com/davidbrear/status/831209379357741057			
	awesome he was too :)	davidbrear	0	0	1487009352	831203587221028865	https://twitter.com/davidbrear/status/831203587221028865			
	yeh its pretty good isnt it... i think the voice stuff for payments will increase for sure...	davidbrear	1	0	1487006145	831190134695542784	https://twitter.com/davidbrear/status/831190134695542784			
	@ Digital_Magss being awesome once again at the payments event with @ _TheBunker in June https://twitter.com/_TheBunker/status/831109141263503360 …	davidbrear	1	2	1486986923	831109509691092992	https://twitter.com/davidbrear/status/831109509691092992			@ @
	maybe... there has to be some element of insurance you can take out to ensure i dont take your whole company down... :)	davidbrear	1	0	1486983773	831096301207056388	https://twitter.com/davidbrear/status/831096301207056388			
	that better be for the co-op Kieran?!	davidbrear	0	0	1486981729	831087726904623105	https://twitter.com/davidbrear/status/831087726904623105			
	well everyone has stuff but my only legacy system is a ACL knee injury I had once. I've never missold anyone anything either.	davidbrear	1	0	1486981672	831087489238581248	https://twitter.com/davidbrear/status/831087489238581248			
	Following on from the co-ops decision this AM. I have decided to put myself up for sale. I will do # FinTech & # Banking stuff for money.	davidbrear	13	5	1486981130	831085212683612161	https://twitter.com/davidbrear/status/831085212683612161		# #	
	I need to look at it in more detail	dgwbirch	0	0	1487025070	831269513320611842	https://twitter.com/dgwbirch/status/831269513320611842			
	it wasn’t my MasterCard since I refuse to buy food or drink on board, but it appeared to be all MasterCards proferred	dgwbirch	0	0	1487024805	831268399149891589	https://twitter.com/dgwbirch/status/831268399149891589			
	Weird. BA to Berlin,in-flight POS accepting Amex and Visa but not MasterCard. Is there a merchant payments ecosystem expert on board?	dgwbirch	6	0	1487018521	831242042990804995	https://twitter.com/dgwbirch/status/831242042990804995			
	this is why your fake social media account should be in your real name and your real social media account should be in a fake name	dgwbirch	2	0	1487013123	831219401609330688	https://twitter.com/dgwbirch/status/831219401609330688			
	true	dgwbirch	0	0	1487012943	831218649344200704	https://twitter.com/dgwbirch/status/831218649344200704			
	# mpecosystem massive fail - the taxi doesn't take cards. Note to organisers: please boycott cities that do not mandate cashless taxis	dgwbirch	14	4	1487010228	831207260412112897	https://twitter.com/dgwbirch/status/831207260412112897		#	
	The idea that education is the answer seems so quaint now. It's time to ask the robots to intercede on our behalf.pic.twitter.com/7caFN2DrkI	dgwbirch	0	0	1487008304	831199191405838337	https://twitter.com/dgwbirch/status/831199191405838337			
	I promise that none of my panelists will claim that the Blockchain will end world hunger or stop climate change http://buff.ly/2kKNSV9	dgwbirch	8	0	1487006291	831190746879377408	https://twitter.com/dgwbirch/status/831190746879377408			
	Payment system as policeman http://buff.ly/2kGcZso  perhaps we need payment systems with different kinds of money for different purposes	dgwbirch	1	1	1487004315	831182459605770240	https://twitter.com/dgwbirch/status/831182459605770240			
	"Go Fark: ""a special place in hell for kind people who steal bolted-down Playstations from children's cancer wards http://buff.ly/2l1bZQl"	dgwbirch	0	0	1487003165	831177634113531904	https://twitter.com/dgwbirch/status/831177634113531904			
	Don't forget artificial deep Quantum intelligent learning (aka machine consciousness aka please robots I'm begging you to take over soon)https://twitter.com/efipm/status/831158998812483584 …	dgwbirch	2	3	1487000462	831166300277837824	https://twitter.com/dgwbirch/status/831166300277837824			
	not for long	dgwbirch	0	0	1486998230	831156934648676353	https://twitter.com/dgwbirch/status/831156934648676353			
	Is this the new NHS policy we've been reading about? Where are you? Ealing?https://twitter.com/seat2d/status/830811543449300992 …	dgwbirch	0	0	1486997414	831153515603042306	https://twitter.com/dgwbirch/status/831153515603042306			
	Are you sure @ michaelcross? I think Lenin said that progress was the power of the workers plus the blockchainification of the country	dgwbirch	0	0	1486997333	831153174245470210	https://twitter.com/dgwbirch/status/831153174245470210			@
	Scatchamagowza never mind a unicorn, Stripe is a krakenhttps://twitter.com/astridbijou/status/802528691955924992 …	dgwbirch	1	0	1486996939	831151523677732865	https://twitter.com/dgwbirch/status/831151523677732865			
	There is NOTHING that THE BLOCKCHAIN CANNOT DOhttps://twitter.com/guzmand/status/830761434795606016 …	dgwbirch	3	2	1486996537	831149835772379136	https://twitter.com/dgwbirch/status/831149835772379136			
	What? The Heathrow Express is now £25? Mike for mile, that's more than the Mars mission isn't it?	dgwbirch	11	2	1486996004	831147601705713665	https://twitter.com/dgwbirch/status/831147601705713665			
	you need to get line behind my Quantum Blockchain	dgwbirch	2	0	1486995901	831147167792451584	https://twitter.com/dgwbirch/status/831147167792451584			
	Holy shit. There is NOTHING that THE BLOCKCHAIN CANNOT DOhttps://twitter.com/brianforde/status/831128900772229120 …	dgwbirch	47	28	1486991819	831130048719630338	https://twitter.com/dgwbirch/status/831130048719630338			
