	How Our Brains Respond to Different Content Formats http://j.mp/2h4Tzgu # science # contentmarketing # media	WarrenWhitlock	6	16	1486993938	831138932796616704	https://twitter.com/WarrenWhitlock/status/831138932796616704		# # #	
	Affordable motion capture system is an entire studio in a suit http://j.mp/2iNtHlJ # video # VR # innovation # tech	WarrenWhitlock	2	3	1486992685	831133678902329345	https://twitter.com/WarrenWhitlock/status/831133678902329345		# # # #	
	Where To Look As The Lithium Boom Unfolds this year http://bit.ly/2kIsKie # stocks $ BRGRF # mining # lithium	WarrenWhitlock	2	3	1486991477	831128611960799232	https://twitter.com/WarrenWhitlock/status/831128611960799232		# # #	
	HydroBee – USB Power from Nature http://ochen.com/hydrobee-usb-power-from-nature … # ochen # renewable # gadget # innovation	WarrenWhitlock	0	0	1486991445	831128478414209025	https://twitter.com/WarrenWhitlock/status/831128478414209025		# # # #	
	Weeks from Idea to Millions Reached http://j.mp/1RuF1S7 # bestseller # book # marketingpic.twitter.com/mYzOw5HI1D	WarrenWhitlock	6	0	1486989373	831119788986474498	https://twitter.com/WarrenWhitlock/status/831119788986474498		# # #	
	Solar Energy Use Molten Salt to Work at Night http://j.mp/2hadC95 # ochen # solarenergy # innovation # future	WarrenWhitlock	8	9	1486988906	831117827390238721	https://twitter.com/WarrenWhitlock/status/831117827390238721		# # # #	
	"The most fascinating person on my show: ""The World Wants More of You!"" http://dld.bz/duU2m # radio # podcast"	WarrenWhitlock	4	1	1486988231	831114999544176640	https://twitter.com/WarrenWhitlock/status/831114999544176640		# #	
	Lucy Let’s You Control the Sun http://j.mp/1RuF1BR # energy # savings # solarpic.twitter.com/BOf1JiaN34	WarrenWhitlock	3	1	1486987552	831112149703471104	https://twitter.com/WarrenWhitlock/status/831112149703471104		# # #	
	Storytelling advice from Akira Kurosawa http://ochen.com/storytelling-advice-from-akira-kurosawa … # marketing # writing # creatvivity	WarrenWhitlock	3	1	1486986375	831107214362411010	https://twitter.com/WarrenWhitlock/status/831107214362411010		# # #	
	Pitch Decks Galore: A Curated List of Public Startup Pitch Decks http://j.mp/2jhU4Qt	WarrenWhitlock	7	3	1486986039	831105802513547264	https://twitter.com/WarrenWhitlock/status/831105802513547264			
	Not just a wheelbarrow. It's saving lives and freeing people http://j.mp/29KGDZa # cleanwater # billionsrisingpic.twitter.com/POgjW8w7jy	WarrenWhitlock	11	12	1486985658	831104206899650561	https://twitter.com/WarrenWhitlock/status/831104206899650561		# #	
	Improved Solar Energy Efficiency from New Software Forecasting Models http://j.mp/2gkd8QU # ochen # solarenergy	WarrenWhitlock	14	14	1486985149	831102072279953408	https://twitter.com/WarrenWhitlock/status/831102072279953408		# #	
	Misteaks Happen. How Not to Look Bad on Twitter. http://j.mp/1RuF14O # socialmedia # trainingpic.twitter.com/lm3NxYgDBv	WarrenWhitlock	2	2	1486983836	831096564810645504	https://twitter.com/WarrenWhitlock/status/831096564810645504		# #	
	First paralyzed human treated with stem cells has now regained his upper body movement http://j.mp/2kHStsq	WarrenWhitlock	38	25	1486982182	831089626689445889	https://twitter.com/WarrenWhitlock/status/831089626689445889			
	The Strange Custom of Setting Pianos on Fire [video] http://j.mp/2hcF1Lp # ochen # music # cuture	WarrenWhitlock	5	2	1486981391	831086309464760320	https://twitter.com/WarrenWhitlock/status/831086309464760320		# # #	
	David Letterman Goes to India to Learn about Solar http://j.mp/2fBpRx9 # ochen # solarenergy # india # innovation	WarrenWhitlock	7	4	1486980126	831081001589817345	https://twitter.com/WarrenWhitlock/status/831081001589817345		# # # #	
	"I've had a ""zero InBox"" for years. My secret weapon, SaneBox Try it free: http://mbsy.co/gL66D # email # clutter # tool"	WarrenWhitlock	1	1	1486979398	831077950682517504	https://twitter.com/WarrenWhitlock/status/831077950682517504		# # #	
	Google's AI Can Now Translate Between Languages It Wasn't Taught to Translate http://j.mp/2fGwA98 # ochen # tranlation # machinelearning	WarrenWhitlock	7	7	1486978820	831075523841372161	https://twitter.com/WarrenWhitlock/status/831075523841372161		# # #	
	Demystifying The Google Knowledge Graph http://j.mp/1RuF14J # SeachEngine # Googlepic.twitter.com/EN5o1YViA3	WarrenWhitlock	4	0	1486978634	831074744598401024	https://twitter.com/WarrenWhitlock/status/831074744598401024		# #	
	Cost of offshore wind power in UK has dropped 32 percent in four years http://j.mp/2kHOgoz	WarrenWhitlock	4	5	1486978353	831073564992339972	https://twitter.com/WarrenWhitlock/status/831073564992339972			
	Google's AI can now lip read better than humans after watching thousands of hours of TV http://j.mp/2fBijdP # ochen # machinelearning	WarrenWhitlock	12	9	1486977563	831070251139887104	https://twitter.com/WarrenWhitlock/status/831070251139887104		# #	
	The Value of Being Seen as a Thought Leader http://dld.bz/duB6b # podcast # leadership # business	WarrenWhitlock	8	6	1486977426	831069679498178560	https://twitter.com/WarrenWhitlock/status/831069679498178560		# # #	
	You are part of a social network superorganism http://j.mp/29n3siZ # video # connection # storiespic.twitter.com/uF3wHePzpq	WarrenWhitlock	6	0	1486976785	831066989770788865	https://twitter.com/WarrenWhitlock/status/831066989770788865		# # #	
	It's a coat, and a sleeping bag, and a way out of homelessness. [video] http://j.mp/2iobOJP # selfreliance @ billionsrising	WarrenWhitlock	6	6	1486976315	831065017852243968	https://twitter.com/WarrenWhitlock/status/831065017852243968		#	@
	too bad you didn't read the article. You might have learned	WarrenWhitlock	0	0	1486975654	831062245605924864	https://twitter.com/WarrenWhitlock/status/831062245605924864			
	you'll find people who say that for any day	WarrenWhitlock	1	0	1486975620	831062102269792257	https://twitter.com/WarrenWhitlock/status/831062102269792257			
	"Carlin said it best. Something like ""don't take a side"""	WarrenWhitlock	1	1	1486975593	831061989946384386	https://twitter.com/WarrenWhitlock/status/831061989946384386			
	I'm surprised we've never mad it a law :)	WarrenWhitlock	0	0	1486975503	831061612555489280	https://twitter.com/WarrenWhitlock/status/831061612555489280			
	Ha	WarrenWhitlock	0	0	1486975460	831061434326880256	https://twitter.com/WarrenWhitlock/status/831061434326880256			
	"want to understand what governments do? Watch ""Wag the Dog"""	WarrenWhitlock	0	0	1486975439	831061344350728192	https://twitter.com/WarrenWhitlock/status/831061344350728192			
	hides	WarrenWhitlock	1	0	1486975383	831061109616414723	https://twitter.com/WarrenWhitlock/status/831061109616414723			
	Anaheim	WarrenWhitlock	1	1	1486975352	831060979832147968	https://twitter.com/WarrenWhitlock/status/831060979832147968			
	much less than killed in fossil fuel production http://ochen.com/chart-how-many-birds-are-killed-by-wind-solar-oil-and-coal …	WarrenWhitlock	0	0	1486975314	831060818523414528	https://twitter.com/WarrenWhitlock/status/831060818523414528			
	pic.twitter.com/bclsfTGDdB	WarrenWhitlock	0	0	1486975243	831060523055607808	https://twitter.com/WarrenWhitlock/status/831060523055607808			
	I've seen turbines like these for rooftops. Like the fake tree design. # cool	WarrenWhitlock	1	0	1486975170	831060215256621057	https://twitter.com/WarrenWhitlock/status/831060215256621057		#	
	Giving Patients an Active Role in Their Health Care http://j.mp/2h0ASau # ochen # health # innovation	WarrenWhitlock	1	0	1486975039	831059668093063169	https://twitter.com/WarrenWhitlock/status/831059668093063169		# # #	
	he's one smart guy	WarrenWhitlock	0	0	1486975020	831059584974409730	https://twitter.com/WarrenWhitlock/status/831059584974409730			
	no fossils needed	WarrenWhitlock	0	0	1486975006	831059526514139136	https://twitter.com/WarrenWhitlock/status/831059526514139136			
	I think you've confused immigrants with terrorists. LOL	WarrenWhitlock	1	0	1486974965	831059356481261568	https://twitter.com/WarrenWhitlock/status/831059356481261568			
	what source has no sin?	WarrenWhitlock	0	0	1486974915	831059145860083713	https://twitter.com/WarrenWhitlock/status/831059145860083713			
	How to Master the Art of Content Creation with Bloggers http://j.mp/1RuF1BJ pic.twitter.com/rWFOp2fNYc	WarrenWhitlock	2	3	1486974911	831059129737310209	https://twitter.com/WarrenWhitlock/status/831059129737310209			
	wouldn't it be more noble to take care of one's own stuff # commonsense	WarrenWhitlock	0	0	1486974896	831059065249738752	https://twitter.com/WarrenWhitlock/status/831059065249738752		#	
	smart enough to take care of their stuff without the government telling them to?	WarrenWhitlock	1	0	1486974861	831058919682248707	https://twitter.com/WarrenWhitlock/status/831058919682248707			
	Flying Saucer Concept http://ochen.com/flying-saucer-concept … # ochen # flyingcar # future	WarrenWhitlock	6	3	1486973778	831054378769477632	https://twitter.com/WarrenWhitlock/status/831054378769477632		# # #	
	I could use a social media assistant like this guy http://j.mp/1RuF1l7 # funny # video # socialmediapic.twitter.com/7MkasSjdWK	WarrenWhitlock	2	1	1486973099	831051528383365120	https://twitter.com/WarrenWhitlock/status/831051528383365120		# # #	
	Sweden is paying people to fix belongings instead of throwing them away http://j.mp/2hcIyJx # ochen # innovation # future # economy	WarrenWhitlock	17	13	1486972513	831049071930507265	https://twitter.com/WarrenWhitlock/status/831049071930507265		# # # #	
	A Robotic lawn mower powered by # SolarEnergy with an Arduino heart http://j.mp/2hcHVQg # ochen # robotics # innovation	WarrenWhitlock	3	2	1486971261	831043818719961088	https://twitter.com/WarrenWhitlock/status/831043818719961088		# # # #	
	Spray-On Solar Cells: The Future of # SolarEnergy http://j.mp/2imGDyt # tech # future # innovation	WarrenWhitlock	6	7	1486970013	831038587890233344	https://twitter.com/WarrenWhitlock/status/831038587890233344		# # # #	
	Twitter Revolution: Social Media and Mobile Marketing are Changing the Way We Do Business http://gshift.it/tr-tw pic.twitter.com/PwBgzsAUtb	WarrenWhitlock	12	7	1486969629	831036974203072512	https://twitter.com/WarrenWhitlock/status/831036974203072512			
	The 3 Stages of Twitter Acceptance http://dld.bz/dpnDf	WarrenWhitlock	3	2	1486969512	831036486334152704	https://twitter.com/WarrenWhitlock/status/831036486334152704			
	How Magicians Trick Your Brain: The Psychology Of Magic [video[ http://ochen.com/how-magicians-trick-your-brain-the-psychology-of-magic …	WarrenWhitlock	5	3	1486969103	831034767059611648	https://twitter.com/WarrenWhitlock/status/831034767059611648			
	All-bacterial battery makes a nutrient when charged, eats it to discharge http://ochen.com/all-bacterial-battery-makes-a-nutrient-when-charged-eats-it-to-discharge … # alternativeenergy # batteries	WarrenWhitlock	11	8	1486969050	831034547445829632	https://twitter.com/WarrenWhitlock/status/831034547445829632		# #	
	Windows 10's Project NEON look might throw off users again http://ochen.com/windows-10s-project-neon-look-might-throw-off-users-again-slashgear …	WarrenWhitlock	3	2	1486968987	831034284647526400	https://twitter.com/WarrenWhitlock/status/831034284647526400			
	The Met has released more than 375,000 images that you can use for free http://ochen.com/the-met-has-released-more-than-375000-images-that-you-can-use-for-free …	WarrenWhitlock	30	14	1486968938	831034077910286337	https://twitter.com/WarrenWhitlock/status/831034077910286337			
	Wind and solar have grown seemingly unstoppable. http://j.mp/2gqJhTR # solarenergy # technology # ochen	WarrenWhitlock	9	11	1486968740	831033247924703232	https://twitter.com/WarrenWhitlock/status/831033247924703232		# # #	
	"""How can you work and live in Vegas?"" .. I answered it at: http://j.mp/1RuF14K # Vegas # Baby # Vegaspic.twitter.com/2kzaAachmn"	WarrenWhitlock	6	2	1486967909	831029762969710592	https://twitter.com/WarrenWhitlock/status/831029762969710592		# # #	
	Should you be a Thought Leader? http://dld.bz/duB6b # radio # podcast	WarrenWhitlock	5	2	1486966635	831024416960212992	https://twitter.com/WarrenWhitlock/status/831024416960212992		# #	
	Work, after SB Sunday - Make it a national holiday already!http://ochen.com/work-after-sb-sunday-make-it-a-national-holiday-already …	WarrenWhitlock	6	1	1486966252	831022810197872640	https://twitter.com/WarrenWhitlock/status/831022810197872640			
	Is # influencemarketing a scam? http://j.mp/2aK8ESE pic.twitter.com/MZELQtR3EP	WarrenWhitlock	2	1	1486966057	831021992493117440	https://twitter.com/WarrenWhitlock/status/831021992493117440		#	
	Google's Plan To Make Our Buildings Less Poisonous http://j.mp/2kVJwuU # health # environment # workplace	WarrenWhitlock	11	3	1486965479	831019569552752641	https://twitter.com/WarrenWhitlock/status/831019569552752641		# # #	
	Watch singer Seal Join Street Musician For duet in Manchesterhttp://ochen.com/watch-singer-seal-join-street-musician-for-duet-in-manchester …	WarrenWhitlock	3	4	1486964994	831017534044381186	https://twitter.com/WarrenWhitlock/status/831017534044381186			
	Why Google Killed 1.7 Billion Ads Last Year - And Kicked 200 Publishers Off Its Networkhttp://j.mp/2kHX9i9	WarrenWhitlock	11	7	1486964917	831017212127358976	https://twitter.com/WarrenWhitlock/status/831017212127358976			
	"""The world is absurd."" -Richard Feynman http://j.mp/1RuF1l9 # feynman # physics # nobelprizepic.twitter.com/tknBWu4HFD"	WarrenWhitlock	8	3	1486964174	831014096669700097	https://twitter.com/WarrenWhitlock/status/831014096669700097		# # #	
	UberHIRE: Many Destinations, One Uberhttp://ochen.com/uberhire-many-destinations-one-uber …	WarrenWhitlock	1	2	1486963704	831012125057437696	https://twitter.com/WarrenWhitlock/status/831012125057437696			
	Scientists Create Completely Renewable Propane. Yes. Propane. http://j.mp/1RuF1l3 # green # energy # techpic.twitter.com/mtQprbZDsI	WarrenWhitlock	6	4	1486962351	831006449073606656	https://twitter.com/WarrenWhitlock/status/831006449073606656		# # #	
	100+ HR Technologies and Recruiting Tools Worth Watching in 2017. http://j.mp/2kR1oFm # hr # futurework # newwaytowork	WarrenWhitlock	6	3	1486961663	831003565242068992	https://twitter.com/WarrenWhitlock/status/831003565242068992		# # #	
	Solar Energy. The new norm. [video] http://j.mp/2kCv7mE # solarenergy # greenenergy # solarpower	WarrenWhitlock	16	11	1486961628	831003416252018688	https://twitter.com/WarrenWhitlock/status/831003416252018688		# # #	
	The happiest place on Earth did get build by worryingpic.twitter.com/LncXPDOMzy	WarrenWhitlock	12	5	1486961530	831003005143175168	https://twitter.com/WarrenWhitlock/status/831003005143175168			
	Falcon 9 getting ready to use Apollo launchpad http://j.mp/2lBayFH # space # rocket	WarrenWhitlock	8	9	1486961169	831001493545312256	https://twitter.com/WarrenWhitlock/status/831001493545312256		# #	
	When They Asked for Social Media Tips. I Gave Them Bacon and Eggs http://j.mp/1mzm4kw # bacon # marketing # salespic.twitter.com/SHnuhfd3eV	WarrenWhitlock	7	5	1486960450	830998475361878016	https://twitter.com/WarrenWhitlock/status/830998475361878016		# # #	
	Star Wars Land to open at Disneyland in 2019 http://ochen.com/star-wars-land-to-open-at-disneyland-in-2019 …	WarrenWhitlock	19	13	1486958664	830990985484234757	https://twitter.com/WarrenWhitlock/status/830990985484234757			
	Why You Need to Study Konstantin Tsiolkovsky http://j.mp/1RuF1lb # nanotech # abundance # futurepic.twitter.com/oASHwHrxKB	WarrenWhitlock	0	2	1486958643	830990896049045504	https://twitter.com/WarrenWhitlock/status/830990896049045504		# # #	
	John Oliver Returns to Out-News the News—by Ignoring Trumphttp://ochen.com/john-oliver-returns-to-out-news-the-newsby-ignoring-trump …	WarrenWhitlock	12	5	1486957625	830986626335645696	https://twitter.com/WarrenWhitlock/status/830986626335645696			
	Creating Extra Value Through Thought # Leadership http://dld.bz/duB6b # radio # podcast	WarrenWhitlock	1	6	1486955825	830979076986925057	https://twitter.com/WarrenWhitlock/status/830979076986925057		# # #	
	Louisville leading the way with a Smart City APIhttp://ochen.com/louisville-leading-the-way-with-a-smart-city-api …	WarrenWhitlock	8	4	1486954878	830975103257149440	https://twitter.com/WarrenWhitlock/status/830975103257149440			
	The revolution in markets. # blockchain for everyone http://j.mp/1RuF1l5 # marketing # business # techpic.twitter.com/baNVuGvU3J	WarrenWhitlock	13	16	1486954647	830974134486183936	https://twitter.com/WarrenWhitlock/status/830974134486183936		# # # #	
	Kevin Smith to resurrect Jay and Silent Bobhttp://ochen.com/kevin-smith-to-resurrect-jay-and-silent-bob …	WarrenWhitlock	18	7	1486953633	830969881419997185	https://twitter.com/WarrenWhitlock/status/830969881419997185			
	A good leader is ready to handle any situation # leadership # quotepic.twitter.com/OdsbyDNycF	WarrenWhitlock	22	13	1486953547	830969523679420416	https://twitter.com/WarrenWhitlock/status/830969523679420416		# #	
	"Personalisation vs. Creepy. Don't go ""Minority Report"" on us. [video] http://j.mp/29nNoN4 # adtech # futurepic.twitter.com/z2VgTt7TU9"	WarrenWhitlock	8	6	1486952776	830966288902139905	https://twitter.com/WarrenWhitlock/status/830966288902139905		# #	
	what city couldn't use positive trust stories?	WarrenWhitlock	1	1	1486952335	830964440342278145	https://twitter.com/WarrenWhitlock/status/830964440342278145			
	"Nokia sold to Microsoft. Do you mean ""beat by competition like Apple beat Nokia?"""	WarrenWhitlock	1	1	1486952262	830964134191575042	https://twitter.com/WarrenWhitlock/status/830964134191575042			
	no tip, no minimum wage. No sick days, unionizing, or whining about who has to work on St. Patrick's Day. # futureofwork	WarrenWhitlock	1	1	1486952202	830963881665114112	https://twitter.com/WarrenWhitlock/status/830963881665114112		#	
	"""Shh.. don't say that until we get our funding"""	WarrenWhitlock	3	1	1486952074	830963344756465664	https://twitter.com/WarrenWhitlock/status/830963344756465664			
	huh?	WarrenWhitlock	1	1	1486952035	830963181119959040	https://twitter.com/WarrenWhitlock/status/830963181119959040			
	Elon Musk plans to start digging tunnels to beat traffic http://j.mp/2kHPVuy	WarrenWhitlock	14	5	1486951504	830960955492335617	https://twitter.com/WarrenWhitlock/status/830960955492335617			
	How To Be Confidenthttp://ochen.com/how-to-be-confident …	WarrenWhitlock	1	2	1486951146	830959451125456898	https://twitter.com/WarrenWhitlock/status/830959451125456898			
	Why do Business People talk about Killing Each Other? http://j.mp/1RuF1BL # business # war # sportspic.twitter.com/toU93sHGVn	WarrenWhitlock	4	9	1486950942	830958595923664901	https://twitter.com/WarrenWhitlock/status/830958595923664901		# # #	
	Cafe X opens in San Francisco, bringing robots to the coffee shop http://j.mp/2l1cM0c # business # automation # robots	WarrenWhitlock	5	3	1486950714	830957641203642368	https://twitter.com/WarrenWhitlock/status/830957641203642368		# # #	
	YouTube opens mobile live streams to those with 10k+ fans http://j.mp/2kR1YVu # livestreaming # youtube	WarrenWhitlock	5	6	1486950650	830957370872365056	https://twitter.com/WarrenWhitlock/status/830957370872365056		# #	
	Google's Plan To Make Our Buildings Less Poisonoushttp://ochen.com/googles-plan-to-make-our-buildings-less-poisonous …	WarrenWhitlock	3	4	1486949837	830953962098524160	https://twitter.com/WarrenWhitlock/status/830953962098524160			
	Another way to describe a meeting with @ TheMrBlueprintpic.twitter.com/17bRUqGABQ	WarrenWhitlock	12	3	1486949129	830950993378414592	https://twitter.com/WarrenWhitlock/status/830950993378414592			@
	Where is Your Blog? Richard Branson Says You Got to Do This http://j.mp/1RuF1l2 # blogging # marketingpic.twitter.com/gqDWE8ysot	WarrenWhitlock	4	2	1486949067	830950731754659840	https://twitter.com/WarrenWhitlock/status/830950731754659840		# #	
	From Tragedy to Trust. A Positive Story from Charleston http://ochen.com/from-tragedy-to-trust-a-positive-story-from-charleston …	WarrenWhitlock	6	1	1486948591	830948735312084992	https://twitter.com/WarrenWhitlock/status/830948735312084992			
	"you mean ""purchased by Microsoft?"""	WarrenWhitlock	0	0	1486948185	830947032877576194	https://twitter.com/WarrenWhitlock/status/830947032877576194			
	no worries, there is so much to choose from # billionsrising out of poverty, so much energy it will be free, # nanotechnology, etc	WarrenWhitlock	2	0	1486948108	830946710423613440	https://twitter.com/WarrenWhitlock/status/830946710423613440		# #	
	By the end of Nov, he was doing whole shows about evil of Trump. If you watch the promos and read blog, you'll see what's promising	WarrenWhitlock	0	0	1486948034	830946399235682304	https://twitter.com/WarrenWhitlock/status/830946399235682304			
	the world is absurd. We certainly can ignore politics and sill find a laugh	WarrenWhitlock	1	0	1486947942	830946015171612672	https://twitter.com/WarrenWhitlock/status/830946015171612672			
	I'm running out of appropriate gifs of people in a booth doing a high five. So I'll use this # selfiepic.twitter.com/FUmT879b6M	WarrenWhitlock	0	0	1486947874	830945726762934276	https://twitter.com/WarrenWhitlock/status/830945726762934276		#	
	watch it about 10 times more before even thinking of understanding it. Dream talk hinds the idea of inception :)	WarrenWhitlock	0	0	1486947590	830944538717876224	https://twitter.com/WarrenWhitlock/status/830944538717876224			
	refugees were human being. refugees before were human beings. What's stupid is people thinking they are different.	WarrenWhitlock	0	0	1486947514	830944218847682561	https://twitter.com/WarrenWhitlock/status/830944218847682561			
	it's a drone, not an insect	WarrenWhitlock	0	0	1486947414	830943796800032769	https://twitter.com/WarrenWhitlock/status/830943796800032769			
	Apple Said to Revive Efforts to Sell Used iPhones in Indiahttp://ochen.com/apple-said-to-revive-efforts-to-sell-used-iphones-in-india …	WarrenWhitlock	2	1	1486947328	830943437952266240	https://twitter.com/WarrenWhitlock/status/830943437952266240			
	Kevin Spacey Explains Content Marketing http://j.mp/1RuF14L pic.twitter.com/7MIPfdHaQg	WarrenWhitlock	4	1	1486947192	830942868747538433	https://twitter.com/WarrenWhitlock/status/830942868747538433			
	Forget your weaknesses, increase your strengths and be the most awesome you, that you can be @ alphabetsuccesspic.twitter.com/D2OgZZ8x4v	WarrenWhitlock	14	7	1486945567	830936050101006340	https://twitter.com/WarrenWhitlock/status/830936050101006340			@
	My interview with Mitchell Levy, the Thought Leadership Expert http://dld.bz/duB6b # podcast # leadership # radio	WarrenWhitlock	2	3	1486945054	830933900776075265	https://twitter.com/WarrenWhitlock/status/830933900776075265		# # #	
	5G is still years away, but at least it has a logo nowhttp://ochen.com/5g-is-still-years-away-but-at-least-it-has-a-logo-now …	WarrenWhitlock	7	3	1486944796	830932819690008577	https://twitter.com/WarrenWhitlock/status/830932819690008577			
	I told my dog to keep his music off my loudspeakers http://ochen.com/dogs-have-music-preferences-but-most-like-to-chill-with-reggae-says-study … # dog # music # sciencenews	WarrenWhitlock	8	5	1486943778	830928546428309516	https://twitter.com/WarrenWhitlock/status/830928546428309516		# # #	
	Japan Has Created Black Mirror-Inspired Bee Drones http://j.mp/2kQs6h5 # robotics # automation # innovation # future	WarrenWhitlock	8	6	1486943751	830928436914946048	https://twitter.com/WarrenWhitlock/status/830928436914946048		# # # #	
	Solar dish sets steamy thermal energy efficiency record http://j.mp/2iqOYnR # solarenergy # renewable	WarrenWhitlock	5	3	1486943542	830927558090833922	https://twitter.com/WarrenWhitlock/status/830927558090833922		# #	
	Share this with someone who needs a smile today http://j.mp/2a9nhbH # socialmedia # joy # love # sharingpic.twitter.com/8L3L9jJMbV	WarrenWhitlock	5	4	1486943473	830927269354995712	https://twitter.com/WarrenWhitlock/status/830927269354995712		# # # #	
	"I've had a ""zero InBox"" for years. My secret weapon, SaneBox Try it free: http://mbsy.co/gL66D # email # clutter # tool"	WarrenWhitlock	0	1	1486943376	830926862733938688	https://twitter.com/WarrenWhitlock/status/830926862733938688		# # #	
	This Battery Breakthrough Could Double Your Smartphone's Life http://j.mp/2bfhylD # tech # battery	WarrenWhitlock	6	5	1486942274	830922240027934722	https://twitter.com/WarrenWhitlock/status/830922240027934722		# #	
	Ken Burns Film About How Ken Burns Tells Stories http://j.mp/OBqHGm # storytelling # writingpic.twitter.com/kXPwosUrBB	WarrenWhitlock	6	3	1486941613	830919465718132736	https://twitter.com/WarrenWhitlock/status/830919465718132736		# #	
	5 Copywriting Techniques That Affect SEO http://j.mp/2hacwdg # marketing # contentmarketing # seo # copywriting # ochen	WarrenWhitlock	12	4	1486941053	830917118472364032	https://twitter.com/WarrenWhitlock/status/830917118472364032		# # # # #	
bitcoin 	Significant selling pressure in China due to blocked bitcoin withdrawals. What happens after bitcoin withdrawals come back?	jimmysong	0	0	1486960079	830996918381731840	https://twitter.com/jimmysong/status/830996918381731840			
	David Duke ‘Really Likes’ Keith Ellison For Democratic National Committee Chairhttp://ift.tt/2kDX7E5	DollarVigilante	9	26	1487024165	831265717089685505	https://twitter.com/DollarVigilante/status/831265717089685505			
	Protect Your Family and Investments # SHTF # Socialism # Venezuela Subscribe here--> https://dollarvigilante.com/2tt pic.twitter.com/rnjppMIT7t	DollarVigilante	10	30	1487019548	831246350486474754	https://twitter.com/DollarVigilante/status/831246350486474754		# # #	
	Infamous Sex Offender Jerry Sandusky’s Son Arrested for Child Sexual Assaulthttp://ift.tt/2lcTkAY	DollarVigilante	11	29	1487019067	831244334368448512	https://twitter.com/DollarVigilante/status/831244334368448512			
