	That’s great. We need to address climate change. Tesla is way ahead however. Volvo is doing well.	GerberKawasaki	0	0	1515250979	949657553088143363	https://twitter.com/GerberKawasaki/status/949657553088143363			
	It’s call non correlated assets. Read some @RayDalio	GerberKawasaki	1	0	1515250887	949657170747904000	https://twitter.com/GerberKawasaki/status/949657170747904000			@RayDalio
bitcoin 	To be clear we do not manage a bitcoin fund or hold alt/Crypto accounts. We simply provide investment advice and manage traditional portfolios. But if you have an account at coinbase. You need investment advice. We can help.	GerberKawasaki	12	0	1515250340	949654872944553984	https://twitter.com/GerberKawasaki/status/949654872944553984			
bitcoin 	We are the only RIA firm with expierence in crypto & bitcoin. Contact us - we can make sure things fit in an overall investment plan. All of our accounts have three sections. Stocks, bonds and Alts. But you must be allocated correctly. Let us help you. Info@gerberkawasaki.com	GerberKawasaki	12	2	1515250197	949654275457560577	https://twitter.com/GerberKawasaki/status/949654275457560577			@gerberkawasaki
bitcoin ripple 	Please crypto and bitcoin is high risk and not for inexperienced investors. If you have no idea what something is, like ripple for example. Why are you buying it? FOMO is a horrid investment thesis.	GerberKawasaki	40	3	1515250006	949653472365879296	https://twitter.com/GerberKawasaki/status/949653472365879296			
bitcoin 	Trump is the best thing ever for crypto. He gets more unstable every day. Causing more risk to the system. More risk in our system. Higher bitcoin goes. #bitcoin	GerberKawasaki	14	3	1515249916	949653094509367296	https://twitter.com/GerberKawasaki/status/949653094509367296		#bitcoin	
	Day 6 - GK Crypto 1000 index now up 26% typical weekend crypto rally. That’s how you know it’s the public trading. Institutions have totally missed this boat. $800 bil of currency controlled by the people. Trump pumping prices higher with every unstable tweet.	GerberKawasaki	9	1	1515249842	949652787507314688	https://twitter.com/GerberKawasaki/status/949652787507314688			
bitcoin 	Must be kidding. Overheard some ladies at dinner. Yes talking about bitcoin. “Oh it just moves around so much, it’s scary. “ this is a full blown mania. Please people. See a financial advisor.	GerberKawasaki	2	0	1515249548	949651553631191040	https://twitter.com/GerberKawasaki/status/949651553631191040			
	You’re bat shit crazy.	GerberKawasaki	100	13	1515249318	949650588047892480	https://twitter.com/GerberKawasaki/status/949650588047892480			
	That man died for the rights of Americans. Our freedoms. Including speech. Taking a knee is as American as not liking it.	GerberKawasaki	6	0	1515249243	949650275467276288	https://twitter.com/GerberKawasaki/status/949650275467276288			
	Try being a Laker fan.	GerberKawasaki	1	0	1515249145	949649862731055104	https://twitter.com/GerberKawasaki/status/949649862731055104			
		GerberKawasaki	1	0	1515249125	949649778836557824	https://twitter.com/GerberKawasaki/status/949649778836557824			
	That a stat baby!!!! I’m a Jan superstitious guy. First five days and Jan so goes the year..	GerberKawasaki	4	0	1515249085	949649611882340352	https://twitter.com/GerberKawasaki/status/949649611882340352			
	You’re coming to beautiful California! Land of Tesla. You’ll be happy once you’re here. Still think you should make the trip down to LA. I’ll send a @tesloop for you.	GerberKawasaki	1	0	1515249023	949649350866567168	https://twitter.com/GerberKawasaki/status/949649350866567168			@tesloop
	Attack the accuser- the most Obvious sign it’s true. Trump missed psych class. Then boasts he’s ‘really smart’ and a ‘very stable genius’. And I’m a hummingbird. https:// apple.news/AmcXC7W-bSoCZq Z6AehpQGA …	GerberKawasaki	6	1	1515248113	949645535023017984	https://twitter.com/GerberKawasaki/status/949645535023017984			
	Maybe they figured out how to create an even worse Laker team with Lonzo Ball leading. Scores 11 in Return from Shoulder Injury as Lakers Lose again. Balling #BBB https:// apple.news/ANRZZ6pWxRyiO6 D60Blhxeg …	GerberKawasaki	1	0	1515247906	949644663828328448	https://twitter.com/GerberKawasaki/status/949644663828328448		#BBB	
	Venice Golds Gym legend gets some love. Working Out With Charles Glass, a Trainer to the Stars via @NYTimes https://www. nytimes.com/2018/01/03/sty le/charles-glass-bodybuilder-workout.html …	GerberKawasaki	7	2	1515247026	949640976670236675	https://twitter.com/GerberKawasaki/status/949640976670236675			@NYTimes
	Blue state civil war has begun. Taxes as Charity? New Jersey Towns Try to Elude G.O.P. Tax Law via @NYTimes https://www. nytimes.com/2018/01/05/nyr egion/taxes-as-charity-new-jersey-towns-try-to-elude-gop-tax-law.html …	GerberKawasaki	3	0	1515246837	949640179937042432	https://twitter.com/GerberKawasaki/status/949640179937042432			@NYTimes
	It’s twitter. That’s the simple version. We all can model business 101 stuff. It’s funny you think that’s difficult or novel. It’s the things not on the page, you don’t see. pic.twitter.com/OaRpjmZvsK	GerberKawasaki	1	0	1515203758	949459496308416512	https://twitter.com/GerberKawasaki/status/949459496308416512			
	Or give us real numbers for last year. Happy to disclose mine. We just want to know how the business model is working. (Really)	GerberKawasaki	0	0	1515203209	949457193706795008	https://twitter.com/GerberKawasaki/status/949457193706795008			
bitcoin 	It’s Friday night and something creeping back up. You can’t say it down the halls of Wall Street. Yes. #Bitcoin #crypto	GerberKawasaki	18	1	1515202748	949455259147018240	https://twitter.com/GerberKawasaki/status/949455259147018240		#Bitcoin #crypto	
	This is such a score. Great job Netflix. $ nflx #Obama #Letterman https:// twitter.com/nytimes/status /949453472402993153 …	GerberKawasaki	7	1	1515202592	949454603782729729	https://twitter.com/GerberKawasaki/status/949454603782729729		#Obama #Letterman	
	Next stage. Ludicrous mode. #stocks	GerberKawasaki	21	3	1515202403	949453810841219073	https://twitter.com/GerberKawasaki/status/949453810841219073		#stocks	
	Enjoy my latest weekly #FinTech newsletter http:// cmun.it/lPD94DWL pic.twitter.com/gzQQ5LRpWY	obussmann	5	4	1515277525	949768897057771520	https://twitter.com/obussmann/status/949768897057771520		#FinTech	
	ITIC partners with IOTA to create a global smart city testbed network #IOTA @iotatoken https:// buff.ly/2D0VPgF	obussmann	160	55	1515267661	949727523155345408	https://twitter.com/obussmann/status/949727523155345408		#IOTA	@iotatoken
ripple 	Ripple Claims 3 Big Money Transfer Firms Will Use XRP in 2018 https:// buff.ly/2F5jJYL	obussmann	28	12	1515252471	949663813812588545	https://twitter.com/obussmann/status/949663813812588545			
bitcoin 	Second-Tier Crypto Coins Are Starting to Catch Up to Bitcoin https:// buff.ly/2EfzU4F pic.twitter.com/0KC58o5jMT	obussmann	2	2	1515250322	949654799175372800	https://twitter.com/obussmann/status/949654799175372800			
	Visa locks down pre-paid cryptocurrency cards affecting hundreds of thousands https:// buff.ly/2D0u4EU pic.twitter.com/jdaRhJihYR	obussmann	11	8	1515243406	949625791146528768	https://twitter.com/obussmann/status/949625791146528768			
	"Bosch Invests ""Significant Sum"" in #IOTA https:// buff.ly/2Cxto9X"	obussmann	192	67	1515241269	949616829999321088	https://twitter.com/obussmann/status/949616829999321088		#IOTA	
	Blockchain will usher in decentralized markets and even more ICOs in 2018 via @SiliconANGLE https:// buff.ly/2lrVDPE	obussmann	11	10	1515223870	949543851827650560	https://twitter.com/obussmann/status/949543851827650560			@SiliconANGLE
	@Norwich vs Chelsea kicking off at Carrow Road. #otbc #NCFC pic.twitter.com/P3QPaB72aw	davidbrear	0	0	1515259625	949693817573335040	https://twitter.com/davidbrear/status/949693817573335040		#otbc #NCFC	@Norwich
	No different at all but its no better either. This type of old school moves with the big four and the government surely has to end unless these companies are doing out of the kindness of their hearts and I'm totally wrong.	davidbrear	1	0	1515245735	949635559424692224	https://twitter.com/davidbrear/status/949635559424692224			
	CMA / Gov reccomendation and appointment yes.	davidbrear	0	0	1515243454	949625992934502401	https://twitter.com/davidbrear/status/949625992934502401			
	pic.twitter.com/b02JwfL8DD	davidbrear	0	0	1515242703	949622843419086848	https://twitter.com/davidbrear/status/949622843419086848			
	I’m not so sure about this being a good candidate for a secondment from a consultancy. Feels like it’s a role that requires total impartiality.	davidbrear	2	0	1515242605	949622431081287680	https://twitter.com/davidbrear/status/949622431081287680			
	Great let’s do that. Lots of rumours about EYs involvement in this one that im sure you guys can dispel. Let’s get it setup. cc @olliejudge	davidbrear	0	0	1515239261	949608407568453632	https://twitter.com/davidbrear/status/949608407568453632			@olliejudge
	I’d be surprised if this wasn’t approved by the EY team. Very very surprised that this role has been allowed to be performed by someone while keeping a role in a position at a consultancy. Maybe an Sir on the next honours or is that lower than an obe I can never remember? pic.twitter.com/KMrC0j7O4K	davidbrear	3	0	1515236045	949594916522426368	https://twitter.com/davidbrear/status/949594916522426368			
	People have watched this a total of over 25 hours!!!! We will be doing this again next Thursday at 1pm GMT. Get it in your diary and get your questions in over on http://www. FinTechInsiderNews.com - Want to ask something sensitive? Email on FIN@11FS.com https:// twitter.com/davidbrear/sta tus/949242840730648576 …	davidbrear	3	0	1515235607	949593078163271680	https://twitter.com/davidbrear/status/949593078163271680			@11FS
	Stupidity is Genius Madness is Stability	dgwbirch	4	0	1515276850	949766065881575424	https://twitter.com/dgwbirch/status/949766065881575424			
	Just to be clear, I think that giving power to the people is INSANE. I’ve met some of them.	dgwbirch	0	0	1515270148	949737955312263168	https://twitter.com/dgwbirch/status/949737955312263168			
	JASON! Our hero! -	dgwbirch	0	0	1515255576	949676837575282690	https://twitter.com/dgwbirch/status/949676837575282690			
	Aaaaarrggggghhhhh fell for a short corner routine 3-4 this is getting crazy. Woking free kick 25 yards out #COYCards	dgwbirch	0	0	1515255217	949675331690131457	https://twitter.com/dgwbirch/status/949675331690131457		#COYCards	
	I love football https:// twitter.com/wokingfc/statu s/949674433496707073 …	dgwbirch	0	0	1515255034	949674561934708736	https://twitter.com/dgwbirch/status/949674561934708736			
	Defensive calamity 2-3 I hate football	dgwbirch	1	0	1515253461	949667963195592704	https://twitter.com/dgwbirch/status/949667963195592704			
	Noooo!!!!!!! Stupid penalty to give away I can’t believe it 2-2 what agame	dgwbirch	0	0	1515253376	949667608256802848	https://twitter.com/dgwbirch/status/949667608256802848			
	Super strike from Effi !!!!!!! 2-1!!!!!!! pic.twitter.com/PdC3dR8JuB	dgwbirch	2	0	1515252970	949665906883485697	https://twitter.com/dgwbirch/status/949665906883485697			
	Football is a cruel game. Utterly jammy deflection and it’s 1-1	dgwbirch	0	0	1515252384	949663447842729985	https://twitter.com/dgwbirch/status/949663447842729985			
	OMG what an absolute PEACH from Ferdinand! #COYCards pic.twitter.com/l9aNR8zqev	dgwbirch	0	0	1515252206	949662700631724032	https://twitter.com/dgwbirch/status/949662700631724032		#COYCards	
	The Forum - Nikola Tesla's Electric Dreams - @bbcradio4 <- if you haven’t read “The man who invented the 20th century” listen to this http://www. bbc.co.uk/programmes/b09 kplfv …	dgwbirch	8	5	1515237562	949601281160736769	https://twitter.com/dgwbirch/status/949601281160736769			@bbcradio4
	Bastards! Cease and desist!	dgwbirch	4	0	1515236306	949596012095725568	https://twitter.com/dgwbirch/status/949596012095725568			
	"Zuck wants to ""take power from centralised systems and put it back into people’s hands” How about the Parole Board? Make it Facebook group that UK citizens can join and then we can vote: green let them out, yellow leave them in, red execute them or something like that."	dgwbirch	7	1	1515230056	949569797028810752	https://twitter.com/dgwbirch/status/949569797028810752			
	Is there a word for ‘been a victim of theft’/‘had stolen’? (5 btc were stolen from the faucet’s wallet... something like $20 at the time)	gavinandresen	79	10	1515213260	949499351721799680	https://twitter.com/gavinandresen/status/949499351721799680			
	Just about the only things I haven’t done with them is paid taxes or posted bail.	gavinandresen	208	12	1515212211	949494948252053504	https://twitter.com/gavinandresen/status/949494948252053504			
bitcoin 	I just realized I have: bought, sold, earned, spent, given, received, lost, destroyed, had stolen and mined bitcoins.	gavinandresen	470	68	1515212210	949494947065073664	https://twitter.com/gavinandresen/status/949494947065073664			
	I never said nerds should never criticize businesses. I said businesses know their own customers better.	gavinandresen	5	0	1515203773	949459559931895811	https://twitter.com/gavinandresen/status/949459559931895811			
	Nicely written by @ian_simpson80 @Lakeside_Prtnrs What Crypto Didn't Give Us in 2017 http:// bit.ly/2CLqEca via @CoinDesk	wmougayar	60	30	1515250592	949655931251441664	https://twitter.com/wmougayar/status/949655931251441664			@ian_simpson80 @Lakeside_Prtnrs @CoinDesk
	I'd LOVE it to succeed and down to help any way possible. My fear is it won't just because it's such a cat heading excercise My hope is it at least prompts positive change from the market	sytaylor	2	0	1515238034	949603259177668608	https://twitter.com/sytaylor/status/949603259177668608			
	When you presume authority you presume accountability, I think David is right to call out how that appears. Caveat: wired do say they edited the text for clarity so something may have been lost there and I'm open to that perspective	sytaylor	0	0	1515236383	949596336411889664	https://twitter.com/sytaylor/status/949596336411889664			
	Optically that second one is so much better - opportunity missed to credit good work done by those parties IMO	sytaylor	0	0	1515236283	949595915081404416	https://twitter.com/sytaylor/status/949595915081404416			
	"The way it reads is that a trustee speaks for the industry. ""We've got some of the best security people"" Security standards and actual implementation have a way to go. The industry takes security seriously and is putting it's best people on it."	sytaylor	0	0	1515236251	949595781035626496	https://twitter.com/sytaylor/status/949595781035626496			
	Optics are everything. If you're in that spot sharing the load is smart. The OBIE, the fintechs, the CMA the banks all equally important parts of the picture. There's only so much you can do within the space of a Q+A I grant you but...	sytaylor	0	0	1515236144	949595330995253248	https://twitter.com/sytaylor/status/949595330995253248			
	I'm all for making it happen, but single handedly taking credit is a douche move	sytaylor	3	0	1515235428	949592329933000705	https://twitter.com/sytaylor/status/949592329933000705			
	The easy times will be those, ppl celebrate you for but the hard times are those that ppl will #respect you for. As a #company and leader we believe we should always be close to our users during both, the easy and hard times. #TenX ‘ progress will be speeding more and more! #2018	julianhosp	326	55	1515275798	949761653004013569	https://twitter.com/julianhosp/status/949761653004013569		#respect #company #TenX #2018	
	Gibraltar launches new regulation for protection of Cryptocurrency users - http:// klou.tt/vfk3dxz7wkzz	billatnapier	2	2	1515256205	949679476119498752	https://twitter.com/billatnapier/status/949679476119498752			
	NSA contractor pleads guilty in embarrassing leak case - http:// klou.tt/41ozph2tg32q	billatnapier	0	0	1515254402	949671911067238400	https://twitter.com/billatnapier/status/949671911067238400			
	Ah ... a late Christmas present for me ... pic.twitter.com/mqlJYz45fU	billatnapier	1	0	1515240373	949613071026327552	https://twitter.com/billatnapier/status/949613071026327552			
	Please can we have a Crypto Village in Scotland eg #edinburgh ... well done to Switzerland	billatnapier	0	0	1515239841	949610838003941376	https://twitter.com/billatnapier/status/949610838003941376		#edinburgh	
	Thank you to @DataLabScotland for their support of our advanced data analysis with machine learning related to insider threat detection https://www. researchgate.net/publication/32 2234350_Distance_Measurement_Methods_for_Improved_Insider_Threat_Detection … @owenatnapier @rjmacfarlane	billatnapier	4	2	1515239649	949610031879741440	https://twitter.com/billatnapier/status/949610031879741440			@DataLabScotland @owenatnapier @rjmacfarlane
	Five Steps To Greater Cybersecurity In Health Care Organizations http:// flip.it/UU8sDa	billatnapier	2	1	1515238407	949604822193524738	https://twitter.com/billatnapier/status/949604822193524738			
	Why Hackers Hack: Motives Behind Cyberattacks - http:// klou.tt/146kyzi19zgqy	billatnapier	1	0	1515236405	949596426283008000	https://twitter.com/billatnapier/status/949596426283008000			
	Watch out for those 1&1 verification scams ... pic.twitter.com/gVTcLRqawT	billatnapier	0	1	1515233007	949582175866970112	https://twitter.com/billatnapier/status/949582175866970112			
	Speaking of China, about to take off for Shanghai. Need to power down. So long...	mikejcasey	1	0	1515252478	949663840500944896	https://twitter.com/mikejcasey/status/949663840500944896			
	I suspect there’s some truth to that. One thing true: China politics are not monolithic.	mikejcasey	1	0	1515252423	949663612607574018	https://twitter.com/mikejcasey/status/949663612607574018			
	That would be enlightened!	mikejcasey	1	0	1515252337	949663250811162624	https://twitter.com/mikejcasey/status/949663250811162624			
	But wouldn’t it be nice if I was wrong: that this was about encouraging decentralization.	mikejcasey	1	0	1515252295	949663072997793797	https://twitter.com/mikejcasey/status/949663072997793797			
	Par for the course - not just China, though. Any government whose country hosts a large amount of the world’s infrastructure for a powerful new alternative financial system would want some control over it. Whether they can exert it or not is another thing.	mikejcasey	1	0	1515252225	949662779845246976	https://twitter.com/mikejcasey/status/949662779845246976			
	China’s move confuses me, though. Easier to control centralized miners dependent on single supply chain of chips from Taiwan than a global network of distributed GPUs.	mikejcasey	3	0	1515251492	949659706674548736	https://twitter.com/mikejcasey/status/949659706674548736			
	Truly would be ironic: ASIC-resistance imposed by external, not internal, governance. https:// twitter.com/prestonjbyrne/ status/949651150114091009 …	mikejcasey	25	7	1515250791	949656767289544704	https://twitter.com/mikejcasey/status/949656767289544704			
	Fair points. Wholeheartedly agree with the last one.	mikejcasey	1	0	1515249469	949651223300526081	https://twitter.com/mikejcasey/status/949651223300526081			
bitcoin ripple 	Sheesh! My point about misinformed bitcoin reporting is NOT whataboutism. It’s to say that many journos misunderstand all of this — bitcoin, crypto, blockchain, Ripple, all of it! My point is that poor coverage is a function of the knowledge gap, not bad intent.	mikejcasey	0	0	1515248736	949648146191343616	https://twitter.com/mikejcasey/status/949648146191343616			
	Maybe. (I do think having different standards for Twitter and regular news is very problematic.) But again, my issue here is that influential people insinuating a deliberate lie - esp. doing so in the current climate of “fake news” fueled mob justice - is bad form.	mikejcasey	0	0	1515248388	949646688138006529	https://twitter.com/mikejcasey/status/949646688138006529			
bitcoin 	Do you think all the terribly misinformed coverage of bitcoin over the years is “intentional?” I know many believe that. But it’s not. This stuff is so outside the box of understanding that too few people get it. That’s annoying, but quite different from deliberate lies	mikejcasey	0	0	1515248113	949645534997991424	https://twitter.com/mikejcasey/status/949645534997991424			
	As I said, I can’t argue against disclosure. In case you misunderstood me, that means I agree that it’s good practice. But I’m also saying in this case it wouldn’t have made a difference and might even have fed more false assumptions.	mikejcasey	0	0	1515247780	949644138118565888	https://twitter.com/mikejcasey/status/949644138118565888			
	"Well, partly, yes. ""Bullshit"" implies a deliberate lie. But it wasn't the only part of that tweet that led a mob to wrongly assume the journalist had simply made his story up. To prove deliberate lying requires a much higher bar than ""inaccurate."""	mikejcasey	1	0	1515247400	949642544496959488	https://twitter.com/mikejcasey/status/949642544496959488			
	Can't argue against disclosure. But by same token it'd be unreasonable to assume that because a journo owns a small amount of BTC they are inherently biased against XRP. What matters most ethical practices, decent news organizations drill them into their reporters.	mikejcasey	1	0	1515247296	949642109136580608	https://twitter.com/mikejcasey/status/949642109136580608			
bitcoin 	Yeah, but this is @Visa acting against a card issuer, not a card issuer against a user. Seriously wondering whether the problem @xapo , @bitwala and other #bitcoin card users are experiencing is unique to crypto or something that fiat issuers have also faced.	mikejcasey	1	0	1515246687	949639552909660167	https://twitter.com/mikejcasey/status/949639552909660167		#bitcoin	@Visa @xapo @bitwala
	Has Visa ever done this with issuers if fiat-based cards? https:// twitter.com/rtaylor05/stat us/949357486938574849 …	mikejcasey	10	4	1515241907	949619503188541441	https://twitter.com/mikejcasey/status/949619503188541441			
	There’s that, yes. But beyond crypto also an unreasonable, generalized distrust in media, fed by a false presidential narrative of “fake news,” so that when a guy with 200K followers says something like that, good, honest journos are mobbed. We need more civil social media habits	mikejcasey	5	1	1515241689	949618590554181632	https://twitter.com/mikejcasey/status/949618590554181632			
	In all its glory: https:// twitter.com/arrington/stat us/949122833585618950 …	mikejcasey	1	0	1515212851	949497634028388353	https://twitter.com/mikejcasey/status/949497634028388353			
	"Yep. BTW, thought @arrington 's ""name your sources"" slam v @nathanielpopper was disturbingly vicious, esp. from a media man. He sicked a rabid mob on Nathaniel. Reminded me of attacks u withstood for yr Mt Gox story, which was also necessarily, justifiably based on unnamed sources"	mikejcasey	5	1	1515212516	949496230983421959	https://twitter.com/mikejcasey/status/949496230983421959			@arrington @nathanielpopper
	Such a gentleman, Paul... Me, I was impressed by Clem's cunning.	mikejcasey	5	0	1515211555	949492199070322689	https://twitter.com/mikejcasey/status/949492199070322689			
	Such an interesting dilemma for him.	mikejcasey	1	0	1515211201	949490713217126400	https://twitter.com/mikejcasey/status/949490713217126400			
	It would be nice. The challenge might not lie with him, however, but with minority shareholders. That's why I he'd have to take FB private -- buy out the public stake -- and then change the model. Much cheaper to do that with a crappy company that isn't worth as much as FB.	mikejcasey	1	0	1515200355	949445220541792257	https://twitter.com/mikejcasey/status/949445220541792257			
	Overstock Gets $100 Million from Soros Fund for #Blockchain and More https://www. coindesk.com/blockchain-bon anza-overstock-gets-100-million-investment-soros-fund/ … #VC #VentureCapital cc @antgrasso @seandotau @BourseetTrading @TeamBlockchain @aldoceccarelli pic.twitter.com/eUKscAXqbW	AntonioSelas	38	32	1515259972	949695272753532928	https://twitter.com/AntonioSelas/status/949695272753532928		#Blockchain #VC #VentureCapital	@antgrasso @seandotau @BourseetTrading @TeamBlockchain @aldoceccarelli
	Gracias Luis. Felices reyes a todos!	AntonioSelas	6	0	1515196116	949427443533844481	https://twitter.com/AntonioSelas/status/949427443533844481			
	昨日遊んだゲームで、沢山の種類の名前が書いていないキャラが書かれたカード山をめくって、新キャラなら命名、既出なら名前を正しくコールしてポイントゲット、というのがあったんですが、「CUH1100」とか「SWR30」とか命名したら覚えられないとひんしゅくを買った。それが狙いだよ！！ https:// twitter.com/GameRoom_info/ status/949273529173794816 …	mochi_wsj	3	0	1515220505	949529738049028096	https://twitter.com/mochi_wsj/status/949529738049028096			
	いやいや、こちらこそどうもありがとうございました。マミヤさんのゼノブレイド2のレビュー（ https://www. famitsu.com/news/201801/05 148399.html … ）、この1年でピカイチの面白さでした。やっぱり書き手の思いが伝わる記事っていいですよね。これからも魂のこもったレビューを楽しみにしています！ https:// twitter.com/alicetroemeria /status/949501985383792640 …	mochi_wsj	13	6	1515220174	949528349994401792	https://twitter.com/mochi_wsj/status/949528349994401792			
