ethereum 	I won't be at https:// ethdenver.com / but Viper/plasma dev David Knott will be. Great to see more independent ethereum events popping up!	VitalikButerin	1414	281	1515275996	949762484713345024	https://twitter.com/VitalikButerin/status/949762484713345024			
	"3. Laugh at you. Hint: the usual retort that ""then they laugh at you"" is succeeded in 2 steps by ""then you win"" is an artefact of survivorship bias, not reality."	VitalikButerin	627	27	1515231656	949576509307600897	https://twitter.com/VitalikButerin/status/949576509307600897			
	I don't actually think the car accident hoax had much to do with that price drop. More technicals; the hoax happening at the time was a coincidence.	VitalikButerin	104	10	1515219815	949526843740250112	https://twitter.com/VitalikButerin/status/949526843740250112			
	I agree that government actors are capable of permanently incapacitating me.	VitalikButerin	12	5	1515218506	949521354641915905	https://twitter.com/VitalikButerin/status/949521354641915905			
	"Not the same thing because unlike Harberger taxes this is voluntary, and does not assume common knowledge of a suitable beneficiary. But yeah, same genre of ""cool game theory stuff""."	VitalikButerin	3	1	1515218391	949520872880070656	https://twitter.com/VitalikButerin/status/949520872880070656			
	Because the system itself does not know which charities are reasonable. Remember: *anyone* in this scheme could set up a charity.	VitalikButerin	5	0	1515218164	949519920097771521	https://twitter.com/VitalikButerin/status/949519920097771521			
	Oh I'm sure they can coerce me into saying whatever they want, but I don't think anyone will take anything I say under those conditions at all seriously.	VitalikButerin	12	1	1515218094	949519626303492096	https://twitter.com/VitalikButerin/status/949519626303492096			
	M can actually be the entire set of accounts in the system, as most participants' donation vectors would be very sparse.	VitalikButerin	2	0	1515218012	949519283121344512	https://twitter.com/VitalikButerin/status/949519283121344512			
	Correct.	VitalikButerin	3	0	1515217974	949519120256544769	https://twitter.com/VitalikButerin/status/949519120256544769			
	"The point is that you spending $1 more causes an extra ~$N to be added to the total donation amount. So it adds ""leverage"" to the altruistic side, or the side that wants to donate to blockchain development to increase the value of one's own other investments in that chain."	VitalikButerin	2	0	1515215887	949510367377465344	https://twitter.com/VitalikButerin/status/949510367377465344			
	Something something speech wreck ignition software?	VitalikButerin	12	1	1515215763	949509849280274433	https://twitter.com/VitalikButerin/status/949509849280274433			
bitcoin 	"The obfuscated program could be executed on a ""fake chain"" offline so you can't do that literally. You could piggyback off PoW, eg. require the contract to have as input the 1000th ancestor of a bitcoin block of some given height, would make oracle querying cost millions."	VitalikButerin	2	0	1515215729	949509704803209216	https://twitter.com/VitalikButerin/status/949509704803209216			
	No, justification for hard forking the DAO was that theft is *unambiguously bad*; basically no one supports theft. Anything political is more controversial.	VitalikButerin	22	1	1515215082	949506992191582208	https://twitter.com/VitalikButerin/status/949506992191582208			
ethereum 	Of course ethereum is decentralized so realistically our ability to do anything is limited. We can refuse to help, and we can try to subvert the scheme (eg. with DEXes), but a hard fork to interfere with the scheme would (i) be useless, and (ii) community would not accept it	VitalikButerin	15	3	1515214935	949506375897395206	https://twitter.com/VitalikButerin/status/949506375897395206			
	The pseudorandomness makes it not feasible to use the circuit as an oracle to detect what a vote does, or if two votes are duplicates, but it only has a small influence on the final outcome of the vote.	VitalikButerin	2	0	1515214800	949505809058156545	https://twitter.com/VitalikButerin/status/949505809058156545			
	An obfuscated circuit, which has the private key, decrypts votes, and if >=2 votes have duplicate sender, it only accepts the vote with the highest priority. It then adds up votes, and for each candidate, adds sha3(sorted decrypted votes for that candidate) % 300.	VitalikButerin	5	0	1515214744	949505573275365376	https://twitter.com/VitalikButerin/status/949505573275365376			
	Everyone makes a vote which contains an encrypted priority number. Setting priority to N requires N-sized proof of work. Votes are encrypted with a public key.	VitalikButerin	4	0	1515214674	949505280777138176	https://twitter.com/VitalikButerin/status/949505280777138176			
	This seems like the sort of thing that could be attacked around the edges. For example, here's a possible scheme using moon math:	VitalikButerin	5	0	1515214611	949505018243121152	https://twitter.com/VitalikButerin/status/949505018243121152			
	Yes.	VitalikButerin	26	1	1515214291	949503672232194048	https://twitter.com/VitalikButerin/status/949503672232194048			
	The point is the 1:N leverage on contributions to mitigate public goods problems.	VitalikButerin	0	0	1515213787	949501559057993728	https://twitter.com/VitalikButerin/status/949501559057993728			
	Is there a simple proof for why a coercion-proof scheme with no trusted party is impossible?	VitalikButerin	3	0	1515213629	949500896383180800	https://twitter.com/VitalikButerin/status/949500896383180800			
	This is a big part of why I support state-backed cryptocurrencies that use public blockchain-adjacent technologies. Making one that you can't make a smart contract DEX for is *hard*.	VitalikButerin	38	5	1515213513	949500409462190080	https://twitter.com/VitalikButerin/status/949500409462190080			
	"Hard forking is useless; they'll just switch to another system. The more radical thing to do is spin up a decentralized exchange between petro and ETH. If a currency is ""crypto"", even if centralized, then you can do this without permission from operators of either blockchain"	VitalikButerin	240	34	1515213400	949499936969695232	https://twitter.com/VitalikButerin/status/949499936969695232			
	@FEhrsam @robinhanson would be interested in your feedback on https:// ethresear.ch/t/call-out-ass urance-contracts/466 …	VitalikButerin	88	12	1515212961	949498096966189056	https://twitter.com/VitalikButerin/status/949498096966189056			@FEhrsam @robinhanson
	And an underexplored fifth one is assurance contracts, possibly subsidized/supported by the blockchain itself in some way.	VitalikButerin	38	4	1515208545	949479573523070976	https://twitter.com/VitalikButerin/status/949479573523070976			
	"There actually is an unexplored fourth possibility: a blockchain-based treasury that has a built-in ""ice age"" so it runs out quickly, and needs hard forks every couple of years to resurrect."	VitalikButerin	102	18	1515208359	949478792635957248	https://twitter.com/VitalikButerin/status/949478792635957248			
	Yes. Go for it. Mention original ok?	dtapscott	0	0	1515217298	949516287025303552	https://twitter.com/dtapscott/status/949516287025303552			
	Great piece. https:// twitter.com/fluffypony/sta tus/949681513393737729 …	maxkeiser	32	17	1515257176	949683546456719361	https://twitter.com/maxkeiser/status/949683546456719361			
	True New Yorkers understand Trump and his style of saying ‘F*** you’ to anyone he feels like. This @davidfrum pearl-clutching mental masturbation piece for @TheAtlantic only solidifies Trump’s hold on the @WhiteHouse . Trump is America. If you don’t like it. STFU. https:// twitter.com/theatlantic/st atus/949660276797865989 …	maxkeiser	136	38	1515257072	949683110760902658	https://twitter.com/maxkeiser/status/949683110760902658			@davidfrum @TheAtlantic @WhiteHouse
bitcoin 	. @Alles_67 La création monétaire n'est pas si différente : on prend des petits bouts de papiers et on décrète que cela a une grande valeur... Et dans le cas du #bitcoin , l'émission est limitée, pas dans le cas des billets	babgi	22	15	1515275443	949760163308818434	https://twitter.com/babgi/status/949760163308818434		#bitcoin	@Alles_67
	Étonnant article dans lequel Peter Todd détaille avec force détails et transparence la stratégie de HEC https://www. lenouveleconomiste.fr/peter-todd-dir ecteur-general-dhec-61990/ …	babgi	17	8	1515259769	949694421372669952	https://twitter.com/babgi/status/949694421372669952			
	Do we, here in Europe, realize the scale of the tragedy ongoing in the USA? https:// nyti.ms/2EVKChM	babgi	17	21	1515243944	949628047946407938	https://twitter.com/babgi/status/949628047946407938			
	Interesting Chart: 3 Generations of IoT for 2018 #IoT #technology #wearables #data #fintech #AI #Cybersecurity #bigdata #blockchain #ces2018 @evankirstel @dez_blanchfield @KirkDBorne @jblefevre60 @gigastacey @ValaAfshar @pierrepinna pic.twitter.com/Dlp2SNR6ht	JimMarous	151	167	1515276300	949763758804516864	https://twitter.com/JimMarous/status/949763758804516864		#IoT #technology #wearables #data #fintech #AI #Cybersecurity #bigdata #blockchain #ces2018	@evankirstel @dez_blanchfield @KirkDBorne @jblefevre60 @gigastacey @ValaAfshar @pierrepinna
	We place our copyright to every chart. We also make all available as free tools for our readers. The good news is the look of our charts are distinctive. I can’t do it for the visuals I buy from Shutterstock.	JimMarous	10	0	1515275729	949761361839644672	https://twitter.com/JimMarous/status/949761361839644672			
	So tired of people who steal tweets, visuals, etc. with no credit given. I pay for my visuals and write content. I even pay a designer for my charts on @FinancialBrand . Lots of bots out there.	JimMarous	13	0	1515274947	949758084196585479	https://twitter.com/JimMarous/status/949758084196585479			@FinancialBrand
	The #Tech Leaders Rule the World Through Relationships http:// bit.ly/2qrYjNP #GAFA #IoT #AI #fintech #media #CES2018 #CES #TechTrends #Google #Amazon @DeepLearn007 @MikeQuindazzi @GlenGilmore @MarshaCollier @brettking pic.twitter.com/JMjNwlpU2c	JimMarous	56	55	1515274740	949757216063553536	https://twitter.com/JimMarous/status/949757216063553536		#Tech #GAFA #IoT #AI #fintech #media #CES2018 #CES #TechTrends #Google #Amazon	@DeepLearn007 @MikeQuindazzi @GlenGilmore @MarshaCollier @brettking
	[Infographic] Amazing View of Generations http:// bit.ly/2sdzsRz #GenY #GenZ #tech #innovation #CMO @TamaraMcCleary @GlenGilmore @Tiffani_Bova @MarTechExec @MarshaCollier @Fisher85M pic.twitter.com/YPhozMmkVa	JimMarous	23	32	1515272580	949748155729530881	https://twitter.com/JimMarous/status/949748155729530881		#GenY #GenZ #tech #innovation #CMO	@TamaraMcCleary @GlenGilmore @Tiffani_Bova @MarTechExec @MarshaCollier @Fisher85M
	Top 5 #Digital #Tech Trends 1. #AR #VR 2. #IoT #wearables 3. #AI #bots 4. #mPayments 5. #voicefirst @BrianRoemmele @DeepLearn007 @brettking pic.twitter.com/qLvTWUt7qE	JimMarous	66	79	1515270840	949740857355255808	https://twitter.com/JimMarous/status/949740857355255808		#Digital #Tech #AR #VR #IoT #wearables #AI #bots #mPayments #voicefirst	@BrianRoemmele @DeepLearn007 @brettking
	Amazing #IoT Ecosystem Map HT @Tiffani_Bova #BigData #AI #IIoT @RWW @DeepLearn007 @ipfconline1 @pierrepinna @MikeQuindazzi @MarTechExec @StrategyFintech pic.twitter.com/3LoKXtdfZ3	JimMarous	80	77	1515268860	949732552876716032	https://twitter.com/JimMarous/status/949732552876716032		#IoT #BigData #AI #IIoT	@Tiffani_Bova @RWW @DeepLearn007 @ipfconline1 @pierrepinna @MikeQuindazzi @MarTechExec @StrategyFintech
	The changing world of technology in financial services http:// bit.ly/2vJQupK #AI #MachineLearning #Fintech #Blockchain #ML #Digital #Banking #strategy #tech HT @DeepLearn007 pic.twitter.com/Y6VHduU3UZ	JimMarous	13	17	1515268080	949729280891617280	https://twitter.com/JimMarous/status/949729280891617280		#AI #MachineLearning #Fintech #Blockchain #ML #Digital #Banking #strategy #tech	@DeepLearn007
	Capitalizing on Big Data! #BigData #Analytics #deeplearning #ArtificialIntelligence #MachineLearning #Startups #CES2018 @ipfconline1 @DeepLearn007 @Tiffani_Bova @Shirastweet @psb_dc @FinancialBrand @GrowUrStartup pic.twitter.com/Ci3l1TwL6A	JimMarous	54	71	1515266100	949720977016897536	https://twitter.com/JimMarous/status/949720977016897536		#BigData #Analytics #deeplearning #ArtificialIntelligence #MachineLearning #Startups #CES2018	@ipfconline1 @DeepLearn007 @Tiffani_Bova @Shirastweet @psb_dc @FinancialBrand @GrowUrStartup
	How AI is taking over the global economy in one chart. http:// bit.ly/2xnCJ3u #AI #MachineLearning #tech @AccentureTech @DeepLearn007 pic.twitter.com/nkFUfOZxBK	JimMarous	8	10	1515265500	949718460421980161	https://twitter.com/JimMarous/status/949718460421980161		#AI #MachineLearning #tech	@AccentureTech @DeepLearn007
	Google's 10 Biggest Acquisitions. http:// bit.ly/2fhkX7v #AI #IoT #smarthome #tech #socialmedia #mobile #digital @ipfconline1 @BrettKing pic.twitter.com/G5Jq5BbO8F	JimMarous	27	26	1515263580	949710406729195520	https://twitter.com/JimMarous/status/949710406729195520		#AI #IoT #smarthome #tech #socialmedia #mobile #digital	@ipfconline1 @BrettKing
	Top 10 Strategic Technology Trends for 2018 http:// gtnr.it/2CypoEZ #TechTrends #CES2018 #AI #MachineLearning #Analytics #IoT #Cloud #VoiceTech #AR #VR #Blockchain @DeepLearn007 @BrianRoemmele @BrettKing @Tiffani_Bova @Shirastweet @GlenGilmore @MarshaCollier @ipfconline1 pic.twitter.com/3D3hOYmT40	JimMarous	69	86	1515262440	949705625080094721	https://twitter.com/JimMarous/status/949705625080094721		#TechTrends #CES2018 #AI #MachineLearning #Analytics #IoT #Cloud #VoiceTech #AR #VR #Blockchain	@DeepLearn007 @BrianRoemmele @BrettKing @Tiffani_Bova @Shirastweet @GlenGilmore @MarshaCollier @ipfconline1
	Why AI is Different from Previous Tech Waves. http:// bit.ly/2yhET2x #AI #AR #VR #TechTrends #MachineLearning #martech @DeepLearn007 @ipfconline1 @Fisher85M @BrettKing @KellyWonderlin @MikeQuindazzi @digitalcloudgal @TamaraMcCleary @evankirstel @Shirastweet pic.twitter.com/G3Ex9tUpNK	JimMarous	12	14	1515261420	949701347149987840	https://twitter.com/JimMarous/status/949701347149987840		#AI #AR #VR #TechTrends #MachineLearning #martech	@DeepLearn007 @ipfconline1 @Fisher85M @BrettKing @KellyWonderlin @MikeQuindazzi @digitalcloudgal @TamaraMcCleary @evankirstel @Shirastweet
	Alexa will come to headphones and smartwatches this year http:// bit.ly/2D1V9HV #VoiceFirst #TechTrends #A ;exa #Banking #Fintech #AI #MachineLearning #BigData #analytics @BrianRoemmele @StrategyFintech @BrettKing @leimer @Shirastweet @MarTechExec @psb_dc pic.twitter.com/M7ysedfpKZ	JimMarous	14	17	1515259800	949694552549371904	https://twitter.com/JimMarous/status/949694552549371904		#VoiceFirst #TechTrends #A #Banking #Fintech #AI #MachineLearning #BigData #analytics	@BrianRoemmele @StrategyFintech @BrettKing @leimer @Shirastweet @MarTechExec @psb_dc
	[Infographic] A Guide to Modern Artificial Intelligence. http:// bit.ly/2ihWCTT #AI #MachineLearning #DeepLearning #BigData #tech @ipfconline1 @MikeQuindazzi @SpirosMargaris @psb_dc @BourseetTrading @Fisher85M pic.twitter.com/l85MMwrfVi	JimMarous	60	66	1515258240	949688010060136448	https://twitter.com/JimMarous/status/949688010060136448		#AI #MachineLearning #DeepLearning #BigData #tech	@ipfconline1 @MikeQuindazzi @SpirosMargaris @psb_dc @BourseetTrading @Fisher85M
	7 Artificial Intelligence Trends that will Rule 2018 http:// bit.ly/2zWQebH HT @DeepLearn007 #AI #MachineLearning #DeepLearning #BigData #Analytics #HealthTech #IoT #tech #chatbots @ipfconline1 @MikeQuindazzi @GaryDower @Fisher85M pic.twitter.com/2vwJsnY5TT	JimMarous	33	48	1515256002	949678622444589057	https://twitter.com/JimMarous/status/949678622444589057		#AI #MachineLearning #DeepLearning #BigData #Analytics #HealthTech #IoT #tech #chatbots	@DeepLearn007 @ipfconline1 @MikeQuindazzi @GaryDower @Fisher85M
	The Six Macro Trends of Banking in the Future http:// bit.ly/2CyC0w6 #banking #fintech #TechTrends #Cybersecurity #AI @DeloitteInsight @psb_dc @nigelwalsh @RAlexJimenez @Prashant_1722 pic.twitter.com/3m8SKkzG5m	JimMarous	23	21	1515245401	949634157868736512	https://twitter.com/JimMarous/status/949634157868736512		#banking #fintech #TechTrends #Cybersecurity #AI	@DeloitteInsight @psb_dc @nigelwalsh @RAlexJimenez @Prashant_1722
	!0 Banking Trends to Watch in 2018 http:// bit.ly/2F6WmhC #banking #fintech #APIs #AI #MachineLearning #robotics #TechTrends #Cloud @StrategyFintech @fintechna @BourseetTrading @helene_wpli @leimer @BankingInsights @AlanMcIntyre13 . @Forbes pic.twitter.com/axWdMuw917	JimMarous	18	22	1515241191	949616502864535552	https://twitter.com/JimMarous/status/949616502864535552		#banking #fintech #APIs #AI #MachineLearning #robotics #TechTrends #Cloud	@StrategyFintech @fintechna @BourseetTrading @helene_wpli @leimer @BankingInsights @AlanMcIntyre13 @Forbes
	"[Infographic] 15 #CX trends for 2018 from @TemkinGroup . Will this be the ""Year of Humanity""? #customerexperience #UX #chatbot #analytics #TopCXTrends @TamaraMcCleary @guzmand @pierrepinna @psb_dc @MarTechExec pic.twitter.com/iFeXsVvFif"	JimMarous	42	40	1515215528	949508862205464577	https://twitter.com/JimMarous/status/949508862205464577		#CX #customerexperience #UX #chatbot #analytics #TopCXTrends	@TemkinGroup @TamaraMcCleary @guzmand @pierrepinna @psb_dc @MarTechExec
	Creating Exponental Growth and Value with AI https:// accntu.re/2CA8whu #AI #MachineLearning #DeepLearning #BigData #TechTrends @BankingInsights @AccentureAI @DeepLearn007 @ipfconline1 @jblefevre60 @Fisher85M @MikeQuindazzi @TunstallAsc pic.twitter.com/ig5yCVaTZ7	JimMarous	107	103	1515214872	949506112969236480	https://twitter.com/JimMarous/status/949506112969236480		#AI #MachineLearning #DeepLearning #BigData #TechTrends	@BankingInsights @AccentureAI @DeepLearn007 @ipfconline1 @jblefevre60 @Fisher85M @MikeQuindazzi @TunstallAsc
	The current crypto market clearly proves the demand for a roulette wheel with 3600 numbers!	VinnyLingham	537	103	1515276925	949766380433301504	https://twitter.com/VinnyLingham/status/949766380433301504			
	Not without a very contentious hard fork...	VinnyLingham	1	0	1515276787	949765801891962880	https://twitter.com/VinnyLingham/status/949765801891962880			
	In the long term, yes, relatively	VinnyLingham	9	0	1515271764	949744734913703937	https://twitter.com/VinnyLingham/status/949744734913703937			
	That makes the tokens a security at this point...	VinnyLingham	3	0	1515269119	949733638043660288	https://twitter.com/VinnyLingham/status/949733638043660288			
	Saw that, but I think that view is probably a bit too myopic for my liking. Time will tell.	VinnyLingham	8	0	1515268591	949731423065317376	https://twitter.com/VinnyLingham/status/949731423065317376			
	Yes, but not all coins are currency coins. Some are utility tokens.	VinnyLingham	13	0	1515267748	949727888646918145	https://twitter.com/VinnyLingham/status/949727888646918145			
	Ask me again in 24 months.	VinnyLingham	8	0	1515261108	949700039156224000	https://twitter.com/VinnyLingham/status/949700039156224000			
	Not now. Give it 24 months	VinnyLingham	12	0	1515261080	949699922483331072	https://twitter.com/VinnyLingham/status/949699922483331072			
	The current crypto bull market is giving a lot of entrepreneurs and technologists the opportunity to prove to the world why the startup failure rate is typically 90%. This stuff is not easy, but the good news is that the winners will win big!	VinnyLingham	559	151	1515260962	949699426599124994	https://twitter.com/VinnyLingham/status/949699426599124994			
	Thank you!	VinnyLingham	1	0	1515193240	949415381462016000	https://twitter.com/VinnyLingham/status/949415381462016000			
	Stupid fake news	SatoshiLite	20	3	1515279050	949775294193328128	https://twitter.com/SatoshiLite/status/949775294193328128			
	"Miners can manipulate the fees higher by actually not mine low fees transactions. This is something they can do today. This proposal doesn't make this ""attack"" worse. A competitive decentralized miner environment will make this less of an issue."	SatoshiLite	27	3	1515277527	949768904095625216	https://twitter.com/SatoshiLite/status/949768904095625216			
	Worst case is it doesn't work. Not worse than today IMO.	SatoshiLite	13	1	1515275772	949761545403117568	https://twitter.com/SatoshiLite/status/949761545403117568			
	Nodes relay transactions. The relay min fee can be set dynamically.	SatoshiLite	7	1	1515275347	949759761641193472	https://twitter.com/SatoshiLite/status/949759761641193472			
	Maybe skewed. Not broken. We could also consider ignoring or combining fees for txns that has a child in the same block.	SatoshiLite	8	1	1515275115	949758789636440064	https://twitter.com/SatoshiLite/status/949758789636440064			
	They can already do that today. This proposal doesn't make it any easier. As long as there are miners willing to mine lower fees, your low fee transaction will be mined. Will just take longer. If no miners are willing to mine it, then it shows that you are paying too little.	SatoshiLite	7	1	1515274881	949757805816250368	https://twitter.com/SatoshiLite/status/949757805816250368			
	Yes, use 5 bits to make it much easier for SPV clients to estimate fees	SatoshiLite	14	1	1515274501	949756212710486016	https://twitter.com/SatoshiLite/status/949756212710486016			
	No, it wouldn't, as the fear will crash the market needlessly	SatoshiLite	9	1	1515273848	949753474761150464	https://twitter.com/SatoshiLite/status/949753474761150464			
	4/ As @pwuille pointed out, out of band fee payments can skew the results. But I think median min fee rate will not be skewed much at all and will be useful. The other important thing is to remove us (developers) from deciding and changing what the min fee and relay fee is.	SatoshiLite	638	110	1515273436	949751747186122752	https://twitter.com/SatoshiLite/status/949751747186122752			@pwuille
	They can do that today. So it's important for mining to be decentralized and competitive.	SatoshiLite	17	2	1515273240	949750926079754240	https://twitter.com/SatoshiLite/status/949750926079754240			
	They can do that today already.	SatoshiLite	8	1	1515273009	949749956734107648	https://twitter.com/SatoshiLite/status/949749956734107648			
	It doesn't give them more than they have today.	SatoshiLite	13	1	1515272953	949749718812258304	https://twitter.com/SatoshiLite/status/949749718812258304			
		SatoshiLite	38	2	1515272789	949749032032743424	https://twitter.com/SatoshiLite/status/949749032032743424			
	Easy to break that cartel as any miner can mine all the low fee transactions and reap the rewards	SatoshiLite	22	4	1515272747	949748857616740352	https://twitter.com/SatoshiLite/status/949748857616740352			
litecoin 	3/ 2) Miners can choose to not mine low fee transactions to signal to the market to increase the fees. This should help create a fee market. If mining is competitive, this should lead to a good fee market. I'm convinced this will work. I think worthwhile to test on Litecoin.	SatoshiLite	768	131	1515272579	949748150201303040	https://twitter.com/SatoshiLite/status/949748150201303040			
	2/ This accomplishes 2 things. 1) min fee rate is stored in block headers, so SPV clients can look at it to more easily calculate a good fee. For example, median min fee rate of last 100 blocks means that >50% of hashrate will mine that transaction. So it should confirm in 2 blk	SatoshiLite	394	82	1515272409	949747438117535744	https://twitter.com/SatoshiLite/status/949747438117535744			
	1/ Technical info: Use 5 of the version bits (fee_bits) to specify min fee rate min_fee_rate = 2^fee_bits (in litoshi) Soft fork enforces that all transaction in that block has a fee rate higher than min_fee_rate and that fee_bits is set to highest possible. https:// twitter.com/SatoshiLite/st atus/949599651874795520 …	SatoshiLite	1175	318	1515272229	949746681662205952	https://twitter.com/SatoshiLite/status/949746681662205952			
	Median fee is easy to figure out. Just look at last 100 block headers. Then if you pay the median fee, your transactions should confirm in 5 mins (2 blocks) on average.	SatoshiLite	30	6	1515270043	949737515736551424	https://twitter.com/SatoshiLite/status/949737515736551424			
	I hope you are being sarcastic for your sake	SatoshiLite	9	1	1515269868	949736779636129792	https://twitter.com/SatoshiLite/status/949736779636129792			
	I did when I sold them all.	SatoshiLite	38	2	1515264865	949715798511112192	https://twitter.com/SatoshiLite/status/949715798511112192			
	Yes. Just started.	SatoshiLite	129	1	1515264784	949715457761722369	https://twitter.com/SatoshiLite/status/949715457761722369			
	You sold because I tweet DBZ gifs? Maybe you shouldn't be investing in crypto currencies. Just saying.	SatoshiLite	362	8	1515264725	949715209173614592	https://twitter.com/SatoshiLite/status/949715209173614592			
	Then please do go make an LTC transaction and figure it out for yourself if it's faster than BCH.	SatoshiLite	13	1	1515264267	949713288480215040	https://twitter.com/SatoshiLite/status/949713288480215040			
litecoin 	Seriously. Litecoin has had 2.5 average confirmations for 6+ years now. Go do your own research and stop wasting our time.	SatoshiLite	16	1	1515264026	949712276952502273	https://twitter.com/SatoshiLite/status/949712276952502273			
	My favorite anime	SatoshiLite	485	10	1515263290	949709188963299328	https://twitter.com/SatoshiLite/status/949709188963299328			
	Yes, I get more on weekends.	SatoshiLite	119	2	1515263215	949708875686555648	https://twitter.com/SatoshiLite/status/949708875686555648			
	I think of it as doing both. Yes OOB is going to mess it up. I do think it would also help the market dynamically find the right fee rate without developers having to dictate min fee.	SatoshiLite	47	5	1515263167	949708672925515776	https://twitter.com/SatoshiLite/status/949708672925515776			
