ripple 	Funny how much effort people have put into branding $ XRP as product controlled by a company. A company with names and faces of people who can be googled and researched. This baby boomer generation controls about 70% of all disposable income in the U.S. and now they @Ripple . https:// twitter.com/cryptoyoda1338 /status/949671129609850880 …	haydentiff	328	105	1515262221	949704708033261568	https://twitter.com/haydentiff/status/949704708033261568			@Ripple
bitcoin 	R3 treated people terribly and I hope it bites them in the ass. https:// news.bitcoin.com/r3-makes-a-hab it-of-sending-cease-and-desist-letters-to-bitcoiners/ …	haydentiff	2	0	1515229276	949566524557230080	https://twitter.com/haydentiff/status/949566524557230080			
ripple 	Definitely. @Ripple doesn’t let bullies walk all over them.	haydentiff	9	2	1515229077	949565690222206977	https://twitter.com/haydentiff/status/949565690222206977			@Ripple
	Nah.	haydentiff	2	0	1515227505	949559097904586752	https://twitter.com/haydentiff/status/949559097904586752			
	Got close a few times to suggesting the other person meet me in the parking lot, haha.	haydentiff	4	0	1515227456	949558892647809029	https://twitter.com/haydentiff/status/949558892647809029			
	Yes!!!!	haydentiff	4	0	1515227380	949558572358225921	https://twitter.com/haydentiff/status/949558572358225921			
	Happy Birthday!!!	haydentiff	15	0	1515226757	949555960263204864	https://twitter.com/haydentiff/status/949555960263204864			
	Thank you!	haydentiff	1	0	1515223758	949543380001976320	https://twitter.com/haydentiff/status/949543380001976320			
	Thanks!	haydentiff	4	0	1515220792	949530939792781312	https://twitter.com/haydentiff/status/949530939792781312			
	We use Twitter for the same reasons, DL! #fistbump https:// twitter.com/haydentiff/sta tus/949299322381848576 …	haydentiff	2	0	1515220655	949530367131897857	https://twitter.com/haydentiff/status/949530367131897857		#fistbump	
	Kind of futile when she doesn’t understand the tech. I’m sure one of the architects of the network would be willing to help her out, but I haven’t seen her bother to reply to @JoelKatz . <smh> #xrpthestandard $ XRP https:// twitter.com/joelkatz/statu s/948846620010926080 …	haydentiff	4	0	1515220381	949529218873995264	https://twitter.com/haydentiff/status/949529218873995264		#xrpthestandard	@JoelKatz
	Dude, it’s right before bed, haha.	haydentiff	0	0	1515215449	949508530159177729	https://twitter.com/haydentiff/status/949508530159177729			
	If you have an iOS it’s the only way Apple allows beta testing. We have to send you a link with a download.	haydentiff	2	0	1515214715	949505452928270336	https://twitter.com/haydentiff/status/949505452928270336			
	Is it just me, or are we seeing a lot of @bgarlinghouse pics? Copycat. #ChallengeAccepted $ XRP #XRPtheStandard https:// twitter.com/coindesk/statu s/949312826618892290 …	haydentiff	242	57	1515211986	949494004919492609	https://twitter.com/haydentiff/status/949494004919492609		#ChallengeAccepted #XRPtheStandard	@bgarlinghouse
	Anybody who studied the protocol can refute that paper. Why would a Cryptographer waste his time on a high school book report from a kid who didn’t even bother reading the book? I had to copy my answer on an image because of character limitations. Again, you’re welcome.	haydentiff	0	0	1515195307	949424048152498176	https://twitter.com/haydentiff/status/949424048152498176			
	You were unable to do a basic search for it today. You’re welcome.	haydentiff	0	0	1515195098	949423174302752769	https://twitter.com/haydentiff/status/949423174302752769			
	Peace I’m out! (The bill is in the mail.)	haydentiff	0	0	1515194805	949421942649614336	https://twitter.com/haydentiff/status/949421942649614336			
	Already possible: connect to a server and ask it to give you updates about transactions affecting your particular wallet (or any wallet of interest). No need to grab the ledger. pic.twitter.com/8fAsZfHgJj	haydentiff	0	0	1515194730	949421628148142080	https://twitter.com/haydentiff/status/949421628148142080			
	Yes -WIP pic.twitter.com/OH29yYXxur	haydentiff	0	0	1515194666	949421359230275584	https://twitter.com/haydentiff/status/949421359230275584			
	To obtain a negative USD balance, just get someone to trust you for USD and send them USD via the client. (Note: negative XRP balances are NOT possible.) pic.twitter.com/0ZIHStFURQ	haydentiff	1	0	1515194592	949421051703889921	https://twitter.com/haydentiff/status/949421051703889921			
ripple 	Ripple's WIP contract language is Turing complete.' Instructions for multi-sign can be found here: https:// ripple.com/build/how-to-m ulti-sign/ … pic.twitter.com/ivssQd4JBc	haydentiff	0	0	1515194510	949420705745121281	https://twitter.com/haydentiff/status/949420705745121281			
	pic.twitter.com/6P0fIhOwKZ	haydentiff	0	1	1515194426	949420354996490240	https://twitter.com/haydentiff/status/949420354996490240			
ripple 	Very thorough ledger format info can be found here: https:// ripple.com/build/ledger-f ormat/ … pic.twitter.com/3juTXYffc4	haydentiff	0	0	1515194146	949419181434441729	https://twitter.com/haydentiff/status/949419181434441729			
ripple 	It would take all day. <sigh> I’ll do some of it. The underlined info he couldn’t find is right here: https:// ripple.com/build/gateway- guide/#trust-lines-and-issuances … pic.twitter.com/puObbrdj1T	haydentiff	0	0	1515193777	949417634063376384	https://twitter.com/haydentiff/status/949417634063376384		#trust	
	If he would have actually studied the protocol, he probably would’ve been able to write a halfway decent paper. Maybe.	haydentiff	0	0	1515193486	949416411969019904	https://twitter.com/haydentiff/status/949416411969019904			
	The White House always wins when you walk into Donald Trump's tweet casino.	stacyherbert	58	24	1515277969	949770758275944453	https://twitter.com/stacyherbert/status/949770758275944453			
	While Trump may, indeed, be a buffoon, he is definitely a genius. He plays the bimbo so well and I just can't believe how the elite media snobs fall for his tricks over and over and over again. He plays them like any chump walking into a casino.	stacyherbert	196	71	1515277889	949770421603364870	https://twitter.com/stacyherbert/status/949770421603364870			
	OMG. Why are you still there living the good life and I am here shivering in front of a fire?	stacyherbert	0	0	1515277781	949769969729982469	https://twitter.com/stacyherbert/status/949769969729982469			
	"My god, seven hours ago Scott Adams predicted my tweet stream would be filled with sarcastic, snarky, ""So, the President's a genius!?"" https:// twitter.com/ScottAdamsSays /status/949670034611163136 …"	stacyherbert	7	0	1515277736	949769782437535746	https://twitter.com/stacyherbert/status/949769782437535746			
	Lol.	stacyherbert	0	0	1515270883	949741037190336513	https://twitter.com/stacyherbert/status/949741037190336513			
	Waiter just offered ‘zucchini,’ and I forgot what that was. Hadn’t heard it referred to as anything but ‘courgette’ for past twenty years.	stacyherbert	67	2	1515266622	949723166041104384	https://twitter.com/stacyherbert/status/949723166041104384			
	Just saw the first @HeisenbergCap in the wild. pic.twitter.com/7zFSDssfJR	stacyherbert	94	17	1515265541	949718630815723524	https://twitter.com/stacyherbert/status/949718630815723524			@HeisenbergCap
	pic.twitter.com/5sLrE5w3e0	stacyherbert	1	0	1515253949	949670011551080449	https://twitter.com/stacyherbert/status/949670011551080449			
	9 and under. Antigua's is 6.	stacyherbert	3	0	1515253929	949669928596115456	https://twitter.com/stacyherbert/status/949669928596115456			
bitcoin 	Citizenship on sale in paradise for just 9 bitcoin! https:// steemit.com/citizenship/@k eiserreport/citizenship-on-sale-for-just-9-bitcoin …	stacyherbert	108	66	1515253679	949668877964840960	https://twitter.com/stacyherbert/status/949668877964840960			@k
	Yep. Up over 30% pic.twitter.com/Bj1zdXmb1K	stacyherbert	1	1	1515252408	949663546958340096	https://twitter.com/stacyherbert/status/949663546958340096			
	Electroneum pic.twitter.com/feFsQhPVaq	stacyherbert	0	0	1515252361	949663351654768642	https://twitter.com/stacyherbert/status/949663351654768642			
	Kin pic.twitter.com/tjW9OmUpmw	stacyherbert	0	0	1515252341	949663265696763907	https://twitter.com/stacyherbert/status/949663265696763907			
	Bytecoin pic.twitter.com/6RxIVkIPl8	stacyherbert	0	0	1515252317	949663165687783427	https://twitter.com/stacyherbert/status/949663165687783427			
	Siacoin pic.twitter.com/f3e8MNWKEW	stacyherbert	2	1	1515252287	949663040739446784	https://twitter.com/stacyherbert/status/949663040739446784			
	Casino in the altcoins. pic.twitter.com/HM76JPLx3p	stacyherbert	15	3	1515251977	949661738856845312	https://twitter.com/stacyherbert/status/949661738856845312			
	PACcoin? pic.twitter.com/RFAcddBOsO	stacyherbert	6	1	1515251860	949661248311955461	https://twitter.com/stacyherbert/status/949661248311955461			
	Dentacoin? pic.twitter.com/UE0rcqmVpD	stacyherbert	10	4	1515251837	949661154586103809	https://twitter.com/stacyherbert/status/949661154586103809			
	To be fair, most British voters don't seem to know what exactly it is either. https:// twitter.com/paulwaugh/stat us/949556723337125889 …	stacyherbert	60	21	1515227507	949559105328500736	https://twitter.com/stacyherbert/status/949559105328500736			
	LOL. Brilliantly put.	stacyherbert	0	0	1515224223	949545332542791680	https://twitter.com/stacyherbert/status/949545332542791680			
	I like the way the uploader of that video has the title exactly the wrong way around.	stacyherbert	2	1	1515223997	949544384122507264	https://twitter.com/stacyherbert/status/949544384122507264			
	Believe it or not, political twitter is filled with way more gossip, slander and tittle tattle than crypto twitter! pic.twitter.com/COrbM6I0r1	stacyherbert	18	2	1515206168	949469603922669568	https://twitter.com/stacyherbert/status/949469603922669568			
	LOL. True! pic.twitter.com/YhivvTXlXP	stacyherbert	5	1	1515205896	949468461088075777	https://twitter.com/stacyherbert/status/949468461088075777			
	Charles, we talked about you on @keiserreport and everyone in crypto knows that our voice is ALL that matters! pic.twitter.com/SIQAdhY99i	stacyherbert	76	10	1515205747	949467839387308032	https://twitter.com/stacyherbert/status/949467839387308032			@keiserreport
	Delete your account. Seriously. https:// twitter.com/NBCNews/status /949449224181166080 …	stacyherbert	212	85	1515201404	949449621989883906	https://twitter.com/stacyherbert/status/949449621989883906			
	Thanks, Gitsy! It's good to be back. And thanks for the help. Open to it.	stacyherbert	9	6	1515197086	949431509341081600	https://twitter.com/stacyherbert/status/949431509341081600			
litecoin 	I like litecoin and have been accumulating. I think I bought some of @SatoshiLite 's!	stacyherbert	2	1	1515196060	949427208585728000	https://twitter.com/stacyherbert/status/949427208585728000			@SatoshiLite
	This https:// twitter.com/cryptomanran/s tatus/949400404655333377 …	stacyherbert	49	19	1515194574	949420976940437505	https://twitter.com/stacyherbert/status/949420976940437505			
	Brilliant ! Seriously you are going to make one awesome teacher - see you soon, Sally :)	sallyeaves	1	1	1515277257	949767773902790656	https://twitter.com/sallyeaves/status/949767773902790656			
	Thanks Per - was an absolute pleasure - brilliant people across the board and real lasting impact to come I have no doubt at all ! See you soon, Sally :)	sallyeaves	6	1	1515277176	949767431597178880	https://twitter.com/sallyeaves/status/949767431597178880			
	Have a lovely evening Jackie ! Enjoy (although always seems bare post xmas lights doesnt it!) Thanks for your kind message earlier, much valued x	sallyeaves	2	2	1515276249	949763545918590976	https://twitter.com/sallyeaves/status/949763545918590976			
	Spot on! Brilliant talk Cliff - I think those social media attention graphics resonated with so many. Insightful! See you soon, Sally :)	sallyeaves	1	0	1515276122	949763013896278016	https://twitter.com/sallyeaves/status/949763013896278016			
	Could not agree more - superb and so natural with it Jo!	sallyeaves	2	0	1515275973	949762386235482117	https://twitter.com/sallyeaves/status/949762386235482117			
	A brilliant talk Michelle and such as pleasure to spend time with you. Keep being you - that is magnificent, S x	sallyeaves	0	0	1515275898	949762072178503681	https://twitter.com/sallyeaves/status/949762072178503681			
	Thank you Amanda what an amazing day ! Look forward to sharing all about it :)	sallyeaves	3	0	1515272854	949749303903490048	https://twitter.com/sallyeaves/status/949749303903490048			
	This was such a fantastic day - what a brilliant #TEDx team across the board absolutely brilliant !!!!	sallyeaves	10	2	1515272684	949748592633352192	https://twitter.com/sallyeaves/status/949748592633352192		#TEDx	
	Thanks Victoria and absolutely would be a pleasure Molly - so many synergies here. Lets arrange that soon ! #Birmingham #tech #inclusion #diversity #TEDXBCU	sallyeaves	1	0	1515272479	949747731224031232	https://twitter.com/sallyeaves/status/949747731224031232		#Birmingham #tech #inclusion #diversity #TEDXBCU	
	Such a pleasure Victoria thank you - what a brilliant day! The very essence of #team ! Looking forward to talking more soon #coffee :) Sally #TEDXBCU #ChangeTheWorld	sallyeaves	4	0	1515272263	949746825229193216	https://twitter.com/sallyeaves/status/949746825229193216		#team #coffee #TEDXBCU #ChangeTheWorld	
	Thanks Joel much appreciated!	sallyeaves	0	0	1515242155	949620544902713344	https://twitter.com/sallyeaves/status/949620544902713344			
	Such a pleasure! A wonderful group of people - such an awesome team around this entire event	sallyeaves	4	1	1515241724	949618735802998784	https://twitter.com/sallyeaves/status/949618735802998784			
	Thanks Thomas ! Speak soon	sallyeaves	2	0	1515241622	949618310349512704	https://twitter.com/sallyeaves/status/949618310349512704			
	Thank you Jackie ! Really kind of you xx	sallyeaves	4	1	1515240550	949613810683404288	https://twitter.com/sallyeaves/status/949613810683404288			
	Thanks so much Rav ! Can't wait to catch up soon will text later ! #community #womenintech #WomenInSTEM	sallyeaves	8	3	1515240431	949613312941199360	https://twitter.com/sallyeaves/status/949613312941199360		#community #womenintech #WomenInSTEM	
	Fantastic start to #TEDXBCU with inspiring ideas worth sharing and an #Amazing atmosphere! Looking forward to speaking later :) #Change #innovation #techforgood #TEDx pic.twitter.com/cwc6FT6PwS	sallyeaves	106	44	1515240059	949611754916630531	https://twitter.com/sallyeaves/status/949611754916630531		#TEDXBCU #Amazing #Change #innovation #techforgood #TEDx	
	Spot on - great share thanks Siddhi :)	sallyeaves	1	0	1515228193	949561982876897280	https://twitter.com/sallyeaves/status/949561982876897280			
	Thank you Helene! ￼ Have a great weekend everyone	sallyeaves	5	0	1515218927	949523119424901120	https://twitter.com/sallyeaves/status/949523119424901120			
	Many thanks indeed - much appreciated and happy weekend all! :)	sallyeaves	1	1	1515218844	949522770840506368	https://twitter.com/sallyeaves/status/949522770840506368			
	Bullish. https:// twitter.com/csuwildcat/sta tus/949611366842707968 …	adam3us	406	71	1515244057	949628520367443969	https://twitter.com/adam3us/status/949628520367443969			
	Lunchtime then #ASW18 pic.twitter.com/WnADx28Jn4	WarrenWhitlock	9	2	1515278417	949772637537951744	https://twitter.com/WarrenWhitlock/status/949772637537951744		#ASW18	
	Who’s at #ASW18 ? Where’s the action (hanging out)?	WarrenWhitlock	1	1	1515278379	949772479412752384	https://twitter.com/WarrenWhitlock/status/949772479412752384		#ASW18	
	see you soon	WarrenWhitlock	0	0	1515273793	949753242564440064	https://twitter.com/WarrenWhitlock/status/949753242564440064			
	All the cool kids	WarrenWhitlock	1	0	1515273673	949752740606984192	https://twitter.com/WarrenWhitlock/status/949752740606984192			
	It's just you and me in this conversation :)	WarrenWhitlock	0	0	1515272509	949747856407080960	https://twitter.com/WarrenWhitlock/status/949747856407080960			
	thankfully #BlackMirror is fiction, as is this company's future if they don't cut the creepy	WarrenWhitlock	1	0	1515272472	949747701175824384	https://twitter.com/WarrenWhitlock/status/949747701175824384		#BlackMirror	
	"Personalisation vs. Creepy. Don't go ""Minority Report"" on us. [video] http:// j.mp/29nNoN4 #adtech #future pic.twitter.com/pu71XEEb4v"	WarrenWhitlock	6	3	1515270024	949737433372987393	https://twitter.com/WarrenWhitlock/status/949737433372987393		#adtech #future	
	I'm doing great. I don't read/answer the DMs fishing (phishing?) with that line though. LOL And how are you?	WarrenWhitlock	2	0	1515268069	949729233655377920	https://twitter.com/WarrenWhitlock/status/949729233655377920			
	people asking it are fine. Bots looking for lonely tweeters are what makes it annoying	WarrenWhitlock	1	0	1515268028	949729064146710528	https://twitter.com/WarrenWhitlock/status/949729064146710528			
	Go right ahead. I won't be watching	WarrenWhitlock	0	0	1515267978	949728852552572928	https://twitter.com/WarrenWhitlock/status/949728852552572928			
	great	WarrenWhitlock	0	0	1515267918	949728600562974720	https://twitter.com/WarrenWhitlock/status/949728600562974720			
	thanks for reading the article	WarrenWhitlock	0	0	1515267780	949728025137922049	https://twitter.com/WarrenWhitlock/status/949728025137922049			
	as long as you have time for your priorities, like complaining on Twitter LOL	WarrenWhitlock	1	0	1515267670	949727563970093056	https://twitter.com/WarrenWhitlock/status/949727563970093056			
	:).. Remind me. Where do we talk privately? Email? Skype? Carrier Pidgeon?	WarrenWhitlock	0	0	1515265432	949718175125352448	https://twitter.com/WarrenWhitlock/status/949718175125352448			
	Some of my best referrals come from Linkedin. Are we connected? http:// linkedin.com/in/book pic.twitter.com/iJV7YMMgYO	WarrenWhitlock	14	1	1515265404	949718059677372416	https://twitter.com/WarrenWhitlock/status/949718059677372416			
	Blockchain will be bigger than the internet, Warren Whitlock new CIF advisor https:// lnkd.in/g-8ea_w	WarrenWhitlock	30	19	1515260030	949695516274667526	https://twitter.com/WarrenWhitlock/status/949695516274667526			
	Why do Business People talk about Killing Each Other? http:// j.mp/1RuF1BL #business #war #sports pic.twitter.com/6ZhDzhwTJb	WarrenWhitlock	2	3	1515258982	949691120556105729	https://twitter.com/WarrenWhitlock/status/949691120556105729		#business #war #sports	
	This could change the way eCommerce works for good https://www. coinhash.co/startup-is-cha nging-the-way-we-trade-online … #ico @bazista_io #onlinemarketing	WarrenWhitlock	11	5	1515249345	949650700300115968	https://twitter.com/WarrenWhitlock/status/949650700300115968		#ico #onlinemarketing	@bazista_io
	Where is Your Blog? Richard Branson Says You Got to Do This http:// j.mp/1RuF1l2 #blogging #marketing pic.twitter.com/IpSn4Kg3F7	WarrenWhitlock	7	3	1515247933	949644777787674626	https://twitter.com/WarrenWhitlock/status/949644777787674626		#blogging #marketing	
	Twitter Revolution: Social Media and Mobile Marketing are Changing the Way We Do Business http:// gshift.it/tr-tw pic.twitter.com/L5iDEFNhCC	WarrenWhitlock	14	7	1515244029	949628403824627713	https://twitter.com/WarrenWhitlock/status/949628403824627713			
	Do you really need a social media expert? https:// warrenwhitlock.com/social-media-e xpert/ …	WarrenWhitlock	7	0	1515240211	949612392203288576	https://twitter.com/WarrenWhitlock/status/949612392203288576			
	Share this with someone who needs a smile today http:// j.mp/2a9nhbH #socialmedia #joy #love #sharing pic.twitter.com/Xr8AbmBvA0	WarrenWhitlock	7	4	1515236900	949598502220390401	https://twitter.com/WarrenWhitlock/status/949598502220390401		#socialmedia #joy #love #sharing	
	The small BIG: small changes that spark big influence http:// j.mp/1RuF1l4 #influence #persuasion #marketing pic.twitter.com/7XcdGefoHU	WarrenWhitlock	7	2	1515225869	949552236748836864	https://twitter.com/WarrenWhitlock/status/949552236748836864		#influence #persuasion #marketing	
	I'm a contributor at http:// coinhash.com . Read and learn about #blockchain and #cryptocurrency #ICO pic.twitter.com/JERereIW9Q	WarrenWhitlock	7	3	1515215035	949506793167867904	https://twitter.com/WarrenWhitlock/status/949506793167867904		#blockchain #cryptocurrency #ICO	
	Weeks from Idea to Millions Reached http:// j.mp/1RuF1S7 #bestseller #book #marketing pic.twitter.com/isrmgWfPdc	WarrenWhitlock	5	2	1515211294	949491105225236485	https://twitter.com/WarrenWhitlock/status/949491105225236485		#bestseller #book #marketing	
	I have a lot of ideas. I share some but know where the real difference can be made. pic.twitter.com/bXcBliEcZb	WarrenWhitlock	24	11	1515208841	949480815947403264	https://twitter.com/WarrenWhitlock/status/949480815947403264			
	2. Amazon's big profit ... https://www. axios.com/future-of-work -1-3-2018-2520319468.html?rebelltitem=8&utm_source=twitter&utm_medium=twsocialshare&utm_campaign=organic#rebelltitem8 …	WarrenWhitlock	6	7	1515205983	949468826688659456	https://twitter.com/WarrenWhitlock/status/949468826688659456		#rebelltitem8	
	Not just a wheelbarrow. It's saving lives and freeing people http:// j.mp/29KGDZa #cleanwater #billionsrising pic.twitter.com/rz28rw2zHl	WarrenWhitlock	10	7	1515196575	949429366911533056	https://twitter.com/WarrenWhitlock/status/949429366911533056		#cleanwater #billionsrising	
	I think he proposed median or something to make that work. I like the idea of embedding fee data into headers, though =)	jimmysong	5	0	1515275095	949758705968480256	https://twitter.com/jimmysong/status/949758705968480256			
	Very clever! SPV wallets can have real time data on this. https:// twitter.com/SatoshiLite/st atus/949746681662205952 …	jimmysong	192	29	1515272967	949749779390713856	https://twitter.com/jimmysong/status/949749779390713856			
	Is China going to ban mining? With @ToneVays and @vxschmid : https:// youtu.be/tZZyvDoSXpo	jimmysong	45	18	1515256037	949678769727471617	https://twitter.com/jimmysong/status/949678769727471617			@ToneVays @vxschmid
bitcoin 	Conventional Wisdom: You need education, money and luck to succeed. Bitcoin Wisdom: You need skill, virtue and grit to succeed.	jimmysong	748	180	1515224133	949544952480124929	https://twitter.com/jimmysong/status/949544952480124929			
	My dad used to say the same thing about gambling. It's better to lose a little bit when you first go to a casino. If you win big the first time, you're going to lose even bigger. https:// twitter.com/naval/status/9 49469114564714496 …	jimmysong	555	109	1515217184	949515807217913856	https://twitter.com/jimmysong/status/949515807217913856			
	Can't win 'em all, kids pic.twitter.com/87GWoms0Ii	DollarVigilante	38	5	1515271141	949742121531203585	https://twitter.com/DollarVigilante/status/949742121531203585			
	Subscribe here--> https:// dollarvigilante.com/2tt #Cashless #India #Australia pic.twitter.com/B2mni0fSOz	DollarVigilante	19	4	1515270919	949741191024775169	https://twitter.com/DollarVigilante/status/949741191024775169		#Cashless #India #Australia	
	Join us here--> http:// dollarvigilante.com #Anarchism #Voluntaryism pic.twitter.com/lF11cVtKp9	DollarVigilante	18	2	1515261201	949700429440520193	https://twitter.com/DollarVigilante/status/949700429440520193		#Anarchism #Voluntaryism	
	Protect Yourself--> https:// dollarvigilante.com/2tt #Economy #CentralBanks #Money pic.twitter.com/Hfo4rZ5I0T	DollarVigilante	19	3	1515251485	949659676379090950	https://twitter.com/DollarVigilante/status/949659676379090950		#Economy #CentralBanks #Money	
	Join us here--> https:// dollarvigilante.com/2tt #Anarchism #Voluntaryism #Communism #Socialism pic.twitter.com/1X3p4iGWoI	DollarVigilante	21	4	1515203985	949460449313148929	https://twitter.com/DollarVigilante/status/949460449313148929		#Anarchism #Voluntaryism #Communism #Socialism	
bitcoin 	Join us and learn about #Bitcoin #Gold and Silver here--> https:// dollarvigilante.com/2tt pic.twitter.com/ATZtcD547m	DollarVigilante	11	3	1515194242	949419583135453184	https://twitter.com/DollarVigilante/status/949419583135453184		#Bitcoin #Gold	
	"yikes. ""concussion protocol"" had better determine that Kelce does not come back to this game after a helmet to helmet hit like that."	readDanwrite	1	0	1515279501	949777184444551168	https://twitter.com/readDanwrite/status/949777184444551168			
	The 2017-2018 Tennessee Titans truly have an aversion to scoring touchdowns. they prefer field goals	readDanwrite	2	2	1515279161	949775758020444160	https://twitter.com/readDanwrite/status/949775758020444160			
bitcoin 	sounds like only 4 https:// finance.yahoo.com/news/bitcoin-m iner-havent-paid-heat-three-years-143714695.html … @readkrystalhu	readDanwrite	3	0	1515269414	949734877926223872	https://twitter.com/readDanwrite/status/949734877926223872			@readkrystalhu
	e-books don't sell out.	readDanwrite	1	0	1515269211	949734027052896256	https://twitter.com/readDanwrite/status/949734027052896256			
	"I have a Q. about @Medium that still isn't clear: with their new ""claps"" system, where claps = pay, does it apply to an older piece? i.e. something on Medium from 2 years ago that is now earning claps. am I going to get any money from that? (let me guess: no!)"	readDanwrite	0	0	1515263883	949711678828105728	https://twitter.com/readDanwrite/status/949711678828105728			@Medium
	Waiting for the Barbarians	readDanwrite	1	0	1515258684	949689870594781190	https://twitter.com/readDanwrite/status/949689870594781190			
