	The thing is, each of these issues has a long and tortuous history. The notion that Trump arrived on the scene and worked magic is ... a figment of his own uniformed imagination.	prchovanec	0	0	1515267383	949726357084409857	https://twitter.com/prchovanec/status/949726357084409857			
	... though the concern (for anyone, not just Trump) is whether defeating ISIS just. opens the door to increase Iran's and Russia's influence, or not.	prchovanec	0	0	1515267326	949726120743768064	https://twitter.com/prchovanec/status/949726120743768064			
	"The notion Trump has achieved ""great things"" is exaggerated, by himself. The ISIS defeat has perhaps the most legitimacy. His predecessor laid the groundwork for that offensive, but Trump carried it through - good on him ..."	prchovanec	0	0	1515267287	949725956591276033	https://twitter.com/prchovanec/status/949725956591276033			
	I'm happy to argue each point, in greater detail, if you like. They're hardly mere excuses.	prchovanec	0	0	1515267143	949725350732451846	https://twitter.com/prchovanec/status/949725350732451846			
	Jan 6, 1918 - American transport ship USS Aeolus at the Navy Yard in New York #100yearsago pic.twitter.com/7GUJgSOeOZ	prchovanec	3	1	1515267080	949725088626167808	https://twitter.com/prchovanec/status/949725088626167808		#100yearsago	
	I knew a lot of crazy people at Princeton. Some of them were pretty good students. https:// twitter.com/kylegriffin1/s tatus/949693320535707648 …	prchovanec	11	2	1515264838	949715684656926721	https://twitter.com/prchovanec/status/949715684656926721			
	I tend to agree.	prchovanec	4	1	1515264791	949715485117075456	https://twitter.com/prchovanec/status/949715485117075456			
	Sometimes people become billionaires by inventing and marketing things we use, things we want.	prchovanec	2	0	1515264728	949715221882593280	https://twitter.com/prchovanec/status/949715221882593280			
	I'm cool with a S&P 500 trailing P/E ratio of 21x, given an ERP of 5.1%, without an evident catalyst that would undermine the earnings outlook.	prchovanec	3	0	1515264681	949715026931314688	https://twitter.com/prchovanec/status/949715026931314688			
	Correct - the mere existence of a consensus does not tell us whether that consensus is right or wrong. We have to look to the substance of the arguments.	prchovanec	1	0	1515264348	949713629628305408	https://twitter.com/prchovanec/status/949713629628305408			
	You probably typed that into an iPhone.	prchovanec	1	0	1515264260	949713260525342725	https://twitter.com/prchovanec/status/949713260525342725			
bitcoin 	96% of economists say Bitcoin is a bubble https:// blogs.wsj.com/economics/2017 /12/13/is-bitcoin-a-bubble-96-of-economists-say-yes/ …	prchovanec	6	5	1515264056	949712404673331200	https://twitter.com/prchovanec/status/949712404673331200			
	Jan 6, 1918 - New York Times: American aviators in France bomb German lines #100yearsago pic.twitter.com/4M0qgkfmwI	prchovanec	1	0	1515263904	949711764710723584	https://twitter.com/prchovanec/status/949711764710723584		#100yearsago	
	Jan 6, 1918 - New York Times: Lloyd George restates Britain's war aims, demands Alsace-Lorraine for France, does not insist on democracy for Germany #100yearsago pic.twitter.com/rNJIHO0nkA	prchovanec	2	2	1515263863	949711594086436866	https://twitter.com/prchovanec/status/949711594086436866		#100yearsago	
	Jan 6, 1918 - News of the World: Under Lloyd George's direction, Britain tightens its belt for a new year #100yearsago pic.twitter.com/NXvIGFUfPX	prchovanec	2	0	1515263809	949711365769433089	https://twitter.com/prchovanec/status/949711365769433089		#100yearsago	
	No, he scammed his way. That takes a great reserves of cleverness, which is not to be confused with wisdom, insight, or character. https:// twitter.com/dineshdsouza/s tatus/949623960349618176 …	prchovanec	58	14	1515258965	949691050586771456	https://twitter.com/prchovanec/status/949691050586771456			
	No, he scammed his way.	prchovanec	0	0	1515258896	949690761704034304	https://twitter.com/prchovanec/status/949690761704034304			
	They will avoid the most important question facing our country, as they have all along. https:// twitter.com/bencjacobs/sta tus/949648155536166913 …	prchovanec	8	2	1515253182	949666796415700992	https://twitter.com/prchovanec/status/949666796415700992			
	The problem with Trump, though, isn't just that he's crazy, but that he's mean crazy.	prchovanec	17	2	1515253097	949666437181911040	https://twitter.com/prchovanec/status/949666437181911040			
	Close.	prchovanec	0	0	1515252908	949665643858661376	https://twitter.com/prchovanec/status/949665643858661376			
	The argument that he's crazy but it doesn't matter is more credible than that he's not crazy. Though one must consider the odds and consequences of being wrong. https:// twitter.com/_Drew_McCoy_/s tatus/949656944893030400 …	prchovanec	6	1	1515252779	949665103120601090	https://twitter.com/prchovanec/status/949665103120601090			
	Nor is it a fact that depends very much on policy, though policy can affect how we cope with and adapt to it.	prchovanec	1	0	1515252649	949664558439858178	https://twitter.com/prchovanec/status/949664558439858178			
	It may not be, for a Western standard of living, if what you're offering competes directly with billions of other people who only aspire to such a standard. Again, this is a fact that doesn't care about your feelings.	prchovanec	2	0	1515252550	949664145447714817	https://twitter.com/prchovanec/status/949664145447714817			
	"Here's a clue: Another book I'm reading is ""An Army at Dawn"" by Rick Atkinson https://www. amazon.com/Army-Dawn-1942 -1943-Liberation-Trilogy/dp/0805087249/ref=sr_1_1?ie=UTF8&qid=1515252319&sr=8-1&keywords=army+at+dawn …"	prchovanec	3	0	1515252387	949663460018835458	https://twitter.com/prchovanec/status/949663460018835458			
	signifying nothing? Oh wait, that sounds and fury. Proceed.	prchovanec	1	0	1515252060	949662088896700424	https://twitter.com/prchovanec/status/949662088896700424			
	The value of any job depends on productivity and the relative scarcity of labor, not on legislation. That is a fact that you can ignore, but will not ignore you.	prchovanec	5	0	1515252010	949661878170669058	https://twitter.com/prchovanec/status/949661878170669058			
	The first recorded case is an army camp in Kansas. But its prehistory is unclear. Anyway, getting ahead of the story!	prchovanec	2	0	1515251885	949661354763411457	https://twitter.com/prchovanec/status/949661354763411457			
	"14. Gathering men from all across the country has turned US army training camps into a breeding ground for infectious diseases. One of them, the ""Spanish flu"", will kill more people in 1918 than BOTH world wars combined. #100yearsago"	prchovanec	3	3	1515251294	949658877137735681	https://twitter.com/prchovanec/status/949658877137735681		#100yearsago	
	And last but not least ...	prchovanec	0	0	1515251169	949658351960559617	https://twitter.com/prchovanec/status/949658351960559617			
	13. Meanwhile, America's allies in Europe are borrowing billions from the US to purchase their own war supplies, shifting the center of gravity of the world economy #100yearsago	prchovanec	2	1	1515251158	949658305525374976	https://twitter.com/prchovanec/status/949658305525374976		#100yearsago	
	12. In the US, the federal government is taking a bigger role that ever before to mobilize the country for war: enacting a military draft, regulating food and coal prices, taking direct control of the railroads, and selling billions in war bonds. #100yearsago	prchovanec	1	2	1515251047	949657841421504512	https://twitter.com/prchovanec/status/949657841421504512		#100yearsago	
	11. Britain's naval blockade is working, however, as Germans and Austrians suffer through a second winter of increasingly desperate hunger at home. #100yearsago	prchovanec	2	2	1515250128	949653984486264832	https://twitter.com/prchovanec/status/949653984486264832		#100yearsago	
	10. Germany's u-boat campaign to starve Britain into submission has failed, defeated by the new convoy system - at the cost of bringing the US into the war. #100yearsago	prchovanec	2	2	1515249971	949653326794194944	https://twitter.com/prchovanec/status/949653326794194944		#100yearsago	
	9. British forces have gained ground against the Turks, capturing Baghdad and Jerusalem, and endorsing a national homeland for the Jews in Palestine - laying the groundwork for the modern Middle East. #100yearsago	prchovanec	1	2	1515249726	949652299043033089	https://twitter.com/prchovanec/status/949652299043033089		#100yearsago	
	8. US troops have arrived in France, and gotten their first taste of combat. But will enough arrive, in time, to make up for the loss of Russia, and hold back new German reinforcements on the Western Front? #100yearsago	prchovanec	0	1	1515249506	949651376661061632	https://twitter.com/prchovanec/status/949651376661061632		#100yearsago	
	7. The Italians suffered a terrible defeat from the Germans and Austrians at Caporetto, but after a headlong retreat - and receiving aid from Britain and France - they are now holding a new line on the Piave River #100yearsago	prchovanec	4	2	1515249351	949650726132879360	https://twitter.com/prchovanec/status/949650726132879360		#100yearsago	
	6. France has survived its darkest days of mutiny and crisis, its morale restored under a new fighting prime minister, Georges Clemenceau. #100yearsago	prchovanec	2	2	1515249231	949650223600754688	https://twitter.com/prchovanec/status/949650223600754688		#100yearsago	
	5. Britain's big push for a breakthrough in Belgium came closer to victory than many realize, but failed, stymied in the mud at Passchendaele - though they did provide cover for a French army disabled by mutiny. #100yearsago	prchovanec	5	2	1515249116	949649741771571209	https://twitter.com/prchovanec/status/949649741771571209		#100yearsago	
	4. Germany now has a free hand to shift most of its troops from the East to the Western Front. It is finally fighting a war on just one main front. #100yearsago	prchovanec	3	1	1515248827	949648527759683584	https://twitter.com/prchovanec/status/949648527759683584		#100yearsago	
	3. Russia's collapse has forced its ally Romania out of the war as well, for the moment at least. #100yearsago	prchovanec	2	1	1515248643	949647758662815744	https://twitter.com/prchovanec/status/949647758662815744		#100yearsago	
	2. An exhausted Russia has fallen under the fragile rule of Lenin's Bolsheviks, who are negotiating a quick end to the war with the Central Powers - whatever the price. #100yearsago	prchovanec	3	1	1515248585	949647511731437568	https://twitter.com/prchovanec/status/949647511731437568		#100yearsago	
	1. As we enter 1918, the war's crisis moment is rapidly approaching, though few fully appreciate it. #100yearsago	prchovanec	20	8	1515248339	949646483690803200	https://twitter.com/prchovanec/status/949646483690803200		#100yearsago	
	Jan 6, 1918 - The Bolsheviks have demobilized the Russian army. Ludendorff holds all the cards, and knows it. Lenin doesn't care, really, believes that if he secures peace (at any price), his success will trigger a revolution in Germany and elsewhere anyway. #100yearsago https:// twitter.com/GnlLudendorff/ status/949645113294192641 …	prchovanec	3	3	1515248169	949645767672725504	https://twitter.com/prchovanec/status/949645767672725504		#100yearsago	
	Here is how US job creation this year compares historically: pic.twitter.com/65vXdOVuKw	prchovanec	3	1	1515247954	949644865675161600	https://twitter.com/prchovanec/status/949644865675161600			
	"""Hiring has now risen for 87 straight months, the longest uninterrupted period of job expansion on record. The second longest run of job expansion—between 1986 and 1990—was only about half as long."""	prchovanec	142	24	1515247751	949644015049244674	https://twitter.com/prchovanec/status/949644015049244674			
	The US economy created 2.1 million jobs in 2017, the 7th straight year of increases exceeding 2 million. https://www. wsj.com/articles/u-s-e mployers-slow-pace-of-hiring-in-december-1515159117 …	prchovanec	9	8	1515247676	949643699952242689	https://twitter.com/prchovanec/status/949643699952242689			
	SEC is investigating Kushner companies over use of EB-5 visa program to attract investors from China https://www. wsj.com/articles/sec-l ooks-into-kushner-cos-use-of-eb-5-program-for-immigrant-investors-1515240181 …	prchovanec	82	61	1515247567	949643244035543040	https://twitter.com/prchovanec/status/949643244035543040			
	US factory orders rose +1.3% m/m in November, up +8.0% y/y. Solid rebound from the slump of that past two years. pic.twitter.com/S31458kbgO	prchovanec	4	1	1515246949	949640653104996352	https://twitter.com/prchovanec/status/949640653104996352			
	Not sure, but the Kasserine Pass is on the itinerary.	prchovanec	3	0	1515246586	949639128232136705	https://twitter.com/prchovanec/status/949639128232136705			
	There is a line that divides China from SW to NE. On one side lies 64% of its land mass, but only 4% of its population. http://www. sixthtone.com/news/1001498/t he-enduring-legacy-of-the-line-between-two-chinas …	prchovanec	7	11	1515246528	949638884408942592	https://twitter.com/prchovanec/status/949638884408942592			
	"I'm reading ""Carthage Must Be Destroyed"" by Richard Miles. Any guesses on where I'll be this time next week? https://www. amazon.com/Carthage-Must- Be-Destroyed-Civilization/dp/0143121294/ref=sr_1_1?ie=UTF8&qid=1515246258&sr=8-1&keywords=carthage+must+be+destroyed …"	prchovanec	11	2	1515246270	949637802697871360	https://twitter.com/prchovanec/status/949637802697871360			
	Naw, he's a stable genius. He said so himself, this morning.	prchovanec	1	0	1515245712	949635461521305601	https://twitter.com/prchovanec/status/949635461521305601			
	They said this sometimes about @JonahNRO , but never @realDonaldTrump . https:// twitter.com/JonahNRO/statu s/949632124679806976 …	prchovanec	7	0	1515245480	949634491945013250	https://twitter.com/prchovanec/status/949634491945013250			@JonahNRO @realDonaldTrump
	This is not how you characterized Bannon's departure at the time. When were you lying, then or now? https:// twitter.com/realDonaldTrum p/status/949498795074736129 …	prchovanec	14	3	1515245420	949634239728898048	https://twitter.com/prchovanec/status/949634239728898048			
	"But yes, when the ""highest since July"" shows 39% approving and 55% disapproving, that's in the toilet - despite a really strong economy that should be making him quite popular."	prchovanec	0	0	1515245320	949633817714806784	https://twitter.com/prchovanec/status/949633817714806784			
	Creative destruction.	prchovanec	0	0	1515244897	949632045583618049	https://twitter.com/prchovanec/status/949632045583618049			
	That sounds very stable. https:// twitter.com/reuters/status /949629143108538370 …	prchovanec	7	0	1515244445	949630147367497728	https://twitter.com/prchovanec/status/949630147367497728			
	Um, you kind of did (see last sentence) https:// twitter.com/joeconchatv/st atus/949625585378234368 …	prchovanec	0	0	1515244374	949629851958370305	https://twitter.com/prchovanec/status/949629851958370305			
	"""Not doing any homework"" lol, watching the economy and traveling and talking to people around the world (including trouble spots) is my job. I'm doing plenty of homework."	prchovanec	0	0	1515244272	949629424227569664	https://twitter.com/prchovanec/status/949629424227569664			
	The Iran protests have very little to do with us either way. North and South Korea have talked for years - anyone who follows the issue knows this. ISIS - good job, fingers crossed, but the outcome is complex and I wouldn't be running any victory laps.	prchovanec	0	0	1515244024	949628381318074368	https://twitter.com/prchovanec/status/949628381318074368			
	But the attempt to dismiss my views as partisan ... on that basis, I should be in this president's cheering section. I'm not.	prchovanec	0	0	1515243890	949627822577995782	https://twitter.com/prchovanec/status/949627822577995782			
	No, not everything else is noise. That's why Trump's ratings are still in the toilet, despite an economy that should have them riding sky high. Other things do matter - including the things I'm talking about.	prchovanec	0	0	1515243758	949627265901613056	https://twitter.com/prchovanec/status/949627265901613056			
	I certainly see the cumulative impact starting to take hold on my frequent trips overseas. Not that it's ever a love fest for every US president (it's not) but this feels quite different.	prchovanec	0	0	1515243660	949626858055831552	https://twitter.com/prchovanec/status/949626858055831552			
	And objectively? I think have an unfit president, and that it eventually will have serious implications. We have avoided them so far, fortunately, but the impact can be either sudden or cumulative.	prchovanec	1	1	1515243516	949626251408441344	https://twitter.com/prchovanec/status/949626251408441344			
	I'm a conservative Republicans, actually. But yes, the course of the economy will definitely have an impact on Trump's fate.	prchovanec	0	0	1515243415	949625829809639424	https://twitter.com/prchovanec/status/949625829809639424			
	"For the moment, we are awash in a world of ""opinion"", as Plato would term it. Anyone can have one. But opinion alone can't shape events. They are inevitably molded by truth, despite ourselves."	prchovanec	0	0	1515243302	949625353466728448	https://twitter.com/prchovanec/status/949625353466728448			
	For some. But in the end, reality takes a toll. And I'm not really talking about what's in the book here, but what is evident for all to see, on a daily basis.	prchovanec	0	0	1515243152	949624727869579265	https://twitter.com/prchovanec/status/949624727869579265			
	"I'm reading ""The Court and the World"" by Justice Stephen Breyer, about different international issues before the US Supreme Court. Very interesting! https://www. amazon.com/Court-World-Am erican-Global-Realities/dp/1101912073/ref=sr_1_1?ie=UTF8&qid=1515212549&sr=8-1&keywords=the+court+and+the+world …"	prchovanec	1	0	1515212620	949496663487537152	https://twitter.com/prchovanec/status/949496663487537152			
	It's a survey of businesses.	prchovanec	0	0	1515212284	949495255866511360	https://twitter.com/prchovanec/status/949495255866511360			
	Indirectly. #1 they're different surveys (though should be consistent, longer term), #2 it depends on the labor participation rate.	prchovanec	1	0	1515211883	949493574143488000	https://twitter.com/prchovanec/status/949493574143488000		#1 #2	
	We're playing with fire, is what we're doing, and pretending it's the normal give and take of political debate.	prchovanec	1	0	1515211448	949491750963503104	https://twitter.com/prchovanec/status/949491750963503104			
	This is my feeling about the US political scene right now, at a very basic level. It's all a game, until it's not anymore. https:// twitter.com/prchovanec/sta tus/949490094783770624 …	prchovanec	18	4	1515211278	949491036799295488	https://twitter.com/prchovanec/status/949491036799295488			
	He did the same at the Cabinet meeting where they all praised him. It was odd.	prchovanec	1	1	1515211103	949490300992589826	https://twitter.com/prchovanec/status/949490300992589826			
	Right now this is all like a reality TV show, people can just root for whoever they want and go about their lives. But it isn't a TV show. I fear someday that will become horribly evident.	prchovanec	18	2	1515211053	949490094783770624	https://twitter.com/prchovanec/status/949490094783770624			
	Honestly, I think it depends on how dangerous the situation gets, and the practical fallout. We haven't really had to have any real world consequences yet.	prchovanec	3	0	1515210839	949489195982184450	https://twitter.com/prchovanec/status/949489195982184450			
	Nixon used to say Americans wanted to know their president isn't a crook. They also want to know he's not a lunatic. Trump's been acting like a lunatic, and even a lot of his supporters can see that.	prchovanec	22	4	1515210640	949488359377956864	https://twitter.com/prchovanec/status/949488359377956864			
	It also hardens those who are already opposed, deepens their convictions.	prchovanec	2	0	1515210506	949487797278334976	https://twitter.com/prchovanec/status/949487797278334976			
	I'd argue it is direct and it operates much like Trump's belittling nicknames, not on a rational level but subtly changing how people approach and think about the personalities involved. It (and the kooky tweets) damages his image.	prchovanec	14	0	1515210415	949487416464822273	https://twitter.com/prchovanec/status/949487416464822273			
	"Perhaps more immediately, it undercuts a momentum that was developing in Trump's favor after the tax cut bill passed, which caused many Republicans to rationalize him as ""not that abnormal after all""."	prchovanec	0	0	1515210047	949485872797437954	https://twitter.com/prchovanec/status/949485872797437954			
	And, of course, it drives home the reality of who Trump is, a reality that will have a profound impact regardless of polls or what anyone wants to believe.	prchovanec	11	0	1515209953	949485478251782144	https://twitter.com/prchovanec/status/949485478251782144			
	I disagree. It may not move votes or polls per se, but it's part of a cumulative drip drip that gradually changes the conversation.	prchovanec	21	3	1515209853	949485058024337410	https://twitter.com/prchovanec/status/949485058024337410			
	I don't think this is the way to understand it, though I also doubt it will shift the polls. It changes the conversation. And the conversation eventually takes its toll.	prchovanec	0	0	1515209763	949484683980627968	https://twitter.com/prchovanec/status/949484683980627968			
	I think everyone liked it better when he just stood there and did splits. https:// twitter.com/wetheunicorns/ status/949297972986163200 …	prchovanec	5	0	1515209377	949483065394581505	https://twitter.com/prchovanec/status/949483065394581505			
	"After this week, ""That's nuts, they wouldn't do that"" just isn't a valid presumptive defense for any accusation against Trump & Co."	prchovanec	17	0	1515209046	949481673359577088	https://twitter.com/prchovanec/status/949481673359577088			
	Hang in there. There are many like yourself.	prchovanec	10	1	1515208503	949479396322267136	https://twitter.com/prchovanec/status/949479396322267136			
	Yeah, that's not going to make things better. https:// twitter.com/SCMP_News/stat us/949478137238315008 …	prchovanec	8	0	1515208292	949478514142728192	https://twitter.com/prchovanec/status/949478514142728192			
	pic.twitter.com/lgr6xfBc73	prchovanec	11	1	1515208002	949477296318156800	https://twitter.com/prchovanec/status/949477296318156800			
	Jan 5, 1918 - Allies aren't buying the peace terms being floated by Central Powers (and a defeated Russia) at Brest-Litovsk #100yearsago https:// twitter.com/revoltingrussi a/status/949128320972541953 …	prchovanec	2	1	1515207763	949476292180828160	https://twitter.com/prchovanec/status/949476292180828160		#100yearsago	
	Jan 5, 1918 - Western Mail: Russians aren't falling for the Germans' peace trap #100yearsago pic.twitter.com/ZdKnlcliqP	prchovanec	5	1	1515207141	949473685647355904	https://twitter.com/prchovanec/status/949473685647355904		#100yearsago	
	Jan 5, 1918 - New York Times: Germans force back four British outposts near Cambrai, in northern France #100yearsago pic.twitter.com/NVI7qY4z9T	prchovanec	1	0	1515207000	949473092706979841	https://twitter.com/prchovanec/status/949473092706979841		#100yearsago	
	January 1918 - View from a German airplane based near the Western Front #100yearsago pic.twitter.com/Xx3RBmQqR4	prchovanec	6	4	1515206947	949472869943250945	https://twitter.com/prchovanec/status/949472869943250945		#100yearsago	
	January 1918 - German airbase on the Western Front #100yearsago pic.twitter.com/XhGlpGfBxC	prchovanec	3	1	1515206900	949472673268228096	https://twitter.com/prchovanec/status/949472673268228096		#100yearsago	
	Jan 5, 1918 - New York Times: US troops in France intensify their training #100yearsago pic.twitter.com/0d4kcNzTHG	prchovanec	1	0	1515206638	949471576042373120	https://twitter.com/prchovanec/status/949471576042373120		#100yearsago	
	Jan 5, 1918 - New York Times: Artillery is active on the Italian Front #100yearsago pic.twitter.com/nPQIqdiju5	prchovanec	1	0	1515206578	949471323838996480	https://twitter.com/prchovanec/status/949471323838996480		#100yearsago	
	Gee, wonder why. https:// qz.com/1170310/mitt-r omney-and-orrin-hatch-are-trending-among-russian-trolls-and-bots/ …	prchovanec	4	0	1515206522	949471087611596800	https://twitter.com/prchovanec/status/949471087611596800			
	Another Himalayan border conflict between China and India. https://www. express.co.uk/news/world/900 631/China-india-dispute-territory-Arunachal-Pradesh-road-builders-troops-standoff …	prchovanec	0	0	1515206309	949470194342223872	https://twitter.com/prchovanec/status/949470194342223872			
	Airbus in talks to sell at least 100 passenger jets to China https://www. reuters.com/article/us-air bus-china/airbus-in-talks-to-sell-at-least-100-jets-to-china-sources-idUSKBN1EU1C5 …	prchovanec	0	0	1515206255	949469969225584641	https://twitter.com/prchovanec/status/949469969225584641			
bitcoin 	China reins in power supply to bitcoin miners https:// qz.com/1172632/chinas -dominance-in-bitcoin-mining-under-threat-as-regulators-hit-where-it-hurts-electricity/ …	prchovanec	8	3	1515206209	949469775402602496	https://twitter.com/prchovanec/status/949469775402602496			
	People in China are walking off with pieces from the world's first solar panel-paved highway https:// techcrunch.com/2018/01/05/som eone-stole-a-piece-of-chinas-new-solar-panel-paved-road-less-than-a-week-after-it-opened/ …	prchovanec	4	3	1515206136	949469467926556674	https://twitter.com/prchovanec/status/949469467926556674			
