	"Speaking of the ""Hand of Fatima"", here are some last images from my first day in Tunis, when it looked like it might rain on me all week. pic.twitter.com/Srvepvk20Z"	prchovanec	5	2	1516348528	954261010109620224	https://twitter.com/prchovanec/status/954261010109620224			
	"The ""hamsa"" is also called ""The Hand of Fatima"" (the prophet Muhammed's daughter) and thus there's also a link to the Fatimid Caliphate, which originated in Tunisia. (Restaurant in Hammamet, Tunisia) pic.twitter.com/ufBSAs62gd"	prchovanec	7	2	1516348151	954259427376467968	https://twitter.com/prchovanec/status/954259427376467968			
	"The ""hamsa"" (seen here in ceramic wall tiles in Sidi Bou Said) is a common symbol seen across Tunisia. It represents the important Islamic number five (5 daily prayers, 5 duties of Islam) but may have much older origins. pic.twitter.com/7cHT4pLjTB"	prchovanec	12	3	1516347904	954258390741635072	https://twitter.com/prchovanec/status/954258390741635072			
	The windows of my hotel room in Sidi Bou Said, Tunisia, where I am tweeting this right now, as I prepare to pack for my flight home. pic.twitter.com/3g5C4ahrPb	prchovanec	38	3	1516347576	954257017878827008	https://twitter.com/prchovanec/status/954257017878827008			
	A cat in Sidi Bou Said, Tunisia. Can you find him? pic.twitter.com/HVlrgWqjdw	prchovanec	24	4	1516347443	954256456102109184	https://twitter.com/prchovanec/status/954256456102109184			
	Sunset over the Mediterranean Sea at Sidi Bou Said, Tunisia pic.twitter.com/pYJ7gG7CD6	prchovanec	16	4	1516347391	954256239961300992	https://twitter.com/prchovanec/status/954256239961300992			
	One of my most enduring memories of driving through Tunisia will be the beat-up old Peugot mini-trucks, like this one in Bizerte. pic.twitter.com/jE3dFDUJr4	prchovanec	4	0	1516347216	954255505911963649	https://twitter.com/prchovanec/status/954255505911963649			
	For another perspective on life in Bizerte, Tunisia check out this documentary: https://www. youtube.com/watch?v=iAAo9x YCC-A …	prchovanec	4	0	1516347098	954255011311181824	https://twitter.com/prchovanec/status/954255011311181824			
	Spanish fort overlooking Bizerte, on the north coast of Tunisia, built by the troops of Holy Roman Emperor Charles V who briefly occupied the city in 1535. pic.twitter.com/Q8Lki9pvX2	prchovanec	14	4	1516346900	954254180402847744	https://twitter.com/prchovanec/status/954254180402847744			
	Impressions of Bizerte's old city, on the north coast of Tunisia. This is far from the normal tourist paths, it's the streets where people really live. pic.twitter.com/T1yehEKnHx	prchovanec	16	4	1516346712	954253392360198144	https://twitter.com/prchovanec/status/954253392360198144			
	"The city of Bizerte, on Tunisia's north coast, is built around its ""old port"" pic.twitter.com/nH6jB5oW91"	prchovanec	35	14	1516346401	954252089689018368	https://twitter.com/prchovanec/status/954252089689018368			
	Utica was actually an older Phoenician settlement than Carthage. Here is a Punic tomb and sacrifice area dating from that early period. pic.twitter.com/CQlm9LKyPV	prchovanec	7	0	1516345981	954250327884271616	https://twitter.com/prchovanec/status/954250327884271616			
	The ruins of Utica, which superseded Carthage as the capital of Rome's Africa Province, because it lay (at the time) at the mouth of the Bagrada (Medjerda) River, the conduit to Tunisia's big wheat-growing region. pic.twitter.com/QsWS0X3eh5	prchovanec	19	9	1516345767	954249427656601600	https://twitter.com/prchovanec/status/954249427656601600			
	"""I've seen this raw strength only once before. It didn’t scare me enough then. It does now."" pic.twitter.com/NPlQOSwJN0"	prchovanec	10	1	1516345490	954248264550965250	https://twitter.com/prchovanec/status/954248264550965250			
	I just realized who Kylo Ren's new role model is, after smashing his Vader mask. pic.twitter.com/hgbTkuxNvw	prchovanec	22	9	1516345096	954246616118153216	https://twitter.com/prchovanec/status/954246616118153216			
	Who needs defense attorneys when there’s Hannity to make pesky prosecutors go away? https:// twitter.com/goangelo/statu s/954181921277399041 …	prchovanec	16	3	1516330108	954183748014301184	https://twitter.com/prchovanec/status/954183748014301184			
	You’d be amazed at how many otherwise informed people don’t seem to understand how and why “adoption” is obvious code for “Magnitsky sanctions”.	prchovanec	8	5	1516329987	954183242181238784	https://twitter.com/prchovanec/status/954183242181238784			
	Proceeds to go towards ... ? https:// twitter.com/jenniferjjacob s/status/954181027995570177 …	prchovanec	6	3	1516329713	954182092954439680	https://twitter.com/prchovanec/status/954182092954439680			
	"I've seen this argument recently too, and I'm glad my skepticism is shared. I don't doubt China's GDP did bounce upwards this year (for all the wrong reasons) but I don't think the ""inaccuracies"" all average out in the end. https:// twitter.com/BaldingsWorld/ status/954174223261421568 …"	prchovanec	6	1	1516328573	954177312437821441	https://twitter.com/prchovanec/status/954177312437821441			
	All I can say is that people really need to be careful because the IRS does not look kindly on this and there's a reason it's (in most cases) accurately being called tax evasion (illegal), not tax avoidance (legal). https:// twitter.com/taramfrancis/s tatus/954175862433173504 …	prchovanec	5	1	1516328461	954176840842825733	https://twitter.com/prchovanec/status/954176840842825733			
	"This is a carob tree. Its beans all weigh the same, so it was used as a standard measure for weight. That's how we get the word ""carat"" for gemstones. Carthage, Tunisia pic.twitter.com/UAJucjPGa1"	prchovanec	62	16	1516328182	954175669856063488	https://twitter.com/prchovanec/status/954175669856063488			
	I'm sorry, I found a mistake. Correcting now.	prchovanec	0	0	1516328100	954175329257521152	https://twitter.com/prchovanec/status/954175329257521152			
	BTW, here's some aerial views of the twin harbors at Carthage then (left) and now (right), from a similar perspective: pic.twitter.com/CeXul2Skec	prchovanec	378	127	1516327691	954173611790696453	https://twitter.com/prchovanec/status/954173611790696453			
	"I like the fact that he's talking on his cell phone: ""I have the cleaver, but she's behind a glass window. What do I do now? This isn't going like we thought."" https:// twitter.com/Crazyinnasia/s tatus/954172419731787776 …"	prchovanec	3	1	1516327630	954173354814164992	https://twitter.com/prchovanec/status/954173354814164992			
	Got it right here with me.	prchovanec	3	0	1516327477	954172714293583873	https://twitter.com/prchovanec/status/954172714293583873			
	I'm going to have to start doing that, and something for foot blisters needs to be at the top of the list. I got on in Lithuania and (cuz I just bought new sneakers) I've been flirting with several this whole trip.	prchovanec	1	0	1516326491	954168577497731072	https://twitter.com/prchovanec/status/954168577497731072			
	I'm just happy to be able to eat again after something I consumed made that nearly impossible for the past several days. Yes, I've been driving around with fever, chills, and stomach cramps since Sfax.	prchovanec	3	0	1516324965	954162180118675457	https://twitter.com/prchovanec/status/954162180118675457			
	"Ha, I originally called this ""blok"" but then people corrected me. But hey, brik is a kind of blok, right?"	prchovanec	3	0	1516324930	954162033708224512	https://twitter.com/prchovanec/status/954162033708224512			
	"Tonight's dinner was ""brik"", a kind of flaky pastry stuffed either with seafood, tuna, or - in my case - with lamb, herbs, and a fried egg, served at a sidewalk cafe in Sidi Bou Said (just next to Carthage), Tunisia. pic.twitter.com/hP4PtxvmI9"	prchovanec	15	1	1516324887	954161850261950464	https://twitter.com/prchovanec/status/954161850261950464			
	"For a long time, after ""the German custom"" was long forgotten, this Papal Bull was misinterpreted as a prohibition on human dissection - and ended up holding back medical and anatomical research in Europe, for fear of church punishment."	prchovanec	48	11	1516324255	954159200627757056	https://twitter.com/prchovanec/status/954159200627757056			
	"Pope Boniface VIII didn't like ""the German practice"" at all and issued a Papal Bull in 1300 called ""De Sepulturis"" forbidding it."	prchovanec	23	6	1516324046	954158325654020099	https://twitter.com/prchovanec/status/954158325654020099			
	So King Louis was boiled down in Carthage and his bones were brought back to France to be buried in St. Denis Cathedral (just north of Paris) with all the other French kings. After he was canonized a saint, they distributed some of those bones as relics.	prchovanec	19	3	1516323918	954157787566747655	https://twitter.com/prchovanec/status/954157787566747655			
	"So German crusaders, in particular, started to adopt another practice: boiling the flesh off the bones (in water or wine), and bringing the bones back home. This became known as ""mos Teutonicus"", or ""the German custom""."	prchovanec	31	11	1516323810	954157332124008453	https://twitter.com/prchovanec/status/954157332124008453			
	Apparently high-ranking crusaders didn't hold with the idea of being buried in non-Christian lands, but neither was it practical for their bodies to be brought home intact.	prchovanec	19	5	1516323701	954156877696335876	https://twitter.com/prchovanec/status/954156877696335876			
	It's there because Saint Louis (King Louis IX of France) attempted to conquer Tunis on the Eighth Crusade, in 1270 AD, with his army camped on the ruins of Carthage, but promptly got sick and died there. pic.twitter.com/pHMsxIMETD	prchovanec	24	6	1516323424	954155714896941057	https://twitter.com/prchovanec/status/954155714896941057			
	So then why is there a French cathedral on top of Carthage's Byrsa Hill, named after Saint Louis? pic.twitter.com/VV9QdQdyPJ	prchovanec	18	8	1516323239	954154938157985794	https://twitter.com/prchovanec/status/954154938157985794			
	In fact, right next to her head is a portrayal of the construction of the Roman Forum atop Carthage's Byrsa Hill, covering up the Punic ruins beneath. pic.twitter.com/nptVMH3gqc	prchovanec	16	3	1516323049	954154142330650624	https://twitter.com/prchovanec/status/954154142330650624			
	And here's a huge head of a princess from the Roman imperial family, displayed that same museum in Carthage, Tunisia. pic.twitter.com/ESPyNCnxUt	prchovanec	24	4	1516322963	954153782388117505	https://twitter.com/prchovanec/status/954153782388117505			
	Here are two residents of Roman Carthage, from the museum atop Byrsa Hill: funerary statues of a charioteer and his wife. pic.twitter.com/Ou2WctCa4D	prchovanec	25	3	1516322871	954153396352770052	https://twitter.com/prchovanec/status/954153396352770052			
	If you recall, I saw the aqueduct that supplied these baths from the distant mountain spring to the south at Zaghouan earlier in my trip. https:// twitter.com/prchovanec/sta tus/952213874643783680 …	prchovanec	27	3	1516322742	954152854452875265	https://twitter.com/prchovanec/status/954152854452875265			
	"But the idea of child sacrifice to Phoenician gods certainly resonates with the Biblical story of Abraham & Isaac. And the word ""tophet"" in the Bible refers to a place in Jerusalem where worshipers of Canaanite gods Ba'al & Moluch sacrificed children by burning them alive pic.twitter.com/rhkI8vmCNA"	prchovanec	30	8	1516322130	954150287740227586	https://twitter.com/prchovanec/status/954150287740227586			
	Some modern scholars say this is a slander or misunderstanding. They argue that, in truth, the Carthaginians dedicated the remains of children who had already died to their gods, sacrificing an animal as part of that ritual. pic.twitter.com/KR2kNPvBu4	prchovanec	29	5	1516321904	954149341240979458	https://twitter.com/prchovanec/status/954149341240979458			
	One of the most debated aspects of Punic Carthage is whether Carthaginian parents ever sacrificed their own children to Tanit and Ba'al, leaving these stones as memorials of those human sacrifices. The Romans claimed unambiguously that they did. pic.twitter.com/OJe9GVtXVa	prchovanec	36	10	1516321696	954148465692631042	https://twitter.com/prchovanec/status/954148465692631042			
	This is the Tophet, a sacred place of ritual sacrifice near Carthage's twin harbors. The stele are memorials of those sacrifices. pic.twitter.com/4TjpTpy8b3	prchovanec	35	7	1516321493	954147614403936256	https://twitter.com/prchovanec/status/954147614403936256			
	Now, back to the goddess Tanit. Remember how I said she was as bloodthirsty as her lion-headed figure suggests? https:// twitter.com/prchovanec/sta tus/954130063729053697 …	prchovanec	24	7	1516321263	954146649592549377	https://twitter.com/prchovanec/status/954146649592549377			
	There are probably a lot more ruins of ancient Carthage buried under the chic Magon Quarter, but we won't find out anytime soon, unless someone is willing to tear down these expensive modern villas. pic.twitter.com/9beHYcALEC	prchovanec	28	5	1516321157	954146204748828673	https://twitter.com/prchovanec/status/954146204748828673			
	Remains of the city walls of ancient Carthage, next to the sea. pic.twitter.com/3U0psmT4F2	prchovanec	31	7	1516320879	954145039017500672	https://twitter.com/prchovanec/status/954145039017500672			
	Here's a view of that same Carthaginian street from atop Byrsa Hill, looking down where you can just see the city's two joined harbors to the left. pic.twitter.com/nkKoEvpzOz	prchovanec	39	4	1516320686	954144231236489217	https://twitter.com/prchovanec/status/954144231236489217			
	Here are some of the houses the Romans must have fought their way past: a Carthaginian street found buried beneath the later Roman Forum built atop Byrsa Hill. pic.twitter.com/6bbhmH6QHC	prchovanec	53	10	1516320512	954143502593609728	https://twitter.com/prchovanec/status/954143502593609728			
	It was through these two harbors that the Roman general Scipio Aemilianus was able to break through Carthage's last defenses in 146 BC, his troops fighting their way house by house up Byrsa Hill. pic.twitter.com/73ZjSu49KY	prchovanec	41	11	1516320256	954142427585105920	https://twitter.com/prchovanec/status/954142427585105920			
	Local Tunisians doing some fishing in ancient Carthage's commercial port, just next to its circular naval base. pic.twitter.com/9hTy8C5dYP	prchovanec	30	5	1516320013	954141410223165442	https://twitter.com/prchovanec/status/954141410223165442			
	Here is Carthage's circular naval port looking in the opposite direction (from the appropriately named Hannibal Street) towards Byrsa Hill in the distance, now topped by a French-built cathedral. pic.twitter.com/u3Qbd4xjby	prchovanec	39	11	1516319844	954140697606737922	https://twitter.com/prchovanec/status/954140697606737922			
	Here are the remains of Carthage's circular naval port, which had sheds ringing both the outside and the island in the center holding 300+ warships ready to go at a moment's notice. pic.twitter.com/DThSgw0INo	prchovanec	54	14	1516319641	954139847433781248	https://twitter.com/prchovanec/status/954139847433781248			
	Punic Carthage had four notable features: a outside commercial port, which led to a circular interior military port, Byrsa Hill - topped by the temple to the Phoenician god Eshmun - and the city walls. pic.twitter.com/SidCNMZ1Ck	prchovanec	478	191	1516319306	954138444976009216	https://twitter.com/prchovanec/status/954138444976009216			
	The appearance of control the Chinese government is able to convey - and have largely accepted - is nothing short of astonishing. (In case anyone is wondering, I say this as a profound skeptic that such control is real). https:// twitter.com/9DashLine/stat us/954132795928076288 …	prchovanec	6	2	1516318582	954135407108722690	https://twitter.com/prchovanec/status/954135407108722690			
	Some road signs just say it all. Carthage, Tunisia pic.twitter.com/ovB7hLi8nX	prchovanec	13	0	1516318460	954134896678711297	https://twitter.com/prchovanec/status/954134896678711297			
	The symbol of the Phoenician goddess Tanit, in a doorway at Kerkouane, Tunisia, and a statue of her lion-headed image form in a nearby museum. Tanit, along with her consort Ba'al Hammon, were two of the leading gods of Carthage. And like a lion, she hungered for blood. pic.twitter.com/hKkW9PIxqo	prchovanec	12	2	1516317308	954130063729053697	https://twitter.com/prchovanec/status/954130063729053697			
	The ruins at Kerkouane, on Tunisia's Cap Bon, are rare in that they are Punic (Phoenician/Carthaginian), not built over in the later Roman period. Note how Punic mosaics have a polka-dot style. pic.twitter.com/zK9Ak4drCB	prchovanec	25	5	1516317061	954129026431508480	https://twitter.com/prchovanec/status/954129026431508480			
	US 10 year Government bond yields weekly close at 2.6592 breaks multi decade downtrend	Sunchartist	8	7	1516399483	954474729494126592	https://twitter.com/Sunchartist/status/954474729494126592			
	Crowded trades WTI is the new carry trade (backwardation) Euro is the new growth story Curve flattening cos rates will never go up in long term as inflation is dead Volatility will never go up cos central banks	Sunchartist	34	15	1516399355	954474192568647680	https://twitter.com/Sunchartist/status/954474192568647680			
	Yup pic.twitter.com/sCCGRmUs9J	Sunchartist	3	0	1516398816	954471932434423808	https://twitter.com/Sunchartist/status/954471932434423808			
	If Amazon raising prime is equivalent to doing Fed's job. Then who is doing God's work in finance now?	Sunchartist	2	0	1516397796	954467652335845376	https://twitter.com/Sunchartist/status/954467652335845376			
	Aren't Crypto supposed to rally because of government shutdown?	Sunchartist	4	0	1516396991	954464277586354176	https://twitter.com/Sunchartist/status/954464277586354176			
	So another 50 bps drop in yields https:// twitter.com/antbarton89/st atus/954460184419631106 …	Sunchartist	1	0	1516396123	954460635948969984	https://twitter.com/Sunchartist/status/954460635948969984			
	VIX commercial have cut their longs faster than VIX Shorts. I guess commercial capitulation came fast and furious	Sunchartist	1	0	1516395872	954459584369848321	https://twitter.com/Sunchartist/status/954459584369848321			
bitcoin 	Not Bitcoin Nymex non commercial postioning pic.twitter.com/zEQ1PYd3gC	Sunchartist	3	0	1516395562	954458284005535745	https://twitter.com/Sunchartist/status/954458284005535745			
	Copper non commercial postioning it is FED equivalent of tapering pic.twitter.com/53gIxC4mVS	Sunchartist	1	0	1516395496	954458005352824832	https://twitter.com/Sunchartist/status/954458005352824832			
	Money managers have increased their bullish Nymex WTI crude oil bets by 44,528 net-long positions to 482,298	Sunchartist	2	1	1516394793	954455058321518592	https://twitter.com/Sunchartist/status/954455058321518592			
	VIX Non commercial of total OI is rising sharply pic.twitter.com/7z22hZOv6d	Sunchartist	3	0	1516394689	954454620666961920	https://twitter.com/Sunchartist/status/954454620666961920			
	Record shorts in 5 year Treasury futures pic.twitter.com/qjg8PaBiTw	Sunchartist	13	3	1516394582	954454171926736896	https://twitter.com/Sunchartist/status/954454171926736896			
	Otherwise ducks are lining up	Sunchartist	1	0	1516394272	954452871637946368	https://twitter.com/Sunchartist/status/954452871637946368			
	A meeting too comment on VIX & SPX correlation. While it is unsettling & indicates it does not add up It is perhaps more relevant to look at credit spreads, implied correlation & realised Vol. for a trouble ahead. The missing bit is implied correlation	Sunchartist	1	0	1516394269	954452862146306048	https://twitter.com/Sunchartist/status/954452862146306048			
	Thank you very much	Sunchartist	1	0	1516393069	954447826674528257	https://twitter.com/Sunchartist/status/954447826674528257			
	Thank you very much	Sunchartist	2	0	1516393023	954447636165115904	https://twitter.com/Sunchartist/status/954447636165115904			
	Riddle me this Why is Utilities & REIT Indices green when bonds are breaking key resistance	Sunchartist	3	0	1516374323	954369199127912448	https://twitter.com/Sunchartist/status/954369199127912448			
	HNA Issues products pays 9.5% IRR (39% yield) to its employees pic.twitter.com/GHA7XtfU4r	Sunchartist	4	0	1516370752	954354223868657666	https://twitter.com/Sunchartist/status/954354223868657666			
	HNA 6.25% 2021 price pic.twitter.com/KBzP3voQQy	Sunchartist	3	0	1516370456	954352980249100288	https://twitter.com/Sunchartist/status/954352980249100288			
	HNA 2018 BOND YIELDS pic.twitter.com/ZI7feN2CQL	Sunchartist	4	1	1516370381	954352665412038656	https://twitter.com/Sunchartist/status/954352665412038656			
	Mr Cantoni thank you very much have a great week	Sunchartist	2	0	1516370099	954351484455366657	https://twitter.com/Sunchartist/status/954351484455366657			
bitcoin 	Mugging old fashioned way Bitcoin trader lured to bogus meeting and robbed of HK$1.4 million https:// sc.mp/2mNsPRK	Sunchartist	1	2	1516366127	954334823069306882	https://twitter.com/Sunchartist/status/954334823069306882			
	#Contrarian pic.twitter.com/K5Q0W276Jw	Sunchartist	3	1	1516365830	954333579776991232	https://twitter.com/Sunchartist/status/954333579776991232		#Contrarian	
	Having said that there is virtually zero liquidity in INR	Sunchartist	2	0	1516359549	954307234833432576	https://twitter.com/Sunchartist/status/954307234833432576			
	USDINR NIFTY Seems one is right	Sunchartist	1	0	1516359514	954307087059709952	https://twitter.com/Sunchartist/status/954307087059709952			
	*U.K. DEC. RETAIL SALES FALL 1.5%; FORECAST 1% DECLINE	Sunchartist	1	0	1516354281	954285139982303232	https://twitter.com/Sunchartist/status/954285139982303232			
	*BOJ IS SAID OPTIMISTIC TO HIT 2% INFLATION TARGET IN 2 YRS: WSJ pic.twitter.com/UuxJYF0dF3	Sunchartist	15	7	1516352027	954275683777130496	https://twitter.com/Sunchartist/status/954275683777130496			
	Nifty Midcap 50 red	Sunchartist	1	0	1516350455	954269090431905792	https://twitter.com/Sunchartist/status/954269090431905792			
	Profound words pic.twitter.com/XW7xFd6fPQ	Sunchartist	5	0	1516349981	954267104827461633	https://twitter.com/Sunchartist/status/954267104827461633			
	USDTWD low matches 2 October 2013 pic.twitter.com/jOtTI5da0j	Sunchartist	3	2	1516347739	954257700942102528	https://twitter.com/Sunchartist/status/954257700942102528			
	Bunds at critical resistance pic.twitter.com/vK0EHotQZg	Sunchartist	4	4	1516346927	954254294248603650	https://twitter.com/Sunchartist/status/954254294248603650			
	A morden word for caged home of 1960's https:// twitter.com/scmp_news/stat us/954232114358243328 …	Sunchartist	2	0	1516341778	954232698146455553	https://twitter.com/Sunchartist/status/954232698146455553			
	S&P 12 month gross yield & Barclays US HY yield to worst pic.twitter.com/n4mIfiOmaC	Sunchartist	5	3	1516341536	954231680402833410	https://twitter.com/Sunchartist/status/954231680402833410			
	Barclays HY yield to worst VIX CBOE SPX Implied correlation pic.twitter.com/bOn2ai9yXm	Sunchartist	2	2	1516341159	954230101113159680	https://twitter.com/Sunchartist/status/954230101113159680			
	No income no tax. Guess fundamental analysis should include this https:// twitter.com/zerohedge/stat us/954102815370174464 …	Sunchartist	3	1	1516335992	954208428494221312	https://twitter.com/Sunchartist/status/954208428494221312			
	India 10 year Government bond yields. LOD pic.twitter.com/IZRSvzZcjE	Sunchartist	1	0	1516335202	954205115510005760	https://twitter.com/Sunchartist/status/954205115510005760			
	Nikkei red	Sunchartist	2	1	1516334375	954201645402931200	https://twitter.com/Sunchartist/status/954201645402931200			
	USDCNY pic.twitter.com/RB6i5oWWZ0	Sunchartist	6	1	1516333893	954199626839613441	https://twitter.com/Sunchartist/status/954199626839613441			
	I agree 97% of HK mortgages are liked to 1 or 3 month HIBOR which is up 3x. Over 50% of high end is sold to mainland buyers who take out leverage in China	Sunchartist	2	0	1516332832	954195174023811072	https://twitter.com/Sunchartist/status/954195174023811072			
	I am looking for 57 area on WTI	Sunchartist	0	0	1516332530	954193907633418241	https://twitter.com/Sunchartist/status/954193907633418241			
	WTI. Will speculative longs get stopped out pic.twitter.com/XIO8QjaVD5	Sunchartist	5	0	1516331863	954191109604782080	https://twitter.com/Sunchartist/status/954191109604782080			
	India successfully test-fires a nuclear-capable intercontinental ballistic missile https://www. cnbc.com/2018/01/18/ind ia-missile-new-delhi-successfully-tests-a-nuclear-capable-icbm.html …	Sunchartist	1	1	1516329284	954180294810075136	https://twitter.com/Sunchartist/status/954180294810075136			
	What would US administration say if USDCNY is sub 6.00	Sunchartist	1	0	1516327932	954174625105104896	https://twitter.com/Sunchartist/status/954174625105104896			
	USDCNY 6.3960	Sunchartist	2	0	1516326391	954168160801800193	https://twitter.com/Sunchartist/status/954168160801800193			
	and USDCNH prints < 6.40	Sunchartist	2	0	1516325909	954166137876393984	https://twitter.com/Sunchartist/status/954166137876393984			
	USDCNH 6.4040 pic.twitter.com/bEPX4gQerP	Sunchartist	7	3	1516325772	954165562816413696	https://twitter.com/Sunchartist/status/954165562816413696			
	*CHINA SETS YUAN REFERENCE RATE AT 6.4169 AGAINST U.S. DOLLAR Spot 6.4050	Sunchartist	1	0	1516325598	954164832382537728	https://twitter.com/Sunchartist/status/954164832382537728			
	*U.S. TREASURY 10-YEAR YIELD RISES TO HIGHEST LEVEL SINCE 2016 2.6330	Sunchartist	8	3	1516325365	954163854224719873	https://twitter.com/Sunchartist/status/954163854224719873			
	Brent 4 hr looks like a H&S pic.twitter.com/254WqwVykN	Sunchartist	4	1	1516324594	954160624031838208	https://twitter.com/Sunchartist/status/954160624031838208			
