ripple 	I respectfully disagree with @JoelKatz . <dramatic pause> Ripple may have plans for what it wants to accomplish with its XRP holdings, but XRP is a tool that can be used by anybody for anything. No permission necessary. https:// twitter.com/joelkatz/statu s/954195497387896832 …	haydentiff	162	37	1516340737	954228331779690497	https://twitter.com/haydentiff/status/954228331779690497			@JoelKatz
	Yep!	haydentiff	1	0	1516325084	954162677496139776	https://twitter.com/haydentiff/status/954162677496139776			
bitcoin 	Wow! It costs a lot if you wait until the last minute to purchase tickets. #TNABC #Bitcoin pic.twitter.com/rwEoZHGSFG	haydentiff	9	2	1516319201	954138001092808704	https://twitter.com/haydentiff/status/954138001092808704		#TNABC #Bitcoin	
	#beer	haydentiff	1	0	1516318455	954134872255352833	https://twitter.com/haydentiff/status/954134872255352833		#beer	
	Awesome! Happy to hear it!	haydentiff	0	0	1516317774	954132015980392454	https://twitter.com/haydentiff/status/954132015980392454			
	¯\_(ツ)_/¯ https:// twitter.com/4azmedic/statu s/954119938918232074 …	haydentiff	24	0	1516317328	954130144561639424	https://twitter.com/haydentiff/status/954130144561639424			
		haydentiff	0	0	1516317117	954129260444299264	https://twitter.com/haydentiff/status/954129260444299264			
	It was great meeting you too!	haydentiff	0	0	1516317030	954128897280487426	https://twitter.com/haydentiff/status/954128897280487426			
	Fun times at #TNABC pic.twitter.com/Go5v5Nd472	stacyherbert	21	2	1516389886	954434477735993344	https://twitter.com/stacyherbert/status/954434477735993344		#TNABC	
	Just saw a manatee! It surfaced for a moment but went back under before I could take photo. You can see it if you look close. pic.twitter.com/dCh5c70HWi	stacyherbert	52	2	1516389437	954432593860145153	https://twitter.com/stacyherbert/status/954432593860145153			
	Hey, I know you! https:// twitter.com/anirgu/status/ 954429926186287104 …	stacyherbert	15	0	1516388866	954430200359645185	https://twitter.com/stacyherbert/status/954430200359645185			
	Who would have imagined that the Democrats would one day become the xenophobic ‘family values’ party?	stacyherbert	16	1	1516386267	954419297228677120	https://twitter.com/stacyherbert/status/954419297228677120			
	Not only have #TheResistance proven to be outright xenophobes but also prudes gossiping condescendingly about the sex lives of consenting adults.	stacyherbert	41	8	1516385006	954414007800213505	https://twitter.com/stacyherbert/status/954414007800213505		#TheResistance	
	Great to meet you! So many in town from Mexico are happy that @KeiserReport told them about crypto years ago! @JohnMAckerman https:// twitter.com/agusstinph/sta tus/954268854951215104 …	stacyherbert	37	8	1516371213	954356157941940225	https://twitter.com/stacyherbert/status/954356157941940225			@KeiserReport @JohnMAckerman
	That will be the day.	stacyherbert	0	0	1516337574	954215066034933760	https://twitter.com/stacyherbert/status/954215066034933760			
	Wow! Good job @SunnyStartups https:// twitter.com/qz/status/9541 44372265832448 …	stacyherbert	23	8	1516320794	954144683437027329	https://twitter.com/stacyherbert/status/954144683437027329			@SunnyStartups
	The power of #AI in predictive healthcare - what our faces can reveal about our health http:// bit.ly/2mRMjEG #HealthTech #MachineLearning #innovation #PredictiveAnalytics @SmithsonianMag pic.twitter.com/AghpGhkfSr	sallyeaves	98	51	1516382336	954402810908459008	https://twitter.com/sallyeaves/status/954402810908459008		#AI #HealthTech #MachineLearning #innovation #PredictiveAnalytics	@SmithsonianMag
	Likewise Kohei san - see you soon! Have a great weekend ahead everyone	sallyeaves	3	1	1516377924	954384304401821696	https://twitter.com/sallyeaves/status/954384304401821696			
	Need to log off for a bit now but just to say would be very happy to ! Feel free to get in touch, S :)	sallyeaves	2	0	1516358386	954302357080236032	https://twitter.com/sallyeaves/status/954302357080236032			
	@51ddh1 Just had to say - loving the new profile pic ! Awesome :)	sallyeaves	2	0	1516358288	954301944746590213	https://twitter.com/sallyeaves/status/954301944746590213			@51ddh1
	Always a pleasure Dinis ! :)	sallyeaves	0	0	1516358020	954300822438871041	https://twitter.com/sallyeaves/status/954300822438871041			
	Have a cracking Friday everyone! :) x	sallyeaves	6	2	1516357863	954300161877921792	https://twitter.com/sallyeaves/status/954300161877921792			
	Juggling wifi connection ironically! But just to say wholeheartedly agree with the comments on balance in this thread. Some interesting differences between formal and community education too - something close to my heart. More to talk on here :)	sallyeaves	2	0	1516357793	954299869992140805	https://twitter.com/sallyeaves/status/954299869992140805			
	Could not agree more! - really enjoyed reading a piece yesterday by @garethintra that really captures this ready for publication in @TheFutureShaper Looking forward to putting together part 2 for #Forbes soon. Fantastic #leadership here - #intrapreneurship at its best ! pic.twitter.com/uPHDwdOG1X	sallyeaves	1	0	1516357354	954298027375669249	https://twitter.com/sallyeaves/status/954298027375669249		#Forbes #leadership #intrapreneurship	@garethintra @TheFutureShaper
	Brilliant - well deserved!	sallyeaves	9	0	1516319357	954138656175869952	https://twitter.com/sallyeaves/status/954138656175869952			
bitcoin 	an interpretation of this meme is that you dont need to sell, because post hyperbitcoinization USD will barely exist. pic.twitter.com/IZqu6phvYq	adam3us	12	4	1516401372	954482654459584512	https://twitter.com/adam3us/status/954482654459584512			
bitcoin 	you really dont want to day trade bitcoin, IMO you will lose vs passively holding BTC. that's what HODL is saying basically. i talked about trades publicly and on bitcoincore slack eg #price -talk. I do those trades from a USD allocation.	adam3us	4	0	1516391857	954442742226026496	https://twitter.com/adam3us/status/954442742226026496		#price	
	it has more universal global coverage outside of GSM coverage areas is the tradeoff.	adam3us	3	0	1516391285	954440342790586369	https://twitter.com/adam3us/status/954440342790586369			
	yes I think there were a few that happened. technically funds stay on the channel but they are matched like $10 in on one channel $10 out on the other, just the funds on the channels must be sufficient. the software auto-routes through channels with sufficient funding, lowest fee	adam3us	1	0	1516391212	954440040003682306	https://twitter.com/adam3us/status/954440040003682306			
	yeah I entered a limit order at $9333. it triggered while i was sleeping. took a few mins to enter.	adam3us	3	0	1516391016	954439214577328128	https://twitter.com/adam3us/status/954439214577328128			
bitcoin 	forks present an issue for secure key management solutions like covenant based vaults (as @el33th4xor wrote about here http:// hackingdistributed.com/2016/02/26/how -to-implement-secure-bitcoin-vaults/ … ), HSMs and multisig solutions like @greenaddress & @bitgo as well as for exchanges and hardware wallets @trezor @LedgerHQ	adam3us	7	1	1516390962	954438989984886784	https://twitter.com/adam3us/status/954438989984886784			@el33th4xor @greenaddress @bitgo @trezor @LedgerHQ
bitcoin 	i buy dips & keep profits in BTC, with a dollar allocation. mostly I am doing cold BTC storage long term HODLing. the forks are a minor issue also as if you want to sell them to BTC you have to load cold keys in untested software. and defensively move bitcoin first for security.	adam3us	62	6	1516390827	954438424282279936	https://twitter.com/adam3us/status/954438424282279936			
	"Holding back a tsunami of innovation with ""tech can't work videos"" & social media accounts - good luck with that - didn't work for King Canute. The future is defined by code. Cypherpunks write code. People adopting code are not swayed by luddites claiming the code can't work :)"	adam3us	247	63	1516376238	954377233258262529	https://twitter.com/adam3us/status/954377233258262529			
	"Liked @kallewoof 's comment on using gripes as fuel to build more innovation rather than using cycles arguing if the tech can work - just show them it working! ""Lightning won't work for 5years"" not looking so good now. Live lightning ""pizza"" payments zipping around disproves."	adam3us	23	3	1516375801	954375400859222017	https://twitter.com/adam3us/status/954375400859222017			@kallewoof
	Lightning is like a write-back disk cache. After the network has run for a while under real-world use it will also look less structured, like a fragmented disk as users route and create new channels to pay. Fees will help also, as it's lowest fee routed.	adam3us	4	0	1516374824	954371301140910081	https://twitter.com/adam3us/status/954371301140910081			
	I believe it's sub second most of the visible lag is website response lag, http etc. Way to tell would be user to user payment on different network eg lan vs 3G, side by side video.	adam3us	0	0	1516374634	954370506337103872	https://twitter.com/adam3us/status/954370506337103872			
	Feels like for karma reasons, the funds collected to debunk misinformation video about lightning not working, should be collected *with* lightning, being proof in itself :) also why are these people making costly, scripted misinformation videos? So weird.	adam3us	24	3	1516373328	954365027418456065	https://twitter.com/adam3us/status/954365027418456065			
	many of them have committed publicly that they will do it. but give them some slack, onboarding 100k users/day in one company is hard work, if you were previously onboarding 1k users. there maybe an economic issue between retail uses and exchanges tho - different fee tolerance.	adam3us	3	0	1516354185	954284735131303937	https://twitter.com/adam3us/status/954284735131303937			
	it's an economic choice. I believe having talked with a few of the companies that it's partly that they are very busy scaling their databases and trading engines to the huge user influx as well as growing support staff, tickets etc. fees are not top of mind to exchanges.	adam3us	3	0	1516353655	954282511114289152	https://twitter.com/adam3us/status/954282511114289152			
	it was. segwit is that small blocksize increase. it started as a HF in aug 2015, until @LukeDashjr realised it could be done as a SF. much of that scale is not yet used, so it seems the scaling bottleneck is companies resources to upgrade software & configurations.	adam3us	2	0	1516353148	954280386405613568	https://twitter.com/adam3us/status/954280386405613568			@LukeDashjr
bitcoin 	no because we'd have 1000x capacity. but yes it's still a constraint and not-infinite because we hope & expect that billions of people will use bitcoin! but tech improves. eg see lightning factories which can reduce on chain channel fund/close by about 20x.	adam3us	3	0	1516352101	954275993333645312	https://twitter.com/adam3us/status/954275993333645312			
	sending via iridium mifi could be cool too :) https://www. iridium.com/Products/Detai ls/Iridium-GO?section=tech … (global coverage but low bandwidth to LEO satellite constellation) pic.twitter.com/AoKSOMcVMu	adam3us	31	1	1516351987	954275516994936837	https://twitter.com/adam3us/status/954275516994936837			
	no setup and tear down net balances go on-chain, but the flow of transactions through the network is netted off chain. a 1000:1 ratio of recirculation is a significant win. more than is likely plausible even if one did not care much about centralising effects of gig blocks.	adam3us	3	0	1516351346	954272829431623680	https://twitter.com/adam3us/status/954272829431623680			
	touche, @kyletorpey , touche :)	adam3us	17	0	1516350662	954269957663047680	https://twitter.com/adam3us/status/954269957663047680			@kyletorpey
	I think there are a few cases where user A paid user B and the payment went via the store funds (user A pays the store to send funds previously paid for a t-shirt to user B). anyway routing is automatic and lowest fee routing.	adam3us	1	1	1516350578	954269607619051520	https://twitter.com/adam3us/status/954269607619051520			
bitcoin 	you have to HODL bitcoin to keep funds on node routes. eg of the $10k approx in mainnet channels some of it is stuck to the blockstream store. we're leaving it there. we hold bitcoin anyway so it's no difference to us. someone who is US denominated and doesnt hold wont do that.	adam3us	0	1	1516350494	954269256882860032	https://twitter.com/adam3us/status/954269256882860032			
	they dont go in blocks, they are cut-through (netted) and routed off-chain. if the recirculation ratio is 1000:1 then 1000x as many +/-.	adam3us	1	0	1516350359	954268688370171904	https://twitter.com/adam3us/status/954268688370171904			
	that's incorrect: lightning is a cut-through transaction system that elides information via netting. all else being equal it needs less on chain space per transaction, and provides fast finality, lower fees, and reduces demand making on chain transactions cheaper also.	adam3us	3	0	1516350063	954267449242759173	https://twitter.com/adam3us/status/954267449242759173			
	eg IM application that sent the messages on chain. similar for meta protocols, that inherently require full-nodes. it is often not necessary to send the app data to the blockchain even functionally to time-stamp it, viz @opentimestamps design.	adam3us	8	0	1516348956	954262804063596544	https://twitter.com/adam3us/status/954262804063596544			@opentimestamps
bitcoin 	it was a recurring cause of confusion - people actually were looking for a p2p application message bus with store-and-forward functionality to send their app messages; because Bitcoin has similar functionality for transactional reasons they stuffed their app messages into it.	adam3us	7	0	1516348878	954262478711529473	https://twitter.com/adam3us/status/954262478711529473			
	fees so far on these payments seem to be 0 satoshis. (it's lowest fee routed and I am assuming that is the default config)	adam3us	1	0	1516329772	954182341110329345	https://twitter.com/adam3us/status/954182341110329345			
bitcoin ethereum 	"question everything, reject argument by authority, merit is earned by proof not claimed, arguments must stand alone as if published anonymously. however you claimed ""Even @VitalikButerin tried to build Ethereum on top of Bitcoin but was denied"" which is just false afaik hence FUD"	adam3us	90	3	1516329591	954181582570467328	https://twitter.com/adam3us/status/954181582570467328			@VitalikButerin
	I just updated my profile if you'd like to connect further. https:// about.me/warrenwhitlock #socialnetworking #business pic.twitter.com/SnOv9NwnvE	WarrenWhitlock	5	4	1516399411	954474425746907136	https://twitter.com/WarrenWhitlock/status/954474425746907136		#socialnetworking #business	
	Where is Your Blog? Richard Branson Says You Got to Do This http:// j.mp/1RuF1l2 #blogging #marketing pic.twitter.com/HtQGDtrTdQ	WarrenWhitlock	2	0	1516395178	954456673271402502	https://twitter.com/WarrenWhitlock/status/954456673271402502		#blogging #marketing	
	Share this with someone who needs a smile today http:// j.mp/2a9nhbH #socialmedia #joy #love #sharing pic.twitter.com/8jz1gBP45r	WarrenWhitlock	4	1	1516384103	954410222415736834	https://twitter.com/WarrenWhitlock/status/954410222415736834		#socialmedia #joy #love #sharing	
	How #Crypto will disrupt Indian #ecommerce [video] https://www. coinhash.co/indian-ecommer ce … #blockchain #crypto #ico @bazista_io	WarrenWhitlock	3	1	1516375433	954373855631609856	https://twitter.com/WarrenWhitlock/status/954373855631609856		#Crypto #ecommerce #blockchain #crypto #ico	@bazista_io
	On Linkedin, I'm what they call an Open Networker. Send me a note and I'll accept to get to know you better and expand our networks. http:// Linkedin.com/in/books pic.twitter.com/1l112vpSnQ	WarrenWhitlock	6	4	1516374212	954368734348660736	https://twitter.com/WarrenWhitlock/status/954368734348660736			
	The small BIG: small changes that spark big influence http:// j.mp/1RuF1l4 #influence #persuasion #marketing pic.twitter.com/dvh5UU8Sws	WarrenWhitlock	0	2	1516373063	954363916338987008	https://twitter.com/WarrenWhitlock/status/954363916338987008		#influence #persuasion #marketing	
	Weeks from Idea to Millions Reached http:// j.mp/1RuF1S7 #bestseller #book #marketing pic.twitter.com/2mCcv0fpr1	WarrenWhitlock	3	0	1516362043	954317695327129601	https://twitter.com/WarrenWhitlock/status/954317695327129601		#bestseller #book #marketing	
	Not just a wheelbarrow. It's saving lives and freeing people http:// j.mp/29KGDZa #cleanwater #billionsrising pic.twitter.com/ifi8yy0An3	WarrenWhitlock	12	5	1516350974	954271266944552961	https://twitter.com/WarrenWhitlock/status/954271266944552961		#cleanwater #billionsrising	
	Some of my best referrals come from Linkedin. Are we connected? http:// linkedin.com/in/book pic.twitter.com/mtUpHnjGQG	WarrenWhitlock	7	1	1516349000	954262990538321920	https://twitter.com/WarrenWhitlock/status/954262990538321920			
	Misteaks Happen. How Not to Look Bad on Twitter. http:// j.mp/1RuF14O #socialmedia #training pic.twitter.com/Aj5ToQgQPG	WarrenWhitlock	5	1	1516339938	954224979868086272	https://twitter.com/WarrenWhitlock/status/954224979868086272		#socialmedia #training	
	Word is getting out on what we are doing at CIF. http:// j.mp/2EhFMdC #ico #blockchain #finance pic.twitter.com/oz316gZTR8	WarrenWhitlock	4	2	1516336308	954209754007719942	https://twitter.com/WarrenWhitlock/status/954209754007719942		#ico #blockchain #finance	
	Why #blockchain is essential in the #future of your #business https:// business.frontier.com/blog/blockchai n-essential-for-future-business/ … @fronteirbiz	WarrenWhitlock	12	8	1516335761	954207461921181696	https://twitter.com/WarrenWhitlock/status/954207461921181696		#blockchain #future #business	@fronteirbiz
	Demystifying The Google Knowledge Graph http:// j.mp/1RuF14J #SeachEngine #Google pic.twitter.com/npCfFrXRS0	WarrenWhitlock	2	0	1516328893	954178653520351232	https://twitter.com/WarrenWhitlock/status/954178653520351232		#SeachEngine #Google	
	You are part of a social network superorganism http:// j.mp/29n3siZ #video #connection #stories pic.twitter.com/g55u3QYiUy	WarrenWhitlock	5	2	1516317851	954132340246237186	https://twitter.com/WarrenWhitlock/status/954132340246237186		#video #connection #stories	
bitcoin 	Conventional Wisdom: altruism is unselfish Bitcoin Wisdom: altruism is selfish	jimmysong	169	14	1516389018	954430836107038720	https://twitter.com/jimmysong/status/954430836107038720			
bitcoin 	My advice for Bitcoin noobs these days. If you're going to sell in 6 months when it doubles or halves, don't bother. If you're going to hold for 5-10 years, then yes, go buy.	jimmysong	1940	535	1516373198	954364482112901120	https://twitter.com/jimmysong/status/954364482112901120			
bitcoin 	One of the nice things about the current state of cryptocurrency is that scammers are far, far away from Bitcoin these days.	jimmysong	1123	165	1516342857	954237222924029957	https://twitter.com/jimmysong/status/954237222924029957			
bitcoin 	Another seminar, another two days, another 25 Bitcoin Developers released to the world. Now can the Bitcoin price react already? =)	jimmysong	672	68	1516341616	954232019130765312	https://twitter.com/jimmysong/status/954232019130765312			
	pic.twitter.com/m78qz9vUTY	DollarVigilante	45	8	1516386600	954420696075051008	https://twitter.com/DollarVigilante/status/954420696075051008			
	pic.twitter.com/aDwprCZ2tC	DollarVigilante	174	57	1516379400	954390495240876032	https://twitter.com/DollarVigilante/status/954390495240876032			
	pic.twitter.com/K0GRTP3LGK	DollarVigilante	50	14	1516332600	954194201691828225	https://twitter.com/DollarVigilante/status/954194201691828225			
	pic.twitter.com/3iEwODLCii	DollarVigilante	60	13	1516320000	954141353914654723	https://twitter.com/DollarVigilante/status/954141353914654723			
bitcoin 	Hey, remember when bitcoin was going to kill Western Union? https:// yhoo.it/2rkQ3UN @YahooFinance $ WU $ btc pic.twitter.com/8WiFo3o10x	readDanwrite	5	5	1516394970	954455798993838080	https://twitter.com/readDanwrite/status/954455798993838080			@YahooFinance
bitcoin 	"fascinating: after China shut down local bitcoin exchanges, some reopened as OTC sites where people can still buy, but pay 20% premium. And they warn customers not to write ""btc"" or ""bitcoin"" in their money transfer notes. @readkrystalhu @YahooFinance https:// yhoo.it/2DrakOj"	readDanwrite	15	13	1516389550	954433069280366593	https://twitter.com/readDanwrite/status/954433069280366593			@readkrystalhu @YahooFinance
ripple 	Costa Rican sportsbook @BetDSI released prop bets on crypto, lol. they have $ btc price at $19k on Jan 1, 2019, $ bch at $2,700, $ eth at $1,650, $ xrp at $2.50, and think Coinbase won't add ripple by 2019. pic.twitter.com/aRmaNx4S1x	readDanwrite	1	0	1516381979	954401312128536576	https://twitter.com/readDanwrite/status/954401312128536576			@BetDSI
bitcoin 	The latest bitcoin 'crash' does not even rank in the top 5 biggest 30-day swings in $ btc price since 2010. @rickjnewman ran the numbers: https:// finance.yahoo.com/news/big-bitco in-crash-not-even-close-192422962.html … pic.twitter.com/qkhZAvH6zG	readDanwrite	2	4	1516376804	954379607968448512	https://twitter.com/readDanwrite/status/954379607968448512			@rickjnewman
	I seek to inform and delight.	readDanwrite	1	0	1516373865	954367278233145345	https://twitter.com/readDanwrite/status/954367278233145345			
	I've discovered Starbucks Veranda Blonde Roast is pretty decent. much better than Pike. I thought it was new, but it launched in 2012.	readDanwrite	3	0	1516373498	954365741087842305	https://twitter.com/readDanwrite/status/954365741087842305			
	that's called journalism, Justin.	readDanwrite	0	0	1516368247	954343717456015360	https://twitter.com/readDanwrite/status/954343717456015360			
	It doesn't even tell you what miners will run.	NickSzabo4	35	5	1516344917	954245863534051333	https://twitter.com/NickSzabo4/status/954245863534051333			
	Yes.	NickSzabo4	4	0	1516342676	954236465944313859	https://twitter.com/NickSzabo4/status/954236465944313859			
bitcoin 	"Yup, bit gold didn't have difficulty adjustment or cap, thus in the blockchain (""titles"") non-fungible. Relied on exchanges to create relative prices thus allow creation of fungible notes (a 2nd layer). Has monetary benefit but Bitcoin/Lightning combo is far more trust-minimized."	NickSzabo4	3	0	1516342228	954234585138700288	https://twitter.com/NickSzabo4/status/954234585138700288			
	Some of my writings on collectibles and the origins of money: Original paper: http:// nakamotoinstitute.org/shelling-out/ Ethnographic example: https:// unenumerated.blogspot.com/2017/02/confli ct-and-collectibles-among-yurok_87.html … Authority resemblance etc. in the archaeological record: https:// unenumerated.blogspot.com/2016/07/artifa cts-of-wealth-patterns-in_15.html … Metal: https:// unenumerated.blogspot.com/2017/03/collec ting-metal-inner-and-outer-worlds.html …	NickSzabo4	1449	690	1516340131	954225789129469952	https://twitter.com/NickSzabo4/status/954225789129469952			
	http:// nakamotoinstitute.org/shelling-out/	NickSzabo4	1	0	1516339696	954223966335393792	https://twitter.com/NickSzabo4/status/954223966335393792			
	An interesting way to summarize it, thanks for the ptr.	NickSzabo4	6	1	1516339547	954223337823125505	https://twitter.com/NickSzabo4/status/954223337823125505			
	this article almost reads as a parody: “to be adopted, blockchain needs to remove all what makes it a blockchain”. Nonsense.	sbmeunier	9	2	1516401599	954483604570214402	https://twitter.com/sbmeunier/status/954483604570214402			
	Great profile on Jonathan Stein and his journey to build Betterment #fintech #investing #startup #innovation @jonstein @psb_dc https:// buff.ly/2mOcSKU pic.twitter.com/pmQS8i05Sv	sbmeunier	4	1	1516400771	954480130851819522	https://twitter.com/sbmeunier/status/954480130851819522		#fintech #investing #startup #innovation	@jonstein @psb_dc
	You can actually make money mining cryptocurrency with a good gaming PC. It's not going to make you a millionaire, though #fintech http:// on.forbes.com/6015DzLpZ pic.twitter.com/CO1puuHT8v	sbmeunier	1	0	1516398073	954468816607735809	https://twitter.com/sbmeunier/status/954468816607735809		#fintech	
	Venezuela Blasts 'False' White Paper for Oil-Backed #cryptocurrency #blockchain @coindesk #fintech http:// bit.ly/2mOa8xg pic.twitter.com/5Kql3vF5Xc	sbmeunier	3	0	1516397557	954466651789058048	https://twitter.com/sbmeunier/status/954466651789058048		#cryptocurrency #blockchain #fintech	@coindesk
bitcoin 	A ‘haven for #bitcoin ’ is considering a #cryptocurrency crackdown #blockchain #fintech http:// for.tn/2BfKEhq	sbmeunier	0	2	1516397422	954466087298625536	https://twitter.com/sbmeunier/status/954466087298625536		#bitcoin #cryptocurrency #blockchain #fintech	
	Here are 5 tips before you buy or sell a home in #cryptocurrency . #blockchain #fintech pic.twitter.com/lvXx8jGN2l	sbmeunier	0	4	1516393577	954449959755141122	https://twitter.com/sbmeunier/status/954449959755141122		#cryptocurrency #blockchain #fintech	
	The hottest party in #cryptocurrency is being broken up #blockchain #fintech https:// bloom.bg/2rmVgLN pic.twitter.com/ZTnrJWFpe8	sbmeunier	0	2	1516391931	954443053409939456	https://twitter.com/sbmeunier/status/954443053409939456		#cryptocurrency #blockchain #fintech	
	Report: India's Government Sends Tax Notices to #cryptocurrency Traders #blockchain @coindesk #fintech http:// bit.ly/2FVKteM pic.twitter.com/hAg8nBkPri	sbmeunier	0	1	1516389503	954432870017355777	https://twitter.com/sbmeunier/status/954432870017355777		#cryptocurrency #blockchain #fintech	@coindesk
	#cryptocurrency ETFs are off the table for now, the SEC says #blockchain #fintech http:// for.tn/2BfEI81	sbmeunier	0	1	1516387517	954424541580800000	https://twitter.com/sbmeunier/status/954424541580800000		#cryptocurrency #blockchain #fintech	
