	On a recent visit to Egypt and Sudan, my host said that Ethopia's actions may planet the seeds of WWIII ... watch this space https:// twitter.com/MatinaStevis/s tatus/954281560080969728 …	Chris_Skinner	0	0	1516353512	954281914143211521	https://twitter.com/Chris_Skinner/status/954281914143211521			
bitcoin 	Bitcoin vs Regulators: who will win? @WSJ http://www. wsj.com/video/bitcoin- vs-regulators-who-will-win/056050A7-E38F-4824-90D5-308C1ABF05A4.html …	Chris_Skinner	2	2	1516353373	954281330774175745	https://twitter.com/Chris_Skinner/status/954281330774175745			@WSJ
bitcoin 	Forget #bitcoin , #dogecoin and #cryptokitties ... let's all invest in the Maycoin http://www. cityam.com/278877/forget- bitcoin-and-dogecoin-theres-joke-cryptocurrency …	Chris_Skinner	2	2	1516351176	954272114839867392	https://twitter.com/Chris_Skinner/status/954272114839867392		#bitcoin #dogecoin #cryptokitties	
	#Brexit , Banking and Equivalence via Chris Skinner's blog - As usual, the Financial Services Club ... http:// tinyurl.com/ya47bkh2	Chris_Skinner	1	1	1516350990	954271335508774913	https://twitter.com/Chris_Skinner/status/954271335508774913		#Brexit	
	Things worth reading: 19th January 2018 via Chris Skinner's blog - Things we're reading today ... http:// tinyurl.com/y6u5mjf6	Chris_Skinner	2	1	1516349191	954263788831805440	https://twitter.com/Chris_Skinner/status/954263788831805440			
	Who needs cash? http://www. bbc.co.uk/news/business- 42741465 …	Chris_Skinner	1	2	1516345416	954247958173798401	https://twitter.com/Chris_Skinner/status/954247958173798401			
	What a fantastic story @oaknorth is. Well done to everyone involved in making that happen. https:// twitter.com/fintechinsider s/status/954388585083555840 …	davidbrear	9	7	1516386755	954421346091585536	https://twitter.com/davidbrear/status/954421346091585536			@oaknorth
	Team are on it.	davidbrear	0	0	1516352994	954279738780143616	https://twitter.com/davidbrear/status/954279738780143616			
	We really should have put some devil horns on Sarah there.	davidbrear	0	0	1516351651	954274108124094465	https://twitter.com/davidbrear/status/954274108124094465			
	Wouldn’t that surprised would you really? Man. London wouldn’t know what to do with itself.	davidbrear	0	0	1516351404	954273071468285952	https://twitter.com/davidbrear/status/954273071468285952			
	Still doing it as it’s working for me?	davidbrear	0	0	1516351353	954272857617588224	https://twitter.com/davidbrear/status/954272857617588224			
	Check out this weeks episode of the Fintech Insider News: On Air Show This week me @JasonBates and @simonvc from @monzo answering your questions about #openbanking #api and a whole host of other things! https:// youtu.be/AVwCAfz5yec via @YouTube	davidbrear	8	7	1516319747	954140292948594689	https://twitter.com/davidbrear/status/954140292948594689		#openbanking #api	@JasonBates @simonvc @monzo @YouTube
	BBC Sport - Fernandinho: Manchester City midfielder signs contract extension until 2020 http://www. bbc.co.uk/sport/football /42743878 …	dgwbirch	1	0	1516395130	954456470967418881	https://twitter.com/dgwbirch/status/954456470967418881			
	#bbcqt for goodness sake shut up about Johnson’s FAKE NEWS bridge and start holding him to account for FOREIGN POLICY. Stop falling for his sinister and manipulative BOLLOCKS.	dgwbirch	6	0	1516393133	954448096716644353	https://twitter.com/dgwbirch/status/954448096716644353		#bbcqt	
	Since cash use in retail fell again, I wonder if the Bank of England can tell us what exactly all this cash is being used for? https:// buff.ly/2FWFeeG	dgwbirch	1	0	1516380537	954395263937982465	https://twitter.com/dgwbirch/status/954395263937982465			
	#FF five nice people I talked to this week @evanzuuren @gidgreen @alexl @thomaspower @@JLVerhelst	dgwbirch	2	0	1516380233	954393989205049344	https://twitter.com/dgwbirch/status/954393989205049344		#FF	@evanzuuren @gidgreen @alexl @thomaspower @ @JLVerhelst
	Starting the eleventh year of Tomorrow's Transactions podcasts with Andy Tobin of Evernym talking about self-sovereign identity https:// buff.ly/2mPUIIO pic.twitter.com/HicRf6nboN	dgwbirch	13	12	1516379887	954392538668036102	https://twitter.com/dgwbirch/status/954392538668036102			
	What should we expect from 2018 in digital transactions and ecommerce? | The Paypers https:// buff.ly/2mNg1L8 including my predictions for MPE	dgwbirch	1	1	1516379349	954390281956347904	https://twitter.com/dgwbirch/status/954390281956347904			
	https:// medium.com/@dgwbirch/dist ributed-proof-of-jerk-56dd5b045544 …	dgwbirch	0	0	1516378453	954386522953875457	https://twitter.com/dgwbirch/status/954386522953875457			@dgwbirch
	Time for a tea/book break. pic.twitter.com/IVs7U7iKrc	dgwbirch	1	0	1516378231	954385592044924928	https://twitter.com/dgwbirch/status/954385592044924928			
	Sadly, I think people are going to lose actual money	dgwbirch	1	1	1516365501	954332199494569985	https://twitter.com/dgwbirch/status/954332199494569985			
	Please BBC! Stop talking about Johnson’s dumbass bridge. It is cynical, manipulative and despicable FAKE NEWS.	dgwbirch	2	0	1516359366	954306466348924929	https://twitter.com/dgwbirch/status/954306466348924929			
bitcoin 	“For the people that have lost their bitcoins, I say tough luck.” https:// buff.ly/2FVQSH0 <- he's harsh but fair, that @jony_levin	dgwbirch	3	3	1516347984	954258728550838272	https://twitter.com/dgwbirch/status/954258728550838272			@jony_levin
bitcoin 	Use of cash continues to fall, amount of cash in “circulation” continues to rise. I told you drug dealers, money launderers and corrupt politicians much prefer £50 notes to Bitcoin. https:// twitter.com/davidpolymath/ status/954257818596532224 …	dgwbirch	10	1	1516347896	954258358533541888	https://twitter.com/dgwbirch/status/954258358533541888			
	No kidding. https:// twitter.com/obussmann/stat us/954246519183560704 …	dgwbirch	3	1	1516345277	954247371851956225	https://twitter.com/dgwbirch/status/954247371851956225			
	Ben’s got a point. This is a weakness in the self-sovereignty case that needs to be addressed. Social sharding? https:// twitter.com/benlaurie/stat us/954195655026671616 …	dgwbirch	9	1	1516343882	954241520797962240	https://twitter.com/dgwbirch/status/954241520797962240			
	Why is there a film director on #bbcqt and not, for example, an advisor on digital financial services?	dgwbirch	5	1	1516318399	954134639597191169	https://twitter.com/dgwbirch/status/954134639597191169		#bbcqt	
ethereum 	I thought Ethereum was over-ambitious and would be vaporware. I was wrong.	gavinandresen	353	84	1516402361	954486801129005061	https://twitter.com/gavinandresen/status/954486801129005061			
	Brian, George and Pinar did all the hard work on Graphene, and it was Brian’s original idea to combine bloom and IBLT.	gavinandresen	78	10	1516368375	954344251835502594	https://twitter.com/gavinandresen/status/954344251835502594			
	Especially after recent tax cuts. I think they'd rather consume decentralised tech than fund / build / launch it	sytaylor	2	0	1516366989	954338438731493376	https://twitter.com/sytaylor/status/954338438731493376			
	Deploy deploy deploy!! pic.twitter.com/P3Vd5jzQtu	sytaylor	2	0	1516366472	954336271052279809	https://twitter.com/sytaylor/status/954336271052279809			
	Yeah enterprise has been quuuuiiiiet lately	sytaylor	0	0	1516366294	954335526487764993	https://twitter.com/sytaylor/status/954335526487764993			
	Did you get your question answered? Click here to find out https://www. youtube.com/watch?v=AVwCAf z5yec&feature=youtu.be … @FinTechInsiders Q+A Live	sytaylor	2	0	1516354947	954287930792652800	https://twitter.com/sytaylor/status/954287930792652800			@FinTechInsiders
	Danke dir Daniel, dass du da warst! Hat mich auch sehr gefreut! Bis zum nächsten Mal! :-)	julianhosp	0	0	1516369384	954348485914120193	https://twitter.com/julianhosp/status/954348485914120193			
	The Blockchain Meetup in #edinburgh just keeps growing ... expertly setup by @mbnsolutions pic.twitter.com/dSkU3wtsk1	billatnapier	9	3	1516359048	954305134133219328	https://twitter.com/billatnapier/status/954305134133219328		#edinburgh	@mbnsolutions
	Poland adopts a national crypto-currency ... https:// cryptodaily.co.uk/2018/01/poland -next-country-announce-national-cryptocurrency/ …	billatnapier	9	5	1516357895	954300296322306048	https://twitter.com/billatnapier/status/954300296322306048			
	A City Taking Its Place on a World Stage https:// lnkd.in/gHHjBmp	billatnapier	4	4	1516347574	954257008181493760	https://twitter.com/billatnapier/status/954257008181493760			
	It was standing room only ... the biggest turnout for Blockchain meeting yet ... and it was all about health and well-being ... #edinburgh is making its mark on the world... this time with tech pic.twitter.com/Tne7VKNnxU	billatnapier	33	17	1516316770	954127804727267328	https://twitter.com/billatnapier/status/954127804727267328		#edinburgh	
	Thanks so much for your support. Glad you enjoyed the first one. Hope you have a similar response to this one.	mikejcasey	1	0	1516330416	954185043601174529	https://twitter.com/mikejcasey/status/954185043601174529			
	Seriously, it took about a year. But in depriving me of sleep, I think it took two years off of my life.	mikejcasey	1	0	1516330372	954184857906745350	https://twitter.com/mikejcasey/status/954184857906745350			
	One week. :)	mikejcasey	1	0	1516330331	954184683801186304	https://twitter.com/mikejcasey/status/954184683801186304			
	"The Truth Machine's 1st independent review. @ALA_Booklist : ""The authors ably explain highly technical information in layperson’s terms, and the text is neither too dense nor too basic."" Cites ""blockchain’s potential to change the world’s financial systems"" https://www. amazon.com/Truth-Machine- Blockchain-Future-Everything/dp/1250114578/ …"	mikejcasey	11	0	1516329526	954181308980310017	https://twitter.com/mikejcasey/status/954181308980310017			@ALA_Booklist
	Congrats guys! You've crossed the Rubicon.	mikejcasey	2	0	1516328262	954176008948797440	https://twitter.com/mikejcasey/status/954176008948797440			
	Yes, that was quite a conversion. I'd like know which Silicon Valley rep produced the killer argument that changed his mind.	mikejcasey	0	0	1516325163	954163007709425664	https://twitter.com/mikejcasey/status/954163007709425664			
	I wasn't too cheeky, was I, @kwerb ? https:// twitter.com/mikejcasey/sta tus/954130952095223808 …	mikejcasey	0	0	1516317662	954131547321520128	https://twitter.com/mikejcasey/status/954131547321520128			@kwerb
	"If imitation=greatest form of flattery, it applies doubly for headlines on articles by Deans of top biz schools. But mostly I'm happy that @garrett_geoff discarded his ""Jamie Dimon mindset"" to embrace the ""end of money as we know it"" thesis. http:// knowledge.wharton.upenn.edu/article/is-thi s-the-end-of-money/ … cc @paulvigna"	mikejcasey	22	2	1516317520	954130952095223808	https://twitter.com/mikejcasey/status/954130952095223808			@garrett_geoff @paulvigna
	Grazie e altretanto Antonio	AntonioSelas	3	0	1516389558	954433100557312000	https://twitter.com/AntonioSelas/status/954433100557312000			
	(More) Top #Insurtech Predictions for 2018 https://www. mynewmarkets.com/articles/18315 8/top-insurtech-predictions-2018 … cc @andi_staub @guzmand @SpirosMargaris @TunstallAsc @nigelwalsh @SabineVdL @stratorob @k_feldborg @insurtechtalk @antgrasso @psb_dc @jaypalter @thepsironi @MCins_ pic.twitter.com/ltvEDq10el	AntonioSelas	43	34	1516372087	954359823306457088	https://twitter.com/AntonioSelas/status/954359823306457088		#Insurtech	@andi_staub @guzmand @SpirosMargaris @TunstallAsc @nigelwalsh @SabineVdL @stratorob @k_feldborg @insurtechtalk @antgrasso @psb_dc @jaypalter @thepsironi @MCins_
	#Insurtech : Munich Re has partnered with California-based AI #startup Betterview for the supply of drone imagery, analysis and reporting to Munich Re’s #insurance company clients https://www. intelligentinsurer.com/news/munich-re -partners-with-ai-insurtech-drone-startup-14397 …	AntonioSelas	2	2	1516371292	954356487744360448	https://twitter.com/AntonioSelas/status/954356487744360448		#Insurtech #startup #insurance	
	僕「Nintendo Labo、意外と母親の支持率高いんだよんね」 妻「そりゃそうでしょ、お母さんはすぐに知育って言葉出ると思うよ」 僕「段ボールでも？」 妻「だからいいんじゃん。組み立て、カスタマイズ、修理、遊び、全部気軽にできる。プラとかじゃなく段ボールにしたのはセンスしか感じられない」	mochi_wsj	103	55	1516366989	954338440459403264	https://twitter.com/mochi_wsj/status/954338440459403264			
	good catch! thx!	mochi_wsj	6	0	1516338225	954217793058033664	https://twitter.com/mochi_wsj/status/954217793058033664			
	楽天。「 EC分野における事業提携発表会」を1月26日に。登壇者は三木谷さん他。なんだろう。案内状にはそれ以上は書いてありません。	mochi_wsj	33	37	1516338178	954217597624467456	https://twitter.com/mochi_wsj/status/954217597624467456			
	-Pokémon GO Plusは高いから売れない -Nintendo Switchは高いから売れない -Nintendo Laboは高いから売れない (NEW!) …まあ、話半分くらいで聞くようにしている。	mochi_wsj	120	101	1516335486	954206306344185858	https://twitter.com/mochi_wsj/status/954206306344185858			
	ダメだ！w	mochi_wsj	0	0	1516332754	954194849418264576	https://twitter.com/mochi_wsj/status/954194849418264576			
	そうだぞ。来ないほうがいいぞ。	mochi_wsj	0	0	1516330588	954185763226189824	https://twitter.com/mochi_wsj/status/954185763226189824			
	ニンキモノ	mochi_wsj	0	0	1516328511	954177051098886145	https://twitter.com/mochi_wsj/status/954177051098886145			
	Analyst says Nintnedo might have sold 7 million Switch units in Oct-Dec globally, which would bring life-to-date figure at more than 14.6 million. Nintendo reports its 3rd FY-quarter results at the end of this month. pic.twitter.com/qZGGWOKMpB	mochi_wsj	192	105	1516328398	954176578317049856	https://twitter.com/mochi_wsj/status/954176578317049856			
	エース経済研究所の安田氏、10-12月期に700万台のNintendo Switchが全世界で売れたと分析。仮にそうだとすると3月からの累計は1,460万台になります。任天堂の現時点での目標は3月末までに1,670万台ですが、今月末の決算発表で上方修正がかかるという声が増えてきています。 pic.twitter.com/qoWGCJXbOG	mochi_wsj	50	43	1516328305	954176187219173377	https://twitter.com/mochi_wsj/status/954176187219173377			
	まだ乗客が降りきっていない地下鉄で、「これからのご乗車はご遠慮下さい」と駅アナウンスがかかり、地方から来たと思われる学生さんたちが「東京の電車、難易度高え」と困惑していた。わかる。	mochi_wsj	33	18	1516327226	954171663435755520	https://twitter.com/mochi_wsj/status/954171663435755520			
	なかなか厳しい論調。 https:// twitter.com/IsayaShimizu/s tatus/954132989071450113 …	mochi_wsj	6	7	1516319492	954139221429645312	https://twitter.com/mochi_wsj/status/954139221429645312			
	My week on Twitter : 80 Mentions, 277K Mention Reach, 125 Likes, 62 Retweets, 151K Retweet Reach. See yours with https:// sumall.com/performancetwe et?utm_source=twitter&utm_medium=publishing&utm_campaign=performance_tweet&utm_content=text_and_media&utm_term=065444fe8249981dab2d8cef … pic.twitter.com/JtPX0fS6e2	SafarazAli	1	0	1516392076	954443661856727040	https://twitter.com/SafarazAli/status/954443661856727040			
	@RiazUlHaqKhan1 @MaryJ_FamousPR , thanks for recent engagements in the last week, happy to have you in my community as my top recently engaged followers :) ( via https:// commun.it/grow-your-foll owers?tc=s&aid=thankyou201 … )	SafarazAli	0	0	1516374766	954371059461099520	https://twitter.com/SafarazAli/status/954371059461099520			@RiazUlHaqKhan1 @MaryJ_FamousPR
	Always a big fan - not just this week	SafarazAli	2	0	1516352680	954278425740619776	https://twitter.com/SafarazAli/status/954278425740619776			
	Stanford brain-computer interface lab humor pic.twitter.com/vL6cI4Xrav	FEhrsam	88	10	1516324977	954162228416032769	https://twitter.com/FEhrsam/status/954162228416032769			
bitcoin 	4/Continued... -Thriving in a world without central banking -Monetary policy impacts of bitcoin -Fiscal policy impacts of bitcoin -Developing a capital market and BIBOR (LIBOR for bitcoin) -Routing around immoral capital controls -Bypassing payment blockades -System D currencies	jonmatonis	10	0	1516382491	954403461763928064	https://twitter.com/jonmatonis/status/954403461763928064			
bitcoin 	3/Suggested conference tracks include: -Why hashrate matters -Why immutability matters -Combating financial surveillance -Importance of fungibility -Role of digital bearer tokens -Extreme privacy protocols 101 -Bitcoin as a closed-loop system (no KYC, no AML)	jonmatonis	10	0	1516382393	954403048675270663	https://twitter.com/jonmatonis/status/954403048675270663			
	2/I want to host a conference that highlights experts for a truly post legal tender era. But, who would sponsor such an event?	jonmatonis	7	1	1516382313	954402713693048833	https://twitter.com/jonmatonis/status/954402713693048833			
bitcoin 	1/I know. It's exhausting! Who cares about conferences that continually focus on Bitcoin regulation and using blockchain for RegTech?	jonmatonis	6	2	1516382287	954402606369181697	https://twitter.com/jonmatonis/status/954402606369181697			
bitcoin 	Bitcoin is a primary asset. We choose to sell for fiat £ and fiat €.	jonmatonis	1	0	1516366373	954335857581928451	https://twitter.com/jonmatonis/status/954335857581928451			
	More than ever the focus on hard assets is a dire call to arms given the deformed market culture of central banking monetary magic. (via @mises ) https:// mises.org/blog/hard-asse ts-age-negative-interest-rates …	jonmatonis	14	6	1516355797	954291497398087680	https://twitter.com/jonmatonis/status/954291497398087680			@mises
	Great UI/UX is the hardest problem in crypto today. The average consumer should have payment freedom, privacy, and a secure experience without having to understand hashes and blockchains. https:// twitter.com/thee_wolf/stat us/954067368631721984 …	jgarzik	173	52	1516401315	954482411718561792	https://twitter.com/jgarzik/status/954482411718561792			
	Paradoxically, the same people love soft forks, which erode the ability for full nodes to fully validate the rules enforced on the blockchain. https:// twitter.com/zackvoell/stat us/954402691899428869 …	jgarzik	19	1	1516392816	954446766530879488	https://twitter.com/jgarzik/status/954446766530879488			
	"""84 crypto hedge funds had opened in 2017, up from just 11 in 2016."" https://www. bloomberg.com/news/articles/ 2018-01-18/singapore-s-kit-trading-raising-money-for-crypto-arbitrage-fund?utm_content=tech&utm_campaign=socialflow-organic&utm_source=twitter&utm_medium=social&cmpid%3D=socialflow-twitter-tech …"	jgarzik	23	12	1516338171	954217566536454144	https://twitter.com/jgarzik/status/954217566536454144			
bitcoin 	Bitcoin Price Correction Is Not Surprising - Unocoin Co-Founder Sunny Ray - BlockTribune http:// blocktribune.com/bitcoin-price- correction-not-surprising-unocoin-co-founder-sunny-ray/ … pic.twitter.com/m1H3yvtTwg	SunnyStartups	1	0	1516367223	954339421658198018	https://twitter.com/SunnyStartups/status/954339421658198018			
	NYSE Parent Company Launches Cryptocurrency Data Feed - CoinDesk https://www. coindesk.com/nyse-parent-co mpany-launches-crypto-trading-data-stream-for-exchanges/ … pic.twitter.com/HCLrn7VZXw	SunnyStartups	2	2	1516356064	954292618531393538	https://twitter.com/SunnyStartups/status/954292618531393538			
bitcoin 	New Study Finds Less Than 1% of Bitcoin Transactions To Exchanges Are Illicit http:// bitcoinist.com/study-identifi es-less-than-1-of-bitcoin-transactions-to-exchanges-are-illicit/ … pic.twitter.com/3n8Fnyl4FE	SunnyStartups	4	2	1516347481	954256618287398912	https://twitter.com/SunnyStartups/status/954256618287398912			
bitcoin 	The Intercontinental Exchange and Blockstream to Deliver Consolidated Bitcoin Trading Data Service https:// blockstream.com/2018/01/18/ice -blockstream-deliver-consolidated-trading-data-service.html … pic.twitter.com/IJQabfLml6	SunnyStartups	3	0	1516345141	954246801082724352	https://twitter.com/SunnyStartups/status/954246801082724352			
bitcoin 	Morgan Stanley is jumping on the bitcoin futures bandwagon https://www. reddit.com/r/Bitcoin/comm ents/7ranh5/morgan_stanley_is_jumping_on_the_bitcoin_futures/?st=JCLAMROQ&sh=a90adf2e …	SunnyStartups	2	0	1516328171	954175625366925314	https://twitter.com/SunnyStartups/status/954175625366925314			
bitcoin 	I'm earning bitcoin by answering paid emails and completing microtasks! Join me there and sign up today. https:// earn.com/sunnyray/refer ral/?a=1n1l7ryuhqkbu37l …	SunnyStartups	4	0	1516322858	954153340220289024	https://twitter.com/SunnyStartups/status/954153340220289024			
	The World Is Going Cashless - Gerald Celente on Kitco News A new paradigm shift in support of cryptocurrencies means the world is going digital http://www. kitco.com/news/video/sho w/Kitco-News/1819/2018-01-15/The-World-Is-Going-Cashless---Gerald-Celente …	geraldcelente	24	21	1516395660	954458693483008000	https://twitter.com/geraldcelente/status/954458693483008000			
	Gerald Celente joins Ron Paul on the Liberty Report to give the scoop on what he is expecting on the economic and foreign policy front for 2018. War? Economic collapse? Peace? Prosperity? https://www. youtube.com/watch?v=_jXPzP bQN3Q …	geraldcelente	17	7	1516381266	954398320528691200	https://twitter.com/geraldcelente/status/954398320528691200			
	War Games With North Korea – What Happens Next? Gerald Celente Explains https://www. youtube.com/watch?v=dopefQ BEArs …	geraldcelente	12	4	1516374074	954368155304030208	https://twitter.com/geraldcelente/status/954368155304030208			
	Make sure to watch my interview with Ron Paul yesterday on what I am expecting on the economic and foreign policy front for 2018. War? Economic collapse? Peace? Prosperity? https://www. youtube.com/watch?v=_jXPzP bQN3Q …	geraldcelente	29	15	1516366856	954337882306695169	https://twitter.com/geraldcelente/status/954337882306695169			
	Ron Paul Liberty Report: What To Expect In 2018 - With Gerald Celente @RonPaul http://www. youtube.com/watch?v=_jXPzP bQN3Q …	geraldcelente	15	7	1516329012	954179154206953472	https://twitter.com/geraldcelente/status/954179154206953472			@RonPaul
	Gerald Celente joins @RonPaul on the Liberty Report to give the scoop on what he is expecting on the economic and foreign policy front for 2018. War? Economic collapse? Peace? Prosperity? http://www. youtube.com/watch?v=_jXPzP bQN3Q …	geraldcelente	68	31	1516323372	954155498223427585	https://twitter.com/geraldcelente/status/954155498223427585			@RonPaul
	Hi, thanks for the feedback.We're including completed ICOs.	CamiRusso	2	1	1516396007	954460149871267840	https://twitter.com/CamiRusso/status/954460149871267840			
	I'm on a hell hole Thameslink train. Which makes me one of the lucky ones.	charliehalkett	1	0	1516388456	954428481013796866	https://twitter.com/charliehalkett/status/954428481013796866			
	Great in theory, but the guys St the barriers were not letting many Thameslink passengers on at St Pancras.	charliehalkett	0	0	1516387670	954425182999011330	https://twitter.com/charliehalkett/status/954425182999011330			
	Thameslink!!! Sort out your ticketing!! The guys upstairs at St Pancras are refusing tickets, guys downstairs are sending us upstairs. It's a joke.	charliehalkett	0	0	1516386381	954419777690324994	https://twitter.com/charliehalkett/status/954419777690324994			
	Until when?!?!?	charliehalkett	0	0	1516386003	954418189101944835	https://twitter.com/charliehalkett/status/954418189101944835			
	"Gosh - all change at #esure as one of the biggest names in UK #insurance leaves. Stuart Vann has stepped down ""with immediate effect"". #insurtech #IoT #instech https:// uk.reuters.com/article/uk-esu re-group-ceo/uks-esure-ceo-steps-down-finance-chief-at-helm-in-interim-idUKKBN1F80ON …"	charliehalkett	0	1	1516370184	954351840778481665	https://twitter.com/charliehalkett/status/954351840778481665		#esure #insurance #insurtech #IoT #instech	
	Trying to be optimistic about this tweet. I am a massive proponent of the power of #tech for social change & impact but usual in building these solutions one finds the hardest parts to solve & key elements of the solution are not about tech. https:// twitter.com/mayoradler/sta tus/954039614804844544 …	DianacBiggs	9	3	1516353432	954281578041135104	https://twitter.com/DianacBiggs/status/954281578041135104		#tech	
	yes, the GHCQ front (part of 5 eyes) has been known for awhile. https:// twitter.com/Thomas1774Pain e/status/954380611808088064 …	TonyGallippi	0	0	1516377545	954382715691954176	https://twitter.com/TonyGallippi/status/954382715691954176			
	Jordan is onto something here https:// twitter.com/jordanxrachel/ status/954174686975242240 …	TonyGallippi	0	0	1516332520	954193867162742784	https://twitter.com/TonyGallippi/status/954193867162742784			
	As fast as it was moving a tomahawk would appear longer in frame capture than it really is. There are definitely no wings though.	TonyGallippi	2	0	1516322767	954152958022778882	https://twitter.com/TonyGallippi/status/954152958022778882			
	Requesting $0. Nice https:// twitter.com/abc/status/954 010009909825538 …	TonyGallippi	1	0	1516321824	954149003435888641	https://twitter.com/TonyGallippi/status/954149003435888641			
	Definitely does not look like a plane. More like a Tomahawk. https:// twitter.com/lord_bawbag/st atus/954136581018877952 …	TonyGallippi	5	4	1516320584	954143802427609089	https://twitter.com/TonyGallippi/status/954143802427609089			
