	Congrats and thanks for the hard work! https:// twitter.com/peter_szilagyi /status/954354752275566592 …	VitalikButerin	1625	300	1516378998	954388810850160640	https://twitter.com/VitalikButerin/status/954388810850160640			
	This is big news. Will have a major impact on the industry. https:// themerkle.com/weiss-ratings- will-bring-more-legitimacy-to-proper-cryptocurrencies/ …	maxkeiser	337	186	1516401415	954482832667226113	https://twitter.com/maxkeiser/status/954482832667226113			
	Lunch #TNABC with @stacyherbert pic.twitter.com/X79wvMJrDk	maxkeiser	71	12	1516385685	954416858568036352	https://twitter.com/maxkeiser/status/954416858568036352		#TNABC	@stacyherbert
	Typical weenie-waving by macho sh******* looking to score some Western blonde babes. #sad https:// twitter.com/implodeometer/ status/954369620483461121 …	maxkeiser	45	5	1516374645	954370550423605248	https://twitter.com/maxkeiser/status/954370550423605248		#sad	
bitcoin 	“Joining Founders Fund is ‘Mad Max’ Keiser’s Heisenberg Capital - a London - based fund focused on Bitcoin investments.” | https://www. coindesk.com/peter-thiel-fo unders-fund-lead-2m-funding-round-in-bitpay/ …	maxkeiser	40	12	1516374306	954369128508387328	https://twitter.com/maxkeiser/status/954369128508387328			
	@mvparadigm check it out. PEC (Psychic Equity Conversion) @stacyherbert	maxkeiser	4	0	1516373809	954367044962668545	https://twitter.com/maxkeiser/status/954367044962668545			@mvparadigm @stacyherbert
	This just published - an art version of one of my recent @KeiserReport commentaries. @stacyherbert https:// twitter.com/morbidbooks/st atus/954330655483224065 …	maxkeiser	32	14	1516367962	954342522364596225	https://twitter.com/maxkeiser/status/954342522364596225			@KeiserReport @stacyherbert
bitcoin 	Got #Bitcoin ? https:// twitter.com/gian_tcatt/sta tus/954327290216935434 …	maxkeiser	78	19	1516364950	954329886130343936	https://twitter.com/maxkeiser/status/954329886130343936		#Bitcoin	
bitcoin 	Regulators won’t impose meaningful deterrents to stop serial financial terrorists like @HSBC . 100 yrs ago, vigilantes would hunt down these execs and execute them. Today, we buy #Bitcoin instead. https:// twitter.com/reutersbiz/sta tus/954322313708756994 …	maxkeiser	326	193	1516363507	954323836358549505	https://twitter.com/maxkeiser/status/954323836358549505		#Bitcoin	@HSBC
	Keiser Report: Tesla moonshot (E1177) https:// youtu.be/riMrSj-D98w via @YouTube	maxkeiser	22	7	1516320758	954144531561279491	https://twitter.com/maxkeiser/status/954144531561279491			@YouTube
bitcoin 	Happy Birthday Bitcoin, and Don’t Forget About Cypherpunks - Keiser https:// cointelegraph.com/news/happy-bir thday-bitcoin-and-dont-forget-about-cypherpunks-keiser … via @Cointelegraph	maxkeiser	140	64	1516318917	954136809344299008	https://twitter.com/maxkeiser/status/954136809344299008			@Cointelegraph
	Absolutely! Brits are garbage. @RBS is right to suggest they kill themselves (hey, we tried to warn you ). @afneil @BBC http://www. theweek.co.uk/financial-cris is/91051/rbs-memo-to-let-customers-hang-themselves-sparks-fury …	maxkeiser	35	22	1516318342	954134399586570240	https://twitter.com/maxkeiser/status/954134399586570240			@RBS @afneil @BBC
	La déferlante incubateurs : nouveau sous-jacent de l'entrepreneuriat? http:// abonnes.lemonde.fr/emploi/article /2018/01/19/les-incubateurs-nouveau-moteur-entrepreneurial_5243800_1698637.html …	babgi	21	28	1516362526	954319718990667776	https://twitter.com/babgi/status/954319718990667776			
	Une personne adulte passerait au rythme actuel 5 ans et 4 mois de sa vie sur les média sociaux https://www. socialmediatoday.com/marketing/how- much-time-do-people-spend-social-media-infographic …	babgi	3	11	1516357439	954298385477095424	https://twitter.com/babgi/status/954298385477095424			
	Donc, avec 2 milliards d'humains passant chacun 1h par jour sur Facebook (stat officielle) = 228 310 année de vie passées chaque jour sur FB. Un sujet pour les économistes et sociologues de quantifier les externalités...	babgi	102	67	1516346478	954252411400523776	https://twitter.com/babgi/status/954252411400523776			
	Si tu n'as pas compris la Loi de Moore https:// twitter.com/joeerl/status/ 953711344783691777 …	babgi	11	8	1516344419	954243774653353985	https://twitter.com/babgi/status/954243774653353985			
	Thank you for a great day with amazing leaders.	JimMarous	4	1	1516399643	954475400813531136	https://twitter.com/JimMarous/status/954475400813531136			
	Does Twitter have a way to give multiple ‘likes’? https:// twitter.com/jasonhenrichs/ status/954386520449921024 …	JimMarous	6	8	1516388712	954429554306797569	https://twitter.com/JimMarous/status/954429554306797569			
	Keep writing and sharing @psb_dc . You are doing great.	JimMarous	7	0	1516374721	954370870469910529	https://twitter.com/JimMarous/status/954370870469910529			@psb_dc
	Honored to be on list and to be co-publisher of @FinancialBrand , giving me the platform for sharing insights globally. @DeepLearn007 @ipfconline1 @SpirosMargaris @MikeQuindazzi @BrettKing https:// twitter.com/financialbrand /status/954355258335137792 …	JimMarous	22	21	1516374620	954370445691768833	https://twitter.com/JimMarous/status/954370445691768833			@FinancialBrand @DeepLearn007 @ipfconline1 @SpirosMargaris @MikeQuindazzi @BrettKing
	Thanks	JimMarous	10	0	1516374378	954369431160975362	https://twitter.com/JimMarous/status/954369431160975362			
	Plastic in Payments is not revolutionary. Just a neat evolution on old rails. Revolution will come Fromm 100% digital platform. @brettking https:// twitter.com/jblefevre60/st atus/954231972200681477 …	JimMarous	10	22	1516374301	954369109063618562	https://twitter.com/JimMarous/status/954369109063618562			@brettking
	More than 1,750 of the brightest global bank and credit union marketers, product managers and retail bankers coming together for the fastest growing event in banking. https:// twitter.com/financialbrand /status/954113696309096449 …	JimMarous	10	16	1516342441	954235479473512450	https://twitter.com/JimMarous/status/954235479473512450			
	Thank you	JimMarous	6	0	1516341609	954231990592602112	https://twitter.com/JimMarous/status/954231990592602112			
	Thank you	JimMarous	5	0	1516339631	954223693768658944	https://twitter.com/JimMarous/status/954223693768658944			
	Looking forward to dinner and drinks in Chicago at the @GuiltBar. pic.twitter.com/aTb4aQaP2i	JimMarous	2	2	1516321509	954147683811364864	https://twitter.com/JimMarous/status/954147683811364864			@GuiltBar
	Great job everyone. Fun group.	JimMarous	12	0	1516321260	954146636825088000	https://twitter.com/JimMarous/status/954146636825088000			
	Dispelling five myths about cognitive technology. http:// bit.ly/2mNvURR #AI #MachineLearning #Cognitive #TechTrends @DeloitteInsight @Deloitte @DeepLearn007 @Fisher85M @ipfconline1 @KirkDBorne @jblefevre60 @sbmeunier pic.twitter.com/B9Hu0Dm7B9	JimMarous	69	73	1516317443	954130629691666434	https://twitter.com/JimMarous/status/954130629691666434		#AI #MachineLearning #Cognitive #TechTrends	@DeloitteInsight @Deloitte @DeepLearn007 @Fisher85M @ipfconline1 @KirkDBorne @jblefevre60 @sbmeunier
	How about just not being anonymous?	VinnyLingham	2	0	1516346133	954250962658476034	https://twitter.com/VinnyLingham/status/954250962658476034			
	pic.twitter.com/FPfRlJgdNo	VinnyLingham	3	0	1516346093	954250796790525952	https://twitter.com/VinnyLingham/status/954250796790525952			
	#factsdontmatter	VinnyLingham	4	0	1516345740	954249315781771264	https://twitter.com/VinnyLingham/status/954249315781771264		#factsdontmatter	
	Alas, I’ve asked this question many times and it’s as elusive as getting a definitive answer on optimal block size for decentralization	VinnyLingham	4	0	1516345637	954248883252510720	https://twitter.com/VinnyLingham/status/954248883252510720			
	Regardless - I would really love to know from those who believe it is, what the minimum node count for sufficient global decentralization should be is...	VinnyLingham	10	2	1516345350	954247677440540672	https://twitter.com/VinnyLingham/status/954247677440540672			
	Why?	VinnyLingham	0	0	1516341671	954232247787417601	https://twitter.com/VinnyLingham/status/954232247787417601			
	I am not crusading against Core. I’m crusading against hypocrisy within elements of contributors to Core	VinnyLingham	3	0	1516341658	954232193974521857	https://twitter.com/VinnyLingham/status/954232193974521857			
	You just committed 3+ logical fallacies in one thread. Let me know when you figure out which ones.	VinnyLingham	7	0	1516337437	954214488986669056	https://twitter.com/VinnyLingham/status/954214488986669056			
	That’s why we have regulations...oh right, that’s the real world...	VinnyLingham	1	0	1516336767	954211680745013248	https://twitter.com/VinnyLingham/status/954211680745013248			
	Which no-one but the 0.001% care about or will use. Show me data that suggests that more than that cares (you’re in that fraction).	VinnyLingham	4	0	1516336529	954210680462245890	https://twitter.com/VinnyLingham/status/954210680462245890			
	For the 0.001%	VinnyLingham	4	0	1516336400	954210141250859008	https://twitter.com/VinnyLingham/status/954210141250859008			
	Optionality always comes a cost...	VinnyLingham	8	0	1516335963	954208309036265472	https://twitter.com/VinnyLingham/status/954208309036265472			
	#factsdontmatter because it’s not about being practical.../s	VinnyLingham	10	0	1516335327	954205638288056320	https://twitter.com/VinnyLingham/status/954205638288056320		#factsdontmatter	
	There are two types of people in the world : Those who believe the solution to the Monty Hall Problem is a 50:50 and those who don’t. Which one are you? pic.twitter.com/202WTaOtcb	VinnyLingham	119	29	1516334359	954201580252774400	https://twitter.com/VinnyLingham/status/954201580252774400			
	Really? What do you think the op_return Wars were about?	VinnyLingham	13	1	1516332806	954195064435105792	https://twitter.com/VinnyLingham/status/954195064435105792			
bitcoin ethereum 	Let’s ask @VitalikButerin : Did you attempt to build Ethereum on Bitcoin but felt enough/too much resistance from developers(?) to accommodate your needs? Would appreciate a clear reply either way, to settle this thread.	VinnyLingham	34	2	1516330035	954183442412978177	https://twitter.com/VinnyLingham/status/954183442412978177			@VitalikButerin
	@ecurrencyhodler Please stop asking tough questions that mess with the convenient narrative that we need to accept without question.	VinnyLingham	1	0	1516328694	954177819646476288	https://twitter.com/VinnyLingham/status/954177819646476288			@ecurrencyhodler
	Lol	VinnyLingham	0	0	1516328568	954177291474489349	https://twitter.com/VinnyLingham/status/954177291474489349			
	I think the work that @0xProject is doing with @LedgerHQ is game changing...	VinnyLingham	29	11	1516328369	954176456732524544	https://twitter.com/VinnyLingham/status/954176456732524544			@0xProject @LedgerHQ
	Who lied?	VinnyLingham	1	1	1516322478	954151745843703808	https://twitter.com/VinnyLingham/status/954151745843703808			
	Because so many ordinary people are running nodes /s	VinnyLingham	5	0	1516318177	954133705978626048	https://twitter.com/VinnyLingham/status/954133705978626048			
	Check my pinned tweet.	SatoshiLite	21	1	1516400566	954479271489097729	https://twitter.com/SatoshiLite/status/954479271489097729			
	Check my pinned tweet.	SatoshiLite	33	1	1516400474	954478888159072256	https://twitter.com/SatoshiLite/status/954478888159072256			
	What was the original tweet? I can't see it.	SatoshiLite	9	2	1516400395	954478554107949056	https://twitter.com/SatoshiLite/status/954478554107949056			
	This is a great article on the potential of Lightning Networks. https:// twitter.com/WIRED/status/9 54346545247408128 …	SatoshiLite	2766	908	1516400008	954476929939161088	https://twitter.com/SatoshiLite/status/954476929939161088			
	pic.twitter.com/xHm1c7xsnT	SatoshiLite	37	2	1516398266	954469623813976069	https://twitter.com/SatoshiLite/status/954469623813976069			
	Well, I tried not to mention any coins if you noticed.	SatoshiLite	8	1	1516396307	954461407914868736	https://twitter.com/SatoshiLite/status/954461407914868736			
	Promoting another altcoin?! You seriously think I'm promoting another altcoin? This is a joke. Have some humor in your life.	SatoshiLite	24	3	1516395790	954459241774948352	https://twitter.com/SatoshiLite/status/954459241774948352			
litecoin 	Your first tweet just to FUD me? See here: https://www. reddit.com/r/litecoin/com ments/7pklg8/my_rebuttal_to_bitfinexeds_fud_article/ …	SatoshiLite	133	12	1516388939	954430505981652992	https://twitter.com/SatoshiLite/status/954430505981652992			
	There's a guy trying to catch up to us. We've been dropping and , but he's been dodging them using bullet time. That's just unfair! pic.twitter.com/bxVaiIytwF	SatoshiLite	1583	283	1516386935	954422101020045312	https://twitter.com/SatoshiLite/status/954422101020045312			
	Not worth my time to be honest.	SatoshiLite	13	2	1516337288	954213865302061056	https://twitter.com/SatoshiLite/status/954213865302061056			
	Have you tried LoafWallet?	SatoshiLite	19	2	1516329629	954181742079832064	https://twitter.com/SatoshiLite/status/954181742079832064			
	Janice (wife) and I in Thailand yesterday. pic.twitter.com/SZBBBuPDXS	officialmcafee	2809	136	1516374752	954371000115671040	https://twitter.com/officialmcafee/status/954371000115671040			
	Moozicore reached its soft cap today. Congratulations. https:// tokensale.moozicore.com//	officialmcafee	396	64	1516372550	954361765634097154	https://twitter.com/officialmcafee/status/954361765634097154			
	His outfit is proof enough for me.	officialmcafee	94	1	1516355294	954289388443308032	https://twitter.com/officialmcafee/status/954289388443308032			
	I was joking. My apologies.	officialmcafee	96	0	1516354951	954287949843181568	https://twitter.com/officialmcafee/status/954287949843181568			
	Yes. We travel with Jimmy Gayle Watson on his luxuriously converted Antonov An-225 Mriya cargo plane. His cars, trucks, boats, armored vehicles, sports aircraft, racing motorcycles and his stables of world class prostitutes are loaded on and off as needed.	officialmcafee	106	2	1516354803	954287328603901952	https://twitter.com/officialmcafee/status/954287328603901952			
	Thank you	officialmcafee	1	0	1516354319	954285297780645893	https://twitter.com/officialmcafee/status/954285297780645893			
	Thank you	officialmcafee	2	0	1516354204	954284816891105280	https://twitter.com/officialmcafee/status/954284816891105280			
	It's a pre-follow. If your soft followers are not reached we will have to unfollow.	officialmcafee	49	1	1516354097	954284364946341888	https://twitter.com/officialmcafee/status/954284364946341888			
	Who doesn't have doubles these days?	officialmcafee	18	0	1516353710	954282744862920705	https://twitter.com/officialmcafee/status/954282744862920705			
	Well ... it's taken somewhere. Disinformation helps me stay alive while travelling	officialmcafee	60	0	1516353652	954282501412982785	https://twitter.com/officialmcafee/status/954282501412982785			
	I'll have my people look into it	officialmcafee	68	0	1516353569	954282152350420992	https://twitter.com/officialmcafee/status/954282152350420992			
	Not on weekends	officialmcafee	2	0	1516353459	954281692503728129	https://twitter.com/officialmcafee/status/954281692503728129			
	Trying to make the parkphoto coin	officialmcafee	17	0	1516353416	954281509439131648	https://twitter.com/officialmcafee/status/954281509439131648			
	We love garages. Glad you appreciate them.	officialmcafee	25	0	1516353359	954281270296621056	https://twitter.com/officialmcafee/status/954281270296621056			
	Stopping in Norway on the way home. pic.twitter.com/iBUqIjqmvk	officialmcafee	2926	140	1516352319	954276908186955776	https://twitter.com/officialmcafee/status/954276908186955776			
	Word!	officialmcafee	6	1	1516331838	954191005653364736	https://twitter.com/officialmcafee/status/954191005653364736			
	What are you expecting then? Did you read the audit?	officialmcafee	3	0	1516331779	954190760185806848	https://twitter.com/officialmcafee/status/954190760185806848			
bitcoin 	I came to Bitcoin because I was a voluntaryist. Next month at Anarchapulco there will be many people who came to voluntaryism through Bitcoin. Join us! http://www. anarchapulco.com	rogerkver	683	170	1516391215	954440050930081794	https://twitter.com/rogerkver/status/954440050930081794			
	Does checking the price count? https:// twitter.com/wsj/status/954 484139893325824 …	BrettKing	1	0	1516401815	954484512360050688	https://twitter.com/BrettKing/status/954484512360050688			
	Meet Brett King at the most exclusive digital finance and #fintech event in Europe! The Paris Fintech Forum @ParisFinForum is a two day event (January 30th & 31st, 2018) ft. 2,000+ attendees, 200+ CEOs speakers and 150+ fintechs from 45+ countries Tickets: http:// parisfintechforum.com/tickets pic.twitter.com/ezIN3jXWqV	BrettKing	8	3	1516400557	954479234248052736	https://twitter.com/BrettKing/status/954479234248052736		#fintech	@ParisFinForum
	I really don’t get plastic biz models today	BrettKing	5	0	1516376012	954376287195287552	https://twitter.com/BrettKing/status/954376287195287552			
	Good stuff from @johnnosta on the Augmented Age and health tech https:// twitter.com/johnnosta/stat us/954371576677453824 …	BrettKing	4	4	1516375856	954375630384119808	https://twitter.com/BrettKing/status/954375630384119808			@johnnosta
	Shibuya, Tokyo on a Friday night #awesome @Shibuya Crossing 渋谷駅前スクランブル交差点 https://www. instagram.com/p/BeIZBDOlQIM/	BrettKing	6	1	1516365038	954330256600719366	https://twitter.com/BrettKing/status/954330256600719366		#awesome	@Shibuya
	Wow! Check out Brett King's 2017 Travel Year In Review Here's to a new year and new adventures around the world in 2018 Interested in having Brett speak at your event? Contact @provokemgmt #Futurist #Speaker #Author #CEO #RadioHost pic.twitter.com/gxqEaa7Mjv	BrettKing	22	8	1516344183	954242786274013184	https://twitter.com/BrettKing/status/954242786274013184		#Futurist #Speaker #Author #CEO #RadioHost	@provokemgmt
	The certainty of capture likely would.	naval	7	0	1516360048	954309328474857472	https://twitter.com/naval/status/954309328474857472			
	#HealthCare https:// twitter.com/aella_girl/sta tus/951478641262669824 …	naval	58	13	1516354058	954284201603301379	https://twitter.com/naval/status/954284201603301379		#HealthCare	
	Fascinating divergence of responses. You can see the political fault lines. https:// twitter.com/aella_girl/sta tus/951481336287567873 …	naval	88	25	1516353927	954283653894307841	https://twitter.com/naval/status/954283653894307841			
	The ending of that kind of crime, captured on camera, takes the more roundabout form of revolution.	naval	15	0	1516352677	954278411366576129	https://twitter.com/naval/status/954278411366576129			
	A contrarian isn’t one who always objects - that’s a confirmist of a different sort. A contrarian reasons independently, from the ground up, and resists pressure to conform.	naval	2939	921	1516352545	954277855889780739	https://twitter.com/naval/status/954277855889780739			
	The real struggle isn’t proletariat vs bourgeois. It’s between high-status elites and wealthy elites. When their cooperation breaks, revolution.	naval	892	240	1516349113	954263461910913029	https://twitter.com/naval/status/954263461910913029			
	Ubiquitous streaming cameras with remote storage will eventually end almost all physical criminal activities.	naval	709	123	1516338157	954217511293108224	https://twitter.com/naval/status/954217511293108224			
	Nailed it. https:// twitter.com/alokvasudev/st atus/953029878516871168 …	naval	224	27	1516332423	954193459350392833	https://twitter.com/naval/status/954193459350392833			
bitcoin 	Bitcoin Q&A: Scaling complex systems https:// youtu.be/dm9m1oQr6Ks	aantonop	336	138	1516383153	954406238414168064	https://twitter.com/aantonop/status/954406238414168064			
	If I ever meet him in person, I am going to just constantly interrupt him as he tries to speak so he knows how his ads make me feel.	ummjackson	3	0	1516402114	954485763877388288	https://twitter.com/ummjackson/status/954485763877388288			
	These ads follow me everywhere, it's painful. https:// twitter.com/dgolumbia/stat us/954482423173132289 …	ummjackson	27	0	1516401581	954483530645495808	https://twitter.com/ummjackson/status/954483530645495808			
	We need to fix the problems on earth first, before we think about the moon :)	ummjackson	4	0	1516396907	954463923968749568	https://twitter.com/ummjackson/status/954463923968749568			
	Decentralized Friday Drinks at 5:30pm in San Francisco. Be there. Talk #crypto . https://www. facebook.com/events/1917805 74891758 …	ummjackson	11	3	1516395258	954457008538771456	https://twitter.com/ummjackson/status/954457008538771456		#crypto	
	Correct, block-lattice has some similar properties to a DAG though... it also has a PoS element I need to dig deeper into.	ummjackson	3	0	1516395233	954456903194587137	https://twitter.com/ummjackson/status/954456903194587137			
	Planning an upcoming video on both, plus Hashgraph.	ummjackson	20	1	1516394761	954454924590432256	https://twitter.com/ummjackson/status/954454924590432256			
	Then why did you reply to it with that question?	ummjackson	0	0	1516387954	954426371928829952	https://twitter.com/ummjackson/status/954426371928829952			
	What does this have to do with my tweet?	ummjackson	0	0	1516387627	954425002958364677	https://twitter.com/ummjackson/status/954425002958364677			
	Oh I didn't give them anything. They had a wrong address for me, which I confirmed and then I told them I don't like sports before hanging up.	ummjackson	1	0	1516387607	954424917860130816	https://twitter.com/ummjackson/status/954424917860130816			
	Just got a cold call at work from some random shipping company who wanted to send me a Super Bowl jersey. Bizarre.	ummjackson	12	1	1516387254	954423435941195776	https://twitter.com/ummjackson/status/954423435941195776			
	Friday morning grooves. https://www. youtube.com/watch?v=Ga2plV Hr04A …	ummjackson	3	0	1516385407	954415691033034752	https://twitter.com/ummjackson/status/954415691033034752			
	Just my YouTube, or so I thought. Someone else from Brave reached out and is helping. Thanks!	ummjackson	1	0	1516376108	954376687923347456	https://twitter.com/ummjackson/status/954376687923347456			
	That’s the one place it floats	ummjackson	0	0	1516347265	954255712594481152	https://twitter.com/ummjackson/status/954255712594481152			
	You're too kind, thanks for the support :)	ummjackson	1	0	1516344750	954245163404046337	https://twitter.com/ummjackson/status/954245163404046337			
	I wish :P	ummjackson	0	0	1516344735	954245097914183681	https://twitter.com/ummjackson/status/954245097914183681			
	Sweet, followed.	ummjackson	0	0	1516344628	954244650012823552	https://twitter.com/ummjackson/status/954244650012823552			
	Thanks, planning to. The team didn't give me good details about how they'd do a non-private blockchain to be honest, so I've been holding off as to now sound *too* critical of them. Maybe I'll ping them again.	ummjackson	1	0	1516344612	954244585798041601	https://twitter.com/ummjackson/status/954244585798041601			
	There is literally a Dogecoin address on that page... :P	ummjackson	1	0	1516344468	954243978395729920	https://twitter.com/ummjackson/status/954243978395729920			
	People told me they'd added me many months ago, but I haven't seen anything come through. How can I verify it's linked to my YouTube channel correctly? The UI has no way of showing me what URL the donations are linked to as a publisher.	ummjackson	0	0	1516344344	954243459132502017	https://twitter.com/ummjackson/status/954243459132502017			
	We need a crypto-based Patreon :) Otherwise, I might have to look into setting one up.	ummjackson	1	0	1516344245	954243043246276608	https://twitter.com/ummjackson/status/954243043246276608			
	I'm registered there and haven't received a single cent... not sure if something is broken or what :(	ummjackson	0	0	1516344196	954242837771534337	https://twitter.com/ummjackson/status/954242837771534337			
	Well that's terrible... yikes. Thanks for the link.	ummjackson	1	0	1516344172	954242740014825473	https://twitter.com/ummjackson/status/954242740014825473			
	I'm on Steemit but don't seem to be getting a lot of traction. Any tips super appreciated. eg. https:// steemit.com/cryptocurrency /@ummjackson/video-what-is-a-directed-acyclic-graph-dag-iota-byteball-spectre-reviewed …	ummjackson	0	0	1516344118	954242510955560960	https://twitter.com/ummjackson/status/954242510955560960			@ummjackson
	Yep... popcorn at the ready.	ummjackson	1	0	1516344064	954242284396068865	https://twitter.com/ummjackson/status/954242284396068865			
	thank you!!	ummjackson	2	0	1516344045	954242204020572160	https://twitter.com/ummjackson/status/954242204020572160			
	PS. If you find my videos helpful, you can support their creation here: http:// ummjackson.com/support Let me know if a) you think I should start a Patreon or b) I should accept another type of crypto	ummjackson	11	1	1516342977	954237724575150080	https://twitter.com/ummjackson/status/954237724575150080			
	Oh my, you're kidding? Would love to see a link to this.	ummjackson	0	0	1516342922	954237494249234433	https://twitter.com/ummjackson/status/954237494249234433			
	Lots of people in my mentions talking about Decentralized Exchanges. If you need an explanation or want my thoughts, check out my video on the topic: https://www. youtube.com/watch?v=lx6rq0 dbcDE …	ummjackson	26	3	1516342757	954236802373640192	https://twitter.com/ummjackson/status/954236802373640192			
