intv see huge bitcoin blockchain play sever undervalu click	0
nearli bitcoin hack crypto mine compani affluencenetwork marketrang	-1
short bitcoin challeng price like top nassim nichola taleb econom time	0
rpt bounti bitcoin cryptocurr blockchain ico ethereum	1
answer clear bought bitcoin year ago would worth million today that	1
bitcoin save account litecoin check account retweet boost price warren	0
everi singl financi function bank current monopol deposit lend money transfer	1
buy bitcoin paypal also paysafecard skrill okpay btc bitcoin	1
bitcoincard airdrop bitcoin creditcard bitcoin card airdrop round live get free token round	0
must watch ibm think academi blockchain work bigdata fintech	1
btc price btce usd bitstamp usd coinbas usd btc bitcoin	1
bitcoin fail bitcoincrash invest	0
bitcoin fail bitcoincrash invest	0
ever bia financi report cover bitcoin	1
bitcoin fail bitcoincrash invest	0
develop updat syscoin auth lib instant asset transfer blockchain bitcoin fintech	0
bangun masa depan dengan bitmora sebuah exchang cryptocurr yang akan datang blockchain medium bitcoin	1
bitcoin fail bitcoincrash invest	0
dogez alpha version releas blockchain medium bitcoin	1
bitcoin fail bitcoincrash invest	0
bitcoin fail bitcoincrash invest	0
mad scientist publish result blockchain medium bitcoin	1
backdoor societi blockchain medium bitcoin	1
math way articl say bitcoin adopt current doubl everi month	1
bitcoin gold litecoin silver warren	0
realli interest cooper cryptocurr coinbas bitcoin litecoin ethereum	0
intertop casino free spin new player spin bonu reliabl bitcoin	1
lesser known crypto coin token could big gainer cryptocurr bitcoin ethereum	0
bitcoin fail bitcoincrash invest	0
think bitcoin ahead sell think bitcoin wouldnt take	0
big bitcoin owner bitcoin btc blockchain fintech tradin	0
bitcoin	1
koala đang mua bitcoin ngài hôm nay tiền mặt bạn sài gòn xin vui lòng liên với tôi bitcoin	1
なるほど bitcoin ビットコイン ethereum rippl eth xrp	0
bitcoin fail bitcoincrash invest	0
bitcoin fail bitcoincrash invest	0
intv see huge bitcoin blockchain play sever undervalu click	0
putin advisor sergey gazyev suggest use bitcoin cryptocurr get around crippl western financi	0
firstofitskind affili market platform leverag blockchain bitcoin bitcoinnew btc cryptocurr	1
bitcoin fail bitcoincrash invest	0
bitcoin fail bitcoincrash invest	0
bitcoin forev	1
bitcoin fail bitcoincrash invest	0
riot surg along bitcoin buyer bewar lay what got concern stock	0
prioriti love trust famili friend bitcoin	1
bitcoin fail bitcoincrash invest	0
bitcoin fail bitcoincrash invest	0
accord bloomberg peopl may around percent exist bitcoin peopl	0
ethereum light airdrop fast easi secur way onlin payment airdrop open	1
free futur money read like use invit get coin	1
hey new crypto litecoin bitcoin cryptocurr fun invest graduat	0
intv see huge bitcoin blockchain play sever undervalu click	0
bitcoin fail bitcoincrash invest	0
bitcoin fail bitcoincrash invest	0
riot surg along bitcoin buyer bewar lay what got concern stock	0
bitcoin fail bitcoincrash invest	0
network start die margin valu creat new particip exce margin cost impo	-1
know pay vpn router bitcoin cryptocurr friendli compani shop	1
think bitcoin ahead sell think bitcoin wouldnt take	0
mona look readi current bounc support accumul day bitcoin cryptocurr	1
bitcoin fail bitcoincrash invest	0
awesom bitcoin biggest bubbl histori congrat crypto peopl dont use tulip joke	0
electroneum relaunch countdown electroneum token bitcoin investor invest investor	0
bullish bearish bitcoin start trade btcusd today fast secur exc	1
bitcoin fail bitcoincrash invest	0
facebook messag david marcu join coinbas board cryptocurr cryptocurr coinbas facebook bitcoin	1
bitcoin hit anoth record high march toward reutersfintech	1
meet scienc technolog develop foundat macau govern qtg quantumgold bitcoin ethereum btc	0
facebook messag david marcu join coinbas board bitcoin	1
believ much believ bitcoin	1
bitcoin fail bitcoincrash invest	0
bitcoin fail bitcoincrash invest	0
best dividend stock buy free report trade investor invest option	1
facebook messag david marcu join coinbas board bitcoin blockchain fintech	1
andrea receiv million bitcoin donat past week commun constantli portray	0
keep eye ball happyhanukkah growth tuesdaythought startup bigdata domain tech bitcoin	1
bubbl smell pumpanddump folk mortgag hous buy bitcoin	-1
rational review current bitcoin gener crypto mania earli investor author	0
relaunch tomorrow etn electroneum bitcoin hackeron jimparson sheldoncoop	1
bitcoin fail bitcoincrash invest	0
bitcoin fail bitcoincrash invest	0
bank done dump bank stock today buy bitcoin warren	0
bitcoin fail bitcoincrash invest	0
bitcoin mainstream great report last night partli film bitcoinsyd meetup feat	0
bitcoin fail bitcoincrash invest	0
nasdaq debut bitcoin futur mid bitcoin	0
bitcoin	0
bitcoin fail bitcoincrash invest	0
stock drift amid bitcoin excit	1
bitcoin fail bitcoincrash invest	0
miss bitcoin dont miss crypto currenc boom blockchain invest bitcoin barcelona	1
putin advisor sergey gazyev suggest use bitcoin cryptocurr get around crippl western financi	0
feel like bitcoin kind day	0
bitcoin fail bitcoincrash invest	0
bitcoin fail bitcoincrash invest	0
bitcoin fail bitcoincrash invest	0
offici levelnet white paper blockchain bitcoin ethereum cryptocurr ico levelnet	0
read peopl bitcoin control also hear peopl control cattl processin	0
like absolut obsess bitcoin hbo	1
purchas bitcoin btc buy first worth bitcoin use link youll receiv addit	0
interact recent meetup newbi cryptocurr fork doubl money rep	-1
bitcoin fail bitcoincrash invest	0
xlm stellarlumen almost everi exchang fork xrp rippl work ibm bitcoin	1
btc price btce usd bitstamp usd coinbas usd btc bitcoin	0
esw airdrop	0
bitcoin fail bitcoincrash invest	0
putin advisor sergey gazyev suggest use bitcoin cryptocurr get around crippl western financi	0
check levelnet ico bounti campaign follow link detail blockchain bitcoin	0
check levelnet ico bounti campaign follow link detail blockchain bitcoin	0
bitcoin fail bitcoincrash invest	0
invest bitcoin crypto alway amazingand new project trustworthi know project	0
litecoin beat bitcoin year fortun	-1
cheapest hotel tour georgia bitcoin	0
bitcoin futur broker allow neg bet uturn interact broker could shift bitcoin blockchain	-1
bitcoin futur broker allow neg bet uturn interact broker could shift bitcoin blockchain	-1
provid global custom option accept bitcoin method payment websit via	1
top mistak novic bitcoin user make bitcoin ethereum cryptocurr blockchain	1
video earth token natur asset exchang introduct ico ethereum bitcoin crypto	0
bitcoin fail bitcoincrash invest	0
モナちゃんごめんねω モナコイン bitcoin comsa	0
putin advisor sergey gazyev suggest use bitcoin cryptocurr get around crippl western financi	0
fai primo acquisto valuta digital coinbas questo link ricevi omaggio bitcoin prova	0
blockchainexpo great start confer say hello peopl regist bitcoin blockchain ether	0
ftc hit tonight ill send ftc everyon retweet bitcoin crypto alt	0
lutilizzo bitcoin nel mondo real blockchain travel	0
love discuss brian cryptocurr bitcoin btc huge way either loo	0
bitcoin ethereum litecoin absolut crazi	1
bitcoin hit anoth record high march toward reutersfintech	1
stock drift amid bitcoin excit	1
earth token token market modern crypto blockchain bitcoin ico innov	0
bitcoin fail bitcoincrash invest	0
bubbl smell pumpanddump folk mortgag hous buy bitcoin	0
blockchain much bitcoin litecoin ethereum also use food industri	1
bitcoin mainstream great report last night partli film bitcoinsyd meetup feat	0
bitcoin fail bitcoincrash invest	0
cryptonetix ico live crypto blockchain ethereum bitcoin trade	0
tri sinedi per btc bpi buy bitcoin banktran	0
bit bitcoin humor crypto invest cryptocurr ethereum litecoin coinbas techhumor fintec	0
ico welcom bounti bitcoin ether crypto ico ico cryptocurr thread	0
bitcoin admit bitcoincash right version first ignor laugh	0
join airdrop eurostock miner bitcoin	0
bitcoin fail bitcoincrash invest	0
concern billion peopl live that lot peopl must pay	0
still late bitcoin	0
coinbas temporarili suspend litecoin ether buy sell bitcoin btc cryptocurr	1
bitcoin fail bitcoincrash invest	0
bitcoin fail bitcoincrash invest	0
bitcoin fail bitcoincrash invest	0
bitcoin fail bitcoincrash invest	0
video earth token natur asset exchang exchang earth ico coin bitcoin	0
work bitcoin otc broker nearli daili occurr peopl come wonder btc went bec	0
blocknubieio intro decentr ecosystem startup offchain enterpris come soon	1
soon pay tesla like btc bitcoin moon teslarocketship	0
ethereum reach record cryptokitti stabil cryptovest cryptocurr blockchain news	0
free bitcoin spin registr withdraw proof	0
bitcoin fail bitcoincrash invest	0
bitcoin cash basic beginn guid	0
usd profit one day guess say pretti fuckin good noob trader	1
rememb day cboe disabl ltc eth purchas even api bitcoin lite	0
video explain earth token climat neutral fuel ico token coin bitcoin ethereum	0
bitcoin futur add trade hype dealbook brief new york time bitcoin	1
falta una hora para meetup entr microsoft iota bosch criptocurr forex bitcoin criptomoneda futur	0
funnest write week bitcoin	0
bitcoin fail bitcoincrash invest	0
total market cap cryptocurr reach half trillion dollar bitcoin btc cryptocurr blockchain	1
blockchain technolog digit ident digit asset autom manag digit asset use	1
intv see huge bitcoin blockchain play sever undervalu click	0
bitcoin fail bitcoincrash invest	0
ico bitcoin ethereum	0
could argu killer app bitcoin along fact price directli attach real	0
bitcoin market cap surpass goldman sach morgan stanley futur money tothemoon	0
bitcoin fail bitcoincrash invest	0
bitcoin fail bitcoincrash invest	0
bitcoin fail bitcoincrash invest	0
diverg price btc imposs new increas still diverg correct	0
bitcoin fail bitcoincrash invest	0
new bounti want know like recruit ill write particip rpt rpt	0
bitcoin fail bitcoincrash invest	0
bitcoin fail bitcoincrash invest	0
bitcoin mrace establish payment method thank bitcoin commun today victori	0
bitcoin fail bitcoincrash invest	0
bitcoin world biggest bank actual cash world largest taxi compani own vehicl world	0
preginald facebook messag david marcu join coinbas board bitcoin via techcrunch	0
intv see huge bitcoin blockchain play sever undervalu click	0
day left discount swapper tokensal bitcoin ethereum crypto coolpro	0
bitcoin ether crypto ico ico cryptocurr	0
commiss prepar draft tax legisl digit economi expert blog ecofin agre upon new internationa	1
nasdaq debut bitcoin futur mid bitcoin	0
ugchain ecosystem consist seri decentr applic core decentr accou	0
dico per lultima volta possibil che non capiat che bitcoin sarà prossima bolla finanziaria pensi come	0
fee move btc high right wtf cryptoproblem bitcoin btc	0
bitcoin fail bitcoincrash invest	0
bitcoin fail bitcoincrash invest	0
facebook messag david marcu join coinbas board bitcoin coinbas cryptocurr	1
offici levelnet white paper blockchain bitcoin ethereum cryptocurr ico levelnet	0
litecoin yeartod here bitcoin btc cryptocurr blockchain crypto litecoin	1
bitcoin fail bitcoincrash invest	0
publish interview ark team crypto bitcoin cryptocurr	0
bitcoin fail bitcoincrash invest	0
mani bitcoin gone forev bitcoin btc crypto cryptocurr	0
bitcoin fail bitcoincrash invest	0
cuánto sabe del bitcoin toda información que necesita saber sobr criptomoneda internacion	0
bitcoin fail bitcoincrash invest	0
fascin bitcoin specul mania rba governor	-1
expedia exp accept btc form payment bitcoin	0
map decentr world tomorrow	0
gon huge crypto ico bitcoin ethereum invest money moneyfornoth blockch	0
pwhat feel like earn bitcoin daili basi avail googl play	1
thing might know ballist bitcoin read bitcoin	1
crowdfund giant indiegogo open platform ico coindesk socialradi bitcoin	0
next xlm xlm pump dump xrp bitcoin btc wave eth etc fork	0
want bitcoin bitcoin cryptocurr show compound earn join free start	0
bitcoin fail bitcoincrash invest	0
retweet post follow get revain list next week revain kucoin ico bitcoin crypt	0
ethereum reach record cryptokitti stabil cryptovest cryptocurr blockchain news	0
bitcoin fail bitcoincrash invest	0
bitcoin fail bitcoincrash invest	0
gox creditor want bitcoin exchang taken bankruptci coindesk socialradi bitcoin	0
price analysi dec bitcoin ethereum bitcoin cash iota litecoin dash bitcoin news	0
bitcoin market matur point attract invest proposit mainstream	1
need still know bitcoin ether crypto ico ico cryptocurrenc	0
firstofitskind affili market platform leverag blockchain technolog disrupt world adverti	0
litecoin outperform crypto market clear handl volum key indic bitcoin btc news	0
bitcoin fail bitcoincrash invest	0
pool passando por instabilidad foi ativado ban por para todo miner que enviarem mai	0
govern constitut dont get say money peopl	1
breakout mean next leg even bigger last one	0
half trillion bitcoin crypto	0
produc compani doesnt mind bitcoin one bit	1
come bigger ether smaller bitcoin ann thread	0
earn free bitcoin faucethubio bitcoin faucet game faucet micropay	0
buy bitcoin coinbas via	1
bitmex ceo bitcoin futur drastic increas volatil bitcoin btc cryptocurr blockchain crypto	-1
riot surg along bitcoin buyer bewar lay what got concern stock	0
ponzi loom xma blackpodcast bitcoin litecoin ethereum potcoin rippl cryptocurr	-1
second oneit goe show dumb money bitcoin sad	-1
bitcoin cryptocurr blow	0
bitcoin fail bitcoincrash invest	0
yeah bitcoin bigger market cap visa current around bitcoin transact day	0
bitcoin fail bitcoincrash invest	0
bitcoin fail bitcoincrash invest	0
bitcoin fail bitcoincrash invest	0
critic bitcoin often mislead share bitcoin blockchain mean	0
way back bitcoin cheap life good screenshot sept work old websit	1
bounti campaign start last till januari ugchain ugt bitcoin altcoin blockchain	0
cmon simpl question get bitcoin	0
ugchain activ work redefin valu blockchain build new blockchain applic system	0
bitcoin fail bitcoincrash invest	0
bitcoin world biggest bank actual cash world largest taxi compani own vehicl world	0
heard bitcoin could make great holiday gift yearvisit one machin purchas bitcoin	0
putin advisor sergey gazyev suggest use bitcoin cryptocurr get around crippl western financi	0
trump sign defens bill author blockchain studi bitcoin btc cryptocurr blockchain crypto	1
btcx bitcoin welcom common sens	0
bitcoin btc usd eur uah rub litecoin ltc usd eur uah	0
bottom line bitcoincash definit less secur bitcoin	0
mellow simpl bitcoin advertis claim free advertis credit	0
thank mention ebrehmjr expedia exp accept btc form payment btc bitcoinfirehos bitcoin	1
bitcoin fail bitcoincrash invest	0
troubl price bitcoin mimick classic bubbl pattern	0
man serv bitcoin platter holiday	0
anyon els wake kinda rich morn bitcoin btc ethereum eth litecoin ltc	0
bitcoin fail bitcoincrash invest	0
bitcoin	0
feel like earn bitcoin daili basi avail googl play money	1
firstofitskind affili market platform leverag blockchain technolog disrupt world adverti	0
bitcoin ethereum bitcoincash litecoin averag transact fee bitcoincash better faster	0
bitcoin fail bitcoincrash invest	0
yet see anyon hate bitcoin cryptocurr speak intellig bitcoin	1
bitcoin fail bitcoincrash invest	0
bitcoin fail bitcoincrash invest	0
risk bitcoin trade	-1
mauric burnsid gave inform present bitcoin meet held	1
bitcoin fail bitcoincrash invest	0
ethereum safe water first airdrop limit particip esw airdrop ether bitcoin	0
may late bitcoin train feel pretti good right buy ether coupl month ago	1
bitcoin fail bitcoincrash invest	0
got feel bitcoin	0
bitcoin fail bitcoincrash invest	0
win limit edit coinjourn bitcoin godzilla poster altcoin litecoin ether	0
putin advisor sergey gazyev suggest use bitcoin cryptocurr get around crippl western financi	0
neo main aim distribut network smart economi websit state digit asset dig	0
bitcoin fail bitcoincrash invest	0
think mysteri project bitcoin	0
まだ間に合います ビットコイン高騰中です 暗号通貨 ビットコイン bitcoin 仮想通貨	0
bitcoin think peopl got rich bitcoin havent seen anyth yet zero hedg	0
news channel flaw bitcoin ethereum dag solut bitcoin btc news usa	0
bitcoin fail bitcoincrash invest	0
bitcoin soar here readi big time bitcoin	-1
bitcoin fail bitcoincrash invest	0
bitcoin firstofitskind affili market platform leverag blockchain technolog disrupt world	0
bitcoin firstofitskind affili market platform leverag blockchain technolog disrupt world	0
bitcoin fail bitcoincrash invest	0
bitcoin firstofitskind affili market platform leverag blockchain technolog disrupt world	0
alert explain bitcoin blackhol theori believ btc could hit sooner rather later	0
wrong bitcoin here bitcoin	1
chang bitcoin bitcoincash ether	0
yeah thing changefrom money bitcoin chang fomo driven ponzi scheme	0
gagnez bitcoin avec	0
firstofitskind affili market platform leverag blockchain technolog disrupt world adverti	0
bitcoin fail bitcoincrash invest	0
bitcoin fail bitcoincrash invest	0
xrp day long next bitcoin actual use cryptocurr bitcoin xrp rippl crypto	1
rippl support start accept bitcoin ethereum rippl cryptocurr	0
bitcoin fail bitcoincrash invest	0
bitcoin fail bitcoincrash invest	0
bitcoin fail bitcoincrash invest	0
bitcoin mainstream know via	0
fun exchang get bitcoin futurenet bitcoin	0
launch bounti campaign bitcointalk bounti cryptocurr bitcoin bitc	0
yeah thing changefrom money bitcoin chang fomo driven ponzi scheme	0
nfl cowboy giant nfl odd new coach giant cowboy town new york giant	0
iota microsoft bosch meetup stream begin iota microsoft bosch cnn bitcoin criptomoneda	0
throwback crypto bitcoin wetrust trst	0
cuánto sabe del bitcoin toda información que necesita saber sobr criptomoneda internacion	0
bitcoin fail bitcoincrash invest	0
bitcoin fail bitcoincrash invest	0
bitcoin fail bitcoincrash invest	0
leak document withheld fund altcoin pump bittrex face increas scrutini bitcoin	0
bitcoin	0
bitcoin fail bitcoincrash invest	0
bitcoin make peopl rethink thought knew money neverforget mainstream economist financ	0
bitcoin	0
riot surg along bitcoin buyer bewar lay what got concern stock	0
bitcoin hit anoth record high march toward reutersfintech	0
blockchain infograph fintech makeyourownlan mpgvip defstar iot bitcoin cryptocurr	0
want buy bitcoin coincheck bitcoin rightris	0
feel like earn bitcoin daili basi avail googl play money	1
bitfinex cryptocurr exchang hit massiv ddo attack secur bitcoin cryptocurr	0
bitcoin fail bitcoincrash invest	0
bitcoin fail bitcoincrash invest	0
bitcoin fail bitcoincrash invest	0
bitcoin fail bitcoincrash invest	0
bitcoin fail bitcoincrash invest	0
bitcoin price watch trade dip	0
flaw bitcoin ethereum dag solut xbt btc bitcoin	0
bitcoin fail bitcoincrash invest	0
stand coin crypto capit bigger ether smaller bitcoin here ann	0
プチバブル中のxpの購入方法 ビットコイン 仮想通貨 bitcoin btc	0
cryptic crowdsal bitcoin ico cryptocurr forecast	0
accord bloomberg peopl may around percent exist bitcoin peopl	0
cryptic crowdsal bitcoin ico cryptic releas mvp	0
bitcoin time date bitcoin btcusd btc	1
btc price continu fall utc bitcoin btcusd btcusd btc	-1
今ある借金をチャラに 一括返済する方法 bitcoin ビットリージョン ライトライズ ソフトex ジアミスト	0
use case blockchain infograph vote bitcoin startup fintech iot bigdata digit govern	0
cryptic crowdsal bitcoin ico cryptocurr news influenc price	0
etherum eth bitcoin btc litecoin ltc cryptocurr crypto cryptocoin cryptomin	0
tradealik stock trade nyse spx qqq nasdaq bitcoin djia cryptocurr stock ride bitcoin	1
verifi cryptocurr blockchain ethereum bitcoin btc bitcoin ico token crowdsal tokensal	0
ftc hit tonight ill send ftc everyon retweet bitcoin crypto alt lightningnetwork	0
osc investor offic conduct small puls survey bitcoin cryptocurr among find	0
cryptic crowdsal bitcoin ico cryptocurr forecast	0
bitcoin fail bitcoincrash invest	0
bitcoin fail bitcoincrash invest	0
bitcoin fail bitcoincrash invest	0
cryptic crowdsal bitcoin ico cryptocurr trade platform help	0
bitcoin cryptocurr news lot late thing want investor kno	0
bitcoin rout ver disrupt blockchain cryptocurr fintech french	0
bitcoin fail bitcoincrash invest	0
bitcoin buy wall street	0
iota microsoft bosch meetup stream begin iota microsoft bosch cnn bitcoin criptomoneda criptocur	0
cryptic crowdsal bitcoin ico cryptic press releas	0
bitcoin fail bitcoincrash invest	0
offici levelnet white paper blockchain bitcoin ethereum cryptocurr ico levelnet	0
bitcoin fail bitcoincrash invest	0
real scale issu isnt bitcoin exchang	0
indiegogo make easi hop cryptocurr bandwagon bitcoin ethereum fintech	1
bitcoin fail bitcoincrash invest	0
bitcoin fail bitcoincrash invest	0
anyon newli interest bitcoin instead blindli buy instead learn watch cou	0
stand coin crypto capit bigger ether smaller bitcoin here ann	0
man call bitcoin ralli see litecoin	1
novogratz say would sell litecoin surg see bitcoin hit within month	1
bitcoin fail bitcoincrash invest	0
peopl mortgag hous buy bitcoin	0
bitcoin fail bitcoincrash invest	0
bitcoin fail bitcoincrash invest	0
rule never invest cant afford lose bitcoin ethereum rippl	0
higher margin set cme soontolaunch bitcoin futur bitcoin btc fintech	1
first time ever today decid bitcoin transact take long send new one would	0
blockchain infograph fintech makeyourownlan mpgvip defstar iot bitcoin cryptocurr ether	0
strong telegram come join parti cryptocurr blockchain ethereum bitcoin btc bitcoin	0
thank rudi bitcoin buyer meet bitcoin seller	0
short descript dont know bitcoin bitcoinfutur	0
bitcoin fail bitcoincrash invest	0
hypothet sovereign nation join work treasuri cryptocurr litecoin ltc btc bitcoin	1
question bitcoin bubbl real deal	0
blockchain via fintech makeyourownlan mpgvip cryptocurr defstar ethereum iot	1
icymi check demo stk ethwaterloo last month cryptocurr blockchain ethereum bitcoin bitc	0
bitcoin supera tulipan como burbuja grand historia	0
ico welcom bounti bitcoin ether crypto ico ico cryptocurr thread	0
icywallet offer cold storag bitcoin wallet visual impair bitcoin	1
bitcoin fail bitcoincrash invest	0
mannn see bitcoin ama like post keaton	0
rippl benc iotayla birlikt geleceğin parası olabilir btc bitcoin iota ethereum rippl borsa adim adim flood	0
bitcoin appetit unknownnot say agre still post wall street side stori	0
ugchain ugt bitcoin altcoin blockchain great opportun free stake given upon join	0
bitcoin fail bitcoincrash invest	0
motherofgod litecoin bitcoin massadopt holeefuk	0
bitcoin fail bitcoincrash invest	0
dear alt right trumpster yeah mortgag home buy bitcoin snort	-1
bitcoin fail bitcoincrash invest	0
stk token cryptocurr blockchain ethereum bitcoin btc bitcoin ico token crowdsal token	0
thought get bitcoin even altcoin dont know begin dont ton	1
midday market updat tdanfuturesl major indic bitcoin energi usd	0
bitcoin make sens	1
bitcoin fail bitcoincrash invest	0
bitcoin fail bitcoincrash invest	0
litecoin beat bitcoin year fortun	0
hey friend still need get free bitcoin land wallet follow ann treath bitcointalkorg	0
get lot dip sir target sir real flip happen bitcoin targetsir btcu	0
bitcoin fail bitcoincrash invest	0
bitcoin fail bitcoincrash invest	0
thank crypto litecoin ltc ethereum bitcoin twitter realli dont pay much attent els	0
etn way top rank electroneum blockchain cryptocurr bitcoin	0
intv see huge bitcoin blockchain play sever undervalu click	0
syscoin avail purchas directli usd bitcoin blockchain fintech	0
bitcoin fail bitcoincrash invest	0
still dont understand bitcoin know scam said	0
mark cuban say bitcoin futur approv gener posit	0
yabtcl complet provabl fair bitcoin lotteri greatest jackpot помощью	1
chines whale buy fleet car worth million litecoin bitcoin	0
bitcoin fail bitcoincrash invest	0
top mistak novic bitcoin user make bitcoin ethereum cryptocurr blockchain altco	0
bitcoin fail bitcoincrash invest	0
bitcoin fail bitcoincrash invest	0
bitcoin fail bitcoincrash invest	0
bitcoin fail bitcoincrash invest	0
bitcoinatm manufactur lamassu final bitcoincash support merkl bitcoin bitcoincash	0
recent altcoin bull run anticip next bitcoin run	1
bitcoin hit tomorrow send btc everyon retweet follow btc omg neo eth gnt	0
bitcoin fail bitcoincrash invest	0
bitcoin fail bitcoincrash invest	0
power coinlion purchas lion soon earn bonu lion eth bitcoin token cryptocurr	0
bitcoin fail bitcoincrash invest	0
bitcoin world biggest bank actual cash world largest taxi compani own vehicl world	0
bitcoin invest year view fintech	0
bitcoin hit saturday give away bitcoin lucki person follow	0
hardwar bitcoin wallet get trezor btc bitcoin	0
bitcoin fail bitcoincrash invest	0
bitcoin fail bitcoincrash invest	0
top ten texa holdem tip beginn top ten texa holdem tip beginn tip get goin	0
mysteri riddl answer bitcoin ether crypto ico ico cryptocurr	0
bitcoin fail bitcoincrash invest	0
bitcoin fail bitcoincrash invest	0
bitcoin fail bitcoincrash invest	0
bitcoin fail bitcoincrash invest	0
wont ebay serious consid bitcoin payment commerc	1
cryptonetix ico live crypto blockchain ethereum bitcoin trade	0
top rule navig bitcoin blockchain crypto craze via	0
took week parabolictrav prove dirtbag bitcoin	0
bitcoin currenc commod discuss	0
выборе криптобиржи декабре bitcoin crypto scam exchang	0
