anyon els notic bitcoin crowd version crossfit crowd	0
simpl step invest bitcoin get wallet find exchang invest afford loos	0
grupo hacker proponen modernizar tripadvisor para darl fiabilidad opin bitcoin blockchain fintech	0
litecoin ltc litecoin expert say pass bitcoin btcusd	0
weekli analysi bitcoin btc ethereum eth litecoin ltc bitcoincash bch rippl xrp cryptocurr altcoin	0
awesom tell everyon sell gold silver bitcoin stock bond eth amp	0
phonesex blockchain futur bitcoin cryptocurr	0
look like good plan ico blockchain bitcoin rocket btc eth neo dgb strat bnb kmd xrp omg ltc crypto	0
qué son criptomoneda dinero virtual una realidad bitcoin	0
mayb miss ralli bitcoin cryptocurr blockchain altcoin litecoin	0
bitcoin great privat safe xvg vergecurr vergecoin	0
nasdaq debut bitcoin futur mid bitcoin	0
serious consid offer topless crypto class everi day peopl wander ask buy btc	0
bitcoin price respond roymoor win	0
prepar import inform pleas stay tune blockchain bitcoin ethereum game cryptocurr	0
cryptocurr half trillion joint market cap hit billion bitcoin news	0
bitcoin schmuck insur central banker bailout stupid keynesian econom idea btc let	0
cash extinct bitcoin ethereum litecoin	0
btc bitcoin korea	0
shift bitcoin potcoin instantexchang noaccountneed bitcoin potcoin via	0
everybodi retweet bitcoin hit tomorrow promis warren	0
total market capit cross billion coinmarketcap bitcoin crypt	0
total market capit cross billion coinmarketcap bitcoin crypt	0
bitcoin growth blockchain disrupt take market share cloudexpo fintech bitcoin blockchain	0
bitcoin continu soar closer goal	0
bitcoin cryptocurr first time new former dnamoney today	0
justsayin bitcoin still want get involv	0
están hipotecando casa para comprar bitcoin btc btcusd	0
freakin big bang theori bitcoin vulgar boy girl	0
news bitstamp coinbas kraken averag via price bitcoin	0
awesom tell everyon sell gold silver bitcoin stock bond eth amp buy buy	0
offici levelnet white paper blockchain bitcoin ethereum cryptocurr ico levelnet	0
wow bitcoink bitcoin hit weekend ill send btc everyon retweet like buy	0
bullish bearish monero start trade xmrusd fast secur exchang	0
bitcoinlitecoinmonerodashなどを完全匿名で現金で個人間で簡単に対面売買することができるサイトbtctradeppの運営をしております 暗号通貨 cryptocurr bitcoin ビットコイン	0
total market capit cross billion coinmarketcap bitcoin crypt	0
friend dont tell friend buy bitcoin friend tell friend buy bitcoincash	0
feel like earn bitcoin daili basi avail googl play money androi	0
indahash connect influenc brand use blockchain blockchain medium bitcoin	0
pleas pleas give littl earlier christma present bitcoin virtualcurr	0
bitcoin schmuck insur central banker bailout stupid keynesian econom idea btc let	0
come twitta shilla shilla altcoin bitcoin	0
current price bitcoin bitcoin bithound	0
food thought bitcoin litecoin	0
develop updat syscoin auth lib instant asset transfer blockchain bitcoin fintech	0
christma gift list millionair billionair bitcoin	0
saudi arabia promin newspap list bitcoin price among gold crude oil top economi page	0
offici levelnet white paper blockchain bitcoin ethereum cryptocurr ico levelnet	0
launch bitcoin cash visa debit card	0
bitcoin cryptocurr revolut	0
btc戦闘力max zec rep bitcoin モネロ bittrex	0
perhap time investor consid nonbitcoin crypto invest bitcoin adverti	0
today sold etf stock went bitcoin ethereum litecoin let hope work	0
cryptocurr half trillion joint market cap hit billion bitcoin news	0
time year predict made one real gem fintech blockchain ico bitcoin	0
year neo neo bitcoin litecoin ethereum cryptocurr	0
purchas bitcoin btc buy first worth bitcoin use link youll receiv addit	0
gia đình người treo tại sài gòn sập sàn bitcoin cryptocurr	0
get hustl gear hustl daytrad daytrad motiv entrepreneur	0
cofound cryptocurr eleph room bitcoin cryptocurr news	0
sat morn discuss bitcoin	0
launch bitcoin cash visa debit card	0
bitcoin ethereum bitcoincash litecoin averag transact fee bitcoincash better faster	0
andrea antonopoulo receiv bitcoin donat fee bitcoin adv	0
receiv word deep state may tri deton emp tri stop bitcoin warren	0
bitcoin xchang youtub channel made excel review globitex gbx token sale globitex gbx ico	0
bought bitcoin begin pick peopl retweet give bitcoin	0
riot surg along bitcoin buyer bewar lay what got concern stock	0
total market cap crypto top billion first time bitcoin ethereum litecoin	0
ethereum safe water token airdrop ensur safe drink water airdrop open esw airdrop	0
total market capit cross billion coinmarketcap bitcoin crypt	0
bitcoin dutch tulip mania	0
pleas pleas give littl earlier christma present bitcoin virtualcurr	0
satoshi trust physic bitcoin would inscrib	0
monitor price suddenli eth went lucki mode asian self call buy hodl	0
offici levelnet white paper blockchain bitcoin ethereum cryptocurr ico levelnet	0
bancor releas six month updat bitcoin advertis ico	0
come shill villag idiot bitcoin know hodl	0
bitcoin mainstream everyon talk mani peopl tri convinc buy	0
total market capit cross billion coinmarketcap bitcoin crypt	0
actual project bitcoin adopt rate year earli adopt	0
appl remov fake myetherwallet hit app store bitcoin advertis ico	0
cryptocurr whopper day yesterday rippl anyon bitcoin ethereum	0
ethereumblu token airdrop fast easi secur way onlin payment airdrop open	0
come soon dollar back bitcoin dollar equal satoshi talk yesterday	0
understand blockchain bubbl via bitcoin	0
mtgox creditor want bitcoin exchang taken bankruptci via	0
add boscoin pleas	0
come shill villag idiot bitcoin know hodl sli	0
bitcoin save account litecoin check account bitcoincash trash warren	0
total market capit cross billion coinmarketcap bitcoin crypt	0
bitcoin dutch tulip mania	0
develop updat syscoin auth lib instant asset transfer blockchain bitcoin fintech	0
want pump coin retweet repli favorit crypto top tweet get pump bitcoin liteco	0
today sold etf stock went bitcoin ethereum litecoin let hope work	0
trade forex crypto currenc still make lot money bitcoin gold eth etc xrp ltc dont	0
feel like earn bitcoin daili basi avail googl play	0
bitcoin continu soar closer goal	0
bancor releas six month updat bitcoin	0
chines whale buy fleet car worth million litecoin bitcoin	0
predict mani specul bitcoin lost faith modern institut bla	0
bitcoin dutch tulip mania	0
gov turkey talk regul bitcoin exchang	0
비트코인 광풍에 거래소 돈벼락하루 억원씩 다음뉴스 bitcoin	0
startup base bigdata iot fintech insurtech bitcoin cybersecur robot robot	0
bitcoin isnt bubbl tradit market money need somewher warren	0
bitcoin dutch tulip mania	0
red flag yike bitcoinmania bitcoin ethereum cryptocurr	0
south korea hold emerg meet cryptocurr measur expect friday bitcoin	0
bitcoin chart shape pressur lower high high day xbt cboe	0
andrea antonopoulo receiv bitcoin donat fee	0
use case blockchain infograph bitcoin startup fintech iot bigdata digit govern healthit	0
japón corea del sur comenzarán prueba pago internacional usando blockchain rippl bitcoin	0
bitcoin popular answer lie longterm debas fiat currenc around globe	0
bitcoin litecoin ethereum cryptocurr	0
real free bitcoin litecoin bitcoin verg monero safex dash acquir cri	0
real free bitcoin litecoin bitcoin verg monero safex dash acquir cri	0
real free bitcoin litecoin bitcoin verg monero safex dash acquir cri	0
chines whale buy fleet car worth million litecoin bitcoin	0
free btc ethereum bitcoin ethereum bitcoin	0
real free bitcoin litecoin bitcoin verg monero safex dash acquir cri	0
hope sell genesi btc dog see hash imag certifi blockchain	0
feel like earn bitcoin daili basi avail googl play money	0
view echo weekend comment low counterpart new zealand bitcoin	0
real free bitcoin litecoin bitcoin verg monero safex dash acquir cri	0
peopl ramp bitcoin relat job search massiv ralli	0
use case blockchain infograph bitcoin startup fintech iot bigdata digit govern healthit	0
bitcoin schmuck insur central banker bailout stupid keynesian econom idea btc let	0
tri oscarwint per btc bpi buy bitcoin banktran	0
total market capit cross billion coinmarketcap bitcoin crypt	0
vida ooh babi love much pennystock blockchain bitcoin	0
today giveaway btc valu retweet like follow get extra entri bitcoin	0
top faucet bitcoin bitcoincash ethereum dash litecoin dogecoin	0
shit trump delet tweet bitcoin ltc eth	0
fascin bitcoin specul mania rba governor	0
tell everyon sell gold silver bitcoin stock bond eth buy buy buy buy amp hodl litecoin ltc ltc	0
auguri airdrop crypto bitcoin	0
hope everybodi openli mock wsop world seri crypto back june actual	0
vida ooh babi love much pennystock blockchain bitcoin	0
billion french asset manag launch europ first bitcoin mutual fund manag	0
rare see someth volatil bitcoin found bitcoinfutur	0
eur kraken bitcoin kraken btceur	0
realli wish peopl knew potenti litecoin chanc lifetim get	0
hold seat entir economi chang bitcoin ethereum	0
esperen buen precio entrada para xrp rippl ajusten cinturon bitcoin cryptocurr crypto altcoin	0
money invest bitcoin want invit podcast convers subject line	0
origin bitcoin	0
tell everyon sell gold silver bitcoin stock bond eth buy buy buy buy amp hodl litecoin ltc ltc	0
exchang coinbas halt etherlitecoin trade tue eth ltc soar past	0
vida ooh babi love much pennystock blockchain bitcoin	0
vida ooh babi love much pennystock blockchain bitcoin	0
bitcoin hit anoth record high march toward bitcoin bitcoincash money	0
vida ooh babi love much pennystock blockchain bitcoin	0
vida ooh babi love much pennystock blockchain bitcoin	0
use case blockchain infograph bitcoin startup fintech iot bigdata digit govern healthit	0
intv see huge bitcoin blockchain play sever undervalu click	0
novemb bitcoin surpass cowork heavili invest stock market say bubbl would	0
bitcoin hit anoth record high march toward	0
bitcoin digit asset sell better platinum album initi creat payment instrument	0
blockchain fintech bitcoin iot	0
pedir hipoteca para comprar bitcoin locura plena fiebr criptomoneda vía bitcoin	0
mtb hat guy explain bitcoin term angler understand	0
make scare bitcoin	0
feel like earn bitcoin daili basi avail googl play money	0
latest gambl news bitcoin poker	0
bitcoin futur begin trade landmark moment cryptocurr	0
decrypt crypto bitcoin blockchain ico tech cryptocurr bitcoin learn startup invest	0
bitcoin digit asset sell better platinum album initi creat payment instrument	0
rise popular valu bitcoin lead inevit regul	0
buy bitcoin paypal also paysafecard skrill okpay btc bitcoin	0
retweet post follow get revain list next week revain kucoin ico bitcoin crypt	0
cryptocurrecni think stay far bitcoin crash settl decent price	0
bowman get bitcoin miner work pool dont use faucet	0
vida ooh babi love much pennystock blockchain bitcoin	0
north korean hacker continu target bitcoin platform europ asia	0
believ bitcoin bubbl short stfu	0
cryptic crowdsal bitcoin ico cryptocurr trade platform help	0
predict mani specul bitcoin lost faith modern institut blame	0
vida ooh babi love much pennystock blockchain bitcoin	0
humor enquanto isso venezuela bitcoin	0
purchas bitcoin btc buy first worth bitcoin use link youll receiv addit	0
perhap time investor consid nonbitcoin crypto invest bitcoin adverti	0
bitcoin invest year view fintech	0
andrea antonopoulo receiv bitcoin donat fee bitcoin adv	0
bancor releas six month updat bitcoin advertis ico	0
appl remov fake myetherwallet hit app store bitcoin advertis ico	0
market opportun experti huge blockchain revolut ethereum bitcoin	0
bitcoin digit asset sell better platinum album initi creat payment instrument	0
vida ooh babi love much pennystock blockchain bitcoin	0
bitcoin uncorrel asset great addit diversif anyon financi portfolio	0
total market capit cross billion coinmarketcap bitcoin crypt	0
zerohedg rumor look rebrand websit zerobtchedg bitcoin zerohedg newsinjust	0
esperen buen precio entrada para xrp rippl ajusten cinturon bitcoin cryptocurr crypto altcoin	0
gain bcash bitcoin litecoin ethereum vertcoin monero zcash cryptocurr	0
vida ooh babi love much pennystock blockchain bitcoin	0
paystand rais expand blockchain technolog autom busi payment bitcoin	0
bitcoin investor use squar cash app buy sell cryptocurr bitcoin	0
mobil payment compani squar test support bitcoin app bitcoin learn	0
vida ooh babi love much pennystock blockchain bitcoin	0
bitcoin chao proxi cryptocurr valu young peopl lose faith institut	0
reason convert bitcoin want sell fiat	0
bitcoin supera tulipan como burbuja grand historia	0
total market capit cross billion today coinmarketcap	0
cryptonetix ico presal live via crypto ico ethereum bitcoin trade	0
bitcoin hit tomorrow send btc everyon retweet follow btc omg neo eth gnt	0
experti new tool monet motherinlaw cryptocurr ethereum bitcoin blockchain revolut	0
good bitcoin explain share knowledg	0
get bitcoin bitcoin cryptocurr cryptocurr lorimoreno wealthtrend	0
japón corea del sur comenzarán prueba pago internacional usando blockchain rippl bitcoin btc	0
exchang restrict legal tender join link bitcoin	0
nasdaq debut bitcoin futur mid bitcoin	0
come hidden gem rup rup crypto bitcoin	0
buy bitcoin paypal also paysafecard skrill okpay btc bitcoin	0
casa cambio cargan seguridad criptomoneda blockchain ethereum bitcoin	0
vida ooh babi love much pennystock blockchain bitcoin	0
experti new tool monet motherinlaw cryptocurr ethereum bitcoin blockchain revolut	0
ethereumblu token airdrop fast easi secur way onlin payment airdrop open	0
atxt token ico bonu first alttradex ico crypto bitcoin ether	0
bitcoin suck currenc medium exchang support say store valu even thou	0
vida ooh babi love much pennystock blockchain bitcoin	0
experti creat support check ethereum bitcoin cryptocurr	0
thank reward tabl omg new ponzi brand new come fast get free btc lol	0
use bitcoin right unrel note use bcash one bit byte	0
financ rest decemb litecoin bitcoin etherium ltc btc eth	0
think short bitcoin futur gbtc bear nurs big loss bitcoin	0
vida ooh babi love much pennystock blockchain bitcoin	0
vida ooh babi love much pennystock blockchain bitcoin	0
bitcoin futur code read mean coindesk btc cmegroup cboe	0
strong telegram come join parti cryptocurr blockchain ethereum bitcoin btc bitcoin	0
vida ooh babi love much pennystock blockchain bitcoin	0
social media manag get news nofilt hashtag bitcoin alabama socialmedia	0
intv see huge bitcoin blockchain play sever undervalu click	0
good bitcoin explain share knowledg	0
earn bitcoin click bitcoin via	0
litecoin qué hay detrá alternativa bitcoin que está creciendo vía	0
kinda insan emb bit javascript websit user cpu mine crypto without	0
cryptic crowdsal bitcoin ico cryptic press releas	0
here need know import cryptocurr name bitcoin via	0
vida ooh babi love much pennystock blockchain bitcoin	0
cryptocurr good blockchang technolog solid peopl like idea	0
reason convert bitcoin want sell fiat	0
stu heard strong rumour ebay far triall payment bitcoin time aliv time	0
project bigger etherum smaller bitcoin info bitcoin ether crypto	0
nasdaq debut bitcoin futur mid bitcoin	0
entri point hodl btc eth ltc bitcoin ethereum litecoin aka litcoin billycryptokid	0
bitcoin ecosystem switch display valu bitcoin display valu millibitcoin mbtc current	0
gain bcash bitcoin litecoin ethereum vertcoin monero zcash cryptocurr	0
vida ooh babi love much pennystock blockchain bitcoin	0
dawn new era dec stay tune game chang announc fundyourselfnow ethereum bitcoin exchan	0
lmc give million cfun token away decemb use invit code app free coin	0
bitcoin btc 過去時間の履歴 bitzeni zni 過去時間の履歴	0
buy bitcoin address least transact free hmu	0
bitcoin price move fiat money experienc hyperinflationari collaps bitcoin	0
feel like earn bitcoin daili basi avail googl play money	0
yesss bleak exactli believ bitcoin	0
putin advisor sergey gazyev suggest use bitcoin cryptocurr get around crippl western financi	0
korea price time btc krw eth krw xrp krw bitcoin ethereum rippl	0
total market capit cross billion coinmarketcap bitcoin crypt	0
interest articl blockchain bitcoin	0
think short bitcoin futur gbtc bear nurs big loss bitcoin	0
time bat get pump bitcoin btc	0
vida ooh babi love much pennystock blockchain bitcoin	0
hard find newest version bitmain antmin btc miner brand new antrout	0
bcash armi salesmen bitcoin armi engin	0
stu heard strong rumour ebay far triall payment bitcoin time aliv time	0
antibitcoin whiner fuel flame bitcoin price rise kind strang antiilluminati ritual illuminati bitcoin	0
vida ooh babi love much pennystock blockchain bitcoin	0
cheap portabl skin cancer detector dyson award iot internetofth iiot	0
larg bitcoin exchang taken hacker vulner grow	0
interest invest bitcoin need know cryptocurr	0
vida ooh babi love much pennystock blockchain bitcoin	0
bitcoin may reach new height asx show blockchain reinvent busi australia	0
bitcoin altcoin bitcoin時価総額 h増減率 altcoin時価総額 h増減率	0
well enough peopl world understand monetari system believ	0
dont dumb money invest ico blockchain startup startup	0
btc price btce usd bitstamp usd coinbas usd btc bitcoin	0
one bitcoin worth market cap billion base coindesk bpi bitcoin	0
one bitcoin worth high low market cap billion bitcoin	0
red babi show love bitcoin	0
vida ooh babi love much pennystock blockchain bitcoin	0
bitcoin ultima alta baixa font foxbit	0
btc broke support alt come ltc eth bch doge xlm neo xmr wave crypto crypto bitcoin	0
vida ooh babi love much pennystock blockchain bitcoin	0
buy ponzi scheme thing realli know bitcoin mania continu	0
bitcoin bubbl bitcoin short hard find keep futur spot price	0
gox bitcoin fortun found bitcoin price peak hmmm via	0
vida ooh babi love much pennystock blockchain bitcoin	0
precio del bitcoin bitcoin elpreciodelbtc criptomoneda	0
turn bitcoin bitcoin christma read find read coul	0
blockchain news bitcoin bit caribbean paradis bitcoin grenadin realest	0
vida ooh babi love much pennystock blockchain bitcoin	0
turn bitcoin bitcoin christma read find read could	0
japan south korea begin test intern payment use rippl blockchain xrp rippl bitcoin	0
bitcoin set yet anoth record high	0
turn bitcoin bitcoin christma read find read coul	0
bitcoin supera tulipan como burbuja grand historia	0
jim rickard gold bitcoin blockchain eric johnson	0
here bitcoin price differ exchang	0
bitcoin euphoria put retail bet shade	0
bitcoin hit anoth record high march toward	0
mainstream media bank tri attack bitcoin everi possibl level bitcoin bubbl didnt work	0
reason convert bitcoin want sell fiat	0
bitcoin consum energía que país del mundo	0
vida ooh babi love much pennystock blockchain bitcoin	0
btc broke support alt come ltc eth bch doge xlm neo xmr wave crypto crypto bitcoin	0
cryptic crowdsal bitcoin ico cryptocurr trade platform help	0
mine still worth reddit bitcoin	0
best exchang buy sell bitcoin reddit bitcoin	0
possibl coinbas get screw reddit bitcoin	0
ton post say bitcoin chang name someth els reddit bitcoin	0
link bank account coinbas reddit bitcoin	0
much bitcoin irrevoc lost due forgot password accident loss btc wallet death	0
coinbas transact time insan reddit bitcoin	0
bitcoin continu soar closer goal	0
star trek come true bit bitcoin reddit bitcoin	0
bitcoin futur hit market reddit bitcoin	0
south korea hold emerg meet cryptocurr measur expect friday reddit bitcoin	0
feel free help bitcoin btc btcusd	0
wait fling reddit bitcoin	0
pleas stop whine exchang lose money take forev make deposit avail	0
pretti sure mine bitcoin year ago what best way search sever old hard drive find	0
bitcoin schmuck insur central banker bailout stupid keynesian econom idea btc let	0
binanc withdraw fee error reddit bitcoin	0
cloud mine scam reddit bitcoin	0
point fomo becom reddit bitcoin	0
midterm altcoin possibl bitcoin make riskrew	0
quick excel correl googl trend bitcoin price volum reddit bitcoin	0
could possibl burst bitcoin bubbl reddit bitcoin	0
conspiraci theori bitcoin hack could news soon reddit bitcoin	0
vida ooh babi love much pennystock blockchain bitcoin	0
wrong bitcoin here reddit bitcoin	0
vida ooh babi love much pennystock blockchain bitcoin	0
crypto market valu surpass billion interest surg blockchain bitcoin altcoin	0
dec utc bitcoin btc	0
ltc ltc litecoin cryptocurr blockchain bitcoin	0
bitcoin discuss bch debit card eta bitcoin	0
let ico bitcoin cryptocurr ethereum	0
ethercom hit market via ethereum cryptocurr fintech crypto brand blockchain	0
ebay serious consid bitcoin payment retweet spread news	0
nobodi deserv btc donat servic bitcoin	0
icymi watch present cryptocurr bitcoin globitex gbx ico year ecom	0
vida ooh babi love much pennystock blockchain bitcoin	0
midterm altcoin possibl bitcoin make riskrew	0
bcash armi salesmen bitcoin armi engin	0
invest made bitcoin etherum litecoin onthego kilevrahcash makingmajormov killinthebeat	0
vida ooh babi love much pennystock blockchain bitcoin	0
bitcoin	0
tonight give away ltc person like retweet good luck litecoin bitcoin giveaway	0
mani bitcoin gone forev bitcoin btc crypto cryptocurr	0
fascin bitcoin prospect valuat mortgag home optim understand	0
man ckeckocard shit never work said year old person bitcoin	0
japan south korea begin test intern payment use rippl blockchain xrp rippl bitcoin	0
vida ooh babi love much pennystock blockchain bitcoin	0
vida ooh babi love much pennystock blockchain bitcoin	0
vida ooh babi love much pennystock blockchain bitcoin	0
putin advisor sergey gazyev suggest use bitcoin cryptocurr get around crippl western financi	0
vida ooh babi love much pennystock blockchain bitcoin	0
cme group plan regul bitcoin commod say bank korea governor news bitcoin	0
total crypto marketcap sit half trillion dollar bee smart hodl smartcash bitcoin	0
christma giveaway know never giveaway buy give bch one person bitcoin hit tonight	0
vida ooh babi love much pennystock blockchain bitcoin	0
bitcoin blame caus next financi crisi	0
vida ooh babi love much pennystock blockchain bitcoin	0
bed loser bore expect wake etransf bitcoin tribut gabriellataylor	0
intv see huge bitcoin blockchain play sever undervalu click	0
woo market cap crypto hit billion gold ill happi portfolio bitcoin decentr youngmoney	0
end novemb japan southkorea vietnam account nearli bitcoin trade activ	0
bitcoin take demand away bullion goldman view	0
vida ooh babi love much pennystock blockchain bitcoin	0
vida ooh babi love much pennystock blockchain bitcoin	0
enjoy brand new edit global outrag educ manvol purg	0
blockchainexpo great start confer say hello peopl regist bitcoin blockchain ether	0
vida ooh babi love much pennystock blockchain bitcoin	0
vida ooh babi love much pennystock blockchain bitcoin	0
vida ooh babi love much pennystock blockchain bitcoin	0
total market capit cross billion coinmarketcap bitcoin crypt	0
vida ooh babi love much pennystock blockchain bitcoin	0
bitcoin realest	0
casa cambio cargan seguridad criptomoneda blockchain ethereum bitcoin	0
intv see huge bitcoin blockchain play sever undervalu click	0
vida ooh babi love much pennystock blockchain bitcoin	0
cryptocurr whopper day yesterday rippl anyon bitcoin ethereum	0
current price bitcoin current updat price bitcoin check	0
bitcoin schmuck insur central banker bailout stupid keynesian econom idea btc let	0
bcash armi salesmen bitcoin armi engin	0
join brand new facebook group bitcoin bitcoinuk cryptocurr atsocialmedia	0
becom crypto sovereign step redirect govt subsidi oil mine bitcoin suffici quantit	0
day profit spread trade close analyz trader market option option	0
vida ooh babi love much pennystock blockchain bitcoin	0
btc bitcoin korea	0
intv see huge bitcoin blockchain play sever undervalu click	0
bitcoin	0
bitcoin pile gold bitcoin	0
nod mod forc cesspit new trudg epic level spam scam thank	0
sourc martinez meet red sox place bitcoin bet via	0
vida ooh babi love much pennystock blockchain bitcoin	0
btc price fall utc bitcoin btcusd btcusd btc	0
vida ooh babi love much pennystock blockchain bitcoin	0
bitcoin hedg fund flock broker embrac bitcoin futur earli via	0
bitcoin digit asset sell better platinum album initi creat payment instrument	0
step accept payment venezuelan oil bitcoin	0
strong telegram come join parti cryptocurr blockchain ethereum bitcoin btc bitcoin	0
vida ooh babi love much pennystock blockchain bitcoin	0
vida ooh babi love much pennystock blockchain bitcoin	0
sell appl buy bitcoin warren	0
masternod current green xmcc xft ion xlr vivo kore xio mue meme	0
ltc crypto bitcoin uptrend tothemoon	0
total market capit cross billion coinmarketcap bitcoin crypt	0
cryptic crowdsal bitcoin ico cryptocurr forecast	0
insaneth first time post bitcoin year ago bare tonight	0
pars young dao concept bitcoin ethereum blockchain	0
bitcoin pin fiat debt bubbl look	0
bitcoin new ath	0
offici bitcoin new world reserv currenc expect anoth pump cme futur	0
actual project bitcoin adopt rate year earli adopt	0
total market capit cross billion coinmarketcap bitcoin crypt	0
elon musk bitcoin	0
total crypto marketcap sit half trillion dollar bee smart hodl smartcash bitcoin litecoin	0
feel like earn bitcoin daili basi avail googl play money	0
step launch petro crypto local govt run currenc fix dynam bitcoin exchang rate	0
vida ooh babi love much pennystock blockchain bitcoin	0
bch cash shuffl bch atm machin bch debit card bch prime exchang bch overtak	0
confus blockchain here everyth need know technolog behind bitcoin includ mean	0
bitcoin bancor releas six month updat	0
