bounti project pay bounti particip bitcoin read ann bitcoin ether cryp	0
gold guy view crypto bitcoin blockchain zero hedg	0
rba governor philip low say bitcoin specul mania	0
get ask bitcoin daili bitcoin back day still bitcoin today wou	0
insaneth first time post bitcoin year ago bare tonight btc	0
want bitcoin bitcoin cryptocurr show compound earn join free start	0
win bitcoin	0
bitcoin bull focu futur exit entranc via	0
top industri invest blockchain fintech bitcoin insurtech smartcontract iot digit	0
crypto updat bitcoin ether bitcoincash cryptocurr btc eth bch	0
cryptic crowdsal bitcoin ico cryptocurr forecast	0
own bitcoin weekend here learn via	0
stand wait first appear januari bitcoin ether crypto ico ico cryptocurr signal rea	0
putin advisor sergey gazyev suggest use bitcoin cryptocurr get around crippl western financi	0
bitcoin digit currenc rapidli gain mainstream adopt south korea disregard uncertain dir	0
bitcoin make debut major stock exchang leap high	0
australia bitcoin rba chief open idea electron aussi dollar payment	0
cryptic crowdsal bitcoin ico cryptic releas mvp	0
bancor releas six month updat see signific adopt uptick bitcoin	0
purchas bitcoin btc buy first worth bitcoin use link youll receiv addit	0
good bitcoin explain share knowledg	0
south korea bitcoin crazi bitcoin	0
bitcoin start men crypto open women bitcoin	0
australian reserv bank open digit currenc label bitcoin hype specul mania	0
possibl could stand crypto market maker bitcoin ether crypto ico	0
bitcoin hit anoth record high march toward bitcoin	0
bitcoin futur code read mean bitcoin	0
icymi watch present cryptocurr bitcoin globitex gbx ico year ecom	0
cryptic crowdsal bitcoin ico	0
think bitcoin yet sooner get involv bitcoin better start small best advic	0
good run bitcoin investor congrat particip soon volatil increas	0
cryptic crowdsal bitcoin ico cryptocurr news influenc price	0
record ive invest bitcoin litecoin	0
sabe cuanta bifurcacion bitcoin están próxima realizars conoc poco cada una	0
let join forum know bitcoin ether crypto ico ico cryptocurr	0
token magic token sale expert bitcoin ethereum	0
new creativecommon cryptoart commun crypto blockchain bitcoin steem	0
bitcoin current omr real estat shoot back	0
bitcoin	0
visual ico explos ico bitcoin crypto cryptocurr blockchain	0
still safer short bitcoin btx	0
unstopp bitcoin head bitcoin invest cryptotrad btc btc hodl toothemoon	0
cryptocurr crazi cryptocurr bitcoin ethereum litecoin dash bcash	0
bitcoin intergalact currenc nobord cryptocurr worldwid bitcoin	0
must read bitcoin	0
glad short glad long bitcoin	0
present sydney fed bitcoin	0
cryptic crowdsal bitcoin ico	0
own bitcoin weekend here learn bitcoin	0
pull bitcoin reinvest litecoin	0
bitcoin	0
like dream color sneaker buy next watch price might bitnec	0
check latest cryptocurr news updat giveaway bitcoin ethereum litecoin	0
cryptic crowdsal bitcoin ico cryptocurr forecast	0
one world biggest bitcoin market hold emerg meet cryptocurr	0
beyond bitcoin real entrepreneuri opportun global financ bitcoin	0
enter win btc check btc bitcoin giveaway	0
gladli buy bitcoin think might taker well current better	0
bitcoin skyrocket top facebook exec join board coinbas cryptocurr exchang	0
set children bitcoin ethereum litecoin christma crypto christma	0
bitcoin futur mean futur bitcoin bitcoin	0
gdax back see pattern today still hold everi time coinbas went today market spike eve	0
cryptic crowdsal bitcoin ico cryptocurr trade platform help	0
bitcoin pass	0
start australian open men wildcard christoph oconnel omar jasika bet bitcoin	0
vericoin verium suppli year bitcoin vertcoin vrc vrm btc vtc btc bitcoin blockchain fintech	0
cryptic crowdsal bitcoin ico cryptic press releas	0
insaneth first time post bitcoin year ago bare tonight btc	0
privat equiti daili est lign privateequ bitcoin	0
major crypto experienc rapid advanc year bitcoin big mover recent bitcoin fut	0
total market capit cross billion coinmarketcap bitcoin crypt	0
algori pioneer cryptocurr trade market becom leader cryptocurr trade	0
check levelnet ico bounti campaign follow link detail blockchain bitcoin	0
bitcoin euphoria put retail bet shade	0
cite volatil valu steam drop bitcoin support indiedev gamedev unityd game bitcoin	0
ardr buy signal result max profit bitcoin altsareback gmt	0
feel like earn bitcoin daili basi avail googl play money	0
held great confer call bitcoin even like learn buy sell bitcoin let know	0
discuss outcom trade limit present time bitcoinfutur	0
bitcoin time date bitcoin btcusd btc	0
bitcoin break	0
stanford princeton nyu offer cours bitcoin blockchain technolog	0
todo hablan del litecoin ltc pero qué cómo está amenazando trono del bitcoin	0
btc price fall utc bitcoin btcusd btcusd btc	0
franc allow blockchain platform trade secur bitcoin digitalassetdb	0
bitcoin today two week ago sudden growth fluctuat cryp	0
actual project bitcoin adopt rate year earli adopt	0
bitcoin futur trade higher price bitcoin digitalassetdb	0
bitcoin euphoria put retail bet shade	0
franc allow blockchain platform trade secur bitcoin digitalassetdb	0
btcusd approach major resist prepar sell bitcoin trade btcusd leverag	0
miss bitcoin bubbl boom five baffl cryptocurr blow save hope stri	0
two time inform versant capit manag articl cryptocurr bitcoin	0
one click start mine cryptocurr togeth peopl bitcoin cloudcomput	0
purchas bitcoin btc buy first worth bitcoin use link youll receiv addit	0
predict mani specul bitcoin lost faith modern institut blame	0
new bitcoin block mine height	0
none messeng know app futur echatico ico btc bitcoin ether	0
funni respect get bitcoin skeptic year ago laugh much anymor funn	0
insaneth first time post bitcoin year ago bare tonight btc	0
updat bitcoin donat link donat made better improv servic imp	0
australia central bank governor say bitcoin fascin specul mania	0
publish interview ark team crypto bitcoin cryptocurr	0
total market capit cross billion coinmarketcap bitcoin crypt	0
coinmarket bitcoin ethereum litecoin zcash monero etc wave qtum	0
bitcoin rocket buy opportun yesterday gbtc gain today trade session	0
bitcoin move	0
think happen bitcoin	0
bitcoin world biggest bank actual cash world largest taxi compani own vehicl world	0
bitcoin लकर पकसतन tension currenc दखत उसक नकल	0
craig wright explain econom bitcoin via	0
litecoin next bitcoin	0
bitcoin close	0
bitcoin punch	0
voy recomendar una peli para que invierten bitcoin bolsamx imperd verla	0
join first payment bounti campaign bitcoin ether crypto ico ico cryptocurr	0
stk token cryptocurr blockchain ethereum bitcoin btc bitcoin ico token crowdsal token	0
bitcoin close	0
join project invest watch increment bitcoin ether crypto ico ico crypt	0
cryptocurr watch hunt next bitcoin cardano one	0
reason peopl crazi bitcoin bitcoin cryptocurr litcoin	0
would huge could sell old shit bitcoin btc btc	0
interest thesi fed bitcoin	0
litecoin bitcoin litecoin ltc btc bitcoin	0
accord bloomberg peopl may around percent exist bitcoin peopl	0
xbc xbc bitcoinplu thing start youv warn bitcoin	0
bitcoin zombi bitcoin cryptocurr	0
xbc xbc bitcoinplu thing start youv warn bitcoin	0
luka speak diversif crypto market cryptospac diversif market hdg bitcoin ethereum	0
perhap bitcoin growth stunt	0
xbc xbc bitcoinplu thing start youv warn bitcoin	0
xbc xbc bitcoinplu thing start youv warn bitcoin	0
bitcoin price buy bitcoin today make money riski bitcoin	0
thought use cryptocurr food leav comment chewhoo think cryptocurr	0
total market capit cross billion coinmarketcap bitcoin crypt	0
nicehash bitcoin cherch une solut pour rembours utilisateur via	0
xbc xbc bitcoinplu thing start youv warn bitcoin	0
franc allow blockchain platform trade secur bitcoin digitalassetdb	0
bitcoin fascin continu ecb start tighten that german bond yield rise	0
cryptoconfer crypto ethereum bitcoin speaker	0
bitcoin close	0
stronghold built network bitcoin blockchain stellar lumen xlm busi	0
get alot messag friend ask coinbas isnt take verif bbullish btc ltc eth bitcoin crypto	0
mia avventura nell cryptovalut contien informazioni utili per capirn meglio italiano	0
join let make money togeth bitcoin bitconnect invest teambobbym	0
bitcoin time date bitcoin btcusd btc	0
critic bitcoin often mislead share bitcoin blockchain mean	0
bitcoin ether crypto ico ico cryptocurr tokensal	0
bitcoin hit	0
xbc xbc bitcoinplu thing start youv warn bitcoin	0
peopl mortgag home buy bitcoin	0
insaneth first time post bitcoin year ago bare tonight btc	0
bitcoin startup predict cryptocurr market grow much billion bitcoin	0
xbc xbc bitcoinplu thing start youv warn bitcoin	0
peopl mortgag hous buy bitcoin	0
imagin bitcoin went leverag would doubl btc stack roughli	0
bitcoin break	0
xbc xbc bitcoinplu thing start youv warn bitcoin	0
want earn lot btc help check ann thread bitcoin	0
bitcoin	0
insaneth first time post bitcoin year ago bare tonight btc	0
must know poker tip follow tip becom better onlin land base poker player play poker	0
steal blind new onlin poker specif texa holdem may hear term	0
comprehens overview bet poker bet integr part texa holdem poker player must	0
xbc xbc bitcoinplu thing start youv warn bitcoin	0
offici elon satoshi bitcoin	0
wake bitcoinfutur bitcoin ppl like stabl annoy didnt hodl	0
first peopl send btc address chanc	0
xbc xbc bitcoinplu thing start youv warn bitcoin	0
know get touch check bitcoin ether crypto ico	0
get tri start social media campaign music never think	0
xbc xbc bitcoinplu thing start youv warn bitcoin	0
proud announc rais milion less hour dont miss day	0
gbtc anoth today sayin bitcoin cryptocurr crpto blockchain	0
अगर bitcoin नवश करक कमई इनकम आपक टकस	0
proud announc rais milion less hour dont miss day	0
bitcoin	0
stay tune learn bitcoin crypto ether ico ico cryptocurr	0
bitcoin isnt bubbl	0
bitcoin growth normal normal big monster tech compani ever seen btc	0
exchang unwant amazon gift card bitcoin bitcoin	0
okex base hong kong ban hong kong fund trap okex btc bitcoin	0
gold cameron winklevoss say bitcoin becom asset via	0
look like good plan ico blockchain bitcoin rocket btc eth neo dgb strat bnb kmd xrp omg ltc crypto	0
bitcoin bear unleash onto cryptocurr futur market	0
start australian open men wildcard christoph oconnel omar jasika bet bitcoin	0
bitcoin price back set new alltim high blockchain bitcoinpredict btc	0
time utc transact mempool averag fee btc averag fee usd	0
sec chairman warn investor bitcoin via	0
get bitcoin bitcoin cryptocurr cryptocurr lorimoreno wealthtrend	0
climb real estat cut edg alreadi accept bitcoin real estat who readi buy	0
still board bitcoin train isit late vote retweet spread bitcoin prosper	0
would huge could sell old shit bitcoin btc btc	0
moonlight tonight nola nox hodl bitcoin	0
blockchain bitcoin twitter account follow	0
feel like earn bitcoin daili basi avail googl play money	0
mainstream media bank tri attack bitcoin everi possibl level bitcoin bubbl didnt work	0
bitcoin feed frenzi fuell time leverag say exchang bitflyer	0
what next bitcoin futur follow cboe launch cnbc	0
bitcoin bubbl see full cartoon	0
time differ part bitcoin realli	0
bitcoin pass	0
call crypto expert coin start jump tomorrow weigh bitcoin crypto trade cryptocurr	0
trade tip set stop loss buy order cryptocurr bitcoin crypto blockchain	0
new land page pay contact inform chanc get new crypto coin well still	0
might soon abl pay bitcoin ebay	0
bitcoin hit anoth record high march toward via bitcoin news	0
here bitcoin price differ exchang cryptocurr kraken gdax gemini bitfin	0
bitcoin atm davison michigan	0
bitcoin bear unleash onto cryptocurr futur market	0
utah record increas darknet fentanyl relat drug overdos death	0
pull bitcoin reinvest litecoin	0
vida ooh babi love much pennystock blockchain bitcoin	0
research find hidden tracker android app bitcoin advertis ico	0
bitcoin anyon may watch	0
awesom tell everyon sell gold silver bitcoin stock	0
リップル人気ね rippl xrp 日経新聞 仮想通貨 btc bitcoin ビットコイン リップル xrpbeliev xrpthestandard	0
insaneth first time post bitcoin year ago bare tonight btc	0
bitcoin news roundup decemb bitcoin advertis ico	0
bitcoin futur start trade dec crypto blockchain litecoin ether coinbas	0
australian secur exchang asx make crypto histori bitcoin advertis ico	0
insaneth first time post bitcoin year ago bare tonight btc	0
miss bitcoin fear litecoin make rich cryptocurr	0
gbtc anoth today litecoin gain today fun week crypto investor bitcoin cryptocurr blockch	0
qtum take next stop let big news come moon eth ubtc btc bitcoin neo	0
отзывы ньюстрой сирии портал компромат крыма вторник волгоград экономика saakashvili bitcoin	0
end novemb japan southkorea vietnam account nearli bitcoin trade activ glob	0
bitcoin litecoin ether still doubl digit day	0
blackrock quien invierta bitcoin debe estar preparado para perderlo todo	0
bitcoin	0
bitcoin schmuck insur central banker bailout stupid keynesian econom idea btc let	0
retweet gain follow followback followgain autofollowback teamfollowback airdrop bounti bitcoin ethereum	0
price remain inexpens much longer bitcoin trade	0
peopl blind bitcoin price right that see bitcoincash outperform btc	0
bitcoin schmuck insur central banker bailout stupid keynesian econom idea btc let	0
oye compren bitcoin mejor dejens alegar está subiendo como espuma	0
putin advisor sergey gazyev suggest use bitcoin cryptocurr get around crippl western financi	0
icymi watch present cryptocurr bitcoin globitex gbx ico year ecom	0
ビットコイン bitcoin btc ビットコイン 仮想通貨	0
new bitcoin block eadbecfacffaaf mine height	0
good read think twice invest bitcoin	0
investor dump gold bitcoin	0
bitcoin ethereum countri here energi consumpt would rank	0
flash btc hour giveaway follow enter btc bitcoin eth ethereum ltc	0
litecoin bitcoin litecoin ltc btc bitcoin	0
power eth bitcoin token cryptocurr crypto blockchain lion	0
icymi watch present cryptocurr bitcoin globitex gbx ico year ecom	0
good read think twice invest bitcoin	0
bank done dump bank stock today buy bitcoin warren	0
bitcoin bitconnect ethereum litecoin monero zcash genesismin bitcoinmin	0
pull bitcoin reinvest litecoin	0
anyon newli interest bitcoin instead blindli buy instead learn watch cou	0
rippl xrp news japan bank consortium move becom productionreadi bitcoin cryptocurreci crypto	0
anyon newli interest bitcoin instead blindli buy instead learn watch cou	0
would like earn addit incom info could soon main one bitcoin bitcoinuk	0
bitcoin cryptocurr power tech democraci	0
total market cap crypto top billion first time bitcoin ethereum litecoin	0
total market capit cross billion coinmarketcap bitcoin crypt	0
look bitcoin super late night show bitcoin mlm	0
top industri invest blockchain fintech bitcoin insurtech smartcontract iot digit	0
satoshi bitcoin	0
predict year even usd enough purchas delici pizza dollar	0
three altcoin crypto investor keep eye altcoinnew ethereum blockchain cryptocurr bitcoin	0
end novemb japan southkorea vietnam account nearli bitcoin trade activ glob	0
regul issu new cryptocurr ico warn altcoinnew legisl news	0
israel secur author hot bitcoin see promis ico	0
insaneth first time post bitcoin year ago bare tonight btc	0
free bitcoin faucet earn free btc minut bitcoin freebtc getbtc	0
current price bitcoin bitcoin bithound	0
satoshipay built network use lumen nativ asset bitcoin blockchain	0
bitcoin bear unleash onto cryptocurr futur market	0
bitcoin bear unleash onto cryptocurr futur market	0
bitcoin bear unleash onto cryptocurr futur market	0
bitcoin bear unleash onto cryptocurr futur market	0
lesserknown cryptocurr chanc exceed bitcoin market cap	0
btc work ltc eth bch doge xlm neo xmr wave crypto crypto bitcoin	0
bitcoin schmuck insur central banker bailout stupid keynesian econom idea btc let	0
fintechfrank bitcoin bear unleash onto cryptocurr futur market	0
get free start mine bitcoin free sign account sign	0
stronghold built network bitcoin blockchain stellar lumen xlm busi nasd	0
bitcoin disrupt gold market btc xbt ltc eth	0
southkorean offici sound caution current bitcoin frenzi lure season	0
cryptonetix ico live crypto blockchain ethereum bitcoin trade	0
newprofilep bitcoin litecoin ethereum eth altcoin yew	0
might soon abl pay bitcoin ebay	0
investor dump gold bitcoin	0
bank done dump bank stock today buy bitcoin warren	0
cryptonetix ico live crypto blockchain ethereum bitcoin trade	0
total market capit cross billion coinmarketcap bitcoin crypt	0
purchas bitcoin btc buy first worth bitcoin use link youll receiv addit	0
insaneth first time post bitcoin year ago bare tonight btc	0
sincer hope stori scale challeng face bitcoin btc ethereum eth	0
riot surg along bitcoin buyer bewar lay what got concern stock	0
bitcoin bear unleash onto cryptocurr futur market	0
honestli believ front row seat could end one craziest mania alltim	0
want profit bitcoin need use hashflar bitcoinmin	0
hey hidden withdraw fee like mani bitcoin exchang trade signup starttrad	0
insaneth first time post bitcoin year ago bare tonight btc	0
govern deepstat must found backdoor bitcoin	0
enter art contest win crypto surviv kit ltc btc bitcoin crypto crypto steem	0
giveaway bitcoin litecoin btc share happi rule follow amp pick random winner	0
cryptocurr oil launch itll complet govern compliant bitcoin fintech crude	0
nice said bitcoin crypto	0
globalist plan blame bitcoin biblic level collaps freedom altcoin decentr	0
bitcoin worth new zealand economi	0
santa surf christma eve christma cocoa beach surf wsj nytim	0
santa surf christma eve christma cocoa beach surf wsj nytim	0
santa surf christma eve christma cocoa beach surf wsj nytim	0
santa surf christma eve christma cocoa beach surf wsj nytim	0
santa surf christma eve christma cocoa beach surf wsj nytim	0
santa surf christma eve christma cocoa beach surf wsj nytim	0
santa surf christma eve christma cocoa beach surf wsj nytim	0
eur kraken bitcoin kraken btceur	0
want bitcoin bitcoin cryptocurr show compound earn join free start	0
mania phase secur regul warn mortgag taken buy bitcoin	0
monthli incom usd usd mine bitcoin bitcoin cash contact info unit	0
cryptocurr bitcoin	0
bitcoin look like tulip tulipmania btc	0
ethereum safe water token airdrop ensur safe drink water airdrop open esw airdrop	0
einigen münchener café kann man schon mit bitcoin bezahlen gute daran man sein wechselgeld bekommt hat sich der	0
updat skorea hold emerg meet cryptocurr measur bitcoin ethereum crypto	0
bitcoin news bitcoin futur code read mean want trade bitcoin futur first	0
bitcoin hit tomorrow send btc everyon retweet follow btc omg neo eth gnt	0
baidu xiaomi work togeth internetofth iot	0
day dream hodl bitcoin litecoin ethereum crypto	0
bitcoin news bitcoin futur code read mean want trade bitcoin futur first	0
blockbid softcap hit day still left particip bitcoin ethereum altcoin	0
wan take moment point despit troll bitcoin rare see peopl attack	0
bitcoin consum less energi nondigit equival	0
get closer qualcomm febdec bitcoin febdec	0
bitcoin ethereum countri here energi consumpt would rank	0
bitcoin news bitcoin futur code read mean want trade bitcoin futur first	0
success success entrepreneur ethereum busi bitcoin	0
einstein aliv cryptocurr bitcoin btc	0
bitcoin futur trade cboe stabl back cryptocurr continu extremel	0
detal interesant paper del que refieren directament tratamiento tributario dar	0
del comento que bitcoin demostrado ser bastant sólido esto último año durant evento	0
jeweleri busi network jnet ico crowdsal bitcoin blockchain token eth ethereum tokensa	0
santa surf christma eve christma cocoa beach surf wsj nytim	0
santa surf christma eve christma cocoa beach surf wsj nytim	0
santa surf christma eve christma cocoa beach surf wsj nytim	0
buy bitcoin paypal also paysafecard skrill okpay btc bitcoin	0
hodl let grow togeth info telegram channel twitter	0
santa surf christma eve christma cocoa beach surf wsj nytim	0
santa surf christma eve christma cocoa beach surf wsj nytim	0
santa surf christma eve christma cocoa beach surf wsj nytim	0
santa surf christma eve christma cocoa beach surf wsj nytim	0
santa surf christma eve christma cocoa beach surf wsj nytim	0
santa surf christma eve christma cocoa beach surf wsj nytim	0
there lot chat bitcoin ico realli get return altern take	0
bulldax gemini bitstamp bearfinex bitcoin	0
sign binanc trade ltc eth xrp xmr futur aka iota iota right	0
bitcoin bear unleash onto cryptocurr futur market	0
bitcoin news bitcoin futur code read mean want trade bitcoin futur first	0
ビットコイン情報局 ビットコイン bitcoin さくら学院 さくら学院購買部	0
tradealik stock trade nyse spx qqq nasdaq bitcoin djia cryptocurr startup keep eye	0
end novemb japan southkorea vietnam account nearli bitcoin trade activ glob	0
time differ part bitcoin realli btc bitcoin	0
ethereum safe water token airdrop ensur safe drink water airdrop open esw airdrop	0
bitcoin news bitcoin futur code read mean want trade bitcoin futur first	0
feel like earn bitcoin daili basi avail googl play money	0
could access onlin wallet sell crypto coin pleas upgrad microwav	0
bitcoin safer invest socialcaf	0
sincer hope stori scale challeng face bitcoin btc	0
utah record increas darknet fentanyl relat drug overdos death	0
research find hidden tracker android app bitcoin advertis ico	0
bitcoin news roundup decemb bitcoin advertis ico	0
australian secur exchang asx make crypto histori bitcoin advertis ico	0
prepar import inform pleas stay tune blockchain bitcoin ethereum game cryptocurr	0
end novemb japan southkorea vietnam account nearli bitcoin trade activ glob	0
bitcoin news bitcoin futur code read mean want trade bitcoin futur first	0
burbank buy bitcoin arsc gbtc coin riot ostk ssc mara uep bitcf xnet	0
wish kept btc instead sell theyr bitcoin	0
isnt bitcoin magic trick bite quarter make normal bitcoin	0
love music artofdar realfriend metoo youtuberewind bitcoin brown themasksing	0
bitcoin bear unleash onto cryptocurr futur market	0
anyon give bitcoin giveaway donat	0
insaneth first time post bitcoin year ago bare tonight btc	0
admit would leav bitcoincash possibl depend detail	0
cryptic crowdsal bitcoin ico cryptocurr trade platform help	0
insaneth first time post bitcoin year ago bare tonight btc	0
top crypto hold explain live ethereum bitcoin dash monero cryptocurr ebtc smartcash ltc	0
blockchain bitcoin twitter account follow	0
morningbul buy btcusd bitcoin check live perform	0
insaneth first time post bitcoin year ago bare tonight btc	0
gold cameron winklevoss say bitcoin becom asset via	0
bitcoin bear unleash onto cryptocurr futur market	0
blockchain fintech bitcoin iot	0
bitcoin llegó bolsa chicago	0
make sens bitcoin wild price ride quicktak	0
putin advisor sergey gazyev suggest use bitcoin cryptocurr get around crippl western financi	0
lol mani peopl know bitcoin	0
bitcoin news bitcoin futur code read mean want trade bitcoin futur first	0
atf blockchain medium bitcoin	0
distribut ledger technolog next wave transform financi inclus blockchain medium bitcoin	0
distribut ledger technolog next wave transform financi inclus blockchain medium bitcoin	0
retweet post follow get revain list next week revain kucoin ico bitcoin crypt	0
borrow blockchain blockchain medium bitcoin	0
good idea blockchain medium bitcoin	0
bitcoin ethereum bitcoin cash rippl litecoin price analysi octob bitcoin uasociolog	0
nice one bitcoinnew btcnew btc bitcoin	0
total market capit cross billion coinmarketcap bitcoin crypt	0
bitcoin isnt bubbl	0
qué cómo son transaccion cuánto valen aquí contamo todo sobr bitcoin	0
bitcoin news bitcoin futur code read mean want trade bitcoin futur first	0
gold cameron winklevoss say bitcoin becom asset via	0
buy bitcoin paypal also paysafecard skrill okpay btc bitcoin	0
capitalización criptomoneda usd bitcoin usd btc ethereum usd	0
bitcoin isnt bubbl	0
bitcoin soar here readi big time wire bitcoin reach	0
know crypto quickli mainstream seattl seahawk richard sherman trade mention	0
bitcoin digit asset sell better platinum album initi creat payment instrument	0
awesom bitcoin biggest bubbl histori congrat crypto peopl dont use tulip joke	0
nasdaq debut bitcoin futur mid bitcoin	0
bitcoin averag daili valu chang btc bitcoin	0
rememb good old day bitcoin bank blockchain bank bitcoin alttcoin rememb came	0
post craigslist give user option accept cryptocurr like bitcoin big step forward	0
bitcoin news bitcoin futur code read mean want trade bitcoin futur first	0
buy bitcoin	0
insaneth first time post bitcoin year ago bare tonight btc	0
bitcoin gold	0
dont think australia rba philip low understand job made obsolet bitcoin cryptocurr	0
fintechfrank bitcoin bear unleash onto cryptocurr futur market	0
incorrect valu come diminish suppli milli	0
bitcoin futur code read mean market bitcoin subfeatur	0
cryptic crowdsal bitcoin ico cryptic press releas	0
total market capit cross billion coinmarketcap bitcoin crypt	0
actual comment facebook discuss bitcoin dont listen naysay actual take lot	0
tweet like prove bitcoin low cost pimp broker exchang love	0
claim bitcoin free claim btc everi minut start bitcoin ico crypt	0
insaneth first time post bitcoin year ago bare tonight btc	0
bitcoin news bitcoin futur code read mean want trade bitcoin futur first	0
ebay serious consid bitcoin payment retweet spread news	0
bitcoin news bitcoin futur code read mean want trade bitcoin futur first	0
