bitcoin chao proxi cryptocurr valu young peopl lose faith institut	0
bitcoin supera tulipan como burbuja grand historia	0
blockchain fintech bitcoin iot	0
lead cryptocurr exchang face outag bitcoin rival surg litecoin ethereum	0
man actual drop legit good advic bitcoin	0
btcusd ico scam alert canadian court send perpetr plexcoin ico scam jail btc	0
offici levelnet white paper blockchain bitcoin ethereum cryptocurr ico levelnet	0
bitcoin	0
late bitcoin parti huh littl advic dont put less transfer fiat	0
bitcoin gold say guy unawar shitti gold	0
readi bitcoin	0
bitcoin noth els make famou bitcoin cryptocurreni crypto bitcoinpric	0
bitcoin schmuck insur central banker bailout stupid keynesian econom idea btc let	0
bitcoin futur broker allow neg bet	0
sec chairman warn investor bitcoin daddi way home fintech regtech	0
two thing tell bitcoin poison peopl realli nasti disagre like liber often	0
year order big mac robot doubt youll hand bill sure itll crypto bitcoin litecoin	0
rational review current bitcoin gener crypto mania earli investor author	0
beginn guid ethereum iot cybersecur bigdata fintech blockchain robot smartciti bitcoin	0
amaz thank sober discuss differ perspect behind	0
blind fervor bitcoin feel reminisc beani babi bubbl here invest bitcoin	0
blockchain fintech bitcoin iot	0
fake news former new zealand prime minist deni invest bitcoin coindesk	0
bitcoin digit currenc get attent trader lunch	0
close bubbl burst bitcoin get start part thing coin	0
bitcoin longer store valu store hope hope price goe hope transact get confirm	0
sabía que bitcoin sistema pago que tien ent gubernament que respald emita	0
buy bitcoin address least transact free hmu	0
famili tour guid georgia bitcoin	0
bitcoin биткоин новый оборонный бюджет сша заложены исследования технологии блокчейн	0
savag numb pain tour vlog learnearnbitcoin	0
updat bitcoin experi ein den letzten wertzuwach seit beginn experi	0
surreal see bitcoin featur almost daili day blockchain crypto	0
walmart bitcoin real think invest walmart invest bitcoin	0
let sink moment predict time next year past trillion market cap	0
savag numb pain tour vlog learnearnbitcoin	0
launch bitcoin cash visa debit card	0
joyner luca keep learnearnbitcoin	0
bitcoin disrupt gold market btc xbt ltc eth	0
bitcoin higher bitcoin futur fall second day	0
amaz serial killer surviv stori learnearnbitcoin	0
get caught super heat market coin believ overtak	0
periscop goldgoatsngun bitcoin sell strength keep emot check	0
joyner luca dear america offici video learnearn	0
unreal like bitcoin	0
savag rich life forb net worth car hous ice amber rose	0
bitcoin bear soon short futur interact broker btc bitcoin altcoin trade	-1
total market capit cross billion coinmarketcap bitcoin	0
weekthatwa prospect bitcoin rival electroneum call launch mani member user	0
bitcoin beaniebabi modern era good luck	0
work bitcoin otc broker nearli daili occurr peopl come wonder btc went bec	0
follow bitcoin crypto currenc articl here buy join ride choos	0
bitcoin schmuck insur central banker bailout stupid keynesian econom idea btc let	0
total market capit cross billion coinmarketcap bitcoin crypt	0
wonder bitcoin altcoin trend twitter	0
news bitstamp coinbas kraken averag via	0
total market capit cross billion coinmarketcap bitcoin crypt	0
total market capit cross billion coinmarketcap bitcoin crypt	0
often yall check bitcoin wallet next time check send queen half balanc	0
litecoin cryptomonnai qui superform bitcoin ltc progressé moi sur	0
bitcoin saw marketshar decreas crypto market hit half trillion dollar mark today	0
roger ver bitcoin jesu promot bitcoincash better invest bitcoincash bitcoin cash bch	0
total market capit cross billion coinmarketcap bitcoin crypt	0
total market capit cross billion coinmarketcap bitcoin crypt	0
total market capit cross billion coinmarketcap bitcoin crypt	0
bitcoin beaniebabi modern era good luck	0
total market capit cross billion coinmarketcap bitcoin crypt	0
what impact alsen race bitcoin price	0
even earn usd worth bitcoin today bitcoin could worth thousand dollar next year	0
total market capit cross billion coinmarketcap bitcoin crypt	0
bitcoin noth els make famou bitcoin cryptocurreni crypto bitcoinpric	0
sabía que bitcoin sistema pago que tien ent gubernament que respald emita	0
cnbc roll lmao cryptocurr bitcoin litecoin usd btc ltc fiat	0
ddo attack match blockchain technolog bitcoin	0
late jump bitcoin bandwagon	0
total market cap crypto top billion first time bitcoin ethereum litecoin	0
total market capit cross billion coinmarketcap bitcoin crypt	0
thing peopl talk today asia govern keep eye fiscal deficit china	0
total market capit cross billion coinmarketcap bitcoin crypt	0
lead cryptocurr exchang face outag bitcoin rival surg ltc eth hodl	0
canada new secur bankfriendli bitcoin exchang live vancouv open account trade within	0
cryptocurr ethereum cryptocurr bitcoin eth btc	0
mani bitcoin gone forev bitcoin btc crypto cryptocurr	0
total market capit cross billion coinmarketcap bitcoin crypt	0
total market capit cross billion coinmarketcap bitcoin crypt	0
total market capit cross billion coinmarketcap bitcoin crypt	0
putin advisor sergey gazyev suggest use bitcoin cryptocurr get around crippl western financi	0
bitcoin futur launch bitcoin worth hous bitcoin blockchain cryptocurr btc crypto	0
total market capit cross billion coinmarketcap bitcoin crypt	0
total market capit cross billion coinmarketcap bitcoin crypt	0
total market capit cross billion coinmarketcap bitcoin crypt	0
bitcoin price surg may help north korea rais money amid heavi global sanction hack cryptocurr	0
cryptonetix ico live crypto blockchain ethereum bitcoin trade	0
blockchain decentralis theori firm blockchain medium bitcoin	0
rocket pool faq blockchain medium bitcoin	0
market summari decemb blockchain medium bitcoin	0
koala đang mua bitcoin ngài hôm nay tiền mặt bạn sài gòn xin vui lòng liên với tôi bitcoin	0
ecosystem partner ambrosu overhaul groceri suppli chain blockchain medium bitcoin	0
latest sec regard ico blockchain medium bitcoin	0
young thug owe million mortgag payment money financ bitcoin cryptocurr	0
case miss memo help chanc bitcoin reach	0
current read influenti mind want know bitcoin well	0
cryptocurr market hit billion market cap first time big mileston histori	0
take money bitcoin put inrippl ethereum litecoin iota cryptocurr	0
precio del bitcoin bitcoin btc	0
vida ooh babi love much pennystock blockchain	0
bitcoin usd next hour	0
total market capit cross billion coinmarketcap bitcoin crypt	0
total market capit cross billion coinmarketcap bitcoin crypt	0
omg rememb hear bitcoin year ago thought	0
view echo weekend comment low counterpart new zealand bitcoin	0
earn bitcoin one top mine site web hashflar btc cryptocurr	0
mani bitcoin gone forev bitcoin btc crypto cryptocurr	0
view complet news releas bitcoin	0
enorm runup bitcoin price year spur talk bitcoin	0
stock trade nyse spx nasdaq bitcoin djia cryptocurr everybodi keep say stock market	0
feel like earn bitcoin daili basi avail googl play money	0
bitcoin futur assur bitcoin strong futur stocku platform alreadi plan integr bitcoin	0
intv see huge bitcoin blockchain play sever undervalu click	0
total market capit cross billion coinmarketcap bitcoin crypt	0
chines whale buy fleet car worth million litecoin bitcoin	0
bitcoin everi time heard	0
total market capit cross billion coinmarketcap bitcoin crypt	0
cryptonetix ico presal live via crypto ico ethereum bitcoin trade	0
bitcoin pop first time bitcoin hyip bitcoin profit	0
earn bitcoin one top mine site web hashflar btc cryptocurr	0
household stock ownership highest level sinc bitcoin	0
total market capit cross billion coinmarketcap bitcoin crypt	0
today invest xrp eth excit futur long hold xrp rippl eth bitcoin	0
total market capit cross billion coinmarketcap bitcoin crypt	0
catch tomorrow morn discuss bitcoin develop digit curren	0
sabía que bitcoin sistema pago que tien ent gubernament que respald emita	0
début bitcoin bours chicago blockchain cryptocurr stockexchang	0
crecimiento bitcoin llega chile tendrán primer cajero comienza invertir moneda del fut	0
earn free bitcoin sign luno bitcoin exchang use code hxnw buy sell bitcoin receiv percen	0
absurd energi usag increas transact fee kill bitcoin blockchain cryptocurrenc	0
cryptic crowdsal bitcoin ico cryptocurr trade platform help	0
beginn guid ethereum iot cybersecur bigdata fintech blockchain robot smartciti bitcoin	0
peopl get success take risk bitcoin usitech cryptocurr	0
think much bitcoin ebay consid accept btc crypto	0
ebay serious consid accept bitcoin	0
australia central bank chief voic grow critic bitcoin	0
cours craigslist would lol bitcoin litecoin nofiat	0
total market capit cross billion coinmarketcap bitcoin crypt	0
winter come bitcoin	0
there lot bitcoin price blockchain tech cryptocurr	0
blockchain startup ico infograph cybersecur cryptocurr bitcoin fintech healthcar insurtech	0
total market capit cross billion coinmarketcap bitcoin crypt	0
mtb hat guy explain bitcoin term angler understand	0
gal valleriu son procè pourrait sceller lavenir bitcoin via bitlicens newyork bzh	0
bitcoin beaniebabi modern era good luck	0
total market capit cross billion coinmarketcap bitcoin crypt	0
power coupl bought bitcoin donat gain cancer hosp	0
intv see huge bitcoin blockchain play sever undervalu click	0
amount untap potenti bitcoin btc gon make break year	0
bitcoin gifto vision virtual gift economi cryptocurr	0
total market capit cross billion coinmarketcap bitcoin crypt	0
valuabl coin world bitcoin list	0
chines whale buy fleet car worth million litecoin bitcoin	0
bitcoin cant money bitcoin econom	0
total market capit cross billion coinmarketcap bitcoin crypt	0
litecoin bitcoin better	0
total market cap crypto top billion first time bitcoin ethereum litecoin	0
icywallet offer cold storag bitcoin wallet visual impair fintech accessibi	0
bitcoin schmuck insur central banker bailout stupid keynesian econom idea btc let	0
preach bitcoin btc	0
ark writer short list everyon crypto short list arkecosystem	0
novogratz say would sell litecoin massiv surg bitcoin cryptocurr	0
bitcoin turn profit real life	0
sat morn discuss bitcoin	0
litecoin cryptomonnai qui superform bitcoin ltc progressé moi sur	0
cryptic crowdsal bitcoin ico cryptocurr forecast	0
econom theori cryptocurr new post blockchain bitcoin	0
strong telegram come join parti cryptocurr blockchain ethereum bitcoin btc bitcoin	0
bitcoin işlem ücretlerind kadar tasarruf imkanı bitcoin bitcoinfe	0
want trade bitcoin	0
bitcoin gold say guy unawar shitti gold	0
bitcoin higher bitcoin futur fall second day	0
valuabl coin world bitcoin list	0
rippl bitcoin moon cryptocurr	0
total market capit cross billion coinmarketcap bitcoin crypt	0
market money invest technolog scienc game china asia sport videogam news parent teen usa	0
sabía que bitcoin sistema pago que tien ent gubernament que respald emita	0
technic support amount usd chang wallet bitcoin	0
south korean govern hold emerg meet bitcoin trade	0
dear babi boomer technophob apathi neglig delay transfer wealth	0
launch bitcoin cash visa debit card	0
power coupl bought bitcoin donat gain cancer hospit	0
yabtcl complet provabl fair bitcoin lotteri greatest jackpot also free lotteri	0
set epic crash crash cryptocurr bitcoin	0
rentabl minería bitcoin dash nube forma casera	0
sabía que bitcoin sistema pago que tien ent gubernament que respald emita	0
welcom twitter marqui trill everyon ask buy bitcoin litecoin ethereum	0
shoutout dude temporarili date told bitcoin month ago girl make mulah	0
bitcoincash bitcoin cash bitcoin core doesnt brainpow financ econ	0
til bitcoin commun use much electr denmark via	0
bitcoin bitclub blockchain mine hast fragen dann frag mich hat einfach	0
bitcoin beaniebabi modern era good luck	0
moon bitcoin bitcoin faucet decid claim bitcoin faucet btc moon	0
bitcoin price could exceed say trader bitcoin btc bitcoink	0
total market capit cross billion coinmarketcap bitcoin crypt	0
peopl wealth dollar dont make laugh truth bitcoin total	0
let ico bitcoin cryptocurr ethereum	0
bitcoin current bitcoin price btc usd goldcoinjar	0
total market capit cross billion coinmarketcap bitcoin crypt	0
total market capit cross billion coinmarketcap bitcoin crypt	0
learn trade bitcoin technolog bitcoin cryptomonnai tout que vou devez savoir pour	0
total market capit cross billion coinmarketcap bitcoin crypt	0
select one buy today btc btcusd bitcoinnew bitcoin litecoin coinbas crypto	0
hour left last chanc buy loc token crypto tokensal ico bitcoin etherum	0
bitcoincom launch bitcoin cash visa debit cryptocurr news	0
bulgaria seiz enough bitcoin pay nation debt	0
cryptic crowdsal bitcoin ico cryptic press releas	0
updat buy bitcoin cryptocurr guid explain mani way enter cryptospher start own	0
eth breakout bitcoin trade ethbtc leverag	0
cryptic crowdsal bitcoin ico cryptic press releas	0
bitcoin bitcoinuk	0
bitcoin world biggest bank actual cash world largest taxi compani own vehicl world	0
that simmer news bitcoincash bitcoin ethereum	0
case dont see bitcoin alreadi heavili central asic miner manufactur bigger block woul	0
total market capit cross billion coinmarketcap bitcoin crypt	0
think got btc late zoom perspect done fine bitcoin crypto	0
present limacryptoforum criptomoneda bitcoin blockchain peru fintech abogadosperu technolog	0
total market cap crypto top billion first time bitcoin ethereum litecoin	0
what bitcoin get one look gold shini	0
imagin bitcoin went leverag would doubl btc stack roughli	0
total market capit cross billion coinmarketcap bitcoin crypt	0
sound excit bitcoin readi scale ltc better	0
trade tip set stop loss buy order cryptocurr bitcoin crypto blockchain	0
total market capit cross billion coinmarketcap bitcoin crypt	0
earn bitcoin daili basi avail googl play money android	0
total market capit cross billion coinmarketcap bitcoin crypt	0
total market capit cross billion coinmarketcap bitcoin crypt	0
top bitcoin address control percent issu currenc btcusd	0
free bitcoin cours short video bitcoin mine blockchain wallet	0
lead cryptocurr exchang face outag bitcoin rival surg ltc eth hodl	0
facebook messag david marcu join coinbas board cryptocurr social bitcoin crypto	0
thank cryptocurr open user avail buy sell trade	0
gooni first investor bitcoin bitcoincash smovi amc classic gooni fratelli	0
total market capit cross billion coinmarketcap bitcoin crypt	0
think much bitcoin ebay consid accept btc crypto	0
total market capit cross billion coinmarketcap bitcoin crypt	0
total market capit cross billion coinmarketcap bitcoin crypt	0
huge bitcoin cryptocurr adopt make access everyon network	0
total market capit cross billion coinmarketcap bitcoin crypt	0
bitcoin futur code read mean coindesk socialradi bitcoin	0
bitcoin futur due date quot cboe chicago board option exchang	0
feel like earn bitcoin daili basi avail googl play money	0
newbi keep ask buy bitcoin bitcoin litecoin ethereum blockchain cryptocurr crypto crypt	0
fake news former new zealand prime minist deni invest bitcoin coindesk	0
bitcoin futur launch bitcoin worth hous bitcoin blockchain cryptocurr btc crypto	0
check ann thread info least hint bitcoin ether crypto ico ico cryptocurr	0
invest bitcoiny would get good return posit profit new economi	0
total market capit cross billion coinmarketcap bitcoin crypt	0
blockchain fintech bitcoin iot	0
timelin right bitcoin steroid	0
intv see huge bitcoin blockchain play sever undervalu click	0
total market capit cross billion coinmarketcap bitcoin crypt	0
progress well dont forget join invest bitcoin ether crypto ico ico crypto	0
intv see huge bitcoin blockchain play sever undervalu click	0
intv see huge bitcoin blockchain play sever undervalu click	0
bitcoin futur due date quot cboe chicago board option exchang	0
two thing tell bitcoin poison peopl realli nasti disagre like liber often	0
bitcoin goe next year give everyon retweet tweet btc	0
bitcoin futur assur bitcoin strong futur stocku platform alreadi plan integr bitcoin	0
bitcoin bubbl see full cartoon	0
intv see huge bitcoin blockchain play sever undervalu click	0
hour left last chanc buy loc token crypto tokensal ico bitcoin etherum	0
coinmarket bitcoin ethereum litecoin zcash monero etc wave	0
bitcoin schmuck insur central banker bailout stupid keynesian econom idea btc let	0
offici levelnet white paper blockchain bitcoin ethereum cryptocurr ico levelnet	0
episod crypto bozo bonu episod infin licens soundcloud bitcoin btc	0
mike maloney new bitcoin documentari cryptocurr blockchain	0
appl remov fake myetherwallet hit app store bitcoin altcoin fintech	0
intv see huge bitcoin blockchain play sever undervalu click	0
sabía que bitcoin sistema pago que tien ent gubernament que respald emita	0
launch bitcoin cash visa debit card bitcoin	0
intv see huge bitcoin blockchain play sever undervalu click	0
bitcoin	0
australian central bank governor say bitcoin mostli attract crimin specul tele blog	0
regist free account trade bitcoin earn even bitcoin bitcoinuk atsocialmedia	0
intv see huge bitcoin blockchain play sever undervalu click	0
bitcoincom launch bitcoin cash visa debit card	0
btc price btce usd bitstamp usd coinbas usd btc bitcoin	0
total market capit cross billion coinmarketcap bitcoin crypt	0
total market capit cross billion coinmarketcap bitcoin crypt	0
intv see huge bitcoin blockchain play sever undervalu click	0
later tonight nhl golden knight keep inexplic rack win make wildcard	0
andrea btc energi consumpt bitcoin btc	0
appl remov fake myetherwallet hit app store bitcoin btc	0
appl remov fake myetherwallet hit app store bitcoin blockchain fintech	0
おすすめはコインチェック 仮想通貨の種類が多く取り扱ってます bitcoin rippl イーサリアム nem	0
kasperski drag govt trashcan weapon blockchain agil devop mull bitcoin blockchain	0
even interest bitcoin futur broker allow neg bet via	0
qué cosa puedo pagar con bitcoin bitcoin cryptocurr	0
keanureev bitcoin destroy globalelit give power back peopl	0
invest bitcoin back would worth	0
intv see huge bitcoin blockchain play sever undervalu click	0
know ive talk fundament trst feel there mani new peopl deserv	0
need share inform lead wealth creation bitcoin invest realest smallbusi strategi entrepreneurship	0
total market capit cross billion coinmarketcap bitcoin crypt	0
bitcoin con mucha gana romper máximo histórico bitcoin criptomoneda	0
novogratz say would sell litecoin surg see bitcoin hit within month	0
total market capit cross billion coinmarketcap bitcoin crypt	0
bitcoin vega slot machin somebodi better doubl check motherfuckin jackpot frequenc	0
former facebook exec chamath palihapitiya social media bitcoin musk	0
bitcoin hit anoth record high march toward	0
bitcoin wonder exchang theyll choos	0
blockchain fintech bitcoin iot	0
issu noth show account even though portfolio show	0
articl bitcoin make seem technolog incompet journalist integ	0
bitcoin excit big boost peopl want trade swapiti cryptocurrenc	0
xvg vergecoin vergecurr hodl altcoin bitcoin	0
latest bitcoin daili cryptocurr bitcoin	0
gari investor edg radio show min stooland edit	0
total market capit cross billion coinmarketcap bitcoin crypt	0
intv see huge bitcoin blockchain play sever undervalu click	0
here like addict bitcoin bitcoin novemb cryptocurr dollar inr invest	0
bitcoin hit tomorrow send btc everyon retweet follow btc omg neo eth gnt	0
intv see huge bitcoin blockchain play sever undervalu click	0
intv see huge bitcoin blockchain play sever undervalu click	0
bitcoin career xbt crypto add algo coin coiniumserv	0
total market capit cross billion coinmarketcap bitcoin crypt	0
adopt would roof ebay would make decis accept bitcoin	0
paul meek top pick first think strong get stronger tech sector plu	0
paul meek top pick first think strong get stronger tech sector plu	0
paul meek top pick first think strong get stronger tech sector plu	0
need share inform lead wealth creation bitcoin invest realest smallbusi strategi	0
total market capit cross billion coinmarketcap bitcoin crypt	0
appl remov fake myetherwallet hit app store blockchain fintech bitcoin	0
better bitcoin coleman tipphil cuse bitcoin	0
financi institut smbc resona bank begin remitt experi two korean major bank	0
want free money litecoin bitcoin sign	0
total market capit cross billion coinmarketcap bitcoin crypt	0
one best thing work blockchain right get tag great bitcoin meme	0
intv see huge bitcoin blockchain play sever undervalu click	0
appl remov fake myetherwallet hit app store bitcoin btc	0
pleas donat bitcoin institut best invest make futur	0
intv see huge bitcoin blockchain play sever undervalu click	0
ist ein ico und zwei gründe vorsichtig sein sec bitcoin ethereum ether ico	0
here like addict bitcoin bitcoin novemb cryptocurr dollar inr invest indian ame	0
today start show discourag specul bitcoin crypto currenc share proverb	0
still dont understand bitcoin know scam said	0
wellfund blockchain compani fintech cryptocurr cybersecur bitcoin crypto infosec	0
total market capit cross billion coinmarketcap bitcoin crypt	0
share via bitcoin btc	0
今話題の buzz space おもろ オモロい動画 話題動画キュレーションサイト おもしろすぎて bitcoin ビジネス ファッション 副業始めました お小遣い 副業したい	0
total market capit cross billion coinmarketcap bitcoin crypt	0
justsayin get involv regist bitcoin usitech bitcoinuk	0
intv see huge bitcoin blockchain play sever undervalu click	0
patient await day bitcoin blockchain crypto	0
bitcoin ethereum litecoin bitcoin cash rippl monero nem iota	0
let week old crypto trade algorithm loos bitcointalk fun	0
power coupl bought bitcoin donat gain cancer hospit	0
drove uber today two japanes guy couldnt understand anyth heard one say bitcoin	0
bitcoin schmuck insur central banker bailout stupid keynesian econom idea btc let	0
receiv profit mom avenu bitcoin drop receiv bonu instantli crowdsal start	0
bitcoin schmuck insur central banker bailout stupid keynesian econom idea btc let	0
patient await day bitcoin blockchain crypto	0
ico look like good invest cryptocurr bitcoin	0
work bitcoin	0
icymi bitcoin flux global game ecosystem playerown game platform build strong loyalti	0
bitcoin time date bitcoin btcusd btc	0
icymi bitcoin flux global game ecosystem playerown game platform build strong loyalti	0
icymi bitcoin flux global game ecosystem playerown game platform build strong loyalti	0
bitcoin appl remov fake myetherwallet hit app store	0
bitcoin appl remov fake myetherwallet hit app store	0
bitcoin appl remov fake myetherwallet hit app store	0
bitcoin schmuck insur central banker bailout stupid keynesian econom idea btc let	0
alreadi invest bitcoin without without websit whitepap social media channel know team bitcoin contr	0
want get bitcoin craze without buy bitcoin mayb buy bitcoin sweater instead	0
everi second matter hustl success bitcoin makeithappen pchzone	0
intv see huge bitcoin blockchain play sever undervalu click	0
bitcoin transact work blockchain fintech iot bigdata cryptocurr saa	0
lartisanat bitcoin vou dit quelqu chose demandez moteur recherch sur quil pens vou	0
cuál pued ser combust que llevado litecoin hasta bitcoin	0
bitcoin slow expens volatil currenc noth price includ bitcoin	0
higher margin set cme soontolaunch bitcoin futur	0
ethereum safe water token airdrop ensur safe drink water airdrop open	0
look start home bitcoin freelanc	0
attent follow direct messag earn worth bitcoin freebitcoin better bitcoinfaucet htt	0
drop freelanc websit solo bitcoin freelanc	0
yabtcl complet provabl fair bitcoin lotteri greatest jackpot also free lotteri	0
appl remov fake myetherwallet hit app store bitcoin	0
good view potenti bubbl long term valu bitcoin cryptocurr busi bitcoin financ	0
ethereum safe water token airdrop ensur safe drink water airdrop open	0
sabía que bitcoin sistema pago que tien ent gubernament que respald emita	0
avocado toast toast bitcoin design	0
breakingnew south korea hold emerg meet crypto cryptocurr btc bitcoin trade eth	0
intv see huge bitcoin blockchain play sever undervalu click	0
know fear bitcoin dont understand never someon trade isnt btc dont understand	0
intv see huge bitcoin blockchain play sever undervalu click	0
bitcoin futur code read mean want trade bitcoin	0
big week cryptocurr dramat chang price bitcoin other wel	0
total market capit cross billion coinmarketcap bitcoin crypt	0
said bitcoin debit card	0
publish interview ark team crypto bitcoin cryptocurr	0
understand bitcoin futur code futur cboe	0
intv see huge bitcoin blockchain play sever undervalu click	0
perhap time investor consid nonbitcoin crypto invest xbt btc bitcoin	0
rba governor speech electron aud say reason one could caus massiv rapid destruct	0
prepar import inform pleas stay tune blockchain bitcoin ethereum game cryptocurr	0
best websit mine bitcoin easi withdraw bitcoin bitcoinmin promot eletan	0
power coupl bought bitcoin donat gain cancer hospit	0
bitcoin rival litecoin smash record valu astonish year	0
satoshi bitcoin	0
bitcoin airbit club	0
bitcoin digit asset sell better platinum album initi creat payment instrument	0
oop bitcoin see jimcram jamiedimon blankfein free open marketplac	0
total market capit cross billion coinmarketcap bitcoin crypt	0
anyon explain dogecoin bytecoin track nearli ident past month trad	0
