	My four year old son is so amped about Christmas he's refusing to take of his Christmas pajama top before we go outside. I'm just telling everyone we're from Shanghai. He's my hero	BaldingsWorld	48	4	2017-12-23 08:29:39	944470041168265216	https://twitter.com/BaldingsWorld/status/944470041168265216			
	fact	BaldingsWorld	1	0	2017-12-23 07:44:19	944458630140641280	https://twitter.com/BaldingsWorld/status/944458630140641280			
	Christmas with Party characteristics pic.twitter.com/B2cQMm4s19	BaldingsWorld	6	0	2017-12-23 07:19:36	944452411740979200	https://twitter.com/BaldingsWorld/status/944452411740979200			
	War on Christmas with Chinese characteristics pic.twitter.com/4kZskaK7Qd	BaldingsWorld	14	4	2017-12-23 07:11:58	944450489747255296	https://twitter.com/BaldingsWorld/status/944450489747255296			
		BaldingsWorld	0	0	2017-12-23 04:42:52	944412965809172480	https://twitter.com/BaldingsWorld/status/944412965809172480			
	This is the world Chinese hipsters want pic.twitter.com/ozuNd88z9l	BaldingsWorld	8	0	2017-12-23 04:03:36	944403087334154240	https://twitter.com/BaldingsWorld/status/944403087334154240			
	I know a number of people that are quite concerned about the structuring of the DB transaction. This is just piling on https://www. wsj.com/articles/china s-hna-group-turns-to-prized-assets-to-borrow-cash-1513941054 … pic.twitter.com/CMq7A46l0i	BaldingsWorld	4	2	2017-12-23 02:28:57	944379268372488192	https://twitter.com/BaldingsWorld/status/944379268372488192			
	Smart girl for sure	BaldingsWorld	2	0	2017-12-23 02:03:46	944372928862240769	https://twitter.com/BaldingsWorld/status/944372928862240769			
	Mommy: We're thinking of going to Beijing for vacation 6yr old daughter: I don't want to go Mommy: why not? 6yr: sounds boring Mommy: really not. All kinds of amazing things to see. 6yr: I really like nice hotels Mommy: uh oh.	BaldingsWorld	31	7	2017-12-23 01:51:00	944369715945885698	https://twitter.com/BaldingsWorld/status/944369715945885698			
	Ah. Better go look into that.	prchovanec	0	0	2017-12-23 23:57:24	944703515691311106	https://twitter.com/prchovanec/status/944703515691311106			
	"The fact that you don't know just shows how far our idea of ""normal"" has fallen."	prchovanec	2	0	2017-12-23 23:56:45	944703352788709378	https://twitter.com/prchovanec/status/944703352788709378			
	But yes, it can also imply that I don't know which holidays you might be celebrating, or not, at this time of year.	prchovanec	2	0	2017-12-23 23:55:29	944703032129880065	https://twitter.com/prchovanec/status/944703032129880065			
	Not necessarily. We used to say it in Catholic school, not because anyone wasn't celebrating Christmas, but because multiple holidays would take place before we saw that person again.	prchovanec	2	0	2017-12-23 23:54:31	944702789380427777	https://twitter.com/prchovanec/status/944702789380427777			
	Those who do celebrate Christmas are never ready for it either, I can assure you.	prchovanec	4	0	2017-12-23 23:53:35	944702556072300544	https://twitter.com/prchovanec/status/944702556072300544			
	I'm tired of Dem lawmakers saying this. We need more GOP lawmakers saying it. I'm glad that some have. https:// twitter.com/thehill/status /944701410242912256 …	prchovanec	12	4	2017-12-23 23:50:24	944701752737255425	https://twitter.com/prchovanec/status/944701752737255425			
	But how can you get too wound up about a daily reality?	prchovanec	1	0	2017-12-23 23:48:53	944701373576306689	https://twitter.com/prchovanec/status/944701373576306689			
	I'm pretty wound up about the President behaving in an unprofessional and bullying way, even if everything you say were proven to be true.	prchovanec	3	0	2017-12-23 23:47:21	944700985884184576	https://twitter.com/prchovanec/status/944700985884184576			
	And so it begins. BTW, I was advised that the GOP tax bill explicitly bars people from taking a 2017 deduction for prepaid 2018 state & local taxes. Correct or not? https:// twitter.com/thehill/status /944699403192946698 …	prchovanec	4	1	2017-12-23 23:44:43	944700324568293377	https://twitter.com/prchovanec/status/944700324568293377			
	If true, that is 100% beside the point.	prchovanec	0	0	2017-12-23 23:41:01	944699392468144128	https://twitter.com/prchovanec/status/944699392468144128			
	It also reflects Xi's broader crackdown on a more free and open civil society in China, which is pushing China backwards in so many ways.	prchovanec	1	0	2017-12-23 23:38:24	944698734415360001	https://twitter.com/prchovanec/status/944698734415360001			
	It's important to people whose religious freedom is supposedly guaranteed by the Chinese constitution, but face harassment and even imprisonment for practicing their faith.	prchovanec	0	0	2017-12-23 23:37:16	944698448422604801	https://twitter.com/prchovanec/status/944698448422604801			
	Contrarian argument of the day: https:// hackernoon.com/ten-years-in-n obody-has-come-up-with-a-use-case-for-blockchain-ee98c180100 … pic.twitter.com/zc5SlzvjEI	prchovanec	13	2	2017-12-23 23:19:53	944694076183666689	https://twitter.com/prchovanec/status/944694076183666689			
	I actually object to many of the policies, and I'm pretty ordinary GOP (or what used to be).	prchovanec	2	2	2017-12-23 23:15:33	944692985039671298	https://twitter.com/prchovanec/status/944692985039671298			
	Deeply shameful that the President of the United States should publicly taunt a public servant, regardless of circumstances. Always the bully, never a leader. https:// twitter.com/realDonaldTrum p/status/944666448185692166 …	prchovanec	461	191	2017-12-23 23:06:30	944690707046060032	https://twitter.com/prchovanec/status/944690707046060032			
	"Dec 23, 1917 - News of the World: Father Christmas has plenty of welcome gifts for Britain for the new year. Note the fairly modest ""stand pat"" expectations for 1918. #100yearsago pic.twitter.com/9Dn6qNRiUi"	prchovanec	5	1	2017-12-23 23:01:46	944689514655739904	https://twitter.com/prchovanec/status/944689514655739904		#100yearsago	
	Dec 23, 1917 - New York Times: US uncovers coded German spy messages carried by neutral Scandinavian seamen for pay #100yearsago pic.twitter.com/9d6DtRmvmm	prchovanec	4	3	2017-12-23 22:57:18	944688390074699776	https://twitter.com/prchovanec/status/944688390074699776		#100yearsago	
	Dec 23, 1917 - New York Times: Japan denies mobilizing its army to deploy to Vladivostok or Russian outposts in Manchuria #100yearsago pic.twitter.com/OhBbDKMthD	prchovanec	2	1	2017-12-23 22:55:54	944688040592715776	https://twitter.com/prchovanec/status/944688040592715776		#100yearsago	
	Dec 23, 1917 - New York Times: More fingers pointed over inefficiency and corruption in US gear-up for war #100yearsago pic.twitter.com/IElGhqVDuU	prchovanec	2	1	2017-12-23 22:54:40	944687729744531456	https://twitter.com/prchovanec/status/944687729744531456		#100yearsago	
	Dec 23, 1917 - New York Times: French chamber of deputies votes to put former Prime Minister Caillaux on trial for having treasonable dealings with Germany #100yearsago pic.twitter.com/qEFEhKOWVr	prchovanec	1	0	2017-12-23 22:53:55	944687540661039104	https://twitter.com/prchovanec/status/944687540661039104		#100yearsago	
	The predictable injury has taken place.	prchovanec	1	0	2017-12-23 19:38:55	944638466930958341	https://twitter.com/prchovanec/status/944638466930958341			
	The fixation of young children on the topic of underwear as a source of humor is pretty remarkable.	prchovanec	8	1	2017-12-23 19:37:59	944638232452624384	https://twitter.com/prchovanec/status/944638232452624384			
	Nope.	prchovanec	1	0	2017-12-23 19:28:47	944635916408250370	https://twitter.com/prchovanec/status/944635916408250370			
	But the funny thing is, we even said it at Catholic school because, you know, NEW YEAR too.	prchovanec	4	0	2017-12-23 19:22:29	944634330877394944	https://twitter.com/prchovanec/status/944634330877394944			
	In large part, because we may not see each other until after the New Year, so I'm wishing you both at the same time. Right?	prchovanec	21	1	2017-12-23 19:21:01	944633959413178368	https://twitter.com/prchovanec/status/944633959413178368			
	"When people said ""happy holidays"" to me (as they have my entire life), I always just assumed they were including New Years in the package, not negating my religion."	prchovanec	93	14	2017-12-23 19:19:15	944633518663053312	https://twitter.com/prchovanec/status/944633518663053312			
	U-boats do too (to be fair).	prchovanec	0	0	2017-12-23 19:15:05	944632467956338688	https://twitter.com/prchovanec/status/944632467956338688			
	Dec 23, 1917 - New York Times: Winter bread lines grow in English towns #100yearsago pic.twitter.com/LIkPLtHR0l	prchovanec	3	0	2017-12-23 19:03:54	944629654996094977	https://twitter.com/prchovanec/status/944629654996094977		#100yearsago	
	Dec 23, 1917 - New York Times: Canada to adopt wartime prohibition on liquor #100yearsago pic.twitter.com/eJNIU9meSC	prchovanec	2	2	2017-12-23 19:03:10	944629467988754437	https://twitter.com/prchovanec/status/944629467988754437		#100yearsago	
	Dec 23, 1917 - New York Times: Another German bombing raid on London, the second this week #100yearsago pic.twitter.com/csFP1WnBfP	prchovanec	1	0	2017-12-23 19:02:37	944629332214992896	https://twitter.com/prchovanec/status/944629332214992896		#100yearsago	
	Bad cell phone reception at Brest-Litvosk, especially in 1917.	prchovanec	1	0	2017-12-23 19:00:39	944628834741161984	https://twitter.com/prchovanec/status/944628834741161984			
	December 1917 - German, Austro-Hungarian and Soviet delegations meeting for peace negotiations at Brest-Litovsk. The real decision-maker on the German side, Gen. Max Hoffmann, is seated fourth from the left. #100yearsago pic.twitter.com/AwtcCNY3aK	prchovanec	5	2	2017-12-23 18:59:20	944628504653651971	https://twitter.com/prchovanec/status/944628504653651971		#100yearsago	
	December 1917 - Prince Leopold of Bavaria at Brest-Litovsk during the Armistice negotiations with Soviet Russia #100yearsago pic.twitter.com/ht9Do96Fqw	prchovanec	2	3	2017-12-23 18:56:26	944627773246726145	https://twitter.com/prchovanec/status/944627773246726145		#100yearsago	
	Dec 23, 1917 - New York Times: Germans plan to invite all Allies to join peace negotiations with Russia at Brest-Litovsk #100yearsago pic.twitter.com/dDpW7oCYit	prchovanec	2	2	2017-12-23 18:55:20	944627499643932673	https://twitter.com/prchovanec/status/944627499643932673		#100yearsago	
	Dec 23, 1917 - British troops eating a meal beside trench they've been digging near Ypres, Belgium #100yearsago pic.twitter.com/qbdEul64xT	prchovanec	10	8	2017-12-23 18:54:28	944627279216500736	https://twitter.com/prchovanec/status/944627279216500736		#100yearsago	
	He could be doing worse things. https:// twitter.com/kellyo/status/ 944623615395459073 …	prchovanec	5	1	2017-12-23 18:52:03	944626670702645248	https://twitter.com/prchovanec/status/944626670702645248			
	I've done the same thing myself - tweeting thoughtful articles with contrasting views on a subject - so I totally get it.	prchovanec	1	0	2017-12-23 18:47:50	944625610789474304	https://twitter.com/prchovanec/status/944625610789474304			
	And that's certainly a positive and much-needed thing. I have tweeted the other tweet as well, to provide proper context.	prchovanec	1	0	2017-12-23 18:46:49	944625352739119104	https://twitter.com/prchovanec/status/944625352739119104			
	A different tweet from @VictorDCha citing the opposing point of view: that the US is not running out of time with North Korea and needs to exercise patience. https:// twitter.com/victordcha/sta tus/944090316495351810 …	prchovanec	0	3	2017-12-23 18:42:02	944624151318421505	https://twitter.com/prchovanec/status/944624151318421505			@VictorDCha
	Ah, I did not see.	prchovanec	1	0	2017-12-23 18:38:25	944623241028661248	https://twitter.com/prchovanec/status/944623241028661248			
	What satellite imagery of North Korean gas stations can tell us about Chinese sanctions enforcement https:// beyondparallel.csis.org/pyongyang-gas- stations-fluctuating-fuel-prices/ …	prchovanec	6	1	2017-12-23 18:38:04	944623153921306625	https://twitter.com/prchovanec/status/944623153921306625			
	Has Trump named @VictorDCha as US ambassador to South Korea yet, as has been long rumored? In any case, a tweet worth noting. https:// twitter.com/victordcha/sta tus/944579387285962752 …	prchovanec	0	2	2017-12-23 18:34:46	944622323591798785	https://twitter.com/prchovanec/status/944622323591798785			@VictorDCha
	Thanks to @AlexHSullivan and @AaronFriedberg for the kind of substantive, informed, constructive debate over China policy that I do sorely miss.	prchovanec	0	0	2017-12-23 18:31:57	944621611365302272	https://twitter.com/prchovanec/status/944621611365302272			@AlexHSullivan @AaronFriedberg
	Sorry, I rephrased my tweet better :)	prchovanec	0	0	2017-12-23 18:28:32	944620755458904069	https://twitter.com/prchovanec/status/944620755458904069			
	Yeah, I totally trust installing that. https:// twitter.com/verge/status/9 44568394036203522 …	prchovanec	18	3	2017-12-23 18:27:48	944620567008890883	https://twitter.com/prchovanec/status/944620567008890883			
	I just think we're better off focusing on the things we can control (our own military capabilities, economic competitiveness, etc.) than imagining we can control or close off China's development.	prchovanec	0	0	2017-12-23 18:25:53	944620086085738497	https://twitter.com/prchovanec/status/944620086085738497			
	"Agree. My view of China has always been ""hope for the best and prepare for the worst""."	prchovanec	0	0	2017-12-23 18:20:41	944618779396464641	https://twitter.com/prchovanec/status/944618779396464641			
	You know the old Jewish story from Prague, I'm sure.	prchovanec	1	0	2017-12-23 18:16:37	944617755193630721	https://twitter.com/prchovanec/status/944617755193630721			
	"I'm just saying that sometimes kicking conflict down the road can be a good thing. ""Either the dog may die, or the master."""	prchovanec	0	0	2017-12-23 18:15:08	944617380092743680	https://twitter.com/prchovanec/status/944617380092743680			
	Fair enough.	prchovanec	0	0	2017-12-23 18:14:12	944617147434786817	https://twitter.com/prchovanec/status/944617147434786817			
	Those were, of course, never the only voices. And they're increasingly silenced or marginalized now.	prchovanec	0	0	2017-12-23 18:11:50	944616549314367493	https://twitter.com/prchovanec/status/944616549314367493			
	Yet I had many surprising discussions in Central Party School about China's potential evolution in a very different direction. And I think quite sincere.	prchovanec	0	0	2017-12-23 18:11:06	944616365050220544	https://twitter.com/prchovanec/status/944616365050220544			
	But beware survival bias (or in this case, conflict bias). Easy to point to time when this approach failed, but what about the times it didn't lead to conflict? Or even defused potential conflict?	prchovanec	0	0	2017-12-23 18:08:36	944615738568073217	https://twitter.com/prchovanec/status/944615738568073217			
	But time horizons and pathways matter a lot, right? Deng's view of letting the Taiwan apple fall from the tree when ripe is a lot less fraught with confrontation.	prchovanec	0	0	2017-12-23 18:06:54	944615308832202752	https://twitter.com/prchovanec/status/944615308832202752			
	Obviously the PLA always saw the US as #1 adversary, but how much head Chinese leaders were willing to give them was very much an open question - even after the EP3 incident.	prchovanec	0	0	2017-12-23 18:05:13	944614883840192512	https://twitter.com/prchovanec/status/944614883840192512		#1	
	On an economic front, Zhu was definitely championing a more open China than Xi has in mind, and he saw WTO as very much a tool to that end.	prchovanec	0	0	2017-12-23 18:01:24	944613926519672832	https://twitter.com/prchovanec/status/944613926519672832			
	I think China's strategic ambitions were always there, but the question of how inimical or reconcilable CCP leaders saw them to the US-led liberal world order were still open. To some degree they still are, though diminishly so.	prchovanec	0	0	2017-12-23 17:59:41	944613494963560448	https://twitter.com/prchovanec/status/944613494963560448			
	"LOL, no, but I do refer to her as ""mama"" in front of the kids."	prchovanec	1	0	2017-12-23 17:48:38	944610712453812224	https://twitter.com/prchovanec/status/944610712453812224			
	This is an entirely fair criticism. There was a lot of aimless coasting, regarding North Korea, under Obama. https:// twitter.com/DAlexBlumentha l/status/944608358492860416 …	prchovanec	2	2	2017-12-23 17:48:07	944610583432908807	https://twitter.com/prchovanec/status/944610583432908807			
	The lost momentum under Hu, and the turn towards party revanchism under Xi, were not inevitable. And the 2008 financial crisis in the West also played a key role in shaping Chinese attitudes.	prchovanec	2	0	2017-12-23 17:44:37	944609702809305093	https://twitter.com/prchovanec/status/944609702809305093			
	Things looked very different at the time, and different paths were genuinely available to China. The US was actively trying to *make* them available, and attractive.	prchovanec	0	0	2017-12-23 17:42:57	944609282921820161	https://twitter.com/prchovanec/status/944609282921820161			
	Keep in mind that, at least in economic terms, China was on a far more reformist path around that time (under Zhu Rongji). And I wouldn't underestimate how WTO was helpful in encouraging that path, both directly and indirectly.	prchovanec	1	0	2017-12-23 17:41:02	944608799817682944	https://twitter.com/prchovanec/status/944608799817682944			
	"""You also had some very fine people on both sides."" pic.twitter.com/uXBIiNDn6t"	prchovanec	85	24	2017-12-23 16:56:24	944597568989822978	https://twitter.com/prchovanec/status/944597568989822978			
	Tax simplification. https:// twitter.com/BrookingsInst/ status/944596220714016768 …	prchovanec	3	5	2017-12-23 16:52:37	944596614026612737	https://twitter.com/prchovanec/status/944596614026612737			
	"""You knew what you signed up for"" would have been a better Trumpian comeback. https:// twitter.com/cbudoffbrown/s tatus/944387519889793025 …"	prchovanec	8	1	2017-12-23 16:47:08	944595235094528001	https://twitter.com/prchovanec/status/944595235094528001			
	Meanwhile, there's a real war on Christmas taking place. https:// twitter.com/SCMP_News/stat us/944515430655422471 …	prchovanec	3	2	2017-12-23 16:42:53	944594166750875648	https://twitter.com/prchovanec/status/944594166750875648			
	"The use of the ""Winter White House"" as a personal money-making machine is beyond disgusting. http://www. cnn.com/2017/12/23/pol itics/trump-kitchen-cabinet/index.html …"	prchovanec	11	0	2017-12-23 16:40:43	944593618635034624	https://twitter.com/prchovanec/status/944593618635034624			
	Like I said, bourbon. https:// twitter.com/amandacarpente r/status/944586675384176640 …	prchovanec	8	0	2017-12-23 16:17:20	944587737822322689	https://twitter.com/prchovanec/status/944587737822322689			
	In that case, we're not there yet (savings rate is 3%, fed funds is 1.4%)	prchovanec	0	0	2017-12-23 16:16:04	944587417239064577	https://twitter.com/prchovanec/status/944587417239064577			
	"Gege is how you refer to ""elder brother"" in Chinese. The funny thing is, all our family names for each other are in Chinese. Hence, I'm ""baba"" at home."	prchovanec	8	0	2017-12-23 16:13:00	944586644409257984	https://twitter.com/prchovanec/status/944586644409257984			
	4-year old daughter: Gege (elder brother) hitted me. Wife: Hit you. Maximizing these teachable moments.	prchovanec	19	0	2017-12-23 16:10:01	944585893171679233	https://twitter.com/prchovanec/status/944585893171679233			
	Good lord. https:// twitter.com/financialtimes /status/944584141751898119 …	prchovanec	4	3	2017-12-23 16:06:24	944584985411022849	https://twitter.com/prchovanec/status/944584985411022849			
	If the shroud fits, you must acquit.	prchovanec	10	0	2017-12-23 16:01:09	944583661277581314	https://twitter.com/prchovanec/status/944583661277581314			
	The personal savings rate over the next few months will be interesting to watch. It's already at a low point for the recovery. https:// twitter.com/wsjcentralbank s/status/944582400721420288 …	prchovanec	2	0	2017-12-23 15:59:38	944583282150313984	https://twitter.com/prchovanec/status/944583282150313984			
	"Despite various compromise ""agreements"" this remains an unresolved issue."	prchovanec	1	0	2017-12-23 15:57:34	944582760047562752	https://twitter.com/prchovanec/status/944582760047562752			
	Read my article about it, from five years ago: http:// foreignpolicy.com/2012/12/10/cla sh-of-the-balance-sheets/ …	prchovanec	1	0	2017-12-23 15:56:33	944582505667203073	https://twitter.com/prchovanec/status/944582505667203073			
	Dec 23, 1917 - New York Times: Wartime coal shortage cuts into US steel production #100yearsago pic.twitter.com/pqZaBGUx6i	prchovanec	0	0	2017-12-23 15:22:20	944573892890374145	https://twitter.com/prchovanec/status/944573892890374145		#100yearsago	
	Dec 23, 1917 - New York Times: French Socialists urge their Russian comrades not to negotiate a separate peace with Germany #100yearsago pic.twitter.com/zj8vOuvQzD	prchovanec	0	1	2017-12-23 15:21:41	944573730541506560	https://twitter.com/prchovanec/status/944573730541506560		#100yearsago	
	Dec 23, 1917 - British engineers with a mobile pigeon loft in the reserve line near Dickebusch, Belgium #100yearsago pic.twitter.com/XoBfQ84im2	prchovanec	4	4	2017-12-23 15:13:23	944571642323357696	https://twitter.com/prchovanec/status/944571642323357696		#100yearsago	
	December 1917 - Kaiser Wilhelm II and his son Crown Prince Wilhelm inspecting German troops near Cambrai, on the Western Front #100yearsago pic.twitter.com/ZNoY0VqNeP	prchovanec	2	3	2017-12-23 15:11:36	944571193868406785	https://twitter.com/prchovanec/status/944571193868406785		#100yearsago	
	She blinded me with tax cuts! https:// twitter.com/seungminkim/st atus/944233010437804032 …	prchovanec	15	2	2017-12-23 14:45:12	944564551093190657	https://twitter.com/prchovanec/status/944564551093190657			
	Well, the SEC has tried to investigate but has been largely stymied by Chinese authorities.	prchovanec	0	0	2017-12-23 14:40:18	944563317011570689	https://twitter.com/prchovanec/status/944563317011570689			
	Since the 1980s, US has always had a relationship with China that was a combination of partnership and mistrust, a mix of hope and concern. Nor, at any point, did the US hold China's fate in its hands like a faucet it could turn on or off.	prchovanec	12	3	2017-12-23 06:16:11	944436452250865669	https://twitter.com/prchovanec/status/944436452250865669			
	Thank you to @BrookingsInst for calling out this mythology that has rapidly become conventional wisdom (that the US coddled China in the mistaken belief its rise would be all roses, while it really should have been smothering China in its crib). https:// twitter.com/jc_mittelstadt /status/944414762657607682 …	prchovanec	9	5	2017-12-23 06:12:55	944435630934765568	https://twitter.com/prchovanec/status/944435630934765568			@BrookingsInst
	"The thing is, they're still exchanged, though mainly for traditional and therefore purely domestic transactions, so hard to come up with an ""exchange rate""."	prchovanec	1	0	2017-12-23 06:05:45	944433825538592768	https://twitter.com/prchovanec/status/944433825538592768			
	As long as you don't mind crying a bit at the same time.	prchovanec	15	0	2017-12-23 05:43:28	944428218312019968	https://twitter.com/prchovanec/status/944428218312019968			
	It's easy to be funny being right about Trump. https:// twitter.com/japanracingblo g/status/944341714344353792 …	prchovanec	11	0	2017-12-23 05:42:24	944427949834588161	https://twitter.com/prchovanec/status/944427949834588161			
	The result is far from illusory.	prchovanec	3	0	2017-12-23 05:39:27	944427208826871808	https://twitter.com/prchovanec/status/944427208826871808			
	Rather, I would call it a cooperative abstraction. Not unlike government itself, or a political constitution.	prchovanec	2	0	2017-12-23 05:38:45	944427031764389888	https://twitter.com/prchovanec/status/944427031764389888			
	Take that, you PLA singers. https:// twitter.com/newshour/statu s/944273842083586048 …	prchovanec	4	1	2017-12-23 05:17:35	944421703500881920	https://twitter.com/prchovanec/status/944421703500881920			
	A new word for my ever-expanding 2017 vocabulary. https:// twitter.com/greend00d/stat us/944327496346030080 …	prchovanec	14	1	2017-12-23 05:16:00	944421305625038848	https://twitter.com/prchovanec/status/944421305625038848			
	"As far as fiat currencies being ""obsolete"", that's an outlook, not a reality. In fact, virtually everything anyone buys or sells today is exchanged for some fiat currency. That's a funny definition of ""obsolete""."	prchovanec	17	2	2017-12-23 05:10:31	944419928081338368	https://twitter.com/prchovanec/status/944419928081338368			
	"Saying that a cowrie shell is still a cowrie shell pretty much tells you nothing about what it is ""worth""."	prchovanec	16	1	2017-12-23 05:05:09	944418574529191936	https://twitter.com/prchovanec/status/944418574529191936			
bitcoin 	The only relevant question for any currency - dollars, yuan, Bitcoin, cowry shells, Yap stone discs - is what can it buy. https:// twitter.com/getfiscal/stat us/944222267113984001 …	prchovanec	15	6	2017-12-23 05:03:44	944418218118205442	https://twitter.com/prchovanec/status/944418218118205442			
	Interesting. Movie coming out about US-listed Chinese companies that became objects of fraud accusations by short-sellers. https:// twitter.com/thechinahustle /status/944243655983763456 …	prchovanec	16	5	2017-12-23 04:55:38	944416181276041216	https://twitter.com/prchovanec/status/944416181276041216			
	The future is now. https:// twitter.com/raykwong/statu s/944263626277261312 …	prchovanec	6	0	2017-12-23 04:52:31	944415395146067970	https://twitter.com/prchovanec/status/944415395146067970			
