	“We have order, but at what price” https:// twitter.com/kentindell/sta tus/947224297311014917 …	dgwbirch	2	0	2017-12-30 23:26:01	947232332020355072	https://twitter.com/dgwbirch/status/947232332020355072			
	"""This time, it isn’t just Main Street US that is about to lose its shirt; it is the developing world"" http://www. hindustantimes.com/analysis/why-b itcoin-is-the-largest-ponzi-scheme-in-human-history/story-L5z56wbz3hqxl2gIrf125H.html …"	dgwbirch	7	3	2017-12-30 22:42:22	947221349667360768	https://twitter.com/dgwbirch/status/947221349667360768			
bitcoin 	The govt, for example, could not pass a law banning the use of stolen $20s at exchanges or in stores. But it could pass a law making it illegal to use stolen Bitcoins or Bitcoins from mixers.	dgwbirch	2	0	2017-12-30 22:23:10	947216514725400577	https://twitter.com/dgwbirch/status/947216514725400577			
bitcoin 	If you give me any dollar bill, it doesn’t matter, they are all the same. I don’t know who had the bill before you did. Bitcoins are not all the same, each UXTO has a unique history, recorded forever on the blockchain.	dgwbirch	3	0	2017-12-30 22:19:47	947215664128897024	https://twitter.com/dgwbirch/status/947215664128897024			
bitcoin 	I don’t mean to be picky, but Bitcoin isn’t fungible http://www. chyp.com/fungibility-an d-feasibility/ …	dgwbirch	2	1	2017-12-30 21:40:09	947205688543121408	https://twitter.com/dgwbirch/status/947205688543121408			
	Let’s hear it for the great English breakfast	dgwbirch	1	0	2017-12-30 21:03:08	947196372901617665	https://twitter.com/dgwbirch/status/947196372901617665			
	Yes but blockchain	dgwbirch	0	0	2017-12-30 19:39:58	947175444381609986	https://twitter.com/dgwbirch/status/947175444381609986			
	“kartoffelkopf” ?	dgwbirch	1	0	2017-12-30 19:17:31	947169794096328709	https://twitter.com/dgwbirch/status/947169794096328709			
	See also “every single time anybody gets assessed for anything, the actual algorithm and the inputs are assessed by a federal regulator” https:// thenextweb.com/syndication/20 17/12/29/future-fintech-racist-according-anonymous-data-scientist/ …	dgwbirch	0	0	2017-12-30 19:16:04	947169432807370752	https://twitter.com/dgwbirch/status/947169432807370752			
	I just published “Where are the customer’s bots?” https:// medium.com/@dgwbirch/wher e-are-the-customers-bots-ea87542adcdf …	dgwbirch	33	25	2017-12-30 18:25:10	947156619611267080	https://twitter.com/dgwbirch/status/947156619611267080			@dgwbirch
	I don’t remember voting for a Stagecoach/Virgin bailout. Why can’t we have a referendum about that? https:// twitter.com/andrew_adonis/ status/947008782403624960 …	dgwbirch	0	0	2017-12-30 17:30:47	947142935799320581	https://twitter.com/dgwbirch/status/947142935799320581			
	Sincere congratulations to Ron Kalifa, OBE. All best for the coming year mate!	dgwbirch	0	0	2017-12-30 17:23:11	947141022991159302	https://twitter.com/dgwbirch/status/947141022991159302			
	"New post on 15Mb ""Horizon scanning in good company"", a note on the CSFI horizon-scanning breakfast at Denton's https:// buff.ly/2Elf4l9 pic.twitter.com/Ng0N84r7bD"	dgwbirch	2	1	2017-12-30 15:48:18	947117143543427073	https://twitter.com/dgwbirch/status/947117143543427073			
	#MoneyboxLive yes of course price comparison websites will get access to the consumer bank accounts	dgwbirch	0	0	2017-12-30 13:24:57	947081067533684736	https://twitter.com/dgwbirch/status/947081067533684736		#MoneyboxLive	
	Ruh roh pic.twitter.com/j7N7y5TC3b	dgwbirch	1	0	2017-12-30 11:51:49	947057630836678656	https://twitter.com/dgwbirch/status/947057630836678656			
	There really is nothing new under the sun. pic.twitter.com/nnwS4l2Sq0	dgwbirch	15	4	2017-12-30 11:48:52	947056888180629504	https://twitter.com/dgwbirch/status/947056888180629504			
	Very sorry to hear this. I tried hard to write for the general business reader and explain all of the technological terms. If you want to e-mail me about any topics you feel I could have explained better, I’d greatly appreciate it as I’m working on my next book.	dgwbirch	1	0	2017-12-30 11:44:06	947055688198639617	https://twitter.com/dgwbirch/status/947055688198639617			
	Always in the authorisation domain,	dgwbirch	1	0	2017-12-30 11:42:17	947055233389166595	https://twitter.com/dgwbirch/status/947055233389166595			
	You are much too kind Tamara, but thanks.	dgwbirch	1	0	2017-12-30 11:41:40	947055077067542528	https://twitter.com/dgwbirch/status/947055077067542528			
	Sincere best wishes to the wonderful @DianeCoyle1859 CBE	dgwbirch	2	0	2017-12-30 11:01:42	947045018614882305	https://twitter.com/dgwbirch/status/947045018614882305			@DianeCoyle1859
	Do you want the social security number too?	dgwbirch	2	0	2017-12-30 11:00:58	947044836468842497	https://twitter.com/dgwbirch/status/947044836468842497			
	Video of my opening keynote at the Cryptospace conference in Moscow, earlier this month. On where decentralization is going and Tokens 2.0 vs. 1.0 https:// twitter.com/avc/status/947 089669157658625 …	wmougayar	28	11	2017-12-30 17:46:17	947146837869203456	https://twitter.com/wmougayar/status/947146837869203456			
	Good question. Which assets could be harmed by more liquidity?	wmougayar	1	1	2017-12-30 15:28:16	947112102040190977	https://twitter.com/wmougayar/status/947112102040190977			
	US crypto investors: this might be interesting for you once your holdings become/are significant: https:// coinskim.com/investors-are- exempt-from-capital-gains-taxes-in-puerto-rico/ … #taxes #crypto #invest #us	julianhosp	68	21	2017-12-30 11:47:32	947056553185742848	https://twitter.com/julianhosp/status/947056553185742848		#taxes #crypto #invest #us	
	Introduction to Cryptography: Part 4 (Public Key, PKI and Identity) https:// youtu.be/KmQQOtZw2GQ via @YouTube	billatnapier	1	0	2017-12-30 20:02:21	947181080246878209	https://twitter.com/billatnapier/status/947181080246878209			@YouTube
bitcoin 	Bank of England plots its own bitcoin-style digital currency http:// flip.it/ZNy9BK	billatnapier	4	3	2017-12-30 19:56:18	947179556460548096	https://twitter.com/billatnapier/status/947179556460548096			
	The latest The Cyber Security Daily! https:// paper.li/billatnapier/1 502887524?edition_id=65c1df90-ed5f-11e7-abf4-0cc47a0d1605 … #cybercrime	billatnapier	0	0	2017-12-30 17:45:25	947146618696097792	https://twitter.com/billatnapier/status/947146618696097792		#cybercrime	
	Hackers took over surveillance cameras just before inauguration, prosecutors say - http:// klou.tt/1eaiibqfyengt	billatnapier	0	0	2017-12-30 17:30:01	947142742286544896	https://twitter.com/billatnapier/status/947142742286544896			
	How Classical Cryptography Will Survive Quantum Computers - Facts So Romantic - Nautilus - http:// klou.tt/18fxd5frv5x24	billatnapier	0	0	2017-12-30 17:00:07	947135219164835842	https://twitter.com/billatnapier/status/947135219164835842			
	6 brutal cyber attacks that shook the world in 2017 - http:// klou.tt/j83wcrbv8a5d	billatnapier	5	7	2017-12-30 12:00:00	947059691477114880	https://twitter.com/billatnapier/status/947059691477114880			
	Privacy on the Blockchain: Where Are We Headed? - http:// klou.tt/islhwdbtdmxw	billatnapier	6	5	2017-12-30 11:45:08	947055950564794368	https://twitter.com/billatnapier/status/947055950564794368			
	Thanks for the plug, Mike! And to @BraytonKey ’s concerns about outdatedness, we have an answer: The Truth Machine, to be published in two months time. https://www. amazon.com/Truth-Machine- Blockchain-Future-Everything/dp/1250114578 …	mikejcasey	3	2	2017-12-30 23:00:59	947226031454347264	https://twitter.com/mikejcasey/status/947226031454347264			@BraytonKey
	@mariabustillos please follow me and DM your email address. Want to get you a galley copy of The Truth Machine.	mikejcasey	0	0	2017-12-30 21:23:55	947201604003954688	https://twitter.com/mikejcasey/status/947201604003954688			@mariabustillos
	True. And I know such distinctions are important. But it feels like semantics when my point is that CBs have at times struggled to contain the damage done by banks' off-balance sheet credit expansions.	mikejcasey	2	0	2017-12-30 21:22:52	947201341994209281	https://twitter.com/mikejcasey/status/947201341994209281			
	But there WAS inflation B4 housing burst. It was asset inflation. All aided by banks' creation of de facto money. CBs didn't know how/whether to rein it in. Same now - though, currently, inflation is limited to financial assets, not houses, so not nearly as big problem socially.	mikejcasey	1	0	2017-12-30 20:57:08	947194864797736962	https://twitter.com/mikejcasey/status/947194864797736962			
	I know. But I'm suggesting that off-balance sheet financial engineering can let banks escape even those reserve constraints. Before 08 crisis, tens of trillions in CDS, CDOs and synthetic CDOs had been created. Their collateral treatment was so liberal they were akin to money.	mikejcasey	2	0	2017-12-30 20:20:46	947185714684399617	https://twitter.com/mikejcasey/status/947185714684399617			
	"Who says biz headlines are hyperbolic? ""Nothing short of catastrophic"" - i.e. it literally cannot be described as anything less than a catastrophe. (Def: an event causing great damage and suffering.) Wait for the ""carnage"" and ""massacre"" we'll hear about if price drop continues."	mikejcasey	6	0	2017-12-30 19:09:36	947167805253832704	https://twitter.com/mikejcasey/status/947167805253832704			
	True, but in the interbank market, private banks have from time to time created alternative forms of money. Tri-party repos, AAA-rated CDOs -- these at different times have taken on the quality of money. (With disastrous consequences).	mikejcasey	1	0	2017-12-30 16:56:41	947134354932760578	https://twitter.com/mikejcasey/status/947134354932760578			
	Es por eso también que los filósofos argentinos bien entienden el verdadero relación entre el dinero y la sociedad. Y por supuesto, el ensayo de Andahazi es excelente! Gracias por compartir!	mikejcasey	1	0	2017-12-30 15:29:41	947112459290234880	https://twitter.com/mikejcasey/status/947112459290234880			
	De hecho, vivir en tu país, con su historia de crises financieras y el fracaso de la confianza civica, me ensañó mucho de la realidad del dinero. :-)	mikejcasey	2	0	2017-12-30 15:23:47	947110975920107520	https://twitter.com/mikejcasey/status/947110975920107520			
	Estuve seis años en Buenos Aires.	mikejcasey	2	0	2017-12-30 15:09:47	947107451568115717	https://twitter.com/mikejcasey/status/947107451568115717			
	Gracias. Leo español	mikejcasey	3	0	2017-12-30 15:08:58	947107244428185600	https://twitter.com/mikejcasey/status/947107244428185600			
	More good stuff from @mariabustillos . These are concepts that @paulvigna and I explore in our forthcoming book, The Truth Machine. https:// medium.com/wordsthatmatte r/never-break-the-blockchain-ecce69d8fd9a …	mikejcasey	8	4	2017-12-30 14:07:39	947091816947634176	https://twitter.com/mikejcasey/status/947091816947634176			@mariabustillos @paulvigna
bitcoin 	Now, I’m happy to concede that cryptocurrency *might* fail , even that this whole experiment will only prove that well-regulated fiat is better. (I doubt it.) But if your argument for that is “Bitcoin is not real,” you are a fool.	mikejcasey	7	0	2017-12-30 14:04:44	947091081769967616	https://twitter.com/mikejcasey/status/947091081769967616			
bitcoin 	Just discovered the writings of @mariabustillos . (h/t @Chris_Skinner .) She gets it. Remarkable how many people don’t. https:// medium.com/@mariabustillo s/you-dont-understand-bitcoin-because-you-think-money-is-real-5aef45b8e952 …	mikejcasey	22	11	2017-12-30 14:00:18	947089966634618880	https://twitter.com/mikejcasey/status/947089966634618880			@mariabustillos @Chris_Skinner @mariabustillo
	It’s happening. https:// twitter.com/wef/status/947 080331609432064 …	mikejcasey	4	4	2017-12-30 13:27:10	947081625971675136	https://twitter.com/mikejcasey/status/947081625971675136			
	"I think you’ll find that “bullshit” is an uncountable noun. ... Now, ""write it out 100 times. If it's not done by sunrise, I'll cut your balls off."" pic.twitter.com/J9AEnDKnay"	mikejcasey	0	0	2017-12-30 13:04:35	947075945957085184	https://twitter.com/mikejcasey/status/947075945957085184			
	Of course, he didn’t actually write it. Which explains a lot. Still, right message. Right time. pic.twitter.com/20CJ7J9777	mikejcasey	5	1	2017-12-30 12:53:47	947073225057558528	https://twitter.com/mikejcasey/status/947073225057558528			
	Maybe the first tweet from @realDonaldTrump I support. This is the right statement to make at this time. #IranProtests https:// twitter.com/realdonaldtrum p/status/946949708915924994 …	mikejcasey	4	0	2017-12-30 12:50:05	947072294928699392	https://twitter.com/mikejcasey/status/947072294928699392		#IranProtests	@realDonaldTrump
	A must read. Eerie. And, yes, deeply disturbing. https:// twitter.com/observer/statu s/947066508441735168 …	mikejcasey	2	1	2017-12-30 12:39:17	947069578093395971	https://twitter.com/mikejcasey/status/947069578093395971			
	Yes, you were :-). But look at you now! Livin’ the dream... Congrats.	mikejcasey	1	0	2017-12-30 12:22:28	947065344287535105	https://twitter.com/mikejcasey/status/947065344287535105			
	I hate to be so shallow, but I'd be lying if I didn't concede that it weren't also part of my problem with the dude.	mikejcasey	3	0	2017-12-30 02:20:57	946913969708691456	https://twitter.com/mikejcasey/status/946913969708691456			
bitcoin 	"""In 2013, James Altucher called bitcoin “a fad, or a scam, or a ponzi scheme, or worse.” "" Oh God, how he makes me cringe. http:// mashable.com/2017/12/29/bit coin-ad-guy-bubble-cryptocurrencies/#VC.7dN9lokOy …"	mikejcasey	77	23	2017-12-30 00:18:48	946883227662381056	https://twitter.com/mikejcasey/status/946883227662381056		#VC	
	#Blockchain in #Healthcare : 2017's Successes https://www. coindesk.com/blockchain-hea lthcare-2017s-successes/ … #DLT #HealthTech cc @ipfconline1 @pierrepinna @HITpol @TeamBlockchain @antgrasso @seandotau @ahier @jnasr @NeuroYoder @SilvelloAndrea @davidhoulding @J_Denny @Info_Data_Mgmt @susan_ramonat @ASashaGoodwin pic.twitter.com/zWPzcPmpqv	AntonioSelas	57	71	2017-12-30 13:39:47	947084801470881792	https://twitter.com/AntonioSelas/status/947084801470881792		#Blockchain #Healthcare #DLT #HealthTech	@ipfconline1 @pierrepinna @HITpol @TeamBlockchain @antgrasso @seandotau @ahier @jnasr @NeuroYoder @SilvelloAndrea @davidhoulding @J_Denny @Info_Data_Mgmt @susan_ramonat @ASashaGoodwin
	100% de acuerdo. Voy a pedírselo a Baltasar, aunque me temo que me traerá unos calcetines	AntonioSelas	3	0	2017-12-30 12:19:31	947064601136508928	https://twitter.com/AntonioSelas/status/947064601136508928			
	Cris mi miedo no es que supervisen una ICO en concreto (deben hacerlo), sino el mensaje generalizado que se lanza, dando la impresión de q todos los tokens son valores. Este mensaje me inquieta	AntonioSelas	3	1	2017-12-30 12:16:49	947063924943450112	https://twitter.com/AntonioSelas/status/947063924943450112			
	De ahí el deseo de q los pasos se den en la dirección adecuada (y no se frene la evolución)	AntonioSelas	4	2	2017-12-30 11:30:07	947052170817540096	https://twitter.com/AntonioSelas/status/947052170817540096			
	Cuidado al adoptar el criterio SEC o ESMA. Deben entender qué es un #token (y la naturaleza de cada uno) y no equipararlo automáticamente a cripto. No es recomendable aplicar automáticamente exigencias de valores a nuevas modalidades no lo son. Aquí sí hace falta regulación!	AntonioSelas	11	3	2017-12-30 11:10:29	947047230392893440	https://twitter.com/AntonioSelas/status/947047230392893440		#token	
	Dejaremos pasar la oportunidad? La CNMV alerta contra las ICOs. http://www. expansion.com/mercados/2017/ 12/29/5a454aade2704e55638b45c9.html … #ICO #token #blockchain #fintech cc @martinhuete @fegido @xalvarezforn @mcantalapiedra @gglardies @ikerdlr @EloiNoya @pjuncob @Mireia_Badia @bamilibia @fderbaix @DANIELLodosa @pgasalla pic.twitter.com/wRetJph5Ia	AntonioSelas	16	16	2017-12-30 10:44:20	947040647634092032	https://twitter.com/AntonioSelas/status/947040647634092032		#ICO #token #blockchain #fintech	@martinhuete @fegido @xalvarezforn @mcantalapiedra @gglardies @ikerdlr @EloiNoya @pjuncob @Mireia_Badia @bamilibia @fderbaix @DANIELLodosa @pgasalla
	Sin duda. Esperemos q sea en la dirección adecuada	AntonioSelas	3	0	2017-12-30 10:00:09	947029529201082376	https://twitter.com/AntonioSelas/status/947029529201082376			
	Gracias Jacobo. A ver donde conseguimos llegar en 2018!	AntonioSelas	3	0	2017-12-30 09:40:25	947024564059549702	https://twitter.com/AntonioSelas/status/947024564059549702			
	Gracias Diego. Feliz año a todos!	AntonioSelas	3	0	2017-12-30 09:38:05	947023977330954245	https://twitter.com/AntonioSelas/status/947023977330954245			
	PKしたいです。後ろからぐっさり。	mochi_wsj	0	0	2017-12-30 11:08:22	947046697347121152	https://twitter.com/mochi_wsj/status/947046697347121152			
	近所のヤマダ電機で、小6くらいの女の子がSwitchと一緒にどのソフトを買うかという文脈で、お母さんにSplatoon2をねだっていたんだけど、お母さんは「3DSでやればいいじゃん」と。頑張れ女の子。ちなみに探しに来たAtoCのアダプタはありませんでした。	mochi_wsj	25	9	2017-12-30 10:24:57	947035772468596736	https://twitter.com/mochi_wsj/status/947035772468596736			
	さてはこれだな pic.twitter.com/bzdb5NG0QR	mochi_wsj	0	0	2017-12-30 09:47:26	947026331006484480	https://twitter.com/mochi_wsj/status/947026331006484480			
	…スマホアプリとは…	mochi_wsj	0	0	2017-12-30 09:45:18	947025794030747648	https://twitter.com/mochi_wsj/status/947025794030747648			
	とりまキーボードを買わないとですも	mochi_wsj	0	0	2017-12-30 09:36:58	947023694601142274	https://twitter.com/mochi_wsj/status/947023694601142274			
	ドラクエ10、買いました。仲間に入れて下さい。	mochi_wsj	29	8	2017-12-30 09:22:48	947020130218680320	https://twitter.com/mochi_wsj/status/947020130218680320			
	「英語でのコミュニケーションで誰か見習うべき人いる？」と質問したら「出川哲朗さん。正直行き過ぎの側面もあるけどあれをやろうとしてできる人なんてそうそういないから逆にあれ位やってやる、というメンタリティで丁度いいのでは、」と。 https:// twitter.com/mochi_wsj/stat us/946950273154428928 …	mochi_wsj	52	56	2017-12-30 05:42:42	946964741401976832	https://twitter.com/mochi_wsj/status/946964741401976832			
	文法とか気にせず英語話そう！って事なんですが、ネイティブの友人に「日本人も外人がヘンテコな日本語使っても気にしないで意味通じるでしょ、英語も同じ。むしろ英語使うノンネイティブの数は英語の方が多いから私達慣れてる。何も話さないでニコニコされても何言いたいかわからん」と。確かに。	mochi_wsj	86	63	2017-12-30 04:45:13	946950273154428928	https://twitter.com/mochi_wsj/status/946950273154428928			
	いやはや、おっしゃる通りです。失礼しました。	mochi_wsj	0	0	2017-12-30 01:58:05	946908212363542528	https://twitter.com/mochi_wsj/status/946908212363542528			
	「タイムラインがそれだけになり不快」というご指摘を多数いただき、たしかに発信する情報の質ではないな、ということで、質問箱を削除しました。タイムラインを荒らしてごめんなさい。質問ある方はDMや＠メンションで聞いていただければと思います。	mochi_wsj	4	4	2017-12-30 01:44:16	946904738108399616	https://twitter.com/mochi_wsj/status/946904738108399616			
	Stopped using Peing because many told me it's ruing their timeline. I'm sorry. If you have any questions, please do so directly on Twitter.	mochi_wsj	9	1	2017-12-30 01:38:49	946903365451104256	https://twitter.com/mochi_wsj/status/946903365451104256			
	Thanks Michael for the card - really appreciated	SafarazAli	1	0	2017-12-30 20:39:50	947190509600231425	https://twitter.com/SafarazAli/status/947190509600231425			
	If you are #Author of a business book and if it was published in #2017 then you can still enter at http://www. businessbookawards.co.uk @BizBookAwardUK #BBA2018 pic.twitter.com/YUdJcHhoVf	SafarazAli	6	5	2017-12-30 20:27:10	947187323611025410	https://twitter.com/SafarazAli/status/947187323611025410		#Author #2017 #BBA2018	@BizBookAwardUK
	Congrats to @DebsGardiner16 and all at @QubeLearning #NewYearsHonoursList https:// twitter.com/fenews/status/ 946863700098547712 …	SafarazAli	2	0	2017-12-30 19:33:40	947173861384249344	https://twitter.com/SafarazAli/status/947173861384249344		#NewYearsHonoursList	@DebsGardiner16 @QubeLearning
	@App4EngAwards @hannahkp10 #FF , thanks for being my top recently engaged followers in the last week :) - Grow your followers with https:// commun.it/grow-your-foll owers/?tc=n&aid=thankyou189 …	SafarazAli	0	1	2017-12-30 08:26:31	947005965576081408	https://twitter.com/SafarazAli/status/947005965576081408		#FF	@App4EngAwards @hannahkp10
	"Invisible roadblock removed! Progress: ""Riders in Waymo’s self-driving cars will now be insured"" https://www. theverge.com/platform/amp/2 017/12/19/16796370/waymo-trov-self-driving-car-insurance?utm_campaign=Abundance%20Insider&utm_source=hs_email&utm_medium=email&utm_content=59685457&_hsenc=p2ANqtz-9HtcIAmF1OrUGS9ORAldSGav0WgTaKxiacbzfHz9sHpSW7-NN7MP4aCHEZ3ncAvQYzboQIBSRW2ChbqcM3KQwjBvRSLg&_hsmi=59685457 … h/t @SilkRoadFlip"	jgarzik	7	0	2017-12-30 03:53:09	946937169653968897	https://twitter.com/jgarzik/status/946937169653968897			@SilkRoadFlip
bitcoin 	From $900 to $20,000: Bitcoin's Historic 2017 Price Run Revisited - CoinDesk https://www. coindesk.com/900-20000-bitc oins-historic-2017-price-run-revisited/ … pic.twitter.com/7O8AaDajI6	SunnyStartups	2	1	2017-12-30 07:59:02	946999051735764992	https://twitter.com/SunnyStartups/status/946999051735764992			
	Here's my talk with Gary Null on the end of 2017 trends update and what to look for in 2018 http:// prn.fm/gary-null-show -12-29-17/ …	geraldcelente	14	8	2017-12-30 23:00:39	947225949619326976	https://twitter.com/geraldcelente/status/947225949619326976			
	I'm on CKNW radio with John Daly now for another talk on top trends for 2018 http://www. cknw.com	geraldcelente	10	3	2017-12-30 20:00:53	947180709801799680	https://twitter.com/geraldcelente/status/947180709801799680			
	Tune into CKNW radio with John Daly for more on my Trends for 2018 @2 pm ET http://www. cknw.com	geraldcelente	5	5	2017-12-30 18:01:12	947150588919320578	https://twitter.com/geraldcelente/status/947150588919320578			@2
	I'm live now on the Randy Tobler Show for an interview on Top Trends for 2018 http://www. 971talk.com	geraldcelente	4	3	2017-12-30 15:05:10	947106291004166144	https://twitter.com/geraldcelente/status/947106291004166144			
	Tune into the Randy Tobler Show @9:07 am ET today for an interview on Top Trends for 2018 http://www. 971talk.com	geraldcelente	2	3	2017-12-30 12:06:21	947061290891083777	https://twitter.com/geraldcelente/status/947061290891083777			@9
	History shows us that censorship is more dangerous than the alternative.	DianacBiggs	7	1	2017-12-30 22:40:19	947220830597124104	https://twitter.com/DianacBiggs/status/947220830597124104			
	No joke cold. #Canada https:// twitter.com/ctvottawa/stat us/946709809512042496 …	DianacBiggs	4	3	2017-12-30 04:05:14	946940211191209985	https://twitter.com/DianacBiggs/status/946940211191209985		#Canada	
	The data shows #ViolenceAgainstWomen isn't getting better - it's getting worse, despite increasing levels of education worldwide. This won't just get better. We need to change hearts and minds, & community leaders - across all groups, sectors, tribes - have a role to play in that	DianacBiggs	4	0	2017-12-30 03:48:39	946936040773664768	https://twitter.com/DianacBiggs/status/946936040773664768		#ViolenceAgainstWomen	
	This is not the first I've heard of this type of violation against women in the #infosec community, with little to no recourse to known, repeat offenders but rather those speaking out facing backlash. Time for this to change. Pretending it isn't happening isn't a good look. https:// twitter.com/chelseakomlo/s tatus/946904128554504192 …	DianacBiggs	4	0	2017-12-30 02:42:03	946919279995240449	https://twitter.com/DianacBiggs/status/946919279995240449		#infosec	
	It definitely seems to be hard to get right.	DianacBiggs	2	0	2017-12-30 00:23:40	946884453716049920	https://twitter.com/DianacBiggs/status/946884453716049920			
	No I've tried this. The number exists.	DianacBiggs	6	0	2017-12-30 00:13:30	946881892581654529	https://twitter.com/DianacBiggs/status/946881892581654529			
	#humblebrag	DianacBiggs	4	0	2017-12-30 00:07:17	946880331025498112	https://twitter.com/DianacBiggs/status/946880331025498112		#humblebrag	
	#michaelgastauer thanking Abgail and Adriano on behalf of #wb21 pic.twitter.com/e5EKsWlRgo	MichaelGastauer	27	356	2017-12-30 16:05:39	947121508878516224	https://twitter.com/MichaelGastauer/status/947121508878516224		#michaelgastauer #wb21	
	#wb21 hosting its 24 months celebration event https://www. youtube.com/watch?v=kxUR1G joLiw&sns=tw … #MichaelGastauer	MichaelGastauer	23	375	2017-12-30 16:03:25	947120949933105152	https://twitter.com/MichaelGastauer/status/947120949933105152		#wb21 #MichaelGastauer	
	The fall of the islamo-fascist regime in Iran will forever change the Middle East. https:// twitter.com/jaketapper/sta tus/947119455120842752 …	TonyGallippi	0	0	2017-12-30 17:11:20	947138039083618304	https://twitter.com/TonyGallippi/status/947138039083618304			
	Fantastic late Christmas present from my Belgian in laws! That’s ‘Dry January’ out the window then. pic.twitter.com/8RJwYs61a3	robdgill	2	0	2017-12-30 15:04:56	947106231537283073	https://twitter.com/robdgill/status/947106231537283073			
