	Thanks. I’m writing a major re3port on the topic of blockchain and Higher Education. Looking for any sources or insights! https:// twitter.com/mjcraw/status/ 944642016020967424 …	dtapscott	69	29	2017-12-23 20:16:30	944647924130172929	https://twitter.com/dtapscott/status/944647924130172929			
	I had not seen this video from last week (OK 130,000 people beat me to it). Good selection of important clips on #blockchain . Seems most of the 20 minutes is my new TED talk. https:// twitter.com/SunilMalhotra/ status/944468381222166528 …	dtapscott	17	7	2017-12-23 18:53:01	944626914295255041	https://twitter.com/dtapscott/status/944626914295255041		#blockchain	
bitcoin 	Serves these nocoiners right. You could have joined the #Bitcoin revolution and done something beautiful for your people. Let other billionaires take note. If it’s not in #Bitcoin , it’s gone. https:// twitter.com/zerohedge/stat us/944651395793375232 …	maxkeiser	182	51	2017-12-23 20:34:07	944652358906187777	https://twitter.com/maxkeiser/status/944652358906187777		#Bitcoin #Bitcoin	
	@stacyherbert	maxkeiser	5	0	2017-12-23 20:30:15	944651382803615747	https://twitter.com/maxkeiser/status/944651382803615747			@stacyherbert
	Roger Ver’s twin brother?	maxkeiser	4	0	2017-12-23 17:47:15	944610363441664000	https://twitter.com/maxkeiser/status/944610363441664000			
		maxkeiser	4	0	2017-12-23 17:46:00	944610048940150790	https://twitter.com/maxkeiser/status/944610048940150790			
	The Thinking Man’s Alt Trader FOLLOW > > @nondualnelly pic.twitter.com/hhbWuBxRKK	maxkeiser	52	8	2017-12-23 17:29:10	944605812114317312	https://twitter.com/maxkeiser/status/944605812114317312			@nondualnelly
bitcoin 	Wanna up your #Bitcoin game this holiday season? FOLLOW >> @petertoddbtc pic.twitter.com/2bXQhMxyML	maxkeiser	73	11	2017-12-23 17:18:21	944603091415990273	https://twitter.com/maxkeiser/status/944603091415990273		#Bitcoin	@petertoddbtc
	These subtle changes boost efficiency at the eco-system’s weakest link: exchanges. With these improvements parabolic adoption spikes at steeper vectors. #DeathToFiat https:// twitter.com/laurentmt/stat us/944300139652567040 …	maxkeiser	41	9	2017-12-23 16:25:46	944589858294640641	https://twitter.com/maxkeiser/status/944589858294640641		#DeathToFiat	
bitcoin 	Max Keiser: Bitcoin Price Cycle Will Repeat to $100k and Beyond https:// cointelegraph.com/news/max-keise r-bitcoin-price-cycle-will-repeat-to-100k-and-beyond … via @Cointelegraph	maxkeiser	163	78	2017-12-23 16:15:44	944587332111478784	https://twitter.com/maxkeiser/status/944587332111478784			@Cointelegraph
bitcoin 	This is still true. This chart pattern will take us to $100,000 #Bitcoin . Fiat currency is a barbarous relic.	maxkeiser	175	47	2017-12-23 16:15:26	944587258245640192	https://twitter.com/maxkeiser/status/944587258245640192		#Bitcoin	
bitcoin 	Max Keiser: Why JPMorgan is in a bubble and not bitcoin https://www. rt.com/business/40329 0-bitcoin-bubble-jpmorgan-dimon-keiser/#.Wj5yQMieN2s.twitter …	maxkeiser	283	132	2017-12-23 16:12:06	944586419737104384	https://twitter.com/maxkeiser/status/944586419737104384		#	
bitcoin 	Bitcoin Fraud Wars: Jamie Dimon Rhetoric Sees Max Keiser Terrorist Rant Go Viral... https:// cointelegraph.com/news/bitcoin-f raud-wars-jamie-dimon-rhetoric-sees-max-keiser-terrorist-rant-go-viral-again … via @Cointelegraph	maxkeiser	53	18	2017-12-23 16:11:28	944586261620314117	https://twitter.com/maxkeiser/status/944586261620314117			@Cointelegraph
	Fiat is cancer. Crypto is the cure. pic.twitter.com/STOtwVpn2o	maxkeiser	114	37	2017-12-23 16:06:20	944584967866249216	https://twitter.com/maxkeiser/status/944584967866249216			
bitcoin 	I suggest we get a global video campaign with crypto and cypherpunks all over the world burning piles of fiat. The fear this will strike in the establishment’s heart will cause crypto panic-buying (so, it’s net profitable). #KillTheBeast #Bitcoin pic.twitter.com/BJ4FxBu4l7	maxkeiser	227	62	2017-12-23 16:02:59	944584122877579265	https://twitter.com/maxkeiser/status/944584122877579265		#KillTheBeast #Bitcoin	
	Cypherpunks are making their move against nation-states and central banks. Crypto market cap set to bust through $1 tr.	maxkeiser	406	100	2017-12-23 15:59:54	944583346847453184	https://twitter.com/maxkeiser/status/944583346847453184			
bitcoin 	After a brief rally against #Bitcoin , the $ USD resumes it’s hyperinflationary collapse against Bitcoin. Only keep money in fiat you can afford to lose.	maxkeiser	787	268	2017-12-23 15:57:27	944582731312320512	https://twitter.com/maxkeiser/status/944582731312320512		#Bitcoin	
bitcoin 	Escape this mindset (and serfdom) with #Bitcoin . pic.twitter.com/qWRRWYmMog	maxkeiser	278	107	2017-12-23 12:27:09	944529808888877057	https://twitter.com/maxkeiser/status/944529808888877057		#Bitcoin	
bitcoin 	#Bitcoin pullback very healthy for this bull market. $28,000 now in play.	maxkeiser	1317	409	2017-12-23 12:02:08	944523514861715461	https://twitter.com/maxkeiser/status/944523514861715461		#Bitcoin	
	Did you all get some of that $10,900 good stuff?	maxkeiser	196	23	2017-12-23 11:49:22	944520299067969536	https://twitter.com/maxkeiser/status/944520299067969536			
	Happy to give you 26 minutes on @KeiserReport to talk about LN @stacyherbert	maxkeiser	454	64	2017-12-23 03:05:03	944388351674736640	https://twitter.com/maxkeiser/status/944388351674736640			@KeiserReport @stacyherbert
bitcoin 	Wall St weenies can’t take a little volatility. We bail out these clowns and then they crawl up in fetal positions with a little #Bitcoin pullback. pic.twitter.com/KVOJpD7yvB	maxkeiser	325	75	2017-12-23 02:52:06	944385092167917569	https://twitter.com/maxkeiser/status/944385092167917569		#Bitcoin	
	You call yourself a man? pic.twitter.com/cCJnxdsCCa	maxkeiser	88	10	2017-12-23 02:49:11	944384358969937920	https://twitter.com/maxkeiser/status/944384358969937920			
bitcoin 	The world is extremely motivated to de-dollarize. #GotBitcoin https:// twitter.com/rt_com/status/ 944380715151618048 …	maxkeiser	136	41	2017-12-23 02:43:53	944383026234118144	https://twitter.com/maxkeiser/status/944383026234118144		#GotBitcoin	
bitcoin 	#Bitcoin ’s no. 1 use case. Escaping governments and central banks. What’s the potential market? About 1 quadrillion. Where’s the price going? pic.twitter.com/xiUPzLb2bP	maxkeiser	566	198	2017-12-23 02:41:45	944382485894397957	https://twitter.com/maxkeiser/status/944382485894397957		#Bitcoin	
bitcoin 	Shouldda owned #Bitcoin . Now you’re living Satoshi’s revenge, putz. | https:// nypost.com/2017/12/22/sau di-prince-can-buy-his-way-out-detention-with-6b/?utm_campaign=iosapp&utm_source=twitter_app …	maxkeiser	108	37	2017-12-23 02:37:52	944381508743254016	https://twitter.com/maxkeiser/status/944381508743254016		#Bitcoin	
	"""La révolution internet est la troisième révolution agricole"" https:// france3-regions.francetvinfo.fr/bretagne/cofar ming-quand-agriculture-se-met-economie-collaborative-30-1390213.html … @Herve_Pillaud @thegreendata"	babgi	33	25	2017-12-23 15:47:36	944580251551719424	https://twitter.com/babgi/status/944580251551719424			@Herve_Pillaud @thegreendata
	2018 Is the Year of AI for Financial Institutions http:// bit.ly/2AxH3zS #banking #fintech #AI #MachineLearning #BigData #tech @DeepLearn007 @sbmeunier @TopCyberNews @helene_wpli @Fisher85M pic.twitter.com/yBY2wmaI81	JimMarous	178	172	2017-12-23 16:35:03	944592194312327168	https://twitter.com/JimMarous/status/944592194312327168		#banking #fintech #AI #MachineLearning #BigData #tech	@DeepLearn007 @sbmeunier @TopCyberNews @helene_wpli @Fisher85M
	Google Top Acquirer of AI Start-Ups http:// bit.ly/2D1OCvm #AI #MachineLearning #DeepLearning #startups @DeepLearn007 @BrettKing @cgledhill @psb_dc @evankirstel @Fisher85M @guzmand @fintechna @ipfconline1 pic.twitter.com/kilENinjaF	JimMarous	74	107	2017-12-23 14:20:23	944558306365968385	https://twitter.com/JimMarous/status/944558306365968385		#AI #MachineLearning #DeepLearning #startups	@DeepLearn007 @BrettKing @cgledhill @psb_dc @evankirstel @Fisher85M @guzmand @fintechna @ipfconline1
	This is a great share by @jaypalter on a Twitter thread started by @JPNicols . Read the synopsis, then the entire thread. @rshevlin @pascalbouvier @mattldooley @BrettKing @LizLum @WFSULLIVAN3 @ipfconline1 @StrategyFintech @fintechna @JillCastilla https:// twitter.com/jaypalter/stat us/944339525337219072 …	JimMarous	26	15	2017-12-23 02:46:24	944383658236006400	https://twitter.com/JimMarous/status/944383658236006400			@jaypalter @JPNicols @rshevlin @pascalbouvier @mattldooley @BrettKing @LizLum @WFSULLIVAN3 @ipfconline1 @StrategyFintech @fintechna @JillCastilla
bitcoin 	Yeah! Those evil CEO’s like @brian_armstrong , @ErikVoorhees & @spair who invested and took on huge personal risk to drive Bitcoin adoption during the lean years when no-one believed need to move on. Thanks for the help, suckers! /s https:// twitter.com/parabolictrav/ status/944700374010626048 …	VinnyLingham	224	33	2017-12-23 23:47:43	944701078083223552	https://twitter.com/VinnyLingham/status/944701078083223552			@brian_armstrong @ErikVoorhees @spair
bitcoin 	Whoops. @beijingbitcoins please send to the right recipient.	VinnyLingham	12	2	2017-12-23 21:30:51	944666636602064896	https://twitter.com/VinnyLingham/status/944666636602064896			@beijingbitcoins
	This is very interesting data. Tether pair prices are lagging by a significant amount. Any counter arguments? https:// twitter.com/ataraxia_inves t/status/944654823496011776 …	VinnyLingham	40	12	2017-12-23 21:30:12	944666472164474881	https://twitter.com/VinnyLingham/status/944666472164474881			
	Count me in! $50 @tipprbot	VinnyLingham	22	2	2017-12-23 19:48:33	944640888537366528	https://twitter.com/VinnyLingham/status/944640888537366528			@tipprbot
	The problem is that everyone thinks it will	VinnyLingham	21	0	2017-12-23 08:48:42	944474835240882176	https://twitter.com/VinnyLingham/status/944474835240882176			
	I put the positive one first to make it fair.	VinnyLingham	3	0	2017-12-23 08:43:19	944473479243448320	https://twitter.com/VinnyLingham/status/944473479243448320			
	Who made that the priority?	VinnyLingham	3	0	2017-12-23 08:23:53	944468586449444864	https://twitter.com/VinnyLingham/status/944468586449444864			
bitcoin 	Lightning on Bitcoin:	VinnyLingham	67	37	2017-12-23 08:02:42	944463259301683200	https://twitter.com/VinnyLingham/status/944463259301683200			
bitcoin 	I love Bitcoin too, but @excellion has already confirmed that Bitcoin is not for poor people. Don’t worry - the middle class are next and eventually rich people won’t be able to afford it either! https:// twitter.com/jlmakhoane/sta tus/944457698736820224 …	VinnyLingham	279	77	2017-12-23 07:47:49	944459511468662784	https://twitter.com/VinnyLingham/status/944459511468662784			@excellion
	Wasn’t invited...	VinnyLingham	0	0	2017-12-23 04:53:53	944415741238951936	https://twitter.com/VinnyLingham/status/944415741238951936			
	The point is that the system was never designed for a premature fee market. It was not the intention.	VinnyLingham	3	0	2017-12-23 02:35:47	944380986883637249	https://twitter.com/VinnyLingham/status/944380986883637249			
bitcoin 	Satoshi put up this webpage 9 years ago: https:// web.archive.org/web/2009013111 5053/http://bitcoin.org:80/ … He said : WHEN that runs out, the system can support transaction fees if needed. It's based on open market competition, and there will probably always be nodes willing to process tx's for free. What an idiot!	VinnyLingham	6	1	2017-12-23 00:43:26	944352714242211840	https://twitter.com/VinnyLingham/status/944352714242211840			
	I don't know anything about the Facebook rumors.	SatoshiLite	16	1	2017-12-23 22:46:07	944685576317411329	https://twitter.com/SatoshiLite/status/944685576317411329			
	How long have you been in crypto-currencies? Bull/bear cycles last 3-4 years in crypto.	SatoshiLite	5	1	2017-12-23 22:44:09	944685079984455680	https://twitter.com/SatoshiLite/status/944685079984455680			
	Maybe read my tweet again?	SatoshiLite	48	0	2017-12-23 22:40:05	944684056653873152	https://twitter.com/SatoshiLite/status/944684056653873152			
bitcoin 	A famous Bitcoin bear finding a chart to fit the pattern... Except Nasdaq is at 7000 today. https:// twitter.com/paulkrugman/st atus/944621737731350528 …	SatoshiLite	1605	349	2017-12-23 18:43:37	944624551341649920	https://twitter.com/SatoshiLite/status/944624551341649920			
	Ok, thanks.	SatoshiLite	8	1	2017-12-23 18:35:55	944622612444987392	https://twitter.com/SatoshiLite/status/944622612444987392			
	No	SatoshiLite	2	0	2017-12-23 18:34:14	944622190028189697	https://twitter.com/SatoshiLite/status/944622190028189697			
	For what? Don't make false claims.	SatoshiLite	7	0	2017-12-23 18:12:34	944616735037992960	https://twitter.com/SatoshiLite/status/944616735037992960			
	I don't know either. They make a lot of money and are HIGHLY regulated. They have the means and the desire to not run fractional reserve. So unless I have proof otherwise, I wouldn't assume they are running a fractional reserve.	SatoshiLite	13	0	2017-12-23 18:11:33	944616477876895744	https://twitter.com/SatoshiLite/status/944616477876895744			
	How do you know they are not backed 1:1?	SatoshiLite	11	0	2017-12-23 18:00:49	944613779072884736	https://twitter.com/SatoshiLite/status/944613779072884736			
	This is not true as they make enough money to cover that loss.	SatoshiLite	68	5	2017-12-23 17:57:31	944612947736772608	https://twitter.com/SatoshiLite/status/944612947736772608			
bitcoin litecoin 	Sorry for creating the only bit of drama Litecoin had all year. We should leave drama to Bitcoin and others! Happy holidays everyone!	SatoshiLite	9653	1117	2017-12-23 12:15:09	944526788260126721	https://twitter.com/SatoshiLite/status/944526788260126721			
	People arbitraging on GDAX.	SatoshiLite	9	2	2017-12-23 12:09:08	944525274854461441	https://twitter.com/SatoshiLite/status/944525274854461441			
	Just on vacation. That's all.	SatoshiLite	15	1	2017-12-23 12:08:35	944525135951757312	https://twitter.com/SatoshiLite/status/944525135951757312			
	Wow, I don't remember that. How stupid do I look now?	SatoshiLite	9	0	2017-12-23 12:06:30	944524613152792576	https://twitter.com/SatoshiLite/status/944524613152792576			
	Not that I'm aware	SatoshiLite	12	0	2017-12-23 06:57:39	944446887637131264	https://twitter.com/SatoshiLite/status/944446887637131264			
	Exactly.	SatoshiLite	15	1	2017-12-23 06:37:38	944441849447452674	https://twitter.com/SatoshiLite/status/944441849447452674			
	My definition has always been merchant adoption, and usage for payments. When those happen, the price will likely go up. But I care about those.	SatoshiLite	34	5	2017-12-23 06:37:23	944441788000960513	https://twitter.com/SatoshiLite/status/944441788000960513			
	I voted 'y'	SatoshiLite	13	0	2017-12-23 06:36:17	944441508173774849	https://twitter.com/SatoshiLite/status/944441508173774849			
	Nope, don't know any news.	SatoshiLite	9	1	2017-12-23 06:17:02	944436665191342081	https://twitter.com/SatoshiLite/status/944436665191342081			
litecoin 	Why I you have to own LTC to want Litecoin to succeed? Maybe I'm the only person in the world that will benefit from Litecoin succeeding when I don't hold any LTC.	SatoshiLite	31	4	2017-12-23 06:13:29	944435771217346560	https://twitter.com/SatoshiLite/status/944435771217346560			
	No, this market crash was not even news related!	SatoshiLite	10	1	2017-12-23 06:11:17	944435219192455169	https://twitter.com/SatoshiLite/status/944435219192455169			
	Thanks!	SatoshiLite	8	0	2017-12-23 06:10:51	944435108026531840	https://twitter.com/SatoshiLite/status/944435108026531840			
	I've never left!	SatoshiLite	25	1	2017-12-23 05:19:59	944422306960379904	https://twitter.com/SatoshiLite/status/944422306960379904			
	It's not up to me when news are announced. Will defer to the respective companies. My guess is 1Q 2018.	SatoshiLite	28	14	2017-12-23 05:19:33	944422199150108672	https://twitter.com/SatoshiLite/status/944422199150108672			
	I only block people who insult me or curse at me. I appreciate constructive criticisms. Thanks. My jokes sometimes are not received well. I will keep that in mind.	SatoshiLite	25	0	2017-12-23 05:15:22	944421145779912704	https://twitter.com/SatoshiLite/status/944421145779912704			
	For heavy hitters --- (And for full disclosure I have been helping this company) -- and for anyone wanting to see some awesome Blockchain creativity (And no ... this is not the coin of the day) -- check out: insurepal.io	officialmcafee	2357	387	2017-12-23 23:45:52	944700613618782208	https://twitter.com/officialmcafee/status/944700613618782208			
	Yes ... LOL	officialmcafee	40	3	2017-12-23 21:33:53	944667400292782080	https://twitter.com/officialmcafee/status/944667400292782080			
bitcoin 	"Coin of the day: Digibyte (DGB). Using a Blockchain which is 40 times faster than Bitcoin and having one of the most decentralized mining systems in the world - based on 5 different synergistic algorithms. DGB adherents call the coin ""The Sleeping Giant"". https://www. digibyte.co"	officialmcafee	11990	3246	2017-12-23 14:07:27	944555048880746497	https://twitter.com/officialmcafee/status/944555048880746497			
	"Notice: Fake Officialmcafee Account. The ""L"" in the fake account is a capital ""i"". The account has no relationship to me; pic.twitter.com/ARIirkKH55"	officialmcafee	1949	593	2017-12-23 13:37:45	944547573511131136	https://twitter.com/officialmcafee/status/944547573511131136			
	The first coin to decentralize and normalize alternative energy. I shamelessly admit that I was blessed with the opportunity to participate in its genesis. Invest or not ... glimpse it's beauty: https:// kwhcoin.com/pre-sale/	officialmcafee	2068	607	2017-12-23 01:29:52	944364397740331008	https://twitter.com/officialmcafee/status/944364397740331008			
	pic.twitter.com/iIy0NgioMB	officialmcafee	11582	4086	2017-12-23 01:21:07	944362194837360640	https://twitter.com/officialmcafee/status/944362194837360640			
	Good people are here to spread the truth, not to win a popularity contest. pic.twitter.com/0hJzrpHgFb	rogerkver	2667	841	2017-12-23 21:29:31	944666300168724481	https://twitter.com/rogerkver/status/944666300168724481			
bitcoin 	See I told you, Bitcoin is crashing... *** Back up to $16,000 a few hours later***	BrettKing	42	11	2017-12-23 16:45:02	944594707530895360	https://twitter.com/BrettKing/status/944594707530895360			
	No self custody or dealing with forks, airdrops, and rebalancing. If you’re savvy enough to do those yourself, by all means do it yourself. Keep in mind trading costs when doing it yourself.	naval	5	0	2017-12-23 16:38:32	944593069768261632	https://twitter.com/naval/status/944593069768261632			
	@BitwiseInvest (disclaimer: advisor).	naval	3	0	2017-12-23 16:24:51	944589626886447104	https://twitter.com/naval/status/944589626886447104			@BitwiseInvest
	Yes and yes.	naval	4	0	2017-12-23 11:05:18	944509209835593728	https://twitter.com/naval/status/944509209835593728			
	Pseudonymous identities can work as long as they are persistent. Also that quote is mostly about making money...	naval	3	0	2017-12-23 10:55:16	944506685833408512	https://twitter.com/naval/status/944506685833408512			
	Thank you.	naval	6	0	2017-12-23 10:49:57	944505348072783872	https://twitter.com/naval/status/944505348072783872			
	It’s bottom up.	naval	3	0	2017-12-23 10:47:07	944504635301040129	https://twitter.com/naval/status/944504635301040129			
	Asymmetric difficulty.	naval	6	0	2017-12-23 10:46:37	944504509954273280	https://twitter.com/naval/status/944504509954273280			
	And if individuals can get them, then heads of state are vulnerable. Thus states will do their damndest to control them.	naval	1	1	2017-12-23 10:45:21	944504189924737025	https://twitter.com/naval/status/944504189924737025			
	True. I assume the 2nd amendment won’t apply here. But interesting if it does.	naval	1	0	2017-12-23 10:44:10	944503891281903619	https://twitter.com/naval/status/944503891281903619			
	True today. Not with drone swarms.	naval	1	0	2017-12-23 10:41:30	944503222781095936	https://twitter.com/naval/status/944503222781095936			
	In investing, yes, as long as they pay attention to the Kelly criterion.	naval	1	0	2017-12-23 10:40:37	944502997387583489	https://twitter.com/naval/status/944502997387583489			
	Clear thinkers appeal to their own authority.	naval	766	178	2017-12-23 10:39:26	944502698962853888	https://twitter.com/naval/status/944502698962853888			
	. This isn’t a secret. And you can shout it from the hills because people are genetically hardwired to go with the crowd.	naval	21	2	2017-12-23 10:34:48	944501535144255489	https://twitter.com/naval/status/944501535144255489			
	Solutions for non-accrediteds will arrive.	naval	3	2	2017-12-23 10:32:55	944501060592271366	https://twitter.com/naval/status/944501060592271366			
	This is more like nukes. Massive advantage to offense. Except targeted against individuals.	naval	11	0	2017-12-23 10:32:06	944500857160155136	https://twitter.com/naval/status/944500857160155136			
	Nukes shifted the balance of power utterly to large and advanced nation states over small states. Drones do the same but for nation states over individuals.	naval	293	63	2017-12-23 10:31:38	944500735835820032	https://twitter.com/naval/status/944500735835820032			
	Thank you.	naval	11	0	2017-12-23 10:24:05	944498837745385472	https://twitter.com/naval/status/944498837745385472			
	Buy and Hodl or index funds.	naval	5	0	2017-12-23 10:16:29	944496926556176384	https://twitter.com/naval/status/944496926556176384			
	They created unlimited synthetic upside in shorting using puts. Very sophisticated, not generally applicable, and timing matters.	naval	24	3	2017-12-23 10:11:27	944495660115443713	https://twitter.com/naval/status/944495660115443713			
	It’s why venture capital is such a good business. @nntaleb built VC in reverse, using options to get unlimited gains on the downside while limiting losses on the upside. He perfected betting on negative black swans rather than venture’s positive black swans.	naval	17	3	2017-12-23 10:09:18	944495118639185921	https://twitter.com/naval/status/944495118639185921			@nntaleb
	“Creating soldiers which cannot be killed simply forces those who oppose empire to hit civilian targets.” https:// twitter.com/ponnappa/statu s/944486292657553408 …	naval	204	44	2017-12-23 10:03:06	944493557351530496	https://twitter.com/naval/status/944493557351530496			
	Doesn’t work as well in reverse. If crowd is optimistic and you are gloomy, much harder to make money. You have to go short, where the asymmetry of returns works against you.	naval	68	5	2017-12-23 09:17:32	944482088341745666	https://twitter.com/naval/status/944482088341745666			
	I don’t trade or hold. Both are technically hard, easier to outsource to funds.	naval	15	1	2017-12-23 09:15:27	944481567002341376	https://twitter.com/naval/status/944481567002341376			
	The endpoint of drone technology is guided bullets.	naval	785	226	2017-12-23 09:12:42	944480874082590720	https://twitter.com/naval/status/944480874082590720			
	The biggest gains in investing come when you bet against a gloomy crowd, on the upside. The low price already bakes their opinion in. Your losses are limited to 1x, and your gains are uncapped.	naval	2061	434	2017-12-23 08:58:21	944477261767483394	https://twitter.com/naval/status/944477261767483394			
bitcoin 	NEW #Bitcoin talk: Beyond Price: Bitcoin's Impact on the Future https:// youtu.be/rvwVbRQ5Ysc	aantonop	784	327	2017-12-23 16:31:28	944591293723930625	https://twitter.com/aantonop/status/944591293723930625		#Bitcoin	
	"No way! Greek food (which I grew up with) has no ""heat"". I can't tolerate spicy food beyond a ""mild"" level."	aantonop	59	2	2017-12-23 16:14:56	944587130042494976	https://twitter.com/aantonop/status/944587130042494976			
	I think I also would have liked them if this trilogy had consistently followed that strategy (eg. yay for better character writing) but what we have so far is 2 very different movies that don’t flow very well together. Oh well haha	ummjackson	1	0	2017-12-23 06:57:55	944446955303837697	https://twitter.com/ummjackson/status/944446955303837697			
	Yeah if Abrams didn’t give him that guidance it’s poor form. I kind of got the sense that Johnson just wanted to do something different though... he could have asked Abrams for guidance?	ummjackson	0	0	2017-12-23 06:53:34	944445860447842304	https://twitter.com/ummjackson/status/944445860447842304			
	I’m a big mystery box (and Lost) fan but understand it’s not for everyone... that being said, if you’re going to start the trilogy that way I think it’s fair to expect consistency. They should have committed to a direction up front so it was less jarring.	ummjackson	0	0	2017-12-23 06:47:04	944444224350457856	https://twitter.com/ummjackson/status/944444224350457856			
	As with most things these days, the online “sentiment” about something is typically pre-programmed through money and manipulation. Hard to get an authentic take on anything now.	ummjackson	3	0	2017-12-23 06:44:51	944443665241423872	https://twitter.com/ummjackson/status/944443665241423872			
	Definitely, but I still preferred TFA. If you’re going to introduce mythology one second, you can’t just tear it all down the next. Each trilogy should have some consistency imo.	ummjackson	1	0	2017-12-23 06:37:32	944441825883930624	https://twitter.com/ummjackson/status/944441825883930624			
	Now I’ve reminded myself of that dumb Bladerunner sequel, ugh.	ummjackson	3	0	2017-12-23 06:32:31	944440561204736005	https://twitter.com/ummjackson/status/944440561204736005			
	Hehehe whenever a classic film or series has a sequel that tries to be different and (often) fails in the process, it’s like an army of people go to work writing thinkpieces about how it’s actually the best thing ever.	ummjackson	3	0	2017-12-23 06:32:07	944440462944825344	https://twitter.com/ummjackson/status/944440462944825344			
