	Well these are effectively destroyed since they were never claimed. So no.	WhalePanda	3	0	2017-12-30 14:39:10	947099744798638080	https://twitter.com/WhalePanda/status/947099744798638080			
	no one, it's effectively destroyed. 12.5 btc burned.	WhalePanda	14	2	2017-12-30 14:38:30	947099580826574849	https://twitter.com/WhalePanda/status/947099580826574849			
bitcoin 	More info on this #Bitcoin block with destroyed 12.5 BTC. https://www. reddit.com/r/Bitcoin/comm ents/7n1ie5/someone_destroyed_125_newly_mined_bitcoins/ … Also this means that we will never have 21 million Bitcoin ;) pic.twitter.com/MeK5wnchVq	WhalePanda	139	43	2017-12-30 14:37:37	947099355223339008	https://twitter.com/WhalePanda/status/947099355223339008		#Bitcoin	
bitcoin 	Coinbase reward is the basic reward a miner gets for mining a valid Bitcoin block. Currently that's 12.5 btc. It has nothing to do with the company Coinbase.	WhalePanda	26	0	2017-12-30 14:29:10	947097230321778688	https://twitter.com/WhalePanda/status/947097230321778688			
	Go fish.	WhalePanda	5	1	2017-12-30 14:25:32	947096315766476800	https://twitter.com/WhalePanda/status/947096315766476800			
bitcoin 	Some miners believe so much in #Bitcoin that they don't even care about the block rewards and just destroy them. Valid block, with a destroyed coinbase reward. https:// btc.com/00000000000000 00004b27f9ee7ba33d6f048f684aaeb0eea4befd80f1701126 … Made @blockchain 's block explorer crash. pic.twitter.com/XufvATIQ44	WhalePanda	244	107	2017-12-30 14:24:07	947095959699324929	https://twitter.com/WhalePanda/status/947095959699324929		#Bitcoin	@blockchain
	Blocked to protect myself from reading too much stupidity. pic.twitter.com/NRvV5819xP	WhalePanda	307	17	2017-12-30 13:56:56	947089116566622208	https://twitter.com/WhalePanda/status/947089116566622208			
bitcoin ripple 	If you're going to include locked coins from Ripple, you also need to include non-mined coins from Bitcoin.	WhalePanda	35	2	2017-12-30 13:48:17	947086941551579136	https://twitter.com/WhalePanda/status/947086941551579136			
	My son and wife are having an afternoon nap, so I'm kinda cheating.	WhalePanda	82	0	2017-12-30 13:40:59	947085106031808512	https://twitter.com/WhalePanda/status/947085106031808512			
ripple 	If you really believe Ripple, which isnt even a blockchain project, is the future of cryptocurrencies... then I have some Bitconnect and Onecoin to sell to you.	WhalePanda	3122	911	2017-12-30 13:27:36	947081735803691008	https://twitter.com/WhalePanda/status/947081735803691008			
bitcoin ripple 	If you count the full supply of Ripple, you should also count 21M coins for Bitcoin. Also Ripple is a centralized scam :P	WhalePanda	81	16	2017-12-30 12:43:44	947070696403931137	https://twitter.com/WhalePanda/status/947070696403931137			
ripple 	I go offline for 1 day and you people let Ripple reach $100 billion marketcap? SMH	WhalePanda	1182	126	2017-12-30 09:55:26	947028342305370112	https://twitter.com/WhalePanda/status/947028342305370112			
	North shore of O’ahu, though I grew up on the south shore so that’s technically home	cburniske	6	0	2017-12-30 18:32:37	947158494699864064	https://twitter.com/cburniske/status/947158494699864064			
	iPhone X	cburniske	2	0	2017-12-30 18:30:26	947157946592456705	https://twitter.com/cburniske/status/947157946592456705			
	Home. pic.twitter.com/XUYLQQdsHw	cburniske	198	4	2017-12-30 18:27:39	947157246034640896	https://twitter.com/cburniske/status/947157246034640896			
ripple 	Now @ripple is weirding out the markets? $11B of trade volume through $ XRP over the last 24 hrs, not far from $BTC’s $14B	cburniske	484	139	2017-12-30 04:47:19	946950803985547264	https://twitter.com/cburniske/status/946950803985547264			@ripple
ripple 	Really? I feel like Ripple is the flavor du jour	AriannaSimpson	9	0	2017-12-30 23:37:09	947235133337296896	https://twitter.com/AriannaSimpson/status/947235133337296896			
	Wtf https:// twitter.com/neerajka/statu s/947212410477309952 …	AriannaSimpson	19	0	2017-12-30 23:09:52	947228267999875072	https://twitter.com/AriannaSimpson/status/947228267999875072			
	Have read! @kimmaicutler is awesome.	AriannaSimpson	1	0	2017-12-30 21:43:01	947206410504429568	https://twitter.com/AriannaSimpson/status/947206410504429568			@kimmaicutler
	Ugh SF prices have completely skewed my view	AriannaSimpson	1	0	2017-12-30 21:35:17	947204465978900481	https://twitter.com/AriannaSimpson/status/947204465978900481			
	Is that a lot or a little?	AriannaSimpson	2	0	2017-12-30 21:23:33	947201514405277699	https://twitter.com/AriannaSimpson/status/947201514405277699			
	What’s Anki?	AriannaSimpson	2	0	2017-12-30 21:02:52	947196308812697607	https://twitter.com/AriannaSimpson/status/947196308812697607			
	Always hodl	AriannaSimpson	4	0	2017-12-30 20:40:23	947190648226091013	https://twitter.com/AriannaSimpson/status/947190648226091013			
	I did not! On my list though, have heard good things.	AriannaSimpson	1	0	2017-12-30 20:13:21	947183848420511744	https://twitter.com/AriannaSimpson/status/947183848420511744			
	Also, that was almost 20 years ago and markets are generally much larger. AND that was US, this is global. https:// twitter.com/ryanxcharles/s tatus/947182424022306816 …	AriannaSimpson	50	8	2017-12-30 20:08:51	947182712791674881	https://twitter.com/AriannaSimpson/status/947182712791674881			
	Great question. I’m not sure I’m the best at this. I have actually come to terms w the fact that my conscious mind will forget a lot but a lot is being assimilated into my mental models, like @paulg explains here: http://www. paulgraham.com/know.html	AriannaSimpson	9	0	2017-12-30 19:56:38	947179640002670598	https://twitter.com/AriannaSimpson/status/947179640002670598			@paulg
	I’m very competitive, so setting a public goal on @goodreads and looping in my book club @zsims and @marissa helps a lot. Unfortunately I surpassed my goal but @zsims trounced me anyways!	AriannaSimpson	9	0	2017-12-30 19:52:03	947178486929772544	https://twitter.com/AriannaSimpson/status/947178486929772544			@goodreads @zsims @marissa @zsims
	https:// twitter.com/ariannasimpson /status/947177793158307842 …	AriannaSimpson	6	0	2017-12-30 19:50:13	947178024805560320	https://twitter.com/AriannaSimpson/status/947178024805560320			
	That’s all for now. 50 books a year feels like a manageable cadence - will attempt to keep it up next year as well. Would love to hear your recommendations as well!	AriannaSimpson	17	1	2017-12-30 19:49:43	947177899366461440	https://twitter.com/AriannaSimpson/status/947177899366461440			
	10. Einstein’s dreams: another unusual and therefore interesting piece of fiction. Very short, but stuck with me for a while. pic.twitter.com/5lx6XG1CPz	AriannaSimpson	11	0	2017-12-30 19:49:42	947177895755243521	https://twitter.com/AriannaSimpson/status/947177895755243521			
	9. The most important thing: a simple (and precisely therefore useful) summary of investing principles. Highly relevant given recent craziness in many markets - public equities and crypto alike. pic.twitter.com/cEhdGxHffN	AriannaSimpson	22	2	2017-12-30 19:49:39	947177882706677766	https://twitter.com/AriannaSimpson/status/947177882706677766			
	8. Technological Revolutions and financial capital: Perez has informed a lot of my thinking on tech cycles. Also recommend her papers, which you can download on her website. pic.twitter.com/rXlYBYR1nb	AriannaSimpson	23	1	2017-12-30 19:49:37	947177872447418368	https://twitter.com/AriannaSimpson/status/947177872447418368			
	7. More money than God: Mallaby is incredible and I really enjoyed his history of the hedge fund industry. pic.twitter.com/gSEAXyhw2t	AriannaSimpson	17	0	2017-12-30 19:49:34	947177863203164160	https://twitter.com/AriannaSimpson/status/947177863203164160			
	6.Stoner: this one is incredibly weird. Almost nothing happens, and yet it’s one of my favorite books I’ve ever read. Hard to explain; try for yourself. pic.twitter.com/k6J5ehfXRw	AriannaSimpson	20	0	2017-12-30 19:49:32	947177854193762305	https://twitter.com/AriannaSimpson/status/947177854193762305			
	5. E-boys: I loved this one. Exciting story of the early web companies (boom + busts) and the VCs that backed them. pic.twitter.com/Z98hz71UJt	AriannaSimpson	17	0	2017-12-30 19:49:30	947177846123978753	https://twitter.com/AriannaSimpson/status/947177846123978753			
	4. The Goldfinch: I don’t read a lot of fiction but really enjoyed this one, mostly because of the deep character development. pic.twitter.com/4bS90W4qWE	AriannaSimpson	7	1	2017-12-30 19:49:28	947177835780812800	https://twitter.com/AriannaSimpson/status/947177835780812800			
	3. The Gene: I learned a lot. Long book, but the combination of history, science, and more was fascinating. pic.twitter.com/tvJYuTxOy2	AriannaSimpson	16	0	2017-12-30 19:49:26	947177827186638848	https://twitter.com/AriannaSimpson/status/947177827186638848			
	2. Evicted: an incredibly well-written and eye-opening account of the impact of evictions on low income communities. A much needed departure from my usual tech & crypto bubble. pic.twitter.com/qLJ1AqhxC5	AriannaSimpson	19	1	2017-12-30 19:49:24	947177818152165376	https://twitter.com/AriannaSimpson/status/947177818152165376			
	1. Seeking Wisdom: a little dry, but very useful frameworks for thinking about our biases and the logical fallacies we are constantly committing. pic.twitter.com/sHeejLZmJt	AriannaSimpson	19	2	2017-12-30 19:49:21	947177807058292743	https://twitter.com/AriannaSimpson/status/947177807058292743			
	I read 51 books in 2017 (may squeeze in one or two more before EOY). Here are my favorites, with a little bit of commentary. In no particular order:	AriannaSimpson	119	19	2017-12-30 19:49:18	947177793158307842	https://twitter.com/AriannaSimpson/status/947177793158307842			
	I’ll be tweeting a list shortly!	AriannaSimpson	1	0	2017-12-30 19:10:53	947168125992226818	https://twitter.com/AriannaSimpson/status/947168125992226818			
	Bahha sorry Rob, I’ll try to take it up a notch	AriannaSimpson	2	0	2017-12-30 19:10:26	947168013018648577	https://twitter.com/AriannaSimpson/status/947168013018648577			
	Haha, thanks for the reminder. I usually tweet a list of my fave books for the year — will do shortly.	AriannaSimpson	20	0	2017-12-30 18:23:20	947156159609344000	https://twitter.com/AriannaSimpson/status/947156159609344000			
	This is a wonderful list: https:// twitter.com/jasonzweigwsj/ status/946772523835953152 …	AriannaSimpson	10	0	2017-12-30 17:57:08	947149566780026880	https://twitter.com/AriannaSimpson/status/947149566780026880			
	Fun way to build relationships with smart, successful people: read the books they recommend, and follow up with thoughts afterwards.	AriannaSimpson	305	42	2017-12-30 17:55:24	947149131830702086	https://twitter.com/AriannaSimpson/status/947149131830702086			
	The exchanges suck. Have a look at the forums full of people who can’t get their money out.	AriannaSimpson	2	0	2017-12-30 17:23:37	947141132378615810	https://twitter.com/AriannaSimpson/status/947141132378615810			
	Sure, assuming you always time it right. Some of the folks doing this will inevitably be left holding the bag	AriannaSimpson	2	0	2017-12-30 17:15:30	947139088859189250	https://twitter.com/AriannaSimpson/status/947139088859189250			
	Lmao	AriannaSimpson	8	0	2017-12-30 17:09:42	947137631497879554	https://twitter.com/AriannaSimpson/status/947137631497879554			
	Yes. I find forced boredom to be essential to the creative process, and generation of the best ideas https:// twitter.com/iam_preethi/st atus/947136578429661184 …	AriannaSimpson	16	1	2017-12-30 17:09:16	947137520281767937	https://twitter.com/AriannaSimpson/status/947137520281767937			
	That is fine. Don’t try to time the exact tops and bottoms — catch the trend and you’ll be fine.	AriannaSimpson	0	0	2017-12-30 17:01:55	947135671520714752	https://twitter.com/AriannaSimpson/status/947135671520714752			
	8/ This doesn’t mean that the price won’t continue to go up for some time — maybe a long time. But Warren Buffet said it best: “only when the tide goes out do you discover who’s been swimming naked”.	AriannaSimpson	54	2	2017-12-30 17:01:24	947135541224574983	https://twitter.com/AriannaSimpson/status/947135541224574983			
bitcoin 	7/ sometimes the best math is the simplest (or you don’t even need math!) Does this coin have a functioning network? No? Then for the love of god don’t buy it. Doesn’t matter if it’s “only” 10% as much as a bitcoin.	AriannaSimpson	45	4	2017-12-30 17:01:24	947135539605581826	https://twitter.com/AriannaSimpson/status/947135539605581826			
	6/ “cheaper” is also a terrible way of thinking about things. The price of a token is irrelevant if you don’t consider factors like 1) the number of tokens outstanding 2) inflationary / deflationary model 3) total market cap etc	AriannaSimpson	42	3	2017-12-30 17:01:23	947135537416204288	https://twitter.com/AriannaSimpson/status/947135537416204288			
bitcoin 	5/ if you can’t explain why a new cryptoasset is fundamentally better than bitcoin, don’t buy it. “It’s cheaper” doesn’t count.	AriannaSimpson	31	4	2017-12-30 17:01:23	947135535730102272	https://twitter.com/AriannaSimpson/status/947135535730102272			
	4/ everyone is buying when they should be selling, and selling when they should be buying	AriannaSimpson	26	0	2017-12-30 17:01:22	947135534006140928	https://twitter.com/AriannaSimpson/status/947135534006140928			
	3/ meanwhile, the price of BTC started rising sharply, inducing a wave of FOMO buying as people wanted to catch the upward momentum and were trying to avoid getting priced out	AriannaSimpson	18	0	2017-12-30 17:01:22	947135531418312705	https://twitter.com/AriannaSimpson/status/947135531418312705			
	2/ in June, BTC dominance fell to a low of ~41%, before shooting back up to 60%.	AriannaSimpson	20	0	2017-12-30 17:01:21	947135529824505857	https://twitter.com/AriannaSimpson/status/947135529824505857			
bitcoin 	1/ Bitcoin appears, once again, to be falling out of vogue. Let’s recall the same thing happened earlier this year, largely due to ETH’s meteoric rise.	AriannaSimpson	87	19	2017-12-30 17:01:21	947135526452293636	https://twitter.com/AriannaSimpson/status/947135526452293636			
	Very true! But a lower entry price is always preferable regardless.	AriannaSimpson	0	0	2017-12-30 16:48:48	947132371597516800	https://twitter.com/AriannaSimpson/status/947132371597516800			
bitcoin 	Probably means it’s a good time to buy bitcoin... https:// twitter.com/montspencer/st atus/947128243819180032 …	AriannaSimpson	63	3	2017-12-30 16:35:50	947129108152057856	https://twitter.com/AriannaSimpson/status/947129108152057856			
	The whitepaper has already been released...?	AriannaSimpson	0	0	2017-12-30 05:17:59	946958520276148224	https://twitter.com/AriannaSimpson/status/946958520276148224			
	Hahahhahahah if I had a dollar for every text like this I’ve gotten this week	AriannaSimpson	7	0	2017-12-30 01:40:53	946903883145797632	https://twitter.com/AriannaSimpson/status/946903883145797632			
	Hahaha	AriannaSimpson	0	0	2017-12-30 01:32:58	946901894923980800	https://twitter.com/AriannaSimpson/status/946901894923980800			
	Damn it, now we’ll REALLY never be able to buy any houses... https:// twitter.com/abc/status/946 529212000858112 …	AriannaSimpson	34	1	2017-12-30 01:18:45	946898313638445057	https://twitter.com/AriannaSimpson/status/946898313638445057			
	I'm a guy, so no. :)	peterktodd	1	0	2017-12-30 15:51:53	947118048242208769	https://twitter.com/peterktodd/status/947118048242208769			
	Not sure if #34c3 or #grimmeathookfuture pic.twitter.com/wqSRCmWr7L	peterktodd	40	9	2017-12-30 15:47:47	947117016309215234	https://twitter.com/peterktodd/status/947117016309215234		#34c3 #grimmeathookfuture	
	This pedantic distinction matters, because a chain of blocks can be usefully made at the low level with an series of incrementally extended trees (like MMRs). At the high level, that still provides what a blockchain does, without explicit prev-block-hashes.	peterktodd	5	4	2017-12-30 14:48:22	947102062671642625	https://twitter.com/peterktodd/status/947102062671642625			
	The important distinguishing feature of a blockchain is being able to verify you have the complete set of something. git usually doesn't qualify b/c of how people use it (assumed that there are many forks), but for some usecases, even git is loosely speaking a blockchain. https:// twitter.com/whitequark/sta tus/946886702932557824 …	peterktodd	45	10	2017-12-30 14:45:44	947101400944615429	https://twitter.com/peterktodd/status/947101400944615429			
	And note how the mechanism by which that threat is combated is highly centralized hard forks.	peterktodd	9	0	2017-12-30 12:28:48	947066940224352256	https://twitter.com/peterktodd/status/947066940224352256			
	"""Mr. Carb tonight; Dr. Protein tomorrow."" @giacomozucco #34c3"	peterktodd	13	1	2017-12-30 02:03:36	946909602251202560	https://twitter.com/peterktodd/status/946909602251202560		#34c3	@giacomozucco
	"""cryptography sucks"" @giacomozucco #34c3"	peterktodd	14	1	2017-12-30 00:21:49	946883987506524160	https://twitter.com/peterktodd/status/946883987506524160		#34c3	@giacomozucco
	Hahaha...1kg if that $#@&	BaldingsWorld	0	0	2017-12-30 16:47:09	947131955442622469	https://twitter.com/BaldingsWorld/status/947131955442622469		#	@
	Can I write this off as an out of pocket teaching instrument under the new Trump tax plan? Asking for a friend pic.twitter.com/vexk1nuF38	BaldingsWorld	9	3	2017-12-30 16:41:00	947130405903204352	https://twitter.com/BaldingsWorld/status/947130405903204352			
	You picked up on that ;)	BaldingsWorld	0	0	2017-12-30 16:30:12	947127688086528001	https://twitter.com/BaldingsWorld/status/947127688086528001			
	Dear Snowflakes, These are actual people putting themselves at risk. Tweeting from a Brooklyn coffee shop about Trump isn't. Best Regards, Reality https:// twitter.com/potkazar/statu s/946793119806296064 …	BaldingsWorld	52	20	2017-12-30 16:29:44	947127569802919938	https://twitter.com/BaldingsWorld/status/947127569802919938			
	Progressives want powerful unions and lots of additional infrastructure. Discuss https:// twitter.com/mattkahn1966/s tatus/947124319196286976 …	BaldingsWorld	8	5	2017-12-30 16:22:34	947125769066573824	https://twitter.com/BaldingsWorld/status/947125769066573824			
	You and I know that but I'm trying to all leading questions :)	BaldingsWorld	2	0	2017-12-30 16:20:42	947125298843213824	https://twitter.com/BaldingsWorld/status/947125298843213824			
	Contradiction: money rates are only high at quarter end pre-audit but regulatory limits are never breached mid quarter now lenders can use reserved to meet mid quarter cash demand? Hmmm https:// twitter.com/caixin/status/ 946700609075388421 …	BaldingsWorld	4	4	2017-12-30 16:15:10	947123905277321216	https://twitter.com/BaldingsWorld/status/947123905277321216			
	I've heard way too many stories from the medical to the non medical to run the risk of giving birth in China	BaldingsWorld	3	0	2017-12-30 16:10:23	947122702719926272	https://twitter.com/BaldingsWorld/status/947122702719926272			
	No. Also, this is for all bankcards you have!	BaldingsWorld	0	1	2017-12-30 15:51:12	947117875273252864	https://twitter.com/BaldingsWorld/status/947117875273252864			
	I can assure you Ann has forgotten more about China than I will know	BaldingsWorld	7	1	2017-12-30 15:44:42	947116237603008513	https://twitter.com/BaldingsWorld/status/947116237603008513			
	"These measures were never to restrict ""terrorism financing"". I'm sure Sydney and Vancouver will sleep peacefully tonight https:// twitter.com/xinzhou/status /947112316209733633 …"	BaldingsWorld	12	6	2017-12-30 15:41:01	947115310359855106	https://twitter.com/BaldingsWorld/status/947115310359855106			
	Sorry I didn't read the characters close enough. You're right. Never mind	BaldingsWorld	0	0	2017-12-30 15:38:48	947114752496451586	https://twitter.com/BaldingsWorld/status/947114752496451586			
	I so get you	BaldingsWorld	1	0	2017-12-30 15:35:44	947113981964984324	https://twitter.com/BaldingsWorld/status/947113981964984324			
	Promoted from foreigner to regular faculty? Epic Chinese	BaldingsWorld	0	0	2017-12-30 15:33:41	947113467873435648	https://twitter.com/BaldingsWorld/status/947113467873435648			
	I love the idea but I don't we will be able to convince them to remake the entirety of Chinese culture by labeling everyone as foreign barbarians	BaldingsWorld	0	0	2017-12-30 15:19:13	947109823992152065	https://twitter.com/BaldingsWorld/status/947109823992152065			
	Almost always. Lots of circulating coughs, cold, etc	BaldingsWorld	3	0	2017-12-30 15:05:54	947106473854636032	https://twitter.com/BaldingsWorld/status/947106473854636032			
	We should discuss the exact discipline and journal list over drinks	BaldingsWorld	0	0	2017-12-30 14:59:28	947104855067209728	https://twitter.com/BaldingsWorld/status/947104855067209728			
	Pro tip: expats in China, do not do not do not do NOT give birth in China. Period. Full. Stop.	BaldingsWorld	32	9	2017-12-30 14:58:27	947104600573620225	https://twitter.com/BaldingsWorld/status/947104600573620225			
	Funding proposal: study on intellectual and psychological differences of bourbon and scotch drinkers. Need to gather lots of data	BaldingsWorld	17	4	2017-12-30 14:45:13	947101270896021505	https://twitter.com/BaldingsWorld/status/947101270896021505			
	I knew it!!	BaldingsWorld	1	0	2017-12-30 14:44:04	947100978293043200	https://twitter.com/BaldingsWorld/status/947100978293043200			
	Why are you adding anything to vodka? Ketel One martini. Three olives.	BaldingsWorld	1	0	2017-12-30 14:34:38	947098607521378305	https://twitter.com/BaldingsWorld/status/947098607521378305			
	You can't argue with science https:// twitter.com/NYDailyNews/st atus/946829427517939712 …	BaldingsWorld	26	9	2017-12-30 14:33:13	947098248124162048	https://twitter.com/BaldingsWorld/status/947098248124162048			
	RMB internationalization with Chinese characteristics https:// twitter.com/SCMP_News/stat us/947062212241379328 …	BaldingsWorld	44	21	2017-12-30 12:49:14	947072082663194624	https://twitter.com/BaldingsWorld/status/947072082663194624			
	Unless you're a China focused economist	BaldingsWorld	2	0	2017-12-30 09:46:11	947026016915955712	https://twitter.com/BaldingsWorld/status/947026016915955712			
	As someone who has lived here 9 years, drives me nuts people who come for a weekend and publish what amounts to a travel diary. I don't write something explaining Japan after a weekend in Tokyo and sushi	BaldingsWorld	4	0	2017-12-30 09:06:29	947016022875242496	https://twitter.com/BaldingsWorld/status/947016022875242496			
	Yes, like the police are going to help me out	BaldingsWorld	0	0	2017-12-30 08:48:03	947011386223206401	https://twitter.com/BaldingsWorld/status/947011386223206401			
	I knew their ultimate plan was to weaponize kimchi!! http:// m.scmp.com/news/asia/east -asia/article/2126231/north-korea-even-production-kimchi-can-be-revolutionised?amp=1&__twitter_impression=true … pic.twitter.com/S3KHwBtRIB	BaldingsWorld	8	3	2017-12-30 08:42:32	947009998340714497	https://twitter.com/BaldingsWorld/status/947009998340714497			
	On that specific topic I'm not though it is decidedly more complex/nuanced than they make it sound. I'm currently writing a book about the topic. That info though could have come from Wikipedia page. Bad article	BaldingsWorld	2	0	2017-12-30 08:34:35	947007997724598272	https://twitter.com/BaldingsWorld/status/947007997724598272			
	Amazingly this information is so low quality the kind you could get off a Wikipedia page	BaldingsWorld	0	0	2017-12-30 08:24:30	947005458170093568	https://twitter.com/BaldingsWorld/status/947005458170093568			
	Proposal: forced re-education for foreign academics who have never spent real time in China by making them spend a winter in rural Liaoning https://www. project-syndicate.org/commentary/chi na-global-innovation-leader-by-simon-johnson-and-jonathan-ruane-2017-12 …	BaldingsWorld	53	16	2017-12-30 08:23:34	947005222760488960	https://twitter.com/BaldingsWorld/status/947005222760488960			
	This either means the regime is trying to back down without giving away too much or that the police don't support the regime. Will it placate or embolden the protestors? https:// twitter.com/joshdcaplan/st atus/946899668734275589 …	BaldingsWorld	12	2	2017-12-30 06:21:35	946974526738391041	https://twitter.com/BaldingsWorld/status/946974526738391041			
	In fairness, that's only a few thousand less than all of Mongolia	BaldingsWorld	4	1	2017-12-30 06:17:14	946973430535962626	https://twitter.com/BaldingsWorld/status/946973430535962626			
	Damn! This sucks? As Seinfeld says... How do you lose a reservation? Any one can take a reservation, holding a reservation is the key part!!	BaldingsWorld	1	0	2017-12-30 06:16:28	946973239439269890	https://twitter.com/BaldingsWorld/status/946973239439269890			
	pic.twitter.com/wuADfQlvlT	BaldingsWorld	1	0	2017-12-30 06:03:37	946970002397175808	https://twitter.com/BaldingsWorld/status/946970002397175808			
	This is the type of catch you can expect from Beijing opening it's market: you can invest more if you invest where we want on the terms we want. I don't think most are going to buy that pitch https:// twitter.com/jotted/status/ 946579465257172993 …	BaldingsWorld	21	12	2017-12-30 06:02:25	946969702059859968	https://twitter.com/BaldingsWorld/status/946969702059859968			
	Do the Obama Admin guys who also talk tough on China want to take a bow for working hard to legitimize these guys? https:// twitter.com/AlirezaNader/s tatus/946847737772937217 …	BaldingsWorld	4	1	2017-12-30 05:50:04	946966594327949312	https://twitter.com/BaldingsWorld/status/946966594327949312			
