	interesting point. it's what I do with dip profits and fork profits - add to BTC hodlings. that's another driver for taking the freshly mined coin supply off the market. https:// twitter.com/AnselLindner/s tatus/944404767027195904 …	adam3us	52	7	2017-12-23 11:59:29	944522846826573824	https://twitter.com/adam3us/status/944522846826573824			
	coinbase has been holding a $1000 price above market for a couple of days now. can the arbitrageurs not keep up? unless there's some risk premium that's a huge 7% spread!	adam3us	15	1	2017-12-23 11:56:47	944522167697526789	https://twitter.com/adam3us/status/944522167697526789			
bitcoin 	my view: buy bitcoin, hodl. if there was a BTC denominated alt-coin bear fund, using eg 2 year short leap options or contracts on basket of alts and forks, then I'd buy that too. zero sum speculation != value. price manipulation != value.	adam3us	27	3	2017-12-23 11:45:22	944519293022212096	https://twitter.com/adam3us/status/944519293022212096			
bitcoin 	it would help if the fork distractions died down so Bitcoin/crypto could focus on preparing for the next level.	adam3us	3	0	2017-12-23 11:41:48	944518394778398722	https://twitter.com/adam3us/status/944518394778398722			
	if people agree, they should consider adopting bits on sites, wallets, retail topup, services! https:// twitter.com/jimmysong/stat us/944418145766379520 …	adam3us	161	31	2017-12-23 11:40:49	944518147922591745	https://twitter.com/adam3us/status/944518147922591745			
	so few people get this. unfortunately it means fee inelasticity maybe huge. companies really need to hurry to adopt best practices, cut 20x off fees add up to 10x scale. they will regret it if fees push higher & they dont have time to adapt and they lose customers to those ahead.	adam3us	34	4	2017-12-23 11:38:14	944517498615029760	https://twitter.com/adam3us/status/944517498615029760			
bitcoin 	why @BitcoinBelle she keep getting blocked? someone have some contacts at twitter to ask for a proper review, get her un-suspend, and account flagged to stop whoever is abusing process to suspend doing it again? this is the second time someone got her account suspended.	adam3us	11	3	2017-12-23 11:32:59	944516177988063232	https://twitter.com/adam3us/status/944516177988063232			@BitcoinBelle
	so 1.38c/bit = $0.0138/bit. looks cheap like that. $100 buys 7,246bits or 7.2k	adam3us	3	2	2017-12-23 11:28:23	944515018279833600	https://twitter.com/adam3us/status/944515018279833600			
bitcoin 	people need to learn to BTFD. Buffett gets that and with Bitcoin's volatility that's even more short term true. pic.twitter.com/C0Iweyxmdf	adam3us	21	0	2017-12-23 11:24:46	944514111228039168	https://twitter.com/adam3us/status/944514111228039168			
bitcoin 	normal Bitcoin volatility meets MSM. zomg price falling. oops price rocketing. need to introduce them to roller coaster guy https:// rollercoasterguy.github.io /	adam3us	48	11	2017-12-23 11:18:51	944512619486040064	https://twitter.com/adam3us/status/944512619486040064			
	the segwit $2m LTC bounty went unclaimed for months. a huge multiple of that in BTC are BTC stored now. many people moved everything to segwit.	adam3us	9	0	2017-12-23 04:04:34	944403331161706496	https://twitter.com/adam3us/status/944403331161706496			
	i think it's interesting. he wrote a lot of material about it at http:// drivechain.info	adam3us	2	0	2017-12-23 03:13:01	944390355931279361	https://twitter.com/adam3us/status/944390355931279361			
	not yet, maybe in a bit.	adam3us	5	0	2017-12-23 02:55:45	944386010552635392	https://twitter.com/adam3us/status/944386010552635392			
	I think @ledgerx has investor limitations.	adam3us	4	0	2017-12-23 02:53:47	944385515758997504	https://twitter.com/adam3us/status/944385515758997504			@ledgerx
	it was done: segwit is 2MB. it started as a HF proposal in aug 2015, and was realised to be improvable as a SF for better backwards compatibility in oct 2015, alpha impl dec 2015, code mid 2016. but to be clear: the 2MB fork was worked on tradeoffs analysed & implemented as above	adam3us	12	1	2017-12-23 02:50:03	944384577824534529	https://twitter.com/adam3us/status/944384577824534529			
	there are 3 implementations that did the interop test and several other individuals, and developers/implementations plus testers. https:// twitter.com/adam3us/status /938471191307739136 …	adam3us	8	0	2017-12-23 02:37:15	944381353549877248	https://twitter.com/adam3us/status/944381353549877248			
	the full thread is actually a spot on list of recommendations, @coinbase could usefully consult with @pierre_rochard as a strategy advisor.	adam3us	90	16	2017-12-23 01:42:08	944367484223803397	https://twitter.com/adam3us/status/944367484223803397			@coinbase @pierre_rochard
	OK then :) https:// twitter.com/CryptoCoinsNew s/status/944259906215010306 …	adam3us	76	17	2017-12-23 01:39:53	944366918596808704	https://twitter.com/adam3us/status/944366918596808704			
	things must be moving too fast for arbitrage to keep up. coinbase is $1040 above bitfinex and has been $1000 over for hours. why is no one taking that arb - I would if my coinbase account weren't jammed. that's 7.5% spread! that should not be hanging there.	adam3us	18	1	2017-12-23 01:38:07	944366475393077253	https://twitter.com/adam3us/status/944366475393077253			
	steady state that can wear off though, once extra miners come online after 4-5 months ASIC+build time.	adam3us	1	0	2017-12-23 01:36:18	944366016074801152	https://twitter.com/adam3us/status/944366016074801152			
	are they still doing that? could be stale.	adam3us	1	0	2017-12-23 01:34:36	944365590243921920	https://twitter.com/adam3us/status/944365590243921920			
	+1 for separate domains for alts. I feel they should be in separate subsidiares with robust separation of liability, because poorly managed alts fail, eg hard-fork frequently, have zero day bugs etc. I would prefer to use an exchange that made this separation.	adam3us	27	2	2017-12-23 01:33:27	944365301298356224	https://twitter.com/adam3us/status/944365301298356224			
	they're just not used to 100% annualized volatility. they'll learn. less than 20% and it's yawn. 20% is a blip. you have to adjust it all by using log( price ) something to relate and compare with blue chips or forex. https:// twitter.com/msantoriESQ/st atus/944277594165297152 …	adam3us	57	13	2017-12-23 01:26:28	944363543595544576	https://twitter.com/adam3us/status/944363543595544576			
	imitation is a form of kudos.	adam3us	6	0	2017-12-23 01:22:17	944362487616622592	https://twitter.com/adam3us/status/944362487616622592			
bitcoin 	agree, NB you can use Brands' ecash protocol http:// cypherspace.org/credlib/ which is ECDL compatible, also has blinding, can use Bitcoin curve, supports multiple denominations & should be CT compatible (similar to the CT construction) doing public audit seems hard & conflicts with scale	adam3us	8	2	2017-12-23 01:16:02	944360914584817664	https://twitter.com/adam3us/status/944360914584817664			
bitcoin 	wow hit interac circuit breakers. Bitcoin broke interac :) (well it's per interac merchant account I expect, but still fun). https:// twitter.com/uTheTAteg/stat us/944254389434310656 …	adam3us	38	13	2017-12-23 01:07:48	944358845903667201	https://twitter.com/adam3us/status/944358845903667201			
	the genesis block is great. bearer uncensorable internet money is the killer app.	adam3us	15	0	2017-12-23 01:05:50	944358350447415296	https://twitter.com/adam3us/status/944358350447415296			
bitcoin 	so that exchanges dont artificially keep prices at their elastic demand point, while pricing out many other super valuable use-cases, because it doesnt hurt their business. the point is bitcoin's investment thesis is somewhat correlated with transaction utility, steep fee onset.	adam3us	29	1	2017-12-23 01:03:53	944357859093110784	https://twitter.com/adam3us/status/944357859093110784			
	we do have to recognise a quite significant problem in slow company adoption of best practices with existing tech. maybe companies can consider a kind of good network citizen drive for best practices as a joint association with funded developers on loan?	adam3us	39	2	2017-12-23 01:00:53	944357103464050688	https://twitter.com/adam3us/status/944357103464050688			
	they're also no doubt flat out scaling infra. but if people do not start acting now, prices may get high. we do not know the demand becomes elastic for each use case and networth grouping which varies drastically. as much as companies give requirements to developers and help fund	adam3us	25	0	2017-12-23 00:59:35	944356777226833920	https://twitter.com/adam3us/status/944356777226833920			
	it maybe that exchanges are only just starting to care, because with $40 wire transfer fee, per ticket support cost, and rush to add new users, plus basis points on trade over 100bp then nominally they really dont care at $10/tx, maybe even $20. but $100 probably their users will	adam3us	36	2	2017-12-23 00:50:21	944354453771161606	https://twitter.com/adam3us/status/944354453771161606			
	the lack of energy to use it with so much scale sitting on the floor unused is odd, market forces are not transferring. on one hand people are say fees are too high (they are) but on the other hand their actions, which speak louder than words, are saying not high enough to care!	adam3us	72	6	2017-12-23 00:48:52	944354080658509825	https://twitter.com/adam3us/status/944354080658509825			
	everyone wants more scale, but everyone has to take responsibility to adopt best practices. passing on costs to users and paying top priority fees, and doing so inefficiently has side-effects and prices out important use cases. there are more scale things being worked on but ...	adam3us	91	7	2017-12-23 00:46:53	944353582333202438	https://twitter.com/adam3us/status/944353582333202438			
	in some cases it seems like they are side-invested in forks and alts, because they expended large engineering efforts supporting those but not efficient use of blockspace. many are paying 20x over normal, have no transaction priority control for users, and using 5-10x space/tx.	adam3us	79	4	2017-12-23 00:45:17	944353178795036672	https://twitter.com/adam3us/status/944353178795036672			
	it will make a difference, and they can do it now. small companies with 3 people did segwit in house. others hired a consultant for a day or two. you could offer your engineers to do it for them if they dont have in-house expertise. or encourage them on ecosystem responsibility.	adam3us	90	5	2017-12-23 00:44:06	944352878017302530	https://twitter.com/adam3us/status/944352878017302530			
	. @ErikVoorhees it seems like your service is doing the best practices things: batching, change consolidation, segwit, fee estimation. maybe you could call up as you may know them better, some of the CEOs who have none of those things and generate big portion of blockspace.	adam3us	120	11	2017-12-23 00:42:29	944352474105810944	https://twitter.com/adam3us/status/944352474105810944			@ErikVoorhees
bitcoin 	that's Bitcoin for you. $1bil invested, few infra developers in sight. very weird. the internet startup analogous early years were not like this at all. voip protocols, streaming, compression, routers lots of hard core protocol work and industry collaboration via IETF & direct.	adam3us	12	0	2017-12-23 00:40:55	944352077211369472	https://twitter.com/adam3us/status/944352077211369472			
	do it. you're actually well placed from tech experience to build a quick and simple web RPC hosted wallet netting service. hard for them, easy for you. they'd save a bundle and share the savings with you.	adam3us	7	0	2017-12-23 00:39:19	944351675174805504	https://twitter.com/adam3us/status/944351675174805504			
bitcoin 	can we have more actual technologists and people who understand Bitcoin and the ecosystem, like this please. @CNBCFastMoney @technology https:// twitter.com/AlyseKilleen/s tatus/944325247179702272 …	adam3us	665	127	2017-12-23 00:37:48	944351296227872770	https://twitter.com/adam3us/status/944351296227872770			@CNBCFastMoney @technology
	https:// twitter.com/adam3us/status /944237628651687936 …	adam3us	0	0	2017-12-23 00:36:30	944350966073176065	https://twitter.com/adam3us/status/944350966073176065			
	"also ""zoom out"" this context... https:// twitter.com/robertreidmd/s tatus/944208162630000641 …"	adam3us	45	9	2017-12-23 00:35:45	944350776801021953	https://twitter.com/adam3us/status/944350776801021953			
	alternatively BTFD could be a good entry point for a fund. some of the HODLers are BTFD and buying the $50k call options expiry dec 2018, it's been a fun couple of days.	adam3us	62	1	2017-12-23 00:33:51	944350301880045568	https://twitter.com/adam3us/status/944350301880045568			
	it also has confidential transactions. https:// elementsproject.org/elements/confi dential-transactions/ …	adam3us	4	0	2017-12-23 00:29:38	944349239865376769	https://twitter.com/adam3us/status/944349239865376769			
	someone could do it, there's the elements project github. there's a smartphone wallet (greenaddress) that can use elements federated sidechains.	adam3us	2	0	2017-12-23 00:28:41	944348999435341824	https://twitter.com/adam3us/status/944348999435341824			
bitcoin 	answering support tickets about KYC scans, being side-invested in altcoins so devoting effort to those, or wrongly assuming bad-faith about volunteers who spent years of their life working on Bitcoin without pay. maybe it's too much for one company and needs a FOSS collaboration.	adam3us	4	0	2017-12-23 00:27:15	944348641426313216	https://twitter.com/adam3us/status/944348641426313216			
	I dont think anyone wants to do the work. there is FOSS code to do it. I offered someone who claimed they had 1mil customers and was advising them not to do it, to provide them free advice, or take the referral. didnt happen. It seems like people are too busy building web UX,...	adam3us	7	0	2017-12-23 00:25:36	944348224235728901	https://twitter.com/adam3us/status/944348224235728901			
	yah. just a matter of time :) see also https:// twitter.com/adam3us/status /944237628651687936 … already down 70% in BTC terms and 90% in USD (from frozen coinbase peak, which a few unlucky people paid)	adam3us	1	0	2017-12-23 00:08:29	944343918572982273	https://twitter.com/adam3us/status/944343918572982273			
	If you won't tell me what error message your getting, I can't help you	WarrenWhitlock	0	0	2017-12-23 23:53:13	944702462023184384	https://twitter.com/WarrenWhitlock/status/944702462023184384			
	Did you decorate for #festivus ? pic.twitter.com/35QEjUC8y5	WarrenWhitlock	8	3	2017-12-23 23:06:55	944690810758582272	https://twitter.com/WarrenWhitlock/status/944690810758582272		#festivus	
	"I shared one of the most uplifting events I've ever witness and was asked: ""Why isn't it better?"" Another said it made him sad. #SeasonOfHope #HappinesIsAChoice #HappyFestivus"	WarrenWhitlock	5	2	2017-12-23 22:13:18	944677318198358016	https://twitter.com/WarrenWhitlock/status/944677318198358016		#SeasonOfHope #HappinesIsAChoice #HappyFestivus	
	Sorry to hear. Is your account broken in some way? Is there an error message? Just what happened? #PleaseDontBeSad #LetsFixIt	WarrenWhitlock	1	0	2017-12-23 22:11:01	944676743708676096	https://twitter.com/WarrenWhitlock/status/944676743708676096		#PleaseDontBeSad #LetsFixIt	
	pic.twitter.com/wS9dUz2nDq	WarrenWhitlock	0	1	2017-12-23 22:07:36	944675882198638593	https://twitter.com/WarrenWhitlock/status/944675882198638593			
	Right. Not much info in the title and cover :)	WarrenWhitlock	0	0	2017-12-23 22:07:24	944675831099437056	https://twitter.com/WarrenWhitlock/status/944675831099437056			
	pic.twitter.com/YzYl5Y2du8	WarrenWhitlock	1	0	2017-12-23 22:06:49	944675686303674368	https://twitter.com/WarrenWhitlock/status/944675686303674368			
	You Mom must be so proud LOL	WarrenWhitlock	1	0	2017-12-23 22:06:12	944675533069074432	https://twitter.com/WarrenWhitlock/status/944675533069074432			
	I wish you a #HappyFestivus pic.twitter.com/685eT1CBPj	WarrenWhitlock	1	1	2017-12-23 22:05:49	944675434351828992	https://twitter.com/WarrenWhitlock/status/944675434351828992		#HappyFestivus	
	"I hoped that people would consider the source and not take it as a claim that ""expert"" have any exclusivity in bad predictions"	WarrenWhitlock	1	0	2017-12-23 22:01:05	944674242297085952	https://twitter.com/WarrenWhitlock/status/944674242297085952			
	Sir, you've missed the point of the program. Let's be happy these people are not carrying heave buckets for multiple trips. #ThinkPositive	WarrenWhitlock	0	0	2017-12-23 21:59:30	944673843049725952	https://twitter.com/WarrenWhitlock/status/944673843049725952		#ThinkPositive	
	I see you read the article LOL	WarrenWhitlock	0	0	2017-12-23 21:58:21	944673554552913920	https://twitter.com/WarrenWhitlock/status/944673554552913920			
	Weeks from Idea to Millions Reached http:// j.mp/1RuF1S7 #bestseller #book #marketing pic.twitter.com/bXjvlB8bxJ	WarrenWhitlock	1	1	2017-12-23 21:20:13	944663960552386560	https://twitter.com/WarrenWhitlock/status/944663960552386560		#bestseller #book #marketing	
	Some of my best referrals come from Linkedin. Are we connected? http:// linkedin.com/in/book pic.twitter.com/Wpsz4IWiIP	WarrenWhitlock	4	1	2017-12-23 20:03:32	944644660458291200	https://twitter.com/WarrenWhitlock/status/944644660458291200			
	Keep Minor Business Changes from Becoming Big-Time Setbacks—with Unified Cloud Communications http:// j.mp/2hyaciv #business #communications #anyware	WarrenWhitlock	2	1	2017-12-23 19:03:33	944629566588452866	https://twitter.com/WarrenWhitlock/status/944629566588452866		#business #communications #anyware	
	Not just a wheelbarrow. It's saving lives and freeing people http:// j.mp/29KGDZa #cleanwater #billionsrising pic.twitter.com/oJdDl1y1u8	WarrenWhitlock	7	5	2017-12-23 18:16:40	944617765285003270	https://twitter.com/WarrenWhitlock/status/944617765285003270		#cleanwater #billionsrising	
	Misteaks Happen. How Not to Look Bad on Twitter. http:// j.mp/1RuF14O #socialmedia #training pic.twitter.com/OlmOlElTZF	WarrenWhitlock	0	1	2017-12-23 15:12:10	944571335233155072	https://twitter.com/WarrenWhitlock/status/944571335233155072		#socialmedia #training	
	Twitter Revolution: Social Media and Mobile Marketing are Changing the Way We Do Business http:// gshift.it/tr-tw pic.twitter.com/MuwwIiQ2m3	WarrenWhitlock	6	4	2017-12-23 14:07:07	944554964835274752	https://twitter.com/WarrenWhitlock/status/944554964835274752			
bitcoin 	How much of Bitcoin do you think is being used on the dark web?	WarrenWhitlock	0	0	2017-12-23 13:49:38	944550565664636934	https://twitter.com/WarrenWhitlock/status/944550565664636934			
	Do you really need a social media expert? https:// warrenwhitlock.com/social-media-e xpert/ …	WarrenWhitlock	4	3	2017-12-23 13:03:23	944538926131372032	https://twitter.com/WarrenWhitlock/status/944538926131372032			
bitcoin 	Gold Mining Company's Shares Jump 1,300% After Switch to Bitcoin https:// plus.google.com/+WarrenWhitloc k/posts/ZkEUmveCEKM … pic.twitter.com/d60o5oCjyl	WarrenWhitlock	10	10	2017-12-23 12:14:38	944526659528609793	https://twitter.com/WarrenWhitlock/status/944526659528609793			
	Demystifying The Google Knowledge Graph http:// j.mp/1RuF14J #SeachEngine #Google pic.twitter.com/lTYbvwtL3e	WarrenWhitlock	6	2	2017-12-23 12:08:38	944525147813433344	https://twitter.com/WarrenWhitlock/status/944525147813433344		#SeachEngine #Google	
	What are you doing for #festivus ? pic.twitter.com/s6N3iUf0Ln	WarrenWhitlock	11	5	2017-12-23 12:06:12	944524534526414848	https://twitter.com/WarrenWhitlock/status/944524534526414848		#festivus	
	Build your team to achieve more http:// j.mp/2j1jVOB #tech #business #anyware	WarrenWhitlock	3	1	2017-12-23 12:04:36	944524133118996480	https://twitter.com/WarrenWhitlock/status/944524133118996480		#tech #business #anyware	
	We are connected. :)	WarrenWhitlock	0	0	2017-12-23 12:02:08	944523514135986181	https://twitter.com/WarrenWhitlock/status/944523514135986181			
bitcoin 	Gold Mining Company's Shares Jump 1,300% After Switch to Bitcoin http:// j.mp/2BOemfk #cryptocurrency #fintech #commodities #blockchain pic.twitter.com/WstiLhsnKk	WarrenWhitlock	12	10	2017-12-23 09:42:02	944488256946802688	https://twitter.com/WarrenWhitlock/status/944488256946802688		#cryptocurrency #fintech #commodities #blockchain	
	You are part of a social network superorganism http:// j.mp/29n3siZ #video #connection #stories pic.twitter.com/OyMQdsN35R	WarrenWhitlock	8	3	2017-12-23 09:04:16	944478751668269056	https://twitter.com/WarrenWhitlock/status/944478751668269056		#video #connection #stories	
	Yes Jim, finding that many skeptics to be wrong gets very hard indeed	WarrenWhitlock	0	0	2017-12-23 08:51:08	944475446971842561	https://twitter.com/WarrenWhitlock/status/944475446971842561			
	I didn't get that from the article. The chart show new additions, not overall market value. It's a good read if you are interested	WarrenWhitlock	0	0	2017-12-23 08:49:34	944475051599859712	https://twitter.com/WarrenWhitlock/status/944475051599859712			
	Are you in the astronomy business? Or just too close to the Strip? I find #Vegas to be the most productive business location I have ever lived in	WarrenWhitlock	0	0	2017-12-23 08:47:43	944474587953119233	https://twitter.com/WarrenWhitlock/status/944474587953119233		#Vegas	
	Libel?	WarrenWhitlock	0	0	2017-12-23 08:46:07	944474185232916481	https://twitter.com/WarrenWhitlock/status/944474185232916481			
	Congratulations, you passed 8th grade English composition LOL	WarrenWhitlock	1	0	2017-12-23 08:45:20	944473985554640902	https://twitter.com/WarrenWhitlock/status/944473985554640902			
	Biotin is a lot better for you than that pizza.	WarrenWhitlock	1	0	2017-12-23 08:43:27	944473510885302272	https://twitter.com/WarrenWhitlock/status/944473510885302272			
bitcoin 	There's no doubt that betting on #bitcoin price predictions is extremely risky at best. The comparison to a lottery is off. It's like betting on commodities or horse racing, where pros do well and most exercise a lot more caution	WarrenWhitlock	1	0	2017-12-23 08:42:19	944473229153861632	https://twitter.com/WarrenWhitlock/status/944473229153861632		#bitcoin	
bitcoin 	Wall Street Expert Predicts Bitcoin Will Reach $55,000 in 5 Years https:// plus.google.com/+WarrenWhitloc k/posts/bbR4weXVKzJ … pic.twitter.com/87iBEepOi7	WarrenWhitlock	3	6	2017-12-23 08:29:46	944470069404319744	https://twitter.com/WarrenWhitlock/status/944470069404319744			
bitcoin 	Wall Street Expert Predicts Bitcoin Will Reach $55,000 in 5 Years http:// j.mp/2pbr7xP #blockchain #fintech #future pic.twitter.com/tvH5G9IiIr	WarrenWhitlock	13	13	2017-12-23 06:08:01	944434396123328513	https://twitter.com/WarrenWhitlock/status/944434396123328513		#blockchain #fintech #future	
	I'm a contributor at http:// coinhash.com . Read and learn about #blockchain and #cryptocurrency #ICO pic.twitter.com/mSoPI4QiVt	WarrenWhitlock	4	5	2017-12-23 06:03:24	944433235563597825	https://twitter.com/WarrenWhitlock/status/944433235563597825		#blockchain #cryptocurrency #ICO	
	The Wikipedia Competitor That's Harnessing #Blockchain For Epistemological Supremacy http:// j.mp/2pafA1X #tokens #research pic.twitter.com/hTxixrdqiV	WarrenWhitlock	3	2	2017-12-23 05:02:02	944417790018117634	https://twitter.com/WarrenWhitlock/status/944417790018117634		#Blockchain #tokens #research	
	How to Master the Art of Content Creation with Bloggers http:// j.mp/1RuF1BJ pic.twitter.com/T6zhKqtaht	WarrenWhitlock	6	2	2017-12-23 05:01:04	944417545834188800	https://twitter.com/WarrenWhitlock/status/944417545834188800			
	The Top 25 ICOs With the Highest Returns (Infographic) http:// j.mp/2BOBwT0 #Blockchain #ico pic.twitter.com/p8Pd7cLkJc	WarrenWhitlock	7	6	2017-12-23 04:56:01	944416276717408256	https://twitter.com/WarrenWhitlock/status/944416276717408256		#Blockchain #ico	
	The Wikipedia Competitor That's Harnessing #Blockchain For Epistemological Supremacy http:// j.mp/2pazZEc https:// plus.google.com/+WarrenWhitloc k/posts/REw7nKcaWHg … pic.twitter.com/aODjXgwwG8	WarrenWhitlock	7	7	2017-12-23 04:45:08	944413537119735809	https://twitter.com/WarrenWhitlock/status/944413537119735809		#Blockchain	
	Conquering the 4 biggest challenges... Free ebook from @frontierbiz http:// j.mp/2zN8CDJ #anyware #communications #business	WarrenWhitlock	6	4	2017-12-23 04:03:46	944403129902256129	https://twitter.com/WarrenWhitlock/status/944403129902256129		#anyware #communications #business	@frontierbiz
litecoin 	Is Litecoin The Future of Cryptocurrency? http:// j.mp/2CXVgCZ #blockchain #litecoin #fintech pic.twitter.com/KvecYOTz3R	WarrenWhitlock	33	16	2017-12-23 04:02:02	944402689772937216	https://twitter.com/WarrenWhitlock/status/944402689772937216		#blockchain #litecoin #fintech	
	How to Use Messenger Ads in Your Business http:// j.mp/2CWjHk7 #marketing #Personalization #SocialMedia pic.twitter.com/Xxtziu2e90	WarrenWhitlock	3	2	2017-12-23 03:42:01	944397654452326400	https://twitter.com/WarrenWhitlock/status/944397654452326400		#marketing #Personalization #SocialMedia	
	It’s Really Not About Foosball and Free Lunch: Digging Into Employee Engagement http:// j.mp/2DtoA5l pic.twitter.com/RNEMGphDtT	WarrenWhitlock	5	3	2017-12-23 02:07:04	944373760387354624	https://twitter.com/WarrenWhitlock/status/944373760387354624			
	The origins of #festivus http:// dld.bz/d4pWC #seinfeld #happyholidays pic.twitter.com/ca6HOROAT7	WarrenWhitlock	7	1	2017-12-23 01:06:15	944358453677625345	https://twitter.com/WarrenWhitlock/status/944358453677625345		#festivus #seinfeld #happyholidays	
	A New Kind of Soft Battery, Inspired by the Electric Eel http:// j.mp/2kXsOK3 pic.twitter.com/tSjx9gXddl	WarrenWhitlock	6	6	2017-12-23 01:00:31	944357012628033537	https://twitter.com/WarrenWhitlock/status/944357012628033537			
	In China, a Three-Digit Score Could Dictate Your Place in Society http:// j.mp/2kEfESR	WarrenWhitlock	0	0	2017-12-23 00:59:01	944356634536693765	https://twitter.com/WarrenWhitlock/status/944356634536693765			
