	Who has the best digital offer in the UK: challenger or big banks? - I just found a really interesting analysis of the state of mobile banking in the UK which, if you bear in mind has lots of new...https://thefinanser.com/2018/06/best-digital-offer-uk-challenger-big-banks.html/ …	Chris_Skinner	4	0	1528787470	1006433713436151809	https://twitter.com/Chris_Skinner/status/1006433713436151809			
	A software startup that doesn't plan to sell any software just raised $4 billionhttps://www.cnbc.com/2018/05/31/a-blockchain-start-up-just-raised-4-billion-without-a-live-product.html …	Chris_Skinner	10	2	1528779324	1006399545117421568	https://twitter.com/Chris_Skinner/status/1006399545117421568			
	Things worth reading: 12th June 2018 via Chris Skinner's blog - Things we're reading today include … Indian billionaire 'on the run over a alleged bank fraud' seeks asylum in Britain Bank of Chile trading down after hackers ...http://tinyurl.com/ydyb66ug	Chris_Skinner	0	0	1528772791	1006372145021190145	https://twitter.com/Chris_Skinner/status/1006372145021190145			
	Things worth reading: 12th June 2018 - Things we're reading today include ... Indian billionaire 'on the run over a alleged bank fraud' seeks asylum in Britain Bank of Chile trading down after... https://thefinanser.com/2018/06/things-worth-reading-12th-june-2018.html/ …	Chris_Skinner	1	0	1528771806	1006368013984190464	https://twitter.com/Chris_Skinner/status/1006368013984190464			
	This is how research reports should be done https://twitter.com/FinTechInsiders/status/1006550807288991745 …	davidbrear	22	7	1528818299	1006563020506632193	https://twitter.com/davidbrear/status/1006563020506632193			
	Easy when you have Debruyne and Hazard in your midfield :)pic.twitter.com/ULXas94YLs	davidbrear	2	0	1528803013	1006498905394163712	https://twitter.com/davidbrear/status/1006498905394163712			
	Sounds interesting Jo... Service in a digital world of rep :) Like it... cc @ petrit996 @ olliejudge	davidbrear	0	0	1528802393	1006496305609310208	https://twitter.com/davidbrear/status/1006496305609310208			@ @
	pic.twitter.com/dPebDFqyEF	davidbrear	0	0	1528797173	1006474410155487232	https://twitter.com/davidbrear/status/1006474410155487232			
	. @ 11FSTeam worldcup sweep stake just happened... lots of sad people in the office... i mean @ RyanWareham1 got England... bad luck dude. :)	davidbrear	8	0	1528796955	1006473495843401728	https://twitter.com/davidbrear/status/1006473495843401728			@ @
	All industries pull this shit until they cant... someone in the market who can do zero fee transfers? Kills the business model and its move on to the next one... it takes a ballsy company to give up revenue before its taken from you :)	davidbrear	1	0	1528796426	1006471278335877120	https://twitter.com/davidbrear/status/1006471278335877120			
	Ha!!! That was amazing :) Thanks!!!	davidbrear	0	0	1528794071	1006461400452161536	https://twitter.com/davidbrear/status/1006461400452161536			
	. @ SlackHQ i cant believe there isnt a World Cup Team Draw thingy integration... anyone figured a way to do this?	davidbrear	5	0	1528788488	1006437983153803264	https://twitter.com/davidbrear/status/1006437983153803264			@
	Are you driving the train?	davidbrear	2	0	1528780962	1006406416716980224	https://twitter.com/davidbrear/status/1006406416716980224			
	# EEMA this is where great breakthroughs in digital Identity always take place - on a napkinpic.twitter.com/NqfBiU9ovN	dgwbirch	14	2	1528837503	1006643565999599616	https://twitter.com/dgwbirch/status/1006643565999599616		#	
	“The government of Australia plans to invest billions of dollars in its digital identity program, providing a single digital ID for all citizens by 2025, and officials say that massive investment will pay dividends” https://buff.ly/2t3iTqn  nicepic.twitter.com/YooWutJvQG	dgwbirch	75	57	1528831048	1006616491230420992	https://twitter.com/dgwbirch/status/1006616491230420992			
	What’s wrong with Zelle?	dgwbirch	0	0	1528827015	1006599575489179649	https://twitter.com/dgwbirch/status/1006599575489179649			
	Dave Birch on Money 20/20, 2018 edition - confessions of a happy attendee | The Paypers https://buff.ly/2t1CPtS	dgwbirch	1	1	1528820281	1006571330907631616	https://twitter.com/dgwbirch/status/1006571330907631616			
	The paper referred to was written in 2012. Given the rise in the value of the Somali Shilling, I think we can agree that the reforms were successful.	dgwbirch	0	0	1528818265	1006562877896093697	https://twitter.com/dgwbirch/status/1006562877896093697			
	I’ve updated my website “David G.W. Birch”! Check it out: http://www.dgwbirch.com/speaking-2/blockchain-innovation.html …	dgwbirch	0	2	1528818086	1006562125807083521	https://twitter.com/dgwbirch/status/1006562125807083521			
	“...there's an old and nagging question in monetary economics that has never been satisfactorily answered: why is fiat money valuable? Somalia serves as a great laboratory to investigate this question because its situation is so unique” https://buff.ly/2sJ5jJo	dgwbirch	4	0	1528817220	1006558493111877633	https://twitter.com/dgwbirch/status/1006558493111877633			
	Hey thanks Dan	dgwbirch	0	0	1528816734	1006556455154212865	https://twitter.com/dgwbirch/status/1006556455154212865			
	Hey thanks	dgwbirch	1	0	1528792910	1006456531745832961	https://twitter.com/dgwbirch/status/1006456531745832961			
	Young people really ARE getting more stupid, study finds https://buff.ly/2JB1LiQ # electrolytes	dgwbirch	0	0	1528789021	1006440216503226368	https://twitter.com/dgwbirch/status/1006440216503226368		#	
	Burn? Why?	dgwbirch	0	0	1528788333	1006437332344561664	https://twitter.com/dgwbirch/status/1006437332344561664			
	The message for Canada is pretty clear if you ask me: start the missile tests.	dgwbirch	12	5	1528786734	1006430626248044544	https://twitter.com/dgwbirch/status/1006430626248044544			
	End times.	dgwbirch	1	0	1528783245	1006415991700586496	https://twitter.com/dgwbirch/status/1006415991700586496			
	Dude. Venmo.	sytaylor	2	0	1528840739	1006657137983086593	https://twitter.com/sytaylor/status/1006657137983086593			
	Ok but I'll take Mario party and smash. And wait for Metroid in future years. Nintendo have a habit of making you wait and being so worth it when you do.	sytaylor	0	0	1528825577	1006593547338964994	https://twitter.com/sytaylor/status/1006593547338964994			
	Wait what happened?	sytaylor	0	0	1528825087	1006591490682966017	https://twitter.com/sytaylor/status/1006591490682966017			
	pic.twitter.com/i7yFzhphZz	sytaylor	1	0	1528797262	1006474782584594432	https://twitter.com/sytaylor/status/1006474782584594432			
	AI is easy to game Having a layer of independent consensus between a bunch of algo's means they can work with their peers to increase confidence they're not being gamed See: how easily a holographic sticker bamboozled a deep learning algohttps://techcrunch.com/2018/01/02/these-psychedelic-stickers-blow-ai-minds/amp/ …	sytaylor	2	0	1528784467	1006421117807013888	https://twitter.com/sytaylor/status/1006421117807013888			
	Welche Kryptowährung hat das größte Potenzial?https://www.youtube.com/watch?v=7YNyiDhZXOA …	julianhosp	43	1	1528832253	1006621545366777859	https://twitter.com/julianhosp/status/1006621545366777859			
	There must be a misunderstanding - I am NOT a speaker there. If they are listing me, then not with my knowledge/permission of what I am aware of.	julianhosp	1	0	1528806988	1006515576699834369	https://twitter.com/julianhosp/status/1006515576699834369			
	Enjoy brother!	julianhosp	3	0	1528806824	1006514889463140354	https://twitter.com/julianhosp/status/1006514889463140354			
	# Exchange # XRPhttps://twitter.com/tenxwallet/status/1006512357114306560 …	julianhosp	64	10	1528806276	1006512593018806272	https://twitter.com/julianhosp/status/1006512593018806272		# #	
	Got this from an attendee at the last meetup. Very nice reminder! # lifepic.twitter.com/3G6YD8OK20	julianhosp	38	7	1528781140	1006407164443942913	https://twitter.com/julianhosp/status/1006407164443942913		#	
	Good to see that there are MPs that truly care about the rights, freedoms and economic stability of our next generation https://www.mirror.co.uk/news/politics/breaking-tory-minister-phillip-lee-1268712 …	billatnapier	0	0	1528836609	1006639816384172032	https://twitter.com/billatnapier/status/1006639816384172032			
	Transferring $12.5 million into your account: Part 4 - And So The Crime ... https://youtu.be/9xurK0iJ4Mc  via @ YouTube	billatnapier	0	0	1528833812	1006628083745599489	https://twitter.com/billatnapier/status/1006628083745599489			@
	Early Morning Unsolicited Call on Web Site Development https://youtu.be/nls7TwED4xQ  via @ YouTube	billatnapier	0	0	1528833507	1006626805850214402	https://twitter.com/billatnapier/status/1006626805850214402			@
	One of our proudest contributions ... @ _BrightRed ... http://www.brightredbooks.net/subjects/  ... supporting our next generation of scientists, engineers and business leaderspic.twitter.com/FaYjaUF8EN	billatnapier	2	0	1528833010	1006624721641885696	https://twitter.com/billatnapier/status/1006624721641885696			@
	A scam email to compensate a few Lucky Scammed People ...pic.twitter.com/UH8lD3lBBc	billatnapier	1	0	1528832346	1006621937563590657	https://twitter.com/billatnapier/status/1006621937563590657			
	# Edinburgh is creating a world-leading research base for Blockchain. @ EdinburghNapier hosts new @ BlockpassIDLab - with 5 new PhDs - and here I am today in @ EdinburghUni Blockchain labpic.twitter.com/iOCWpboqYt	billatnapier	10	5	1528832040	1006620655343816704	https://twitter.com/billatnapier/status/1006620655343816704		#	@ @ @
	The First In The Queue for a large GDPR Fine? https://www.linkedin.com/pulse/first-queue-large-gdpr-fine-prof-bill-buchanan-obe-phd-fbcs/?published=t …pic.twitter.com/HP2TwaeOA9	billatnapier	1	0	1528826648	1006598036435406848	https://twitter.com/billatnapier/status/1006598036435406848			
	The latest The Cyber Security Daily! https://paper.li/billatnapier/1502887524?edition_id=800921f0-6e3e-11e8-ab2e-0cc47a0d1605 … # security	billatnapier	0	0	1528821925	1006578229111656449	https://twitter.com/billatnapier/status/1006578229111656449		#	
	Here is 8th floor view from Appleton Tower in # Edinburghpic.twitter.com/0DSH6sjHF2	billatnapier	0	0	1528816618	1006555969722241024	https://twitter.com/billatnapier/status/1006555969722241024		#	
	We are discussing blockchain in eVoting # Edinburghpic.twitter.com/wqSCTUhOeG	billatnapier	13	9	1528816451	1006555267801210886	https://twitter.com/billatnapier/status/1006555267801210886		#	
	We are at an eVoting workshop todat in # Edinburghpic.twitter.com/NBGlD3vkh8	billatnapier	3	0	1528816361	1006554892616466433	https://twitter.com/billatnapier/status/1006554892616466433		#	
	The latest The Cyber Security Daily! https://paper.li/billatnapier/1502887524?edition_id=800921f0-6e3e-11e8-ab2e-0cc47a0d1605 … # cybersecurity # security	billatnapier	0	0	1528807537	1006517880773595137	https://twitter.com/billatnapier/status/1006517880773595137		# #	
	My crypto book is going to be translated into Chinesepic.twitter.com/OksyyPw0YS	billatnapier	16	2	1528807518	1006517801492852737	https://twitter.com/billatnapier/status/1006517801492852737			
	Video integration must be fundamental for future health and social care integration ... Ajenta outling their innovations in the areapic.twitter.com/oi98Xr6bcv	billatnapier	3	2	1528803941	1006502799574790144	https://twitter.com/billatnapier/status/1006502799574790144			
	Calling family member or care worker using Ajenta methods for video integrationpic.twitter.com/xQ7SrCHtKy	billatnapier	1	1	1528803935	1006502774106918912	https://twitter.com/billatnapier/status/1006502774106918912			
	We are taking future health with Ajenta todaypic.twitter.com/zrzSd4ARid	billatnapier	5	2	1528800383	1006487872436887552	https://twitter.com/billatnapier/status/1006487872436887552			
	Data Science 2: Pandas https://youtu.be/jFjuEpQwD20  via @ YouTube	billatnapier	0	0	1528789712	1006443114683359237	https://twitter.com/billatnapier/status/1006443114683359237			@
	Big Data: Plotting Bubbles with http://ASP.NET  and Python https://youtu.be/IgJx4ueGjuE  via @ YouTube	billatnapier	0	0	1528789647	1006442842955436032	https://twitter.com/billatnapier/status/1006442842955436032			@
	Data Science Tutorial 1 - Pandas Analysis https://youtu.be/TE_CJLFn4jo  via @ YouTube	billatnapier	0	0	1528788997	1006440117765132289	https://twitter.com/billatnapier/status/1006440117765132289			@
	Problem solving is one of the key skills in the jobs of the future. Go exercise your brain ... https://asecuritysite.com/challenges/ pic.twitter.com/aPVV5CqYgD	billatnapier	0	0	1528788558	1006438274523717635	https://twitter.com/billatnapier/status/1006438274523717635			
	"""To lead the world in this new economy, we need the most talented and hardest-working people"" - Mark Zuckerberg. In UK ""2,360 applications from doctors and 1,946 applications from IT professionals from outside the European Economic area were unsuccessful for Tier 2 visa system."""	billatnapier	2	1	1528787500	1006433841010151424	https://twitter.com/billatnapier/status/1006433841010151424			
	"""To lead the world in this new economy, we need the most talented and hardest-working people"" - Mark Zuckerberg"	billatnapier	0	0	1528784611	1006421721027629056	https://twitter.com/billatnapier/status/1006421721027629056			
	Introduction to Cryptography: Part 4 (Public Key, PKI and Identity) https://youtu.be/KmQQOtZw2GQ  via @ YouTube	billatnapier	0	0	1528782793	1006414096873476099	https://twitter.com/billatnapier/status/1006414096873476099			@
	A couple of years ago, we hid an EXE in a Web page as part of a university cipher challenge ... can you find it? https://asecuritysite.com/html/cipher.html … If you are struggling here is the solution: https://www.youtube.com/watch?v=5SCirDE8Nkw …pic.twitter.com/chySjXX30J	billatnapier	0	1	1528782389	1006412401699381248	https://twitter.com/billatnapier/status/1006412401699381248			
	Cracking Light-weight cryptography with Side Channels, Keysight/ENU https://youtu.be/yy3FBp9f9XQ  via @ YouTube	billatnapier	1	0	1528755473	1006299508005900288	https://twitter.com/billatnapier/status/1006299508005900288			@
	IoT: Safety and Security of Human Digital Memories, Prof Madjid Merabti https://youtu.be/pc32SGPJ2qk  via @ YouTube	billatnapier	0	0	1528755422	1006299294981337088	https://twitter.com/billatnapier/status/1006299294981337088			@
	Thanks for having us back, @ WSJ...https://twitter.com/scastellwsj/status/1006572804567859200 …	mikejcasey	2	2	1528837404	1006643152411856897	https://twitter.com/mikejcasey/status/1006643152411856897			@
	Enjoy. Great beach reading. :)	mikejcasey	1	0	1528837363	1006642977761046528	https://twitter.com/mikejcasey/status/1006642977761046528			
	# JUPARIS18 # Trophées2018 La Palme d'Or des trophées, qui partira à Oracle OpenWorld à S Francisco est décernée à : ENGIE, projet One HRpic.twitter.com/ijRiyXz9oq	PierreTran	0	1	1528804195	1006503863766192128	https://twitter.com/PierreTran/status/1006503863766192128		# #	
	"# JUPARIS18 # Trophées2018 Election en direct du Trophée ""Coup de coeur du public"" : et le gagant est Crédit Agricole Assurrances, Projet Déploiement FCCSpic.twitter.com/7xInH4hzoF"	PierreTran	3	2	1528803504	1006500964029947905	https://twitter.com/PierreTran/status/1006500964029947905		# #	
	"# JUPARIS18 # Trophées2018 Trophée ""Efficacité"" : Renault Nissan Mitshubishi, projet ITM 2020 (Inbound Transport Marketing), Pascal Delepinepic.twitter.com/P8vGavED69"	PierreTran	3	4	1528802685	1006497529788272646	https://twitter.com/PierreTran/status/1006497529788272646		# #	
	"# JUPARIS18 # Trophées2018 Trophée ""Transformation 360"" : Nexans, projet Nexans Europe Planning, Emmanuel Savarypic.twitter.com/nHKmOA40N4"	PierreTran	0	1	1528802141	1006495246950260736	https://twitter.com/PierreTran/status/1006495246950260736		# #	
	"# JUPARIS18 # Trophées2018 Trophée ""Pilotage innovant"" : ICF Habitat, projet Migration des applis RH sur HCM Cloud en 5 mois, François Melinpic.twitter.com/NO6v7lwthY"	PierreTran	1	2	1528801851	1006494029700362240	https://twitter.com/PierreTran/status/1006494029700362240		# #	
	"# JUPARIS18 # Trophées2018 Trphée ""Disruption de la relation client"" : Groupe PLG, projet Octopus, Olivier Pezzettapic.twitter.com/1IaSsCQJje"	PierreTran	3	1	1528801247	1006491497829732352	https://twitter.com/PierreTran/status/1006491497829732352		# #	
	"# JUPARIS18 # Trophées2018 Trophée ""Simplicité et solution collaborative"" : GEFCO, projet COSY, Vincent Fernandezpic.twitter.com/UiIfoqghAv"	PierreTran	2	1	1528800847	1006489820162609152	https://twitter.com/PierreTran/status/1006489820162609152		# #	
	# JUPARIS18 # Trophées2018 Adoption internationale : ENGIE, projet One HR, Violaine Pons-Vidartpic.twitter.com/gfVleLka7t	PierreTran	4	4	1528800235	1006487254993391617	https://twitter.com/PierreTran/status/1006487254993391617		# #	
	# JUPARIS18 # Trophées2018 Méthodologie pour le Cloud : Crédit Agricole Assurances, Hélène Napolypic.twitter.com/2eP9huSWz2	PierreTran	0	0	1528799772	1006485312464474112	https://twitter.com/PierreTran/status/1006485312464474112		# #	
	# JUPARIS18 Cérémonie des Trophées Oracle des Clubs Utilisateurs 2018 # Trophées2018 : valoriser vos créations, partager votre expérience. Le fil rouge : le cloud comme transformateurpic.twitter.com/Qgz7BUgdY1	PierreTran	2	2	1528799371	1006483630762397696	https://twitter.com/PierreTran/status/1006483630762397696		# #	
	@ jeanmarchbh désolé j'ai écorché votre nom pendant toute la matinée	PierreTran	0	0	1528796902	1006473272903553024	https://twitter.com/PierreTran/status/1006473272903553024			@
	# JUPARIS18 Jean-Marc Hui Bon Ha : Viendez à la journée du 26 juin, annonce de nouvelles startups accélérées, à suivre sur @ ClubAUFOpic.twitter.com/B40ZNbbGt4	PierreTran	0	0	1528795607	1006467840570986497	https://twitter.com/PierreTran/status/1006467840570986497		#	@
	# JUPARIS18 Jean-Marc Hui Bon Hoa : il faut s'adapter tous les jours, typologies plus agiles des start-up, il faut mettre en oeuvre des mécanismes différents pour mieux communiquerpic.twitter.com/BUQsRG57j8	PierreTran	2	2	1528795423	1006467071738249216	https://twitter.com/PierreTran/status/1006467071738249216		#	
	# JUPARIS18 Jean-Emmanuel Granade : Objectif de time 2 market, de payer les pilotes, fonctionner en bienveillance, accepter l'échecpic.twitter.com/ynroilsoqM	PierreTran	1	0	1528795121	1006465803171106816	https://twitter.com/PierreTran/status/1006465803171106816		#	
	# JUPARIS18 Arthur Philbe @ Weblib : la volonté de disrupter chez Oracle est très forte, les moyens sont là, bénéfices de l'internationalpic.twitter.com/itogdFAC9h	PierreTran	5	3	1528794886	1006464819833208832	https://twitter.com/PierreTran/status/1006464819833208832		#	@
	# JUPARIS18 Témoignages de startups accélérées : Charles Dunston @ DialOnce, Arthur Philbe @ Weblibpic.twitter.com/J5Ukw5JCok	PierreTran	1	2	1528794595	1006463595914330112	https://twitter.com/PierreTran/status/1006463595914330112		#	@ @
	# JUPARIS18 Jean-Emmanuel Granade, CA Ile-de-France : on a aussi des relations avec des start-up qui se basent sur l'affectifpic.twitter.com/QHbkFGaY3z	PierreTran	2	1	1528794333	1006462500169310208	https://twitter.com/PierreTran/status/1006462500169310208		#	
	# JUPARIS18 Jean-Emmanuel Granade, CA Ile-de-France : Oracle a l'habitude des contraintes de conformité, de sclabilité, les notions et co,trai,tes des grands groupespic.twitter.com/JVMqqLLJ18	PierreTran	0	0	1528794141	1006461694930022400	https://twitter.com/PierreTran/status/1006461694930022400		#	
	# JUPARIS18 Jean-Marc Hui Bon Ha : Le programme Start-up Cloud Accelerator rapproche les start-up et les grands groupes. En 2018, on étendu le panel avec les universités et grandes écoles, création du Scal-up System Program. 26 juin appel de mentorspic.twitter.com/OGp3rfU2vl	PierreTran	2	4	1528793856	1006460496252489728	https://twitter.com/PierreTran/status/1006460496252489728		#	
	# JUPARIS18 Start-Up/Grand compte, une connexion gagnante avec Jean-Marc Hui Bon Ha, coordonne l'initiative d’accélération startup chez Oraclepic.twitter.com/lPqCXJTuDg	PierreTran	1	0	1528793524	1006459105014403072	https://twitter.com/PierreTran/status/1006459105014403072		#	
	"# JUPARIS18 Erwan Deveze : la solution est coeur de la diversité : chercheur, artiste, startupper... ""Sois le changement que tu veux voir dans le monde"" -Gandi"	PierreTran	2	0	1528793375	1006458479366823936	https://twitter.com/PierreTran/status/1006458479366823936		#	
	# JUPARIS18 Erwan Deveze : cultivez la saillance, le jeu, l'active learning, l'état d'esprit d'apprenant permanentpic.twitter.com/ilJ3pcc8pb	PierreTran	3	2	1528793212	1006457798870388740	https://twitter.com/PierreTran/status/1006457798870388740		#	
	# JUPARIS18 Erwan Deveze : le multitasking génère une pensée zapping, fait beaucoup de mal à notre cerveau. Le cerveau ne peut pas faire 2 choses en même temps. Octroyez-vous des plages déconnectéespic.twitter.com/3JBjtdPgIc	PierreTran	3	1	1528793010	1006456949163134976	https://twitter.com/PierreTran/status/1006456949163134976		#	
	#JUPARIS18 Erwan Deveze : fondamentalement, on n'est pas configuré pour le changement, c'est normal. Nécessité d'apprendre tous les jourspic.twitter.com/YrTEqwXdfl	PierreTran	3	2	1528792730	1006455773197733889	https://twitter.com/PierreTran/status/1006455773197733889		#JUPARIS18	
	# JUPARIS18 Erwan Deveze : Face à l'IA, 2 solutions : on y va de nos prédictions, discours alarmisme, on va flinguer nos cerveaux, on va vers un pays gouverné par la peur il y a des inconnues, la meilleure façon de se préparer c'est de redécouvrir son cerveaupic.twitter.com/GEJt4WXJhO	PierreTran	1	0	1528792443	1006454570065809408	https://twitter.com/PierreTran/status/1006454570065809408		#	
	# JUPARIS18 Erwan Deveze : l'IA est une formidable opportunité d'explorer ce qu'il y a de mieux en nous : l'intelligence des émotions, des relations, des situations, là ou l'IA n'est pas prête de nous rejoindre. Sofia est un guignol de l'infopic.twitter.com/mMOWOuuH50	PierreTran	1	0	1528792088	1006453082996314112	https://twitter.com/PierreTran/status/1006453082996314112		#	
	# JUPARIS18 Erwan Deveze : travaillez votre SCARF : Statut : statut cérébral à respecter Certitude : besoin d'être rassuré Autonomie : s’accompagne de l'échec qui permet de grandir Relation : nous sommes des animaux sociaux Franc jeu : le non-conscient 90%pic.twitter.com/i3hg3mURnJ	PierreTran	3	3	1528791760	1006451706874531840	https://twitter.com/PierreTran/status/1006451706874531840		#	
	# JUPARIS18 Erwan Deveze : Ouvrir ses mails en arrivant au bureau, ça flingue le cerveau pour la journée. Plutôt, prenez un feuille et dessinez votre journée et gardez cette image globale pour la journée. Faites des pauses régulièrement, séquencez votre travail...pic.twitter.com/5tXmd3PBTk	PierreTran	3	0	1528791379	1006450108265844736	https://twitter.com/PierreTran/status/1006450108265844736		#	
	# JUPARIS18 Erwan Deveze : N'utilise-t-on que 10% de son cerveau ? C'est faux. Mais c'est vrai qu'on utilise mal notre cerveau. La méditation peut améliorer son fonctionnementpic.twitter.com/ntFlRzQZwr	PierreTran	1	0	1528791177	1006449262488707072	https://twitter.com/PierreTran/status/1006449262488707072		#	
	# JUPARIS18 Erwan Deveze , chercehur en neurosciences : les neurosceinces étudient fonctionnement, physiologie et pathologies du cerveaupic.twitter.com/x7Cp0NrcRE	PierreTran	1	0	1528790546	1006446616570626048	https://twitter.com/PierreTran/status/1006446616570626048		#	
	# JUPARIS18 Jean-Jacqus Camps : élaboration d'un Guide des bonnes pratiques RGPD, en collaboration avec 4 autres clubs utilisateurs, soumis à CNIL pour intégrer leur charte. Tout frais, dispo aujourd'huipic.twitter.com/WwtsZUcTJD	PierreTran	1	3	1528790396	1006445985839665152	https://twitter.com/PierreTran/status/1006445985839665152		#	
	"# JUPARIS18 Ouverture de la 13ème Journée Utilisateurs Oracle 2018 ""Cloud, IA, comment piloter la changement dans un monde diruptif"" avec Françoise Hemery (Club J.D.Edwards), Jean-Jacques Camps (Club U Oracle), Yacine Mbarki # LBDW"	PierreTran	2	2	1528790262	1006445423890976768	https://twitter.com/PierreTran/status/1006445423890976768		# #	
	La Journée du Club des Utilisateurs Oracle à suivre aujourd'hui sur # JUPARIS18 # lbdwhttp://clubutilisateursoracle.org/ju/journee-utilisateurs-2018/ …	PierreTran	1	3	1528786579	1006429975812214785	https://twitter.com/PierreTran/status/1006429975812214785		# #	
	Este jueves en el CEU se celebra el evento Economía y Financiación Digital descentralizada. # Blockchain- # Fintech. Encantado de compartir mesa redonda con @ jjmoraunix @ rfhergueta @ CarmenChicharro y @ JGrauMiro, moderados por @ joobid https://www.ceuiam.com/business-school/economia-y-financiacion-digital-descentralizada-blockchain-fintech--evento … Gracias @ Luis_vega_74pic.twitter.com/VXf6os5eMe	AntonioSelas	10	9	1528810050	1006528420870836225	https://twitter.com/AntonioSelas/status/1006528420870836225		# #	@ @ @ @ @ @
	Nintendo: Dragon Ball FighterZ - 2018 Monster Hunter Generations Ultimate - Aug. 28 Starlink: Battle for Atlas - Oct. 16	mochi_wsj	33	13	1528823011	1006582784847015937	https://twitter.com/mochi_wsj/status/1006582784847015937			
	Nintendo: new Smash Bros. is coming in December 7.	mochi_wsj	31	21	1528821768	1006577569477476352	https://twitter.com/mochi_wsj/status/1006577569477476352			
	Nintendo: new Smash Bros. includes Snake	mochi_wsj	15	4	1528820449	1006572035571499012	https://twitter.com/mochi_wsj/status/1006572035571499012			
	Nintendo: new demo for Octopath available on 14thpic.twitter.com/nhdG3U6Jsw	mochi_wsj	33	20	1528820102	1006570581213368320	https://twitter.com/mochi_wsj/status/1006570581213368320			
