	I'm inclined to say, switch to one of the PoS algos that we know works, but with weaker security properties (ie. the ones running in the wild since 2011-13, with improvements).	VitalikButerin	69	8	1530213005	1012412840056012800	https://twitter.com/VitalikButerin/status/1012412840056012800			
	That said, if the new constitution lacks article IV entirely that *is* scary.	VitalikButerin	5	4	1530145718	1012130616316489728	https://twitter.com/VitalikButerin/status/1012130616316489728			
	"The kind of ""vote buying"" where you promise to do nice things for specific constituencies is much less harmful than literally paying people for their specific vote."	VitalikButerin	4	3	1530145686	1012130482505551872	https://twitter.com/VitalikButerin/status/1012130482505551872			
	It needs to specifically be a prohibition on peering into a vote's internal structure, if that makes sense.	VitalikButerin	5	3	1530145597	1012130110361792513	https://twitter.com/VitalikButerin/status/1012130110361792513			
	"The correct formulation of anti-vote-buying is ""you cannot give out rewards or penalties that are directly conditional on how someone voted"". Rewards or penalties conditional on *the result* of a vote are ok."	VitalikButerin	26	3	1530145563	1012129966606168064	https://twitter.com/VitalikButerin/status/1012129966606168064			
	Thanks Iris. I actually LOVED giving this speech. I think we DO need a new social contract for the digital age.https://twitter.com/SHEntrepreneurM/status/1012393926131683328 …	dtapscott	19	3	1530211693	1012407337083076608	https://twitter.com/dtapscott/status/1012407337083076608			
	This fake Don Tapscott on Facebook is trying to scam you. Please report him. https://www.facebook.com/Don.tapscott1	dtapscott	9	0	1530209739	1012399142558158851	https://twitter.com/dtapscott/status/1012399142558158851			
	It appears you have the résumé of a double-agent, comrade. https://en.wikipedia.org/wiki/Bob_Seely pic.twitter.com/YrfsDrUEUL	maxkeiser	5	2	1530207909	1012391465891385345	https://twitter.com/maxkeiser/status/1012391465891385345			
	Keep that stiff upper lip, Giles and carry on!pic.twitter.com/GwiCU664ho	maxkeiser	46	18	1530188796	1012311299399831552	https://twitter.com/maxkeiser/status/1012311299399831552			
	Soho, London.pic.twitter.com/11iNslS0sO	maxkeiser	94	28	1530175352	1012254910937731075	https://twitter.com/maxkeiser/status/1012254910937731075			
	Les entreprises qui adopteraient les technologies d'intelligence artificielle seraient sensiblement moins susceptibles de voir leurs travailleurs se faire désertermédier par ces technologies (et c'est assez logique) https://www.zdnet.com/article/citizen-ai-a-business-guide-on-raising-ai-in-a-digital-economy/ … # AI @ glencore	babgi	23	20	1530201202	1012363335193460736	https://twitter.com/babgi/status/1012363335193460736		#	@
	"""If you can do it, teach it"" la maxime du jour, drôle ou grinçante selon d'où on se place."	babgi	8	0	1530179516	1012272376510386177	https://twitter.com/babgi/status/1012272376510386177			
	Keep up the great growth and reimagining of the future of insurance. Great job @ SpirosMargaris and teams.	JimMarous	12	2	1530213420	1012414579429736448	https://twitter.com/JimMarous/status/1012414579429736448			@
	It is a process. In the last 90 days I have worked a web team, graphic designer, SEO firm, speaker mgt agency, copywriter, database specialist and outbound sales specialist for my personal brand and business. You are a living example of embracing change, and disrupting yourself.	JimMarous	3	1	1530206608	1012386009953206273	https://twitter.com/JimMarous/status/1012386009953206273			
	Great fun today speaking on the future of money to a diverse group of bankers, technologists, consultants and regulators. https://www.instagram.com/p/BkkEECjlalJ/?utm_source=ig_twitter_share&igshid=pdazjusuiaf9 …	JimMarous	9	4	1530178479	1012268028795506688	https://twitter.com/JimMarous/status/1012268028795506688			
	Catch the great interview of @ BrettKing by Chloe James on @ SkyNewsAust. https://www.skynews.com.au/details/_5802775158001 … # banking # fintech # finserv # futurist @ Breakingbanks1 @ BBanksAsia @ JPNicols @ psb_dc @ leimer @ provokemgmt @ Prashant_1722 @ dgwbirchpic.twitter.com/up1bFDVzuc	JimMarous	41	32	1530178224	1012266959294038016	https://twitter.com/JimMarous/status/1012266959294038016		# # # #	@ @ @ @ @ @ @ @ @ @
	Thank you @ elpais_economia for the honor of opening your Future of Money event today in Madrid. # banking # fintech # finserv # futureofmoney # cashless # payments @ ipfconline1 @ DeepLearn007 @ BrettKing @ leimer @ psb_dc @ FinancialBrand @ provokemgmtpic.twitter.com/TmS8VGjTjI	JimMarous	51	32	1530174155	1012249890414649344	https://twitter.com/JimMarous/status/1012249890414649344		# # # # # #	@ @ @ @ @ @ @ @
	Closed walls will not work in long term.	JimMarous	0	0	1530169121	1012228775558418432	https://twitter.com/JimMarous/status/1012228775558418432			
	Thank you for your comment. I believe most of the numbers are artificially boosted by banks just moving benchmark P2P to Zelle. Still too much friction IMHO.	JimMarous	3	0	1530169120	1012228772312084480	https://twitter.com/JimMarous/status/1012228772312084480			
	@ MetaCert @ Paul__Walsh wtf?	VinnyLingham	0	0	1530204662	1012377848101810177	https://twitter.com/VinnyLingham/status/1012377848101810177			@ @
	Great read by @ m2jrhttps://twitter.com/m2jr/status/1012371796794986496 …	VinnyLingham	12	2	1530203253	1012371938558087168	https://twitter.com/VinnyLingham/status/1012371938558087168			@
	He hasn't made enough crypto investments yet, but @ Dafrankel is a master of unorthodox ecommerce, writing first checks into @ civickey, @ gyft, and... @ PillPack, which was just acquired by Amazon - Congrats David!https://medium.com/@foundercollective/5-lessons-from-pillpacks-sale-to-amazon-375bf9b6523c …	VinnyLingham	42	1	1530198360	1012351414968856576	https://twitter.com/VinnyLingham/status/1012351414968856576			@ @ @ @ @foundercollective
	Being too early can deliver the same outcomes as being wrong, as they say in the venture capital world. Timing, as with most things, is everything. (2/2)	VinnyLingham	94	11	1530196235	1012342500382552065	https://twitter.com/VinnyLingham/status/1012342500382552065			
	The secret to making money in markets is not always about knowing more than the market, but instead, figuring out how long it will take for the broader market to overcome that knowledge gap so that you can act accordingly. (1/2)	VinnyLingham	135	28	1530196234	1012342498394378241	https://twitter.com/VinnyLingham/status/1012342498394378241			
	Yes please!!!	VinnyLingham	3	0	1530195627	1012339950484766724	https://twitter.com/VinnyLingham/status/1012339950484766724			
	Thanks - I wish I had the time!	VinnyLingham	2	0	1530194863	1012336749106741249	https://twitter.com/VinnyLingham/status/1012336749106741249			
	Channels are small by design for now because it's still beta software. And in the end, LN is best suited for smaller payments anyways.	SatoshiLite	7	0	1530194010	1012333169545076738	https://twitter.com/SatoshiLite/status/1012333169545076738			
	Yes	SatoshiLite	18	4	1530172716	1012243854198824960	https://twitter.com/SatoshiLite/status/1012243854198824960			
	Who's insisting that you should get excited?	SatoshiLite	6	1	1530158801	1012185490966155264	https://twitter.com/SatoshiLite/status/1012185490966155264			
	No, it wouldn't have succeeded if I did that.	SatoshiLite	8	1	1530155404	1012171243636678656	https://twitter.com/SatoshiLite/status/1012171243636678656			
	Mcafee minecraft	officialmcafee	4	4	1530219966	1012442036480376832	https://twitter.com/officialmcafee/status/1012442036480376832			
	I will be speaking at the Blockchain World Conference at Harrah's Casino in Atlantic City. It will be the largest crypto event in history with eight thousand attendees and live streaming across the world. Use this link to purchase tickets for $334. https://www.universe.com/embed2/events/5aeb89dcb3dd46003402102b?state=%7B%22currentDiscountCode%22%3A%7B%22code%22%3A%22MCAFEE35%22%7D%7D …	officialmcafee	767	152	1530201009	1012362527479685121	https://twitter.com/officialmcafee/status/1012362527479685121			
	The crypto exchanges have become the thing that we have originally fought against. Their power is immense. Hitbtc, for example, has increased suffering for millions of poor people who cannot afford the minimum buy-in since it is greater than their monthly income. Boycott them.	officialmcafee	3004	665	1530193299	1012330185872564224	https://twitter.com/officialmcafee/status/1012330185872564224			
	O	officialmcafee	9	3	1530182471	1012284770104086530	https://twitter.com/officialmcafee/status/1012284770104086530			
bitcoin ethereum 	If you think BTC with its full block, high fee policy will be able to maintain market share, you are mistaken. It won’t, and it is time to move on to other things. # BitcoinCash # Ethereum # Dash # Monero # Zcash # Zcoin # cryptocurrencypic.twitter.com/icVxopyJCZ	rogerkver	748	226	1530220105	1012442620956741632	https://twitter.com/rogerkver/status/1012442620956741632		# # # # # # #	
	. @ CIOStraightTalk # STinsights Read Chapter 10 of # Bank4.0 to get my Roadmap for 2020-2030 in # FinancialServices	BrettKing	6	1	1530199812	1012357504339185665	https://twitter.com/BrettKing/status/1012357504339185665		# # #	@
	(Part 1/2) #1 Deliver every product you have in real-time without a signature #2 Remove product silos and create experience, delivery competency #3 Tech is your business, stop hiring bankers (those with legacy thinking) @ CIOStraightTalk # STinsights	BrettKing	16	9	1530199508	1012356231154098176	https://twitter.com/BrettKing/status/1012356231154098176		#1 #2 #3 #	@
	(Part 2/2) #4 Create a culture of change - risk adverse culture is bad for innovation #5 Partner with and invest in fintechs and disruptors # cheaper and # faster than DIY @ CIOStraightTalk # STinsights	BrettKing	17	10	1530199508	1012356230059319297	https://twitter.com/BrettKing/status/1012356230059319297		#4 #5 # # #	@
	. @ CIOStraightTalk # STinsights Millennials don't engage with FS players in historical ways, and can't be trained to do so. This fundamentally changes # economics of # acquisition	BrettKing	7	4	1530199209	1012354975945707521	https://twitter.com/BrettKing/status/1012354975945707521		# # #	@
	# AI disrupts humans and advice, but # financialservices in # embeddedtech most jarring as existing products disappear in favor of tech-based experiences. # STinsights @ CIOStraightTalk	BrettKing	7	4	1530198610	1012352465033973760	https://twitter.com/BrettKing/status/1012352465033973760		# # # #	@
	. @ CIOStraightTalk The greatest opportunities lie in the ability to reinvent relevance, differentiation at this stage is still relatively easy # STinsights	BrettKing	9	5	1530198311	1012351209389387776	https://twitter.com/BrettKing/status/1012351209389387776		#	@
	. @ CIOStraightTalk Greatest challenges are # legacy, # friction and # culture. Almost nothing about being good at tomorrow's # financialservices lies in how we did in the past # STinsights	BrettKing	10	7	1530197410	1012347429071589377	https://twitter.com/BrettKing/status/1012347429071589377		# # # # #	@
	Starting in just a few minutes @ CIOStraightTalk # STinsightshttps://twitter.com/CIOStraightTalk/status/1012343245202849793 …	BrettKing	7	3	1530196760	1012344704862736385	https://twitter.com/BrettKing/status/1012344704862736385		#	@
	Check out my recent interview on how # Technology and # Innovation are reshaping # Business and # FinancialServices with Chloé James on @ SkyNewsAust https://www.skynews.com.au/details/_5802775158001 … @ CIOStraightTalk # STinsights # Banking # Fintech # Finserv # Futurist @ SkyNews @ SkyNewsBiz @ provokemgmtpic.twitter.com/3tLQBPVBaI	BrettKing	48	31	1530196661	1012344288892596224	https://twitter.com/BrettKing/status/1012344288892596224		# # # # # # # # #	@ @ @ @ @
	Starts in an hour. Join me for a # TweetChat with fellow # Fintech thought leaders on how the traditional # FinancialServices industry can thrive in an age of # Disruption. @ CIOStraightTalk # STinsightshttps://twitter.com/ciostraighttalk/status/1011264369748074497 …	BrettKing	14	10	1530192448	1012326619439075328	https://twitter.com/BrettKing/status/1012326619439075328		# # # # #	@
	Sorry to hear that Per	BrettKing	1	0	1530183750	1012290136799784960	https://twitter.com/BrettKing/status/1012290136799784960			
	I’ve finally found someone who travels as much as I	BrettKing	1	0	1530150566	1012150953338810368	https://twitter.com/BrettKing/status/1012150953338810368			
	The flight to the big banks in terms of assets has very little to do with location in the US and more about ease of use/digital. Assets 22-67% from 05-18. @ FinancialBrand showed more new customers chose mobile as the driver vs branch	BrettKing	2	0	1530149982	1012148504163069952	https://twitter.com/BrettKing/status/1012148504163069952			@
	Is it on the Blockchain?	BrettKing	3	0	1530148186	1012140968089300992	https://twitter.com/BrettKing/status/1012140968089300992			
	I got upgraded to the presidential suite there once. Amazing	BrettKing	2	0	1530139526	1012104648235204608	https://twitter.com/BrettKing/status/1012104648235204608			
	But they’re good at estimating market returns right?	BrettKing	1	0	1530139413	1012104174006423552	https://twitter.com/BrettKing/status/1012104174006423552			
	@ JPNicols you might need to respond ;)	BrettKing	2	0	1530138946	1012102212561063936	https://twitter.com/BrettKing/status/1012102212561063936			@
	It’s spontaneous - sorry.	naval	2	0	1530221922	1012450242556411904	https://twitter.com/naval/status/1012450242556411904			
	Most of the savers in society are older people retired off their savings and most of the debtors are younger people. Younger people have more options. Older people in retirement are devastated by low interest rates and high inflation.	naval	9	1	1530214073	1012417321061634048	https://twitter.com/naval/status/1012417321061634048			
	I use like as a “thank you.”	naval	55	0	1530209623	1012398654915731456	https://twitter.com/naval/status/1012398654915731456			
	If you can’t delete an email without flinching or responding, you won’t scale.https://twitter.com/quellhorst/status/1012392401275686912 …	naval	974	171	1530209154	1012396688349192192	https://twitter.com/naval/status/1012396688349192192			
	That’s not how logic works...	naval	3	0	1530207707	1012390618704695296	https://twitter.com/naval/status/1012390618704695296			
	Biometrics, when they fail, fail catastrophically. You can’t replace your fingerprints or your eyes.	naval	8	1	1530207637	1012390324126113792	https://twitter.com/naval/status/1012390324126113792			
	Notifications are just alarm clocks that someone else is setting for you.https://twitter.com/samirmadi01/status/1012387370606268417 …	naval	1869	448	1530207537	1012389905840816133	https://twitter.com/naval/status/1012389905840816133			
	“Governance Markets” are the new Financial Markets.https://twitter.com/m2jr/status/1012371796794986496 …	naval	152	38	1530204920	1012378928667750400	https://twitter.com/naval/status/1012378928667750400			
	https://twitter.com/naval/status/1012359677336670211?s=21 …	naval	5	0	1530200436	1012360122503327744	https://twitter.com/naval/status/1012360122503327744			
	Smart contracts can easily build in arbitration. They make everyday tracking easier and more transparent. For ajudication, they allow selection of any arbiter, from oracle to lawyer to trusted friend.	naval	8	1	1530200330	1012359677336670211	https://twitter.com/naval/status/1012359677336670211			
	Very familiar with it.	naval	4	0	1530200179	1012359045104070657	https://twitter.com/naval/status/1012359045104070657			
	I just prefer to be spontaneous. It’s a luxury and not always possible. It doesn’t take work from my end but can be incompatible with others.	naval	2	0	1530199963	1012358137561542657	https://twitter.com/naval/status/1012358137561542657			
	Whatever keeps you up...	naval	71	0	1530180450	1012276292983533568	https://twitter.com/naval/status/1012276292983533568			
	Absolutely.	naval	32	2	1530179951	1012274200139067392	https://twitter.com/naval/status/1012274200139067392			
	Well said.	naval	13	0	1530179809	1012273605474783232	https://twitter.com/naval/status/1012273605474783232			
	When building habits, choose consistency over content. The best book is the one you can’t put down. The best exercise is the one you enjoy doing every day. The best health food is the one you find tasty. The best work is the work you’d do for free.	naval	10240	3376	1530179311	1012271519009943552	https://twitter.com/naval/status/1012271519009943552			
	Check out @ ScottAdamsSays book. He addresses this squarely:https://www.amazon.com/How-Fail-Almost-Everything-Still/dp/1491518855 …	naval	6	2	1530168818	1012227508559724544	https://twitter.com/naval/status/1012227508559724544			@
	Big fan of Coase.	naval	8	2	1530168780	1012227348123406336	https://twitter.com/naval/status/1012227348123406336			
	It’s easier to become successful by being good at a few different things than by being great at one thing.	naval	7	2	1530168653	1012226812728864770	https://twitter.com/naval/status/1012226812728864770			
	And to manage them for smaller time periods. Contractors whose deliverables and payments are atomized.	naval	1	0	1530168134	1012224637525155841	https://twitter.com/naval/status/1012224637525155841			
	Smart contracts will allow the people who do that to scale into a much larger network. One manager managing 50 relationships instead of 5.	naval	2	1	1530168095	1012224473049649152	https://twitter.com/naval/status/1012224473049649152			
	Something new, but likely each firm will be able to handle more of each kind of relationship and more effectively plug into online marketplaces for capital and labor.	naval	23	0	1530166456	1012217601668218880	https://twitter.com/naval/status/1012217601668218880			
	Contracts will be encrypted and Zero-Knowledge Proofs will provide selective disclosure to each party.	naval	3	1	1530166238	1012216683845468160	https://twitter.com/naval/status/1012216683845468160			
	Interesting. Are there any examples to date of customers unionizing? What would it take?	naval	1	0	1530166061	1012215943211053056	https://twitter.com/naval/status/1012215943211053056			
bitcoin 	Fair, that's why I focused on Bitcoin.	naval	4	0	1530165974	1012215578042384385	https://twitter.com/naval/status/1012215578042384385			
	Yes, old news to those who have been in crypto for a while. I wanted to see how simply I could explain the potential.	naval	56	2	1530165440	1012213339601043456	https://twitter.com/naval/status/1012213339601043456			
bitcoin 	The value of Bitcoin derives from its decentralization. Any centralized competitor is dead on arrival.	naval	7	1	1530165185	1012212267776016384	https://twitter.com/naval/status/1012212267776016384			
	"A firm is just a ""nexus of contracts."" Payroll contracts with employees, profit contracts with shareholders, debt contracts with lenders, delivery contracts with customers, tax contracts with the state. Blockchain-based ""smart"" contracts will eventually reinvent the firm."	naval	3352	1031	1530165110	1012211955459690496	https://twitter.com/naval/status/1012211955459690496			
	Usage decline may have more to do with easier-to-use alternatives like Netflix and Spotify.	naval	22	0	1530164544	1012209578186903552	https://twitter.com/naval/status/1012209578186903552			
bitcoin 	Bitcoin Q&A: Lightning Network scalinghttps://youtu.be/4KiWkwo48k0	aantonop	461	213	1530207040	1012387821724856322	https://twitter.com/aantonop/status/1012387821724856322			
	bahahahahahahaha.	ummjackson	5	0	1530222256	1012451643512635392	https://twitter.com/ummjackson/status/1012451643512635392			
	Guess I'll have to stop playing as Link.https://twitter.com/motherboard/status/1012417879411654657 …	ummjackson	7	0	1530214470	1012418984098983936	https://twitter.com/ummjackson/status/1012418984098983936			
	*gasp* where is @ VitalikButerin's zany t-shirt?!	ummjackson	4	0	1530214378	1012418598453764096	https://twitter.com/ummjackson/status/1012418598453764096			@
	If it's free I'll check it out. Just Bootcamped my iMac so I can run Windows games again.	ummjackson	1	0	1530200782	1012361575091429376	https://twitter.com/ummjackson/status/1012361575091429376			
	This thing is turning out to the worlds most expensive enterprise DB install.	ummjackson	5	0	1530195789	1012340630779932672	https://twitter.com/ummjackson/status/1012340630779932672			
	Yep yep, it’s much better with the Pro	ummjackson	0	0	1530194625	1012335750816325632	https://twitter.com/ummjackson/status/1012335750816325632			
	It also gave us inequality and unsustainable debt... but back to the real issue: take a look at meme quality over the past 24 months, it’s a mess.	ummjackson	0	0	1530169818	1012231699948695554	https://twitter.com/ummjackson/status/1012231699948695554			
bitcoin 	Bitcoin deciding if it wants to crash some more this week.pic.twitter.com/XvjCGZ6cid	ummjackson	54	4	1530169565	1012230641327337472	https://twitter.com/ummjackson/status/1012230641327337472			
	It somehow runs smoother on the Switch. Less glitchy and I’ve been getting better which is kinda rewarding.	ummjackson	4	0	1530169211	1012229153033080833	https://twitter.com/ummjackson/status/1012229153033080833			
	Nah man, capitalism is the destroyer of good memes - stripping away the creativity and co-opting the format for TV commercials and Katy Perry music videos. Open your eyes.	ummjackson	2	0	1530169093	1012228660172951552	https://twitter.com/ummjackson/status/1012228660172951552			
	Ok the Switch version of Fortnite has me hooked.	ummjackson	18	2	1530167384	1012221493776769024	https://twitter.com/ummjackson/status/1012221493776769024			
	What does your fragile masculinity impacting your ability to enjoy soy products have to do with cryptocurrency?	ummjackson	1	0	1530167337	1012221293112930304	https://twitter.com/ummjackson/status/1012221293112930304			
	Fortnite runs smoother on my iPhone than it does on my iMac.	ummjackson	44	0	1530148809	1012143583304937472	https://twitter.com/ummjackson/status/1012143583304937472			
	It's... it's a lot.	ummjackson	2	0	1530140712	1012109620142174209	https://twitter.com/ummjackson/status/1012109620142174209			
	Supreme Court won't rehear Ross Ulbricht's case, even though they just changed Fourth Amendment law with <em>Carpenter</em> in a way that makes such rehearing the right thing to do. https://reason.com/blog/2018/06/28/ross-ulbrichts-case-will-not-be-heard-by … via @ reason # FreeRoss	ErikVoorhees	268	107	1530218061	1012434047585271808	https://twitter.com/ErikVoorhees/status/1012434047585271808		#	@
bitcoin 	Supreme Ct digital # privacy decision opens door to rechallenging Bank Secrecy Act constitutionality by # blockchain cos http://www.forbes.com/sites/caitlinlong/2018/06/28/supreme-court-and-digital-privacy-should-blockchain-companies-challenge-the-bank-secrecy-act/ … # bitcoin @ CaitlinLong_	ErikVoorhees	53	25	1530213979	1012416927522742272	https://twitter.com/ErikVoorhees/status/1012416927522742272		# # #	@
	It’s that time. Lots to do.	brockpierce	0	0	1530160042	1012190696860725253	https://twitter.com/brockpierce/status/1012190696860725253			
		brockpierce	1	0	1530159648	1012189043554168832	https://twitter.com/brockpierce/status/1012189043554168832			
		brockpierce	1	0	1530155397	1012171212737384448	https://twitter.com/brockpierce/status/1012171212737384448			
	Thread:https://twitter.com/bgurley/status/1012360935510458368 …	TuurDemeester	11	1	1530210661	1012403007466680320	https://twitter.com/TuurDemeester/status/1012403007466680320			
	Agreed, phenomenal & enlightening.	TuurDemeester	3	1	1530210644	1012402939191799808	https://twitter.com/TuurDemeester/status/1012402939191799808			
	What's the advantage over Mac's built in screenshot function?	TuurDemeester	0	0	1530208579	1012394277304000517	https://twitter.com/TuurDemeester/status/1012394277304000517			
	https://www.youtube.com/watch?v=9U4Ha9HQvMo …	TuurDemeester	1	0	1530201826	1012365953110282240	https://twitter.com/TuurDemeester/status/1012365953110282240			
	That'd be awesome!	TuurDemeester	0	0	1530192019	1012324816630812673	https://twitter.com/TuurDemeester/status/1012324816630812673			
	https://twitter.com/TuurDemeester/status/987025637398413313?s=19 …	TuurDemeester	0	0	1530191499	1012322637685710848	https://twitter.com/TuurDemeester/status/1012322637685710848			
	https://twitter.com/BenedictEvans/status/1012042604198821889?s=19 …	TuurDemeester	2	2	1530184691	1012294081245077504	https://twitter.com/TuurDemeester/status/1012294081245077504			
	"""The Future of Tesla Hinges on This Gigantic Tent"" https://www.bloomberg.com/amp/news/articles/2018-06-25/the-future-of-tesla-hinges-on-this-gigantic-tent?__twitter_impression=true …pic.twitter.com/SoOLz3H5Pw"	TuurDemeester	10	4	1530184674	1012294011825131520	https://twitter.com/TuurDemeester/status/1012294011825131520			
	"In a way you could argue that ""polycoinism"" is already here, with people arguing you get a superior store of value by holding a basket of coins over a single one. https://jpkoning.blogspot.com/2018/06/failed-monetary-technology.html …https://twitter.com/jp_koning/status/1001122943643119616 …"	TuurDemeester	50	16	1530155231	1012170517305053184	https://twitter.com/TuurDemeester/status/1012170517305053184			
	Catch me on @ CNBCFastMoney in the next 5 minutes for my next BTC call!pic.twitter.com/uGuC98edDd	cryptomanran	76	2	1530222360	1012452079401558018	https://twitter.com/cryptomanran/status/1012452079401558018			@
