	Obviously Trump’s meeting with Kim had a real impact on him.https://twitter.com/jwpetersnyt/status/1007609991644237824 …	prchovanec	6	0	1529068043	1007610522106322944	https://twitter.com/prchovanec/status/1007610522106322944			
	It’s disgusting. Horrifying. Obscene. Not in the least bit funny.	prchovanec	15	0	1529067902	1007609929576960001	https://twitter.com/prchovanec/status/1007609929576960001			
	I won’t. Haven’t forgotten about the other stuff he’s said too.	prchovanec	1	0	1529067726	1007609190779621378	https://twitter.com/prchovanec/status/1007609190779621378			
	For a US President to say this is pure evil. And I don’t say that lightly.https://twitter.com/zekejmiller/status/1007605585498529792 …	prchovanec	32	13	1529067354	1007607633312931840	https://twitter.com/prchovanec/status/1007607633312931840			
	China responds to Trump’s latest tariffs:https://twitter.com/onlyyoontv/status/1007606557570265088 …	prchovanec	6	6	1529067269	1007607274850914305	https://twitter.com/prchovanec/status/1007607274850914305			
	Very. They’ve blackballed people for much much less.	prchovanec	1	0	1529067235	1007607132416630784	https://twitter.com/prchovanec/status/1007607132416630784			
	Dear God. Did he really say that? Tell me he didn’t. Please.https://twitter.com/zekejmiller/status/1007605585498529792 …	prchovanec	27	8	1529067115	1007606628244475906	https://twitter.com/prchovanec/status/1007606628244475906			
	I like Presidents who didn’t get captured.https://twitter.com/zekejmiller/status/1007604754707550209 …	prchovanec	26	6	1529066977	1007606052056166405	https://twitter.com/prchovanec/status/1007606052056166405			
	I don’t actually know what he’s talking about here.https://twitter.com/foxnews/status/1007602089546145792 …	prchovanec	7	2	1529066781	1007605229183995904	https://twitter.com/prchovanec/status/1007605229183995904			
	I remember just two weeks ago, being lectured by Trump fans for expressing skepticism of his claims he had just sealed a huge trade deal with China.https://twitter.com/wsj/status/1007600639311077376 …	prchovanec	7	2	1529066612	1007604518756995073	https://twitter.com/prchovanec/status/1007604518756995073			
	Trump is treating the post-war international order the US helped build like a rock star trashing his hotel room.https://www.washingtonpost.com/opinions/donald-trumps-america-the-rogue-superpower/2018/06/14/c01bb540-6ff7-11e8-afd5-778aca903bbe_story.html?utm_term=.512367397dd5 …	prchovanec	8	1	1529066358	1007603455001800704	https://twitter.com/prchovanec/status/1007603455001800704			
	There is a Norwegian TV show on Netflix about a Russian takeover of Norway. Gonna have to check it out.https://twitter.com/natomoscow/status/1007274188309135360 …	prchovanec	5	0	1529066097	1007602360326254593	https://twitter.com/prchovanec/status/1007602360326254593			
	Why?https://twitter.com/mlcalderone/status/1007273446953365504 …	prchovanec	8	1	1529066044	1007602136098705414	https://twitter.com/prchovanec/status/1007602136098705414			
	The steady march from words to actions continues ... despite many who assured us it would never happen.https://twitter.com/cnnmoney/status/1007599651720134656 …	prchovanec	11	4	1529066009	1007601989855989760	https://twitter.com/prchovanec/status/1007601989855989760			
	Woke Joe Walsh is kinda scary.https://twitter.com/walshfreedom/status/1007346194845224961 …	prchovanec	12	4	1529065909	1007601573025984513	https://twitter.com/prchovanec/status/1007601573025984513			
	That he alleged were fabricated. It’s pretty hard to fabricate initial jobless claims.	prchovanec	1	0	1529065575	1007600171268657155	https://twitter.com/prchovanec/status/1007600171268657155			
	The US economy is doing pretty well. I don’t understand Trump’s need to lie and mislead so blatantly about the statistics.	prchovanec	7	1	1529065537	1007600008873562114	https://twitter.com/prchovanec/status/1007600008873562114			
	He is referring here to initial jobless claims, which were already the lowest in 43 years before he was elected. Job gains during his term, so far, are pretty much unchanged from the last couple years.https://twitter.com/realdonaldtrump/status/1007589800667435011 …	prchovanec	21	11	1529065462	1007599694732816384	https://twitter.com/prchovanec/status/1007599694732816384			
	Now @ GeorgeMonbiot should go NATO, the UN, the Constitution, the Geneva Conventions, and the Landmine Treaty. By this line of thinking, they should have have 5-year sunset clauses.	prchovanec	0	0	1529061835	1007584483573411840	https://twitter.com/prchovanec/status/1007584483573411840			@
	Museum in Kiev devoted to Ukrainians killed in Soviet worldwide military engagements during the Cold War, including Korea, Vietnam, Africa, and Afghanistan. pic.twitter.com/oeIyfGjbCh	prchovanec	3	1	1529033041	1007463714197524480	https://twitter.com/prchovanec/status/1007463714197524480			
	They might be giants. Soviet WW2 memorial in Kiev, Ukraine pic.twitter.com/x4ConTwzZF	prchovanec	3	0	1529032530	1007461568160911361	https://twitter.com/prchovanec/status/1007461568160911361			
	Not so subtle messaging: Ukrainian tank faces off head-to-head with Russian tanks outside the WW2 museum in Kiev, Ukraine pic.twitter.com/j7pplusIY9	prchovanec	7	1	1529031943	1007459106616209409	https://twitter.com/prchovanec/status/1007459106616209409			
	Some Soviet traditions never die. Taking wedding photos at the World War II monument in Kiev, Ukraine pic.twitter.com/sVEeC2WKMk	prchovanec	4	0	1529031750	1007458295936929792	https://twitter.com/prchovanec/status/1007458295936929792			
	Come at me, bro. Soviet WW2 memorial, Kiev, Ukraine pic.twitter.com/jN7WfMrWJZ	prchovanec	5	1	1529031550	1007457460800585729	https://twitter.com/prchovanec/status/1007457460800585729			
	Cast that steel, comrades! Soviet WW2 memorial, Kiev, Ukraine pic.twitter.com/36vt6eFHXa	prchovanec	17	0	1529031344	1007456594295246854	https://twitter.com/prchovanec/status/1007456594295246854			
	That’s how they get you, every time.	prchovanec	0	0	1529031181	1007455912280383488	https://twitter.com/prchovanec/status/1007455912280383488			
	Essentially, Trump jokes that he would prefer North Korean-style media coverage to a free and critical press. Ha. Ha. Ha.https://twitter.com/thehill/status/1007451903683375105 …	prchovanec	8	4	1529031042	1007455326982098944	https://twitter.com/prchovanec/status/1007455326982098944			
	That’s the problem with bad precedents ... they always look attractive at the time, unless you think through their broader implications.	prchovanec	1	0	1529025136	1007430554931875841	https://twitter.com/prchovanec/status/1007430554931875841			
	Because it’s not aimed at sanctioning corruption, on its own merits, it’s aimed at gaining a form of personal leverage in a dispute over public policy.	prchovanec	0	0	1529025070	1007430278728617986	https://twitter.com/prchovanec/status/1007430278728617986			
	You’re confusing two entirely separate issues. Which is exactly how this will cause unintended problems.	prchovanec	0	0	1529024979	1007429896703004673	https://twitter.com/prchovanec/status/1007429896703004673			
	But this is a dispute with the US government - like it or not.	prchovanec	0	0	1529024909	1007429604188008448	https://twitter.com/prchovanec/status/1007429604188008448			
	I am fully in favor of Trump removing himself entirely from his business interests, or forcing him to do so. But not as a foreign lever against US policy making. In fact, the former to avoid the latter.	prchovanec	1	0	1529024869	1007429435019202560	https://twitter.com/prchovanec/status/1007429435019202560			
	That was the result of domestic ethics rules and expectations, which is totally legit and even welcome, not a result of foreign sanctions imposed over a policy dispute.	prchovanec	0	0	1529024782	1007429072862015489	https://twitter.com/prchovanec/status/1007429072862015489			
	In other words, the threat of personal damage (like the enticement of personal gain) guides US policy making rather than at least a perceived public interest.	prchovanec	0	0	1529024678	1007428635882553344	https://twitter.com/prchovanec/status/1007428635882553344			
	And I have no problem with that, on its own merits. But not as leverage against US policy, not matter how ill-conceived it may be. It can end up being a form of corruption in reverse.	prchovanec	0	0	1529024564	1007428157488672768	https://twitter.com/prchovanec/status/1007428157488672768			
	You will find the next US President being personally sanctioned by countries that don’t like aspects of US policy, foreign and domestic. Not something to invite.	prchovanec	0	0	1529024479	1007427800679280641	https://twitter.com/prchovanec/status/1007427800679280641			
	Because while I think Trump has been behaving in a corrupt manner, we have laws in the US that we should work through, long before looking to international sanctions. And it’s tangential to the trade dispute between the US and Canada, however wrong Trump may be on the issue.	prchovanec	0	0	1529024388	1007427419303743489	https://twitter.com/prchovanec/status/1007427419303743489			
	Not on the level of Magnitsky (killing someone) or Iran’s Revolutionary Guard (funding terrorism), no.	prchovanec	0	0	1529024238	1007426791164776448	https://twitter.com/prchovanec/status/1007426791164776448			
	Think about how this will be applied in the future. It opens a Pandora’s Box.	prchovanec	0	0	1529024129	1007426333377429504	https://twitter.com/prchovanec/status/1007426333377429504			
	Bad cases make bad law, in this instance.	prchovanec	0	0	1529024080	1007426128485781505	https://twitter.com/prchovanec/status/1007426128485781505			
	If targeting an individuals wealth as part of a normal policy difference between two countries? Unless the wealth can be proven to be illicit gains, or the official behavior is particularly egregious, I say no.	prchovanec	1	0	1529024027	1007425906707660802	https://twitter.com/prchovanec/status/1007425906707660802			
	But this was not a common situation. Should have thought through the protocol of this summit more carefully, not just winged it.https://twitter.com/politico/status/1007349705251213312 …	prchovanec	9	2	1529023902	1007425380159025154	https://twitter.com/prchovanec/status/1007425380159025154			
	If the President is engaged in improper business in Canada, I have no problem with Canadian prosecutors taking that up on its own merits.	prchovanec	1	0	1529023806	1007424976956293122	https://twitter.com/prchovanec/status/1007424976956293122			
	I don’t think we want to be criminalizing normal policy differences between two countries, however serious those differences may be.	prchovanec	1	0	1529023748	1007424733804146689	https://twitter.com/prchovanec/status/1007424733804146689			
	They should, but that should be a matter for domestic laws and ethics rules, not international sanctions. And the issue here is a policy difference between two countries, not human rights or criminality.	prchovanec	1	0	1529023708	1007424565994278912	https://twitter.com/prchovanec/status/1007424565994278912			
	When they are lies and obfuscations, yes, they are hard to understand.https://twitter.com/cillizzacnn/status/1007342918657630214 …	prchovanec	15	2	1529023615	1007424178314731520	https://twitter.com/prchovanec/status/1007424178314731520			
	I understand the enthusiasm for this, but except in the case of blatant criminality and thuggery (Magnitsky) it sets a bad precedent.https://twitter.com/thehill/status/1007422464744402944 …	prchovanec	9	4	1529023510	1007423738537758721	https://twitter.com/prchovanec/status/1007423738537758721			
	I’m not sure of anything anymore.	prchovanec	2	0	1529023203	1007422447333859332	https://twitter.com/prchovanec/status/1007422447333859332			
	Han Solo is actually an electricity box.	prchovanec	5	0	1529023170	1007422309878165505	https://twitter.com/prchovanec/status/1007422309878165505			
	Glimpses of Odessa, Ukraine pic.twitter.com/nLOwB079Io	prchovanec	16	4	1529022769	1007420629296050179	https://twitter.com/prchovanec/status/1007420629296050179			
	Different flavors of kompot fruit punch, in Odessa, Ukraine pic.twitter.com/riSZjYfjlJ	prchovanec	5	0	1529022607	1007419947834859520	https://twitter.com/prchovanec/status/1007419947834859520			
	Fine. The pinched nerve was just that.	prchovanec	0	0	1529022509	1007419539783593984	https://twitter.com/prchovanec/status/1007419539783593984			
	Checking out the old Soviet military hardware at the Aviation Museum outside of Kiev, Ukraine pic.twitter.com/hXGAd0ZWCR	prchovanec	8	1	1529022414	1007419139219173377	https://twitter.com/prchovanec/status/1007419139219173377			
	I found Han Solo, frozen in carbonite, on this street in Odessa, Ukraine. And look - in another part of town, I came across Chewbacca looking for him. pic.twitter.com/8SCfWoV3vF	prchovanec	17	2	1529022404	1007419099289456640	https://twitter.com/prchovanec/status/1007419099289456640			
	The problem with this reasoning is that the President can effectively turn anyone from an annoyingly dogged investigator into an ethically conflicted witness just by firing their colleague. How convenient.https://twitter.com/hughhewitt/status/1007259016056180736 …	prchovanec	8	5	1529022196	1007418226253467648	https://twitter.com/prchovanec/status/1007418226253467648			
	So much winning.https://twitter.com/thehill/status/1007268439642312704 …	prchovanec	9	2	1529022195	1007418221023186945	https://twitter.com/prchovanec/status/1007418221023186945			
	May help explain the incredibly thorough workover I got from airport security in Frankfurt today.https://twitter.com/ap/status/1007206884158427136 …	prchovanec	5	1	1529022193	1007418211950907393	https://twitter.com/prchovanec/status/1007418211950907393			
	At least they didn’t call you “old timer” ... yet.	prchovanec	0	0	1529021200	1007414049821380609	https://twitter.com/prchovanec/status/1007414049821380609			
	well that is Apple weekly evening starpic.twitter.com/DwcN66M5DA	Sunchartist	5	0	1529099109	1007740821381136384	https://twitter.com/Sunchartist/status/1007740821381136384			
	I do keep my TL purely finance but..	Sunchartist	2	0	1529098853	1007739747597316096	https://twitter.com/Sunchartist/status/1007739747597316096			
	Cl_a is so screwed	Sunchartist	4	0	1529098648	1007738887060402176	https://twitter.com/Sunchartist/status/1007738887060402176			
	you bet on this. Children need to be protected defend & nurtured at all cost. even if the parens are murders	Sunchartist	1	0	1529097969	1007736040147173377	https://twitter.com/Sunchartist/status/1007736040147173377			
	Disagree what is child fault in this traumatising children to get to parents is unforgivable and using religion to justify such actions is not just unforgivable , there is a special place in hell for such people.	Sunchartist	1	0	1529097613	1007734548375801856	https://twitter.com/Sunchartist/status/1007734548375801856			
	I really really really don’t like people who use religion to hurt children	Sunchartist	16	0	1529096783	1007731064071077888	https://twitter.com/Sunchartist/status/1007731064071077888			
	Bullish Hammer on NYSE Comp & S&P lets see if we get confirmation. Russell 2000 is more like a Hanging Man reversal	Sunchartist	4	0	1529096699	1007730715465617408	https://twitter.com/Sunchartist/status/1007730715465617408			
	Copper Non Commercial combined record longs before the reversalpic.twitter.com/lJtyxZwcqY	Sunchartist	10	0	1529096586	1007730240892821505	https://twitter.com/Sunchartist/status/1007730240892821505			
	VIX Non-Commerical net combined increased shorts increased their position by 47%pic.twitter.com/bv6gvR86DP	Sunchartist	4	0	1529096548	1007730079483359232	https://twitter.com/Sunchartist/status/1007730079483359232			
	Stepping down as CEO of a scam. How is that is that punishment? another get out of jail cardhttps://twitter.com/CNBCnow/status/1007723773951467520 …	Sunchartist	4	1	1529095225	1007724533124493312	https://twitter.com/Sunchartist/status/1007724533124493312			
	*SPDR GOLD TRUST HOLDINGS UNCHANGED AT 828.76 METRIC TONS ON 15 Jun, 2018	Sunchartist	3	0	1529094875	1007723063725572096	https://twitter.com/Sunchartist/status/1007723063725572096			
	S&P 500 Dailypic.twitter.com/0vBBUWqjXd	Sunchartist	4	3	1529093703	1007718145698615296	https://twitter.com/Sunchartist/status/1007718145698615296			
	Jeff Session is dick head	Sunchartist	4	0	1529093633	1007717854748164096	https://twitter.com/Sunchartist/status/1007717854748164096			
	If your religion tells you to hate someone you need a new religionhttps://twitter.com/cnnpolitics/status/1007345519570706432 …	Sunchartist	1	1	1529093597	1007717703988080640	https://twitter.com/Sunchartist/status/1007717703988080640			
	And quarterly	Sunchartist	7	0	1529093358	1007716700475682817	https://twitter.com/Sunchartist/status/1007716700475682817			
	Immunity from Bankruptcy what a time to be alivehttps://twitter.com/reuters/status/1007715839649419265 …	Sunchartist	4	0	1529093335	1007716604514144257	https://twitter.com/Sunchartist/status/1007716604514144257			
	S&P 500 Weeklypic.twitter.com/dt2laZA8TK	Sunchartist	9	1	1529093176	1007715936135069697	https://twitter.com/Sunchartist/status/1007715936135069697			
	S&P 500 Quarterlypic.twitter.com/NahqQQJtrH	Sunchartist	32	14	1529093117	1007715690600525824	https://twitter.com/Sunchartist/status/1007715690600525824			
	Thank you Marc it is very kind of you. Have a fantastic weekend	Sunchartist	4	0	1529092444	1007712865871003649	https://twitter.com/Sunchartist/status/1007712865871003649			
	USDKRW 1 MONTH NDF 1101	Sunchartist	5	0	1529077599	1007650603810500608	https://twitter.com/Sunchartist/status/1007650603810500608			
	*CHINA SAYS DOESN’T WANT TRADE WAR, BUT WILL HAVE TO RETALIATE Trade war could soon become Olympic Sport	Sunchartist	23	5	1529065949	1007601739460034566	https://twitter.com/Sunchartist/status/1007601739460034566			
	Is that bullish growth?	Sunchartist	2	0	1529065743	1007600873093017600	https://twitter.com/Sunchartist/status/1007600873093017600			
	Deutsche Bank -3.23%	Sunchartist	12	4	1529065313	1007599069131243520	https://twitter.com/Sunchartist/status/1007599069131243520			
	India Said to Probe Sequoia's Role in Alleged Money Laundering	Sunchartist	3	1	1529062987	1007589313821925378	https://twitter.com/Sunchartist/status/1007589313821925378			
	Korean Won is the worst performing EM currency today	Sunchartist	2	1	1529062149	1007585798512783360	https://twitter.com/Sunchartist/status/1007585798512783360			
	USDKRW +1.38% biggest rally since Aug 2016 & closes above 200 DMA Breaks consolidation since February	Sunchartist	3	0	1529062045	1007585365513760768	https://twitter.com/Sunchartist/status/1007585365513760768			
		Sunchartist	0	0	1529061216	1007581885227134976	https://twitter.com/Sunchartist/status/1007581885227134976			
	anyone see H&S on NIFTY Midcap 100	Sunchartist	4	1	1529057831	1007567687340285952	https://twitter.com/Sunchartist/status/1007567687340285952			
	Italy 2 year yield realised Volatility 10 & 30 dayspic.twitter.com/XG93c2XhQc	Sunchartist	7	2	1529055938	1007559749376720898	https://twitter.com/Sunchartist/status/1007559749376720898			
	Thanks you too	Sunchartist	1	0	1529053191	1007548229838241792	https://twitter.com/Sunchartist/status/1007548229838241792			
	I had one more but sod it i need a drink	Sunchartist	3	0	1529052458	1007545153416859648	https://twitter.com/Sunchartist/status/1007545153416859648			
	Shenzhen Stock Exchange Component Index 500 of most liquid A shares breaks trend line from January 2016pic.twitter.com/QSsa92X4vh	Sunchartist	10	2	1529051827	1007542506832064514	https://twitter.com/Sunchartist/status/1007542506832064514			
	*INDIA'S MAY OIL IMPORTS AT $11.5B, UP 49.5% Y/Y	Sunchartist	3	1	1529051457	1007540953513463809	https://twitter.com/Sunchartist/status/1007540953513463809			
	*INDIA MAY TRADE BALANCE -$14.62 BLN; EST. -$14.279 BLN *INDIA MAY IMPORTS RISE 14.9% Y/Y *INDIA MAY EXPORTS RISE 20.2% Y/Y	Sunchartist	1	0	1529051434	1007540857203879936	https://twitter.com/Sunchartist/status/1007540857203879936			
	*HONG KONG’S HANG SENG INDEX FALLS 0.43% TO 30,309.49 AT CLOSE ZTE -11.49%	Sunchartist	3	1	1529050429	1007536642461069313	https://twitter.com/Sunchartist/status/1007536642461069313			
	*H.K. EXISTING HOME PRICES RISE 0.57% ON WEEK: CENTALINE	Sunchartist	0	0	1529050287	1007536046798540800	https://twitter.com/Sunchartist/status/1007536046798540800			
	*ZTE DROPS AS MUCH AS 10.81% IN H.K. TO LOWEST SINCE MARCH 2017	Sunchartist	2	0	1529049168	1007531353892507648	https://twitter.com/Sunchartist/status/1007531353892507648			
	Hong Kong May Bankruptcy Petitions Rose 7.7% From Year Ago	Sunchartist	1	0	1529048902	1007530237297491969	https://twitter.com/Sunchartist/status/1007530237297491969			
	*HSBC RAISES HKD TIME DEPOSIT RATES WITH NEW FUNDS: DAILY	Sunchartist	6	1	1529048835	1007529955524206592	https://twitter.com/Sunchartist/status/1007529955524206592			
	*U.S. IS SAID TO NEAR 2ND TARIFF LIST ON $100B CHINA GOODS: RTRS	Sunchartist	8	6	1529048399	1007528127436689409	https://twitter.com/Sunchartist/status/1007528127436689409			
	Indian refiner IOC says country's top bank to stop handling Iran oil paymentshttps://reut.rs/2yfayFW	Sunchartist	1	1	1529048322	1007527804903157760	https://twitter.com/Sunchartist/status/1007527804903157760			
	1 Month HIBOR rises 6.66 bps 14 day in a row to highest level since 31 October 2008pic.twitter.com/G0WyRGYGDP	Sunchartist	6	7	1529048277	1007527615287083008	https://twitter.com/Sunchartist/status/1007527615287083008			
	KOSPIpic.twitter.com/W2XaBXzgLu	Sunchartist	5	2	1529047852	1007525836390465536	https://twitter.com/Sunchartist/status/1007525836390465536			
	AUDJPYpic.twitter.com/LYAHGQmezw	Sunchartist	2	0	1529046008	1007518099589885952	https://twitter.com/Sunchartist/status/1007518099589885952			
	HSI testing H&S neckline worth watching the butterfly effectpic.twitter.com/EKSqS6Kkcj	Sunchartist	10	6	1529045452	1007515770027327488	https://twitter.com/Sunchartist/status/1007515770027327488			
	SHANGHAI COMP - A H&S ?pic.twitter.com/CZ9y6T6sS9	Sunchartist	4	2	1529042706	1007504250904014848	https://twitter.com/Sunchartist/status/1007504250904014848			
	Tencent Holding by its fingernailspic.twitter.com/gXT562fQ0f	Sunchartist	6	2	1529042260	1007502378109566976	https://twitter.com/Sunchartist/status/1007502378109566976			
	CSI 300 Technology Index Historically the correlation to NASDAQ has been highpic.twitter.com/dNGMZdtE7v	Sunchartist	11	6	1529042150	1007501916954189824	https://twitter.com/Sunchartist/status/1007501916954189824			
	ChiNext Index -1.47% at key supportpic.twitter.com/BVk4RtftJx	Sunchartist	2	1	1529042012	1007501339889319936	https://twitter.com/Sunchartist/status/1007501339889319936			
	ZTE Down another 8.38% todaypic.twitter.com/tc5iROqnu2	Sunchartist	4	1	1529041753	1007500254361481217	https://twitter.com/Sunchartist/status/1007500254361481217			
	In photos: when Hong Kong was hit by a deadly rainstormhttps://sc.mp/2yaX2TQ	Sunchartist	0	0	1529032619	1007461943882338307	https://twitter.com/Sunchartist/status/1007461943882338307			
	USDKRW HOD +0.77%	Sunchartist	1	0	1529031271	1007456286726709249	https://twitter.com/Sunchartist/status/1007456286726709249			
	Shanghai Comp 3019 (-0.80%) red line	Sunchartist	2	0	1529031109	1007455608843337730	https://twitter.com/Sunchartist/status/1007455608843337730			
	so copy paste droolhttps://twitter.com/ForexLive/status/1007452924644089856 …	Sunchartist	3	1	1529030516	1007453119880425473	https://twitter.com/Sunchartist/status/1007453119880425473			
	CNH Forwards well bid . fast money what to do	Sunchartist	2	0	1529030487	1007452998635671552	https://twitter.com/Sunchartist/status/1007452998635671552			
	Reserve Bank of India - Notifications RBI allows OTC Rupee Interest rate Swaptions https://www.rbi.org.in/Scripts/NotificationUser.aspx?Id=10802&Mode=0 …	Sunchartist	1	0	1529030216	1007451864982409216	https://twitter.com/Sunchartist/status/1007451864982409216			
	Don’t think Hong Kong House Price to income is at 19.4 multiple ,it is in excess of 20X	Sunchartist	2	0	1529026416	1007435925670936576	https://twitter.com/Sunchartist/status/1007435925670936576			
	Given the leverage It is not a fall that is needed, unchanged prices means debt cannot be servicedhttps://twitter.com/tEconomics/status/1007435115432218624 …	Sunchartist	4	0	1529026317	1007435508023037952	https://twitter.com/Sunchartist/status/1007435508023037952			
	You can’t unless you lie, leverage or use Bank of parents. As far i know close to 50% of translations is to Mainland China buyers for last 7 years. which leads to decline in birth rate, increase in migration and level of stress	Sunchartist	1	0	1529026201	1007435021513154560	https://twitter.com/Sunchartist/status/1007435021513154560			
	Even if you assume it was 6-8 there is lot to catch up	Sunchartist	0	0	1529026080	1007434517928243200	https://twitter.com/Sunchartist/status/1007434517928243200			
	it seems right	Sunchartist	0	0	1529026030	1007434306065584128	https://twitter.com/Sunchartist/status/1007434306065584128			
	Does it mean revert? In Hong Kong, it now requires 19.4 times the average salary of a resident to buy a home, up from 4.6 times in 2002.	Sunchartist	4	1	1529025917	1007433830997716992	https://twitter.com/Sunchartist/status/1007433830997716992			
	*CHINA SETS YUAN REFERENCE RATE AT 6.4306 AGAINST U.S. DOLLAR	Sunchartist	2	1	1529025392	1007431629457911808	https://twitter.com/Sunchartist/status/1007431629457911808			
	EMBI Global Spreads highest since December 2016pic.twitter.com/Rd7eKidFZQ	Sunchartist	5	2	1529024835	1007429293012443136	https://twitter.com/Sunchartist/status/1007429293012443136			
	*USD/KRW RISES AS MUCH AS 0.5% TO 1,088.75, HIGHEST SINCE FEB. 9	Sunchartist	0	0	1529024390	1007427428006834176	https://twitter.com/Sunchartist/status/1007427428006834176			
