	Go figure.https://twitter.com/wsj/status/1012217814038536199 …	prchovanec	3	0	1530187196	1012304590350487553	https://twitter.com/prchovanec/status/1012304590350487553			
	I think we all should be willing to apply our political ideas to our own lives, otherwise we’re not being honest.	prchovanec	1	0	1530187136	1012304339187240967	https://twitter.com/prchovanec/status/1012304339187240967			
	Joe Crowley being Trump’s nickname for Steve Bannon.https://twitter.com/maggienyt/status/1012139169529729024 …	prchovanec	3	0	1530187052	1012303983774519296	https://twitter.com/prchovanec/status/1012303983774519296			
	Twitter really not the place for this discussion.	prchovanec	0	0	1530186942	1012303523730649088	https://twitter.com/prchovanec/status/1012303523730649088			
	It will evolve, no question. That’s unavoidable. But it doesn’t need to be adversarial.	prchovanec	0	0	1530185791	1012298696644587525	https://twitter.com/prchovanec/status/1012298696644587525			
	Traveling domestically, I find myself constantly reaching to check for my missing passport. Sometimes I bring it just so I don’t freak out.	prchovanec	7	0	1530185639	1012298060616142848	https://twitter.com/prchovanec/status/1012298060616142848			
	Both equity markets and the yield curve are telling us something about how fragile they see the current, very positive momentum.	prchovanec	0	0	1530185488	1012297426361778176	https://twitter.com/prchovanec/status/1012297426361778176			
	You know that quarterly growth rates have been highly volatile throughout this recovery.	prchovanec	0	0	1530185090	1012295756626219008	https://twitter.com/prchovanec/status/1012295756626219008			
	You’re reframing my words in a way I wouldn’t agree with. Let’s see what the rest of the year brings before you start claiming projections as facts.	prchovanec	0	0	1530184947	1012295157562081280	https://twitter.com/prchovanec/status/1012295157562081280			
	And it’s happening in a far more fundamental sense than previous tensions over US policy in Middle East or listening in on Merkel’s phone calls.	prchovanec	2	0	1530184861	1012294793848860672	https://twitter.com/prchovanec/status/1012294793848860672			
	This isn’t a forecast. It’s happening. The only question is how deep it goes and whether it can be reversed.	prchovanec	1	1	1530184750	1012294328377585665	https://twitter.com/prchovanec/status/1012294328377585665			
	I’d be happy to see him make a solid conservative pick, just as I’m happy US economic growth has continued. It doesn’t change my opinion of his in-so-many-ways toxic presidency.https://twitter.com/mattklewis/status/1012073424016068610 …	prchovanec	13	3	1530184692	1012294088614432768	https://twitter.com/prchovanec/status/1012294088614432768			
	There are people in the Administration who don’t see it, or won’t. But they are not, as Trump puts it, “the only one who matters”.	prchovanec	5	0	1530183623	1012289605167669248	https://twitter.com/prchovanec/status/1012289605167669248			
	“Danger, Will Robinson!” Robot security guard making its rounds at LaGuardia Airport, NYCpic.twitter.com/4T4K6jhR2j	prchovanec	6	1	1530183568	1012289372136312832	https://twitter.com/prchovanec/status/1012289372136312832			
	Trump’s remarks on the EU last night are why, in all seriousness, I now refer to them as our former allies. Something big has changed, at least as long as Trump is President, and those at home and abroad who prefer not to see it are kidding themselves.	prchovanec	48	26	1530183096	1012287392940744705	https://twitter.com/prchovanec/status/1012287392940744705			
	And Putin smiled.https://twitter.com/abc/status/1012135271184228352 …	prchovanec	35	13	1530182713	1012285785624711168	https://twitter.com/prchovanec/status/1012285785624711168			
	How about responding by being the adult in the room, soothing strained feelings (to the best of your ability), calling for self-restraint and leading by example?https://twitter.com/realdonaldtrump/status/1012174976668061699 …	prchovanec	11	0	1530182284	1012283986557767681	https://twitter.com/prchovanec/status/1012283986557767681			
	He has? Who? Link?	prchovanec	0	0	1530182099	1012283212675076096	https://twitter.com/prchovanec/status/1012283212675076096			
	Saying that US companies aren’t capital constrained isn’t the same thing as saying productive investment is being maxed out. In fact, despite plentiful funding available, sluggish and halting investment growth has long been a hallmark of this recovery cycle.	prchovanec	0	0	1530182032	1012282929748365312	https://twitter.com/prchovanec/status/1012282929748365312			
	As I told CNN today, Justice Kennedy voted pretty reliably with the conservative majority on business issues. So the potential swing here is more on social issues than on business rulings.https://finance.yahoo.com/news/supreme-court-likely-strong-business-vote-decades-203651247.html …	prchovanec	3	1	1530160993	1012194686436507648	https://twitter.com/prchovanec/status/1012194686436507648			
	"A decision not to take something to the floor is effectively a majority decision. Even if it's a ""majority of the majority"" situation, the minority of the majority is acquiescing in that outcome. Legislative bodies maneuver to avoid difficult votes all the time."	prchovanec	0	0	1530160377	1012192104536268801	https://twitter.com/prchovanec/status/1012192104536268801			
	Jun 27, 1918 - Dutch soldiers near Breskens stand guard over a British Airco DH.9 bomber which was damaged by German anti-aircraft fire and forced to land in neutral Dutch territory # 100yearsagopic.twitter.com/uPzHOfE1SQ	prchovanec	2	2	1530160131	1012191068778041344	https://twitter.com/prchovanec/status/1012191068778041344		#	
	Jun 27, 1918 - Canadian hospital ship HMHS Llandovery Castle is torpedoed and sunk in the Atlantic Ocean by German u-boat SM U-86 with the loss of 234 of the 258 people on board, making it the deadliest naval disaster in Canadian history # 100yearsagopic.twitter.com/qK0BqtxksW	prchovanec	3	2	1530159764	1012189529506304001	https://twitter.com/prchovanec/status/1012189529506304001		#	
	Jun 27, 1918 - New York Times: Wholesalers protest milk prices fixed by wartime food board # 100yearsagopic.twitter.com/oCz4QggzAs	prchovanec	2	1	1530159479	1012188336558092288	https://twitter.com/prchovanec/status/1012188336558092288		#	
	Jun 27, 1918 - New York Times: After disastrous defeat of latest Austrian offensive in Italy, Germany can't afford another attack to fail # 100yearsagopic.twitter.com/nbhvjDRMUO	prchovanec	0	0	1530159437	1012188158077947905	https://twitter.com/prchovanec/status/1012188158077947905		#	
	Jun 27, 1918 - New York Times: Britain's King George sits down with American soldiers in London for a meal of buckwheat cakes # 100yearsagopic.twitter.com/4U2NuFK8Kk	prchovanec	2	2	1530159377	1012187908995010560	https://twitter.com/prchovanec/status/1012187908995010560		#	
	Jun 27, 1918 - New York Times: Air battles over the Western Front # 100yearsagopic.twitter.com/HJ7c1kJC24	prchovanec	0	0	1530159297	1012187573966557185	https://twitter.com/prchovanec/status/1012187573966557185		#	
	I felt like I was in the Twilight Zone when I visited North Korea. But this takes it to a whole new level.https://twitter.com/Robert_E_Kelly/status/1012169804856229888 …	prchovanec	6	5	1530159023	1012186424182009856	https://twitter.com/prchovanec/status/1012186424182009856			
	I think you know, as well as I do, that the Senate either acting or not acting reflects a tacit decision by the majority.	prchovanec	0	0	1530158993	1012186296918466560	https://twitter.com/prchovanec/status/1012186296918466560			
	As someone who participated in the process, from a non-commercial, non-governmental point of view, I think that many don't understand that when you're talking about removing non-tariff barriers, especially for services, you're inherently talking about harmonizing regulations.	prchovanec	1	0	1530158629	1012184772452511744	https://twitter.com/prchovanec/status/1012184772452511744			
	But if you don't have time for that, you should check out John Oliver's recent segment on China and Xi Jinping, if you haven't already. The one that got him completely banned on China's internet.https://www.youtube.com/watch?v=OubM8bD9kck …	prchovanec	1	0	1530158408	1012183843829440512	https://twitter.com/prchovanec/status/1012183843829440512			
	So many good books on China, but for a good and timely overview from a US policy perspective, I'd recommend the following. @ LizEconomy is a great friend, and she knows her stuff. https://www.amazon.com/Third-Revolution-Jinping-Chinese-State/dp/0190866071/ref=sr_1_1?ie=UTF8&qid=1530158278&sr=8-1&keywords=the+third+revolution+xi+jinping+and+the+new+chinese+state …	prchovanec	2	0	1530158318	1012183466262302721	https://twitter.com/prchovanec/status/1012183466262302721			@
	I know TPP may not be very popular among your fans, but negotiating it and then walking away from it abruptly the way we did, did nothing to enhance Asian regional perceptions of how reliably the US keeps its commitments.	prchovanec	2	0	1530157900	1012181713500475392	https://twitter.com/prchovanec/status/1012181713500475392			
	A lot of countries in Asia look to the US as a positive balancing force in Asia, in terms of security, economics, and democratic values. If that presence isn't there, they will make different accommodations.	prchovanec	1	0	1530157686	1012180816930144256	https://twitter.com/prchovanec/status/1012180816930144256			
	... but I also think that if the US fails to stand up for its friends, its core interests, and international rules in the region - consistent with a recognition of China's own legitimate interests and concerns - we will invite more trouble not very far down the road.	prchovanec	1	0	1530157581	1012180374674386944	https://twitter.com/prchovanec/status/1012180374674386944			
	My wife is from China and my kids were all born in China, and half their relatives live in China. The last thing I would want is a military conflict between the US and China ....	prchovanec	1	0	1530157416	1012179685021798400	https://twitter.com/prchovanec/status/1012179685021798400			
	You and I probably wouldn't agree on many issues. But a bipartisan foreign policy on certain core issues - such as our relationships with existing allies, and a willingness to protect the International commons, e.g. vital sea lanes - has been a hallmark of US policy for 70 years.	prchovanec	1	0	1530157313	1012179252391960577	https://twitter.com/prchovanec/status/1012179252391960577			
	But it's a situation that rewards firmness and consistency and clarity over time, as opposed to the erratic bombast that tends to characterize the Trump Administration.	prchovanec	1	0	1530156991	1012177901196804096	https://twitter.com/prchovanec/status/1012177901196804096			
	My sense is that the entire issue was put on the sidelines as Trump tried to woo China's support in putting pressure on North Korea. Now that US-China trade tensions are rising, and China's cooperation on North Korea looks cloudy, it could come back on the table.	prchovanec	1	0	1530156871	1012177397964210176	https://twitter.com/prchovanec/status/1012177397964210176			
	Unfortunately, this has become less and less viable in the face of a mounting Chinese military buildup in the South China Sea, to which a halting US response actually invites miscalculation and aggression.	prchovanec	1	0	1530156693	1012176649889222656	https://twitter.com/prchovanec/status/1012176649889222656			
	"Although China sees US ""freedom of navigation"" operations in the South China Sea as provocative, because they claim the entire sea as their own, the purpose is to prevent conflict among conflicting claimants by maintaining its status as freely accessible international waters."	prchovanec	1	0	1530156575	1012176154994921472	https://twitter.com/prchovanec/status/1012176154994921472			
	I doubt that it is something your voters are rushing to ask you about, but it is certainly a topic of mounting concern you will encounter if you make it to DC.	prchovanec	2	0	1530156430	1012175546363629568	https://twitter.com/prchovanec/status/1012175546363629568			
	Thanks for your willingness to listen and keep an open mind, on a topic that isn't necessarily familiar to most Americans as part of their everyday lives.	prchovanec	2	0	1530156323	1012175097782833153	https://twitter.com/prchovanec/status/1012175097782833153			
	And the more fundamental question is, pay in dollars, but dollars worth what in terms of real resources obtained. You can expand the dollars infinitely, you cannot expand the real resources quite so easily.	prchovanec	0	0	1530156248	1012174783117701120	https://twitter.com/prchovanec/status/1012174783117701120			
	A reliance on foreign imports is definitely one factor that can make a country reliant on foreign currency to pay for it. But a reliance on foreign financing can also create the same vulnerability, depending on the circumstances.	prchovanec	0	0	1530156195	1012174560979046400	https://twitter.com/prchovanec/status/1012174560979046400			
	I'm glad people are finally realizing that this is a red herring. It's an awkward product of China's imbalanced trade with the US, not a weapon to be used to sustain it.https://twitter.com/Lingling_Wei/status/1012171882877968385 …	prchovanec	30	12	1530155704	1012172502653718528	https://twitter.com/prchovanec/status/1012172502653718528			
	I would be very happy to tell you about it, because it is an issue of bipartisan concern, regardless of where you stand on the US political spectrum.	prchovanec	1	0	1530155614	1012172125451554816	https://twitter.com/prchovanec/status/1012172125451554816			
	Also the significance of freedom of navigation as a core US interest for over 200 years, and the active role the US Navy plays in ensuring it, every day around the world.	prchovanec	1	0	1530155393	1012171197944082432	https://twitter.com/prchovanec/status/1012171197944082432			
	As a candidate for Congress, I sincerely hope you will educate yourself about this issue, the nature of the claims China is making, and why it matters for regional Asian peace and security.	prchovanec	1	0	1530155299	1012170803604049920	https://twitter.com/prchovanec/status/1012170803604049920			
	We're talking about what makes the US different from Zimbabwe - or not.	prchovanec	0	0	1530155191	1012170351877468160	https://twitter.com/prchovanec/status/1012170351877468160			
	It isn't ours. It is international waters.	prchovanec	1	0	1530155002	1012169559590227968	https://twitter.com/prchovanec/status/1012169559590227968			
	He didn't even know he was doing it.	prchovanec	1	0	1530154931	1012169260389535745	https://twitter.com/prchovanec/status/1012169260389535745			
	Jun 27, 1918 - New York Times: Ousted Russian Premier Kerensky reaches London on the way to US # 100yearsagopic.twitter.com/uUcNSamdnu	prchovanec	0	1	1530154887	1012169076997804032	https://twitter.com/prchovanec/status/1012169076997804032		#	
	Jun 27, 1918 - New York Times: President Wilson proposes non-military mission to stabilize post-revolutionary Russia # 100yearsagopic.twitter.com/xYtVZBIodp	prchovanec	1	0	1530154840	1012168879551012865	https://twitter.com/prchovanec/status/1012168879551012865		#	
	Jun 27, 1918 - New York Times: German hardliners enraged at government's new peace offer # 100yearsagopic.twitter.com/hESC6jTtL3	prchovanec	1	0	1530154773	1012168599333691392	https://twitter.com/prchovanec/status/1012168599333691392		#	
	Jun 27, 1918 - New York Times: Now is the time for Allies to aid uprising in Austrian Empire # 100yearsagopic.twitter.com/o29XEb0p05	prchovanec	0	0	1530154726	1012168400234319872	https://twitter.com/prchovanec/status/1012168400234319872		#	
	Jun 27, 1918 - New York Times: Austrian Emperor Karl struggles to assemble a new Cabinet amid defeat in Italy, unrest at home # 100yearsagopic.twitter.com/Oj3vLw85WR	prchovanec	3	0	1530154658	1012168117265498113	https://twitter.com/prchovanec/status/1012168117265498113		#	
	Trump's failure to assert a US naval presence in the South China Sea to challenge Chinese claims - even worse than Obama failed to - is a rather striking disappointment.https://twitter.com/stevenleemyers/status/1012140749465444352 …	prchovanec	9	10	1530154382	1012166959260209152	https://twitter.com/prchovanec/status/1012166959260209152			
	Jun 27, 1918 - Life Magazine: Norman Rockwell illustration of student reciting the Declaration of Independence # 100yearsagopic.twitter.com/0b23paDfWr	prchovanec	3	1	1530153852	1012164732932055041	https://twitter.com/prchovanec/status/1012164732932055041		#	
	Jun 27, 1918 - Newlyweds: a US army officer and his wife # 100yearsagopic.twitter.com/BsJToa4t78	prchovanec	9	2	1530153748	1012164298070781952	https://twitter.com/prchovanec/status/1012164298070781952		#	
	Jun 27, 1918 - New York Times: Great losses forced Austrian retreat on the Italian Front # 100yearsagopic.twitter.com/3GjQGDygG6	prchovanec	1	0	1530153598	1012163667570429952	https://twitter.com/prchovanec/status/1012163667570429952		#	
	Jun 27, 1918 - New York Times: Italians hold new gains against Austrians on the Piave Front, in northern Italy # 100yearsagopic.twitter.com/UosOwU92y9	prchovanec	2	1	1530153556	1012163493317967874	https://twitter.com/prchovanec/status/1012163493317967874		#	
	Jun 27, 1918 - Soldier's sketch of aerial dogfight on the Italian Front # 100yearsagopic.twitter.com/G80YdOsBw2	prchovanec	11	7	1530153507	1012163288149516288	https://twitter.com/prchovanec/status/1012163288149516288		#	
	Jun 27, 1918 - Group of new US draftees leaving Minden, Nebraska for military training at Camp Funston, Kansas # 100yearsagopic.twitter.com/rnQfTDXgmo	prchovanec	0	2	1530153393	1012162810778931200	https://twitter.com/prchovanec/status/1012162810778931200		#	
	Jun 27, 1918 - New York Times: German u-boats sink two Canadian ships # 100yearsagopic.twitter.com/76kJrWqhiO	prchovanec	0	2	1530153261	1012162256384200705	https://twitter.com/prchovanec/status/1012162256384200705		#	
	Jun 27, 1918 - New York Times: May be best month yet in Allied war on German u-boats # 100yearsagopic.twitter.com/b6rtr1JIH9	prchovanec	1	1	1530153232	1012162134640398336	https://twitter.com/prchovanec/status/1012162134640398336		#	
	Jun 27, 1918 - New York Times: German air raid on Paris inflicts damage # 100yearsagopic.twitter.com/dn6JX7hO1Y	prchovanec	1	0	1530153192	1012161964875960320	https://twitter.com/prchovanec/status/1012161964875960320		#	
	"Jun 27, 1918 - Chicago Tribune: Another peace invitation from Germany, after the ""peace"" it made with Russia and Romania # 100yearsagopic.twitter.com/Ts17gV9kjv"	prchovanec	3	3	1530153128	1012161698193690629	https://twitter.com/prchovanec/status/1012161698193690629		#	
	Jun 27, 1918 - Western Mail: Germany waits forlornly for an Allied response to her latest peace offer # 100yearsagopic.twitter.com/gV2F9gYY6w	prchovanec	0	0	1530152785	1012160257391579136	https://twitter.com/prchovanec/status/1012160257391579136		#	
	Jun 27, 1918 - New York Times: Spanish influenza is raging in the German army # 100yearsagopic.twitter.com/GSMXENamqA	prchovanec	1	1	1530152669	1012159771804360710	https://twitter.com/prchovanec/status/1012159771804360710		#	
	Jun 26, 1918 - Letter home from Austrian military chaplain, notifying family of the death and burial of Slovak soldier Andreja Zemánka # 100yearsagopic.twitter.com/oZ8PRInbYg	prchovanec	1	1	1530152630	1012159608843112448	https://twitter.com/prchovanec/status/1012159608843112448		#	
	Jun 27, 1918 - New York Times: US casualties pass the 10,000 mark # 100yearsagopic.twitter.com/jhDRV6C9QG	prchovanec	0	1	1530152409	1012158681570594816	https://twitter.com/prchovanec/status/1012158681570594816		#	
	Jun 27, 1918 - New York Times: Where American troops took German-held ridge in 20-hour battle, near Chateau-Thierry, France # 100yearsagopic.twitter.com/RSGXrKpt3m	prchovanec	0	0	1530152339	1012158389101780998	https://twitter.com/prchovanec/status/1012158389101780998		#	
	Jun 27, 1918 - New York Times: Big American army helps guard Paris from further German advances # 100yearsagopic.twitter.com/HRq2uOLZpr	prchovanec	2	0	1530152276	1012158125087121410	https://twitter.com/prchovanec/status/1012158125087121410		#	
	Jun 27, 1918 - New York Times: US troops storm and capture hill, clear all of Belleau Wood of Germans # 100yearsagopic.twitter.com/hHx8aDr9L3	prchovanec	2	1	1530152104	1012157405000556545	https://twitter.com/prchovanec/status/1012157405000556545		#	
	That's probably where he heard it, to be honest.	prchovanec	1	0	1530151997	1012156952103841793	https://twitter.com/prchovanec/status/1012156952103841793			
	"As a ""retired automobile executive"", I think you should know better."	prchovanec	9	0	1530151951	1012156761506238465	https://twitter.com/prchovanec/status/1012156761506238465			
	It's a clown show. It really is. Except that we're not watching it, we're in it.	prchovanec	13	1	1530151250	1012153818979561473	https://twitter.com/prchovanec/status/1012153818979561473			
	So we should print as much money as possible, is what you're saying.	prchovanec	0	0	1530151138	1012153352589840389	https://twitter.com/prchovanec/status/1012153352589840389			
	"Here's my appearance on CNBC @ PowerLunch yesterday alongside @ JimPethokoukis discussing whether President Trump is ""pro-business"" and what the impact of his tariffs will be.https://www.youtube.com/watch?v=XKA3XEtcdlU …"	prchovanec	13	4	1530150829	1012152054654128136	https://twitter.com/prchovanec/status/1012152054654128136			@ @
	No, as other responses to this thread have indicated, they've persuaded themselves that it's normal and everyone does it.	prchovanec	0	0	1530150708	1012151549701840896	https://twitter.com/prchovanec/status/1012151549701840896			
	No, just disappointing.	prchovanec	1	0	1530150523	1012150771411021824	https://twitter.com/prchovanec/status/1012150771411021824			
	But it'll cost you.	prchovanec	0	0	1530150422	1012150348713283587	https://twitter.com/prchovanec/status/1012150348713283587			
	Mar-a-Davos	prchovanec	1	0	1530150406	1012150281533054983	https://twitter.com/prchovanec/status/1012150281533054983			
	He's going to launch a new Davos.https://twitter.com/yashar/status/1012142862228738049 …	prchovanec	4	0	1530150225	1012149520157806592	https://twitter.com/prchovanec/status/1012149520157806592			
	Reagan, though I wouldn't mindlessly apply Reagan's answers to today's questions.	prchovanec	0	0	1530150112	1012149046461521920	https://twitter.com/prchovanec/status/1012149046461521920			
	And I'll go further and say that to equate it with what came before, from either party, is to take active part in the deception.	prchovanec	3	1	1530150075	1012148891809210370	https://twitter.com/prchovanec/status/1012148891809210370			
	If you can't see the difference, I can't teach it to you. But it's blatant, and should be self-evident.	prchovanec	3	1	1530149994	1012148552087326720	https://twitter.com/prchovanec/status/1012148552087326720			
	Frodo, don't wear the Ring.	prchovanec	1	0	1530149957	1012148399326588928	https://twitter.com/prchovanec/status/1012148399326588928			
	"You know, I think you're deceiving yourself here. Yeah, I know, ""you can keep your plan"" and all that. And I argued against that myself. But we're talking a whole different order of chronic ... I can't even describe it. It's bizarre."	prchovanec	1	0	1530149862	1012148000481775617	https://twitter.com/prchovanec/status/1012148000481775617			
	Who is he talking about? I'd say his supporters, but do they have bigger boats? Maybe himself? His Cabinet?https://twitter.com/joshtpm/status/1012144186802438146 …	prchovanec	10	0	1530149705	1012147341065904128	https://twitter.com/prchovanec/status/1012147341065904128			
	Politicians are often selective with facts or take them out of context. But I've never seen a bunch be so blatantly and constantly deceptive as this.	prchovanec	2	0	1530149582	1012146825942458369	https://twitter.com/prchovanec/status/1012146825942458369			
	For those interested in real facts, not deceptive ones, see my thread:https://twitter.com/prchovanec/status/1012142644045189120 …	prchovanec	17	2	1530149482	1012146406365302785	https://twitter.com/prchovanec/status/1012146406365302785			
	Well, I'm not a doctor.	prchovanec	1	0	1530149416	1012146127259488256	https://twitter.com/prchovanec/status/1012146127259488256			
	Make that argument (which would apply similarly to this year's fiscal stimulus, btw). But don't lie about the numbers.	prchovanec	5	0	1530149321	1012145732239978496	https://twitter.com/prchovanec/status/1012145732239978496			
	The endless deceptions themselves are so disturbing. It's almost sociopathic.	prchovanec	21	3	1530149235	1012145370980405248	https://twitter.com/prchovanec/status/1012145370980405248			
	I wasn't a fan of Obama's economic policies, so it's not my purpose to defend them. My purpose is to say, don't lie. There's no need to lie. Make arguments based on real facts, or at least the shared facts that we have.	prchovanec	27	1	1530149171	1012145101366349824	https://twitter.com/prchovanec/status/1012145101366349824			
	"Furthermore, Trump Jr states ""I don't think Obama ever broke 2%"". He thinks wrong. US GDP growth was 2.5% in 2010, 2.2% in 2012, 2.6% in 2014, and 2.9% in 2015. Clearly, by that measure, 2018 is looking good. So why lie about previous GDP numbers?"	prchovanec	12	5	1530149067	1012144665842343936	https://twitter.com/prchovanec/status/1012144665842343936			
	We'll see what 2Q18 delivers - it's looking like between 3-5%. But even with this good news, the IMF is still projecting 2.9% US GDP growth for 2018 as a whole, not 3% or higher as Trump Jr. claims.	prchovanec	13	1	1530148816	1012143610458984448	https://twitter.com/prchovanec/status/1012143610458984448			
