	Gabriel nailed it: both the old and the new constitution are stupid, written by people who don't know what they are doing. We have courts for a reason. Use them. Ask that the BPs enforce court rulings.	el33th4xor	20	4	1530144101	1012123836513431552	https://twitter.com/el33th4xor/status/1012123836513431552			
	A comment from someone who was in the EOS chat.	el33th4xor	0	0	1530143867	1012122853343481856	https://twitter.com/el33th4xor/status/1012122853343481856			
	Insightful comments about goldbugs and fiat proponents. I'd say that people seek not so much fixed supply but a trustworthy supply that will not be mismanaged at will for political or personal gain.https://twitter.com/kristovatlas/status/1011979264491548672 …	el33th4xor	61	8	1530143448	1012121095338627073	https://twitter.com/el33th4xor/status/1012121095338627073			
	Excellent tweetstorm on today's EOS dumpster fire. The central arbiter called ECAF pissed off central coder, so wet see a fight emerging, where neither side has the right words or concepts.https://twitter.com/lex_node/status/1012103244150013952 …	el33th4xor	50	9	1530143278	1012120382168592387	https://twitter.com/el33th4xor/status/1012120382168592387			
	Plus, I gather that it will require payment on top of the $4B already collected. That part is astounding, if true.	el33th4xor	21	1	1530142200	1012115860553682944	https://twitter.com/el33th4xor/status/1012115860553682944			
	"But there is zero chance the new one will not be embarrassing. A group of people who thought the original ""constitution"" was ok for a microsecond are *constitutionally incapable* of coming up with a better constitution."	el33th4xor	33	3	1530142199	1012115858640994304	https://twitter.com/el33th4xor/status/1012115858640994304			
bitcoin 	"As if on cue, EOS main dev proposes scrapping their ""constitution"" with a do over. This is an admission that their current ""constitution"" is embarrassing in every way.https://bitcoinist.com/eos-constitution-scrap-larimer/ …"	el33th4xor	16	5	1530142198	1012115855499513857	https://twitter.com/el33th4xor/status/1012115855499513857			
	Thank you, very sweet, but the photo is of someone else.	laurashin	2	0	1530218578	1012436216568950784	https://twitter.com/laurashin/status/1012436216568950784			
	Ha, you're asking the wrong person! I don't work there full-time	laurashin	1	0	1530213440	1012414663777062912	https://twitter.com/laurashin/status/1012414663777062912			
	Yeah, because it was a special section, not a daily or breaking news article, it was basically an overview of what's been happening	laurashin	3	0	1530208648	1012394566492741634	https://twitter.com/laurashin/status/1012394566492741634			
ethereum 	The sale isn't a security, it's a securities offering. And what security are they offering? The token. So, at the time of sale, ETH may have been a security, but now it's not. The SEC hasn't said whether the Ethereum crowd sale was actually a securities offering but implied so	laurashin	5	0	1530201670	1012365298555469824	https://twitter.com/laurashin/status/1012365298555469824			
	I did mention this in the story, and that some lawyers don’t even feel they can’t give advice on it anymore ...	laurashin	1	0	1530198660	1012352671099990016	https://twitter.com/laurashin/status/1012352671099990016			
	Yeah, parts of my original story got cut, such as the fact that, now, after determining that ETH is not a security, the SEC has left open the possibility that a token sale could constitute a securities offering but the token for the network could later morph into a commodity.	laurashin	7	0	1530198585	1012352360406867968	https://twitter.com/laurashin/status/1012352360406867968			
	Check out the sidebar. It’s brief but does talk about how Switzerland created such a category. And the main story mentions Wyoming’s new laws around it.	laurashin	2	0	1530197698	1012348639484628992	https://twitter.com/laurashin/status/1012348639484628992			
	Check out the full special section in Dealbook on everything blockchain:https://www.nytimes.com/spotlight/dealbook-special-section …	laurashin	40	12	1530196479	1012343523851395073	https://twitter.com/laurashin/status/1012343523851395073			
		laurashin	3	0	1530195758	1012340500802646017	https://twitter.com/laurashin/status/1012340500802646017			
	And the third article is on how businesses are using private blockchains:https://www.nytimes.com/2018/06/27/business/dealbook/industries-blockchains-efficiency.html?rref=collection%2Fspotlightcollection%2Fdealbook-special-section …	laurashin	73	23	1530195679	1012340169809190912	https://twitter.com/laurashin/status/1012340169809190912			
	The accompanying sidebar is on regulation of the crypto space abroad:https://www.nytimes.com/2018/06/27/business/dealbook/cryptocurrency-regulations-countries.html?rref=collection%2Fspotlightcollection%2Fdealbook-special-section …	laurashin	44	14	1530195595	1012339818502602753	https://twitter.com/laurashin/status/1012339818502602753			
	I've got three articles in the New York Times today. Check them out! One is on regulation of the crypto space:https://www.nytimes.com/2018/06/27/business/dealbook/crypto-industry-regulation.html?rref=collection%2Fspotlightcollection%2Fdealbook-special-section …	laurashin	479	120	1530195507	1012339446941827073	https://twitter.com/laurashin/status/1012339446941827073			
	It seems worth noting that Jed McCaleb also created XRP and the XRP ledger, which is a big part of the reason that he is on the list.	nathanielpopper	19	0	1530202419	1012368439908790273	https://twitter.com/nathanielpopper/status/1012368439908790273			
	Today's blockchain special section from @ Dealbook gave me a chance to review the biggest hurdles that have kept blockchain and crypto from living up to the promises so farhttps://www.nytimes.com/2018/06/27/business/dealbook/-blockchain-adoption-faces-hurdles.html …	nathanielpopper	37	19	1530202312	1012367988765278208	https://twitter.com/nathanielpopper/status/1012367988765278208			@
	My take on the 10 most influential people in blockchain/crypto today, in today's @ Dealbook special section Amber Baldet Brian Behlendorf Vitalik Buterin Chris Dixon Daniel Larimer Jed McCaleb Michael Novogratz Elizabeth Stark Valerie Szczepanik Jihan Wuhttps://www.nytimes.com/2018/06/27/business/dealbook/blockchain-stars.html …	nathanielpopper	611	223	1530167859	1012223486197051392	https://twitter.com/nathanielpopper/status/1012223486197051392			@
	I forward the good news but I think BCH is BCHhttps://twitter.com/sheriucar/status/1012269739110907905 …	JihanWu	218	40	1530210784	1012403526159331329	https://twitter.com/JihanWu/status/1012403526159331329			
	On http://Purse.io , it is some low income freelancers that are trying to cash out their “wages” in crypto, that pay Amazon for consumers living in U.S. Dollars of high transaction fee is very bad for them! Now http://Purse.io  adopts BCH, fees are low! Good!	JihanWu	256	50	1530172493	1012242921838428160	https://twitter.com/JihanWu/status/1012242921838428160			
	Except for Craig Wright. https://twitter.com/peterktodd/status/1012391813519310848 …	starkness	11	0	1530208738	1012394943371988992	https://twitter.com/starkness/status/1012394943371988992			
bitcoin 	https://github.com/rust-bitcoin/rust-lightning … and there may be some others.	starkness	5	0	1530200350	1012359760295981058	https://twitter.com/starkness/status/1012359760295981058			
	There are a few in-progress spec-compatible implementations but he was only talking about the ones that have been fully fleshed out.	starkness	4	0	1530200200	1012359130315714561	https://twitter.com/starkness/status/1012359130315714561			
	Credit goes to @ rusty_twit @ roasbeef @ acinq_co and others on the spec work! We're a whole community working together.	starkness	134	7	1530199797	1012357442888437760	https://twitter.com/starkness/status/1012357442888437760			@ @ @
	Because I'm the CEO of Lightning Network right?	starkness	125	6	1530199420	1012355861501677568	https://twitter.com/starkness/status/1012355861501677568			
	Excited to partner with Philip Rosedale and High Fidelity in what will be one of the coolest projects on the Blockchain.https://venturebeat.com/2018/06/28/high-fidelity-raises-35-million-with-goal-of-bringing-vr-to-a-billion-people/ …	novogratz	229	56	1530213624	1012415437441851393	https://twitter.com/novogratz/status/1012415437441851393			
	Facebook Revokes Crypto Ad Ban https://cryptocoin.news/news/altcoin/facebook-revokes-crypto-ad-ban-16522/ … via @ TodayCrypto	SimonCocking	65	40	1530184958	1012295204353789952	https://twitter.com/SimonCocking/status/1012295204353789952			@
	Africa To Trial Turning Oil And Gas Into Clean Energy https://cryptocoin.news/cryptocurrency/africa-could-benefit-from-turning-oil-gas-into-clean-energy-16474/ … via @ TodayCrypto	SimonCocking	2	0	1530184837	1012294696129978369	https://twitter.com/SimonCocking/status/1012294696129978369			@
	Tether Sends 100M USDT To Bitfinex After CSO’s Departure https://cryptocoin.news/news/altcoin/tether-sends-100m-usdt-to-bitfinex-after-csos-departure-16458/ … via @ TodayCrypto	SimonCocking	0	0	1530184716	1012294185884553216	https://twitter.com/SimonCocking/status/1012294185884553216			@
	Moldova To Help End Child Trafficking Via Blockchain Technology https://cryptocoin.news/news/blockchain-news/moldova-to-help-end-child-trafficking-via-blockchain-technology-16260/ … via @ TodayCrypto	SimonCocking	3	1	1530184461	1012293118555717633	https://twitter.com/SimonCocking/status/1012293118555717633			@
	Colombian Demand Drives Crypto Growth https://cryptocoin.news/analysis/adoption/colombian-demand-drives-crypto-growth-16278/ … via @ TodayCrypto	SimonCocking	1	1	1530184315	1012292506036461568	https://twitter.com/SimonCocking/status/1012292506036461568			@
	ICOs: The Past, Present, And Future Trends Of Initial Coin Offerings [ICO] https://cryptocoin.news/cryptocurrency/icos-the-past-the-present-and-future-trends-of-the-crypto-acronym-16541/ … via @ TodayCrypto	SimonCocking	64	47	1530183961	1012291019101097984	https://twitter.com/SimonCocking/status/1012291019101097984			@
	Tesla shorts starting to capitulate covering 2 mil shares in the first 2 weeks of June. The smart shorts covered with a small loss. The squeeze is coming... # tesla $ tsla	GerberKawasaki	99	22	1530201306	1012363769077350402	https://twitter.com/GerberKawasaki/status/1012363769077350402		#	
	Sweet! Almost got that one.	GerberKawasaki	0	0	1530197934	1012349627155116032	https://twitter.com/GerberKawasaki/status/1012349627155116032			
	Me too.	GerberKawasaki	11	0	1530197868	1012349350981193728	https://twitter.com/GerberKawasaki/status/1012349350981193728			
	Sold it. We’ve had it for years.	GerberKawasaki	2	0	1530197857	1012349305447841792	https://twitter.com/GerberKawasaki/status/1012349305447841792			
	LOL sorry your losing more money today. Cheer up.	GerberKawasaki	16	0	1530197832	1012349201663983616	https://twitter.com/GerberKawasaki/status/1012349201663983616			
	Totally.	GerberKawasaki	0	0	1530197802	1012349072894644224	https://twitter.com/GerberKawasaki/status/1012349072894644224			
	Thank god no.	GerberKawasaki	5	0	1530197784	1012348999540461568	https://twitter.com/GerberKawasaki/status/1012348999540461568			
	Saying it’s a extremely important factor as weighted to others.	GerberKawasaki	1	0	1530197758	1012348888945082369	https://twitter.com/GerberKawasaki/status/1012348888945082369			
	I got red!pic.twitter.com/Vre2ZIivx2	GerberKawasaki	3	0	1530197705	1012348668534329344	https://twitter.com/GerberKawasaki/status/1012348668534329344			
	My wife and I are arguing about owls killing people thanks to the # Staircase on # Netflix. Another amazing crime show. There is no way an owl killed this woman. $ nflx	GerberKawasaki	10	1	1530197607	1012348258188840962	https://twitter.com/GerberKawasaki/status/1012348258188840962		# #	
	Tesla up $10. Filling out the cup and handle to set up for the short kill of the century. Now at $354. Tesla model 3 is a game changer and it’s getting harder to change that narrative. $ tsla	GerberKawasaki	110	23	1530193582	1012331374265622529	https://twitter.com/GerberKawasaki/status/1012331374265622529			
	Stocks start the day mixed. Positive talk on Q2 GDP supporting stocks. Tesla in rally mode as more evidence suggests positive # model3 ramp. Disney higher. Fox deal approved by DOJ and Comcast seems to have little chance. $ foxa $ dis $ tsla	GerberKawasaki	11	3	1530193397	1012330597241348096	https://twitter.com/GerberKawasaki/status/1012330597241348096		#	
	Explaining a short squeeze to my wife last night. She was amazed people bet $12 bil to try to destroy a company attempting to make a huge dent in # climatechange ! I tried to explain, but she insisted it was stupid. # tesla $ tsla	GerberKawasaki	394	58	1530191609	1012323099457417217	https://twitter.com/GerberKawasaki/status/1012323099457417217		# #	
	Some strange stocks on this list. But most people lose money on Robinhood. Clearly.	GerberKawasaki	0	0	1530191387	1012322168376422400	https://twitter.com/GerberKawasaki/status/1012322168376422400			
	Try to do business in the EU. They have huge protectionist policies.	GerberKawasaki	0	0	1530191332	1012321938444652544	https://twitter.com/GerberKawasaki/status/1012321938444652544			
	Not mine. We’ve seen huge increases in the last 2 years. Was stable before that.	GerberKawasaki	0	0	1530191292	1012321769263325186	https://twitter.com/GerberKawasaki/status/1012321769263325186			
	True. Soon.	GerberKawasaki	1	0	1530191259	1012321631262294017	https://twitter.com/GerberKawasaki/status/1012321631262294017			
	Value is a very important factor. Very.	GerberKawasaki	0	0	1530191013	1012320597441802240	https://twitter.com/GerberKawasaki/status/1012320597441802240			
	We’re done.	GerberKawasaki	0	0	1530190796	1012319689794412544	https://twitter.com/GerberKawasaki/status/1012319689794412544			
	Things we don’t have in LA. # HoagieDay !!! # Phillyhttps://twitter.com/timjradio/status/1012267937858834432 …	GerberKawasaki	6	1	1530190578	1012318776652468224	https://twitter.com/GerberKawasaki/status/1012318776652468224		# #	
	Just in time for Walgreens to be put in the Dow. Not amazon. Stupid index. $ amzn # DJIA # Dowhttps://twitter.com/mikethecdn/status/1012317167495282689 …	GerberKawasaki	7	1	1530190519	1012318526722330624	https://twitter.com/GerberKawasaki/status/1012318526722330624		# #	
	@ ShopMedMen	GerberKawasaki	1	0	1530156249	1012174789123846145	https://twitter.com/GerberKawasaki/status/1012174789123846145			@
	Value factors definitively matter. But it’s just one factor driving potential return. Often value factors alone cloud judgement from huge potential gains. If overly relied upon.	GerberKawasaki	1	0	1530156196	1012174564871233536	https://twitter.com/GerberKawasaki/status/1012174564871233536			
	Went through GE numbers today. Sad. The end of a 100 year run. What makes you think ford and GM are immune to GE or Sears fate. Hubris. $ f $ gm $ ge $ tsla # Tesla # TeslaModel3	GerberKawasaki	37	9	1530155934	1012173468970782720	https://twitter.com/GerberKawasaki/status/1012173468970782720		# #	
	Amazing day for that guy.	GerberKawasaki	1	0	1530155807	1012172933760839681	https://twitter.com/GerberKawasaki/status/1012172933760839681			
	The guys we take money from every month. I care. There’s a lot to get from there. # Billions	GerberKawasaki	1	0	1530155787	1012172852026433536	https://twitter.com/GerberKawasaki/status/1012172852026433536		#	
	Neighbor - went to same high school.	GerberKawasaki	0	0	1530155731	1012172615199232000	https://twitter.com/GerberKawasaki/status/1012172615199232000			
	Trump said he measures his performance by the stock market. So he knows he’s doing crappy.	GerberKawasaki	1	0	1530155628	1012172184763056128	https://twitter.com/GerberKawasaki/status/1012172184763056128			
	Everyone rush and see your movie pass movies before they BK!	GerberKawasaki	0	0	1530155398	1012171219062308864	https://twitter.com/GerberKawasaki/status/1012171219062308864			
	My model3 is amazing. You get your hands on autopilot and your life is changed.	GerberKawasaki	1	0	1530155315	1012170869831921664	https://twitter.com/GerberKawasaki/status/1012170869831921664			
	This is a man who wants to sign # Lebron He’s # Magic ! # Lakers @ MagicJohnson that’s right 9 finals. Loved every game!https://twitter.com/espn/status/1011779329674575872 …	GerberKawasaki	13	2	1530155196	1012170372601372672	https://twitter.com/GerberKawasaki/status/1012170372601372672		# # #	@
	Just another day in LALA land.https://twitter.com/latimes/status/1012022477063708673 …	GerberKawasaki	14	2	1530155050	1012169757896814592	https://twitter.com/GerberKawasaki/status/1012169757896814592			
	Typical UBS. Go independent you deserve better. # fiduciary # advisor is in your best interest.https://twitter.com/tictoc/status/1012001922079916033 …	GerberKawasaki	11	1	1530154173	1012166082424070144	https://twitter.com/GerberKawasaki/status/1012166082424070144		# #	
	Typical Hollywood rise and fall. What a bs artist this guy was. With Relativity in Bankruptcy, Ryan Kavanaugh Lists Malibu Estate (EXCLUSIVE) - Varietyhttps://apple.news/AlXHfmz6YSlqVp0v1MIv0-g …	GerberKawasaki	4	0	1530153536	1012163409561808896	https://twitter.com/GerberKawasaki/status/1012163409561808896			
	Ouch. But pocket change for Dr. Dre and Jimmy Iovine . Ordered to Pay $25M to Former Beats Business Partner - Complex # beats # apple $ aaplhttps://apple.news/AfMx85lBPSN2mHND_zmnRnA …	GerberKawasaki	2	0	1530153271	1012162299728019457	https://twitter.com/GerberKawasaki/status/1012162299728019457		# #	
	An interesting list. Millennial Investors Love These Stocks: Here Are Robinhood's Top 20 Holdings - Investor's Business Daily ⁦ @ IBDinvestors⁩ # IBDPartner # ad $ aaplhttps://apple.news/A-uTrMiwIR1acqeQdaVfyOA …	GerberKawasaki	7	2	1530153057	1012161398913134592	https://twitter.com/GerberKawasaki/status/1012161398913134592		# #	@
	wow!	GerberKawasaki	1	0	1530137617	1012096640927162368	https://twitter.com/GerberKawasaki/status/1012096640927162368			
	Be careful, lots of credit cards scams around. Just caught one, they call you and say you have a past due balance and if you want to make a payment with a different card so you don't get a penalty. But its a fraud. Be careful.	GerberKawasaki	8	7	1530137405	1012095750832918528	https://twitter.com/GerberKawasaki/status/1012095750832918528			
	Report: First 5 Months of 2018 Saw 537 ICOs Raise $13.7 Billion https://buff.ly/2N64MK5 @ thecryptovalley # ico # blockchain	obussmann	6	2	1530211261	1012405523336089601	https://twitter.com/obussmann/status/1012405523336089601		# #	@
	A16z Leads Investors in $20 Million ICO for Crypto Assets Platform https://buff.ly/2Mznz0c pic.twitter.com/y6b5KWksc0	obussmann	0	0	1530193923	1012332806498869248	https://twitter.com/obussmann/status/1012332806498869248			
	Apple Blocks Crypto Mining Apps On Its Products https://buff.ly/2sYcZ9O pic.twitter.com/7TAHCuAWpu	obussmann	0	2	1530184862	1012294799255310336	https://twitter.com/obussmann/status/1012294799255310336			
	HARNESSING THE POWER OF PLATFORM BUSINESS MODELS via @ tendswisshttps://buff.ly/2lGL37m	obussmann	4	3	1530167460	1012221811986259968	https://twitter.com/obussmann/status/1012221811986259968			@
	Advanced Data Analytics is Evolving Rapidly, Here are 5 Important Trends to Know - by @ IrenaPeregood https://floq.to/Ydhwb # BigData	VanRijmenam	0	1	1530218183	1012434557050736641	https://twitter.com/VanRijmenam/status/1012434557050736641		#	@
	Why Data # Collaboration is the Next Revolution - by @ BigDataBlock https://floq.to/OdKqk#.Wyz_6ds9hQA.twitter … # BigData	VanRijmenam	1	0	1530215800	1012424562812866560	https://twitter.com/VanRijmenam/status/1012424562812866560		# # #	@
	How Big Data Is Impacting E-Commerce In 2018 - https://floq.to/9ZItd#.WyzzGQlHo-Q.twitter … # bigdata	VanRijmenam	2	2	1530212536	1012410873997119488	https://twitter.com/VanRijmenam/status/1012410873997119488		# #	
	Why the Internet Has a Problem and What We Can Learn from China’s Sesame Credit https://buff.ly/2yVUARA @ datafloq	VanRijmenam	0	0	1530209107	1012396491166699523	https://twitter.com/VanRijmenam/status/1012396491166699523			@
	How Artificial Intelligence Will Change Retail Banking - by @ VanRijmenam http://dld.bz/gbbcx # AI	VanRijmenam	0	0	1530207990	1012391805881548800	https://twitter.com/VanRijmenam/status/1012391805881548800		#	@
	Looking for # BigData # Talent for your Company? Create an Employer profile and Publish unlimited Job posts - https://datafloq.com/plans	VanRijmenam	1	1	1530205199	1012380099222691842	https://twitter.com/VanRijmenam/status/1012380099222691842		# #	
	Develop for the future of AI with tools, frameworks, and training from Intel. Sponsored by Intel. # Ad # IntelAI http://dld.bz/gDt3v	VanRijmenam	0	0	1530204930	1012378969675530241	https://twitter.com/VanRijmenam/status/1012378969675530241		# #	
	MongoDB Ruby Driver 2.5.x Case-Sensitivity Issues with Hostnames on Replica Sets https://buff.ly/2lE2uFy @ datafloq	VanRijmenam	0	0	1530201840	1012366011033628673	https://twitter.com/VanRijmenam/status/1012366011033628673			@
	Why People Make Bad Charts (and What to Do When it Happens) # BigDatahttp://dld.bz/gSKub	VanRijmenam	1	0	1530196458	1012343435578224640	https://twitter.com/VanRijmenam/status/1012343435578224640		#	
	What will be the consequences for having limitless data and unlimited computing power - by @ bigcloudteam http://floq.to/ySm9A # BigData	VanRijmenam	1	3	1530192390	1012326376173637632	https://twitter.com/VanRijmenam/status/1012326376173637632		#	@
	To Compete in Today's Competitive E-Commerce Landscape, End-to-End Visibility is Key - by @ cstonecontenthttps://floq.to/gpgkL#.WzM7cJJmRNw.twitter …	VanRijmenam	0	0	1530192226	1012325687250825217	https://twitter.com/VanRijmenam/status/1012325687250825217		#	@
	Online reputation is vital for global online collaboration. What can we learn from China's social credit scoring system Sesame Credit? - by @ vanrijmenam https://floq.to/bXRGM#.WzSOK3DDRZs.twitter … # Privacy # Blockchainpic.twitter.com/fRgtZMsOZr	VanRijmenam	1	1	1530189037	1012312309606371329	https://twitter.com/VanRijmenam/status/1012312309606371329		# # #	@
	What to Do on Your First Day as Data Science Leader - by @ michaelyoungMBN http://floq.to/gU9dt # BigData	VanRijmenam	0	1	1530187941	1012307712582053888	https://twitter.com/VanRijmenam/status/1012307712582053888		#	@
	How Artificial Intelligence is changing the Farms of Future https://buff.ly/2N5AMxP @ datafloq	VanRijmenam	0	0	1530180903	1012278194521731073	https://twitter.com/VanRijmenam/status/1012278194521731073			@
	2018 DATAVERSITY Mid-Year Top 20 # BigDatahttp://dld.bz/gSJvJ	VanRijmenam	0	0	1530178445	1012267886365298688	https://twitter.com/VanRijmenam/status/1012267886365298688		#	
	How Retailers Can Put Idle Data To Work And Increase Profits by @ WeAreManthan http://floq.to/5rON4 # BigDatapic.twitter.com/YbxjdaYBiS	VanRijmenam	1	0	1530177990	1012265974953926656	https://twitter.com/VanRijmenam/status/1012265974953926656		#	@
	MongoDB 4.0 aims for cloud-friendliness # BigDatahttp://dld.bz/gSJvH	VanRijmenam	0	0	1530176715	1012260627576950784	https://twitter.com/VanRijmenam/status/1012260627576950784		#	
	Looking to hire Big Data Scientists or Analysts? Publish your job posts on Datafloq, starting at $39 - https://datafloq.com/plans	VanRijmenam	0	0	1530176281	1012258809258135553	https://twitter.com/VanRijmenam/status/1012258809258135553			
	Digital Twin as a Strategic Technology Trend: Meaning, Benefits & Examples - by @ Apium_hub https://floq.to/cLqrq # BigData	VanRijmenam	16	14	1530173108	1012245501570420736	https://twitter.com/VanRijmenam/status/1012245501570420736		#	@
	Why retailers must think beyond traditional engagement strategies - by @ DataMentors http://floq.to/JGscx # BigData	VanRijmenam	0	0	1530171863	1012240279594766336	https://twitter.com/VanRijmenam/status/1012240279594766336		#	@
	Why the Internet Has a Problem and What We Can Learn from China's Sesame Credit - by @ vanrijmenam https://floq.to/bXRGM#.WzSOK3DDRZs.twitter … # Privacy # Blockchain	VanRijmenam	0	0	1530170947	1012236434659598336	https://twitter.com/VanRijmenam/status/1012236434659598336		# # #	@
	The concept of # BigData never looked more fascinating, but what will the future look like? - by @ russellelena11http://floq.to/KiJop	VanRijmenam	3	1	1530167498	1012221971986251781	https://twitter.com/VanRijmenam/status/1012221971986251781		#	@
	How Artificial Intelligence is changing the Farms of Future - by @ webtunix https://floq.to/iJamN#.WzSAd48u1o4.twitter … # AI # Farming	VanRijmenam	1	0	1530167487	1012221923382775808	https://twitter.com/VanRijmenam/status/1012221923382775808		# # #	@
	The Rise of Robot and AI, are They Taking Over the World? - by @ bigcloudteam https://floq.to/O39gT # BigData	VanRijmenam	3	1	1530165682	1012214353448308736	https://twitter.com/VanRijmenam/status/1012214353448308736		#	@
	Looking to find # BigData # Talent? Publish your job posts on Datafloq, starting at $39 - https://datafloq.com/plans	VanRijmenam	0	0	1530161828	1012198188890165248	https://twitter.com/VanRijmenam/status/1012198188890165248		# #	
	Big Data and # Advertising: A Match Made in Heaven - by @ LarryAlton3 https://floq.to/q6UD1#.Wxa9qvSlwh0.twitter … # BigData # Marketing	VanRijmenam	1	2	1530161041	1012194888677580800	https://twitter.com/VanRijmenam/status/1012194888677580800		# # # #	@
	The Top 6 Free # Redis # Memory # Analysis Tools - by @ scalegridiohttps://floq.to/O0ruX#.WzEYpfHzpaU.twitter …	VanRijmenam	2	1	1530160269	1012191650100187136	https://twitter.com/VanRijmenam/status/1012191650100187136		# # # #	@
