	pic.twitter.com/qXL0gHi2WL	BaldingsWorld	1	0	1528802166	1006495354060136448	https://twitter.com/BaldingsWorld/status/1006495354060136448			
	Booooom!https://twitter.com/RollingWave0720/status/1006494277289930752 …	BaldingsWorld	12	3	1528802074	1006494968372813824	https://twitter.com/BaldingsWorld/status/1006494968372813824			
	"""Mo money, mo problems"" -- Chinese proverbhttps://twitter.com/IvankaTrump/status/1006160823360872448 …"	BaldingsWorld	29	2	1528801500	1006492558678061056	https://twitter.com/BaldingsWorld/status/1006492558678061056			
	Hmmmm.. Though 2018 is shaping up to be a good year	BaldingsWorld	0	0	1528800897	1006490031005958149	https://twitter.com/BaldingsWorld/status/1006490031005958149			
	I need that meme where investors stare at the pretty North Korean girl while the Chinese girlfriend punches investors in the facehttps://twitter.com/paleofuture/status/1006482334319665152 …	BaldingsWorld	34	5	1528800121	1006486777266257921	https://twitter.com/BaldingsWorld/status/1006486777266257921			
	The sugar industry in the US is absurd. Absurdly protected	BaldingsWorld	0	0	1528799952	1006486064976941057	https://twitter.com/BaldingsWorld/status/1006486064976941057			
	Reminder: excluding one time items, in 2017 Xiaomi made 3.9 billion RMB or $609mhttps://twitter.com/IFRAsia/status/1006472872691470337 …	BaldingsWorld	11	4	1528798309	1006479174725275648	https://twitter.com/BaldingsWorld/status/1006479174725275648			
	"""hotter than than a mushroom cloud"""	BaldingsWorld	1	0	1528797526	1006475889608048640	https://twitter.com/BaldingsWorld/status/1006475889608048640			
	I thought Juche was that little appetizer they served you before the Korean BBQ?	BaldingsWorld	2	0	1528797503	1006475795257176066	https://twitter.com/BaldingsWorld/status/1006475795257176066			
	Damn! Salary cap issues killed the deal!	BaldingsWorld	0	0	1528797318	1006475020413964288	https://twitter.com/BaldingsWorld/status/1006475020413964288			
	I'm listening....	BaldingsWorld	2	0	1528789875	1006443802171600896	https://twitter.com/BaldingsWorld/status/1006443802171600896			
	Serious question: how on earth would one use iTunes to produce nuclear weapons and violate the terms of service?https://twitter.com/Psythor/status/1006427935778230273 …	BaldingsWorld	9	4	1528788350	1006437405186916352	https://twitter.com/BaldingsWorld/status/1006437405186916352			
	The best part is, this apparently started out as an American proverb then became attributed to China.https://twitter.com/s1moncox/status/1006429967859634177 …	BaldingsWorld	8	2	1528787158	1006432406545420288	https://twitter.com/BaldingsWorld/status/1006432406545420288			
	Most of the Trump-Kim agreement is just glad handing except the US allowing ShakeShack to open a franchise in Pyongyang. I find that concession troublesome	BaldingsWorld	8	2	1528786732	1006430617557295107	https://twitter.com/BaldingsWorld/status/1006430617557295107			
	ShakeShack in Pyongyang	BaldingsWorld	1	0	1528785968	1006427413612359680	https://twitter.com/BaldingsWorld/status/1006427413612359680			
	Depending on performance of denuclearization could be upgraded from an Arby's to a ShakeShack	BaldingsWorld	2	2	1528783541	1006417235080957953	https://twitter.com/BaldingsWorld/status/1006417235080957953			
	Nobody is going to trust the process	BaldingsWorld	0	0	1528783501	1006417066700632065	https://twitter.com/BaldingsWorld/status/1006417066700632065			
	hahahaha....ROFL....that's epic	BaldingsWorld	1	0	1528783480	1006416975763931137	https://twitter.com/BaldingsWorld/status/1006416975763931137			
	Hahaha....that's why we have to have the cabinet member to be named later!!!	BaldingsWorld	0	0	1528783336	1006416372144881665	https://twitter.com/BaldingsWorld/status/1006416372144881665			
	One of the greatest quotes about a meeting between world leaders e-v-e-r	BaldingsWorld	0	0	1528782430	1006412573145645056	https://twitter.com/BaldingsWorld/status/1006412573145645056			
	Probably pretty similar	BaldingsWorld	0	0	1528781068	1006406859157147648	https://twitter.com/BaldingsWorld/status/1006406859157147648			
	In a way it says a lot about Chinese business that this is arguably one of the best companies to go public on effectively zero margin in a shrinking market	BaldingsWorld	1	0	1528780777	1006405639784894464	https://twitter.com/BaldingsWorld/status/1006405639784894464			
	Get real estate developers cash without increasing leverage	BaldingsWorld	2	0	1528777737	1006392888425529344	https://twitter.com/BaldingsWorld/status/1006392888425529344			
	There are much much dodgier	BaldingsWorld	0	0	1528776825	1006389063606140928	https://twitter.com/BaldingsWorld/status/1006389063606140928			
	Bank has loan the real estate firm money at say 7%. The unit on rental yields 1-2%. So developer loses say 5-6% a year on their debt for every rental unit. The bank is essentially tiding the developer over to hope they can sell those units in a few years to repay their debt.	BaldingsWorld	8	1	1528776132	1006386156706021377	https://twitter.com/BaldingsWorld/status/1006386156706021377			
	being pressured to rent so people can afford to live there. Bank steps in and loans a renter 5-10 years of rent payments upfront. The real estate development firm still holds the unit but they have enough cash tide them over. Here is the problem.....	BaldingsWorld	4	1	1528775998	1006385594824396800	https://twitter.com/BaldingsWorld/status/1006385594824396800			
	First, this is a judgement free Twitter zone so honest questions are welcomed. Second, you're close but not exact. Goes like this. Assume a bank makes a big loan to a real estate developer that would build 1,000 units. The real estate developer needs the cash but.....	BaldingsWorld	9	1	1528775883	1006385113066758145	https://twitter.com/BaldingsWorld/status/1006385113066758145			
	There are lots of different plans but they definitely do exist where you get to live there for 5 years and pay it back over 10 or for 10/20	BaldingsWorld	1	0	1528774452	1006379109943922690	https://twitter.com/BaldingsWorld/status/1006379109943922690			
	"Banks are literally being told to subsidize housing because asset prices are too high in China. ""Renters"" are taking out loans for loans that are longer than their rental period for yields below current interest rates. How is this remotely rational?https://www.reuters.com/article/us-china-rentals-banks/china-pushes-state-banks-into-home-rental-market-at-their-own-risk-idUSKCN1J031N …"	BaldingsWorld	111	60	1528770793	1006363763614932992	https://twitter.com/BaldingsWorld/status/1006363763614932992			
	Unless Kim Kardashian is invited to offer her expertise on North Korean prison reform, this whole interview is a sham done purely for publicityhttps://twitter.com/abigailcgrace/status/1006351274286166016 …	BaldingsWorld	7	1	1528768717	1006355058068369408	https://twitter.com/BaldingsWorld/status/1006355058068369408			
	Blockchained BloodCoin?	BaldingsWorld	1	0	1528768604	1006354581297639424	https://twitter.com/BaldingsWorld/status/1006354581297639424			
	I keep telling you there remains much more underlying tightness in the Chinese credit market than is realizedhttps://twitter.com/bopinion/status/1004503470718750720 …	BaldingsWorld	28	8	1528768513	1006354203013287936	https://twitter.com/BaldingsWorld/status/1006354203013287936			
	Well worth your time	BaldingsWorld	0	0	1528767280	1006349028815134721	https://twitter.com/BaldingsWorld/status/1006349028815134721			
	All I'm gonna say is: you've never seen them togetherhttps://twitter.com/vexmark/status/1006347961964560384 …	BaldingsWorld	8	3	1528767096	1006348258531160066	https://twitter.com/BaldingsWorld/status/1006348258531160066			
	I don't think so as it's taken more just as policy but given the existence of this article maybe there is a little concern?	BaldingsWorld	2	0	1528765274	1006340617520025600	https://twitter.com/BaldingsWorld/status/1006340617520025600			
	pic.twitter.com/3Ckzq5IbxA	BaldingsWorld	0	0	1528764784	1006338559400239105	https://twitter.com/BaldingsWorld/status/1006338559400239105			
	Amazing storyhttps://twitter.com/Cezary/status/1006004003430457346 …	BaldingsWorld	5	1	1528764337	1006336687625027585	https://twitter.com/BaldingsWorld/status/1006336687625027585			
	1. They would love it but for many reasons very unlikely 2. Definitely not encouraged 3. Yes	BaldingsWorld	1	0	1528764016	1006335338627776514	https://twitter.com/BaldingsWorld/status/1006335338627776514			
	These concerns are valid but way too latehttp://www.chinabankingnews.com/2018/06/11/peoples-daily-warns-chinese-depository-receipts-help-internet-giants-cement-monopolies/ …	BaldingsWorld	3	0	1528763582	1006333518639595525	https://twitter.com/BaldingsWorld/status/1006333518639595525			
		BaldingsWorld	1	0	1528763447	1006332953767469056	https://twitter.com/BaldingsWorld/status/1006332953767469056			
	We are all going to die in a robot apocalypse	BaldingsWorld	2	0	1528763430	1006332880270708737	https://twitter.com/BaldingsWorld/status/1006332880270708737			
	That was only fed Reddit. Imagine how much worse it would have been if it was trained on Twitter?!?!?!?!https://twitter.com/TheAVClub/status/1004533422516252672 …	BaldingsWorld	19	5	1528762841	1006330413319520256	https://twitter.com/BaldingsWorld/status/1006330413319520256			
	This summary of the state and direction of US China relations captures it perfectly. Hopefully the historical failures on the US side will be learned from rather than ignored.pic.twitter.com/h6Ci30vMRE	BaldingsWorld	19	9	1528762378	1006328469871923202	https://twitter.com/BaldingsWorld/status/1006328469871923202			
	Later on he accurately captures the creeping push this represents around the worldpic.twitter.com/H3TA6XaDk4	BaldingsWorld	12	7	1528762264	1006327989599006720	https://twitter.com/BaldingsWorld/status/1006327989599006720			
	Right from the outset he nails the biggest problem. Too many on both sides continue to view this as a simple conflict between an existing power and a rising power rather than fundamental conflict it ispic.twitter.com/0zCS9P0cBz	BaldingsWorld	18	6	1528762211	1006327767384797184	https://twitter.com/BaldingsWorld/status/1006327767384797184			
	Occasionally I read things and they are so great that I wish I had written them. @ AaronFriedberg put out a tour de force on US China relations which nails the previous failures and charts a course forward https://www.iiss.org/en/publications/survival/sections/2018-9a32/survival--global-politics-and-strategy-june-july-2018-7fc7/60-3-02-friedberg-c740 …	BaldingsWorld	37	17	1528762146	1006327497015812096	https://twitter.com/BaldingsWorld/status/1006327497015812096			@
	@ georgemagnus1 just mic dropped y'allhttps://twitter.com/georgemagnus1/status/1006288285705097219 …	BaldingsWorld	0	0	1528760503	1006320606890070016	https://twitter.com/BaldingsWorld/status/1006320606890070016			@
	Get in line.https://twitter.com/elisewho/status/1006469063583756288 …	prchovanec	7	0	1528828967	1006607762787323912	https://twitter.com/prchovanec/status/1006607762787323912			
	I’m watching the same Trump flaks I know who, if it were anyone else, would be pounding the table and denouncing today’s summit “deal” with North Korea as spineless and pathetic, praising it instead as a historic accomplishment. Not sure if I want to or .	prchovanec	20	2	1528828853	1006607286117261317	https://twitter.com/prchovanec/status/1006607286117261317			
	And they would be wrong. Ineptly, transparently so.https://twitter.com/parscale/status/1006544337612754945 …	prchovanec	13	0	1528828513	1006605860863389697	https://twitter.com/prchovanec/status/1006605860863389697			
	Narrator: He didn’t admit it. He found some kind of excuse.https://twitter.com/cnnpolitics/status/1006473250313039872 …	prchovanec	7	2	1528828384	1006605317336174592	https://twitter.com/prchovanec/status/1006605317336174592			
	Please tell me he was misquoted.https://twitter.com/bencjacobs/status/1006264775435841537 …	prchovanec	1	2	1528828295	1006604946723262465	https://twitter.com/prchovanec/status/1006604946723262465			
	South Korea to Trump: You did what exactly?http://thehill.com/policy/international/391778-south-korea-to-seek-precise-meaning-of-trumps-plan-to-end-war-games …	prchovanec	4	3	1528828199	1006604541205340161	https://twitter.com/prchovanec/status/1006604541205340161			
	Sigh.https://twitter.com/pdanahar/status/1006571445013577728 …	prchovanec	4	2	1528828133	1006604266184863745	https://twitter.com/prchovanec/status/1006604266184863745			
	To blame Canada.https://twitter.com/byrdinator/status/1006601139721265152 …	prchovanec	10	1	1528828047	1006603903939563521	https://twitter.com/prchovanec/status/1006603903939563521			
	So much for Trump being willing to “walk out” if concrete results weren’t forthcoming.https://twitter.com/andreilankov/status/1006441443555205120 …	prchovanec	6	0	1528825841	1006594654354231296	https://twitter.com/prchovanec/status/1006594654354231296			
	I’ve actually been to a casino and a beach resort in North Korea. Make that two casinos.https://twitter.com/zekejmiller/status/1006467614007177216 …	prchovanec	1	0	1528825841	1006594650856132608	https://twitter.com/prchovanec/status/1006594650856132608			
	No kidding.https://twitter.com/urbanachievr/status/1006497854679126016 …	prchovanec	1	1	1528825840	1006594646640943104	https://twitter.com/prchovanec/status/1006594646640943104			
	= How often do I have to tell you?	prchovanec	1	0	1528825838	1006594642094317568	https://twitter.com/prchovanec/status/1006594642094317568			
	The hand-washing and finger-pointing begin.https://twitter.com/ericgeller/status/1006581910485651457 …	prchovanec	10	2	1528824637	1006589603795603456	https://twitter.com/prchovanec/status/1006589603795603456			
	My dinner tonight in Odessa, Ukraine: Black Sea mussels in cream cheese sauce, potatoes, and hot mulled white wine. pic.twitter.com/riypgigLOy	prchovanec	13	2	1528824573	1006589336320729088	https://twitter.com/prchovanec/status/1006589336320729088			
	Please don’t tell me he pledged to remove troops. I felt this was coming but would like to believe otherwise.https://twitter.com/joshrogin/status/1006458224206282752 …	prchovanec	6	4	1528823255	1006583805463932928	https://twitter.com/prchovanec/status/1006583805463932928			
	Yes, Kim certainly does “run it tough”.https://twitter.com/monachareneppc/status/1006537741620801536 …	prchovanec	7	4	1528822910	1006582359876096000	https://twitter.com/prchovanec/status/1006582359876096000			
	Meanwhile ...https://twitter.com/chloechotv/status/1006345524918697985 …	prchovanec	7	4	1528788515	1006438095028391936	https://twitter.com/prchovanec/status/1006438095028391936			
	Next week, Trump will be denying there ever was a summit, and his spinners will be faithfully writing articles questioning if Singapore is even a real place.https://twitter.com/adamcathcart/status/1006436352471257088 …	prchovanec	27	3	1528788213	1006436829770416133	https://twitter.com/prchovanec/status/1006436829770416133			
	Maybe he should have stuck with cancelling the meeting.	prchovanec	23	7	1528787951	1006435731269615616	https://twitter.com/prchovanec/status/1006435731269615616			
	I'll give him the benefit of the doubt, and assume he was referring to the weather.https://twitter.com/W7VOA/status/1006435013246611456 …	prchovanec	8	1	1528787840	1006435263793508353	https://twitter.com/prchovanec/status/1006435263793508353			
	I don't think the writers on the show put as much thought into this episode as many of the others.https://twitter.com/nknewsorg/status/1006434024183627777 …	prchovanec	12	10	1528787734	1006434820707246080	https://twitter.com/prchovanec/status/1006434820707246080			
	And that would be under normal circumstances, with a normal President.	prchovanec	0	0	1528787385	1006433356391895041	https://twitter.com/prchovanec/status/1006433356391895041			
	So the real question becomes, what happens next?https://twitter.com/MichaelSchuman/status/1006432582148354049 …	prchovanec	3	2	1528787248	1006432780207697920	https://twitter.com/prchovanec/status/1006432780207697920			
	How about Kim's signature, though? You could write a Psychology doctoral thesis on the two of them together.pic.twitter.com/tvhZGC0cHf	prchovanec	22	6	1528786993	1006431714430930945	https://twitter.com/prchovanec/status/1006431714430930945			
	"Somebody - maybe that @ RandyRainbow guy - needs to make a ""Rainbow Tour"" song for the G7 and Singapore Summit."	prchovanec	1	0	1528786896	1006431306505433088	https://twitter.com/prchovanec/status/1006431306505433088			@
	Let's hear it for the Rainbow Tour. It's been an incredible success. We weren't quite sure, we had a few doubts. Will the Donald win through? And the answer is: Yes And no. And yes. And no. And yes. No.	prchovanec	5	1	1528786782	1006430828564492289	https://twitter.com/prchovanec/status/1006430828564492289			
	Yes, it's circulating around right now. Four points, all pretty vague, nothing new.	prchovanec	0	0	1528786615	1006430127302037504	https://twitter.com/prchovanec/status/1006430127302037504			
	Just be happy it wasn't the Fourteen Points, okay?	prchovanec	8	0	1528786520	1006429728075603968	https://twitter.com/prchovanec/status/1006429728075603968			
	3. We agree on all the stuff we don't disagree on. For now.	prchovanec	3	0	1528786416	1006429290764873730	https://twitter.com/prchovanec/status/1006429290764873730			
	2. I like lamp.	prchovanec	5	0	1528786392	1006429191544430592	https://twitter.com/prchovanec/status/1006429191544430592			
	1. We had a meeting in Singapore. Historic, huh?	prchovanec	2	0	1528786368	1006429089698377728	https://twitter.com/prchovanec/status/1006429089698377728			
	I've taken a magnifying glass and done my best to decipher the text of the Trump-Kim agreement. Point by point, here it is:	prchovanec	4	1	1528786320	1006428887725871104	https://twitter.com/prchovanec/status/1006428887725871104			
	No, the implications of North Korea having nuclear weapons that can reach the US are quite real, and dangerous. That's what Obama told Trump when he first came to the White House.	prchovanec	2	0	1528786200	1006428386300977152	https://twitter.com/prchovanec/status/1006428386300977152			
	That's literally going into the dustbin of history. Literally.pic.twitter.com/ikyXhGlmJR	prchovanec	18	5	1528786133	1006428105693593606	https://twitter.com/prchovanec/status/1006428105693593606			
	I honestly didn't know what to expect. But it looks like what just happened is that President Trump gave Kim Jong-un a huge propaganda win, in the form of a one-on-one summit they've wanted for decades, and got nothing concrete in return.	prchovanec	158	78	1528786003	1006427561197436928	https://twitter.com/prchovanec/status/1006427561197436928			
	I think we're all going to need some PotCoin to help us out.https://twitter.com/hunterw/status/1006348097532973057 …	prchovanec	7	2	1528785774	1006426599380738048	https://twitter.com/prchovanec/status/1006426599380738048			
	Justin would like to know.	prchovanec	11	0	1528785677	1006426192113799168	https://twitter.com/prchovanec/status/1006426192113799168			
	So if Trump comes under vigorous criticism for signing what, from initial reports, seems like a nothing-burger, will he get angry and repudiate the joint statement via Twitter on Air Force One flying home?https://twitter.com/JChengWSJ/status/1006425053985062913 …	prchovanec	20	7	1528785552	1006425670057189376	https://twitter.com/prchovanec/status/1006425670057189376			
	So, important question for @ realDonaldTrump: What are the implications of your just-finished meeting, and the document you just signed, for existing US and international sanctions aimed at North Korea?	prchovanec	58	26	1528785388	1006424979389468673	https://twitter.com/prchovanec/status/1006424979389468673			@
	This is very much the conversation going on in Europe right now.https://twitter.com/lykkefriis/status/1006421672663101441 …	prchovanec	12	8	1528784807	1006422542071017472	https://twitter.com/prchovanec/status/1006422542071017472			
	Optics. Actually worth watching in full, to pick up the full parallels.https://www.youtube.com/watch?v=hQ95ffnU4Sw …	prchovanec	10	7	1528784490	1006421215156883456	https://twitter.com/prchovanec/status/1006421215156883456			
	"Much better answer would have been: ""I've learned that we have much to discuss, and that he seems - for now - willing to listen, as are we.""https://twitter.com/ZekeJMiller/status/1006417976206036992 …"	prchovanec	11	6	1528784281	1006420339004465152	https://twitter.com/prchovanec/status/1006420339004465152			
	I'm sure our allies - and China - are on pins and needles waiting to find out.https://twitter.com/abcnews/status/1006418281496891393 …	prchovanec	3	2	1528783968	1006419024614445059	https://twitter.com/prchovanec/status/1006419024614445059			
	Nope.https://twitter.com/redsteeze/status/1006411471838957568 …	prchovanec	6	0	1528783918	1006418815125721088	https://twitter.com/prchovanec/status/1006418815125721088			
	"I think we'll need more than a piece of paper proclaiming ""peace in our time"" for that to be justified.https://twitter.com/AP/status/1006413910038188032 …"	prchovanec	13	3	1528783717	1006417971449880576	https://twitter.com/prchovanec/status/1006417971449880576			
	I guess we'll have to take the time to read it before forming an opinion. Oh bother.https://twitter.com/thehill/status/1006417343042543616 …	prchovanec	1	2	1528783674	1006417791375892480	https://twitter.com/prchovanec/status/1006417791375892480			
	Trump Cabinet members glance worriedly at one another.https://twitter.com/BaldingsWorld/status/1006414983259815936 …	prchovanec	7	0	1528783593	1006417453545656320	https://twitter.com/prchovanec/status/1006417453545656320			
	I think you confused @ reihan's twitter feed with the person who RTed him. They may have had very different perspectives.	prchovanec	0	0	1528783280	1006416137607942145	https://twitter.com/prchovanec/status/1006416137607942145			@
	19. With that, I'd welcome @ reihan's response, and hope I didn't take too many false liberties with what he had to say.	prchovanec	2	1	1528783195	1006415783336054784	https://twitter.com/prchovanec/status/1006415783336054784			@
	18. In fact, in many ways the course the US ultimately did follow was the result of unsuccessful efforts to do precisely what today's critics (and not just @ reihan) insist should have been done - and would have proven more successful.	prchovanec	0	0	1528783130	1006415509225725952	https://twitter.com/prchovanec/status/1006415509225725952			@
	17. And that overlap consists of questioning whether the US really had the viable and effective alternatives we imagine it had, looking back from a distance.	prchovanec	2	0	1528783030	1006415089199734784	https://twitter.com/prchovanec/status/1006415089199734784			
	"16. Anyway, I'll stop here, but simply note the while @ reihan's argument isn't the same as the broader ""we got China wrong"" case that attracted the brunt of my criticism, there is some meaningful overlap."	prchovanec	0	0	1528782928	1006414664446726144	https://twitter.com/prchovanec/status/1006414664446726144			@
	15. Also, at that time, China was embarked on a major economic reform effort led by Zhu Rongji, which was - in fact - leading China in a much more positive direction. The U.S. very much wanted to encourage and reward that.	prchovanec	2	0	1528782709	1006413745952870401	https://twitter.com/prchovanec/status/1006413745952870401			
	14. Compared to 10 years ago, China has undoubtedly backtracked on both market reform and political openness. But compared to 20 or 30 years ago, the contrast is not nearly so clear or one-sided.	prchovanec	3	1	1528782614	1006413346017554432	https://twitter.com/prchovanec/status/1006413346017554432			
	13. But isn't it obvious that we didn't make such progress? You have to remember where China started (a completely state-run economy, with virtually no rule of law) to keep in perspective the problems and issues that (undoubtedly) remain.	prchovanec	1	0	1528782545	1006413054488272896	https://twitter.com/prchovanec/status/1006413054488272896			
	12. Moreover, by delinking human rights, the US was able to make not insignificant progress on issues like intellectual property piracy, which had a stronger logical and political alignment with trading privileges.	prchovanec	1	0	1528782454	1006412676417904640	https://twitter.com/prchovanec/status/1006412676417904640			
	11. Critics would say this subordinated human rights to business interests, but that attempted alignment wasn't proving either credible or effective anyway.	prchovanec	2	2	1528782302	1006412038355243008	https://twitter.com/prchovanec/status/1006412038355243008			
	"10. By ""de-linking"" trade issues from human rights, the idea wasn't to abandon human rights, but to align disputes with consequences in a way that hold one set of US interests hostage to another."	prchovanec	0	1	1528782236	1006411758427361280	https://twitter.com/prchovanec/status/1006411758427361280			
	9. When the US did threaten trade sanctions over China's human rights record, the Clinton Admin lacked the domestic political consensus to stand by them, and was forced to back in a very visible and awkward manner.	prchovanec	0	2	1528782105	1006411210793897985	https://twitter.com/prchovanec/status/1006411210793897985			
	8. In practice, this linkage proved more problematic than hoped, because it pitted different domestic US constituencies against each other, in a battle over China policy.	prchovanec	1	1	1528781975	1006410663986712576	https://twitter.com/prchovanec/status/1006410663986712576			
