	Is there something wrong with that?	VitalikButerin	5	4	1528821805	1006577725232984065	https://twitter.com/VitalikButerin/status/1006577725232984065			
	> Quicker consensus is an approach to scaling too right? Absolutely not. The truly fundamental scaling bottleneck has nothing to do with consensus algos, it has to do with the fact that in naively implemented blockchains every node needs to process every tx.	VitalikButerin	11	8	1528821143	1006574946145878016	https://twitter.com/VitalikButerin/status/1006574946145878016			
	Blockchains actually can help to achieve some guarantees (eg. by hosting the vote on one, you can prove that people weren't unfairly denied the chance to participate). The recent (non-blockchain-based) EOS genesis vote was criticized because of precisely this issue I believe.	VitalikButerin	29	7	1528820807	1006573536897478657	https://twitter.com/VitalikButerin/status/1006573536897478657			
	Of course not. But putting a list of valid public keys onto a blockchain could be a reasonable thing to do.	VitalikButerin	3	4	1528796212	1006470378015735810	https://twitter.com/VitalikButerin/status/1006470378015735810			
	Got it :)	VitalikButerin	16	4	1528790341	1006445753957433344	https://twitter.com/VitalikButerin/status/1006445753957433344			
	I did mention @ SpankChain specifically in other contexts (Edcon I think) But in any case, definitely looking forward to seeing this go live.	VitalikButerin	48	13	1528790222	1006445256902991872	https://twitter.com/VitalikButerin/status/1006445256902991872			@
	"What does ""Islamming the SEC"" even mean?"	VitalikButerin	836	38	1528790144	1006444928476442624	https://twitter.com/VitalikButerin/status/1006444928476442624			
	Ok I don't think clear-text personally identifiable information should be stored on a blockchain. Keep it to lists of public keys, and possibly hashes/Merkle roots of data.	VitalikButerin	40	8	1528790084	1006444677334118400	https://twitter.com/VitalikButerin/status/1006444677334118400			
	Trusted-setup-free STARKs are making great progress recently. Also, trusted setup once again isn't as big of an issue because petitions are non-binding.	VitalikButerin	4	5	1528790002	1006444334034505729	https://twitter.com/VitalikButerin/status/1006444334034505729			
ethereum 	Specifically looking at you Zug: https://www.coindesk.com/swiss-city-plans-to-vote-on-blockchain-using-ethereum-digital-id/ … But also CC @ kasparkorjus @ augama @ EvaKaili	VitalikButerin	228	57	1528789848	1006443687268642816	https://twitter.com/VitalikButerin/status/1006443687268642816			@ @ @
	Governments looking to use blockchains for IDs + voting should consider starting with petitions. It's a safer use case because petitions are non-binding so security risks are much smaller, but you can still take advantage of blockchains for verifiability and ZKPs for privacy.	VitalikButerin	1710	500	1528789704	1006443083855097856	https://twitter.com/VitalikButerin/status/1006443083855097856			
	Will give @ CelerNetwork @ PerunNetwork @ funfairtech mentions as I haven't mentioned them before. Too many teams to keep track of these days	VitalikButerin	208	40	1528786378	1006429131624538112	https://twitter.com/VitalikButerin/status/1006429131624538112			@ @ @
	To be clear, I do not endorse any state channel project over any other. I'm excited about ongoing progress in the ETH state channel ecosystem and look forward to continuing to work with everyone contributing to the space.	VitalikButerin	470	96	1528786359	1006429054331846657	https://twitter.com/VitalikButerin/status/1006429054331846657			
	That's a sidechain, not a channel :)	VitalikButerin	9	4	1528769003	1006356258171940864	https://twitter.com/VitalikButerin/status/1006356258171940864			
	Thanks. I think it crosses 3 million views today which is kind of cool and speaks to the point you made.https://twitter.com/LIFElabsHQ/status/1006529147798253569 …	dtapscott	9	1	1528835679	1006635917912821761	https://twitter.com/dtapscott/status/1006635917912821761			
	A pleasure having you involved! It’s an exciting time!https://twitter.com/obussmann/status/1006298397215739907 …	dtapscott	11	2	1528761694	1006325598896246784	https://twitter.com/dtapscott/status/1006325598896246784			
	. @ CharlieShrem & @ courtmwarner - the love grows stronger every day. I’m still feeling it!https://twitter.com/stacyherbert/status/1006454520677912576 …	maxkeiser	35	4	1528793770	1006460136414760960	https://twitter.com/maxkeiser/status/1006460136414760960			@ @
	L'un des meilleurs articles que j'ai lus sur ce qu'on peut faire avec des blockchains, soulignant en particulier l'importance de l'ux et modèle de gouvernancehttps://hackernoon.com/blockchain-governance-how-decentralized-do-we-need-to-be-799a7988ce84 …	babgi	188	92	1528813761	1006543987392569344	https://twitter.com/babgi/status/1006543987392569344			
	Data design : un remarquable ouvrage sur la datavizualisation, le rapport entre l'art et la technologie ; avec le soutien de la fondation @ EDFofficiel @ EDFpulse @ dbihanic # datavizpic.twitter.com/9ibbR6EK1b	babgi	39	24	1528812885	1006540312288878594	https://twitter.com/babgi/status/1006540312288878594		#	@ @ @
	Secteur informel : le numérique au secours des recettes des États ? http://af.lpnt.fr/2225443t # Economie une intéressante contribution	babgi	7	3	1528809888	1006527739665543171	https://twitter.com/babgi/status/1006527739665543171		#	
	Morale de l'histoire : ceux qui voudront participer à la déforestation mettront du biocarburant dans leur voiture et réciproquementhttp://www.liberation.fr/france/2018/06/08/biocarburant-total-jette-de-l-huile-de-palme-sur-le-feu_1657762?utm_campaign=Echobox&utm_medium=Social&utm_source=Twitter …	babgi	6	12	1528756607	1006304263767777282	https://twitter.com/babgi/status/1006304263767777282			
	74% of Banking Execs Believe AI Will Transform the Industry. Only 3% Plan to Retrain Their Teams. http://bit.ly/2GxGLap # banking # AI # MachineLearning # futureofwork @ BankingInsights @ DeepLearn007 @ ipfconline1 @ BourseetTrading @ jblefevre60 @ SpirosMargaris @ Fisher85Mpic.twitter.com/PsscTvj83k	JimMarous	74	67	1528830180	1006612851442704384	https://twitter.com/JimMarous/status/1006612851442704384		# # # #	@ @ @ @ @ @ @
	Machine Learning in Finance – Present and Future Applications http://bit.ly/2wRCsWV  HT: @ DeepLearn007 # banking # fintech # AI # MachineLearning # DeepLearning # BigData @ pierrepinna @ ipfconline1 @ SpirosMargaris @ psb_dc @ BourseetTrading @ TopCyberNews @ helene_wplipic.twitter.com/IB4U45PBfK	JimMarous	42	38	1528828500	1006605806136119296	https://twitter.com/JimMarous/status/1006605806136119296		# # # # # #	@ @ @ @ @ @ @ @
	To Succeed With AI, Invest in Humans http://bit.ly/2GxGLap # AI # MachineLearning # banking # TechTrends # futureofwork @ RAlexJimenez @ BourseetTrading @ WFSULLIVAN3 @ FinancialBrand @ rshevlin @ helene_wpli @ pierrepinna @ ipfconline1 @ BankingInsights @ AccentureDigipic.twitter.com/t06cGnx0xG	JimMarous	34	34	1528826700	1006598256179269634	https://twitter.com/JimMarous/status/1006598256179269634		# # # # #	@ @ @ @ @ @ @ @ @ @
	33 Tech Strategies Banks and Credit Unions Must Implement Immediately http://bit.ly/2CCdryf # banking # fintech # AI # MachineLearning # TechTrends # digitaltransformation @ DeepLearn007 @ WFSULLIVAN3 @ cgledhill @ psb_dc @ Fisher85M @ FinancialBrand @ Fisher85M @ ipfconline1pic.twitter.com/qWQK07Z3uf	JimMarous	32	28	1528824840	1006590454056402944	https://twitter.com/JimMarous/status/1006590454056402944		# # # # # #	@ @ @ @ @ @ @ @
	Trends in Digital Transformation http://bit.ly/2nSwsqM # Banking # AI # IoT # digital # fintech # transformation # MachineLearning @ DeepLearn007 @ evankirstel @ MikeQuindazzi @ ipfconline1 @ Fisher85M @ BourseetTrading @ antgrasso @ jblefevre60pic.twitter.com/DEyRZvwUtr	JimMarous	76	86	1528822980	1006582652617412609	https://twitter.com/JimMarous/status/1006582652617412609		# # # # # # #	@ @ @ @ @ @ @ @
	The Art and Science of Data Analytics in Financial Services http://bit.ly/2JcDQJF # banking # fintech # Analytics # BigData # AI # MachineLearning @ StrategyFintech @ pierrepinna @ Fisher85M @ Ronald_vanLoon @ TopCyberNews @ jblefevre60 @ Clagettpic.twitter.com/dGuJ11AFzj	JimMarous	19	17	1528821120	1006574850951954432	https://twitter.com/JimMarous/status/1006574850951954432		# # # # # #	@ @ @ @ @ @ @
	Technology Giants Pose Major Threat to Banking Industry http://bit.ly/2xqIqvb # banking # Tech # fintech # AI # MachineLearning @ DeepLearn007 @ ipfconline1 @ SpirosMargaris @ psb_dc @ FinancialBrand @ BourseetTrading @ BrettKing @ leimer @ WFSULLIVAN3 @ Efma_news @ fintechna @ Xbond49pic.twitter.com/9RtZJrfF2Q	JimMarous	18	24	1528819380	1006567554301562880	https://twitter.com/JimMarous/status/1006567554301562880		# # # # #	@ @ @ @ @ @ @ @ @ @ @ @
	The Importance of the Mobile Banking Consumer Continues to Increase http://bit.ly/2Mg0Xl2 # banking # fintech # finserv # mobile # Digital @ PwC_FinServ @ PwC @ MikeQuindazzi @ StrategyFintech @ cgledhillpic.twitter.com/HCZYXElZXq	JimMarous	10	15	1528818060	1006562016109084672	https://twitter.com/JimMarous/status/1006562016109084672		# # # # #	@ @ @ @ @
	At the same time, nearly 80% of the cost will remain in physical channels. Do we see a pattern here? @ BrettKing @ rshevlin @ pascalbouvier @ psb_dc @ RAlexJimenez @ leimer	JimMarous	4	1	1528817633	1006560225640448000	https://twitter.com/JimMarous/status/1006560225640448000			@ @ @ @ @ @
	In some cases, both will occur. Not often, but possible.	JimMarous	2	0	1528817510	1006559710911320064	https://twitter.com/JimMarous/status/1006559710911320064			
	Ignore research that says the majority of consumers WANT to walk into a branch to open a new account. http://bit.ly/2C91nbn # banking # finserv # digital # TechTrendspic.twitter.com/dejJwQ96xE	JimMarous	11	7	1528817280	1006558745055248384	https://twitter.com/JimMarous/status/1006558745055248384		# # # #	
	I like that the source is noted. I will not RT videos not in my wheelhouse or without source. Not on Twitter to watch without learning.	JimMarous	6	0	1528817258	1006558651438501890	https://twitter.com/JimMarous/status/1006558651438501890			
	Well done @ TopCyberNews	JimMarous	5	0	1528817080	1006557908073631745	https://twitter.com/JimMarous/status/1006557908073631745			@
	I accept all business payments by credit card via PayPal Business and make all business payments through PayPal as well. Only use traditional bank as holding tank. Has my ‘primary bank’ changed? Yup.pic.twitter.com/ZwFhd1dJEc	JimMarous	5	1	1528817033	1006557709041356800	https://twitter.com/JimMarous/status/1006557709041356800			
	[Must Read from @ rshevlin] The Cultural Differences Behind Megabanks’ And Smaller FIs’ IT Spend http://bit.ly/2JqEbZd # banking # fintech # IT @ DeepLearn007 @ leimer @ Chris_Skinner @ psb_dc @ evankirstel @ BourseetTrading @ Visible_Banking @ ipfconline1 @ WFSULLIVAN3 @ MikeQuindazzipic.twitter.com/yae3Izzl4w	JimMarous	7	8	1528815720	1006552202020675585	https://twitter.com/JimMarous/status/1006552202020675585		# # #	@ @ @ @ @ @ @ @ @ @ @
	What Is Machine Learning and Deep Learning and How to Use Them? http://bit.ly/2JimXNN  HT @ DeepLearn007 # AI # MachineLearning # DeepLearning # ML # DL # BigData # Analytics # TechTrends @ customerthink @ ipfconline1 @ MikeQuindazzi @ Fisher85M @ psb_dc @ antgrasso @ AntonioSelaspic.twitter.com/lMfMUqL8UP	JimMarous	37	27	1528813920	1006544652303036416	https://twitter.com/JimMarous/status/1006544652303036416		# # # # # # # #	@ @ @ @ @ @ @ @
	What are the Biggest Unresolved Problems with AI? http://bit.ly/2rLdeFw  HT @ ipfconline1 # AI # MachineLearning # ML # DL # analytics # bigdata # TechTrends @ DeepLearn007 @ pierrepinna @ andi_staub @ antgrasso @ jblefevre60 @ Fisher85Mpic.twitter.com/1vKvro4mvI	JimMarous	27	34	1528812121	1006537105168838657	https://twitter.com/JimMarous/status/1006537105168838657		# # # # # # #	@ @ @ @ @ @ @
	Top Banking Takeaways from Mary Meeker's 2018 Internet Trends Report http://bit.ly/2JcDa7C # banking # fintech # InternetTtends # mobile # mobilemarketing # VoiceFirst @ DeepLearn007 @ leimer @ BrettKing @ rshevlin @ WFSULLIVAN3 @ Shirastweet @ SpirosMargaris @ ipfconline1 @ psb_dcpic.twitter.com/ihxEUm1XKl	JimMarous	30	32	1528810320	1006529554742210561	https://twitter.com/JimMarous/status/1006529554742210561		# # # # # #	@ @ @ @ @ @ @ @ @
	Banks Play Catch Up With Technology As They Concede The Battle for Payments http://bit.ly/2sy0nX5 # banking # fintech # AI # MachineLearning # BigData # analytics # payments @ StrategyFintech @ stratorob @ BourseetTrading @ jblefevre60 @ psb_dc @ FinancialBrand @ SpirosMargaris @ Fisher85Mpic.twitter.com/F8SaMtHy4T	JimMarous	32	30	1528808580	1006522254786609154	https://twitter.com/JimMarous/status/1006522254786609154		# # # # # # #	@ @ @ @ @ @ @ @
	In banking, AI can improve performance by 50% over other analytics options. https://mck.co/2LBzbi3 # AI # MachineLearning # Analytics # ML # DeepLearning' @ DeepLearn007 @ ipfconline1 @ pierrepinna @ cgledhill @ jblefevre60 @ BrettKing @ leimer @ stratorob @ pascalbouvier @ psb_dcpic.twitter.com/Eh0rJAqxiu	JimMarous	27	34	1528806780	1006514704741617665	https://twitter.com/JimMarous/status/1006514704741617665		# # # # #	@ @ @ @ @ @ @ @ @ @
	The Rise of AI and Robotics HT @ MikeQuindazzi # AI # MachineLearning @ ML # Robotics # TechTrends @ PwC @ SpirosMargaris @ psb_dc @ jaypalter @ ipfconline1 @ pierrepinna @ guzmand @ Fisher85Mpic.twitter.com/xGn3AYYJfY	JimMarous	147	139	1528805760	1006510427126329344	https://twitter.com/JimMarous/status/1006510427126329344		# # # #	@ @ @ @ @ @ @ @ @ @
	Despite Strength of Branches, Banks Must Still Think Mobile-First http://bit.ly/2Mg0Xl2  New from @ PwC # banking # finserv # mobile # mobilebanking @ FinancialBrand @ BrettKing @ leimer @ SpirosMargaris @ MikeQuindazzi @ PwC_FinServ @ DeepLearn007 @ ipfconline1 @ jblefevre60 @ psb_dcpic.twitter.com/J7W0LPUyGw	JimMarous	24	17	1528805400	1006508916300115968	https://twitter.com/JimMarous/status/1006508916300115968		# # # #	@ @ @ @ @ @ @ @ @ @ @
	Open Banking Can Save Banking From Threat of Tech Giants. http://bit.ly/2JBIEVE  New from @ SridharmFino @ mFinoINC # banking # fintech # finserv # PSD2 # OpenBanking @ DeepLearn007 @ pascalbouvier @ FinancialBrand @ ipfconline1 @ SpirosMargaris @ BrettKing @ leimer @ Ronald_vanLoonpic.twitter.com/z4d5c6xIj0	JimMarous	45	39	1528803121	1006499359553277959	https://twitter.com/JimMarous/status/1006499359553277959		# # # # #	@ @ @ @ @ @ @ @ @ @
	2018 Google Search Trends in Banking, Fintech, AI and Marketing http://bit.ly/2JwjzzI # banking # fintech # finserv # AI # MarTech @ StrategyFintech @ Shirastweet @ TamaraMcCleary @ Tiffani_Bova @ chboursinpic.twitter.com/AfB3e9dfHd	JimMarous	10	11	1528803082	1006499193744183296	https://twitter.com/JimMarous/status/1006499193744183296		# # # # #	@ @ @ @ @
	"BBVA Executive Chairman, ""Fintech threatens to eclipse banks that do not adapt digitally."" https://on.ft.com/2JFuXVX # banking # fintech # finserv # innovation # digital # transformation @ bbva @ FT @ MikeQuindazzi @ jblefevre60 @ BourseetTrading @ fintechna @ psb_dcpic.twitter.com/wyoitB8clM"	JimMarous	49	52	1528801560	1006492810294505473	https://twitter.com/JimMarous/status/1006492810294505473		# # # # # #	@ @ @ @ @ @ @
	Thanks to the team at @ Geezeo for the great interview. https://geezeo.com/nation/one-one-geezeo-jim-marous … … # banking # fintech # finserv @ RAlexJimenez @ StrategyFintech @ antgrasso @ WFSULLIVAN3 @ Clagett @ psb_dc @ evankirstel @ fintechnapic.twitter.com/YYR8DrdZqJ	JimMarous	23	20	1528801417	1006492212786495488	https://twitter.com/JimMarous/status/1006492212786495488		# # #	@ @ @ @ @ @ @ @ @
	Sometimes feeling like a salmon swimming upstream I am sure.	JimMarous	1	0	1528800083	1006486616993685505	https://twitter.com/JimMarous/status/1006486616993685505			
	Biggest Google Search Trends 2018 # DigitalTransformation # CustomerJourney # CX # Chatbot # Fintech # AI # MachineLearning # Millennial # GenZ # Martech http://bit.ly/2JwjzzI @ DeepLearn007 @ FinancialBrand @ BrettKing @ leimer @ WFSULLIVAN3 @ cgledhill @ SpirosMargaris @ MikeQuindazzipic.twitter.com/BFSm8THVHO	JimMarous	131	111	1528796955	1006473495260422145	https://twitter.com/JimMarous/status/1006473495260422145		# # # # # # # # # #	@ @ @ @ @ @ @ @
	"BBVA Executive Chairman, ""Fintech threatens to eclipse banks that do not adapt digitally."" https://on.ft.com/2JFuXVX # banking # fintech # finserv # innovation # digital # transformation @ bbva @ FT @ MikeQuindazzi @ jblefevre60 @ BourseetTrading @ fintechna @ psb_dcpic.twitter.com/2UYb9g5pl4"	JimMarous	46	49	1528772492	1006370892522381312	https://twitter.com/JimMarous/status/1006370892522381312		# # # # # #	@ @ @ @ @ @ @
	Big Day for Acronym Changes # CFPB is now the # BCFP http://bit.ly/2Ml58fJ  Does the 'B' stand for Bureau, Burgers or Breakfast? # banking # fintech # finserv # IHOP # IHOb @ voxdotcom @ rshevlinpic.twitter.com/YZaKv9KaNI	JimMarous	7	7	1528771461	1006366564608827399	https://twitter.com/JimMarous/status/1006366564608827399		# # # # # # #	@ @
	Open Banking Can Save Banking From Threat of Tech Giants. http://bit.ly/2JBIEVE  New from @ SridharmFino @ mFinoINC # banking # fintech # finserv # PSD2 # OpenBanking @ DeepLearn007 @ pascalbouvier @ FinancialBrand @ ipfconline1 @ SpirosMargaris @ BrettKing @ leimer @ Ronald_vanLoonpic.twitter.com/3NTIVj3HlV	JimMarous	33	28	1528770809	1006363831189327872	https://twitter.com/JimMarous/status/1006363831189327872		# # # # #	@ @ @ @ @ @ @ @ @ @
	Are Your Prepared to Embrace Change, Take Risks and Disrupt Yourself? http://bit.ly/2rFlwip # banking # fintech # finserv # transformation # disruption @ FinancialBrand @ BrettKing @ leimer @ SpirosMargaris @ MikeQuindazzi @ Fisher85M @ ipfconline1 @ TamaraMcCleary @ Shirastweet @ rshevlinpic.twitter.com/MOOimqmdV2	JimMarous	61	63	1528761264	1006323795928473603	https://twitter.com/JimMarous/status/1006323795928473603		# # # # #	@ @ @ @ @ @ @ @ @ @
	Realists always look like optimists to pessimists and pessimists to optimists. Being realistic therefore requires a very high level of conviction in the face of opposition.	VinnyLingham	337	91	1528835282	1006634250219581440	https://twitter.com/VinnyLingham/status/1006634250219581440			
	That assumption is based on there only ever being two SHA256 mineable coins at scale.	VinnyLingham	0	0	1528782620	1006413372714184704	https://twitter.com/VinnyLingham/status/1006413372714184704			
	Unless a decoupling occurs, I would concur.	VinnyLingham	3	0	1528782059	1006411019294420992	https://twitter.com/VinnyLingham/status/1006411019294420992			
	How realistic is the so-called death spiral scenario?	VinnyLingham	0	0	1528782003	1006410783662604288	https://twitter.com/VinnyLingham/status/1006410783662604288			
	Why not mine a more profitable coin at that point?	VinnyLingham	1	0	1528780864	1006406005142376448	https://twitter.com/VinnyLingham/status/1006406005142376448			
bitcoin 	Bitcoin also has an economic attack surface which is as yet, untested. What happens in a world where miners have alternatives and the Bitcoin price drops below marginal cost of production. Maybe we’ll find out, maybe we won’t...https://twitter.com/kylesamani/status/1006366936530391041 …	VinnyLingham	54	13	1528771674	1006367461040578560	https://twitter.com/VinnyLingham/status/1006367461040578560			
	That opinion is very unpopular, trust me I know.... Welcome to my world, @ eric_lombrozo!https://twitter.com/eric_lombrozo/status/1006360806659780608 …	VinnyLingham	37	6	1528770826	1006363903989694465	https://twitter.com/VinnyLingham/status/1006363903989694465			@
	Really? Have you looked at the carrying costs of hedging lately?	VinnyLingham	2	0	1528760338	1006319912103448576	https://twitter.com/VinnyLingham/status/1006319912103448576			
bitcoin 	Doesn’t matter. You can’t kill Bitcoin.	VinnyLingham	9	2	1528760239	1006319496926150656	https://twitter.com/VinnyLingham/status/1006319496926150656			
bitcoin 	If Bitcoin dies, I guarantee it will be reincarnated https://twitter.com/wadhwa/status/1006163958170963968 …	VinnyLingham	179	33	1528760113	1006318967546249216	https://twitter.com/VinnyLingham/status/1006318967546249216			
	That economic incentive only works when the price is rising, which is when all the verbal insults and attacks on miners won’t result in repercussions. If the price drops too low, I’d be a bit more careful if I were you... Economic slavery never lasts forever...	VinnyLingham	6	4	1528759923	1006318172876574720	https://twitter.com/VinnyLingham/status/1006318172876574720			
	Already in progress	VinnyLingham	8	0	1528755077	1006297847078121472	https://twitter.com/VinnyLingham/status/1006297847078121472			
	"Its simple: Life sucks, then you die. The secret is to minimize the suckiness, maximize the mirth, and delay the ""and then"" by any means possible."	officialmcafee	17	3	1528837247	1006642491997786112	https://twitter.com/officialmcafee/status/1006642491997786112			
	Thank you.	officialmcafee	7	2	1528830291	1006613315597021184	https://twitter.com/officialmcafee/status/1006613315597021184			
	Not possible. Sober time is unscheduled and limited. I must do the best with what little I have.	officialmcafee	27	6	1528830138	1006612674359320577	https://twitter.com/officialmcafee/status/1006612674359320577			
	Ty	officialmcafee	2	0	1528829988	1006612046794973184	https://twitter.com/officialmcafee/status/1006612046794973184			
	Not sure	officialmcafee	6	1	1528829894	1006611652530376704	https://twitter.com/officialmcafee/status/1006611652530376704			
	True	officialmcafee	3	0	1528829852	1006611474180202501	https://twitter.com/officialmcafee/status/1006611474180202501			
	Yes	officialmcafee	1	0	1528827791	1006602831401537537	https://twitter.com/officialmcafee/status/1006602831401537537			
	Ty	officialmcafee	13	0	1528827708	1006602482879954944	https://twitter.com/officialmcafee/status/1006602482879954944			
	45 days. 45 days. Watch and learn	officialmcafee	29	5	1528827639	1006602193644998656	https://twitter.com/officialmcafee/status/1006602193644998656			
	Too bad.	officialmcafee	4	0	1528825997	1006595307365453824	https://twitter.com/officialmcafee/status/1006595307365453824			
	Good man	officialmcafee	5	0	1528825960	1006595152692109312	https://twitter.com/officialmcafee/status/1006595152692109312			
	You will not regret it.	officialmcafee	7	0	1528825930	1006595025881436160	https://twitter.com/officialmcafee/status/1006595025881436160			
	No problem	officialmcafee	7	1	1528825902	1006594909187473408	https://twitter.com/officialmcafee/status/1006594909187473408			
	Ty	officialmcafee	4	0	1528825873	1006594787489787910	https://twitter.com/officialmcafee/status/1006594787489787910			
	True	officialmcafee	4	0	1528825817	1006594553602805761	https://twitter.com/officialmcafee/status/1006594553602805761			
	Next time	officialmcafee	6	0	1528825801	1006594486556905472	https://twitter.com/officialmcafee/status/1006594486556905472			
	You bet	officialmcafee	13	0	1528825780	1006594395745988608	https://twitter.com/officialmcafee/status/1006594395745988608			
	"No clue. I was drunk when I typed it, I could possibly have meant: ""I am slamming the SEC"", or ""Islam = the SEC"", or ""I'm scamming the SEC"", or ""the SEC is lame"". Seriously, I have no fucking clue""."	officialmcafee	1078	68	1528824947	1006590902893203456	https://twitter.com/officialmcafee/status/1006590902893203456			
	This will be the Woodstock of Crypto. The largest Crypto gathering in history. Come if you can. It will be something to tell your grandchildren about.https://cryptovest.com/news/bwc-set-to-be-biggest-crypto-event-ever-big-ticket-price-too/ …	officialmcafee	634	199	1528818746	1006564894655774721	https://twitter.com/officialmcafee/status/1006564894655774721			
	https://cryptoslate.com/mcafee-vs-the-sec-renegade-security-expert-challenges-sec-to-debate-on-cryptocurrencies/ …	officialmcafee	273	64	1528818491	1006563822667214848	https://twitter.com/officialmcafee/status/1006563822667214848			
	http://cryptonewsreview.com/john-mcafee-vows-to-include-as-much-of-the-cryptocurrency-world-as-i-can-in-his-us-presidential-bid/ …	officialmcafee	226	57	1528818465	1006563713715974144	https://twitter.com/officialmcafee/status/1006563713715974144			
	https://ambcrypto.com/john-mcafee-supports-docademic-mtc-small-coins-big-promotions/ …	officialmcafee	120	27	1528818449	1006563647466897408	https://twitter.com/officialmcafee/status/1006563647466897408			
	https://blokt.com/news/john-mcafee-on-his-run-for-president-ill-be-including-as-much-of-the-crypto-world-as-i-can …	officialmcafee	129	34	1528818407	1006563473663365122	https://twitter.com/officialmcafee/status/1006563473663365122			
bitcoin 	https://globalcoinreport.com/do-not-panic-about-bitcoins-btc-drop-advises-john-mcafee/ …	officialmcafee	351	112	1528818385	1006563382051385344	https://twitter.com/officialmcafee/status/1006563382051385344			
	https://medium.com/@info_87835/heres-why-john-mcafee-will-use-clearpoll-during-his-presidential-campaign-9cd81938a5c7 …	officialmcafee	128	31	1528813259	1006541881847803904	https://twitter.com/officialmcafee/status/1006541881847803904			@info_87835
	Another informative article about currency independence from cryptoslate:https://cryptoslate.com/what-is-currency-independence-and-why-is-it-important/ …	officialmcafee	165	40	1528812764	1006539802999689217	https://twitter.com/officialmcafee/status/1006539802999689217			
	Pyramid silver menthol.	officialmcafee	3	0	1528811699	1006535338280587267	https://twitter.com/officialmcafee/status/1006535338280587267			
	Still ongoing	officialmcafee	5	1	1528808988	1006523965412708352	https://twitter.com/officialmcafee/status/1006523965412708352			
