	I did not consider the top to be a symmetrical triangle according to classical charting (Schabacker) guidelines. Mostly mute point, but I labeled a blow-off parabolic top followed by rising wedge.pic.twitter.com/HCQa48p1ha	PeterLBrandt	3	0	1530142517	1012117192983314432	https://twitter.com/PeterLBrandt/status/1012117192983314432			
	Don't get me wrong, I am extremely constructive on cryptos once all but 20 or so of the survivors emerge. Similar to dotcom bubble of 2000 -- key is finding the winners afterwards. My bet is on $ btcusd	PeterLBrandt	127	12	1530142054	1012115251310092288	https://twitter.com/PeterLBrandt/status/1012115251310092288			
	Perhaps your right, but that is a HUGE assumption to make. I just returned from Scotland visiting a friend -- one of Europe's largest and most successful institutional & proprietary traders. He has NOOOO interest in cryptos.	PeterLBrandt	71	1	1530141775	1012114081267048448	https://twitter.com/PeterLBrandt/status/1012114081267048448			
	They need to stop fucking speculating and read the damn white paper ... The $10 bln is to cover the family of four tokens ... DIG ($3 bln) is only one of them.	RonnieMoas	8	1	1530219810	1012441384425541632	https://twitter.com/RonnieMoas/status/1012441384425541632			
	$ DIG ... I am not pumping anything ... I am trying to offset the garbage and misinformation posted online about a legitimate and undervalued name 100s of my subscribers are in. Here is the DIG conference call recording for anyone who wants to listen ...https://youtu.be/zDNmGord3JM	RonnieMoas	91	27	1530217850	1012433161798782978	https://twitter.com/RonnieMoas/status/1012433161798782978			
	$ DIG Never ceases to amaze me; the unproductive/underachieving idiots who lurk around here w/ nothing better to do than to criticize. Some people have such low self-esteem & it makes them feel better about themselves to treat others like garbage. Post shit here & you get blocked.	RonnieMoas	99	13	1530217047	1012429795303575554	https://twitter.com/RonnieMoas/status/1012429795303575554			
	This is the company that is involved in the $10 billion deal with $ DIG ... http://scotiacorp.com/ingles/photos.htm …	RonnieMoas	82	26	1530214222	1012417946734551040	https://twitter.com/RonnieMoas/status/1012417946734551040			
	Thanks Jules	RonnieMoas	5	1	1530213587	1012415279316561926	https://twitter.com/RonnieMoas/status/1012415279316561926			
	$ DIG conference call ...https://twitter.com/julpi/status/1012413953362857984 …	RonnieMoas	47	11	1530213420	1012414580566487040	https://twitter.com/RonnieMoas/status/1012414580566487040			
	I just landed in Moscow. I missed the $ DIG conf call. I will send a long note to my subscribers in the next 24 hours. See previous tweet ... excerpt from c/c transcript. The name of the trading firm may not be spelled properly. The scum who post here will be blocked immediately.	RonnieMoas	28	6	1530213187	1012413605390749696	https://twitter.com/RonnieMoas/status/1012413605390749696			
	$ DIG recreated a gold standard for the sector. In partnership with Sion Trading FZE, out of Dubai, one of the only licensed gold traders on the Dubai Gold Exchange, DIG will be granted $10 bln worth of gold. Agreements are in place & signed, & the bullion will be held at Brinks.	RonnieMoas	251	87	1530212921	1012412489995350016	https://twitter.com/RonnieMoas/status/1012412489995350016			
	Last time I was in # Russia # MichaelJackson died ... today I am flying to # Russia and just found out his father passed away at age 89.	RonnieMoas	21	1	1530178821	1012269460575653893	https://twitter.com/RonnieMoas/status/1012269460575653893		# # #	
	$ DIG I'll be on a flight to Moscow & will miss this call. Significant news expected today ... & shortly thereafter ... in the coming days & weeks. Up 600% since my recommendation. Price target is > $0.40 near-term & $0.50-$0.75 shortly thereafter ...https://globenewswire.com/news-release/2018/06/23/1528568/0/en/CORRECTING-and-REPLACING-PRESS-ALERT-INVITATION-Arbitrade-to-Hold-a-Press-Conference-on-June-28th-From-Bermuda-Its-New-Global-Headquarters.html …	RonnieMoas	115	26	1530165593	1012213981728079873	https://twitter.com/RonnieMoas/status/1012213981728079873			
	The # Queen concert in # Rotterdam # Holland this evening was excellent ... it ran more than two hours ... they came in with seven truck loads of equipment ... and # AdamLambert does a good job replacing # FreddieMercury.pic.twitter.com/zLm0mu1YGQ	RonnieMoas	44	6	1530139686	1012105317684076545	https://twitter.com/RonnieMoas/status/1012105317684076545		# # # # #	
	Not possible due to the private nature of channel updates.	lopp	1	0	1530216211	1012426288865431553	https://twitter.com/lopp/status/1012426288865431553			
	Hmmmm looks like they deleted the announcement page but left the link to it on their news page.	lopp	5	0	1530209287	1012397244157394944	https://twitter.com/lopp/status/1012397244157394944			
	A blockchain only gives you tamper evidence; the rest of the protocol built around such a data structure is incredibly important. Is is possible to build permissioned / private blockchains that help minimize trust amongst a group of participants. It's not guaranteed to add value.	lopp	7	1	1530209087	1012396407142211584	https://twitter.com/lopp/status/1012396407142211584			
bitcoin 	@ BitcoinVisuals	lopp	2	0	1530208938	1012395780597043200	https://twitter.com/lopp/status/1012395780597043200			@
	Already on my to-do listhttps://github.com/jlopp/lopp.net/issues/101 …	lopp	2	0	1530204234	1012376052663029761	https://twitter.com/lopp/status/1012376052663029761			
	Right - looks like their node gets restarted about once a month.	lopp	2	0	1530198160	1012350577483898880	https://twitter.com/lopp/status/1012350577483898880			
bitcoin 	Nope, belongs to @ BitcoinVisuals	lopp	2	0	1530196317	1012342844420476929	https://twitter.com/lopp/status/1012342844420476929			@
bitcoin 	Bitcoin visualizations! Bitcoin visualizations! Get your Bitcoin visualizations athttps://bitcoinvisuals.com/	lopp	455	239	1530195560	1012339670187986944	https://twitter.com/lopp/status/1012339670187986944			
	Looks like another block storm, happens from time to time. https://web.archive.org/web/20160910173004/https://blog.blocktrail.com/2015/04/in-the-darkest-depths-of-testnet3-16k-blocks-were-found-in-1-day/ …	lopp	6	0	1530193932	1012332841202577411	https://twitter.com/lopp/status/1012332841202577411			
	"""Blockchain governance"" has been conceptually stretched to the point of near meaninglessness. - @ nic__carter"	lopp	156	32	1530193767	1012332149700288518	https://twitter.com/lopp/status/1012332149700288518			@
	As with any network protocol, you can change the rules you are following. But since this is a network, in order for changes to be usable you need others on the network to agree with you.	lopp	15	0	1530193055	1012329162433056768	https://twitter.com/lopp/status/1012329162433056768			
	"The votes have been tallied and the official Zcash mascot is now the ""zeal"" - a collection of zebras!pic.twitter.com/YcV2qc7AUF"	lopp	69	11	1530192236	1012325726853484545	https://twitter.com/lopp/status/1012325726853484545			
	What I love about Ethernet: the people who love it most have already abandoned it in their hearts, and spend their days fantasizing about a totally new network that’s nothing like it.	lopp	83	4	1530189094	1012312550975967232	https://twitter.com/lopp/status/1012312550975967232			
	It's not going to have much effect to change only your wallet's limits if everyone else is still abiding by the standard rules.	lopp	4	0	1530188385	1012309574588739584	https://twitter.com/lopp/status/1012309574588739584			
	The safety limits were implemented because there was general agreement that it was a good idea; anyone who cares should participate in the protocol development process and let their wishes be known.	lopp	39	0	1530187065	1012304039059578880	https://twitter.com/lopp/status/1012304039059578880			
	The max allowed payment value is currently 0.042 BTC while the max channel funding value is 0.168 BTC. The difficulty in making payments over $100 is by design (for safety) and easily changed when developers are confident in the robustness of the network.https://twitter.com/Snyke/status/1012273459186012160?s=19 …	lopp	568	127	1530185471	1012297354312126464	https://twitter.com/lopp/status/1012297354312126464			
	Just your standard block storm; some explorers either break or don't bother trying to keep up until it's over. This is due to a special testnet edge case: https://web.archive.org/web/20160910173004/https://blog.blocktrail.com/2015/04/in-the-darkest-depths-of-testnet3-16k-blocks-were-found-in-1-day/ …	lopp	2	0	1530184099	1012291601467572226	https://twitter.com/lopp/status/1012291601467572226			
	Monero is a strong project - I wouldn't dismiss it.	lopp	57	11	1530147236	1012136983320199168	https://twitter.com/lopp/status/1012136983320199168			
	"""Switching to Monero is always an option."" - @ zooko"	lopp	367	30	1530145458	1012129526652993536	https://twitter.com/lopp/status/1012129526652993536			@
	Zcon0 caters to all dietary requirements, including crypto carnivores.pic.twitter.com/vvmKGwf6bS	lopp	152	13	1530144297	1012124657338724352	https://twitter.com/lopp/status/1012124657338724352			
	"""The price of crypto is the least interesting thing about it."" - @ MiguelCuneta @ e27co # Echelon2018pic.twitter.com/k6nQhRCFVC"	onemanatatime	22	10	1530155732	1012172618999296000	https://twitter.com/onemanatatime/status/1012172618999296000		#	@ @
	Surf's up... $ BTCpic.twitter.com/OptYL618mI	CryptoHustle	63	8	1530220246	1012443211216941061	https://twitter.com/CryptoHustle/status/1012443211216941061			
	Bot and AI in # trading.https://cryptohustle.com/robotics-and-ai-in-trading …	CryptoHustle	38	9	1530219941	1012441930234548224	https://twitter.com/CryptoHustle/status/1012441930234548224		#	
bitcoin 	I heard a rumour from a credible anonymous source on bitcointalk... a donkey head in a space suit just confirmed that the People's Bank of China will include $ DOGE in a basket of currencies... Please keep this hush hush.	CryptoHustle	120	11	1530193626	1012331557015769091	https://twitter.com/CryptoHustle/status/1012331557015769091			
bitcoin 	Never trust a perma-bull to show you accumulation levels on bitcoin... especially if their chart is really popular.	CryptoHustle	166	11	1530188253	1012309022530252800	https://twitter.com/CryptoHustle/status/1012309022530252800			
	Welcome to the community!	CryptoHustle	3	0	1530143313	1012120532790194177	https://twitter.com/CryptoHustle/status/1012120532790194177			
	Happy birthday E!https://twitter.com/elonmusk/status/1012416542724665346 …	westcoastbill	572	12	1530217296	1012430839240691713	https://twitter.com/westcoastbill/status/1012430839240691713			
	Bird doesn't compete with Uber - it competes with walking.	westcoastbill	1	0	1530215312	1012422517338853376	https://twitter.com/westcoastbill/status/1012422517338853376			
	. @ BirdRide continuing to pioneer the scooter space.https://www.bloomberg.com/news/articles/2018-06-28/bird-ceo-explains-why-his-scooter-startup-needed-300-million …	westcoastbill	3	0	1530205917	1012383110246232064	https://twitter.com/westcoastbill/status/1012383110246232064			@
	Congrats guys!https://twitter.com/crv/status/1012314547649040384 …	westcoastbill	4	0	1530191532	1012322774805860354	https://twitter.com/westcoastbill/status/1012322774805860354			
	Congrats team!https://twitter.com/pillpack/status/1012316678473076736 …	westcoastbill	5	1	1530191429	1012322342385659905	https://twitter.com/westcoastbill/status/1012322342385659905			
	Send it over	CharlieShrem	0	0	1530197557	1012348048050094081	https://twitter.com/CharlieShrem/status/1012348048050094081			
	"I love opening this bridge when we boat through it! ""Blackburn Point Bridge, this is SATOSHI at mile marker 31, requesting an opening at your leisure""https://www.sarasotamagazine.com/articles/2018/6/27/only-in-sarasota-blackburn-point-bridge#.WzTufbsxqFI.twitter …"	CharlieShrem	14	3	1530195645	1012340028532514818	https://twitter.com/CharlieShrem/status/1012340028532514818		#	
	Have fun my friend!	CharlieShrem	0	0	1530194218	1012334043940171776	https://twitter.com/CharlieShrem/status/1012334043940171776			
	I mostly work with the European and Asian timezones, so the 6am-noon EST work day works for me.	CharlieShrem	4	0	1530191506	1012322667012206593	https://twitter.com/CharlieShrem/status/1012322667012206593			
	Bottom indicator?https://www.quora.com/Is-there-any-chance-of-revival-for-the-cryptocurrency-market-My-initial-investment-is-down-to-40-till-now-June-11-2018?share=306b7fcf …	CharlieShrem	46	18	1530189802	1012315521629523972	https://twitter.com/CharlieShrem/status/1012315521629523972			
	8/ I leave my afternoon hours free of set meetings and calls, this way I can work on my personal life development and do the things I love about Crypto. Those almost always lead to more business opportunities anyway.	CharlieShrem	159	5	1530188270	1012309092344516608	https://twitter.com/CharlieShrem/status/1012309092344516608			
	"7/ ""That is, he should walk among the willows, read a timeless text, converse with a friend beneath the pergola, or reflect before the fire—engaging in those endeavors that have no appointed hour, and that dictate their own beginnings and ends.”"	CharlieShrem	79	9	1530188269	1012309091329429505	https://twitter.com/CharlieShrem/status/1012309091329429505			
	"6/ ""In the afternoon, the Count’s father believed that a man should take care not to live by the watch in his waistcoat—marking the minutes as if the events of one’s life were stations on a railway line. Rather, he should spend his afternoon in wise liberty."""	CharlieShrem	64	6	1530188268	1012309085293830144	https://twitter.com/CharlieShrem/status/1012309085293830144			
	"5/ ""When the noon bell sounded, the diligent man could take pride in having made good use of the morning and sit down to his lunch with a clear conscience."""	CharlieShrem	62	7	1530188268	1012309084287262720	https://twitter.com/CharlieShrem/status/1012309084287262720			
	"4/ ""The Count’s father believed that our Creator had set aside the morning hours for industry. If a man woke no later than six, engaged in a light repast, and then applied himself without interruption, by the hour of noon he should have accomplished a full day’s labor."""	CharlieShrem	102	19	1530188267	1012309083238608897	https://twitter.com/CharlieShrem/status/1012309083238608897			
	"3/ This quote from ""A Gentleman in Moscow"" by @ amortowles perfectly explains:"	CharlieShrem	36	5	1530188267	1012309082483646465	https://twitter.com/CharlieShrem/status/1012309082483646465			@
	2/ In prison, its lights out by 10pm and you have to be awake standing by your perfectly made bed by 530am for inspection. This conditioned me to change my habit when I got out. My day starts around 6/7am and I'm usually finished with my most productive work by noon.	CharlieShrem	69	3	1530188267	1012309081124720640	https://twitter.com/CharlieShrem/status/1012309081124720640			
bitcoin 	1/ I used to be a big night person, in fact I learnt about # Bitcoin in an IRC chat room around 3am. I would wake up late in the day and stay awake into the wee hours of the night. I used to think this was production, but prison changed that.	CharlieShrem	379	66	1530188267	1012309080113807361	https://twitter.com/CharlieShrem/status/1012309080113807361		#	
	8th time will be the charm. Trillion dollar ICO incoming.	WhalePanda	39	0	1530216762	1012428598517616643	https://twitter.com/WhalePanda/status/1012428598517616643			
	I used to, I cancelled my hosting but still have the domain :)	WhalePanda	1	0	1530210351	1012401708146876416	https://twitter.com/WhalePanda/status/1012401708146876416			
	"4) ""The Foundation should be open to discussing changes to monetary policy and/or supply schedule."" 31 agree vs 33 disagree, that was a close call. I have been hearing rumors about extending the founders rewards for 4 more years. Guess that's off the table.. for now."	WhalePanda	20	1	1530193114	1012329411994095618	https://twitter.com/WhalePanda/status/1012329411994095618			
	ZCash governance through voting. 1) ASIC resistance is not a priority (no new PoW at this time so Jihan can keep mining with his ASICs) 2) Plan to migrate to new PoW by the end of 2020. 3) new ZCash foundation board members elected https://vote.heliosvoting.org/helios/elections/cdc15aa6-6f75-11e8-b5e0-0e48ec97cebb/view …	WhalePanda	52	8	1530192994	1012328907490713600	https://twitter.com/WhalePanda/status/1012328907490713600			
	FUD: Facts U Dislike.	WhalePanda	474	81	1530187667	1012306563783102465	https://twitter.com/WhalePanda/status/1012306563783102465			
	"We're at the point that critics accept that it works ""I can buy 1 coffee with it, but not 2!"". More people are setting up their channels for bigger amounts with the implementations maturing and more testing being done. Payment processors like @ GlobeeCom are also adding support."	WhalePanda	142	19	1530184292	1012292411115098113	https://twitter.com/WhalePanda/status/1012292411115098113			@
	Evolution of LN fud: LN won't launch anytime soon →LN launches → it's too complicated to set up → easy to use implementations like @ acinq_co's eclair & @ ln_zap → No one uses it →more nodes than $ BCH →No place to use it → @ Blockstream store, Lightning spin, satoshisplace,..	WhalePanda	405	100	1530184257	1012292260627734528	https://twitter.com/WhalePanda/status/1012292260627734528			@ @ @
	Stop reading my mind.	WhalePanda	18	0	1530182651	1012285525330399232	https://twitter.com/WhalePanda/status/1012285525330399232			
bitcoin 	Gambling was one of the primary uses of Bitcoin, we had satoshi dice back in the day, people loved it, I never used it since I'm not that kind of a gambler. It's a solid use case. I personally would also love to see more games and other things but people want what they want.	WhalePanda	3	0	1530182633	1012285452815093760	https://twitter.com/WhalePanda/status/1012285452815093760			
	3/10 Please try again.	WhalePanda	123	2	1530182340	1012284220390215682	https://twitter.com/WhalePanda/status/1012284220390215682			
bitcoin 	Great thread on what cash really should be like from someone who basically lives on # Bitcoin.https://twitter.com/waxwing__/status/1012221025503891456 …	WhalePanda	73	28	1530182245	1012283821616746497	https://twitter.com/WhalePanda/status/1012283821616746497		#	
bitcoin 	With the rise of the # Bitcoin fees an often heard criticism was that people can no longer use it for micro-payments and things like satoshi dice. Now we already have https://www.lightningspin.com/  and I'm sure more gambling websites will pop up. I prefer to gamble on altcoins and Bitmex	WhalePanda	243	55	1530174484	1012251271447875584	https://twitter.com/WhalePanda/status/1012251271447875584		#	
	Great stuff from my friend ⁦ @ m2jr⁩: “Crypto Commons” by @ floodgatefundhttps://medium.com/@m2jr/crypto-commons-da602fb98138?source=twitterShare-93aa7d62f870-1530215302 …	AriannaSimpson	16	5	1530215344	1012422651762151424	https://twitter.com/AriannaSimpson/status/1012422651762151424			@ @ @m2jr
	Thanks Richard!	AriannaSimpson	1	0	1530213482	1012414840684490753	https://twitter.com/AriannaSimpson/status/1012414840684490753			
	Haha I didn’t win!	AriannaSimpson	0	0	1530205138	1012379842086686721	https://twitter.com/AriannaSimpson/status/1012379842086686721			
	Woo hoo! Congrats Saar!	AriannaSimpson	2	0	1530201548	1012364786292744192	https://twitter.com/AriannaSimpson/status/1012364786292744192			
	Thanks Medha!	AriannaSimpson	0	0	1530199257	1012355175057690626	https://twitter.com/AriannaSimpson/status/1012355175057690626			
	Thanks Andrew!	AriannaSimpson	1	0	1530197787	1012349009715974144	https://twitter.com/AriannaSimpson/status/1012349009715974144			
	Congrats to you guys and the team!!	AriannaSimpson	2	0	1530195608	1012339870751252480	https://twitter.com/AriannaSimpson/status/1012339870751252480			
	Of course! Happy to help however I can.	AriannaSimpson	5	0	1530193983	1012333056479375360	https://twitter.com/AriannaSimpson/status/1012333056479375360			
	I replied to your email - unfortunately have a conflict and can’t make it.	AriannaSimpson	0	0	1530193966	1012332985373331456	https://twitter.com/AriannaSimpson/status/1012332985373331456			
	Big congrats to @ AmberBaldet and @ secparam on willing the @ ZcashFoundation board vote! I have no doubt they will be great additions to the Foundation board. https://twitter.com/socrates1024/status/1012326235358224386 …	AriannaSimpson	20	2	1530193555	1012331262160310272	https://twitter.com/AriannaSimpson/status/1012331262160310272			@ @ @
	Must you really turn everything good into something negative?! Geez, what a way to live.	AriannaSimpson	4	0	1530192525	1012326939842007040	https://twitter.com/AriannaSimpson/status/1012326939842007040			
	I think we could all stand to be a little more self critical, and less critical of others in the space.	AriannaSimpson	65	2	1530191564	1012322911603101701	https://twitter.com/AriannaSimpson/status/1012322911603101701			
	In the excitement to criticize @ zooko’s compensation (which by the way is paid in ZEC and only worth a lot now because of the work done by him + team) nobody bothered to notice that he donated over $1M to http://givecrypto.org .https://buff.ly/2N2Zf74	AriannaSimpson	144	16	1530191495	1012322619595657216	https://twitter.com/AriannaSimpson/status/1012322619595657216			@
	Thanks Gillian!	AriannaSimpson	1	0	1530177815	1012265244687728640	https://twitter.com/AriannaSimpson/status/1012265244687728640			
	Thanks Saar!!	AriannaSimpson	2	0	1530167064	1012220149288579072	https://twitter.com/AriannaSimpson/status/1012220149288579072			
	Thanks Matt!	AriannaSimpson	2	0	1530167050	1012220091692474370	https://twitter.com/AriannaSimpson/status/1012220091692474370			
	Congrats to Masha and Alexandra for launching CryptoPR labs! These ladies have some serious hustle.http://www.forbes.com/sites/katieelizabeth1/2018/06/26/crypto-is-booming-where-are-the-women/#7828914b1a3f …	AriannaSimpson	45	5	1530142486	1012117063341690880	https://twitter.com/AriannaSimpson/status/1012117063341690880		#7828914b1a3f	
	Thanks, Judith!	AriannaSimpson	1	0	1530142182	1012115788713680896	https://twitter.com/AriannaSimpson/status/1012115788713680896			
	Thanks Andrea!	AriannaSimpson	1	0	1530139916	1012106282847830016	https://twitter.com/AriannaSimpson/status/1012106282847830016			
	Who are they?	AriannaSimpson	0	0	1530139690	1012105332859064320	https://twitter.com/AriannaSimpson/status/1012105332859064320			
	Thanks Sharon!	AriannaSimpson	0	0	1530137585	1012096504784355329	https://twitter.com/AriannaSimpson/status/1012096504784355329			
	Super appreciate the support, Matt! Am pretty sure you were the first yes	AriannaSimpson	3	0	1530137393	1012095701893951490	https://twitter.com/AriannaSimpson/status/1012095701893951490			
	Hahaha @ zsims might beg to differ	AriannaSimpson	1	0	1530137360	1012095562005524480	https://twitter.com/AriannaSimpson/status/1012095562005524480			@
	couldn’t help myself	VentureCoinist	1	0	1530204887	1012378790000054272	https://twitter.com/VentureCoinist/status/1012378790000054272			
	my height + serious lack of flexibility has caused this a few times	VentureCoinist	2	0	1530204550	1012377379333922818	https://twitter.com/VentureCoinist/status/1012377379333922818			
	i wish i was kidding	VentureCoinist	0	0	1530204464	1012377018254667779	https://twitter.com/VentureCoinist/status/1012377018254667779			
	i have a while until 30, which is the scary part	VentureCoinist	2	0	1530204354	1012376554985459712	https://twitter.com/VentureCoinist/status/1012376554985459712			
	Tweaked my back when I got out bed today to the point where I can’t stand up on my own. Thank you CT for making it a little more bearable	VentureCoinist	134	3	1530204273	1012376216974823424	https://twitter.com/VentureCoinist/status/1012376216974823424			
	Hey Noob, i have been doing this a lot longer than you, just look at my follower numbers... i have public articles and videos going back to mid 2014 when i was calling for a bottom at $110 from $700 (missed it by $40)	ToneVays	169	9	1530214672	1012419833651257345	https://twitter.com/ToneVays/status/1012419833651257345			
	Name me something openly traded that ISN'T manipulated... good luck... Manipulation is just an excuse people say for bad trades they are on the wrong side of. People also think that if someone with more money then them trade they are manipulaters.	ToneVays	69	5	1530214501	1012419116160995328	https://twitter.com/ToneVays/status/1012419116160995328			
	i am teaching a trading Workshop in Boston Aug 4th	ToneVays	0	0	1530202510	1012368821708091392	https://twitter.com/ToneVays/status/1012368821708091392			
ripple 	you should read that again, the FACT that $ XRP is a totally unnecessary scam coin continues fool everyone associated with @ Ripple ... hence by default, anyone association with # Ripple is either a scammer or ignorant/stupid.	ToneVays	8	0	1530202411	1012368406991994881	https://twitter.com/ToneVays/status/1012368406991994881		#	@
bitcoin 	Armstrong does not understand the decentralized tech of # Bitcoin, so he sees $ BTC more like the Petro, but his understanding of Gold vs Fiat/cash vs Electronic money is generally correct.	ToneVays	6	0	1530202215	1012367582505127938	https://twitter.com/ToneVays/status/1012367582505127938		#	
	no, i explained in last nights video during QA... what if Amazon accepted btc	ToneVays	0	0	1530201859	1012366089844674560	https://twitter.com/ToneVays/status/1012366089844674560			
	i dont what increased liquidity means in this context... for example, # Doge has more transactions per second and is more liquid than # BCash.	ToneVays	0	0	1530193077	1012329255814955009	https://twitter.com/ToneVays/status/1012329255814955009		# #	
