currency	tweet	username	favorites	retweets	date	id	permalink	geo	hashtags	mentions	sent	vader_sent
bitcoin 	High fees on #Bitcoin suck, but some things to keep in mind: 1) fees are calculated in sats, high Bitcoin price = higher fee in USD. 2) Miners have an incentive to spam mempool with low fee txs = real users pay higher fees on which they profit. 3) fee estimators in wallets suck.	WhalePanda	407	144	1514037011	944565802832941056	https://twitter.com/WhalePanda/status/944565802832941056		#Bitcoin		0.31	-0.1058
	3/ it’s in the interest of $ BTC , $ BCH , and the rest of #crypto that these two communities go their separate ways and leave each other alone.	cburniske	72	9	1514055442	944643110692417536	https://twitter.com/cburniske/status/944643110692417536		#crypto		0.33	0.2023
	2/ These two #cryptoassets will increasingly diverge over time in technical base, someday looking very different, just as divided species can no longer recreate after a period of time.	cburniske	48	4	1514055361	944642771163537408	https://twitter.com/cburniske/status/944642771163537408		#cryptoassets		0.10	-0.296
bitcoin 	1/ $ BTC is one asset, $ BCH is another. The divorce was in August and the market has already voted that $ BTC = #Bitcoin .	cburniske	297	48	1514055183	944642021129629697	https://twitter.com/cburniske/status/944642021129629697		#Bitcoin		0.56	0.1806
bitcoin 	I didn’t say #BitcoinCash . Referring specifically to “intra- #Bitcoin ” here. That group has left and morphed into a new asset imo.	cburniske	0	0	1514054544	944639341296603137	https://twitter.com/cburniske/status/944639341296603137		#BitcoinCash #Bitcoin		0.26	0.1204
bitcoin 	I’ve been in #Bitcoin for a while now and can’t tell who’s right & who’s wrong anymore. I suppose we’re all wrong because we’re all pointing fingers at one other, as opposed to uniting together.	cburniske	901	142	1514054375	944638634204061696	https://twitter.com/cburniske/status/944638634204061696		#Bitcoin		-0.29	-0.4767
bitcoin 	End of an important thread on how exchanges play a key role in current #Bitcoin fees being high. https:// twitter.com/laurentmt/stat us/944300757586759683 …	cburniske	30	7	1514042147	944587347232022528	https://twitter.com/cburniske/status/944587347232022528		#Bitcoin		0.36	0.247
bitcoin 	I have a book for you https://www. amazon.com/Cryptoassets-I nnovative-Investors-Bitcoin-Beyond/dp/1260026671/ref=zg_bs_2633_1?_encoding=UTF8&psc=1&refRID=NN0P9P4CA4YVZKGCEFPR …	cburniske	0	0	1514040704	944581294939308034	https://twitter.com/cburniske/status/944581294939308034				0.20	0.0
	2/ h/t @msamyARK , who specializes in Genomics @ARKInvest but has a penchant for #crypto . As @CathieDWood would say: convergence!!	cburniske	6	0	1514040018	944578416719945728	https://twitter.com/cburniske/status/944578416719945728		#crypto	@msamyARK @ARKInvest @CathieDWood	0.05	0.0
	2/ If your strategy creeps, bad trades will become investments, and bad investments will quickly become trades. Good way to get #crypto whiplash, and lose .	cburniske	47	6	1514039176	944574883580841984	https://twitter.com/cburniske/status/944574883580841984		#crypto		-0.04	-0.3695
	1/ Trading & investing are very different practices, and both are needed in #crypto . https://www. investopedia.com/ask/answers/12 /difference-investing-trading.asp … But identify your strategy, and stick to it...	cburniske	73	26	1514039085	944574503065186304	https://twitter.com/cburniske/status/944574503065186304		#crypto		0.15	0.0
	Applies particularly to #crypto . Backup your seeds, don’t keep them in an obvious place, make them proof. https:// twitter.com/alfiedotwtf/st atus/944419582558609409 …	cburniske	12	2	1514038633	944572606371557377	https://twitter.com/cburniske/status/944572606371557377		#crypto		0.14	0.0
	It was an optically volatile swing for @novogratz to pull his fund after being so bullish, but he does make clear he’s still long term committed to #crypto . https:// twitter.com/novogratz/stat us/944343342594383872 …	cburniske	37	6	1514038220	944570875768201216	https://twitter.com/cburniske/status/944570875768201216		#crypto	@novogratz	0.18	0.3614
bitcoin 	Mostly accurate, largely hilarious, #bitcoin parody ad from @sethmeyers https:// m.youtube.com/watch?v=aeMv9u KpAZg … pic.twitter.com/skLSFMTOvu	cburniske	135	62	1514033502	944551084479131648	https://twitter.com/cburniske/status/944551084479131648		#bitcoin	@sethmeyers	0.21	0.4019
	Perhaps I should have added “over the holidays.” But then again, Burning Man is the National Holiday of Crypto...	cburniske	7	0	1513986312	944353155755790338	https://twitter.com/cburniske/status/944353155755790338				0.42	0.4019
	No “out-of-office” emails in #crypto	cburniske	136	11	1513985864	944351275927375872	https://twitter.com/cburniske/status/944351275927375872		#crypto		0.00	-0.296
	So? They actually did the hard work to make it happen, and it's coming from a reputable group. That's exciting and valuable. My own OpenTimestamps project is like that: boring crypto, but someone had to actually do it, and no-one had until I did.	peterktodd	0	0	1514054709	944640033746833410	https://twitter.com/peterktodd/status/944640033746833410				-0.09	0.1665
	Notable how the reason why @coinbase may effectively be running a fractional reserve - alleged poor UTXO management - is a problem that many privacy protecting proof-of-reserves schemes would have failed to uncover. Crypto-engineering is hard, and full of ugly tradeoffs. https:// twitter.com/WhalePanda/sta tus/944198374080774144 …	peterktodd	237	67	1514045577	944601731639468034	https://twitter.com/peterktodd/status/944601731639468034			@coinbase	0.09	-0.4357
bitcoin 	The only relevant question for any currency - dollars, yuan, Bitcoin, cowry shells, Yap stone discs - is what can it buy. https:// twitter.com/getfiscal/stat us/944222267113984001 …	prchovanec	15	6	1514001824	944418218118205442	https://twitter.com/prchovanec/status/944418218118205442				0.27	0.0
	If elected, I will make my challenge coin a virtual cryptocurrency.	prchovanec	14	0	1513986829	944355323955032064	https://twitter.com/prchovanec/status/944355323955032064				0.45	0.0772
bitcoin 	A high cost of production is by far the worst reason / argument for higher price for the commodity ( or bitcoin).	Sunchartist	3	0	1514006176	944436474539159552	https://twitter.com/Sunchartist/status/944436474539159552				0.27	-0.765
bitcoin 	Bitcoin's down, but soon	RadioFreeTom	1	0	1514044060	944595371531128832	https://twitter.com/RadioFreeTom/status/944595371531128832				0.50	0.0
bitcoin 	Like I said.. bitcoin rallies on weekends now.. that when zombie come in with their 500 dollar buys.. and then next week with futures open.. crashes again..	Bamabroker	7	3	1514002655	944421705946189824	https://twitter.com/Bamabroker/status/944421705946189824				-0.07	0.3612
bitcoin 	"The US government.. The strongest military in the world.. and 300 years of rule... add to that its the world RESERVE currency.. Bitcoin is ""pokemon trading cards"" back up with people with 4000 dollars in savings.. PLEASE.. spare me the nonsense.. https:// twitter.com/P_Squalz/statu s/944420161758597120 …"	Bamabroker	59	8	1514002444	944420817668067328	https://twitter.com/Bamabroker/status/944420817668067328				0.18	0.1468
bitcoin 	Without a doubt Bitcoin... the zombies that worship that would choose death over hearing its really just a made up token backed by nothing.. https:// twitter.com/RampCapitalLLC /status/944376956216332288 …	Bamabroker	13	1	1514002131	944419505505173504	https://twitter.com/Bamabroker/status/944419505505173504				0.04	-0.6249
	"Now that real markets are closed here comes the mom and pop zombies buying crypto this weekend and pushing it up on 100 dollar purchases. I have no doubt coinbase will run smoothly this weekend. . But next week when it starts tanking. Coinbase ""our systems are down""."	Bamabroker	34	4	1513987596	944358544371052545	https://twitter.com/Bamabroker/status/944358544371052545				0.19	-0.1144
	Belarus Wants to Run a Global Crypto Hub - Bloomberg https://www. bloomberg.com/news/articles/ 2017-12-22/europe-s-last-dictator-now-wants-to-be-its-blockchain-king …	valuewalk	2	1	1514069466	944701930290413568	https://twitter.com/valuewalk/status/944701930290413568				0.21	0.0
