	Excellent, I love lolcode!	VitalikButerin	3	1	1470239780	760866904332390400	https://twitter.com/VitalikButerin/status/760866904332390400			
	No, it's about values. ETH = reasonableness, pragmatism and compromise.	VitalikButerin	58	23	1470239596	760866132186148864	https://twitter.com/VitalikButerin/status/760866132186148864			
	I still won't support ETC.	VitalikButerin	110	59	1470239509	760865764236627968	https://twitter.com/VitalikButerin/status/760865764236627968			
	Looking to learn more about # blockchain # technology?? Check out @ alextapscott latest article on @ LinkedIn: https://www.linkedin.com/pulse/what-you-need-know-blockchain-technology-alex-tapscott …	dtapscott	26	28	1470256085	760935290131341312	https://twitter.com/dtapscott/status/760935290131341312		# #	@ @
	Check out @ alextapscott's twitter page for our thoughts!	dtapscott	1	0	1470255536	760932987701780481	https://twitter.com/dtapscott/status/760932987701780481			@
	Thanks Susan!	dtapscott	1	0	1470255413	760932471227703296	https://twitter.com/dtapscott/status/760932471227703296			
	Awesome!https://twitter.com/alextapscott/status/760836677489287168 …	dtapscott	4	0	1470234098	760843072741711872	https://twitter.com/dtapscott/status/760843072741711872			
	would love to discuss this possibility! Contact my agent Wes at wesn@leighbureau.com	dtapscott	0	0	1470234031	760842788065992704	https://twitter.com/dtapscott/status/760842788065992704			@leighbureau
	Trump is the perfect president to ride us into eco-holocaust. Dr. Strangehair https://www.newscientist.com/article/2099756-record-breaking-year-shows-earths-climate-is-in-real-trouble/?utm_medium=Social&utm_campaign=Echobox&utm_source=Twitter&utm_term=Autofeed&cmpid=SOC%257CNSNS%257C2016-Echobox …	maxkeiser	27	26	1470254724	760929581847240704	https://twitter.com/maxkeiser/status/760929581847240704			
	Cash handouts worked for bankers, why wouldn't it work for workers?	maxkeiser	76	63	1470254320	760927887209947136	https://twitter.com/maxkeiser/status/760927887209947136			
	"""Springtime For Hitler""pic.twitter.com/w87Kjx6sfj"	maxkeiser	2	1	1470234787	760845962545954816	https://twitter.com/maxkeiser/status/760845962545954816			
	Inflation Hidden in Plain Sight http://po.st/NI8J28  via @ maxkeiser	maxkeiser	14	12	1470228197	760818320065044480	https://twitter.com/maxkeiser/status/760818320065044480			@
	Gold Bullion – The Ultimate Monetary Solution http://po.st/v7Litv  via @ maxkeiser	maxkeiser	10	9	1470228183	760818263215538176	https://twitter.com/maxkeiser/status/760818263215538176			@
	# KeiserReport talks to @ geraldcelente about 'the myth of the millenial entrepreneur' https://youtu.be/G2Nxf4ZdNAE http://fb.me/8qpiRQ0y1	maxkeiser	23	20	1470188894	760653471838302208	https://twitter.com/maxkeiser/status/760653471838302208		#	@
	Billionaires like Warren Buffett who were bailed out during the 2008 financial crisis stumping for Hillary is:	maxkeiser	28	33	1470187666	760648319496577024	https://twitter.com/maxkeiser/status/760648319496577024			
	What state combo do you think would have greatest impact fighting terrorism?	maxkeiser	14	23	1470187165	760646221535055872	https://twitter.com/maxkeiser/status/760646221535055872			
	What is Trump biggest liability at this point in race... ?	maxkeiser	8	11	1470186984	760645458356305920	https://twitter.com/maxkeiser/status/760645458356305920			
	Trump's a success so far because he's... ?	maxkeiser	27	38	1470186750	760644480890441729	https://twitter.com/maxkeiser/status/760644480890441729			
	If you could watch only one network, which would it be?	maxkeiser	19	15	1470186415	760643075391840256	https://twitter.com/maxkeiser/status/760643075391840256			
	Do you think a president Trump would be capable of overriding the US Constitution and imposing dictatorial powers?	maxkeiser	13	10	1470186135	760641898902151168	https://twitter.com/maxkeiser/status/760641898902151168			
	Who do you think is the 'aggressor' in today's new Cold War with Russia?	maxkeiser	13	21	1470186047	760641532177166336	https://twitter.com/maxkeiser/status/760641532177166336			
	What do you perceive as a big threat if Trump elected president?	maxkeiser	6	6	1470185897	760640899592380416	https://twitter.com/maxkeiser/status/760640899592380416			
	The downside of a Trump presidency is what, exactly?	maxkeiser	30	18	1470184287	760634146750361600	https://twitter.com/maxkeiser/status/760634146750361600			
	Dans le venture capital, les femmes représentent 12% des tours de table, et 10% des montants levés. (2010-15)pic.twitter.com/839OLg0Fcp	babgi	29	50	1470215536	760765217538179072	https://twitter.com/babgi/status/760765217538179072			
	Part de la population vivant sous le seuil de pauvreté en EU, avant et après la crise (2005/2013) # datavizpic.twitter.com/7Q3mvi3N2R	babgi	23	35	1470215143	760763569436844032	https://twitter.com/babgi/status/760763569436844032		#	
	Reason why # Fintech + # Banking partnerships will (must) work is because banks bring scale and fintechs bring innovation.	JimMarous	1	0	1470249574	760907979700875265	https://twitter.com/JimMarous/status/760907979700875265		# #	
	I disagree, the power of data and digital delivery is delivering far better results ... at a lower cost. # fintech	JimMarous	0	0	1470245068	760889082780147713	https://twitter.com/JimMarous/status/760889082780147713		#	
	Would love P2P # payments like @ Square Cash or @ venmo or loans in 30 seconds like @ mBankpl	JimMarous	3	2	1470234757	760845836687335424	https://twitter.com/JimMarous/status/760845836687335424		#	@ @ @
	Not surprising. The industry is still only touching the surface. Consumer expectations being set by other industries.	JimMarous	1	0	1470234401	760844342537752576	https://twitter.com/JimMarous/status/760844342537752576			
	I also thought you would like this. We cover Millennials heavily on @ FinancialBrand.https://twitter.com/JimMarous/status/760831146238238720 …	JimMarous	0	0	1470234327	760844032088035328	https://twitter.com/JimMarous/status/760844032088035328			@
	Congratulations to # WomeninFinance Power 100 http://bit.ly/2aoQj9x @ devie_mohan @ GCGodfrey @ DuenaBlomstrompic.twitter.com/WYZ8txYTDf	JimMarous	13	10	1470234071	760842959486976000	https://twitter.com/JimMarous/status/760842959486976000		#	@ @ @
	# Fintech Is't Disrupting Africa's # Banking Industry — It's Building It http://bit.ly/2arOOY7 @ dotfinancelivepic.twitter.com/06wEjfQMo1	JimMarous	5	11	1470232032	760834406525186048	https://twitter.com/JimMarous/status/760834406525186048		# #	@
	New Report: # Digital Innovation in # Banking Will Drive $405B in Value http://bit.ly/2auq4CF @ CiscoFSI # fintechpic.twitter.com/T7VHy0wUZr	JimMarous	17	33	1470231825	760833537159290880	https://twitter.com/JimMarous/status/760833537159290880		# # #	@
	# Millennials Prefer # Mobile Wallets from Non-Banks http://bit.ly/2aNRLFM @ ccgcatalyst @ Tery # paymentspic.twitter.com/no9fiRwVtT	JimMarous	4	7	1470231255	760831146238238720	https://twitter.com/JimMarous/status/760831146238238720		# # #	@ @
	How # Banking Can Capitalize on $405B # Digital Opportunity http://bit.ly/2arUfGx @ CiscoFSI # fintechpic.twitter.com/yeKXxsudHA	JimMarous	11	17	1470211900	760749965433909248	https://twitter.com/JimMarous/status/760749965433909248		# # #	@
	Looking beyond the hype at # fintech in Southeast Asia http://tcrn.ch/2as4SdV @ techcrunch @ NextMoney_ # FF17pic.twitter.com/gEJItNVG4g	JimMarous	6	12	1470211210	760747072328912896	https://twitter.com/JimMarous/status/760747072328912896		# #	@ @
	How UK # Fintech Has Finally Come of Age http://bit.ly/2arRiWo @ MisysFS @ EddieGeorge @ NewFinancepic.twitter.com/KsqhO3XjTZ	JimMarous	14	13	1470210496	760744074915700738	https://twitter.com/JimMarous/status/760744074915700738		#	@ @ @
	# Fintech Is't Disrupting Africa's # Banking Industry — It's Building It http://bit.ly/2arOOY7 @ dotfinancelivepic.twitter.com/gmjz6lQSrn	JimMarous	20	22	1470210001	760742000630960128	https://twitter.com/JimMarous/status/760742000630960128		# #	@
	# Millennials Prefer # Mobile Wallets from Non-Banks http://bit.ly/2aNRLFM @ ccgcatalyst @ Tery # payments # fintechpic.twitter.com/wl6fICTvtm	JimMarous	10	6	1470208025	760733712602529792	https://twitter.com/JimMarous/status/760733712602529792		# # # #	@ @
	Major Banks Are Pushing Real-Time # P2P # Payments Forward. http://ln.is/letstalkpayments.com/EpKNi … via @ LetsTalkPaymnts # fintech	JimMarous	0	5	1470188698	760652648047579136	https://twitter.com/JimMarous/status/760652648047579136		# # #	@
	By 2020, Wearable Payment Transaction Volume Will Reach $500 Billion Worldwide http://ln.is/letstalkpayments.com/wdyOy … via @ LetsTalkPaymnts	JimMarous	2	6	1470188455	760651629502853120	https://twitter.com/JimMarous/status/760651629502853120			@
	@ SpirosMargaris @ cgledhill @ leimer @ RAlexJimenez @ rshevlin @ fintechna Thin line between 'dabbling' and 'doubling down' # fintech	JimMarous	4	2	1470186798	760644678404313088	https://twitter.com/JimMarous/status/760644678404313088		#	@ @ @ @ @ @
	Join # BreakingBanks Thursdays for 4-week series on # Blockchain. http://bit.ly/11Fpstu @ brettking @ Chris_Skinnerpic.twitter.com/TTiVk7ebtL	JimMarous	22	29	1470183200	760629587063615488	https://twitter.com/JimMarous/status/760629587063615488		# #	@ @
	Starbucks Holds More Cash Than Many Banks. http://www.forbes.com/sites/niallmccarthy/2016/08/01/starbucks-holds-more-cash-than-many-banks-infographic/#511300b73aef … # payments # fintech # innovationpic.twitter.com/7VwTzgwpLm	JimMarous	10	10	1470182561	760626907595497472	https://twitter.com/JimMarous/status/760626907595497472		#511300b73aef # # #	
	# Fintech adoption could double within year. http://bit.ly/2aqU9z8 @ EYnews @ MisysFSpic.twitter.com/L3WJVln6By	JimMarous	10	16	1470182354	760626039450050560	https://twitter.com/JimMarous/status/760626039450050560		#	@ @
	The great # FinTech robo advisor race. http://on.forbes.com/6019BLfIf # wealthmanagement @ GCGodfrey @ WFSULLIVAN3 @ UBSpic.twitter.com/3Q9XraMkuk	JimMarous	4	11	1470181877	760624041015189504	https://twitter.com/JimMarous/status/760624041015189504		# #	@ @ @
	# Millennials Prefer # Mobile Wallets from Non-Banks http://bit.ly/2aNRLFM @ ccgcatalyst @ Tery # payments # fintechpic.twitter.com/Axul8ESjMB	JimMarous	21	14	1470175901	760598974508052481	https://twitter.com/JimMarous/status/760598974508052481		# # # #	@ @
	nope.	VinnyLingham	4	0	1470242928	760880108441776128	https://twitter.com/VinnyLingham/status/760880108441776128			
	ahhh! Mother country!	VinnyLingham	0	0	1470239035	760863775943630848	https://twitter.com/VinnyLingham/status/760863775943630848			
	where are you based?	VinnyLingham	0	0	1470231857	760833671909691396	https://twitter.com/VinnyLingham/status/760833671909691396			
	you don't sense my sarcasm?!	VinnyLingham	0	0	1470212477	760752384486150144	https://twitter.com/VinnyLingham/status/760752384486150144			
	can you show the movement of coins into the market?	VinnyLingham	2	0	1470180373	760617730642890752	https://twitter.com/VinnyLingham/status/760617730642890752			
	"I said : ""Don't panic!""...... No one ever listens to me :-).https://vinnylingham.com/the-lake-wobegon-effect-b39decb6691a#.anfmtbqn1 …"	VinnyLingham	18	3	1470178967	760611835242438656	https://twitter.com/VinnyLingham/status/760611835242438656		#	
	You don't understand sarcasm?	VinnyLingham	9	0	1470177815	760607001428713476	https://twitter.com/VinnyLingham/status/760607001428713476			
bitcoin 	I have a great idea! Why don't we hard fork Bitcoin and help Bitfinex get back their coins?! That seems like the right thing to do, right?	VinnyLingham	46	19	1470177760	760606772730011648	https://twitter.com/VinnyLingham/status/760606772730011648			
bitcoin 	The flush is not a single event. It's a prolonged state where Bitcoin's price stays low enough to force the closure of bad actors	VinnyLingham	1	0	1470177618	760606175918305280	https://twitter.com/VinnyLingham/status/760606175918305280			
	We are still working on get the license to allow us to support Hawaii. Hopefully soon!	SatoshiLite	2	1	1470201486	760706286384283648	https://twitter.com/SatoshiLite/status/760706286384283648			
	This is the problem I addressed at d10e last week. The problem will worsen if we don't take the steps I suggestedhttps://twitter.com/TheCryptoAdviso/status/760659164674818048 …	officialmcafee	42	13	1470256272	760936077259661312	https://twitter.com/officialmcafee/status/760936077259661312			
	http://www.durhamcollege.ca/new-notable/dc-highlights/dc-grads-partner-with-mcafee-global-technologies-to-revolutionize-digital-security …	officialmcafee	41	8	1470252460	760920087125778432	https://twitter.com/officialmcafee/status/760920087125778432			
	The entire KYC/AML scheme is a massive due process violation. Everyone is guilty until proven innocent. https://steemit.com/politics/@joelkatz/the-war-on-cash … - @ JoelKatz	rogerkver	52	29	1470240156	760868480732192768	https://twitter.com/rogerkver/status/760868480732192768			@joelkatz @
	Everyone should shun any organization that isn't based on the voluntary consent of those involved.pic.twitter.com/VMSevNBWNW	rogerkver	272	193	1470209228	760738758673117186	https://twitter.com/rogerkver/status/760738758673117186			
	PwC should sponsor an episode of @ Breakingbanks1 and get the word out	BrettKing	0	0	1470186157	760641992892280834	https://twitter.com/BrettKing/status/760641992892280834			@
	@ katherinemiller cake, I prefer to eat cake...	BrettKing	1	0	1470180302	760617432985763841	https://twitter.com/BrettKing/status/760617432985763841			@
	http://FintechAvengers.com !!	BrettKing	3	0	1470179361	760613486326087680	https://twitter.com/BrettKing/status/760613486326087680			
	our face swap looks like @ leimer	BrettKing	2	0	1470178530	760610003686391808	https://twitter.com/BrettKing/status/760610003686391808			@
	nope - I AM the party!! :)	BrettKing	2	0	1470178148	760608399277064192	https://twitter.com/BrettKing/status/760608399277064192			
	How so? I would expect that they are easier	aantonop	0	0	1470244469	760886570547240960	https://twitter.com/aantonop/status/760886570547240960			
	I would agree that this is a weakness of PoS. We'll see...	aantonop	0	0	1470244338	760886020745273345	https://twitter.com/aantonop/status/760886020745273345			
	Very interested in the possibility that Lightning Network (State Channels) could be used to remove custodial control & allow rapid trading	aantonop	97	56	1470244306	760885887106293760	https://twitter.com/aantonop/status/760885887106293760			
	"I was at first. But ETH is committed to PoS (difficulty bomb) and 14% puts power in the hands of hacker. Different ""stakes"""	aantonop	1	1	1470244226	760885551788470272	https://twitter.com/aantonop/status/760885551788470272			
	Not sure I can add any value to this topic.	aantonop	1	0	1470240945	760871789803081728	https://twitter.com/aantonop/status/760871789803081728			
	KYC will simply make this worse, if hackers breached the servers holding PII.	aantonop	1	0	1470239693	760866539654438912	https://twitter.com/aantonop/status/760866539654438912			
	I'm pointing out correlation because what we know stinks already. We need answers and CFTC should provide accountability	aantonop	1	1	1470238815	760862854111121408	https://twitter.com/aantonop/status/760862854111121408			
	Will anyone look into the responsibility that CFTC bears in weakening Bitfinex security with their interference? Important story	aantonop	22	11	1470238500	760861532083228672	https://twitter.com/aantonop/status/760861532083228672			
	No, not at all. If CFTC bears some responsibility, Bitfinex bears even more for allowing that change to happen & getting hacked	aantonop	3	1	1470237801	760858600277356545	https://twitter.com/aantonop/status/760858600277356545			
	Will you be looking into the possibility that CFTC forced Bitfinex to change their security model, removing cold storage?	aantonop	5	1	1470236542	760853319912820736	https://twitter.com/aantonop/status/760853319912820736			
	I really hope that @ Bitfinex take the example of @ ShapeShift_io & provide a comprehensive and public report of this hack so we can all learn	aantonop	143	91	1470236368	760852590011703296	https://twitter.com/aantonop/status/760852590011703296			@ @
	We know that the security model changed after CFTC got involved. Now we need accountability from CFTC. How likely?	aantonop	2	1	1470235953	760850849899814914	https://twitter.com/aantonop/status/760850849899814914			
	"a) CFTC steps in to ""protect consumers"" b) Exchange dismantles cold storage c) Hack d) Regulators point & say this is why regulations needed"	aantonop	187	187	1470235704	760849808378597377	https://twitter.com/aantonop/status/760849808378597377			
bitcoin 	We're beginning to see a picture: Traditional bank regulations (KYC/AML/custody), when applied to bitcoin end up harming consumers	aantonop	109	89	1470235407	760848560963190784	https://twitter.com/aantonop/status/760848560963190784			
	For those who lost no funds on Bitfinex, the next question is whether the hackers got all the ID info from their KYC program. KYC = danger	aantonop	82	66	1470235325	760848217810489344	https://twitter.com/aantonop/status/760848217810489344			
	Couldn't do ANY withdrawal without verifying a LOT of documents. All that info is now at risk, since they were hacked.	aantonop	1	2	1470235290	760848068732342273	https://twitter.com/aantonop/status/760848068732342273			
	Are you kidding? I was a customer of Bitfinex and I had to verify 10+ documents. They did more KYC than my bank	aantonop	3	3	1470235176	760847592481710080	https://twitter.com/aantonop/status/760847592481710080			
	Did CFTC push Bitfinex away from using cold storage and to hot wallets for every customer? Was this driven by KYC/AML, increasing risks?	aantonop	44	36	1470234995	760846832138194946	https://twitter.com/aantonop/status/760846832138194946			
bitcoin 	Bitcoin Q&A: Will Bitcoin save us from a global currency crisis?: http://youtu.be/U3S7vQrNOAI?a  via @ YouTube	aantonop	22	15	1470233555	760840791522701312	https://twitter.com/aantonop/status/760840791522701312			@
	Silicon Valley, yes. But not Wall St., which is what this article is about.	aantonop	1	0	1470232574	760836678441238528	https://twitter.com/aantonop/status/760836678441238528			
	A good time to discuss failure and our options:https://medium.com/@aantonop/failure-is-an-option-fa1499180dcb …	aantonop	41	18	1470194455	760676797335805952	https://twitter.com/aantonop/status/760676797335805952			@aantonop
	.@SwartWayne @1cyrilblanc1 Failure is an option - a paean to markets not bailouts https://medium.com/@aantonop/failure-is-an-option-fa1499180dcb …	aantonop	14	6	1470194436	760676714213101568	https://twitter.com/aantonop/status/760676714213101568			@SwartWayne @1cyrilblanc1 @aantonop
	No, customer losses will not be bailed out. Time to trot out:	aantonop	13	2	1470194394	760676539411275777	https://twitter.com/aantonop/status/760676539411275777			
bitcoin 	I doubt it would work. Bitcoin is even more resistant than ETH and we saw how ETH's hard fork is resisted strongly.	aantonop	3	0	1470192583	760668944806006784	https://twitter.com/aantonop/status/760668944806006784			
	Control is transferred, thereby stealing the value.	aantonop	0	1	1470192535	760668744225992704	https://twitter.com/aantonop/status/760668744225992704			
	It just accelerated the already ongoing profit-taking and consolidation from the recent run-up.	aantonop	0	0	1470192435	760668324845936640	https://twitter.com/aantonop/status/760668324845936640			
bitcoin 	. @ dAnconiaMining Still, not a reason to panic. Bitcoin is still exactly the same. What failed is centralization of control, as always	aantonop	104	51	1470191657	760665058183487488	https://twitter.com/aantonop/status/760665058183487488			@
	Agreed. It is very disappointing and terrible for those who lost money. Custodial exchanges are always risky.	aantonop	0	0	1470191617	760664894488190976	https://twitter.com/aantonop/status/760664894488190976			
	Yet no one went to jail. So the cost of pulling this crime off is zero and the FBI will do it again.	aantonop	0	0	1470190910	760661929144659968	https://twitter.com/aantonop/status/760661929144659968			
bitcoin 	Panicking? Huh, you must be new to bitcoin.pic.twitter.com/YrDLPbCFBW	aantonop	284	164	1470189873	760657578195980288	https://twitter.com/aantonop/status/760657578195980288			
	Fun word, karmic black hole.	aantonop	3	0	1470189325	760655279734140928	https://twitter.com/aantonop/status/760655279734140928			
	Better to avoid the Schadenfreude all around.	aantonop	4	0	1470188834	760653218766401536	https://twitter.com/aantonop/status/760653218766401536			
	"That's the ""if any"" part. Most times, no recourse. Recourse means handing power to intermediaries, who then abuse it"	aantonop	2	0	1470188647	760652435471867904	https://twitter.com/aantonop/status/760652435471867904			
	This way losses are limited to those who risked money on a custodial account, not the entire space through devaluation of BTC	aantonop	5	1	1470188605	760652261252931584	https://twitter.com/aantonop/status/760652261252931584			
	I've always taken a very long term view of BTC. It took a beating today but it's still up 100% YoY. I continue to HODL	aantonop	9	0	1470188072	760650021775642624	https://twitter.com/aantonop/status/760650021775642624			
	Not really an option. Once the coins start moving it gets exponentially harder to execute without severe collateral damage	aantonop	5	1	1470186197	760642158957203456	https://twitter.com/aantonop/status/760642158957203456			
bitcoin ethereum 	Personally, I blame the Ethereum maximalists for undermining bitcoin's price with their attacks. # sarcasm # jk	aantonop	150	45	1470186154	760641977687748608	https://twitter.com/aantonop/status/760641977687748608		# #	
	YEEEEESSSS!	aantonop	1	0	1470186047	760641532185616384	https://twitter.com/aantonop/status/760641532185616384			
	Possible for short time, but much more difficult and fraught with greater risk. Impossible at day+ scale.	aantonop	1	0	1470185885	760640852221767680	https://twitter.com/aantonop/status/760640852221767680			
	In rhyme?	aantonop	2	0	1470185840	760640663675244544	https://twitter.com/aantonop/status/760640663675244544			
bitcoin 	"To be clear: No circumstances under which a ""fix"" to the Bitfinex hack would be advisable or even practical in bitcoin. # NoFork # Immutable"	aantonop	197	118	1470185688	760640026069696512	https://twitter.com/aantonop/status/760640026069696512		# #	
	"ALL custodial accounts are always at risk. ""Your keys, your coin, not your keys, not your coin"""	aantonop	34	16	1470178468	760609740506275840	https://twitter.com/aantonop/status/760609740506275840			
	Any statements from @ Bitgo on the @ Bitfinex hack?	aantonop	54	21	1470178203	760608629724581888	https://twitter.com/aantonop/status/760608629724581888			@ @
	Not much point to having multisig if the customer has zero keys and a quorum can be stolen from one agent	aantonop	48	24	1470176285	760600585867440128	https://twitter.com/aantonop/status/760600585867440128			
	Fits the trend for the rest of 2016. This is a drama-filled year in every way	aantonop	1	0	1470175241	760596205797646336	https://twitter.com/aantonop/status/760596205797646336			
	ShapeShift now lets you split dirty or potentially dirty ETH/ETC into clean ETH and ETC. http://split.shapeshift.io https://twitter.com/ShapeShift_io/status/760923299543212032 …	ErikVoorhees	26	15	1470253643	760925049297571840	https://twitter.com/ErikVoorhees/status/760925049297571840			
	I just flipped a quarter five times, heads up each time. Can't be a coincidence!	ErikVoorhees	0	0	1470235040	760847019711737856	https://twitter.com/ErikVoorhees/status/760847019711737856			
	FML	ErikVoorhees	1	0	1470199946	760699828670201862	https://twitter.com/ErikVoorhees/status/760699828670201862			
	ShapeShift is based in Switzerland, has nothing to do with Panama.	ErikVoorhees	3	0	1470199839	760699378587820032	https://twitter.com/ErikVoorhees/status/760699378587820032			
	I'm relatively neutral about ETH HF... I don't vilify either side. But no, I don't support a BTC fork in this case.	ErikVoorhees	2	0	1470182937	760628485907808256	https://twitter.com/ErikVoorhees/status/760628485907808256			
bitcoin ethereum 	Brutal day for crypto :( http://www.CoinCap.io # bitcoin # ethereum # blockchain # finance	ErikVoorhees	35	23	1470181535	760622604885434368	https://twitter.com/ErikVoorhees/status/760622604885434368		# # # #	
	@ coindesk Crazy day. Wasn't following Twitter.	brockpierce	0	0	1470195125	760679604273065984	https://twitter.com/brockpierce/status/760679604273065984			@
	ah, thanks!	TuurDemeester	0	0	1470261117	760956398134038529	https://twitter.com/TuurDemeester/status/760956398134038529			
	does the UK really hold $348 billion worth of cash in paper bills and coins? Seems like a lot... Source?	TuurDemeester	0	0	1470260871	760955365022244864	https://twitter.com/TuurDemeester/status/760955365022244864			
	deflecting responsibility is not cool, agreed	TuurDemeester	0	0	1470247261	760898279009902592	https://twitter.com/TuurDemeester/status/760898279009902592			
bitcoin 	Coindesk quoted me in their latest article on the Bitcoin price.http://www.coindesk.com/bitcoin-drops-12-exchange-hack-amplifies-price-decline/ …	TuurDemeester	8	1	1470244877	760888279612948480	https://twitter.com/TuurDemeester/status/760888279612948480			
	"The Bond King abdicates: ""I don't like bonds, favor gold, real estate"" http://www.bloomberg.com/news/articles/2016-08-03/gross-says-i-don-t-like-bonds-most-stocks-favors-real-assets?utm_content=business&utm_campaign=socialflow-organic&utm_source=twitter&utm_medium=social&cmpid%3D=socialflow-twitter-business …"	TuurDemeester	12	8	1470239855	760867216023810051	https://twitter.com/TuurDemeester/status/760867216023810051			
