	@ TheMicheleWalsh fyi you might like http://irishtechnews.net/ITN3/the-future-of-working-remotely-interview-with-emmotional-resilience-author-geetu-bharwaney/ … is your book a hardcopy if so we can review it? thanks @ SimonCocking	SimonCocking	0	0	1470231828	760833550925070336	https://twitter.com/SimonCocking/status/760833550925070336			@ @
	@ SymphonyVenture fyi you might like http://irishtechnews.net/ITN3/the-future-of-working-remotely-interview-with-emmotional-resilience-author-geetu-bharwaney/ … interested in featuring also? @ SimonCocking @ Irish_TechNews	SimonCocking	1	1	1470222749	760795471556337664	https://twitter.com/SimonCocking/status/760795471556337664			@ @ @
	thanks, mailed you! Cheers @ SimonCockingpic.twitter.com/W48Wq1vtTk	SimonCocking	1	0	1470221340	760789561085755392	https://twitter.com/SimonCocking/status/760789561085755392			@
	Its his publicly traded investment vehicle. So it is his performance.	GerberKawasaki	0	0	1470261280	760957079200800769	https://twitter.com/GerberKawasaki/status/760957079200800769			
	Found it on facebook in 2 sec. Great interface too. Facebook just moves so fast to counter competition. # InstagramStories $ FB	GerberKawasaki	0	0	1470261178	760956652363276289	https://twitter.com/GerberKawasaki/status/760956652363276289		#	
	Downloaded our app # MyMoneyPage. Track goals, net worth, budget in one place w/ the help of a GK advisor. Learn more http://ow.ly/IEsD302TLKi	GerberKawasaki	2	0	1470258907	760947126897639425	https://twitter.com/GerberKawasaki/status/760947126897639425		#	
	actually way out performed Carl in any recent period. Here is his chart. $ ieppic.twitter.com/RDE9unuCoy	GerberKawasaki	0	0	1470257995	760943300991856640	https://twitter.com/GerberKawasaki/status/760943300991856640			
	Borgata just got sold by Boyd to MGM. They are fine. $ mgm	GerberKawasaki	0	0	1470257950	760943111895855104	https://twitter.com/GerberKawasaki/status/760943111895855104			
	Or a totally poorly run and managed casino.	GerberKawasaki	0	0	1470257804	760942502253768705	https://twitter.com/GerberKawasaki/status/760942502253768705			
	My first buy was at $3. youre wrong. We have much higher returns on Apple than Carl ever even close to made. $ aapl	GerberKawasaki	0	0	1470257784	760942418195652609	https://twitter.com/GerberKawasaki/status/760942418195652609			
	# Trump creating jobs with his Treasury chief @ Carl_C_Icahn Shutting another Trump icon. BK failure again Donny. # AChttp://www.reuters.com/article/us-atlantic-city-casino-idUSKCN10E2DL?utm_source=Twitter&utm_medium=Social …	GerberKawasaki	3	1	1470257451	760941020339064832	https://twitter.com/GerberKawasaki/status/760941020339064832		# #	@
	Thats exactly my feeling. Why buy $ Scty? Clearly not the best company. $ tsla	GerberKawasaki	1	0	1470257375	760940700871434240	https://twitter.com/GerberKawasaki/status/760940700871434240			
	Sorry Twitter but Facebook Live was really good and easy to find. Watching some Manchester United. $ manu $ FB $ TWTR	GerberKawasaki	7	1	1470257223	760940062846492672	https://twitter.com/GerberKawasaki/status/760940062846492672			
	very large.	GerberKawasaki	0	0	1470255499	760932831010836481	https://twitter.com/GerberKawasaki/status/760932831010836481			
	it's not about rev. It's about fees net margin. They own great assets. $ etp	GerberKawasaki	0	0	1470255441	760932588106035201	https://twitter.com/GerberKawasaki/status/760932588106035201			
	Tesla unchanged after hours. Got to love it. $ tsla at least Elon has Amber Heard to hang with and discuss his lack of earnings.	GerberKawasaki	4	1	1470255393	760932389069533184	https://twitter.com/GerberKawasaki/status/760932389069533184			
	Another stellar qtr for # Tesla. Burning cash and dreaming of a # solar future. Elon we need some focus here. $ tslahttps://twitter.com/lebeaucarnews/status/760930729417175040 …	GerberKawasaki	6	7	1470255142	760931336056037376	https://twitter.com/GerberKawasaki/status/760931336056037376		# #	
	Its hard when there is no fiscal stimulus. Central banks are forced to do everything.	GerberKawasaki	0	0	1470249901	760909352953839617	https://twitter.com/GerberKawasaki/status/760909352953839617			
	I like Pandora, they cant make money but would be a nice fit for Apple music. $ aapl $ P	GerberKawasaki	0	0	1470248191	760902181386063872	https://twitter.com/GerberKawasaki/status/760902181386063872			
	So people buying bonds because we have no inflation, slow growth is bad? Corp profits are increasing over the next 12 months.	GerberKawasaki	0	0	1470248148	760901999047090176	https://twitter.com/GerberKawasaki/status/760901999047090176			
	My client said, Why did you sell some of my Apple? Then he opened his @ TMobile # SamsungS7 He likes free calling when travelling. $ Tmus $ aapl	GerberKawasaki	10	0	1470248031	760901509299183616	https://twitter.com/GerberKawasaki/status/760901509299183616		#	@
	I love my # Iphone # Ios Ill never switch. we've sold some of our stock. They are behind the innovation curve. $ aapl	GerberKawasaki	0	0	1470247883	760900888127008768	https://twitter.com/GerberKawasaki/status/760900888127008768		# #	
	going on, where? Actually Bill's been under performing. Since he left PIMCO.	GerberKawasaki	0	0	1470247743	760900303671746565	https://twitter.com/GerberKawasaki/status/760900303671746565			
	Bill Gross doesn't like anything. These old guys are so pessimistic. # stocks # bonds $ JNS	GerberKawasaki	4	0	1470247521	760899371709952000	https://twitter.com/GerberKawasaki/status/760899371709952000		# #	
	# Stocks holding gains with strength in Disney and Apple. $ DIS $ AAPL Nice rally in # Oil and related companies.	GerberKawasaki	1	1	1470245705	760891753255821312	https://twitter.com/GerberKawasaki/status/760891753255821312		# #	
	The # RepublicansAgainstTrump are planning an intervention to save the party from total destruction. A coup of # Trump http://www.msn.com/en-us/news/politics/trump-allies-plot-candidate-intervention-after-disastrous-48-hours/ar-BBvcNvm?li=BBnb7Kz&ocid=LENDHP …	GerberKawasaki	4	0	1470242569	760878600899981312	https://twitter.com/GerberKawasaki/status/760878600899981312		# #	
	Apple shareholders worst nightmare. $ aaplpic.twitter.com/u9F0JiIj8c	GerberKawasaki	7	0	1470241464	760873966059696128	https://twitter.com/GerberKawasaki/status/760873966059696128			
	hope.	GerberKawasaki	0	0	1470240747	760870957581905921	https://twitter.com/GerberKawasaki/status/760870957581905921			
	we already have a position in $ etp and $ ete. We only make specific recommendations to clients. Join us. We work for the public.	GerberKawasaki	0	0	1470234625	760845279352360960	https://twitter.com/GerberKawasaki/status/760845279352360960			
	Great article from the @ latimes about the amazing diversity and people of Southern California. # NeverTrump http://www.latimes.com/opinion/op-ed/la-oe-friedersdorf-trump-decline-thesis-20160803-snap-story.html …	GerberKawasaki	1	1	1470234481	760844676182056960	https://twitter.com/GerberKawasaki/status/760844676182056960		#	@
	Yes yes. Just killing it this morning with our $ etp investment. I love stocks.	GerberKawasaki	5	0	1470231154	760830722324049920	https://twitter.com/GerberKawasaki/status/760830722324049920			
	Instagram has changed a lot. I'll admit I don't use it much but it's way better. I like video on it. Good platform. # InstagramStories $ fb	GerberKawasaki	5	1	1470231014	760830133930332161	https://twitter.com/GerberKawasaki/status/760830133930332161		#	
	Going to take another look at $ twx today. They are doing a lot of things right.https://twitter.com/cnbc/status/760829325079896064 …	GerberKawasaki	1	0	1470230916	760829723412795392	https://twitter.com/GerberKawasaki/status/760829723412795392			
bitcoin 	that's bs. These guys are crooks like # mtgox. My bet inside job. # bitcoin	GerberKawasaki	0	0	1470230857	760829476968148992	https://twitter.com/GerberKawasaki/status/760829476968148992		# #	
	Loving it. $ etp @ LizClaman @ FoxBusinesshttps://twitter.com/marketcurrents/status/760811790355697664 …	GerberKawasaki	1	0	1470230752	760829036239085568	https://twitter.com/GerberKawasaki/status/760829036239085568			@ @
	US economy is picking up steam. Low rates. Low oil. Good dollar. Full employment. People traveling.	GerberKawasaki	1	0	1470229093	760822077758722049	https://twitter.com/GerberKawasaki/status/760822077758722049			
	Not a good development if this is true. Elon and Amber equals crazy. Please Elon. $ tsla # divorce # teslahttps://apple.news/A9vAiLIvcPLGmJWaY-QA4dQ …	GerberKawasaki	6	0	1470229024	760821788729147392	https://twitter.com/GerberKawasaki/status/760821788729147392		# #	
	It did not take long for Facebook to counter Twitter, Snapchat with sports live-streaming $ manu $ fb $ twtr # soccerhttps://apple.news/Aj32zlBN1MryaHL3BBYZhPQ …	GerberKawasaki	2	0	1470228858	760821090801201153	https://twitter.com/GerberKawasaki/status/760821090801201153		#	
	nice headline. You can say that!	GerberKawasaki	0	0	1470228262	760818593051193345	https://twitter.com/GerberKawasaki/status/760818593051193345			
	How # oil goes so goes the markets. # stocks	GerberKawasaki	4	2	1470227864	760816925207203840	https://twitter.com/GerberKawasaki/status/760816925207203840		# #	
	Solid jobs numbers in America.https://twitter.com/seanansmith/status/760815832444366848 …	GerberKawasaki	0	0	1470227803	760816668075397120	https://twitter.com/GerberKawasaki/status/760816668075397120			
bitcoin 	there are no firms you can trust with you money. They need a FDIC for # bitcoin I wouldn't trust any firm out there.	GerberKawasaki	0	1	1470227728	760816354282774528	https://twitter.com/GerberKawasaki/status/760816354282774528		#	
	no	GerberKawasaki	0	0	1470227671	760816115475816449	https://twitter.com/GerberKawasaki/status/760816115475816449			
	If you can't beat them. Copy. An old Silicon Valley adage. $ fb # snapchat # stories http://bloom.bg/2aNE7CY	GerberKawasaki	1	0	1470227663	760816078406594560	https://twitter.com/GerberKawasaki/status/760816078406594560		# #	
	yes. Plan on holding it for a few years. $ ete	GerberKawasaki	0	0	1470226699	760812037710581760	https://twitter.com/GerberKawasaki/status/760812037710581760			
	turns out maybe they all have issues.	GerberKawasaki	0	0	1470226672	760811923415851010	https://twitter.com/GerberKawasaki/status/760811923415851010			
bitcoin 	This explains the rapid decline in # Bitcoin. Huge hack and theft. Another blow to trust. This must be addressed! http://bloom.bg/2aOegKV	GerberKawasaki	2	5	1470226622	760811715080495105	https://twitter.com/GerberKawasaki/status/760811715080495105		#	
	huge fan!	GerberKawasaki	0	0	1470187308	760646820653445121	https://twitter.com/GerberKawasaki/status/760646820653445121			
bitcoin 	Stopped out of # Bitcoin at $600. I'm out. Lost confidence keeping money at @ coinbase # ETC is bad for @ Bitcoin as it creates confusion.	GerberKawasaki	6	5	1470185555	760639466696429572	https://twitter.com/GerberKawasaki/status/760639466696429572		# #	@ @
	not a fan of $ xom not do we own big oil companies. We like pipelines. $ etp $ ete	GerberKawasaki	0	0	1470184417	760634692731215872	https://twitter.com/GerberKawasaki/status/760634692731215872			
	The rise and rise of Mexican # fintechhttp://tcrn.ch/2a8RxEh	obussmann	4	4	1470249542	760907848952020994	https://twitter.com/obussmann/status/760907848952020994		#	
	Evolve or Perish say Bain & Company to Banks on Using # Blockchain http://bit.ly/2aiLOi4	obussmann	0	3	1470238380	760861031711313920	https://twitter.com/obussmann/status/760861031711313920		#	
	Smart move: Swiss Parliament announced the official deregulation of # blockchain startupshttp://bit.ly/2aze7cQ	obussmann	21	30	1470224280	760801891009892354	https://twitter.com/obussmann/status/760801891009892354		#	
	# Blockchain-based SmartContract launches Smart Oracles Platform http://bit.ly/2algPSJ pic.twitter.com/BNtb6f3nzl	obussmann	2	5	1470218765	760778757632294912	https://twitter.com/obussmann/status/760778757632294912		#	
	Microsoft Azure expands # Blockchain as a Service to its DevTest Labs http://bit.ly/2arclZl	obussmann	1	2	1470214981	760762886868365312	https://twitter.com/obussmann/status/760762886868365312		#	
	http://www.bloomberglive.com/markets-most-influential/london/speakers …	obussmann	1	0	1470210815	760745413116891136	https://twitter.com/obussmann/status/760745413116891136			
	http://www.waterstechnology.com/waters/analysis/2441370/aftas-2015-best-technology-executive-sell-side-oliver-bussmann-ubs …	obussmann	0	0	1470210740	760745100699955200	https://twitter.com/obussmann/status/760745100699955200			
	I appreciate your support for my 100 miles Best Buddies charity ride in September Challenge Yourself to Change Lives https://lnkd.in/eyUTGKR	obussmann	2	2	1470209377	760739383884611585	https://twitter.com/obussmann/status/760739383884611585			
	Enjoy my latest post: Want to innovate? Then collaborate. http://bit.ly/2arrYhp # FinTech https://goo.gl/77qmEf	obussmann	9	13	1470204270	760717963813150720	https://twitter.com/obussmann/status/760717963813150720		#	
	Thomson Reuters joins R3 # blockchain consortiumhttp://reut.rs/2aPpmzO	obussmann	3	7	1470203825	760716095359684608	https://twitter.com/obussmann/status/760716095359684608		#	
	My latest blog: Is # Blockchain going mainstream? You bet! https://lnkd.in/eZ9qR2P  on @ LinkedIn # FinTech	obussmann	2	5	1470189154	760654561719689216	https://twitter.com/obussmann/status/760654561719689216		# #	@
bitcoin 	Blockai Uses Bitcoin # Blockchain to Protect Intellectual Propertyhttp://bit.ly/2asyPvr	obussmann	6	11	1470176340	760600817284046849	https://twitter.com/obussmann/status/760600817284046849		#	
	Things most people don't see in The City #1: St Michael Cornhill # TMPDSITCpic.twitter.com/A8bwWEuazD	Chris_Skinner	3	0	1470246394	760894643034808321	https://twitter.com/Chris_Skinner/status/760894643034808321		#1 #	
	Your chances of dying in a plane crash are 2,380,000:1http://www.bbc.co.uk/news/business-31133246 …	Chris_Skinner	0	1	1470246063	760893257148686336	https://twitter.com/Chris_Skinner/status/760893257148686336			
	now that would be telling, wouldn't it?	Chris_Skinner	1	0	1470237536	760857491433553925	https://twitter.com/Chris_Skinner/status/760857491433553925			
	based on your pic it looks like mine has sold a few ... three months and on 2nd print runpic.twitter.com/pPRH5X8wXw	Chris_Skinner	1	0	1470237516	760857407442526208	https://twitter.com/Chris_Skinner/status/760857407442526208			
	Microsoft won't fix Windows flaw that lets hackers steal your username and password | ZDNet http://www.zdnet.com/article/windows-attack-can-steal-your-username-password-and-other-logins/?ftag=TRE17cfd61&bhid=22347844246479528720654027332564 …	Chris_Skinner	0	4	1470237184	760856014937874432	https://twitter.com/Chris_Skinner/status/760856014937874432			
	This Bank Poses Greatest Risk to Global Financial System, IMF Says - WSJhttp://www.wsj.com/articles/deutsche-bank-poses-greatest-risk-to-global-financial-system-imf-says-1467239405 …	Chris_Skinner	3	6	1470236235	760852035386368000	https://twitter.com/Chris_Skinner/status/760852035386368000			
	Charting The Epic Collapse Of The World's Most Systemically Dangerous Bank | Zero Hedge http://www.zerohedge.com/news/2016-07-09/charting-epic-collapse-worlds-most-systemically-dangerous-bank …	Chris_Skinner	2	7	1470236201	760851891110707200	https://twitter.com/Chris_Skinner/status/760851891110707200			
	Go get it now https://www.amazon.com/gp/aw/d/9814677175?keywords=valueweb&pc_redir=T1&qid=1453905389&s=books&sr=1-1 …https://twitter.com/helenkhmitchell/status/760789632254676992 …	Chris_Skinner	2	0	1470230292	760827105844363264	https://twitter.com/Chris_Skinner/status/760827105844363264			
	The Bank of England: taking the lead in # FinTechhttp://fb.me/5KvTxafQh	Chris_Skinner	2	3	1470223946	760800489214652417	https://twitter.com/Chris_Skinner/status/760800489214652417		#	
	New Blog Post: The Bank of England: taking the lead in # FinTech: I like to point at the fact that the Bank o... http://bit.ly/2aAXzhS	Chris_Skinner	0	1	1470223055	760796753524170752	https://twitter.com/Chris_Skinner/status/760796753524170752		#	
	Paris = 1 licence for all Europe, except UK if passporting refused for Brexit	Chris_Skinner	0	0	1470222064	760792596985868288	https://twitter.com/Chris_Skinner/status/760792596985868288			
	Cost Obsessions Around the World - fascinatinghttp://www.fixr.com/blog/2015/04/17/world-of-obsessions/ …	Chris_Skinner	6	7	1470216719	760770176736518144	https://twitter.com/Chris_Skinner/status/760770176736518144			
	well spotted. I'd just thought they both moved to the Bank https://www.barnett-waddingham.co.uk/comment-insight/blog/2013/04/03/goodbye-fsa-hello-pra-and-fca/ … - my bad	Chris_Skinner	1	0	1470216078	760767490171478016	https://twitter.com/Chris_Skinner/status/760767490171478016			
	Blockchain Technology - Knowledge Sharinghttps://www.linkedin.com/pulse/blockchain-technology-knowledge-sharing-kunal-patel …	Chris_Skinner	6	6	1470213302	760755846934630400	https://twitter.com/Chris_Skinner/status/760755846934630400			
	not my understanding https://en.m.wikipedia.org/wiki/Financial_Services_Authority … - when did FCA move to HMT	Chris_Skinner	0	0	1470212652	760753121597489152	https://twitter.com/Chris_Skinner/status/760753121597489152			
	US elections: leading republicans Meg Whitman & Hank Paulson are voting for Hillary Clinton and many abstaining http://www.bbc.co.uk/news/election-us-2016-36961408 …	Chris_Skinner	1	1	1470210918	760745844878565376	https://twitter.com/Chris_Skinner/status/760745844878565376			
	The Bank of England: taking the lead in # FinTech via Chris Skinner's blog - I like to point at the ... http://tinyurl.com/jdz65z4	Chris_Skinner	1	4	1470209752	760740954764484609	https://twitter.com/Chris_Skinner/status/760740954764484609		#	
	How a simple coffee app saved Lloyds bank 10,000 days of work http://www.thememo.com/2016/07/14/how-a-simple-coffee-app-saved-lloyds-bank-10000-days-of-work/ … #	Chris_Skinner	3	4	1470209105	760738242371194880	https://twitter.com/Chris_Skinner/status/760738242371194880		#	
	just touched down. ;)	davidbrear	0	0	1470258782	760946604614488064	https://twitter.com/davidbrear/status/760946604614488064			
	I'm at London @ HeathrowAirport in Hounslow, Greater London https://www.swarmapp.com/c/fOzLL78bSQ3	davidbrear	0	0	1470257517	760941298287255554	https://twitter.com/davidbrear/status/760941298287255554			@
	yeh those other shelves do look full :)	davidbrear	1	0	1470237911	760859063005671424	https://twitter.com/davidbrear/status/760859063005671424			
	we are trying :)	davidbrear	4	0	1470232692	760837172043841536	https://twitter.com/davidbrear/status/760837172043841536			
	Zurich Pokemon are just the same as the UK ones... Just 4 times more expensive...	davidbrear	8	1	1470232181	760835029463396352	https://twitter.com/davidbrear/status/760835029463396352			
	LOL	davidbrear	1	0	1470213311	760755885085958144	https://twitter.com/davidbrear/status/760755885085958144			
	Looking for people with Austrian bank accounts :) DM me :)	davidbrear	0	1	1470210563	760744359486709760	https://twitter.com/davidbrear/status/760744359486709760			
	City airport on the way to Zurich. Take that @ jk_rowling - Well done @ Chris_Skinner pic.twitter.com/rUvdRMicly	davidbrear	19	7	1470209694	760740712501633024	https://twitter.com/davidbrear/status/760740712501633024			@ @
	@ FinTechInsiders glad you're liking it Rob :) If you get a chance a review on iTunes would be excellent	davidbrear	4	1	1470206037	760725375039205378	https://twitter.com/davidbrear/status/760725375039205378			@
	Early start and off to Zurich today... It's been a while	davidbrear	0	0	1470205801	760724385854619650	https://twitter.com/davidbrear/status/760724385854619650			
	"What on Earth is going on at the summer camp where my boys are counsellors? ""Save the Maromots"" ? http://buff.ly/2b3pK9Z  cc @ prestonjbyrne"	dgwbirch	0	0	1470256178	760935682663669760	https://twitter.com/dgwbirch/status/760935682663669760			@
	Mobile to the rescue (WSJ graphic) http://buff.ly/2av6BiA pic.twitter.com/3V0Vou8Mmk	dgwbirch	10	11	1470241088	760872389412589569	https://twitter.com/dgwbirch/status/760872389412589569			
	You should alway keep your private key on your personpic.twitter.com/uzKSJ8fR18	dgwbirch	10	0	1470239938	760867566155927552	https://twitter.com/dgwbirch/status/760867566155927552			
	Hey it's my mate Pierre on Money Talks: http://buff.ly/2adoori pic.twitter.com/7r4BtOA8bS	dgwbirch	0	0	1470238406	760861139987263492	https://twitter.com/dgwbirch/status/760861139987263492			
	Sorry for posting this, but the Medici Bank failed in 1494 following Charles VIII’s invasion of Italy.https://twitter.com/patio11/status/760707946804305920 …	dgwbirch	9	0	1470235395	760848509352439808	https://twitter.com/dgwbirch/status/760848509352439808			
	yep	dgwbirch	0	0	1470234718	760845672832724992	https://twitter.com/dgwbirch/status/760845672832724992			
	Another day, another ₽	dgwbirch	1	0	1470233740	760841570740473860	https://twitter.com/dgwbirch/status/760841570740473860			
	pic.twitter.com/T5SzSUlVRA	dgwbirch	1	0	1470233352	760839941056303104	https://twitter.com/dgwbirch/status/760839941056303104			
bitcoin 	At least it was only money stolen, it's not like the bitcoins were land ownership records or refugee IDs or anythinghttp://buff.ly/2aNyQuj	dgwbirch	10	1	1470231819	760833513658675200	https://twitter.com/dgwbirch/status/760833513658675200			
	It looks like a DXIIhttps://twitter.com/LondonMudlark/status/760391497460092928 …	dgwbirch	0	0	1470210707	760744961163792384	https://twitter.com/dgwbirch/status/760744961163792384			
	New on Tomorrow's Transactions: Card fraud is really only a small part of all fraud, why worry about it? http://buff.ly/2aNgzOM	dgwbirch	2	1	1470209765	760741009793880064	https://twitter.com/dgwbirch/status/760741009793880064			
	Add a comment ...https://twitter.com/QiwiRussia/status/754967795092316160 …	dgwbirch	0	0	1470207895	760733166491594754	https://twitter.com/dgwbirch/status/760733166491594754			
	The official blockchain quatrain http://buff.ly/2apL6zW	dgwbirch	0	0	1470207546	760731704151707648	https://twitter.com/dgwbirch/status/760731704151707648			
	it was twitter rhetoric - I of course unplug the clock radio and use my phone like everyone else does	dgwbirch	1	0	1470204561	760719183755763712	https://twitter.com/dgwbirch/status/760719183755763712			
	hey thanks	dgwbirch	0	0	1470204533	760719065249878016	https://twitter.com/dgwbirch/status/760719065249878016			
bitcoin 	Help! I want my anonymous uncensorable electronic money back part 97: Bitfinex https://m.reddit.com/r/Bitcoin/comments/4vupa6/p2shinfo_shows_movement_out_of_multisig_wallets/d61oe33?utm_source=mweb_redirect&compact=true …	dgwbirch	2	1	1470203548	760714933608845312	https://twitter.com/dgwbirch/status/760714933608845312			
	доброе утро St. Petersburg	dgwbirch	2	0	1470202490	760710495309627393	https://twitter.com/dgwbirch/status/760710495309627393			
	@ Young_Austrian what is your email please. We had an issue with the mail merge in July and re-sending some manually. thank you.	wmougayar	0	0	1470239071	760863927215460352	https://twitter.com/wmougayar/status/760863927215460352			@
bitcoin 	Join me & @ JimROrlando @ OMERSVentures August 8th @ MaRSDD, Panel on VC in Blockhain sector-Canada Bitcoin Blockchainhttp://meetu.ps/2XxCkF	wmougayar	5	7	1470238781	760862713216204800	https://twitter.com/wmougayar/status/760862713216204800			@ @ @
	Blame Lee for emailing me late.pic.twitter.com/0HfLP7izOx	sytaylor	0	0	1470243253	760881467899740160	https://twitter.com/sytaylor/status/760881467899740160			
	i'm going to link to a simple concept that everyone thinks is stupid, but is actually remarkably effective.	sytaylor	0	0	1470242710	760879192619769858	https://twitter.com/sytaylor/status/760879192619769858			
	cc @ Chris_Skinner @triptananda @ CoinTelegraph @ AnthonyMacey @ bigmarh @ FilamentHQ @ delitzer @ dgwbirch @ obussmann	sytaylor	2	0	1470242586	760878673062981632	https://twitter.com/sytaylor/status/760878673062981632			@ @triptananda @ @ @ @ @ @ @
	presented without comment: http://www.newyorker.com/magazine/2007/12/10/the-checklist …	sytaylor	1	0	1470242252	760877270802259968	https://twitter.com/sytaylor/status/760877270802259968			
	banks evolved for a reason, people don't like looking after their own money, its a pain in the proverbial.	sytaylor	0	0	1470242183	760876980241850368	https://twitter.com/sytaylor/status/760876980241850368			
	vetoing cold storage is stupid, but it doesn't excuse lax security broadly.	sytaylor	0	0	1470242097	760876620274106368	https://twitter.com/sytaylor/status/760876620274106368			
	Towards a standard framework for Smart Contracts and # blockchain by @ ucl and Lee Braine of @ barclays http://arxiv.org/pdf/1608.00771v1.pdf … cc @ coindesk	sytaylor	12	11	1470242008	760876245701779456	https://twitter.com/sytaylor/status/760876245701779456		#	@ @ @
	"there should be a ""don't be an idiot"" checklist of security for exchanges voulentary kite mark."	sytaylor	1	0	1470230067	760826164919332865	https://twitter.com/sytaylor/status/760826164919332865			
	that's 50% if what Visa is. A set of standards. The other part is a network that accepts / uses that standard.	sytaylor	1	0	1470229968	760825748122992640	https://twitter.com/sytaylor/status/760825748122992640			
	standards and regulation are different. People think they want regulation when they need standards and a kite mark.	sytaylor	1	0	1470229932	760825597518045184	https://twitter.com/sytaylor/status/760825597518045184			
	@ dranejeremy the wrong regulation wouldn't fix the issue.	sytaylor	1	0	1470229660	760824457636216832	https://twitter.com/sytaylor/status/760824457636216832			@
