	Surviving and Prospering During and After the Economic Collapse # Investing http://ow.ly/IOCP3000UBN pic.twitter.com/0bkc5MYafa	DollarVigilante	5	0	1470253485	760924385863692292	https://twitter.com/DollarVigilante/status/760924385863692292		#	
	Join us here--> http://buff.ly/1TFC7sO # Anarchism # Voluntaryismpic.twitter.com/BTCuKpNOZW	DollarVigilante	10	4	1470252956	760922166338658304	https://twitter.com/DollarVigilante/status/760922166338658304		# #	
	“If You Want Trump To Win, You Should Root For Stock Market Crash Before November” http://snip.ly/40z2i # SHTF	DollarVigilante	5	2	1470250990	760913920727117824	https://twitter.com/DollarVigilante/status/760913920727117824		#	
	# TDV # Quotes Subscribe--> http://buff.ly/1TFC7sO pic.twitter.com/J6YtvpKxZa	DollarVigilante	7	3	1470246159	760893656853319680	https://twitter.com/DollarVigilante/status/760893656853319680		# #	
	Is Zika Outbreak Blowback From the Release of GM Mosquitoes? “Nature Finds A Way” http://snip.ly/u1raz # SHTF	DollarVigilante	3	1	1470245473	760890780709969921	https://twitter.com/DollarVigilante/status/760890780709969921		#	
bitcoin 	Subscribe to the Dollar Vigilante # Mining # Bitcoin # Investing http://ow.ly/IOCP3000UBN pic.twitter.com/9esT9rPHu5	DollarVigilante	5	0	1470242258	760877296995733505	https://twitter.com/DollarVigilante/status/760877296995733505		# # #	
bitcoin 	Global Elite Plans # Bilderberg Will Drive # Bitcoin Precious Metals Higher https://www.dollarvigilante.com/blog/2016/06/13/global-elite-jubilee-plans-bilderberg-will-drive-bitcoin-precious-metals-higher.html …pic.twitter.com/gnnbFIWGMN	DollarVigilante	11	8	1470241193	760872827402805248	https://twitter.com/DollarVigilante/status/760872827402805248		# #	
	The Financial Disease Spreading Globally No One Will Discuss: “The Real Risk Is Contagion” http://snip.ly/olg4v # SHTF	DollarVigilante	8	4	1470240925	760871704340070401	https://twitter.com/DollarVigilante/status/760871704340070401		#	
	Will Erdogan Resort to Regional Nuclear Blackmail? http://snip.ly/o1ymp # Activism	DollarVigilante	3	6	1470240857	760871420054437888	https://twitter.com/DollarVigilante/status/760871420054437888		#	
	PROOF Hillary Armed Jihadists in Syria Is in the WikiLeaks Hillary Emails Newly Released http://snip.ly/awcfe # Activism	DollarVigilante	10	15	1470240856	760871417009278976	https://twitter.com/DollarVigilante/status/760871417009278976		#	
	The Secrets Behind Clinton Cash: Clinton Foundation Fraud Whistle-blower Charles Ortel AND IRS Investigating http://ift.tt/2aRyvYr	DollarVigilante	8	4	1470240536	760870073531858944	https://twitter.com/DollarVigilante/status/760870073531858944			
	As Disenfranchisement Rises, Third Parties Start to Shine http://ift.tt/2aRwdJa	DollarVigilante	4	3	1470239334	760865031588311040	https://twitter.com/DollarVigilante/status/760865031588311040			
	BREAKING: DC Transit Authority Policeman Nicholas Young Charged With Aiding ISIS http://ift.tt/2aQ8Wqx	DollarVigilante	5	6	1470238167	760860137456295936	https://twitter.com/DollarVigilante/status/760860137456295936			
	Time to subscribe to TDV http://buff.ly/1TFC7sO # NWO # Dollar # Economicspic.twitter.com/m7nuockip7	DollarVigilante	2	3	1470237934	760859160393162752	https://twitter.com/DollarVigilante/status/760859160393162752		# # #	
	Chinese Drills Prepare for “Sudden, Cruel and Short” Electronic Warfare in Disputed Waters http://snip.ly/5g8b8 # SHTF	DollarVigilante	0	2	1470235160	760847524315922432	https://twitter.com/DollarVigilante/status/760847524315922432		#	
	Chinese Drills Prepare for “Sudden, Cruel and Short” Electronic Warfare in Disputed Waters http://snip.ly/9618r # Activism	DollarVigilante	0	3	1470235122	760847366907801601	https://twitter.com/DollarVigilante/status/760847366907801601		#	
	Learn how to make 100% or more gains in your portfolio today! # Investing http://ow.ly/IOCP3000UBN pic.twitter.com/A7haUTfnbX	DollarVigilante	7	0	1470231038	760830235101237249	https://twitter.com/DollarVigilante/status/760830235101237249		#	
	Pope Francis Calls For Worldwide Communist Government # Communism # Catholic https://www.dollarvigilante.com/blog/2016/05/12/pope-francis-calls-worldwide-communist-government.html …pic.twitter.com/WSDN8efWzm	DollarVigilante	6	1	1470230253	760826943679918080	https://twitter.com/DollarVigilante/status/760826943679918080		# #	
	# TDV # Quotes Subscribe--> http://buff.ly/1TFC7sO pic.twitter.com/8iw16iFqa0	DollarVigilante	18	4	1470229712	760824674163036161	https://twitter.com/DollarVigilante/status/760824674163036161		# #	
	# TDV # Quotes Subscribe--> http://buff.ly/1TFC7sO pic.twitter.com/mbl3doaSgz	DollarVigilante	6	0	1470221492	760790196300439552	https://twitter.com/DollarVigilante/status/760790196300439552		# #	
	Learn about protecting your assets at The Dollar Vigilante # Dollar # Gold http://ow.ly/IOCP3000UBN pic.twitter.com/tTAQQRIJ7j	DollarVigilante	7	0	1470219813	760783154449907712	https://twitter.com/DollarVigilante/status/760783154449907712		# #	
	Central Banks are Printing to Avert a Global Meltdown # Banking # Gold https://www.dollarvigilante.com/blog/2016/04/13/central-banks-printing-avert-global-meltdown-gold-miners-start-melt.html …pic.twitter.com/62MIRjlcMh	DollarVigilante	9	7	1470219452	760781642772471809	https://twitter.com/DollarVigilante/status/760781642772471809		# #	
	Philadelphia Is Run By Freemasonshttp://ift.tt/2aMQJJm	DollarVigilante	2	0	1470214328	760760150974164992	https://twitter.com/DollarVigilante/status/760760150974164992			
	VIDEO: Now # Obama Warns Americans to 'Be Prepared' What Does He Know? https://www.dollarvigilante.com/blog/2016/06/08/video-now-obama-warns-americans-prepared-disaster-know.html …pic.twitter.com/sqRZDqtRfG	DollarVigilante	10	3	1470213271	760755714134532096	https://twitter.com/DollarVigilante/status/760755714134532096		#	
	Doug Casey- Hop on a Train or Die Full of Regrets. # Education # Anarchism https://www.dollarvigilante.com/blog/2016/03/17/anarchast-doug-casey-quit-school-and-hop-on-a-train-or-die-full-of-regrets-and-reincarnate-as-a-cockroach.html …pic.twitter.com/2vNMxkVBEA	DollarVigilante	3	1	1470208650	760736335850266626	https://twitter.com/DollarVigilante/status/760736335850266626		# #	
	Learn how to make 100% or more gains in your portfolio today! # Investing http://ow.ly/IOCP3000UBN pic.twitter.com/vUgueVQUsj	DollarVigilante	8	0	1470208592	760736091595046912	https://twitter.com/DollarVigilante/status/760736091595046912		#	
	Are you tired of giving up your # freedom @ officialmcafee Subscribe here--> http://buff.ly/1TFC7sO pic.twitter.com/GCf2W3RMO3	DollarVigilante	11	3	1470205050	760721232585224193	https://twitter.com/DollarVigilante/status/760721232585224193		#	@
	Survive the Disasters of 2016 the New TDV Survival Based Video Library https://www.dollarvigilante.com/blog/2016/04/11/survive-the-disasters-of-2016-with-our-new-tdv-survival-based-video-library.html …pic.twitter.com/rCnJnGq9ll	DollarVigilante	8	1	1470197849	760691032094830592	https://twitter.com/DollarVigilante/status/760691032094830592			
	Learn about protecting your assets at The Dollar Vigilante # Dollar # Gold http://ow.ly/IOCP3000UBN pic.twitter.com/n5BRxiQpdt	DollarVigilante	9	0	1470197411	760689195518160896	https://twitter.com/DollarVigilante/status/760689195518160896		# #	
	SOMEBODY Wants Chaos # Economy # Conspiracy # SHTF Subscribe--> http://buff.ly/1TFC7sO pic.twitter.com/PxD9XzdEra	DollarVigilante	8	6	1470197279	760688640842498049	https://twitter.com/DollarVigilante/status/760688640842498049		# # #	
	# Equality # Socialism # BernieSanders # Trump # HillaryClinton Subscribe here--> http://buff.ly/1TFC7sO pic.twitter.com/u4I3DmHhar	DollarVigilante	3	0	1470192639	760669180412751872	https://twitter.com/DollarVigilante/status/760669180412751872		# # # # #	
	The Stock Market Has Predicted The Outcome Of Presidential Elections With 86 Percent Accuracyhttp://ift.tt/2aMc85E	DollarVigilante	10	1	1470191982	760666423656079361	https://twitter.com/DollarVigilante/status/760666423656079361			
bitcoin 	Subscribe to the Dollar Vigilante # Mining # Bitcoin # Investing http://ow.ly/IOCP3000UBN pic.twitter.com/kOcXURAl0p	DollarVigilante	5	0	1470189521	760656102346395648	https://twitter.com/DollarVigilante/status/760656102346395648		# # #	
	Donald Trump Warns Americans To Get Out Of The Stock Market As The Dow Falls For A 7th Day In A Row http://snip.ly/etmbz # Economy	DollarVigilante	8	3	1470187442	760647382463836160	https://twitter.com/DollarVigilante/status/760647382463836160		#	
	The # Brexit Psyop: Greenspan Blames the Brits for the Crash. https://www.dollarvigilante.com/blog/2016/06/27/brexit-psyop-greenspan-falsely-blames-brits-crash-chaos-follow.html …pic.twitter.com/TWgsNfrB99	DollarVigilante	9	4	1470187061	760645782517211136	https://twitter.com/DollarVigilante/status/760645782517211136		#	
	# HillaryClinton # Trump Time to subscribe to TDV http://buff.ly/1TFC7sO pic.twitter.com/BIJukmQ3UK	DollarVigilante	7	4	1470184420	760634704836059136	https://twitter.com/DollarVigilante/status/760634704836059136		# #	
	The Reckoning: “A Banking Crisis Is About To Sweep The Globe” http://snip.ly/s414t # SHTF	DollarVigilante	1	1	1470184310	760634244792188929	https://twitter.com/DollarVigilante/status/760634244792188929		#	
	The Attack on the Second Amendment is not Finished http://snip.ly/mvn0g # SHTF	DollarVigilante	3	1	1470178807	760611161888915456	https://twitter.com/DollarVigilante/status/760611161888915456		#	
bitcoin 	Subscribe and learn! # Investing # Gold # Bitcoin # Mining # Shemitah http://ow.ly/IOCP3000UBN pic.twitter.com/940Yq1xEpK	DollarVigilante	2	0	1470178302	760609044050636800	https://twitter.com/DollarVigilante/status/760609044050636800		# # # # #	
	BREAKING: DNC Collapsing Amid Resignations In WikiLeaks Aftermath http://ift.tt/2aGT6fk	DollarVigilante	8	6	1470176408	760601100080873473	https://twitter.com/DollarVigilante/status/760601100080873473			
	The Coming Collapse will be Talked About for Centuries. # Economy # War https://www.dollarvigilante.com/blog/2016/04/10/the-coming-collapse-will-be-talked-about-for-centuries-if-we-are-even-still-here-to-talk-about-it.html …pic.twitter.com/kKuiPCsQFt	DollarVigilante	12	5	1470176260	760600479437119488	https://twitter.com/DollarVigilante/status/760600479437119488		# #	
	Surviving and Prospering during and after the dollar collapse http://buff.ly/1TFC7sO # Investingpic.twitter.com/uCa2IwdXuS	DollarVigilante	6	2	1470176202	760600238738505728	https://twitter.com/DollarVigilante/status/760600238738505728		#	
	If of interest: email that DraftKings just sent all users in state of NYpic.twitter.com/2A1YLSLuyT	readDanwrite	7	10	1470260796	760955048616747009	https://twitter.com/readDanwrite/status/760955048616747009			
	"FanDuel celebratory statement on news of Cuomo signing NY # DFS bill begins with ""hallelujah!""pic.twitter.com/G1U5NhpCWT"	readDanwrite	7	3	1470260742	760954824993153024	https://twitter.com/readDanwrite/status/760954824993153024		#	
	As Nike exits the golf-club business, relevant story on why Adidas is doing the same thing: http://yhoo.it/1SUjvpY @ YahooFinance	readDanwrite	7	17	1470260192	760952514976047105	https://twitter.com/readDanwrite/status/760952514976047105			@
	A relentless day of major sports business news. golly	readDanwrite	2	0	1470260011	760951759699402752	https://twitter.com/readDanwrite/status/760951759699402752			
	NY AG Schneiderman still pursuing false advertising & consumer fraud against DraftKings and FanDuel. (with joy) # DFSpic.twitter.com/zGDShgLtjh	readDanwrite	0	3	1470259968	760951577826000898	https://twitter.com/readDanwrite/status/760951577826000898		#	
	"How Nike is framing this news: ""focusing its golf innovation on footwear and apparel"" hehehehe https://finance.yahoo.com/news/nike-focuses-golf-innovation-footwear-210000141.html …"	readDanwrite	0	0	1470259896	760951276762980352	https://twitter.com/readDanwrite/status/760951276762980352			
	Nike ENDS golf equipment business. following Adidas, which is looking to sell off club maker TaylorMade.	readDanwrite	0	0	1470259860	760951125969342464	https://twitter.com/readDanwrite/status/760951125969342464			
	NFL Network added to Sling. the further disintegration of traditional cable. this is good. soon, stream everything. burn the cable bill.	readDanwrite	8	3	1470259457	760949436063375361	https://twitter.com/readDanwrite/status/760949436063375361			
	"Everyone touting NY # DFS bill as ""the end of all the trouble."" no. NY rly rly big! but there are still other problem states. Delaware, e.g."	readDanwrite	1	0	1470259013	760947573142290432	https://twitter.com/readDanwrite/status/760947573142290432		#	
	I am hearing that DraftKings and FanDuel expect to obtain their New York temp permits in days, not weeks. up & running in NY in August. # DFS	readDanwrite	24	20	1470258549	760945623625527296	https://twitter.com/readDanwrite/status/760945623625527296		#	
	I believe days, not weeks. I am getting the answer right now	readDanwrite	1	0	1470258372	760944881833545732	https://twitter.com/readDanwrite/status/760944881833545732			
	DraftKings is happy about Cuomo signing NY # DFS bill. (surprise!) official company statement:pic.twitter.com/Cc9rYLuFvw	readDanwrite	1	0	1470258348	760944780897558529	https://twitter.com/readDanwrite/status/760944780897558529		#	
	As is the tradition on the # DFS beat, big big news comes out at 5pm when you thought your day was winding down. @ DavidPurdum @ DustinGouker	readDanwrite	2	0	1470258248	760944364742963201	https://twitter.com/readDanwrite/status/760944364742963201		#	@ @
	Gov Cuomo has signed the New York # DFS bill into law. DraftKings and FanDuel will turn back on in NY as soon as they get temporary permits.	readDanwrite	5	15	1470258216	760944230424535040	https://twitter.com/readDanwrite/status/760944230424535040		#	
	"Rule 40 at # Rio is ""a small door that has opened a crack, but you can still get your foot in there—maybe even more""http://yhoo.it/2aJkAAM"	readDanwrite	2	2	1470257254	760940194698760193	https://twitter.com/readDanwrite/status/760940194698760193		#	
	Everything you need to know about # rule40, the biggest business plotline unfolding at # Rio2016 http://yhoo.it/2aJkAAM @ YahooFinance	readDanwrite	7	10	1470255244	760931761492746240	https://twitter.com/readDanwrite/status/760931761492746240		# #	@
	You've made a mistake on your list of Worst Places in NYC, @ mh0ffman. Penn Sta is No. 1, nothing comes close.https://medium.com/slackjaw/a-list-of-the-legit-worst-places-in-new-york-city-e67902876bdc#.i64mxb459 …	readDanwrite	2	0	1470252512	760920305430892544	https://twitter.com/readDanwrite/status/760920305430892544		#	@
	How $ FB is jumping on the Olympics: http://buff.ly/2apvuL0  How Instagram (so, also $ FB) is: http://buff.ly/2aAO823 @ YahooFinance	readDanwrite	0	1	1470250940	760913711183826944	https://twitter.com/readDanwrite/status/760913711183826944			@
	absolutely. results will be obv skewed.	readDanwrite	1	0	1470250279	760910938862133248	https://twitter.com/readDanwrite/status/760910938862133248			
	I sorta like 'em! no one remembers/cares anymore than Meerkat came before Periscope.	readDanwrite	1	0	1470250031	760909896627916800	https://twitter.com/readDanwrite/status/760909896627916800			
	Which social network will you use the most during the Olympics?	readDanwrite	8	9	1470249889	760909303695958016	https://twitter.com/readDanwrite/status/760909303695958016			
	Very eager to see Indignation. yes, adaptations of Roth books have been mostly bad (Human Stain, The Humbling) but Elegy was dead-on.	readDanwrite	0	0	1470248844	760904920568561664	https://twitter.com/readDanwrite/status/760904920568561664			
	"Twitter is the ""exclusive social media platform for the USA House"" at the Olympics, @ twitter just announced."	readDanwrite	2	1	1470247797	760900528343842821	https://twitter.com/readDanwrite/status/760900528343842821			@
	I see many many friends using # InstagramStories. and many more views than on Snapchat. I bet Insta Stories will be a hit, like it or not.	readDanwrite	2	0	1470243143	760881009969754112	https://twitter.com/readDanwrite/status/760881009969754112		#	
	time for the @ YahooFinance midday live show. join us http://yhoo.it/2aTrMKD @ serwerpic.twitter.com/2IHFCnZKgE	readDanwrite	3	1	1470239951	760867618140094465	https://twitter.com/readDanwrite/status/760867618140094465			@ @
	"This is the ""greeting"" $ FB is serving up during the Olympics. @ minyoungpark wrote about this http://buff.ly/2apvuL0 pic.twitter.com/E9jo8ntsgv"	readDanwrite	1	2	1470239802	760866996783316992	https://twitter.com/readDanwrite/status/760866996783316992			@
	"Has anyone seen a legal argument that USOC can really go after companies for use of ""gold"" or ""Rio?"" mega overreach."	readDanwrite	0	0	1470239517	760865799024340992	https://twitter.com/readDanwrite/status/760865799024340992			
bitcoin 	$ btc price might have already hit its bottom (at least in this particular fall). climbing back a little. # bitcoinpic.twitter.com/PgtSmWCaXB	readDanwrite	0	0	1470239006	760863658129944576	https://twitter.com/readDanwrite/status/760863658129944576		#	
	so much news in tech today! $ TWTR talk; # BitfinexHack; Walmart and @ Jet.	readDanwrite	1	0	1470238086	760859799508492288	https://twitter.com/readDanwrite/status/760859799508492288		#	@
	Every day, there is news! crazy how that works. thrilling. there's never a day with no news.	readDanwrite	2	0	1470237737	760858333649612800	https://twitter.com/readDanwrite/status/760858333649612800			
	rumors of Steve Ballmer + Prince Al-Waleed $ TWTR takeover @ Street_Insiderpic.twitter.com/2W6QGZvi0K	readDanwrite	20	14	1470237482	760857263733026816	https://twitter.com/readDanwrite/status/760857263733026816			@
	Everyone hating on # InstagramStories will get over it, get used to it, and unfortch for Snapchat, maybe even shift to Insta. but maybe not!	readDanwrite	1	0	1470237169	760855950374821888	https://twitter.com/readDanwrite/status/760855950374821888		#	
	"Everyone ran ""Instagram copied Snapchat!"" headlines. well, yes. they did. Systrom admitted. that doesn't mean Insta can't do it better..."	readDanwrite	4	0	1470237110	760855704399781888	https://twitter.com/readDanwrite/status/760855704399781888			
	Look at that # btc price drop. precipitous. via @ LawnmowerIOpic.twitter.com/OGNOjOyBkp	readDanwrite	3	1	1470235810	760850253033734144	https://twitter.com/readDanwrite/status/760850253033734144		#	@
bitcoin 	Hey # bitcoin folks: is this true? Bitfinex was using cold storage but stopped when it switched to BitGo security?https://www.reddit.com/r/Bitcoin/comments/4vvdli/obviously_bitfinex_is_the_one_to_blame_here_but/ …	readDanwrite	1	0	1470235225	760847797167886336	https://twitter.com/readDanwrite/status/760847797167886336		#	
bitcoin 	As you read about the # BitfinexHack, this chart page, with live movement of the biggest exchanges, is clutch: http://bitcoincharts.com/markets/currency/USD.html …	readDanwrite	0	1	1470234738	760845756878036992	https://twitter.com/readDanwrite/status/760845756878036992		#	
bitcoin 	You've gotta think the # BitfinexHack could stoke volume on other exchanges like btc-e and Bitstamp... if customers look elsewhere. # bitcoin	readDanwrite	0	0	1470234707	760845624040239105	https://twitter.com/readDanwrite/status/760845624040239105		# #	
	Every single person in line for this show in Prospect Park is attractive	readDanwrite	2	0	1470178787	760611079135395840	https://twitter.com/readDanwrite/status/760611079135395840			
	"seriously h8 this new ""PageFlip"" feature on Kindle. any idea how to turn it off? @ thDigitalReader? @ RonCharles?"	readDanwrite	0	0	1470176159	760600056441479168	https://twitter.com/readDanwrite/status/760600056441479168			@ @
	A Brave New # Cashless World # fintech # payments @ LetsTalkPaymnts http://ow.ly/nY9h302StIr pic.twitter.com/XbSYvBNJeW	sbmeunier	10	17	1470258318	760944656549019648	https://twitter.com/sbmeunier/status/760944656549019648		# # #	@
bitcoin 	Exchange @ bitfinex Offline as $60M of # Bitcoin Stolen # hack # cybersecurityhttp://www.coindesk.com/bitfinex-shuts-down-customer-bitcoin-stolen/ …	sbmeunier	1	0	1470254467	760928504137605120	https://twitter.com/sbmeunier/status/760928504137605120		# # #	@
	And now the second bank of the USA pic.twitter.com/RVPb4a7Hi0	sbmeunier	1	0	1470251804	760917336530509824	https://twitter.com/sbmeunier/status/760917336530509824			
	In Philadelphia right now, visiting the # first # bank of the USA! pic.twitter.com/5QW5sODcuD	sbmeunier	8	0	1470251652	760916695993155584	https://twitter.com/sbmeunier/status/760916695993155584		# #	
	# SmartContracts, From High Up On The Hill # fintech # blockchain @ pymnts @ PerianneDChttp://www.pymnts.com/news/b2b-payments/2016/smart-contracts-alliance-chamber-of-digital-commerce/ …	sbmeunier	6	13	1470250872	760913426071818240	https://twitter.com/sbmeunier/status/760913426071818240		# # #	@ @
	Why ASX's new CEO Dominic Stevens needs to crank up # blockchain # fintech @ FinancialReviewhttp://ow.ly/Gm27302Sucn	sbmeunier	2	5	1470247515	760899346955177985	https://twitter.com/sbmeunier/status/760899346955177985		# #	@
bitcoin 	Bitcoin # SmartContract ‘Federation’ to Launch With 25 Startups # fintech # blockchain @ RSKsmarthttp://www.coindesk.com/25-bitcoin-companies-are-trying-to-organize-into-a-smart-contract-federation/ …	sbmeunier	5	10	1470244219	760885519777660928	https://twitter.com/sbmeunier/status/760885519777660928		# # #	@
	Here's Why # ChatBots Are So Important To Your Business # fintech http://www.forbes.com/sites/vivianrosenthal/2016/08/02/heres-why-chat-bots-are-important-to-your-business/#46ca35d025e4 …pic.twitter.com/MSe78HrSHb	sbmeunier	10	6	1470240925	760871703459299328	https://twitter.com/sbmeunier/status/760871703459299328		# # #46ca35d025e4	
bitcoin 	Swiss Parliament announced the deregulation of # blockchain startups # fintech # regulation via @ obussmannhttp://www.livebitcoinnews.com/zurich-emerging-fintech-and-blockchain-hub-for-startups/?utm_content=buffer6e910&utm_medium=social&utm_source=twitter.com&utm_campaign=buffer …	sbmeunier	16	20	1470237614	760857816332722176	https://twitter.com/sbmeunier/status/760857816332722176		# # #	@
	Cisco: A Roadmap to # Digital Value in Retail Banking # fintech http://ow.ly/Ja4l302StCX pic.twitter.com/DltyCNDfeD	sbmeunier	2	6	1470234310	760843961946759169	https://twitter.com/sbmeunier/status/760843961946759169		# #	
	When do you need # blockchain? Decision models. # fintech @ dgwbirch @ antony_btc http://ow.ly/54aV302Syei pic.twitter.com/WSNQptX6jA	sbmeunier	12	17	1470231024	760830176871735296	https://twitter.com/sbmeunier/status/760830176871735296		# #	@ @
bitcoin 	. @ elliptic and @ LexisNexisRisk bring bank-grade # AML to # Bitcoin # fintechhttps://www.finextra.com/newsarticle/29253/elliptic-and-lexisnexis-bring-bank-grade-aml-to-bitcoin …	sbmeunier	5	7	1470227415	760815038936547329	https://twitter.com/sbmeunier/status/760815038936547329		# # #	@ @
	# Fintech isn’t disrupting Africa’s financial industry—it’s building it! # payments # mobile http://qz.com/749008/african-fintech-isnt-disrupting-the-financial-industry-its-building-it/ …	sbmeunier	10	8	1470224484	760802747994271744	https://twitter.com/sbmeunier/status/760802747994271744		# # #	
	MasterCard and Visa Join @ clearxchange # Realtime # Payments Network # fintechhttp://bankinnovation.net/2016/08/mastercard-and-visa-join-clearxchange-realtime-payments-network/ …	sbmeunier	5	8	1470175543	760597475229073411	https://twitter.com/sbmeunier/status/760597475229073411		# # #	@
bitcoin 	for everyone who is feeling pessimistic about # bitcoin - don't. this is a learning opportunity, and there is so much good work coming out.	Melt_Dem	18	6	1470241651	760874749937541121	https://twitter.com/Melt_Dem/status/760874749937541121		#	
	https://twitter.com/aantonop/status/760849808378597377 …	Melt_Dem	3	2	1470235839	760850371065569280	https://twitter.com/Melt_Dem/status/760850371065569280			
	@ reypoullard @ jedigras @ Creveroeland @ bitfinexpic.twitter.com/8kOBoUAiZC	Melt_Dem	4	0	1470234237	760843654839795712	https://twitter.com/Melt_Dem/status/760843654839795712			@ @ @ @
bitcoin 	good read @ Itsjoeco - this is what regulation can do. good thing tech > sovereignty.http://www.zerohedge.com/news/2016-08-03/here-comes-mandatory-bitcoin-database …	Melt_Dem	3	4	1470234085	760843016148058112	https://twitter.com/Melt_Dem/status/760843016148058112			@
bitcoin 	patience. # bitcoin is SO young, made useable by testing, building solutions	Melt_Dem	5	0	1470233749	760841607512002560	https://twitter.com/Melt_Dem/status/760841607512002560		#	
	lol remember that time we bailed out the US financial system? TARP isn't free.	Melt_Dem	3	0	1470233615	760841046611853312	https://twitter.com/Melt_Dem/status/760841046611853312			
	the only reason fiat bank hacks are made whole is SEIGNORAGE and SOVEREIGN DEBT	Melt_Dem	3	0	1470233582	760840905758765056	https://twitter.com/Melt_Dem/status/760840905758765056			
bitcoin 	your agenda is... interesting. what attracts you to # bitcoin? censorship resistance? immutability? this is concerning to me	Melt_Dem	0	0	1470233510	760840606537113601	https://twitter.com/Melt_Dem/status/760840606537113601		#	
bitcoin 	again - we all take responsibility for helping # bitcoin grow. let's find a prudent path forward.	Melt_Dem	2	0	1470233232	760839439190990852	https://twitter.com/Melt_Dem/status/760839439190990852		#	
bitcoin 	also it's our JOB as a community supporting # bitcoin development to find ways to avoid over-regulating!!	Melt_Dem	0	0	1470233147	760839080146010113	https://twitter.com/Melt_Dem/status/760839080146010113		#	
